,author,created_utc,title,url,created,d_,created_utc_dt
0,RevolutionaryLog8819,1611860381,"I own Dynavax at $6.04 a share, is it time to sell or hold?",https://www.reddit.com/r/wallstreetbets/comments/l75bdw/i_own_dynavax_at_604_a_share_is_it_time_to_sell/,1611860381.0,"{'author': 'RevolutionaryLog8819', 'created_utc': 1611860381, 'title': 'I own Dynavax at $6.04 a share, is it time to sell or hold?', 'url': 'https://www.reddit.com/r/wallstreetbets/comments/l75bdw/i_own_dynavax_at_604_a_share_is_it_time_to_sell/', 'created': 1611860381.0}",2021-01-28 18:59:41
1,firebird84,1611860381,UNITY AT LAST,https://i.redd.it/m1dcvdowe4e61.jpg,1611860381.0,"{'author': 'firebird84', 'created_utc': 1611860381, 'title': 'UNITY AT LAST', 'url': 'https://i.redd.it/m1dcvdowe4e61.jpg', 'created': 1611860381.0}",2021-01-28 18:59:41
2,[deleted],1611860381,WHAT IS HAPPENING!???! PLEASE INFORM ME,https://www.reddit.com/r/wallstreetbets/comments/l75bdm/what_is_happening_please_inform_me/,1611860381.0,"{'author': '[deleted]', 'created_utc': 1611860381, 'title': 'WHAT IS HAPPENING!???! PLEASE INFORM ME', 'url': 'https://www.reddit.com/r/wallstreetbets/comments/l75bdm/what_is_happening_please_inform_me/', 'created': 1611860381.0}",2021-01-28 18:59:41
3,AudioFenix,1611860381,"I can search and view $GME on RH again, but they have a little note.",https://i.redd.it/ivwhjr3ye4e61.jpg,1611860381.0,"{'author': 'AudioFenix', 'created_utc': 1611860381, 'title': 'I can search and view $GME on RH again, but they have a little note.', 'url': 'https://i.redd.it/ivwhjr3ye4e61.jpg', 'created': 1611860381.0}",2021-01-28 18:59:41
4,zafferous,1611860380,"Hedge Funds Doubled Down on Shorts ~~~ More Stonks!!!!! ~~~ 290% of Gamestop shares are now floated, and they have to buy them all back.",https://i.redd.it/mrsbyl4te4e61.png,1611860380.0,"{'author': 'zafferous', 'created_utc': 1611860380, 'title': 'Hedge Funds Doubled Down on Shorts ~~~ More Stonks!!!!! ~~~ 290% of Gamestop shares are now floated, and they have to buy them all back.', 'url': 'https://i.redd.it/mrsbyl4te4e61.png', 'created': 1611860380.0}",2021-01-28 18:59:40
5,XrpDotBit,1611860380,Close Robinhood accounts!,https://www.reddit.com/r/wallstreetbets/comments/l75bd5/close_robinhood_accounts/,1611860380.0,"{'author': 'XrpDotBit', 'created_utc': 1611860380, 'title': 'Close Robinhood accounts!', 'url': 'https://www.reddit.com/r/wallstreetbets/comments/l75bd5/close_robinhood_accounts/', 'created': 1611860380.0}",2021-01-28 18:59:40
6,Don_Gainz_Johnson,1611860379,SEC COMPLAINT FORM - TAKE THEM DOWN!!!!,https://www.reddit.com/r/wallstreetbets/comments/l75bcc/sec_complaint_form_take_them_down/,1611860379.0,"{'author': 'Don_Gainz_Johnson', 'created_utc': 1611860379, 'title': 'SEC COMPLAINT FORM - TAKE THEM DOWN!!!!', 'url': 'https://www.reddit.com/r/wallstreetbets/comments/l75bcc/sec_complaint_form_take_them_down/', 'created': 1611860379.0}",2021-01-28 18:59:39
7,joscclark14,1611860378,What’s the move from here?,https://www.reddit.com/r/wallstreetbets/comments/l75bc6/whats_the_move_from_here/,1611860378.0,"{'author': 'joscclark14', 'created_utc': 1611860378, 'title': 'What’s the move from here?', 'url': 'https://www.reddit.com/r/wallstreetbets/comments/l75bc6/whats_the_move_from_here/', 'created': 1611860378.0}",2021-01-28 18:59:38
8,ReleaseBeneficial549,1611860378,Are you fucking kidding me??!!!!,https://www.reddit.com/r/wallstreetbets/comments/l75bbw/are_you_fucking_kidding_me/,1611860378.0,"{'author': 'ReleaseBeneficial549', 'created_utc': 1611860378, 'title': 'Are you fucking kidding me??!!!!', 'url': 'https://www.reddit.com/r/wallstreetbets/comments/l75bbw/are_you_fucking_kidding_me/', 'created': 1611860378.0}",2021-01-28 18:59:38
9,[deleted],1611860378,This morning may have been scary but adventure and glory waits for us in the moon!🚀🚀,https://v.redd.it/ljpdt7wte4e61,1611860378.0,"{'author': '[deleted]', 'created_utc': 1611860378, 'title': 'This morning may have been scary but adventure and glory waits for us in the moon!🚀🚀', 'url': 'https://v.redd.it/ljpdt7wte4e61', 'created': 1611860378.0}",2021-01-28 18:59:38
10,Yellomelw,1611860377,Yacht party,https://www.reddit.com/r/wallstreetbets/comments/l75bbc/yacht_party/,1611860377.0,"{'author': 'Yellomelw', 'created_utc': 1611860377, 'title': 'Yacht party', 'url': 'https://www.reddit.com/r/wallstreetbets/comments/l75bbc/yacht_party/', 'created': 1611860377.0}",2021-01-28 18:59:37
11,Key-Brilliant-105,1611860376,$dogecoin,https://www.reddit.com/r/wallstreetbets/comments/l75bb0/dogecoin/,1611860376.0,"{'author': 'Key-Brilliant-105', 'created_utc': 1611860376, 'title': '$dogecoin', 'url': 'https://www.reddit.com/r/wallstreetbets/comments/l75bb0/dogecoin/', 'created': 1611860376.0}",2021-01-28 18:59:36
12,PAPA_Emc2,1611860376,"I like GME, but help",https://www.reddit.com/r/wallstreetbets/comments/l75baw/i_like_gme_but_help/,1611860376.0,"{'author': 'PAPA_Emc2', 'created_utc': 1611860376, 'title': 'I like GME, but help', 'url': 'https://www.reddit.com/r/wallstreetbets/comments/l75baw/i_like_gme_but_help/', 'created': 1611860376.0}",2021-01-28 18:59:36
13,Greedy_Valuable,1611860375,The comeback will be real from now on🪐🪐🪐🪐🪐,https://www.reddit.com/r/wallstreetbets/comments/l75ba4/the_comeback_will_be_real_from_now_on/,1611860375.0,"{'author': 'Greedy_Valuable', 'created_utc': 1611860375, 'title': 'The comeback will be real from now on\U0001fa90\U0001fa90\U0001fa90\U0001fa90\U0001fa90', 'url': 'https://www.reddit.com/r/wallstreetbets/comments/l75ba4/the_comeback_will_be_real_from_now_on/', 'created': 1611860375.0}",2021-01-28 18:59:35
14,DimpleFaceKillah,1611860375,GTE,https://www.reddit.com/r/wallstreetbets/comments/l75b9w/gte/,1611860375.0,"{'author': 'DimpleFaceKillah', 'created_utc': 1611860375, 'title': 'GTE', 'url': 'https://www.reddit.com/r/wallstreetbets/comments/l75b9w/gte/', 'created': 1611860375.0}",2021-01-28 18:59:35
15,[deleted],1611860374,idea: questrade and robinhood teamed up to stop GME stock from selling.,https://www.reddit.com/r/wallstreetbets/comments/l75b9t/idea_questrade_and_robinhood_teamed_up_to_stop/,1611860374.0,"{'author': '[deleted]', 'created_utc': 1611860374, 'title': 'idea: questrade and robinhood teamed up to stop GME stock from selling.', 'url': 'https://www.reddit.com/r/wallstreetbets/comments/l75b9t/idea_questrade_and_robinhood_teamed_up_to_stop/', 'created': 1611860374.0}",2021-01-28 18:59:34
16,[deleted],1611860374,How to Deduct Stock Losses From Your Tax Bill,https://www.reddit.com/r/wallstreetbets/comments/l75b9p/how_to_deduct_stock_losses_from_your_tax_bill/,1611860374.0,"{'author': '[deleted]', 'created_utc': 1611860374, 'title': 'How to Deduct Stock Losses From Your Tax Bill', 'url': 'https://www.reddit.com/r/wallstreetbets/comments/l75b9p/how_to_deduct_stock_losses_from_your_tax_bill/', 'created': 1611860374.0}",2021-01-28 18:59:34
17,thebrickboy,1611860374,Should I invest in doge-usd?,https://www.reddit.com/r/wallstreetbets/comments/l75b9d/should_i_invest_in_dogeusd/,1611860374.0,"{'author': 'thebrickboy', 'created_utc': 1611860374, 'title': 'Should I invest in doge-usd?', 'url': 'https://www.reddit.com/r/wallstreetbets/comments/l75b9d/should_i_invest_in_dogeusd/', 'created': 1611860374.0}",2021-01-28 18:59:34
18,junoandtheechodog,1611860373,"Wall Street Bets bringing the World (not Melvin, Shitron, and robinhood) together. --------",https://v.redd.it/dmrf5ynpe4e61,1611860373.0,"{'author': 'junoandtheechodog', 'created_utc': 1611860373, 'title': 'Wall Street Bets bringing the World (not Melvin, Shitron, and robinhood) together. --------', 'url': 'https://v.redd.it/dmrf5ynpe4e61', 'created': 1611860373.0}",2021-01-28 18:59:33
19,reek156,1611860373,"You want a revolution, Redditors? What's your plan when GameStop collapses?",https://www.usatoday.com/story/money/markets/2021/01/28/gamestop-stock-reddit-traders-could-suffer-huge-losses-using-options/4294899001/,1611860373.0,"{'author': 'reek156', 'created_utc': 1611860373, 'title': ""You want a revolution, Redditors? What's your plan when GameStop collapses?"", 'url': 'https://www.usatoday.com/story/money/markets/2021/01/28/gamestop-stock-reddit-traders-could-suffer-huge-losses-using-options/4294899001/', 'created': 1611860373.0}",2021-01-28 18:59:33
20,FiveOclockSumewhere,1611860372,Restricted,https://www.reddit.com/r/wallstreetbets/comments/l75b8g/restricted/,1611860372.0,"{'author': 'FiveOclockSumewhere', 'created_utc': 1611860372, 'title': 'Restricted', 'url': 'https://www.reddit.com/r/wallstreetbets/comments/l75b8g/restricted/', 'created': 1611860372.0}",2021-01-28 18:59:32
21,Stocks_N_Shocks,1611860372,DONT BAIL ON AMC AND NOK! ONE GME INVESTOR CASHED IN FOR A BILLION MAY BE TIME TO MOVE ON. AMC EASILY COULD BE THE NEXT GME.,https://www.reddit.com/r/wallstreetbets/comments/l75b8a/dont_bail_on_amc_and_nok_one_gme_investor_cashed/,1611860372.0,"{'author': 'Stocks_N_Shocks', 'created_utc': 1611860372, 'title': 'DONT BAIL ON AMC AND NOK! ONE GME INVESTOR CASHED IN FOR A BILLION MAY BE TIME TO MOVE ON. AMC EASILY COULD BE THE NEXT GME.', 'url': 'https://www.reddit.com/r/wallstreetbets/comments/l75b8a/dont_bail_on_amc_and_nok_one_gme_investor_cashed/', 'created': 1611860372.0}",2021-01-28 18:59:32
22,Berkeley3y,1611860372,Merrill Edge,https://www.reddit.com/r/wallstreetbets/comments/l75b85/merrill_edge/,1611860372.0,"{'author': 'Berkeley3y', 'created_utc': 1611860372, 'title': 'Merrill Edge', 'url': 'https://www.reddit.com/r/wallstreetbets/comments/l75b85/merrill_edge/', 'created': 1611860372.0}",2021-01-28 18:59:32
23,nwprivateye,1611860372,Don’t forget to go on the App Store and give Robinhood a 1 star rating tonight.,https://www.reddit.com/r/wallstreetbets/comments/l75b82/dont_forget_to_go_on_the_app_store_and_give/,1611860372.0,"{'author': 'nwprivateye', 'created_utc': 1611860372, 'title': 'Don’t forget to go on the App Store and give Robinhood a 1 star rating tonight.', 'url': 'https://www.reddit.com/r/wallstreetbets/comments/l75b82/dont_forget_to_go_on_the_app_store_and_give/', 'created': 1611860372.0}",2021-01-28 18:59:32
24,Hype_cart00ns,1611860372,Creating a new platform.,https://www.reddit.com/r/wallstreetbets/comments/l75b80/creating_a_new_platform/,1611860372.0,"{'author': 'Hype_cart00ns', 'created_utc': 1611860372, 'title': 'Creating a new platform.', 'url': 'https://www.reddit.com/r/wallstreetbets/comments/l75b80/creating_a_new_platform/', 'created': 1611860372.0}",2021-01-28 18:59:32
25,LucarioN64,1611860371,Why not dodge coin cheap and they can’t shut it down like they did with AMC and others ?,https://www.reddit.com/r/wallstreetbets/comments/l75b7y/why_not_dodge_coin_cheap_and_they_cant_shut_it/,1611860371.0,"{'author': 'LucarioN64', 'created_utc': 1611860371, 'title': 'Why not dodge coin cheap and they can’t shut it down like they did with AMC and others ?', 'url': 'https://www.reddit.com/r/wallstreetbets/comments/l75b7y/why_not_dodge_coin_cheap_and_they_cant_shut_it/', 'created': 1611860371.0}",2021-01-28 18:59:31
26,StreetTripleRider,1611860371,Is Robinhood starting to sell peoples stocks without their knowledge or consent???,https://i.redd.it/61ywa89te4e61.jpg,1611860371.0,"{'author': 'StreetTripleRider', 'created_utc': 1611860371, 'title': 'Is Robinhood starting to sell peoples stocks without their knowledge or consent???', 'url': 'https://i.redd.it/61ywa89te4e61.jpg', 'created': 1611860371.0}",2021-01-28 18:59:31
27,hurtgoth,1611860371,Robinhood exchange restriction solution,https://www.reddit.com/r/wallstreetbets/comments/l75b7s/robinhood_exchange_restriction_solution/,1611860371.0,"{'author': 'hurtgoth', 'created_utc': 1611860371, 'title': 'Robinhood exchange restriction solution', 'url': 'https://www.reddit.com/r/wallstreetbets/comments/l75b7s/robinhood_exchange_restriction_solution/', 'created': 1611860371.0}",2021-01-28 18:59:31
28,[deleted],1611860371,"Hey guys since we’re doing silly things, wanna inflate NUAN so my family never has to work again? Love you 😘",https://i.redd.it/l0mehc3xe4e61.jpg,1611860371.0,"{'author': '[deleted]', 'created_utc': 1611860371, 'title': 'Hey guys since we’re doing silly things, wanna inflate NUAN so my family never has to work again? Love you 😘', 'url': 'https://i.redd.it/l0mehc3xe4e61.jpg', 'created': 1611860371.0}",2021-01-28 18:59:31
29,Ok_Orange_9252,1611860369,🐐amc and gme ball game! 🚀,https://i.redd.it/03bji40xe4e61.jpg,1611860369.0,"{'author': 'Ok_Orange_9252', 'created_utc': 1611860369, 'title': '🐐amc and gme ball game! 🚀', 'url': 'https://i.redd.it/03bji40xe4e61.jpg', 'created': 1611860369.0}",2021-01-28 18:59:29
30,dragonlord213,1611860369,BLGV,https://www.reddit.com/r/wallstreetbets/comments/l75b6d/blgv/,1611860369.0,"{'author': 'dragonlord213', 'created_utc': 1611860369, 'title': 'BLGV', 'url': 'https://www.reddit.com/r/wallstreetbets/comments/l75b6d/blgv/', 'created': 1611860369.0}",2021-01-28 18:59:29
31,JimBobCooter87,1611860368,"This is what happens next! $GME, $AMC, $NOK",https://www.reddit.com/r/wallstreetbets/comments/l75b66/this_is_what_happens_next_gme_amc_nok/,1611860368.0,"{'author': 'JimBobCooter87', 'created_utc': 1611860368, 'title': 'This is what happens next! $GME, $AMC, $NOK', 'url': 'https://www.reddit.com/r/wallstreetbets/comments/l75b66/this_is_what_happens_next_gme_amc_nok/', 'created': 1611860368.0}",2021-01-28 18:59:28
32,dodoleshkaa,1611860368,Buying GME,https://www.reddit.com/r/wallstreetbets/comments/l75b5y/buying_gme/,1611860368.0,"{'author': 'dodoleshkaa', 'created_utc': 1611860368, 'title': 'Buying GME', 'url': 'https://www.reddit.com/r/wallstreetbets/comments/l75b5y/buying_gme/', 'created': 1611860368.0}",2021-01-28 18:59:28
33,x_UGK_x,1611860367,HOLD!!! This could be the movie poster,https://i.redd.it/i2jcfahse4e61.png,1611860367.0,"{'author': 'x_UGK_x', 'created_utc': 1611860367, 'title': 'HOLD!!! This could be the movie poster', 'url': 'https://i.redd.it/i2jcfahse4e61.png', 'created': 1611860367.0}",2021-01-28 18:59:27
34,MilanR3,1611860367,Stop the MANIPULATION!,https://www.reddit.com/r/wallstreetbets/comments/l75b5d/stop_the_manipulation/,1611860367.0,"{'author': 'MilanR3', 'created_utc': 1611860367, 'title': 'Stop the MANIPULATION!', 'url': 'https://www.reddit.com/r/wallstreetbets/comments/l75b5d/stop_the_manipulation/', 'created': 1611860367.0}",2021-01-28 18:59:27
35,kingdeath1,1611860366,Robinhood is stopping more than just GME,https://i.redd.it/bek6r2kwe4e61.jpg,1611860366.0,"{'author': 'kingdeath1', 'created_utc': 1611860366, 'title': 'Robinhood is stopping more than just GME', 'url': 'https://i.redd.it/bek6r2kwe4e61.jpg', 'created': 1611860366.0}",2021-01-28 18:59:26
36,Complex-Fill502,1611860366,Dogecoin?,https://www.reddit.com/r/wallstreetbets/comments/l75b4u/dogecoin/,1611860366.0,"{'author': 'Complex-Fill502', 'created_utc': 1611860366, 'title': 'Dogecoin?', 'url': 'https://www.reddit.com/r/wallstreetbets/comments/l75b4u/dogecoin/', 'created': 1611860366.0}",2021-01-28 18:59:26
37,DesperateAd718,1611860366,"Hold all online brokers accountable, not just Robin Hood",https://www.reddit.com/r/wallstreetbets/comments/l75b4r/hold_all_online_brokers_accountable_not_just/,1611860366.0,"{'author': 'DesperateAd718', 'created_utc': 1611860366, 'title': 'Hold all online brokers accountable, not just Robin Hood', 'url': 'https://www.reddit.com/r/wallstreetbets/comments/l75b4r/hold_all_online_brokers_accountable_not_just/', 'created': 1611860366.0}",2021-01-28 18:59:26
38,[deleted],1611860366,This is one of the cocksuckers who is doing this today let’s ruin this stupid fuck financially and teach him a lesson.,https://www.reddit.com/r/wallstreetbets/comments/l75b4p/this_is_one_of_the_cocksuckers_who_is_doing_this/,1611860366.0,"{'author': '[deleted]', 'created_utc': 1611860366, 'title': 'This is one of the cocksuckers who is doing this today let’s ruin this stupid fuck financially and teach him a lesson.', 'url': 'https://www.reddit.com/r/wallstreetbets/comments/l75b4p/this_is_one_of_the_cocksuckers_who_is_doing_this/', 'created': 1611860366.0}",2021-01-28 18:59:26
39,ar1680,1611860364,Fuck USA Today,https://www.reddit.com/r/wallstreetbets/comments/l75b3t/fuck_usa_today/,1611860364.0,"{'author': 'ar1680', 'created_utc': 1611860364, 'title': 'Fuck USA Today', 'url': 'https://www.reddit.com/r/wallstreetbets/comments/l75b3t/fuck_usa_today/', 'created': 1611860364.0}",2021-01-28 18:59:24
40,MrSplattacus,1611860364,One Capital Management LP and One Research Company Managed To Fight The Wishes of Millions and Investors,https://www.reddit.com/r/wallstreetbets/comments/l75b3q/one_capital_management_lp_and_one_research/,1611860364.0,"{'author': 'MrSplattacus', 'created_utc': 1611860364, 'title': 'One Capital Management LP and One Research Company Managed To Fight The Wishes of Millions and Investors', 'url': 'https://www.reddit.com/r/wallstreetbets/comments/l75b3q/one_capital_management_lp_and_one_research/', 'created': 1611860364.0}",2021-01-28 18:59:24
41,Closetedcousin,1611860364,Is there a place to leak/post evidence of collusion?,https://www.reddit.com/r/wallstreetbets/comments/l75b3m/is_there_a_place_to_leakpost_evidence_of_collusion/,1611860364.0,"{'author': 'Closetedcousin', 'created_utc': 1611860364, 'title': 'Is there a place to leak/post evidence of collusion?', 'url': 'https://www.reddit.com/r/wallstreetbets/comments/l75b3m/is_there_a_place_to_leakpost_evidence_of_collusion/', 'created': 1611860364.0}",2021-01-28 18:59:24
42,Spiderat33,1611860364,Steve Bannon's warroom explains it all for you. He knows more about wall street than anyone,https://rumble.com/vdcuwz-the-uni-party-in-dc-and-wall-street-cartel-are-united-bankrolled-by-deplora.html,1611860364.0,"{'author': 'Spiderat33', 'created_utc': 1611860364, 'title': ""Steve Bannon's warroom explains it all for you. He knows more about wall street than anyone"", 'url': 'https://rumble.com/vdcuwz-the-uni-party-in-dc-and-wall-street-cartel-are-united-bankrolled-by-deplora.html', 'created': 1611860364.0}",2021-01-28 18:59:24
43,MatterSubstantial431,1611860364,STILL HOLDING BUT WHY ARE PEOPLE SAYING TO SELL FRIDAY,https://www.reddit.com/r/wallstreetbets/comments/l75b3d/still_holding_but_why_are_people_saying_to_sell/,1611860364.0,"{'author': 'MatterSubstantial431', 'created_utc': 1611860364, 'title': 'STILL HOLDING BUT WHY ARE PEOPLE SAYING TO SELL FRIDAY', 'url': 'https://www.reddit.com/r/wallstreetbets/comments/l75b3d/still_holding_but_why_are_people_saying_to_sell/', 'created': 1611860364.0}",2021-01-28 18:59:24
44,antonthebum,1611860364,We must support each other against these global criminals. We are working to expose them from different angles. I’m very proud of you all.Help me do my part as an artist👁🙏👁,https://www.reddit.com/r/wallstreetbets/comments/l75b3a/we_must_support_each_other_against_these_global/,1611860364.0,"{'author': 'antonthebum', 'created_utc': 1611860364, 'title': 'We must support each other against these global criminals. We are working to expose them from different angles. I’m very proud of you all.Help me do my part as an artist👁🙏👁', 'url': 'https://www.reddit.com/r/wallstreetbets/comments/l75b3a/we_must_support_each_other_against_these_global/', 'created': 1611860364.0}",2021-01-28 18:59:24
45,robbie_digital,1611860363,F*** M1 Finance,https://www.reddit.com/r/wallstreetbets/comments/l75b32/f_m1_finance/,1611860363.0,"{'author': 'robbie_digital', 'created_utc': 1611860363, 'title': 'F*** M1 Finance', 'url': 'https://www.reddit.com/r/wallstreetbets/comments/l75b32/f_m1_finance/', 'created': 1611860363.0}",2021-01-28 18:59:23
46,Lost_5k,1611860363,In regards to Robin Hood,https://www.reddit.com/r/wallstreetbets/comments/l75b31/in_regards_to_robin_hood/,1611860363.0,"{'author': 'Lost_5k', 'created_utc': 1611860363, 'title': 'In regards to Robin Hood', 'url': 'https://www.reddit.com/r/wallstreetbets/comments/l75b31/in_regards_to_robin_hood/', 'created': 1611860363.0}",2021-01-28 18:59:23
47,erelim,1611860363,Justin Kan calling for whistleblowers to expose Robinhood and Citadel's collusion/market manipulation,https://i.redd.it/8jjtbq4re4e61.png,1611860363.0,"{'author': 'erelim', 'created_utc': 1611860363, 'title': ""Justin Kan calling for whistleblowers to expose Robinhood and Citadel's collusion/market manipulation"", 'url': 'https://i.redd.it/8jjtbq4re4e61.png', 'created': 1611860363.0}",2021-01-28 18:59:23
48,kili_pa,1611860362,Take a look at STRATASYS,https://www.reddit.com/r/wallstreetbets/comments/l75b2m/take_a_look_at_stratasys/,1611860362.0,"{'author': 'kili_pa', 'created_utc': 1611860362, 'title': 'Take a look at STRATASYS', 'url': 'https://www.reddit.com/r/wallstreetbets/comments/l75b2m/take_a_look_at_stratasys/', 'created': 1611860362.0}",2021-01-28 18:59:22
49,EnrixFiggy,1611860362,"GME Movement! Who’s with me!? 1!,2!,3!... CANCUN!!",https://i.redd.it/0mtznk9we4e61.jpg,1611860362.0,"{'author': 'EnrixFiggy', 'created_utc': 1611860362, 'title': 'GME Movement! Who’s with me!? 1!,2!,3!... CANCUN!!', 'url': 'https://i.redd.it/0mtznk9we4e61.jpg', 'created': 1611860362.0}",2021-01-28 18:59:22
50,Kbieksabets,1611860362,I am in Canada and my bank is not limiting buying but I feel like I could still be part of a class action because what Robin Hood is doing is making my stock price go down,https://www.reddit.com/r/wallstreetbets/comments/l75b2c/i_am_in_canada_and_my_bank_is_not_limiting_buying/,1611860362.0,"{'author': 'Kbieksabets', 'created_utc': 1611860362, 'title': 'I am in Canada and my bank is not limiting buying but I feel like I could still be part of a class action because what Robin Hood is doing is making my stock price go down', 'url': 'https://www.reddit.com/r/wallstreetbets/comments/l75b2c/i_am_in_canada_and_my_bank_is_not_limiting_buying/', 'created': 1611860362.0}",2021-01-28 18:59:22
51,Desperate_Slide,1611860362,BREAKING NEWS FROM ROBINHOOD CEO VLAD TENEV,https://www.reddit.com/r/wallstreetbets/comments/l75b28/breaking_news_from_robinhood_ceo_vlad_tenev/,1611860362.0,"{'author': 'Desperate_Slide', 'created_utc': 1611860362, 'title': 'BREAKING NEWS FROM ROBINHOOD CEO VLAD TENEV', 'url': 'https://www.reddit.com/r/wallstreetbets/comments/l75b28/breaking_news_from_robinhood_ceo_vlad_tenev/', 'created': 1611860362.0}",2021-01-28 18:59:22
52,Snooperton,1611860361,HOLD STEADY | TOMORROW IS ANOTHER DAY OF RECKONING FOR THE SHORTS. 249% FLOAT SHORTED. THIS WILL GO PARABOLIC 💎🤲🏻🚀💎🤲🏻🚀💎🤲🏻🚀💎🤲🏻🚀💎🤲🏻💎🤲🏻🚀,https://i.redd.it/lsao9z4we4e61.jpg,1611860361.0,"{'author': 'Snooperton', 'created_utc': 1611860361, 'title': 'HOLD STEADY | TOMORROW IS ANOTHER DAY OF RECKONING FOR THE SHORTS. 249% FLOAT SHORTED. THIS WILL GO PARABOLIC 💎🤲🏻🚀💎🤲🏻🚀💎🤲🏻🚀💎🤲🏻🚀💎🤲🏻💎🤲🏻🚀', 'url': 'https://i.redd.it/lsao9z4we4e61.jpg', 'created': 1611860361.0}",2021-01-28 18:59:21
53,Ani_leo,1611860361,It begins... #bb #amc #gme #nok,https://i.redd.it/jvqarqxve4e61.jpg,1611860361.0,"{'author': 'Ani_leo', 'created_utc': 1611860361, 'title': 'It begins... #bb #amc #gme #nok', 'url': 'https://i.redd.it/jvqarqxve4e61.jpg', 'created': 1611860361.0}",2021-01-28 18:59:21
54,mjaspan21,1611860361,Rolls-Royce (RYCEY),https://www.reddit.com/r/wallstreetbets/comments/l75b1u/rollsroyce_rycey/,1611860361.0,"{'author': 'mjaspan21', 'created_utc': 1611860361, 'title': 'Rolls-Royce (RYCEY)', 'url': 'https://www.reddit.com/r/wallstreetbets/comments/l75b1u/rollsroyce_rycey/', 'created': 1611860361.0}",2021-01-28 18:59:21
55,alyssaaa021,1611860361,Gain,https://www.reddit.com/r/wallstreetbets/comments/l75b1o/gain/,1611860361.0,"{'author': 'alyssaaa021', 'created_utc': 1611860361, 'title': 'Gain', 'url': 'https://www.reddit.com/r/wallstreetbets/comments/l75b1o/gain/', 'created': 1611860361.0}",2021-01-28 18:59:21
56,KingInTheNorthVI,1611860360,Robinhood forcing people to sell their shares. This is beyond disgusting,https://i.redd.it/4hjd351we4e61.jpg,1611860360.0,"{'author': 'KingInTheNorthVI', 'created_utc': 1611860360, 'title': 'Robinhood forcing people to sell their shares. This is beyond disgusting', 'url': 'https://i.redd.it/4hjd351we4e61.jpg', 'created': 1611860360.0}",2021-01-28 18:59:20
57,thedead69,1611860360,"If we all file small claims court lawsuits, Robinhood will have to respond to them all!",https://www.reddit.com/r/wallstreetbets/comments/l75b1b/if_we_all_file_small_claims_court_lawsuits/,1611860360.0,"{'author': 'thedead69', 'created_utc': 1611860360, 'title': 'If we all file small claims court lawsuits, Robinhood will have to respond to them all!', 'url': 'https://www.reddit.com/r/wallstreetbets/comments/l75b1b/if_we_all_file_small_claims_court_lawsuits/', 'created': 1611860360.0}",2021-01-28 18:59:20
58,Newspaper_Prize,1611860360,BB 1700 SHARES AND HOLDING,https://www.reddit.com/r/wallstreetbets/comments/l75b18/bb_1700_shares_and_holding/,1611860360.0,"{'author': 'Newspaper_Prize', 'created_utc': 1611860360, 'title': 'BB 1700 SHARES AND HOLDING', 'url': 'https://www.reddit.com/r/wallstreetbets/comments/l75b18/bb_1700_shares_and_holding/', 'created': 1611860360.0}",2021-01-28 18:59:20
59,Tear-Abject,1611860360,I BOUGHT NOK is open now🍾🍾🍾,https://www.reddit.com/r/wallstreetbets/comments/l75b12/i_bought_nok_is_open_now/,1611860360.0,"{'author': 'Tear-Abject', 'created_utc': 1611860360, 'title': 'I BOUGHT NOK is open now🍾🍾🍾', 'url': 'https://www.reddit.com/r/wallstreetbets/comments/l75b12/i_bought_nok_is_open_now/', 'created': 1611860360.0}",2021-01-28 18:59:20
60,MadDogHarris,1611860360,HODOR,https://i.redd.it/w3tvqi0we4e61.jpg,1611860360.0,"{'author': 'MadDogHarris', 'created_utc': 1611860360, 'title': 'HODOR', 'url': 'https://i.redd.it/w3tvqi0we4e61.jpg', 'created': 1611860360.0}",2021-01-28 18:59:20
