,author,created_utc,title,url,created,d_,created_utc_dt
60,Kodono,1609920964,READ THIS BEFORE YOU MAKE A MOVE JANUARY 6th 2020. Save your money. (DD),https://www.reddit.com/r/wallstreetbets/comments/krjn58/read_this_before_you_make_a_move_january_6th_2020/,1609920964.0,"{'author': 'Kodono', 'created_utc': 1609920964, 'title': 'READ THIS BEFORE YOU MAKE A MOVE JANUARY 6th 2020. Save your money. (DD)', 'url': 'https://www.reddit.com/r/wallstreetbets/comments/krjn58/read_this_before_you_make_a_move_january_6th_2020/', 'created': 1609920964.0}",2021-01-06 08:16:04
61,AwesomeD,1609920605,Purchased some SNDL shares. It was only fitting that I represent r/trees. Blaze up to the moon retards.,https://i.redd.it/aoyzdr207o961.jpg,1609920605.0,"{'author': 'AwesomeD', 'created_utc': 1609920605, 'title': 'Purchased some SNDL shares. It was only fitting that I represent r/trees. Blaze up to the moon retards.', 'url': 'https://i.redd.it/aoyzdr207o961.jpg', 'created': 1609920605.0}",2021-01-06 08:10:05
62,RandoEDDIE,1609920600,Buy and Hold BBI,https://i.redd.it/pg3cjclz6o961.jpg,1609920600.0,"{'author': 'RandoEDDIE', 'created_utc': 1609920600, 'title': 'Buy and Hold BBI', 'url': 'https://i.redd.it/pg3cjclz6o961.jpg', 'created': 1609920600.0}",2021-01-06 08:10:00
63,nyquil815,1609920370,A Fellow Autist Somehow Made it to the Ivy League,https://i.redd.it/kcxbhpya6o961.jpg,1609920370.0,"{'author': 'nyquil815', 'created_utc': 1609920370, 'title': 'A Fellow Autist Somehow Made it to the Ivy League', 'url': 'https://i.redd.it/kcxbhpya6o961.jpg', 'created': 1609920370.0}",2021-01-06 08:06:10
64,Clutch3131,1609920119,I get that tech is dipping on a dem win but what the hell are small caps up to? Rotation = retardation. My advice? Buy calls on anything tomorrow as the Great Recession bull run will continue without a black swan,https://i.redd.it/ra4jik1k5o961.jpg,1609920119.0,"{'author': 'Clutch3131', 'created_utc': 1609920119, 'title': 'I get that tech is dipping on a dem win but what the hell are small caps up to? Rotation = retardation. My advice? Buy calls on anything tomorrow as the Great Recession bull run will continue without a black swan', 'url': 'https://i.redd.it/ra4jik1k5o961.jpg', 'created': 1609920119.0}",2021-01-06 08:01:59
65,Puzzleheaded_Ad71,1609920065,This retard was so committed even his stepsister couldn’t distract him from the bag.,https://i.redd.it/e0kjoe9e5o961.jpg,1609920065.0,"{'author': 'Puzzleheaded_Ad71', 'created_utc': 1609920065, 'title': 'This retard was so committed even his stepsister couldn’t distract him from the bag.', 'url': 'https://i.redd.it/e0kjoe9e5o961.jpg', 'created': 1609920065.0}",2021-01-06 08:01:05
66,TheModeratorWrangler,1609919794,$GME meets $SPY calls,https://i.redd.it/wwxctaal4o961.jpg,1609919794.0,"{'author': 'TheModeratorWrangler', 'created_utc': 1609919794, 'title': '$GME meets $SPY calls', 'url': 'https://i.redd.it/wwxctaal4o961.jpg', 'created': 1609919794.0}",2021-01-06 07:56:34
67,DayDry7629,1609919496,My flexmobile after loosing my life savings on yolos.,https://v.redd.it/4uvht3kl3o961,1609919496.0,"{'author': 'DayDry7629', 'created_utc': 1609919496, 'title': 'My flexmobile after loosing my life savings on yolos.', 'url': 'https://v.redd.it/4uvht3kl3o961', 'created': 1609919496.0}",2021-01-06 07:51:36
68,delsystem32exe,1609919300,Storytime: My Grandpa Was an autist...,https://www.reddit.com/r/wallstreetbets/comments/krj9rt/storytime_my_grandpa_was_an_autist/,1609919300.0,"{'author': 'delsystem32exe', 'created_utc': 1609919300, 'title': 'Storytime: My Grandpa Was an autist...', 'url': 'https://www.reddit.com/r/wallstreetbets/comments/krj9rt/storytime_my_grandpa_was_an_autist/', 'created': 1609919300.0}",2021-01-06 07:48:20
69,BlvckLvng_,1609919142,Ask for proof or ban he said. Here it is. I’m poorer and more retarded than ever,https://i.redd.it/smww9cgn2o961.jpg,1609919142.0,"{'author': 'BlvckLvng_', 'created_utc': 1609919142, 'title': 'Ask for proof or ban he said. Here it is. I’m poorer and more retarded than ever', 'url': 'https://i.redd.it/smww9cgn2o961.jpg', 'created': 1609919142.0}",2021-01-06 07:45:42
70,BlvckLvng_,1609918970,Someone said proof or ban. Eat Shit. I may be poor but I’m retarded as ever.,https://i.redd.it/jc4wdw052o961.jpg,1609918970.0,"{'author': 'BlvckLvng_', 'created_utc': 1609918970, 'title': 'Someone said proof or ban. Eat Shit. I may be poor but I’m retarded as ever.', 'url': 'https://i.redd.it/jc4wdw052o961.jpg', 'created': 1609918970.0}",2021-01-06 07:42:50
71,SPCEMember593,1609918957,Some people call him the SPCE Cowboy.,https://v.redd.it/r41vbc0x1o961,1609918957.0,"{'author': 'SPCEMember593', 'created_utc': 1609918957, 'title': 'Some people call him the SPCE Cowboy.', 'url': 'https://v.redd.it/r41vbc0x1o961', 'created': 1609918957.0}",2021-01-06 07:42:37
72,TheModeratorWrangler,1609918677,Democrats win Georgia: The DD for you Republicucks,https://www.reddit.com/r/wallstreetbets/comments/krj4lq/democrats_win_georgia_the_dd_for_you_republicucks/,1609918677.0,"{'author': 'TheModeratorWrangler', 'created_utc': 1609918677, 'title': 'Democrats win Georgia: The DD for you Republicucks', 'url': 'https://www.reddit.com/r/wallstreetbets/comments/krj4lq/democrats_win_georgia_the_dd_for_you_republicucks/', 'created': 1609918677.0}",2021-01-06 07:37:57
73,almazanu,1609918660,Change ink on tech printer .,https://www.reddit.com/r/wallstreetbets/comments/krj4gu/change_ink_on_tech_printer/,1609918660.0,"{'author': 'almazanu', 'created_utc': 1609918660, 'title': 'Change ink on tech printer .', 'url': 'https://www.reddit.com/r/wallstreetbets/comments/krj4gu/change_ink_on_tech_printer/', 'created': 1609918660.0}",2021-01-06 07:37:40
74,DisruptiveTechn,1609918652,"$BNGO? MAYBE TAKE PROFITS, EVERYONE MISINTERPRETED THE STUDY",https://www.reddit.com/r/wallstreetbets/comments/krj4f0/bngo_maybe_take_profits_everyone_misinterpreted/,1609918652.0,"{'author': 'DisruptiveTechn', 'created_utc': 1609918652, 'title': '$BNGO? MAYBE TAKE PROFITS, EVERYONE MISINTERPRETED THE STUDY', 'url': 'https://www.reddit.com/r/wallstreetbets/comments/krj4f0/bngo_maybe_take_profits_everyone_misinterpreted/', 'created': 1609918652.0}",2021-01-06 07:37:32
75,terahabel,1609918488,Y'all are sleepin,https://www.reddit.com/r/wallstreetbets/comments/krj35g/yall_are_sleepin/,1609918488.0,"{'author': 'terahabel', 'created_utc': 1609918488, 'title': ""Y'all are sleepin"", 'url': 'https://www.reddit.com/r/wallstreetbets/comments/krj35g/yall_are_sleepin/', 'created': 1609918488.0}",2021-01-06 07:34:48
76,CappedCrib,1609918378,Printers now set to commence warpspeed 📈,https://i.redd.it/294ae8md0o961.jpg,1609918378.0,"{'author': 'CappedCrib', 'created_utc': 1609918378, 'title': 'Printers now set to commence warpspeed 📈', 'url': 'https://i.redd.it/294ae8md0o961.jpg', 'created': 1609918378.0}",2021-01-06 07:32:58
77,sin1sback,1609918180,expiry dates,https://www.reddit.com/r/wallstreetbets/comments/krj0r9/expiry_dates/,1609918180.0,"{'author': 'sin1sback', 'created_utc': 1609918180, 'title': 'expiry dates', 'url': 'https://www.reddit.com/r/wallstreetbets/comments/krj0r9/expiry_dates/', 'created': 1609918180.0}",2021-01-06 07:29:40
78,SummertimeInParis,1609917787,Stand By Me Adaptation: Print By Me,https://i.redd.it/sxq3togmyn961.jpg,1609917787.0,"{'author': 'SummertimeInParis', 'created_utc': 1609917787, 'title': 'Stand By Me Adaptation: Print By Me', 'url': 'https://i.redd.it/sxq3togmyn961.jpg', 'created': 1609917787.0}",2021-01-06 07:23:07
79,CappedCrib,1609917604,Printers will now commence warpspeed,https://i.redd.it/yhk8s6q2yn961.jpg,1609917604.0,"{'author': 'CappedCrib', 'created_utc': 1609917604, 'title': 'Printers will now commence warpspeed', 'url': 'https://i.redd.it/yhk8s6q2yn961.jpg', 'created': 1609917604.0}",2021-01-06 07:20:04
80,moksha-mahey,1609917592,"Threat to chad short seller firm Citron research, if they don’t raise DADA as a buy. They will face the wrath of the one known incel messiah dropping a squid on them. Incelian bastards of WSB it’s our time to moon 🚀🚀🚀🚀Incel army always wins.",https://www.reddit.com/gallery/kriwb4,1609917592.0,"{'author': 'moksha-mahey', 'created_utc': 1609917592, 'title': 'Threat to chad short seller firm Citron research, if they don’t raise DADA as a buy. They will face the wrath of the one known incel messiah dropping a squid on them. Incelian bastards of WSB it’s our time to moon 🚀🚀🚀🚀Incel army always wins.', 'url': 'https://www.reddit.com/gallery/kriwb4', 'created': 1609917592.0}",2021-01-06 07:19:52
81,jytusky,1609917528,For Greater Minds Than Mine...Low Bar,https://www.reddit.com/r/wallstreetbets/comments/krivug/for_greater_minds_than_minelow_bar/,1609917528.0,"{'author': 'jytusky', 'created_utc': 1609917528, 'title': 'For Greater Minds Than Mine...Low Bar', 'url': 'https://www.reddit.com/r/wallstreetbets/comments/krivug/for_greater_minds_than_minelow_bar/', 'created': 1609917528.0}",2021-01-06 07:18:48
82,DaBlizzard321,1609916844,Best books to learn stock trading.,https://www.reddit.com/r/wallstreetbets/comments/kripw5/best_books_to_learn_stock_trading/,1609916844.0,"{'author': 'DaBlizzard321', 'created_utc': 1609916844, 'title': 'Best books to learn stock trading.', 'url': 'https://www.reddit.com/r/wallstreetbets/comments/kripw5/best_books_to_learn_stock_trading/', 'created': 1609916844.0}",2021-01-06 07:07:24
83,mrusername1234567,1609916783,"Let’s go $JAGX, gave me just the monthly gains I needed $420.69",https://www.reddit.com/gallery/kripdv,1609916783.0,"{'author': 'mrusername1234567', 'created_utc': 1609916783, 'title': 'Let’s go $JAGX, gave me just the monthly gains I needed $420.69', 'url': 'https://www.reddit.com/gallery/kripdv', 'created': 1609916783.0}",2021-01-06 07:06:23
84,DravenGod1,1609916632,Market is going so far down tomorrow,https://www.reddit.com/r/wallstreetbets/comments/krio2h/market_is_going_so_far_down_tomorrow/,1609916632.0,"{'author': 'DravenGod1', 'created_utc': 1609916632, 'title': 'Market is going so far down tomorrow', 'url': 'https://www.reddit.com/r/wallstreetbets/comments/krio2h/market_is_going_so_far_down_tomorrow/', 'created': 1609916632.0}",2021-01-06 07:03:52
85,kbraz555,1609916536,Started with 0.02 and a dream,https://i.redd.it/rb8e6ghwun961.jpg,1609916536.0,"{'author': 'kbraz555', 'created_utc': 1609916536, 'title': 'Started with 0.02 and a dream', 'url': 'https://i.redd.it/rb8e6ghwun961.jpg', 'created': 1609916536.0}",2021-01-06 07:02:16
86,crypticmeaning,1609916502,How many of you autists are from 4chan,https://www.reddit.com/r/wallstreetbets/comments/krimz2/how_many_of_you_autists_are_from_4chan/,1609916502.0,"{'author': 'crypticmeaning', 'created_utc': 1609916502, 'title': 'How many of you autists are from 4chan', 'url': 'https://www.reddit.com/r/wallstreetbets/comments/krimz2/how_many_of_you_autists_are_from_4chan/', 'created': 1609916502.0}",2021-01-06 07:01:42
87,browncoats4lyfe,1609915996,Puts on WeBull.,https://www.npr.org/2021/01/06/953783462/trump-orders-ban-on-chinese-software-apps-citing-potential-espionage,1609915996.0,"{'author': 'browncoats4lyfe', 'created_utc': 1609915996, 'title': 'Puts on WeBull.', 'url': 'https://www.npr.org/2021/01/06/953783462/trump-orders-ban-on-chinese-software-apps-citing-potential-espionage', 'created': 1609915996.0}",2021-01-06 06:53:16
88,rogue019,1609915854,Tesla is now bigger (in market cap) than the next 10 biggest automakers,https://www.reddit.com/r/dataisbeautiful/comments/kr3wy9/oc_tesla_is_now_bigger_in_market_cap_than_the/?ref=share&amp;ref_source=link,1609915854.0,"{'author': 'rogue019', 'created_utc': 1609915854, 'title': 'Tesla is now bigger (in market cap) than the next 10 biggest automakers', 'url': 'https://www.reddit.com/r/dataisbeautiful/comments/kr3wy9/oc_tesla_is_now_bigger_in_market_cap_than_the/?ref=share&amp;ref_source=link', 'created': 1609915854.0}",2021-01-06 06:50:54
89,M5VM5V,1609915812,Alright boys. How do you all catch up on the markets? Any decent podcasts or websites that break down the news?,https://www.reddit.com/r/wallstreetbets/comments/krih9e/alright_boys_how_do_you_all_catch_up_on_the/,1609915812.0,"{'author': 'M5VM5V', 'created_utc': 1609915812, 'title': 'Alright boys. How do you all catch up on the markets? Any decent podcasts or websites that break down the news?', 'url': 'https://www.reddit.com/r/wallstreetbets/comments/krih9e/alright_boys_how_do_you_all_catch_up_on_the/', 'created': 1609915812.0}",2021-01-06 06:50:12
90,mrusername1234567,1609915746,Nice.,https://i.redd.it/hb7l3wmjsn961.jpg,1609915746.0,"{'author': 'mrusername1234567', 'created_utc': 1609915746, 'title': 'Nice.', 'url': 'https://i.redd.it/hb7l3wmjsn961.jpg', 'created': 1609915746.0}",2021-01-06 06:49:06
91,JustCantGoTitsUp,1609915564,Just gonna leave this here lmao AllHailPapaMusk,https://v.redd.it/swvd9l5vrn961,1609915564.0,"{'author': 'JustCantGoTitsUp', 'created_utc': 1609915564, 'title': 'Just gonna leave this here lmao AllHailPapaMusk', 'url': 'https://v.redd.it/swvd9l5vrn961', 'created': 1609915564.0}",2021-01-06 06:46:04
92,Otey,1609915485,Stonks only goes up!,https://i.redd.it/79iqj9zrrn961.jpg,1609915485.0,"{'author': 'Otey', 'created_utc': 1609915485, 'title': 'Stonks only goes up!', 'url': 'https://i.redd.it/79iqj9zrrn961.jpg', 'created': 1609915485.0}",2021-01-06 06:44:45
93,ferros90,1609915342,PETA says drink your milk for diamond hands,https://i.redd.it/9gnfjacxyk961.png,1609915342.0,"{'author': 'ferros90', 'created_utc': 1609915342, 'title': 'PETA says drink your milk for diamond hands', 'url': 'https://i.redd.it/9gnfjacxyk961.png', 'created': 1609915342.0}",2021-01-06 06:42:22
94,jhartz_,1609915248,Even Robinhood called me a 🌈 🐻 autist,https://i.redd.it/dtolgxk2rn961.jpg,1609915248.0,"{'author': 'jhartz_', 'created_utc': 1609915248, 'title': 'Even Robinhood called me a 🌈 🐻 autist', 'url': 'https://i.redd.it/dtolgxk2rn961.jpg', 'created': 1609915248.0}",2021-01-06 06:40:48
95,c2b01,1609915210,"$XPEV Feb 21 $54 Yolo bet, 3rd time doing this. Doubled the last two times",https://i.redd.it/p3b6v0myqn961.png,1609915210.0,"{'author': 'c2b01', 'created_utc': 1609915210, 'title': '$XPEV Feb 21 $54 Yolo bet, 3rd time doing this. Doubled the last two times', 'url': 'https://i.redd.it/p3b6v0myqn961.png', 'created': 1609915210.0}",2021-01-06 06:40:10
96,Rooivalk0,1609915070,will I be able to buy a yacht by Friday??,https://i.redd.it/zlgxxgdjqn961.jpg,1609915070.0,"{'author': 'Rooivalk0', 'created_utc': 1609915070, 'title': 'will I be able to buy a yacht by Friday??', 'url': 'https://i.redd.it/zlgxxgdjqn961.jpg', 'created': 1609915070.0}",2021-01-06 06:37:50
97,jhartz_,1609914923,ROBINHOOD JUST CALLED ME AUTISTIC,https://i.redd.it/3fr7ayq3qn961.jpg,1609914923.0,"{'author': 'jhartz_', 'created_utc': 1609914923, 'title': 'ROBINHOOD JUST CALLED ME AUTISTIC', 'url': 'https://i.redd.it/3fr7ayq3qn961.jpg', 'created': 1609914923.0}",2021-01-06 06:35:23
98,ARMATAV,1609914868,@ all memers who create meme content,https://www.reddit.com/r/wallstreetbets/comments/kri9g7/all_memers_who_create_meme_content/,1609914868.0,"{'author': 'ARMATAV', 'created_utc': 1609914868, 'title': '@ all memers who create meme content', 'url': 'https://www.reddit.com/r/wallstreetbets/comments/kri9g7/all_memers_who_create_meme_content/', 'created': 1609914868.0}",2021-01-06 06:34:28
99,RalphJameson,1609914565,What are your retards calls and puts for democrats running every branch of government?,https://www.reddit.com/r/wallstreetbets/comments/kri6u8/what_are_your_retards_calls_and_puts_for/,1609914565.0,"{'author': 'RalphJameson', 'created_utc': 1609914565, 'title': 'What are your retards calls and puts for democrats running every branch of government?', 'url': 'https://www.reddit.com/r/wallstreetbets/comments/kri6u8/what_are_your_retards_calls_and_puts_for/', 'created': 1609914565.0}",2021-01-06 06:29:25
