,author,created_utc,title,url,created,d_,created_utc_dt
0,ilob,1613285013,Why XM is the Most Underrated High Growth Stock,https://www.reddit.com/r/wallstreetbets/comments/ljjca0/why_xm_is_the_most_underrated_high_growth_stock/,1613285013.0,"{'author': 'ilob', 'created_utc': 1613285013, 'title': 'Why XM is the Most Underrated High Growth Stock', 'url': 'https://www.reddit.com/r/wallstreetbets/comments/ljjca0/why_xm_is_the_most_underrated_high_growth_stock/', 'created': 1613285013.0}",2021-02-14 06:43:33
1,International-Seat51,1613285004,Buy spineway (A1KCX1) it is an innovative pharmaceutical company. They grow very fast!!!,https://www.reddit.com/r/wallstreetbets/comments/ljjc7d/buy_spineway_a1kcx1_it_is_an_innovative/,1613285004.0,"{'author': 'International-Seat51', 'created_utc': 1613285004, 'title': 'Buy spineway (A1KCX1) it is an innovative pharmaceutical company. They grow very fast!!!', 'url': 'https://www.reddit.com/r/wallstreetbets/comments/ljjc7d/buy_spineway_a1kcx1_it_is_an_innovative/', 'created': 1613285004.0}",2021-02-14 06:43:24
2,Ganja2233,1613285002,"Regarding Robinhood selling our Order Flows, am i missing something? Arent they a registered NPO? (Non-Profit Organization)",https://www.reddit.com/r/wallstreetbets/comments/ljjc6l/regarding_robinhood_selling_our_order_flows_am_i/,1613285002.0,"{'author': 'Ganja2233', 'created_utc': 1613285002, 'title': 'Regarding Robinhood selling our Order Flows, am i missing something? Arent they a registered NPO? (Non-Profit Organization)', 'url': 'https://www.reddit.com/r/wallstreetbets/comments/ljjc6l/regarding_robinhood_selling_our_order_flows_am_i/', 'created': 1613285002.0}",2021-02-14 06:43:22
3,pdomine99,1613284944,Massive short interest in $AY Atlantica Sustainable,https://www.reddit.com/r/wallstreetbets/comments/ljjbsq/massive_short_interest_in_ay_atlantica_sustainable/,1613284944.0,"{'author': 'pdomine99', 'created_utc': 1613284944, 'title': 'Massive short interest in $AY Atlantica Sustainable', 'url': 'https://www.reddit.com/r/wallstreetbets/comments/ljjbsq/massive_short_interest_in_ay_atlantica_sustainable/', 'created': 1613284944.0}",2021-02-14 06:42:24
4,Unusual-Baker-6405,1613284915,Plz help my friend i love this group chat and he has been getting harassed so call this number and tell her to stop harassing brookes (231)534-3199,https://www.reddit.com/r/wallstreetbets/comments/ljjbl1/plz_help_my_friend_i_love_this_group_chat_and_he/,1613284915.0,"{'author': 'Unusual-Baker-6405', 'created_utc': 1613284915, 'title': 'Plz help my friend i love this group chat and he has been getting harassed so call this number and tell her to stop harassing brookes (231)534-3199', 'url': 'https://www.reddit.com/r/wallstreetbets/comments/ljjbl1/plz_help_my_friend_i_love_this_group_chat_and_he/', 'created': 1613284915.0}",2021-02-14 06:41:55
5,causewhynot0173,1613284913,Worth a shot 🤷🏻‍♂️,https://i.redd.it/q8cfsz6t2eh61.jpg,1613284913.0,"{'author': 'causewhynot0173', 'created_utc': 1613284913, 'title': 'Worth a shot 🤷🏻\u200d♂️', 'url': 'https://i.redd.it/q8cfsz6t2eh61.jpg', 'created': 1613284913.0}",2021-02-14 06:41:53
6,JoeT1227,1613284866,Anybody looking into GigCapital?,https://www.reddit.com/r/wallstreetbets/comments/ljjb7h/anybody_looking_into_gigcapital/,1613284866.0,"{'author': 'JoeT1227', 'created_utc': 1613284866, 'title': 'Anybody looking into GigCapital?', 'url': 'https://www.reddit.com/r/wallstreetbets/comments/ljjb7h/anybody_looking_into_gigcapital/', 'created': 1613284866.0}",2021-02-14 06:41:06
7,Madbadmixmaster,1613284832,Pick 1: Aphria or Tilray?!?🤔 merging but which stock will go up Tuesday?,https://www.reddit.com/r/wallstreetbets/comments/ljjaul/pick_1_aphria_or_tilray_merging_but_which_stock/,1613284832.0,"{'author': 'Madbadmixmaster', 'created_utc': 1613284832, 'title': 'Pick 1: Aphria or Tilray?!?🤔 merging but which stock will go up Tuesday?', 'url': 'https://www.reddit.com/r/wallstreetbets/comments/ljjaul/pick_1_aphria_or_tilray_merging_but_which_stock/', 'created': 1613284832.0}",2021-02-14 06:40:32
8,Extremely-Bad-Idea,1613284828,Lithium shortages as electric vehicle production rises?,https://www.reddit.com/r/wallstreetbets/comments/ljjat2/lithium_shortages_as_electric_vehicle_production/,1613284828.0,"{'author': 'Extremely-Bad-Idea', 'created_utc': 1613284828, 'title': 'Lithium shortages as electric vehicle production rises?', 'url': 'https://www.reddit.com/r/wallstreetbets/comments/ljjat2/lithium_shortages_as_electric_vehicle_production/', 'created': 1613284828.0}",2021-02-14 06:40:28
9,Unusual-Baker-6405,1613284774,Everyone plz my friend has been getting harassed by his ex gf pls spam her number and as get to stop messing with brookes (231)534-3199 plz do this and help my friend,https://www.reddit.com/r/wallstreetbets/comments/ljjacm/everyone_plz_my_friend_has_been_getting_harassed/,1613284774.0,"{'author': 'Unusual-Baker-6405', 'created_utc': 1613284774, 'title': 'Everyone plz my friend has been getting harassed by his ex gf pls spam her number and as get to stop messing with brookes (231)534-3199 plz do this and help my friend', 'url': 'https://www.reddit.com/r/wallstreetbets/comments/ljjacm/everyone_plz_my_friend_has_been_getting_harassed/', 'created': 1613284774.0}",2021-02-14 06:39:34
10,Onboarding92,1613284766,"If we ask, Robinhood has to tell us exactly how much they made selling order flow for every single trade we made. I would like to know. Would you?",https://www.reddit.com/r/wallstreetbets/comments/lje81e/if_we_ask_robinhood_has_to_tell_us_exactly_how/?utm_source=ifttt,1613284766.0,"{'author': 'Onboarding92', 'created_utc': 1613284766, 'title': 'If we ask, Robinhood has to tell us exactly how much they made selling order flow for every single trade we made. I would like to know. Would you?', 'url': 'https://www.reddit.com/r/wallstreetbets/comments/lje81e/if_we_ask_robinhood_has_to_tell_us_exactly_how/?utm_source=ifttt', 'created': 1613284766.0}",2021-02-14 06:39:26
11,bigkev2569,1613284669,WE ARE ONE WEEK BEFORE THE 2000 CRASH,https://www.reddit.com/r/wallstreetbets/comments/ljj9jp/we_are_one_week_before_the_2000_crash/,1613284669.0,"{'author': 'bigkev2569', 'created_utc': 1613284669, 'title': 'WE ARE ONE WEEK BEFORE THE 2000 CRASH', 'url': 'https://www.reddit.com/r/wallstreetbets/comments/ljj9jp/we_are_one_week_before_the_2000_crash/', 'created': 1613284669.0}",2021-02-14 06:37:49
12,Desperate-Show-992,1613284629,WILL TESLA HIT 1.2K IN 2021?,https://www.reddit.com/r/wallstreetbets/comments/ljj99g/will_tesla_hit_12k_in_2021/,1613284629.0,"{'author': 'Desperate-Show-992', 'created_utc': 1613284629, 'title': 'WILL TESLA HIT 1.2K IN 2021?', 'url': 'https://www.reddit.com/r/wallstreetbets/comments/ljj99g/will_tesla_hit_12k_in_2021/', 'created': 1613284629.0}",2021-02-14 06:37:09
13,bluelip12,1613284610,Walking off a cliff,https://i.redd.it/b5w1cgxt1eh61.jpg,1613284610.0,"{'author': 'bluelip12', 'created_utc': 1613284610, 'title': 'Walking off a cliff', 'url': 'https://i.redd.it/b5w1cgxt1eh61.jpg', 'created': 1613284610.0}",2021-02-14 06:36:50
14,Lower_Tea_8512,1613284592,stocks and stuff,https://www.reddit.com/r/wallstreetbets/comments/ljj8y3/stocks_and_stuff/,1613284592.0,"{'author': 'Lower_Tea_8512', 'created_utc': 1613284592, 'title': 'stocks and stuff', 'url': 'https://www.reddit.com/r/wallstreetbets/comments/ljj8y3/stocks_and_stuff/', 'created': 1613284592.0}",2021-02-14 06:36:32
15,Substantial_Source47,1613284590,Mortgage bonds are falling.,https://www.reddit.com/r/wallstreetbets/comments/ljj8xa/mortgage_bonds_are_falling/,1613284590.0,"{'author': 'Substantial_Source47', 'created_utc': 1613284590, 'title': 'Mortgage bonds are falling.', 'url': 'https://www.reddit.com/r/wallstreetbets/comments/ljj8xa/mortgage_bonds_are_falling/', 'created': 1613284590.0}",2021-02-14 06:36:30
16,Chrononubz,1613284553,"$IO Geophysical, Earnings Play: A Bear's perspective...",https://www.reddit.com/r/wallstreetbets/comments/ljj8fm/io_geophysical_earnings_play_a_bears_perspective/,1613284553.0,"{'author': 'Chrononubz', 'created_utc': 1613284553, 'title': ""$IO Geophysical, Earnings Play: A Bear's perspective..."", 'url': 'https://www.reddit.com/r/wallstreetbets/comments/ljj8fm/io_geophysical_earnings_play_a_bears_perspective/', 'created': 1613284553.0}",2021-02-14 06:35:53
17,certified_prickUSMC,1613284453,CTRM CANT SHORT IT TUESDAY! CEO BUYING SHARES! Going to explode Tuesday!,https://fintel.io/doc/sec-sc-13ga-2021-february-12-18670-881?fbclid=IwAR0kHtVXyM7VDQh3PBR1DfOpYedtqbxNaLPWL9BlrQMxgd7u26BNsfcOLnY,1613284453.0,"{'author': 'certified_prickUSMC', 'created_utc': 1613284453, 'title': 'CTRM CANT SHORT IT TUESDAY! CEO BUYING SHARES! Going to explode Tuesday!', 'url': 'https://fintel.io/doc/sec-sc-13ga-2021-february-12-18670-881?fbclid=IwAR0kHtVXyM7VDQh3PBR1DfOpYedtqbxNaLPWL9BlrQMxgd7u26BNsfcOLnY', 'created': 1613284453.0}",2021-02-14 06:34:13
18,Zacyeung9999,1613284415,"NVCN,",https://www.reddit.com/r/wallstreetbets/comments/ljj76w/nvcn/,1613284415.0,"{'author': 'Zacyeung9999', 'created_utc': 1613284415, 'title': 'NVCN,', 'url': 'https://www.reddit.com/r/wallstreetbets/comments/ljj76w/nvcn/', 'created': 1613284415.0}",2021-02-14 06:33:35
19,eefmu,1613284306,I was berated for communicating my new strategy for risk management... then accused of being a Melvin plant. So now I present to you why your information about short interest is meaningless.,https://www.reddit.com/r/wallstreetbets/comments/ljj6au/i_was_berated_for_communicating_my_new_strategy/,1613284306.0,"{'author': 'eefmu', 'created_utc': 1613284306, 'title': 'I was berated for communicating my new strategy for risk management... then accused of being a Melvin plant. So now I present to you why your information about short interest is meaningless.', 'url': 'https://www.reddit.com/r/wallstreetbets/comments/ljj6au/i_was_berated_for_communicating_my_new_strategy/', 'created': 1613284306.0}",2021-02-14 06:31:46
20,dirtydando,1613284165,💎 hands never get heavy,https://i.redd.it/3fjou6al0eh61.jpg,1613284165.0,"{'author': 'dirtydando', 'created_utc': 1613284165, 'title': '💎 hands never get heavy', 'url': 'https://i.redd.it/3fjou6al0eh61.jpg', 'created': 1613284165.0}",2021-02-14 06:29:25
21,usethetip,1613284121,Quantumscape (QS) Preparing for liftoff...,https://www.reddit.com/r/wallstreetbets/comments/ljj4lv/quantumscape_qs_preparing_for_liftoff/,1613284121.0,"{'author': 'usethetip', 'created_utc': 1613284121, 'title': 'Quantumscape (QS) Preparing for liftoff...', 'url': 'https://www.reddit.com/r/wallstreetbets/comments/ljj4lv/quantumscape_qs_preparing_for_liftoff/', 'created': 1613284121.0}",2021-02-14 06:28:41
22,Excellent_Pianist_,1613284086,Why Qualtrics (XM) is the most underrated high growth stock in the market,https://www.reddit.com/r/wallstreetbets/comments/ljj4c9/why_qualtrics_xm_is_the_most_underrated_high/,1613284086.0,"{'author': 'Excellent_Pianist_', 'created_utc': 1613284086, 'title': 'Why Qualtrics (XM) is the most underrated high growth stock in the market', 'url': 'https://www.reddit.com/r/wallstreetbets/comments/ljj4c9/why_qualtrics_xm_is_the_most_underrated_high/', 'created': 1613284086.0}",2021-02-14 06:28:06
23,schwinn36,1613284075,Loss porn....F... Robinhood,https://i.redd.it/kvy5s5nb0eh61.jpg,1613284075.0,"{'author': 'schwinn36', 'created_utc': 1613284075, 'title': 'Loss porn....F... Robinhood', 'url': 'https://i.redd.it/kvy5s5nb0eh61.jpg', 'created': 1613284075.0}",2021-02-14 06:27:55
24,bawse1,1613284072,Vote Yes.,https://www.reddit.com/r/wallstreetbets/comments/ljj47k/vote_yes/,1613284072.0,"{'author': 'bawse1', 'created_utc': 1613284072, 'title': 'Vote Yes.', 'url': 'https://www.reddit.com/r/wallstreetbets/comments/ljj47k/vote_yes/', 'created': 1613284072.0}",2021-02-14 06:27:52
25,Dr0iDroid,1613284059,King of barcode,https://i.redd.it/x4r0t2d90eh61.jpg,1613284059.0,"{'author': 'Dr0iDroid', 'created_utc': 1613284059, 'title': 'King of barcode', 'url': 'https://i.redd.it/x4r0t2d90eh61.jpg', 'created': 1613284059.0}",2021-02-14 06:27:39
26,holeechit15,1613284025,what does everyone think about $HITIF,https://www.reddit.com/r/wallstreetbets/comments/ljj3tv/what_does_everyone_think_about_hitif/,1613284025.0,"{'author': 'holeechit15', 'created_utc': 1613284025, 'title': 'what does everyone think about $HITIF', 'url': 'https://www.reddit.com/r/wallstreetbets/comments/ljj3tv/what_does_everyone_think_about_hitif/', 'created': 1613284025.0}",2021-02-14 06:27:05
27,Newfie_Knight,1613283998,I just put my entire savings into this! Best decision I’ve ever made! https://spiffcoin.net,https://i.redd.it/szst8ig30eh61.jpg,1613283998.0,"{'author': 'Newfie_Knight', 'created_utc': 1613283998, 'title': 'I just put my entire savings into this! Best decision I’ve ever made! https://spiffcoin.net', 'url': 'https://i.redd.it/szst8ig30eh61.jpg', 'created': 1613283998.0}",2021-02-14 06:26:38
28,Stockie1,1613283942,"Waters Announces Robinhood, Citadel, Melvin Capital, Reddit CEOs and Keith Gill to Testify at Committee Hearing",https://www.reddit.com/r/wallstreetbets/comments/ljj36g/waters_announces_robinhood_citadel_melvin_capital/,1613283942.0,"{'author': 'Stockie1', 'created_utc': 1613283942, 'title': 'Waters Announces Robinhood, Citadel, Melvin Capital, Reddit CEOs and Keith Gill to Testify at Committee Hearing', 'url': 'https://www.reddit.com/r/wallstreetbets/comments/ljj36g/waters_announces_robinhood_citadel_melvin_capital/', 'created': 1613283942.0}",2021-02-14 06:25:42
29,raccoon-city-crypto,1613283879,I have a question,https://www.reddit.com/r/wallstreetbets/comments/ljj2o8/i_have_a_question/,1613283879.0,"{'author': 'raccoon-city-crypto', 'created_utc': 1613283879, 'title': 'I have a question', 'url': 'https://www.reddit.com/r/wallstreetbets/comments/ljj2o8/i_have_a_question/', 'created': 1613283879.0}",2021-02-14 06:24:39
30,risktaker299,1613283748,Lost most of my money with GME holding,https://www.reddit.com/r/wallstreetbets/comments/ljj1le/lost_most_of_my_money_with_gme_holding/,1613283748.0,"{'author': 'risktaker299', 'created_utc': 1613283748, 'title': 'Lost most of my money with GME holding', 'url': 'https://www.reddit.com/r/wallstreetbets/comments/ljj1le/lost_most_of_my_money_with_gme_holding/', 'created': 1613283748.0}",2021-02-14 06:22:28
31,hahaloser,1613283714,"This has to get nerfed, right?",https://i.imgur.com/jQgcNaa.png,1613283714.0,"{'author': 'hahaloser', 'created_utc': 1613283714, 'title': 'This has to get nerfed, right?', 'url': 'https://i.imgur.com/jQgcNaa.png', 'created': 1613283714.0}",2021-02-14 06:21:54
32,foxfirefinishes,1613283702,1st time on robinhood,https://www.reddit.com/r/wallstreetbets/comments/ljj187/1st_time_on_robinhood/,1613283702.0,"{'author': 'foxfirefinishes', 'created_utc': 1613283702, 'title': '1st time on robinhood', 'url': 'https://www.reddit.com/r/wallstreetbets/comments/ljj187/1st_time_on_robinhood/', 'created': 1613283702.0}",2021-02-14 06:21:42
33,foxfirefinishes,1613283698,1st time on robinhood,https://www.reddit.com/r/wallstreetbets/comments/ljj16z/1st_time_on_robinhood/,1613283698.0,"{'author': 'foxfirefinishes', 'created_utc': 1613283698, 'title': '1st time on robinhood', 'url': 'https://www.reddit.com/r/wallstreetbets/comments/ljj16z/1st_time_on_robinhood/', 'created': 1613283698.0}",2021-02-14 06:21:38
34,Sucre233,1613283611,"Legendary Roaring Kits - We all stand with him... I hope the clowns in the capitol don’t bother him toomych - otherwise, a bigger group of degenerates might invade capitol this time..",https://www.reddit.com/r/wallstreetbets/comments/ljj0i4/legendary_roaring_kits_we_all_stand_with_him_i/,1613283611.0,"{'author': 'Sucre233', 'created_utc': 1613283611, 'title': 'Legendary Roaring Kits - We all stand with him... I hope the clowns in the capitol don’t bother him toomych - otherwise, a bigger group of degenerates might invade capitol this time..', 'url': 'https://www.reddit.com/r/wallstreetbets/comments/ljj0i4/legendary_roaring_kits_we_all_stand_with_him_i/', 'created': 1613283611.0}",2021-02-14 06:20:11
35,slysailor,1613283330,Circa July 2020 #moneymoves,https://i.redd.it/ae5nsuv3ydh61.jpg,1613283330.0,"{'author': 'slysailor', 'created_utc': 1613283330, 'title': 'Circa July 2020 #moneymoves', 'url': 'https://i.redd.it/ae5nsuv3ydh61.jpg', 'created': 1613283330.0}",2021-02-14 06:15:30
36,Far-Parsnip-6534,1613283328,Stonks,https://www.reddit.com/r/wallstreetbets/comments/ljixxi/stonks/,1613283328.0,"{'author': 'Far-Parsnip-6534', 'created_utc': 1613283328, 'title': 'Stonks', 'url': 'https://www.reddit.com/r/wallstreetbets/comments/ljixxi/stonks/', 'created': 1613283328.0}",2021-02-14 06:15:28
37,nycsaytrader,1613283296,Options trading!,https://www.reddit.com/r/wallstreetbets/comments/ljixl1/options_trading/,1613283296.0,"{'author': 'nycsaytrader', 'created_utc': 1613283296, 'title': 'Options trading!', 'url': 'https://www.reddit.com/r/wallstreetbets/comments/ljixl1/options_trading/', 'created': 1613283296.0}",2021-02-14 06:14:56
38,Willing_Bison1741,1613283281,Someone tell me 🤔,https://www.reddit.com/r/wallstreetbets/comments/ljixho/someone_tell_me/,1613283281.0,"{'author': 'Willing_Bison1741', 'created_utc': 1613283281, 'title': 'Someone tell me 🤔', 'url': 'https://www.reddit.com/r/wallstreetbets/comments/ljixho/someone_tell_me/', 'created': 1613283281.0}",2021-02-14 06:14:41
39,AssistantAvailable63,1613283271,Quick DD on EVFM,https://www.reddit.com/r/wallstreetbets/comments/ljixei/quick_dd_on_evfm/,1613283271.0,"{'author': 'AssistantAvailable63', 'created_utc': 1613283271, 'title': 'Quick DD on EVFM', 'url': 'https://www.reddit.com/r/wallstreetbets/comments/ljixei/quick_dd_on_evfm/', 'created': 1613283271.0}",2021-02-14 06:14:31
40,DannyWhan,1613283262,Please Gill,https://www.reddit.com/r/wallstreetbets/comments/ljixbo/please_gill/,1613283262.0,"{'author': 'DannyWhan', 'created_utc': 1613283262, 'title': 'Please Gill', 'url': 'https://www.reddit.com/r/wallstreetbets/comments/ljixbo/please_gill/', 'created': 1613283262.0}",2021-02-14 06:14:22
41,BananaGlittering4820,1613283175,What a bunch of shit,https://www.reddit.com/r/wallstreetbets/comments/ljiwl4/what_a_bunch_of_shit/,1613283175.0,"{'author': 'BananaGlittering4820', 'created_utc': 1613283175, 'title': 'What a bunch of shit', 'url': 'https://www.reddit.com/r/wallstreetbets/comments/ljiwl4/what_a_bunch_of_shit/', 'created': 1613283175.0}",2021-02-14 06:12:55
42,LaGuardiaImperial,1613283160,$DFT - AnyStake... Fasten Your Seatbelts plz!,https://www.reddit.com/r/wallstreetbets/comments/ljiweo/dft_anystake_fasten_your_seatbelts_plz/,1613283160.0,"{'author': 'LaGuardiaImperial', 'created_utc': 1613283160, 'title': '$DFT - AnyStake... Fasten Your Seatbelts plz!', 'url': 'https://www.reddit.com/r/wallstreetbets/comments/ljiweo/dft_anystake_fasten_your_seatbelts_plz/', 'created': 1613283160.0}",2021-02-14 06:12:40
43,TTeRBy2112,1613283119,My smooth brain on display after wiping out a year of gains..,https://i.redd.it/m3eebndhxdh61.jpg,1613283119.0,"{'author': 'TTeRBy2112', 'created_utc': 1613283119, 'title': 'My smooth brain on display after wiping out a year of gains..', 'url': 'https://i.redd.it/m3eebndhxdh61.jpg', 'created': 1613283119.0}",2021-02-14 06:11:59
44,YourManArctic,1613283054,"Well, this is what my wife's boyfriend told me to do",https://v.redd.it/6rfpgbqmwdh61,1613283054.0,"{'author': 'YourManArctic', 'created_utc': 1613283054, 'title': ""Well, this is what my wife's boyfriend told me to do"", 'url': 'https://v.redd.it/6rfpgbqmwdh61', 'created': 1613283054.0}",2021-02-14 06:10:54
45,DoomerTrades,1613283041,💎🤲🌿🚀,https://i.redd.it/6t62jczuwdh61.jpg,1613283041.0,"{'author': 'DoomerTrades', 'created_utc': 1613283041, 'title': '💎🤲🌿🚀', 'url': 'https://i.redd.it/6t62jczuwdh61.jpg', 'created': 1613283041.0}",2021-02-14 06:10:41
46,yyypi24-7,1613282994,BCH to the mars🚀🚀🚀,https://www.reddit.com/r/wallstreetbets/comments/ljiup1/bch_to_the_mars/,1613282994.0,"{'author': 'yyypi24-7', 'created_utc': 1613282994, 'title': 'BCH to the mars🚀🚀🚀', 'url': 'https://www.reddit.com/r/wallstreetbets/comments/ljiup1/bch_to_the_mars/', 'created': 1613282994.0}",2021-02-14 06:09:54
47,HomoSapien-sa,1613282984,Inminent bull run for the Uranium market?,https://www.reddit.com/r/wallstreetbets/comments/ljiul3/inminent_bull_run_for_the_uranium_market/,1613282984.0,"{'author': 'HomoSapien-sa', 'created_utc': 1613282984, 'title': 'Inminent bull run for the Uranium market?', 'url': 'https://www.reddit.com/r/wallstreetbets/comments/ljiul3/inminent_bull_run_for_the_uranium_market/', 'created': 1613282984.0}",2021-02-14 06:09:44
48,jayne_marie,1613282946,🚀 Heed This Warning. Buy a Triple Digit While You Still Can. B. C. H. 🚀,https://www.reddit.com/r/wallstreetbets/comments/ljiua0/heed_this_warning_buy_a_triple_digit_while_you/,1613282946.0,"{'author': 'jayne_marie', 'created_utc': 1613282946, 'title': '🚀 Heed This Warning. Buy a Triple Digit While You Still Can. B. C. H. 🚀', 'url': 'https://www.reddit.com/r/wallstreetbets/comments/ljiua0/heed_this_warning_buy_a_triple_digit_while_you/', 'created': 1613282946.0}",2021-02-14 06:09:06
49,HomoSapien-sa,1613282866,Inminent bull run for the Uranium market?,https://www.reddit.com/r/wallstreetbets/comments/ljitlo/inminent_bull_run_for_the_uranium_market/,1613282866.0,"{'author': 'HomoSapien-sa', 'created_utc': 1613282866, 'title': 'Inminent bull run for the Uranium market?', 'url': 'https://www.reddit.com/r/wallstreetbets/comments/ljitlo/inminent_bull_run_for_the_uranium_market/', 'created': 1613282866.0}",2021-02-14 06:07:46
50,degenerate_101,1613282861,TAKOF is the new TSLA? IDK YOU TELL MEEE,https://i.redd.it/24bf7aqpwdh61.jpg,1613282861.0,"{'author': 'degenerate_101', 'created_utc': 1613282861, 'title': 'TAKOF is the new TSLA? IDK YOU TELL MEEE', 'url': 'https://i.redd.it/24bf7aqpwdh61.jpg', 'created': 1613282861.0}",2021-02-14 06:07:41
51,Trishapet,1613282837,https://www.gotpetential.com/products/unisex-long-sleeve-tee,https://www.reddit.com/gallery/ljitd9,1613282837.0,"{'author': 'Trishapet', 'created_utc': 1613282837, 'title': 'https://www.gotpetential.com/products/unisex-long-sleeve-tee', 'url': 'https://www.reddit.com/gallery/ljitd9', 'created': 1613282837.0}",2021-02-14 06:07:17
52,randomdudepassing,1613282831,Thanks WSB!,https://www.reddit.com/r/wallstreetbets/comments/ljitbf/thanks_wsb/,1613282831.0,"{'author': 'randomdudepassing', 'created_utc': 1613282831, 'title': 'Thanks WSB!', 'url': 'https://www.reddit.com/r/wallstreetbets/comments/ljitbf/thanks_wsb/', 'created': 1613282831.0}",2021-02-14 06:07:11
53,TJax2744,1613282829,How are GME bag holders doing?,https://www.reddit.com/r/wallstreetbets/comments/ljitap/how_are_gme_bag_holders_doing/,1613282829.0,"{'author': 'TJax2744', 'created_utc': 1613282829, 'title': 'How are GME bag holders doing?', 'url': 'https://www.reddit.com/r/wallstreetbets/comments/ljitap/how_are_gme_bag_holders_doing/', 'created': 1613282829.0}",2021-02-14 06:07:09
54,fevzinevzatt,1613282823,"- What coin are you hodl ⠀⠀⠀⠀⠀⠀⠀⠀⠀⠀⠀⠀⠀⠀⠀⠀⠀⠀ + B/TC, you? ⠀⠀⠀⠀⠀⠀⠀⠀⠀⠀⠀⠀⠀⠀⠀⠀⠀⠀ - D/oge",https://i.redd.it/j7hceiilwdh61.jpg,1613282823.0,"{'author': 'fevzinevzatt', 'created_utc': 1613282823, 'title': '- What coin are you hodl ⠀⠀⠀⠀⠀⠀⠀⠀⠀⠀⠀⠀⠀⠀⠀⠀⠀⠀ + B/TC, you? ⠀⠀⠀⠀⠀⠀⠀⠀⠀⠀⠀⠀⠀⠀⠀⠀⠀⠀ - D/oge', 'url': 'https://i.redd.it/j7hceiilwdh61.jpg', 'created': 1613282823.0}",2021-02-14 06:07:03
55,fevzinevzatt,1613282823,"- What coin are you hodl ⠀⠀⠀⠀⠀⠀⠀⠀⠀⠀⠀⠀⠀⠀⠀⠀⠀⠀ + B/TC, you? ⠀⠀⠀⠀⠀⠀⠀⠀⠀⠀⠀⠀⠀⠀⠀⠀⠀⠀ - D/oge",https://www.reddit.com/gallery/ljit8r,1613282823.0,"{'author': 'fevzinevzatt', 'created_utc': 1613282823, 'title': '- What coin are you hodl ⠀⠀⠀⠀⠀⠀⠀⠀⠀⠀⠀⠀⠀⠀⠀⠀⠀⠀ + B/TC, you? ⠀⠀⠀⠀⠀⠀⠀⠀⠀⠀⠀⠀⠀⠀⠀⠀⠀⠀ - D/oge', 'url': 'https://www.reddit.com/gallery/ljit8r', 'created': 1613282823.0}",2021-02-14 06:07:03
56,fevzinevzatt,1613282821,"- What coin are you hodl ⠀⠀⠀⠀⠀⠀⠀⠀⠀⠀⠀⠀⠀⠀⠀⠀⠀⠀ + B/TC, you? ⠀⠀⠀⠀⠀⠀⠀⠀⠀⠀⠀⠀⠀⠀⠀⠀⠀⠀ - D/oge",https://i.redd.it/x40zlnclwdh61.jpg,1613282821.0,"{'author': 'fevzinevzatt', 'created_utc': 1613282821, 'title': '- What coin are you hodl ⠀⠀⠀⠀⠀⠀⠀⠀⠀⠀⠀⠀⠀⠀⠀⠀⠀⠀ + B/TC, you? ⠀⠀⠀⠀⠀⠀⠀⠀⠀⠀⠀⠀⠀⠀⠀⠀⠀⠀ - D/oge', 'url': 'https://i.redd.it/x40zlnclwdh61.jpg', 'created': 1613282821.0}",2021-02-14 06:07:01
57,nycsaytrader,1613282818,New to the option world!,https://www.reddit.com/r/wallstreetbets/comments/ljit79/new_to_the_option_world/,1613282818.0,"{'author': 'nycsaytrader', 'created_utc': 1613282818, 'title': 'New to the option world!', 'url': 'https://www.reddit.com/r/wallstreetbets/comments/ljit79/new_to_the_option_world/', 'created': 1613282818.0}",2021-02-14 06:06:58
58,Dthomas_1120,1613282786,What’s the difference??? 2 on Robinhood,https://www.reddit.com/gallery/ljisx6,1613282786.0,"{'author': 'Dthomas_1120', 'created_utc': 1613282786, 'title': 'What’s the difference??? 2 on Robinhood', 'url': 'https://www.reddit.com/gallery/ljisx6', 'created': 1613282786.0}",2021-02-14 06:06:26
59,gdelucasde,1613282762,Is it a great time buy (long term)? We're facing all times high and a recovering economy,https://www.reddit.com/r/wallstreetbets/comments/ljispt/is_it_a_great_time_buy_long_term_were_facing_all/,1613282762.0,"{'author': 'gdelucasde', 'created_utc': 1613282762, 'title': ""Is it a great time buy (long term)? We're facing all times high and a recovering economy"", 'url': 'https://www.reddit.com/r/wallstreetbets/comments/ljispt/is_it_a_great_time_buy_long_term_were_facing_all/', 'created': 1613282762.0}",2021-02-14 06:06:02
