,author,created_utc,title,url,created,d_,created_utc_dt
0,noej_,1611848172,I have amc call options should I hold it? They expire on 2/12,https://www.reddit.com/r/wallstreetbets/comments/l6zx4g/i_have_amc_call_options_should_i_hold_it_they/,1611848172.0,"{'author': 'noej_', 'created_utc': 1611848172, 'title': 'I have amc call options should I hold it? They expire on 2/12', 'url': 'https://www.reddit.com/r/wallstreetbets/comments/l6zx4g/i_have_amc_call_options_should_i_hold_it_they/', 'created': 1611848172.0}",2021-01-28 15:36:12
1,scienceguy127,1611848172,NAKD,https://www.reddit.com/r/wallstreetbets/comments/l6zx4d/nakd/,1611848172.0,"{'author': 'scienceguy127', 'created_utc': 1611848172, 'title': 'NAKD', 'url': 'https://www.reddit.com/r/wallstreetbets/comments/l6zx4d/nakd/', 'created': 1611848172.0}",2021-01-28 15:36:12
2,StillStanding39168,1611848171,#NOK,https://www.reddit.com/r/wallstreetbets/comments/l6zx47/nok/,1611848171.0,"{'author': 'StillStanding39168', 'created_utc': 1611848171, 'title': '#NOK', 'url': 'https://www.reddit.com/r/wallstreetbets/comments/l6zx47/nok/', 'created': 1611848171.0}",2021-01-28 15:36:11
3,JustinGetby,1611848171,How to transfer your stocks from RH to another broker account (like Fidelity),https://www.reddit.com/r/wallstreetbets/comments/l6zx44/how_to_transfer_your_stocks_from_rh_to_another/,1611848171.0,"{'author': 'JustinGetby', 'created_utc': 1611848171, 'title': 'How to transfer your stocks from RH to another broker account (like Fidelity)', 'url': 'https://www.reddit.com/r/wallstreetbets/comments/l6zx44/how_to_transfer_your_stocks_from_rh_to_another/', 'created': 1611848171.0}",2021-01-28 15:36:11
4,jmobfitness,1611848171,Ge??,https://www.reddit.com/r/wallstreetbets/comments/l6zx3y/ge/,1611848171.0,"{'author': 'jmobfitness', 'created_utc': 1611848171, 'title': 'Ge??', 'url': 'https://www.reddit.com/r/wallstreetbets/comments/l6zx3y/ge/', 'created': 1611848171.0}",2021-01-28 15:36:11
5,any-no-mousey,1611848171,HOLD THE FUCKING LINE MY BROTHERS! GME AMC BB NOK,https://www.reddit.com/r/wallstreetbets/comments/l6zx3x/hold_the_fucking_line_my_brothers_gme_amc_bb_nok/,1611848171.0,"{'author': 'any-no-mousey', 'created_utc': 1611848171, 'title': 'HOLD THE FUCKING LINE MY BROTHERS! GME AMC BB NOK', 'url': 'https://www.reddit.com/r/wallstreetbets/comments/l6zx3x/hold_the_fucking_line_my_brothers_gme_amc_bb_nok/', 'created': 1611848171.0}",2021-01-28 15:36:11
6,traderinthehouse,1611848171,AMC down to 9!!,https://www.reddit.com/r/wallstreetbets/comments/l6zx3u/amc_down_to_9/,1611848171.0,"{'author': 'traderinthehouse', 'created_utc': 1611848171, 'title': 'AMC down to 9!!', 'url': 'https://www.reddit.com/r/wallstreetbets/comments/l6zx3u/amc_down_to_9/', 'created': 1611848171.0}",2021-01-28 15:36:11
7,JustinWitt,1611848171,WHAT DO WE DO???,https://www.reddit.com/r/wallstreetbets/comments/l6zx3q/what_do_we_do/,1611848171.0,"{'author': 'JustinWitt', 'created_utc': 1611848171, 'title': 'WHAT DO WE DO???', 'url': 'https://www.reddit.com/r/wallstreetbets/comments/l6zx3q/what_do_we_do/', 'created': 1611848171.0}",2021-01-28 15:36:11
8,danklord0,1611848171,BUY THE DIP AND HOLD WE ARE WINNING,https://www.reddit.com/r/wallstreetbets/comments/l6zx3p/buy_the_dip_and_hold_we_are_winning/,1611848171.0,"{'author': 'danklord0', 'created_utc': 1611848171, 'title': 'BUY THE DIP AND HOLD WE ARE WINNING', 'url': 'https://www.reddit.com/r/wallstreetbets/comments/l6zx3p/buy_the_dip_and_hold_we_are_winning/', 'created': 1611848171.0}",2021-01-28 15:36:11
9,chodemeister69,1611848171,NOKIAS WAY LOWER RISK AND HIGHER GAIN DUE TO LOWER STOCK PRICE,https://www.reddit.com/r/wallstreetbets/comments/l6zx3o/nokias_way_lower_risk_and_higher_gain_due_to/,1611848171.0,"{'author': 'chodemeister69', 'created_utc': 1611848171, 'title': 'NOKIAS WAY LOWER RISK AND HIGHER GAIN DUE TO LOWER STOCK PRICE', 'url': 'https://www.reddit.com/r/wallstreetbets/comments/l6zx3o/nokias_way_lower_risk_and_higher_gain_due_to/', 'created': 1611848171.0}",2021-01-28 15:36:11
10,UndoneRuckus,1611848171,"CHASE BANKING , AMC GME NOK AND ALL",https://www.reddit.com/r/wallstreetbets/comments/l6zx3i/chase_banking_amc_gme_nok_and_all/,1611848171.0,"{'author': 'UndoneRuckus', 'created_utc': 1611848171, 'title': 'CHASE BANKING , AMC GME NOK AND ALL', 'url': 'https://www.reddit.com/r/wallstreetbets/comments/l6zx3i/chase_banking_amc_gme_nok_and_all/', 'created': 1611848171.0}",2021-01-28 15:36:11
11,Dp1988ind,1611848170,If they do not allow us to buy stock lets show them by making DOGECOIN FLY TO 1$🚀🚀🚀🚀,https://www.reddit.com/r/wallstreetbets/comments/l6zx38/if_they_do_not_allow_us_to_buy_stock_lets_show/,1611848170.0,"{'author': 'Dp1988ind', 'created_utc': 1611848170, 'title': 'If they do not allow us to buy stock lets show them by making DOGECOIN FLY TO 1$🚀🚀🚀🚀', 'url': 'https://www.reddit.com/r/wallstreetbets/comments/l6zx38/if_they_do_not_allow_us_to_buy_stock_lets_show/', 'created': 1611848170.0}",2021-01-28 15:36:10
12,FiftyPercentComputer,1611848170,It's time to build an Open Source trading tool. API recommendations?,https://www.reddit.com/r/wallstreetbets/comments/l6zx36/its_time_to_build_an_open_source_trading_tool_api/,1611848170.0,"{'author': 'FiftyPercentComputer', 'created_utc': 1611848170, 'title': ""It's time to build an Open Source trading tool. API recommendations?"", 'url': 'https://www.reddit.com/r/wallstreetbets/comments/l6zx36/its_time_to_build_an_open_source_trading_tool_api/', 'created': 1611848170.0}",2021-01-28 15:36:10
13,mrlatino8,1611848169,HOLD BUY NOK &amp; BB,https://www.reddit.com/r/wallstreetbets/comments/l6zx2x/hold_buy_nok_bb/,1611848169.0,"{'author': 'mrlatino8', 'created_utc': 1611848169, 'title': 'HOLD BUY NOK &amp; BB', 'url': 'https://www.reddit.com/r/wallstreetbets/comments/l6zx2x/hold_buy_nok_bb/', 'created': 1611848169.0}",2021-01-28 15:36:09
14,deltq69,1611848169,NOK SWEDEN TO THE MOON🚀 🚀 🚀 🚀 🚀 🚀 🚀 🚀 🚀,https://www.reddit.com/r/wallstreetbets/comments/l6zx2o/nok_sweden_to_the_moon/,1611848169.0,"{'author': 'deltq69', 'created_utc': 1611848169, 'title': 'NOK SWEDEN TO THE MOON🚀 🚀 🚀 🚀 🚀 🚀 🚀 🚀 🚀', 'url': 'https://www.reddit.com/r/wallstreetbets/comments/l6zx2o/nok_sweden_to_the_moon/', 'created': 1611848169.0}",2021-01-28 15:36:09
15,Tretrue3,1611848169,IF YOURE GETTING PAPER HANDS BECAUSE THE BIG TRADERS ARE LOCKING STUFF DOWN YOH ARE BOTH A COWARD AND AN IDIOT. SPREAD AWARENESS,https://www.reddit.com/r/wallstreetbets/comments/l6zx2n/if_youre_getting_paper_hands_because_the_big/,1611848169.0,"{'author': 'Tretrue3', 'created_utc': 1611848169, 'title': 'IF YOURE GETTING PAPER HANDS BECAUSE THE BIG TRADERS ARE LOCKING STUFF DOWN YOH ARE BOTH A COWARD AND AN IDIOT. SPREAD AWARENESS', 'url': 'https://www.reddit.com/r/wallstreetbets/comments/l6zx2n/if_youre_getting_paper_hands_because_the_big/', 'created': 1611848169.0}",2021-01-28 15:36:09
16,koshka09,1611848169,Is AMC a lost cause or should I buy in at the dip?,https://www.reddit.com/r/wallstreetbets/comments/l6zx2k/is_amc_a_lost_cause_or_should_i_buy_in_at_the_dip/,1611848169.0,"{'author': 'koshka09', 'created_utc': 1611848169, 'title': 'Is AMC a lost cause or should I buy in at the dip?', 'url': 'https://www.reddit.com/r/wallstreetbets/comments/l6zx2k/is_amc_a_lost_cause_or_should_i_buy_in_at_the_dip/', 'created': 1611848169.0}",2021-01-28 15:36:09
17,Novel_Island2765,1611848168,It’s War,https://www.reddit.com/r/wallstreetbets/comments/l6zx2f/its_war/,1611848168.0,"{'author': 'Novel_Island2765', 'created_utc': 1611848168, 'title': 'It’s War', 'url': 'https://www.reddit.com/r/wallstreetbets/comments/l6zx2f/its_war/', 'created': 1611848168.0}",2021-01-28 15:36:08
18,Alwaystime4Sweets,1611848168,Literally watching RH not execute orders and not cancel them. Holding my funds in limbo to execute when???. BIG L,https://www.reddit.com/r/wallstreetbets/comments/l6zx2d/literally_watching_rh_not_execute_orders_and_not/,1611848168.0,"{'author': 'Alwaystime4Sweets', 'created_utc': 1611848168, 'title': 'Literally watching RH not execute orders and not cancel them. Holding my funds in limbo to execute when???. BIG L', 'url': 'https://www.reddit.com/r/wallstreetbets/comments/l6zx2d/literally_watching_rh_not_execute_orders_and_not/', 'created': 1611848168.0}",2021-01-28 15:36:08
19,BoringBusinessClass,1611848168,Lol reddit removed my post for marginalizing the SEC. (Mine was the fuck the SEC post),https://i.redd.it/3c5pr5ume3e61.jpg,1611848168.0,"{'author': 'BoringBusinessClass', 'created_utc': 1611848168, 'title': 'Lol reddit removed my post for marginalizing the SEC. (Mine was the fuck the SEC post)', 'url': 'https://i.redd.it/3c5pr5ume3e61.jpg', 'created': 1611848168.0}",2021-01-28 15:36:08
20,Blakejefe,1611848168,HOLD YOUR STOCKS THEY ARE TRYING TO MANIPULATE THE MARKET AND HALT STOCKS. HOOOOOLD AMC GME AND NOK,https://www.reddit.com/r/wallstreetbets/comments/l6zx25/hold_your_stocks_they_are_trying_to_manipulate/,1611848168.0,"{'author': 'Blakejefe', 'created_utc': 1611848168, 'title': 'HOLD YOUR STOCKS THEY ARE TRYING TO MANIPULATE THE MARKET AND HALT STOCKS. HOOOOOLD AMC GME AND NOK', 'url': 'https://www.reddit.com/r/wallstreetbets/comments/l6zx25/hold_your_stocks_they_are_trying_to_manipulate/', 'created': 1611848168.0}",2021-01-28 15:36:08
21,dirtydangles6,1611848168,Because ‘fuck you’,https://i.redd.it/g652aswme3e61.jpg,1611848168.0,"{'author': 'dirtydangles6', 'created_utc': 1611848168, 'title': 'Because ‘fuck you’', 'url': 'https://i.redd.it/g652aswme3e61.jpg', 'created': 1611848168.0}",2021-01-28 15:36:08
22,ChiddyChuddyBangGang,1611848168,Cash App,https://www.reddit.com/r/wallstreetbets/comments/l6zx22/cash_app/,1611848168.0,"{'author': 'ChiddyChuddyBangGang', 'created_utc': 1611848168, 'title': 'Cash App', 'url': 'https://www.reddit.com/r/wallstreetbets/comments/l6zx22/cash_app/', 'created': 1611848168.0}",2021-01-28 15:36:08
23,HuckleberryFormal341,1611848168,GO Against Hedge funds was fun but why not fuck the banks over? GO FOR CRYPTO BTC/ETH,https://www.reddit.com/r/wallstreetbets/comments/l6zx1x/go_against_hedge_funds_was_fun_but_why_not_fuck/,1611848168.0,"{'author': 'HuckleberryFormal341', 'created_utc': 1611848168, 'title': 'GO Against Hedge funds was fun but why not fuck the banks over? GO FOR CRYPTO BTC/ETH', 'url': 'https://www.reddit.com/r/wallstreetbets/comments/l6zx1x/go_against_hedge_funds_was_fun_but_why_not_fuck/', 'created': 1611848168.0}",2021-01-28 15:36:08
24,ian_dunne,1611848168,We must continue to contribute to Amc!,https://www.reddit.com/r/wallstreetbets/comments/l6zx1w/we_must_continue_to_contribute_to_amc/,1611848168.0,"{'author': 'ian_dunne', 'created_utc': 1611848168, 'title': 'We must continue to contribute to Amc!', 'url': 'https://www.reddit.com/r/wallstreetbets/comments/l6zx1w/we_must_continue_to_contribute_to_amc/', 'created': 1611848168.0}",2021-01-28 15:36:08
25,Marco577,1611848167,Are you keeping BB and NOK?,https://www.reddit.com/r/wallstreetbets/comments/l6zx1u/are_you_keeping_bb_and_nok/,1611848167.0,"{'author': 'Marco577', 'created_utc': 1611848167, 'title': 'Are you keeping BB and NOK?', 'url': 'https://www.reddit.com/r/wallstreetbets/comments/l6zx1u/are_you_keeping_bb_and_nok/', 'created': 1611848167.0}",2021-01-28 15:36:07
26,MANSHAHAQUE,1611848167,Hey yo quick question.....,https://www.reddit.com/r/wallstreetbets/comments/l6zx1t/hey_yo_quick_question/,1611848167.0,"{'author': 'MANSHAHAQUE', 'created_utc': 1611848167, 'title': 'Hey yo quick question.....', 'url': 'https://www.reddit.com/r/wallstreetbets/comments/l6zx1t/hey_yo_quick_question/', 'created': 1611848167.0}",2021-01-28 15:36:07
27,Arubeno31,1611848167,DON’T LET THEM FALL,https://www.reddit.com/r/wallstreetbets/comments/l6zx1q/dont_let_them_fall/,1611848167.0,"{'author': 'Arubeno31', 'created_utc': 1611848167, 'title': 'DON’T LET THEM FALL', 'url': 'https://www.reddit.com/r/wallstreetbets/comments/l6zx1q/dont_let_them_fall/', 'created': 1611848167.0}",2021-01-28 15:36:07
28,sanwal092,1611848167,Once this has all settled we need to post shit reviews for Robinhood on Playstore and App store for being boot lickere,https://www.reddit.com/r/wallstreetbets/comments/l6zx1m/once_this_has_all_settled_we_need_to_post_shit/,1611848167.0,"{'author': 'sanwal092', 'created_utc': 1611848167, 'title': 'Once this has all settled we need to post shit reviews for Robinhood on Playstore and App store for being boot lickere', 'url': 'https://www.reddit.com/r/wallstreetbets/comments/l6zx1m/once_this_has_all_settled_we_need_to_post_shit/', 'created': 1611848167.0}",2021-01-28 15:36:07
29,vtnrwyers,1611848167,Why’s amc crashing?!,https://www.reddit.com/r/wallstreetbets/comments/l6zx1i/whys_amc_crashing/,1611848167.0,"{'author': 'vtnrwyers', 'created_utc': 1611848167, 'title': 'Why’s amc crashing?!', 'url': 'https://www.reddit.com/r/wallstreetbets/comments/l6zx1i/whys_amc_crashing/', 'created': 1611848167.0}",2021-01-28 15:36:07
30,mikedom10,1611848167,Let’s get on that AMC when the dickheads decide to let us. Guess it’s time to go to webull...,https://www.reddit.com/r/wallstreetbets/comments/l6zx1f/lets_get_on_that_amc_when_the_dickheads_decide_to/,1611848167.0,"{'author': 'mikedom10', 'created_utc': 1611848167, 'title': 'Let’s get on that AMC when the dickheads decide to let us. Guess it’s time to go to webull...', 'url': 'https://www.reddit.com/r/wallstreetbets/comments/l6zx1f/lets_get_on_that_amc_when_the_dickheads_decide_to/', 'created': 1611848167.0}",2021-01-28 15:36:07
31,Impossible-Tie-512,1611848167,OPTT,https://www.reddit.com/r/wallstreetbets/comments/l6zx1e/optt/,1611848167.0,"{'author': 'Impossible-Tie-512', 'created_utc': 1611848167, 'title': 'OPTT', 'url': 'https://www.reddit.com/r/wallstreetbets/comments/l6zx1e/optt/', 'created': 1611848167.0}",2021-01-28 15:36:07
32,Mediocre_Complex_448,1611848167,"If there is a time to strike it’s now, reaching out to whoever can buy AMC BB OR NOK, but do not let them win, we are down bad rn but that’s what they want they want us to sell they don’t want a bunch of middle class ppl having money it’ll ruin their little society, buy buy buy",https://www.reddit.com/r/wallstreetbets/comments/l6zx1d/if_there_is_a_time_to_strike_its_now_reaching_out/,1611848167.0,"{'author': 'Mediocre_Complex_448', 'created_utc': 1611848167, 'title': 'If there is a time to strike it’s now, reaching out to whoever can buy AMC BB OR NOK, but do not let them win, we are down bad rn but that’s what they want they want us to sell they don’t want a bunch of middle class ppl having money it’ll ruin their little society, buy buy buy', 'url': 'https://www.reddit.com/r/wallstreetbets/comments/l6zx1d/if_there_is_a_time_to_strike_its_now_reaching_out/', 'created': 1611848167.0}",2021-01-28 15:36:07
33,thrwbck77,1611848167,AMC down to $9 Great time to Buy!,https://www.reddit.com/r/wallstreetbets/comments/l6zx19/amc_down_to_9_great_time_to_buy/,1611848167.0,"{'author': 'thrwbck77', 'created_utc': 1611848167, 'title': 'AMC down to $9 Great time to Buy!', 'url': 'https://www.reddit.com/r/wallstreetbets/comments/l6zx19/amc_down_to_9_great_time_to_buy/', 'created': 1611848167.0}",2021-01-28 15:36:07
34,officergabe,1611848166,CHARLES SCHWAB TO THE MOON 🚀🌈,https://i.redd.it/e23b4fgme3e61.jpg,1611848166.0,"{'author': 'officergabe', 'created_utc': 1611848166, 'title': 'CHARLES SCHWAB TO THE MOON 🚀🌈', 'url': 'https://i.redd.it/e23b4fgme3e61.jpg', 'created': 1611848166.0}",2021-01-28 15:36:06
35,Whole-Ad2365,1611848166,One star reviews let’s bring it down boys,https://i.redd.it/rkm945qme3e61.jpg,1611848166.0,"{'author': 'Whole-Ad2365', 'created_utc': 1611848166, 'title': 'One star reviews let’s bring it down boys', 'url': 'https://i.redd.it/rkm945qme3e61.jpg', 'created': 1611848166.0}",2021-01-28 15:36:06
36,maoweee1,1611848166,AMC Trades automatically closed,https://www.reddit.com/r/wallstreetbets/comments/l6zx10/amc_trades_automatically_closed/,1611848166.0,"{'author': 'maoweee1', 'created_utc': 1611848166, 'title': 'AMC Trades automatically closed', 'url': 'https://www.reddit.com/r/wallstreetbets/comments/l6zx10/amc_trades_automatically_closed/', 'created': 1611848166.0}",2021-01-28 15:36:06
37,LargeCheeseburgrMeal,1611848166,STAKE in Australia is back online,https://www.reddit.com/r/wallstreetbets/comments/l6zx0x/stake_in_australia_is_back_online/,1611848166.0,"{'author': 'LargeCheeseburgrMeal', 'created_utc': 1611848166, 'title': 'STAKE in Australia is back online', 'url': 'https://www.reddit.com/r/wallstreetbets/comments/l6zx0x/stake_in_australia_is_back_online/', 'created': 1611848166.0}",2021-01-28 15:36:06
38,wsbraveheart,1611848166,"It's not much, but 1 double 69 GME is &gt; 1 SPY",https://www.reddit.com/r/wallstreetbets/comments/l6zx0v/its_not_much_but_1_double_69_gme_is_1_spy/,1611848166.0,"{'author': 'wsbraveheart', 'created_utc': 1611848166, 'title': ""It's not much, but 1 double 69 GME is &gt; 1 SPY"", 'url': 'https://www.reddit.com/r/wallstreetbets/comments/l6zx0v/its_not_much_but_1_double_69_gme_is_1_spy/', 'created': 1611848166.0}",2021-01-28 15:36:06
39,CFSTROOPER,1611848166,Ameritrade seems to be working.,https://www.reddit.com/r/wallstreetbets/comments/l6zx0u/ameritrade_seems_to_be_working/,1611848166.0,"{'author': 'CFSTROOPER', 'created_utc': 1611848166, 'title': 'Ameritrade seems to be working.', 'url': 'https://www.reddit.com/r/wallstreetbets/comments/l6zx0u/ameritrade_seems_to_be_working/', 'created': 1611848166.0}",2021-01-28 15:36:06
40,Xumas300,1611848166,UPVOTE THIS: Hedge Funds are doing MARKET MANIPULATION on $AMC.,https://www.reddit.com/r/wallstreetbets/comments/l6zx0p/upvote_this_hedge_funds_are_doing_market/,1611848166.0,"{'author': 'Xumas300', 'created_utc': 1611848166, 'title': 'UPVOTE THIS: Hedge Funds are doing MARKET MANIPULATION on $AMC.', 'url': 'https://www.reddit.com/r/wallstreetbets/comments/l6zx0p/upvote_this_hedge_funds_are_doing_market/', 'created': 1611848166.0}",2021-01-28 15:36:06
41,kamilius00,1611848165,AMC &amp; GME WILL GO BACK UP!,https://www.reddit.com/r/wallstreetbets/comments/l6zx0l/amc_gme_will_go_back_up/,1611848165.0,"{'author': 'kamilius00', 'created_utc': 1611848165, 'title': 'AMC &amp; GME WILL GO BACK UP!', 'url': 'https://www.reddit.com/r/wallstreetbets/comments/l6zx0l/amc_gme_will_go_back_up/', 'created': 1611848165.0}",2021-01-28 15:36:05
42,oilposion,1611848165,Did we run out of money ?,https://www.reddit.com/r/wallstreetbets/comments/l6zx0a/did_we_run_out_of_money/,1611848165.0,"{'author': 'oilposion', 'created_utc': 1611848165, 'title': 'Did we run out of money ?', 'url': 'https://www.reddit.com/r/wallstreetbets/comments/l6zx0a/did_we_run_out_of_money/', 'created': 1611848165.0}",2021-01-28 15:36:05
43,Warm_File_1025,1611848165,GUYS BUY AMC ON CASHAPP,https://www.reddit.com/r/wallstreetbets/comments/l6zx08/guys_buy_amc_on_cashapp/,1611848165.0,"{'author': 'Warm_File_1025', 'created_utc': 1611848165, 'title': 'GUYS BUY AMC ON CASHAPP', 'url': 'https://www.reddit.com/r/wallstreetbets/comments/l6zx08/guys_buy_amc_on_cashapp/', 'created': 1611848165.0}",2021-01-28 15:36:05
44,Toto8599,1611848165,They are attacking everywhere (BB GME AMC KOSS) !,https://www.reddit.com/r/wallstreetbets/comments/l6zx06/they_are_attacking_everywhere_bb_gme_amc_koss/,1611848165.0,"{'author': 'Toto8599', 'created_utc': 1611848165, 'title': 'They are attacking everywhere (BB GME AMC KOSS) !', 'url': 'https://www.reddit.com/r/wallstreetbets/comments/l6zx06/they_are_attacking_everywhere_bb_gme_amc_koss/', 'created': 1611848165.0}",2021-01-28 15:36:05
45,Thebravest1,1611848164,GameStop And The Ecstasy Of Making Elites Pay,https://www.youtube.com/watch?v=zTT4it_f7Jc,1611848164.0,"{'author': 'Thebravest1', 'created_utc': 1611848164, 'title': 'GameStop And The Ecstasy Of Making Elites Pay', 'url': 'https://www.youtube.com/watch?v=zTT4it_f7Jc', 'created': 1611848164.0}",2021-01-28 15:36:04
46,Apprehensive-Day-490,1611848164,*Whispers*,https://www.reddit.com/r/wallstreetbets/comments/l6zwzz/whispers/,1611848164.0,"{'author': 'Apprehensive-Day-490', 'created_utc': 1611848164, 'title': '*Whispers*', 'url': 'https://www.reddit.com/r/wallstreetbets/comments/l6zwzz/whispers/', 'created': 1611848164.0}",2021-01-28 15:36:04
47,signgain82,1611848164,WE LIKE THE STOCK! WE DO NOT LIKE THE APP,https://www.reddit.com/r/wallstreetbets/comments/l6zwzx/we_like_the_stock_we_do_not_like_the_app/,1611848164.0,"{'author': 'signgain82', 'created_utc': 1611848164, 'title': 'WE LIKE THE STOCK! WE DO NOT LIKE THE APP', 'url': 'https://www.reddit.com/r/wallstreetbets/comments/l6zwzx/we_like_the_stock_we_do_not_like_the_app/', 'created': 1611848164.0}",2021-01-28 15:36:04
48,PersianOmoplata,1611848164,For anyone having trouble accessing Ally Invest. Ally Invest Direct Platform Link https://live.invest.ally.com/dashboard,https://www.reddit.com/r/wallstreetbets/comments/l6zwzo/for_anyone_having_trouble_accessing_ally_invest/,1611848164.0,"{'author': 'PersianOmoplata', 'created_utc': 1611848164, 'title': 'For anyone having trouble accessing Ally Invest. Ally Invest Direct Platform Link https://live.invest.ally.com/dashboard', 'url': 'https://www.reddit.com/r/wallstreetbets/comments/l6zwzo/for_anyone_having_trouble_accessing_ally_invest/', 'created': 1611848164.0}",2021-01-28 15:36:04
49,Liluzisquirt2x,1611848163,They got rid of all the reviews on the Apple store for RH,https://www.reddit.com/r/wallstreetbets/comments/l6zwzi/they_got_rid_of_all_the_reviews_on_the_apple/,1611848163.0,"{'author': 'Liluzisquirt2x', 'created_utc': 1611848163, 'title': 'They got rid of all the reviews on the Apple store for RH', 'url': 'https://www.reddit.com/r/wallstreetbets/comments/l6zwzi/they_got_rid_of_all_the_reviews_on_the_apple/', 'created': 1611848163.0}",2021-01-28 15:36:03
50,chrisrayn,1611848163,"According to VICE: “Robinhood Stops Users From Trading GameStop Stocks, Other Reddit Picks”",https://i.redd.it/elxyh2dme3e61.jpg,1611848163.0,"{'author': 'chrisrayn', 'created_utc': 1611848163, 'title': 'According to VICE: “Robinhood Stops Users From Trading GameStop Stocks, Other Reddit Picks”', 'url': 'https://i.redd.it/elxyh2dme3e61.jpg', 'created': 1611848163.0}",2021-01-28 15:36:03
51,BongRips4Paris,1611848163,NAKD is dipping hard. Anxious. Sell or hold,https://www.reddit.com/r/wallstreetbets/comments/l6zwz9/nakd_is_dipping_hard_anxious_sell_or_hold/,1611848163.0,"{'author': 'BongRips4Paris', 'created_utc': 1611848163, 'title': 'NAKD is dipping hard. Anxious. Sell or hold', 'url': 'https://www.reddit.com/r/wallstreetbets/comments/l6zwz9/nakd_is_dipping_hard_anxious_sell_or_hold/', 'created': 1611848163.0}",2021-01-28 15:36:03
52,anthova,1611848162,FOR ANYONE WHO CANT BUY STOCKS RIGHT NOW.,https://www.reddit.com/r/wallstreetbets/comments/l6zwz7/for_anyone_who_cant_buy_stocks_right_now/,1611848162.0,"{'author': 'anthova', 'created_utc': 1611848162, 'title': 'FOR ANYONE WHO CANT BUY STOCKS RIGHT NOW.', 'url': 'https://www.reddit.com/r/wallstreetbets/comments/l6zwz7/for_anyone_who_cant_buy_stocks_right_now/', 'created': 1611848162.0}",2021-01-28 15:36:02
53,LordEsdeath,1611848162,"NOK AND BB NEED HELP !! BUY AND HOLD BOYS, DONT LET HEDGE LORDS WIN 🚀🚀🚀🚀🚀🚀🚀🚀",https://www.reddit.com/r/wallstreetbets/comments/l6zwz2/nok_and_bb_need_help_buy_and_hold_boys_dont_let/,1611848162.0,"{'author': 'LordEsdeath', 'created_utc': 1611848162, 'title': 'NOK AND BB NEED HELP !! BUY AND HOLD BOYS, DONT LET HEDGE LORDS WIN 🚀🚀🚀🚀🚀🚀🚀🚀', 'url': 'https://www.reddit.com/r/wallstreetbets/comments/l6zwz2/nok_and_bb_need_help_buy_and_hold_boys_dont_let/', 'created': 1611848162.0}",2021-01-28 15:36:02
54,NineToeBIll,1611848162,Fidelity let me buy NOK and AMC and BB 🚀🚀🚀🚀🚀🌑🌑🌑,https://www.reddit.com/r/wallstreetbets/comments/l6zwyw/fidelity_let_me_buy_nok_and_amc_and_bb/,1611848162.0,"{'author': 'NineToeBIll', 'created_utc': 1611848162, 'title': 'Fidelity let me buy NOK and AMC and BB 🚀🚀🚀🚀🚀🌑🌑🌑', 'url': 'https://www.reddit.com/r/wallstreetbets/comments/l6zwyw/fidelity_let_me_buy_nok_and_amc_and_bb/', 'created': 1611848162.0}",2021-01-28 15:36:02
55,_rik_rok_,1611848162,BUY AMC DIP,https://www.reddit.com/r/wallstreetbets/comments/l6zwyv/buy_amc_dip/,1611848162.0,"{'author': '_rik_rok_', 'created_utc': 1611848162, 'title': 'BUY AMC DIP', 'url': 'https://www.reddit.com/r/wallstreetbets/comments/l6zwyv/buy_amc_dip/', 'created': 1611848162.0}",2021-01-28 15:36:02
56,Forensics_Alpha,1611848162,AMC's stock is dropping rapidly,https://www.reddit.com/r/wallstreetbets/comments/l6zwyr/amcs_stock_is_dropping_rapidly/,1611848162.0,"{'author': 'Forensics_Alpha', 'created_utc': 1611848162, 'title': ""AMC's stock is dropping rapidly"", 'url': 'https://www.reddit.com/r/wallstreetbets/comments/l6zwyr/amcs_stock_is_dropping_rapidly/', 'created': 1611848162.0}",2021-01-28 15:36:02
57,crazycarl007,1611848162,Anyone thoughts on BBBY?,https://www.reddit.com/r/wallstreetbets/comments/l6zwyq/anyone_thoughts_on_bbby/,1611848162.0,"{'author': 'crazycarl007', 'created_utc': 1611848162, 'title': 'Anyone thoughts on BBBY?', 'url': 'https://www.reddit.com/r/wallstreetbets/comments/l6zwyq/anyone_thoughts_on_bbby/', 'created': 1611848162.0}",2021-01-28 15:36:02
58,Franpuj79,1611848162,CLASS ACTION LAWSUIT NEEDED,https://www.reddit.com/r/wallstreetbets/comments/l6zwyl/class_action_lawsuit_needed/,1611848162.0,"{'author': 'Franpuj79', 'created_utc': 1611848162, 'title': 'CLASS ACTION LAWSUIT NEEDED', 'url': 'https://www.reddit.com/r/wallstreetbets/comments/l6zwyl/class_action_lawsuit_needed/', 'created': 1611848162.0}",2021-01-28 15:36:02
59,LilFingas,1611848161,Uh oh.,https://i.redd.it/jwvj1caee3e61.jpg,1611848161.0,"{'author': 'LilFingas', 'created_utc': 1611848161, 'title': 'Uh oh.', 'url': 'https://i.redd.it/jwvj1caee3e61.jpg', 'created': 1611848161.0}",2021-01-28 15:36:01
