,author,created_utc,title,url,created,d_,created_utc_dt
0,EmmaBean00,1612753731,Robinhood trying to save face by spending millions on a SuperBowl ad,https://i.redd.it/zllmzcac76g61.jpg,1612753731.0,"{'author': 'EmmaBean00', 'created_utc': 1612753731, 'title': 'Robinhood trying to save face by spending millions on a SuperBowl ad', 'url': 'https://i.redd.it/zllmzcac76g61.jpg', 'created': 1612753731.0}",2021-02-08 03:08:51
1,Mister_Twiggy,1612753673,Robinhood liked my tweet! Total redemption.,https://i.redd.it/ci7oag2676g61.jpg,1612753673.0,"{'author': 'Mister_Twiggy', 'created_utc': 1612753673, 'title': 'Robinhood liked my tweet! Total redemption.', 'url': 'https://i.redd.it/ci7oag2676g61.jpg', 'created': 1612753673.0}",2021-02-08 03:07:53
2,magonz0,1612753667,🤣,https://i.redd.it/i4dehjb576g61.jpg,1612753667.0,"{'author': 'magonz0', 'created_utc': 1612753667, 'title': '🤣', 'url': 'https://i.redd.it/i4dehjb576g61.jpg', 'created': 1612753667.0}",2021-02-08 03:07:47
3,kylebro11,1612753660,3 years of holding VKTX after losing in the beginning has finally paid off. Diamond hands never fails,https://i.redd.it/6xn38qm476g61.jpg,1612753660.0,"{'author': 'kylebro11', 'created_utc': 1612753660, 'title': '3 years of holding VKTX after losing in the beginning has finally paid off. Diamond hands never fails', 'url': 'https://i.redd.it/6xn38qm476g61.jpg', 'created': 1612753660.0}",2021-02-08 03:07:40
4,Nice-Cook,1612753648,My dog wants to be a Dogecoin mascot. BB to the moon tomorrow 🚀🚀🚀🚀🚀,https://i.redd.it/kq3pwj8376g61.jpg,1612753648.0,"{'author': 'Nice-Cook', 'created_utc': 1612753648, 'title': 'My dog wants to be a Dogecoin mascot. BB to the moon tomorrow 🚀🚀🚀🚀🚀', 'url': 'https://i.redd.it/kq3pwj8376g61.jpg', 'created': 1612753648.0}",2021-02-08 03:07:28
5,scot321,1612753645,"Hmm, i feel like this was a valid point. And should n0t have been removed, hopefully many soft headed apes changed stockbrokers so we can hit it tomorrow!",https://i.redd.it/n4visz0376g61.jpg,1612753645.0,"{'author': 'scot321', 'created_utc': 1612753645, 'title': 'Hmm, i feel like this was a valid point. And should n0t have been removed, hopefully many soft headed apes changed stockbrokers so we can hit it tomorrow!', 'url': 'https://i.redd.it/n4visz0376g61.jpg', 'created': 1612753645.0}",2021-02-08 03:07:25
6,OofyGoofyLookinAss,1612753612,"Hello fellow retards, while you guys are crying and heads up your ass on literally one stock, some of us are actually getting a fucking rocket.r/wallstreetbets (8mil+) get your shit together.",https://i.redd.it/vuq100jz66g61.jpg,1612753612.0,"{'author': 'OofyGoofyLookinAss', 'created_utc': 1612753612, 'title': 'Hello fellow retards, while you guys are crying and heads up your ass on literally one stock, some of us are actually getting a fucking rocket.r/wallstreetbets (8mil+) get your shit together.', 'url': 'https://i.redd.it/vuq100jz66g61.jpg', 'created': 1612753612.0}",2021-02-08 03:06:52
7,CappedCrib,1612753582,Just maintain the faith boys. $500 EOW.,https://i.redd.it/wblhyv8w66g61.jpg,1612753582.0,"{'author': 'CappedCrib', 'created_utc': 1612753582, 'title': 'Just maintain the faith boys. $500 EOW.', 'url': 'https://i.redd.it/wblhyv8w66g61.jpg', 'created': 1612753582.0}",2021-02-08 03:06:22
8,E23MT,1612753579,AMERICA 03/21,https://i.redd.it/6x9l96qv66g61.jpg,1612753579.0,"{'author': 'E23MT', 'created_utc': 1612753579, 'title': 'AMERICA 03/21', 'url': 'https://i.redd.it/6x9l96qv66g61.jpg', 'created': 1612753579.0}",2021-02-08 03:06:19
9,cardboardboxcarracer,1612753573,Me after losing most of my portfolio on game thinking I'm fighting wallstreet but really just an idiot.,https://i.redd.it/zw6xjifu66g61.png,1612753573.0,"{'author': 'cardboardboxcarracer', 'created_utc': 1612753573, 'title': ""Me after losing most of my portfolio on game thinking I'm fighting wallstreet but really just an idiot."", 'url': 'https://i.redd.it/zw6xjifu66g61.png', 'created': 1612753573.0}",2021-02-08 03:06:13
10,Substantial_Shine359,1612753566,Any thoughts? Inpx?,https://i.redd.it/ow8hpgku66g61.jpg,1612753566.0,"{'author': 'Substantial_Shine359', 'created_utc': 1612753566, 'title': 'Any thoughts? Inpx?', 'url': 'https://i.redd.it/ow8hpgku66g61.jpg', 'created': 1612753566.0}",2021-02-08 03:06:06
11,PatrickOBrienBoling,1612753562,Why does anyone care if a community of investors favor AMC?,https://www.reddit.com/r/wallstreetbets/comments/lf2hf9/why_does_anyone_care_if_a_community_of_investors/,1612753562.0,"{'author': 'PatrickOBrienBoling', 'created_utc': 1612753562, 'title': 'Why does anyone care if a community of investors favor AMC?', 'url': 'https://www.reddit.com/r/wallstreetbets/comments/lf2hf9/why_does_anyone_care_if_a_community_of_investors/', 'created': 1612753562.0}",2021-02-08 03:06:02
12,Xxgougaxx,1612753555,We will all get our tendies.,https://i.redd.it/fyekoq3t66g61.jpg,1612753555.0,"{'author': 'Xxgougaxx', 'created_utc': 1612753555, 'title': 'We will all get our tendies.', 'url': 'https://i.redd.it/fyekoq3t66g61.jpg', 'created': 1612753555.0}",2021-02-08 03:05:55
13,leurw,1612753546,That one time Robinhood gave me a free share of GME...back in March-2020 as my sign up bonus,https://i.redd.it/6xzzu5hs66g61.png,1612753546.0,"{'author': 'leurw', 'created_utc': 1612753546, 'title': 'That one time Robinhood gave me a free share of GME...back in March-2020 as my sign up bonus', 'url': 'https://i.redd.it/6xzzu5hs66g61.png', 'created': 1612753546.0}",2021-02-08 03:05:46
14,Ohgodharambe,1612753540,To the moon this week though 💎🚀,https://i.redd.it/h8xfhhrr66g61.jpg,1612753540.0,"{'author': 'Ohgodharambe', 'created_utc': 1612753540, 'title': 'To the moon this week though 💎🚀', 'url': 'https://i.redd.it/h8xfhhrr66g61.jpg', 'created': 1612753540.0}",2021-02-08 03:05:40
15,Few-Ad-2719,1612753529,Help,https://i.redd.it/6sisr5nq66g61.jpg,1612753529.0,"{'author': 'Few-Ad-2719', 'created_utc': 1612753529, 'title': 'Help', 'url': 'https://i.redd.it/6sisr5nq66g61.jpg', 'created': 1612753529.0}",2021-02-08 03:05:29
16,Few-Ad-2719,1612753500,I fucked up,https://i.redd.it/eugbpjkn66g61.jpg,1612753500.0,"{'author': 'Few-Ad-2719', 'created_utc': 1612753500, 'title': 'I fucked up', 'url': 'https://i.redd.it/eugbpjkn66g61.jpg', 'created': 1612753500.0}",2021-02-08 03:05:00
17,poweranimals,1612753490,What stock trading app is the best to use for beginners?,https://www.reddit.com/r/wallstreetbets/comments/lf2glk/what_stock_trading_app_is_the_best_to_use_for/,1612753490.0,"{'author': 'poweranimals', 'created_utc': 1612753490, 'title': 'What stock trading app is the best to use for beginners?', 'url': 'https://www.reddit.com/r/wallstreetbets/comments/lf2glk/what_stock_trading_app_is_the_best_to_use_for/', 'created': 1612753490.0}",2021-02-08 03:04:50
18,Laroxide,1612753438,Senseonics ($SENS) - Long Comprehensive Due Diligence by u/Choiph,https://www.reddit.com/r/wallstreetbets/comments/lf2g0q/senseonics_sens_long_comprehensive_due_diligence/,1612753438.0,"{'author': 'Laroxide', 'created_utc': 1612753438, 'title': 'Senseonics ($SENS) - Long Comprehensive Due Diligence by u/Choiph', 'url': 'https://www.reddit.com/r/wallstreetbets/comments/lf2g0q/senseonics_sens_long_comprehensive_due_diligence/', 'created': 1612753438.0}",2021-02-08 03:03:58
19,Accomplished_Meet683,1612753420,SI6 - ASX,https://www.reddit.com/r/wallstreetbets/comments/lf2ftv/si6_asx/,1612753420.0,"{'author': 'Accomplished_Meet683', 'created_utc': 1612753420, 'title': 'SI6 - ASX', 'url': 'https://www.reddit.com/r/wallstreetbets/comments/lf2ftv/si6_asx/', 'created': 1612753420.0}",2021-02-08 03:03:40
20,Radiant_Board_6661,1612753417,ISWH potentially the next GME. From the original list by wallstreetbets,https://www.reddit.com/r/wallstreetbets/comments/lf2fsl/iswh_potentially_the_next_gme_from_the_original/,1612753417.0,"{'author': 'Radiant_Board_6661', 'created_utc': 1612753417, 'title': 'ISWH potentially the next GME. From the original list by wallstreetbets', 'url': 'https://www.reddit.com/r/wallstreetbets/comments/lf2fsl/iswh_potentially_the_next_gme_from_the_original/', 'created': 1612753417.0}",2021-02-08 03:03:37
21,homie1441,1612753410,Robinhood commercial,https://www.reddit.com/r/wallstreetbets/comments/lf2fq6/robinhood_commercial/,1612753410.0,"{'author': 'homie1441', 'created_utc': 1612753410, 'title': 'Robinhood commercial', 'url': 'https://www.reddit.com/r/wallstreetbets/comments/lf2fq6/robinhood_commercial/', 'created': 1612753410.0}",2021-02-08 03:03:30
22,GiftedTuna,1612753390,Dnsnsns,https://www.reddit.com/r/wallstreetbets/comments/lf2fip/dnsnsns/,1612753390.0,"{'author': 'GiftedTuna', 'created_utc': 1612753390, 'title': 'Dnsnsns', 'url': 'https://www.reddit.com/r/wallstreetbets/comments/lf2fip/dnsnsns/', 'created': 1612753390.0}",2021-02-08 03:03:10
23,Which-Ad-3106,1612753389,AMC HAS BEEN NOT BEEN CANCELED,https://i.redd.it/d11t2dmb66g61.jpg,1612753389.0,"{'author': 'Which-Ad-3106', 'created_utc': 1612753389, 'title': 'AMC HAS BEEN NOT BEEN CANCELED', 'url': 'https://i.redd.it/d11t2dmb66g61.jpg', 'created': 1612753389.0}",2021-02-08 03:03:09
24,EZKTurbo,1612753384,"Yo, what happened to that guy who paid his rent on CC so that he could put everything he had on GME??",https://www.reddit.com/r/wallstreetbets/comments/lf2fgi/yo_what_happened_to_that_guy_who_paid_his_rent_on/,1612753384.0,"{'author': 'EZKTurbo', 'created_utc': 1612753384, 'title': 'Yo, what happened to that guy who paid his rent on CC so that he could put everything he had on GME??', 'url': 'https://www.reddit.com/r/wallstreetbets/comments/lf2fgi/yo_what_happened_to_that_guy_who_paid_his_rent_on/', 'created': 1612753384.0}",2021-02-08 03:03:04
25,ThenMedia9010,1612753375,Let’s do it tomorrow,https://www.reddit.com/r/wallstreetbets/comments/lf2fcz/lets_do_it_tomorrow/,1612753375.0,"{'author': 'ThenMedia9010', 'created_utc': 1612753375, 'title': 'Let’s do it tomorrow', 'url': 'https://www.reddit.com/r/wallstreetbets/comments/lf2fcz/lets_do_it_tomorrow/', 'created': 1612753375.0}",2021-02-08 03:02:55
26,Frodo1813,1612753367,Verizon to the moon，10X in two week！,https://www.reddit.com/gallery/lf2fal,1612753367.0,"{'author': 'Frodo1813', 'created_utc': 1612753367, 'title': 'Verizon to the moon，10X in two week！', 'url': 'https://www.reddit.com/gallery/lf2fal', 'created': 1612753367.0}",2021-02-08 03:02:47
27,BloodyScallywag,1612753321,"Was there a Robinhood NFL commercial, or I'm i just seeing shit?",https://www.reddit.com/r/wallstreetbets/comments/lf2es0/was_there_a_robinhood_nfl_commercial_or_im_i_just/,1612753321.0,"{'author': 'BloodyScallywag', 'created_utc': 1612753321, 'title': ""Was there a Robinhood NFL commercial, or I'm i just seeing shit?"", 'url': 'https://www.reddit.com/r/wallstreetbets/comments/lf2es0/was_there_a_robinhood_nfl_commercial_or_im_i_just/', 'created': 1612753321.0}",2021-02-08 03:02:01
28,Mdeezy100,1612753316,What advice can I get,https://www.reddit.com/r/wallstreetbets/comments/lf2eps/what_advice_can_i_get/,1612753316.0,"{'author': 'Mdeezy100', 'created_utc': 1612753316, 'title': 'What advice can I get', 'url': 'https://www.reddit.com/r/wallstreetbets/comments/lf2eps/what_advice_can_i_get/', 'created': 1612753316.0}",2021-02-08 03:01:56
29,scot321,1612753295,Rob the hood,https://www.reddit.com/r/wallstreetbets/comments/lf2ehy/rob_the_hood/,1612753295.0,"{'author': 'scot321', 'created_utc': 1612753295, 'title': 'Rob the hood', 'url': 'https://www.reddit.com/r/wallstreetbets/comments/lf2ehy/rob_the_hood/', 'created': 1612753295.0}",2021-02-08 03:01:35
30,DiligentDaughter,1612753289,Bullseye!,https://i.redd.it/c2d9b5x066g61.jpg,1612753289.0,"{'author': 'DiligentDaughter', 'created_utc': 1612753289, 'title': 'Bullseye!', 'url': 'https://i.redd.it/c2d9b5x066g61.jpg', 'created': 1612753289.0}",2021-02-08 03:01:29
31,ThenMedia9010,1612753276,Really Robinhood,https://www.reddit.com/r/wallstreetbets/comments/lf2e9f/really_robinhood/,1612753276.0,"{'author': 'ThenMedia9010', 'created_utc': 1612753276, 'title': 'Really Robinhood', 'url': 'https://www.reddit.com/r/wallstreetbets/comments/lf2e9f/really_robinhood/', 'created': 1612753276.0}",2021-02-08 03:01:16
32,Fluffermitten,1612753274,Have enough money for a super bowl ad tho 🧐🤔,https://i.redd.it/5tkduk9z56g61.jpg,1612753274.0,"{'author': 'Fluffermitten', 'created_utc': 1612753274, 'title': 'Have enough money for a super bowl ad tho 🧐🤔', 'url': 'https://i.redd.it/5tkduk9z56g61.jpg', 'created': 1612753274.0}",2021-02-08 03:01:14
33,OpportunistGuy,1612753268,Pi Cryptocurrency feasible?,https://www.reddit.com/r/wallstreetbets/comments/lf2e63/pi_cryptocurrency_feasible/,1612753268.0,"{'author': 'OpportunistGuy', 'created_utc': 1612753268, 'title': 'Pi Cryptocurrency feasible?', 'url': 'https://www.reddit.com/r/wallstreetbets/comments/lf2e63/pi_cryptocurrency_feasible/', 'created': 1612753268.0}",2021-02-08 03:01:08
34,itsezmk,1612753268,Wut stonks r we sending to the moon?,https://www.reddit.com/r/wallstreetbets/comments/lf2e5y/wut_stonks_r_we_sending_to_the_moon/,1612753268.0,"{'author': 'itsezmk', 'created_utc': 1612753268, 'title': 'Wut stonks r we sending to the moon?', 'url': 'https://www.reddit.com/r/wallstreetbets/comments/lf2e5y/wut_stonks_r_we_sending_to_the_moon/', 'created': 1612753268.0}",2021-02-08 03:01:08
35,bobaluski,1612753253,You’re not wrong.,https://i.redd.it/0nbkhb2x56g61.jpg,1612753253.0,"{'author': 'bobaluski', 'created_utc': 1612753253, 'title': 'You’re not wrong.', 'url': 'https://i.redd.it/0nbkhb2x56g61.jpg', 'created': 1612753253.0}",2021-02-08 03:00:53
36,Forward_Yard_9932,1612753240,Brilliant,https://i.redd.it/9yeqjigv56g61.jpg,1612753240.0,"{'author': 'Forward_Yard_9932', 'created_utc': 1612753240, 'title': 'Brilliant', 'url': 'https://i.redd.it/9yeqjigv56g61.jpg', 'created': 1612753240.0}",2021-02-08 03:00:40
37,Imboredcantusee,1612753239,I just saw a RobinHood ad on The Super Bowl,https://www.reddit.com/r/wallstreetbets/comments/lf2dti/i_just_saw_a_robinhood_ad_on_the_super_bowl/,1612753239.0,"{'author': 'Imboredcantusee', 'created_utc': 1612753239, 'title': 'I just saw a RobinHood ad on The Super Bowl', 'url': 'https://www.reddit.com/r/wallstreetbets/comments/lf2dti/i_just_saw_a_robinhood_ad_on_the_super_bowl/', 'created': 1612753239.0}",2021-02-08 03:00:39
38,Which-Ad-3106,1612753218,AMC HAS BEEN NOT BEEN CANCELED,https://www.reddit.com/r/wallstreetbets/comments/lf2dhc/amc_has_been_not_been_canceled/,1612753218.0,"{'author': 'Which-Ad-3106', 'created_utc': 1612753218, 'title': 'AMC HAS BEEN NOT BEEN CANCELED', 'url': 'https://www.reddit.com/r/wallstreetbets/comments/lf2dhc/amc_has_been_not_been_canceled/', 'created': 1612753218.0}",2021-02-08 03:00:18
39,MENZPHU,1612753215,Super Bowl,https://www.reddit.com/r/wallstreetbets/comments/lf2dg9/super_bowl/,1612753215.0,"{'author': 'MENZPHU', 'created_utc': 1612753215, 'title': 'Super Bowl', 'url': 'https://www.reddit.com/r/wallstreetbets/comments/lf2dg9/super_bowl/', 'created': 1612753215.0}",2021-02-08 03:00:15
40,danbrown543,1612753214,Fellow Indian here; Bought GME via my US friend 😎. Totally support on what WSB is doing. 💎🖐️,https://i.redd.it/0bbv9sds56g61.jpg,1612753214.0,"{'author': 'danbrown543', 'created_utc': 1612753214, 'title': 'Fellow Indian here; Bought GME via my US friend 😎. Totally support on what WSB is doing. 💎🖐️', 'url': 'https://i.redd.it/0bbv9sds56g61.jpg', 'created': 1612753214.0}",2021-02-08 03:00:14
41,ihrenell,1612753214,Robinhood got a Super Bowl ad👎👎👎,https://i.redd.it/r3lt5rqs56g61.jpg,1612753214.0,"{'author': 'ihrenell', 'created_utc': 1612753214, 'title': 'Robinhood got a Super Bowl ad👎👎👎', 'url': 'https://i.redd.it/r3lt5rqs56g61.jpg', 'created': 1612753214.0}",2021-02-08 03:00:14
42,FBarbarian,1612753211,How do you guys prefer to trade?,https://www.reddit.com/r/wallstreetbets/comments/lf2de6/how_do_you_guys_prefer_to_trade/,1612753211.0,"{'author': 'FBarbarian', 'created_utc': 1612753211, 'title': 'How do you guys prefer to trade?', 'url': 'https://www.reddit.com/r/wallstreetbets/comments/lf2de6/how_do_you_guys_prefer_to_trade/', 'created': 1612753211.0}",2021-02-08 03:00:11
43,pradyumnv,1612753204,papa reddit spent millions of dollars on us. big win. buy and hold. we did it bros.,https://i.redd.it/clkljx5r56g61.jpg,1612753204.0,"{'author': 'pradyumnv', 'created_utc': 1612753204, 'title': 'papa reddit spent millions of dollars on us. big win. buy and hold. we did it bros.', 'url': 'https://i.redd.it/clkljx5r56g61.jpg', 'created': 1612753204.0}",2021-02-08 03:00:04
44,duffman853,1612753196,Robbinhood SB commercial.,https://www.reddit.com/r/wallstreetbets/comments/lf2d6n/robbinhood_sb_commercial/,1612753196.0,"{'author': 'duffman853', 'created_utc': 1612753196, 'title': 'Robbinhood SB commercial.', 'url': 'https://www.reddit.com/r/wallstreetbets/comments/lf2d6n/robbinhood_sb_commercial/', 'created': 1612753196.0}",2021-02-08 02:59:56
45,nonrice,1612753195,Fresh out of the printer,https://i.redd.it/4ffuihwq56g61.jpg,1612753195.0,"{'author': 'nonrice', 'created_utc': 1612753195, 'title': 'Fresh out of the printer', 'url': 'https://i.redd.it/4ffuihwq56g61.jpg', 'created': 1612753195.0}",2021-02-08 02:59:55
46,mturturro,1612753185,Super Bowl commercial,https://www.reddit.com/r/wallstreetbets/comments/lf2d2m/super_bowl_commercial/,1612753185.0,"{'author': 'mturturro', 'created_utc': 1612753185, 'title': 'Super Bowl commercial', 'url': 'https://www.reddit.com/r/wallstreetbets/comments/lf2d2m/super_bowl_commercial/', 'created': 1612753185.0}",2021-02-08 02:59:45
47,schultzy99,1612753174,$MTBC is a deep value opportunity,https://stocktwits.com/DntGvAStock/message/285113680,1612753174.0,"{'author': 'schultzy99', 'created_utc': 1612753174, 'title': '$MTBC is a deep value opportunity', 'url': 'https://stocktwits.com/DntGvAStock/message/285113680', 'created': 1612753174.0}",2021-02-08 02:59:34
48,Nebula-Resident,1612753169,This person should share the STL files of his figurine,https://youtu.be/Z5pJQWU8_nc,1612753169.0,"{'author': 'Nebula-Resident', 'created_utc': 1612753169, 'title': 'This person should share the STL files of his figurine', 'url': 'https://youtu.be/Z5pJQWU8_nc', 'created': 1612753169.0}",2021-02-08 02:59:29
49,brianfisk10,1612753159,Your money went to a dogshit Super Bowl spot. Who's autistic now? (I am),https://www.reddit.com/r/wallstreetbets/comments/lf2crn/your_money_went_to_a_dogshit_super_bowl_spot_whos/,1612753159.0,"{'author': 'brianfisk10', 'created_utc': 1612753159, 'title': ""Your money went to a dogshit Super Bowl spot. Who's autistic now? (I am)"", 'url': 'https://www.reddit.com/r/wallstreetbets/comments/lf2crn/your_money_went_to_a_dogshit_super_bowl_spot_whos/', 'created': 1612753159.0}",2021-02-08 02:59:19
50,[deleted],1612753151,RobinHood in damage control,https://i.redd.it/dtk03rog56g61.png,1612753151.0,"{'author': '[deleted]', 'created_utc': 1612753151, 'title': 'RobinHood in damage control', 'url': 'https://i.redd.it/dtk03rog56g61.png', 'created': 1612753151.0}",2021-02-08 02:59:11
51,WheresTheReceipt,1612753148,Robinhood with the superbowl ad,https://i.redd.it/7ig2imsl56g61.jpg,1612753148.0,"{'author': 'WheresTheReceipt', 'created_utc': 1612753148, 'title': 'Robinhood with the superbowl ad', 'url': 'https://i.redd.it/7ig2imsl56g61.jpg', 'created': 1612753148.0}",2021-02-08 02:59:08
52,leavethisblank0,1612753143,"Okay guys, thoughts on FCAU stock after the Jeep ad tonight?",https://www.reddit.com/r/wallstreetbets/comments/lf2cl8/okay_guys_thoughts_on_fcau_stock_after_the_jeep/,1612753143.0,"{'author': 'leavethisblank0', 'created_utc': 1612753143, 'title': 'Okay guys, thoughts on FCAU stock after the Jeep ad tonight?', 'url': 'https://www.reddit.com/r/wallstreetbets/comments/lf2cl8/okay_guys_thoughts_on_fcau_stock_after_the_jeep/', 'created': 1612753143.0}",2021-02-08 02:59:03
53,alecd,1612753141,ROBINHOOD SUPERBOWL COMMERCIAL!! HA!,https://www.reddit.com/r/wallstreetbets/comments/lf2ckm/robinhood_superbowl_commercial_ha/,1612753141.0,"{'author': 'alecd', 'created_utc': 1612753141, 'title': 'ROBINHOOD SUPERBOWL COMMERCIAL!! HA!', 'url': 'https://www.reddit.com/r/wallstreetbets/comments/lf2ckm/robinhood_superbowl_commercial_ha/', 'created': 1612753141.0}",2021-02-08 02:59:01
54,United-Sherbet4778,1612753141,WOOF WOOF,https://www.reddit.com/r/wallstreetbets/comments/lf2ckl/woof_woof/,1612753141.0,"{'author': 'United-Sherbet4778', 'created_utc': 1612753141, 'title': 'WOOF WOOF', 'url': 'https://www.reddit.com/r/wallstreetbets/comments/lf2ckl/woof_woof/', 'created': 1612753141.0}",2021-02-08 02:59:01
55,Posthumos1,1612753132,Robinhood,https://www.reddit.com/r/wallstreetbets/comments/lf2chd/robinhood/,1612753132.0,"{'author': 'Posthumos1', 'created_utc': 1612753132, 'title': 'Robinhood', 'url': 'https://www.reddit.com/r/wallstreetbets/comments/lf2chd/robinhood/', 'created': 1612753132.0}",2021-02-08 02:58:52
56,Character_Rest6585,1612753130,Binance US,https://www.reddit.com/r/wallstreetbets/comments/lf2cg8/binance_us/,1612753130.0,"{'author': 'Character_Rest6585', 'created_utc': 1612753130, 'title': 'Binance US', 'url': 'https://www.reddit.com/r/wallstreetbets/comments/lf2cg8/binance_us/', 'created': 1612753130.0}",2021-02-08 02:58:50
57,pradyumnv,1612753130,papa reddit spent millions of dollars to acknowledge us. we did it bros.,https://www.reddit.com/r/wallstreetbets/comments/lf2cfz/papa_reddit_spent_millions_of_dollars_to/,1612753130.0,"{'author': 'pradyumnv', 'created_utc': 1612753130, 'title': 'papa reddit spent millions of dollars to acknowledge us. we did it bros.', 'url': 'https://www.reddit.com/r/wallstreetbets/comments/lf2cfz/papa_reddit_spent_millions_of_dollars_to/', 'created': 1612753130.0}",2021-02-08 02:58:50
58,Winner_McGee,1612753126,No shit.,https://i.redd.it/tz2pyl9j56g61.jpg,1612753126.0,"{'author': 'Winner_McGee', 'created_utc': 1612753126, 'title': 'No shit.', 'url': 'https://i.redd.it/tz2pyl9j56g61.jpg', 'created': 1612753126.0}",2021-02-08 02:58:46
59,inlighttrading,1612753124,That RH Superbowl ad was terrible...,https://www.reddit.com/r/wallstreetbets/comments/lf2cdx/that_rh_superbowl_ad_was_terrible/,1612753124.0,"{'author': 'inlighttrading', 'created_utc': 1612753124, 'title': 'That RH Superbowl ad was terrible...', 'url': 'https://www.reddit.com/r/wallstreetbets/comments/lf2cdx/that_rh_superbowl_ad_was_terrible/', 'created': 1612753124.0}",2021-02-08 02:58:44
60,LeVeloursRouge,1612753122,"This guy has a different outlook on GME, AMC.",https://www.reddit.com/r/wallstreetbets/comments/lf2cd0/this_guy_has_a_different_outlook_on_gme_amc/,1612753122.0,"{'author': 'LeVeloursRouge', 'created_utc': 1612753122, 'title': 'This guy has a different outlook on GME, AMC.', 'url': 'https://www.reddit.com/r/wallstreetbets/comments/lf2cd0/this_guy_has_a_different_outlook_on_gme_amc/', 'created': 1612753122.0}",2021-02-08 02:58:42
61,crackclown1997,1612753104,Robinhood really put up a Superbowl Ad 🤮🤮,https://www.reddit.com/r/wallstreetbets/comments/lf2c6w/robinhood_really_put_up_a_superbowl_ad/,1612753104.0,"{'author': 'crackclown1997', 'created_utc': 1612753104, 'title': 'Robinhood really put up a Superbowl Ad 🤮🤮', 'url': 'https://www.reddit.com/r/wallstreetbets/comments/lf2c6w/robinhood_really_put_up_a_superbowl_ad/', 'created': 1612753104.0}",2021-02-08 02:58:24
62,kaze919,1612753085,Imagine putting out a $5.5mil 30-second Super Bowl commercial while having liquidity issues,https://www.cnet.com/news/see-robinhood-do-damage-control-in-super-bowl-ad-aimed-at-small-investors/,1612753085.0,"{'author': 'kaze919', 'created_utc': 1612753085, 'title': 'Imagine putting out a $5.5mil 30-second Super Bowl commercial while having liquidity issues', 'url': 'https://www.cnet.com/news/see-robinhood-do-damage-control-in-super-bowl-ad-aimed-at-small-investors/', 'created': 1612753085.0}",2021-02-08 02:58:05
63,PossibleFit,1612753067,Thank you! This was absolutely brilliant!,https://www.reddit.com/r/wallstreetbets/comments/lf2br6/thank_you_this_was_absolutely_brilliant/,1612753067.0,"{'author': 'PossibleFit', 'created_utc': 1612753067, 'title': 'Thank you! This was absolutely brilliant!', 'url': 'https://www.reddit.com/r/wallstreetbets/comments/lf2br6/thank_you_this_was_absolutely_brilliant/', 'created': 1612753067.0}",2021-02-08 02:57:47
64,bombayguynewyork,1612753062,Robin Hood ad- YUCK!,https://www.reddit.com/r/wallstreetbets/comments/lf2bpb/robin_hood_ad_yuck/,1612753062.0,"{'author': 'bombayguynewyork', 'created_utc': 1612753062, 'title': 'Robin Hood ad- YUCK!', 'url': 'https://www.reddit.com/r/wallstreetbets/comments/lf2bpb/robin_hood_ad_yuck/', 'created': 1612753062.0}",2021-02-08 02:57:42
65,JayBoston617,1612753061,Super bowl Sunday...,https://i.redd.it/cs21lfjc56g61.jpg,1612753061.0,"{'author': 'JayBoston617', 'created_utc': 1612753061, 'title': 'Super bowl Sunday...', 'url': 'https://i.redd.it/cs21lfjc56g61.jpg', 'created': 1612753061.0}",2021-02-08 02:57:41
66,chrizerk,1612753059,I just released a funny little idle game about buying meme stonks. I bet someone will get a kick out of this lol,https://chrizerk.itch.io/gamestonks-money-is-power,1612753059.0,"{'author': 'chrizerk', 'created_utc': 1612753059, 'title': 'I just released a funny little idle game about buying meme stonks. I bet someone will get a kick out of this lol', 'url': 'https://chrizerk.itch.io/gamestonks-money-is-power', 'created': 1612753059.0}",2021-02-08 02:57:39
67,YewProJake,1612753057,Robinhood SB commercial. Lolz,https://www.reddit.com/r/wallstreetbets/comments/lf2bn1/robinhood_sb_commercial_lolz/,1612753057.0,"{'author': 'YewProJake', 'created_utc': 1612753057, 'title': 'Robinhood SB commercial. Lolz', 'url': 'https://www.reddit.com/r/wallstreetbets/comments/lf2bn1/robinhood_sb_commercial_lolz/', 'created': 1612753057.0}",2021-02-08 02:57:37
