,author,created_utc,title,url,created,d_,created_utc_dt
0,tomhomas,1598558100,Milestone Account Total Achieved,https://i.redd.it/0gnbmm6folj51.png,1598558100.0,"{'author': 'tomhomas', 'created_utc': 1598558100, 'title': 'Milestone Account Total Achieved', 'url': 'https://i.redd.it/0gnbmm6folj51.png', 'created': 1598558100.0}",2020-08-27 19:55:00
1,inactiveuser1964,1598557834,My 100% Tesla portfolio went tits up. From 3k to 32k...all the way down to -300 after forced liquidation,https://v.redd.it/bipq6lavmlj51,1598557834.0,"{'author': 'inactiveuser1964', 'created_utc': 1598557834, 'title': 'My 100% Tesla portfolio went tits up. From 3k to 32k...all the way down to -300 after forced liquidation', 'url': 'https://v.redd.it/bipq6lavmlj51', 'created': 1598557834.0}",2020-08-27 19:50:34
2,Tripper1,1598557723,Spotted in the wild. Can't afford TSLA,https://i.redd.it/vqw8qlfbnlj51.jpg,1598557723.0,"{'author': 'Tripper1', 'created_utc': 1598557723, 'title': ""Spotted in the wild. Can't afford TSLA"", 'url': 'https://i.redd.it/vqw8qlfbnlj51.jpg', 'created': 1598557723.0}",2020-08-27 19:48:43
3,tomhomas,1598557688,$3.98 over milestone account total,https://i.redd.it/16kt7m84nlj51.png,1598557688.0,"{'author': 'tomhomas', 'created_utc': 1598557688, 'title': '$3.98 over milestone account total', 'url': 'https://i.redd.it/16kt7m84nlj51.png', 'created': 1598557688.0}",2020-08-27 19:48:08
4,tsla-,1598557664,Will XPENG go up? It has to right?,https://www.reddit.com/r/wallstreetbets/comments/ihs3gp/will_xpeng_go_up_it_has_to_right/,1598557664.0,"{'author': 'tsla-', 'created_utc': 1598557664, 'title': 'Will XPENG go up? It has to right?', 'url': 'https://www.reddit.com/r/wallstreetbets/comments/ihs3gp/will_xpeng_go_up_it_has_to_right/', 'created': 1598557664.0}",2020-08-27 19:47:44
5,2020_TheYrOfBubbles,1598557637,ROCKET POWER!,https://www.reddit.com/r/wallstreetbets/comments/ihs34i/rocket_power/,1598557637.0,"{'author': '2020_TheYrOfBubbles', 'created_utc': 1598557637, 'title': 'ROCKET POWER!', 'url': 'https://www.reddit.com/r/wallstreetbets/comments/ihs34i/rocket_power/', 'created': 1598557637.0}",2020-08-27 19:47:17
6,I_Like_Tech_Drawings,1598557626,Can someone please tell me why I shouldn't buy a boat load of ERX $35c 1/2022 at what is currently only $55 per contract?,https://www.reddit.com/r/wallstreetbets/comments/ihs2zx/can_someone_please_tell_me_why_i_shouldnt_buy_a/,1598557626.0,"{'author': 'I_Like_Tech_Drawings', 'created_utc': 1598557626, 'title': ""Can someone please tell me why I shouldn't buy a boat load of ERX $35c 1/2022 at what is currently only $55 per contract?"", 'url': 'https://www.reddit.com/r/wallstreetbets/comments/ihs2zx/can_someone_please_tell_me_why_i_shouldnt_buy_a/', 'created': 1598557626.0}",2020-08-27 19:47:06
7,scrooplynooples,1598557587,The Best AAPL TA there ever was and will be!,https://www.reddit.com/r/wallstreetbets/comments/ihs2jj/the_best_aapl_ta_there_ever_was_and_will_be/,1598557587.0,"{'author': 'scrooplynooples', 'created_utc': 1598557587, 'title': 'The Best AAPL TA there ever was and will be!', 'url': 'https://www.reddit.com/r/wallstreetbets/comments/ihs2jj/the_best_aapl_ta_there_ever_was_and_will_be/', 'created': 1598557587.0}",2020-08-27 19:46:27
8,ChardsyDoesOneWeed,1598557482,what the fuck is a strangle?,https://www.reddit.com/r/wallstreetbets/comments/ihs1an/what_the_fuck_is_a_strangle/,1598557482.0,"{'author': 'ChardsyDoesOneWeed', 'created_utc': 1598557482, 'title': 'what the fuck is a strangle?', 'url': 'https://www.reddit.com/r/wallstreetbets/comments/ihs1an/what_the_fuck_is_a_strangle/', 'created': 1598557482.0}",2020-08-27 19:44:42
9,chormley,1598557424,Anybody else in $ABT gang calls?,https://i.redd.it/d8uwbjgfmlj51.jpg,1598557424.0,"{'author': 'chormley', 'created_utc': 1598557424, 'title': 'Anybody else in $ABT gang calls?', 'url': 'https://i.redd.it/d8uwbjgfmlj51.jpg', 'created': 1598557424.0}",2020-08-27 19:43:44
10,mrsimbau,1598557308,Nice play Oil and Gas,https://www.reddit.com/r/wallstreetbets/comments/ihrz6n/nice_play_oil_and_gas/,1598557308.0,"{'author': 'mrsimbau', 'created_utc': 1598557308, 'title': 'Nice play Oil and Gas', 'url': 'https://www.reddit.com/r/wallstreetbets/comments/ihrz6n/nice_play_oil_and_gas/', 'created': 1598557308.0}",2020-08-27 19:41:48
11,slugadug,1598557302,Yolo options they said,https://www.reddit.com/r/wallstreetbets/comments/ihrz3t/yolo_options_they_said/,1598557302.0,"{'author': 'slugadug', 'created_utc': 1598557302, 'title': 'Yolo options they said', 'url': 'https://www.reddit.com/r/wallstreetbets/comments/ihrz3t/yolo_options_they_said/', 'created': 1598557302.0}",2020-08-27 19:41:42
12,slugadug,1598557235,Yolo options they said,https://www.reddit.com/r/wallstreetbets/comments/ihryc0/yolo_options_they_said/,1598557235.0,"{'author': 'slugadug', 'created_utc': 1598557235, 'title': 'Yolo options they said', 'url': 'https://www.reddit.com/r/wallstreetbets/comments/ihryc0/yolo_options_they_said/', 'created': 1598557235.0}",2020-08-27 19:40:35
13,GBAgency,1598557233,"Fed’s dual mandate now single mandate. Inflation unbridled. Metals, anyone?",https://www.reddit.com/r/wallstreetbets/comments/ihrybc/feds_dual_mandate_now_single_mandate_inflation/,1598557233.0,"{'author': 'GBAgency', 'created_utc': 1598557233, 'title': 'Fed’s dual mandate now single mandate. Inflation unbridled. Metals, anyone?', 'url': 'https://www.reddit.com/r/wallstreetbets/comments/ihrybc/feds_dual_mandate_now_single_mandate_inflation/', 'created': 1598557233.0}",2020-08-27 19:40:33
14,absoluteScientific,1598556887,Tell me what calls to double down on. I’ll do anything you guys upvote,https://i.redd.it/7q0nc3anklj51.jpg,1598556887.0,"{'author': 'absoluteScientific', 'created_utc': 1598556887, 'title': 'Tell me what calls to double down on. I’ll do anything you guys upvote', 'url': 'https://i.redd.it/7q0nc3anklj51.jpg', 'created': 1598556887.0}",2020-08-27 19:34:47
15,Tennex1022,1598556847,"TSLA: This wasnt the 240 we wanted, but its the 240 we deserve.",https://i.redd.it/u0xihzrpklj51.jpg,1598556847.0,"{'author': 'Tennex1022', 'created_utc': 1598556847, 'title': 'TSLA: This wasnt the 240 we wanted, but its the 240 we deserve.', 'url': 'https://i.redd.it/u0xihzrpklj51.jpg', 'created': 1598556847.0}",2020-08-27 19:34:07
16,Dairul,1598556841,How retards feel when they get nuggets from an autists trading strategy,https://i.redd.it/f5whqf2pklj51.jpg,1598556841.0,"{'author': 'Dairul', 'created_utc': 1598556841, 'title': 'How retards feel when they get nuggets from an autists trading strategy', 'url': 'https://i.redd.it/f5whqf2pklj51.jpg', 'created': 1598556841.0}",2020-08-27 19:34:01
17,GBAgency,1598556687,"Fed just stated the dual-mandate is no longer a dual-mandate and that inflation will have its bridle removed. Metals, anyone?",https://www.reddit.com/r/wallstreetbets/comments/ihrrj9/fed_just_stated_the_dualmandate_is_no_longer_a/,1598556687.0,"{'author': 'GBAgency', 'created_utc': 1598556687, 'title': 'Fed just stated the dual-mandate is no longer a dual-mandate and that inflation will have its bridle removed. Metals, anyone?', 'url': 'https://www.reddit.com/r/wallstreetbets/comments/ihrrj9/fed_just_stated_the_dualmandate_is_no_longer_a/', 'created': 1598556687.0}",2020-08-27 19:31:27
18,mrsimbau,1598556667,Why is oil and gas in Texas going up ?,https://www.reddit.com/r/wallstreetbets/comments/ihrr9x/why_is_oil_and_gas_in_texas_going_up/,1598556667.0,"{'author': 'mrsimbau', 'created_utc': 1598556667, 'title': 'Why is oil and gas in Texas going up ?', 'url': 'https://www.reddit.com/r/wallstreetbets/comments/ihrr9x/why_is_oil_and_gas_in_texas_going_up/', 'created': 1598556667.0}",2020-08-27 19:31:07
19,Pharaoh415,1598556659,I was so close😭😭,https://i.redd.it/zo0vm4o5klj51.jpg,1598556659.0,"{'author': 'Pharaoh415', 'created_utc': 1598556659, 'title': 'I was so close😭😭', 'url': 'https://i.redd.it/zo0vm4o5klj51.jpg', 'created': 1598556659.0}",2020-08-27 19:30:59
20,absoluteScientific,1598556606,Which options to double down on or buy to open? I’ll do anything you guys upvote the most (pls don’t make me yolo on spy puts),https://i.redd.it/zfz6gclyjlj51.jpg,1598556606.0,"{'author': 'absoluteScientific', 'created_utc': 1598556606, 'title': 'Which options to double down on or buy to open? I’ll do anything you guys upvote the most (pls don’t make me yolo on spy puts)', 'url': 'https://i.redd.it/zfz6gclyjlj51.jpg', 'created': 1598556606.0}",2020-08-27 19:30:06
21,Nacujo,1598556490,Big Lots! (BIG) Set to Post a $2.7/share price on Stock - Up from $0.53/share last year - Earnings Call tomorrow morning!,https://www.reddit.com/r/wallstreetbets/comments/ihrp3n/big_lots_big_set_to_post_a_27share_price_on_stock/,1598556490.0,"{'author': 'Nacujo', 'created_utc': 1598556490, 'title': 'Big Lots! (BIG) Set to Post a $2.7/share price on Stock - Up from $0.53/share last year - Earnings Call tomorrow morning!', 'url': 'https://www.reddit.com/r/wallstreetbets/comments/ihrp3n/big_lots_big_set_to_post_a_27share_price_on_stock/', 'created': 1598556490.0}",2020-08-27 19:28:10
22,LavenderAutist,1598556465,Trump Word Soup &amp; Winner Winner KFC Dinners,https://www.reddit.com/r/wallstreetbets/comments/ihrot3/trump_word_soup_winner_winner_kfc_dinners/,1598556465.0,"{'author': 'LavenderAutist', 'created_utc': 1598556465, 'title': 'Trump Word Soup &amp; Winner Winner KFC Dinners', 'url': 'https://www.reddit.com/r/wallstreetbets/comments/ihrot3/trump_word_soup_winner_winner_kfc_dinners/', 'created': 1598556465.0}",2020-08-27 19:27:45
23,whothatcodeguy,1598556420,I hacked together a site that loads the daily discussion thread and auto formats all ticker symbols to load the chart on click,https://v.redd.it/wyege2nw5lj51,1598556420.0,"{'author': 'whothatcodeguy', 'created_utc': 1598556420, 'title': 'I hacked together a site that loads the daily discussion thread and auto formats all ticker symbols to load the chart on click', 'url': 'https://v.redd.it/wyege2nw5lj51', 'created': 1598556420.0}",2020-08-27 19:27:00
24,CannedOxygen,1598556073,Curious to know how much theta will eat into this tomorrow? What’s the rate of decline?,https://i.redd.it/cozy09xeilj51.jpg,1598556073.0,"{'author': 'CannedOxygen', 'created_utc': 1598556073, 'title': 'Curious to know how much theta will eat into this tomorrow? What’s the rate of decline?', 'url': 'https://i.redd.it/cozy09xeilj51.jpg', 'created': 1598556073.0}",2020-08-27 19:21:13
25,mrsimbau,1598556041,Expected Oil and gas to come down but got F*CKed!,https://www.reddit.com/r/wallstreetbets/comments/ihrjpq/expected_oil_and_gas_to_come_down_but_got_fcked/,1598556041.0,"{'author': 'mrsimbau', 'created_utc': 1598556041, 'title': 'Expected Oil and gas to come down but got F*CKed!', 'url': 'https://www.reddit.com/r/wallstreetbets/comments/ihrjpq/expected_oil_and_gas_to_come_down_but_got_fcked/', 'created': 1598556041.0}",2020-08-27 19:20:41
26,CannedOxygen,1598555859,"Just curious how much theta will eat into this tomorrow? I bought Monday morning at the ath and have been doubling down on the dips ever since. My average for the $500 call is 9.96. If there is a god, his name is Tim Cook. 🙏🏼",https://i.redd.it/ai2m7cwrhlj51.jpg,1598555859.0,"{'author': 'CannedOxygen', 'created_utc': 1598555859, 'title': 'Just curious how much theta will eat into this tomorrow? I bought Monday morning at the ath and have been doubling down on the dips ever since. My average for the $500 call is 9.96. If there is a god, his name is Tim Cook. 🙏🏼', 'url': 'https://i.redd.it/ai2m7cwrhlj51.jpg', 'created': 1598555859.0}",2020-08-27 19:17:39
27,betswallstreet,1598555741,Robinhoods UI is TO good,https://www.reddit.com/r/wallstreetbets/comments/ihrg0x/robinhoods_ui_is_to_good/,1598555741.0,"{'author': 'betswallstreet', 'created_utc': 1598555741, 'title': 'Robinhoods UI is TO good', 'url': 'https://www.reddit.com/r/wallstreetbets/comments/ihrg0x/robinhoods_ui_is_to_good/', 'created': 1598555741.0}",2020-08-27 19:15:41
28,wjohnsto,1598555663,Salute to the one retard on this subreddit doing $WORK,https://www.reddit.com/r/wallstreetbets/comments/ihrf3t/salute_to_the_one_retard_on_this_subreddit_doing/,1598555663.0,"{'author': 'wjohnsto', 'created_utc': 1598555663, 'title': 'Salute to the one retard on this subreddit doing $WORK', 'url': 'https://www.reddit.com/r/wallstreetbets/comments/ihrf3t/salute_to_the_one_retard_on_this_subreddit_doing/', 'created': 1598555663.0}",2020-08-27 19:14:23
29,wonderingwhite,1598555545,"Want to start trading options, any advice?",https://www.reddit.com/r/wallstreetbets/comments/ihrdo8/want_to_start_trading_options_any_advice/,1598555545.0,"{'author': 'wonderingwhite', 'created_utc': 1598555545, 'title': 'Want to start trading options, any advice?', 'url': 'https://www.reddit.com/r/wallstreetbets/comments/ihrdo8/want_to_start_trading_options_any_advice/', 'created': 1598555545.0}",2020-08-27 19:12:25
30,beef_the_shmeef,1598555528,The market actually makes sense if you think about it,https://www.businessinsider.com/stock-market-record-high-rising-economy-pandemic-data-divergence-2020-8?amp,1598555528.0,"{'author': 'beef_the_shmeef', 'created_utc': 1598555528, 'title': 'The market actually makes sense if you think about it', 'url': 'https://www.businessinsider.com/stock-market-record-high-rising-economy-pandemic-data-divergence-2020-8?amp', 'created': 1598555528.0}",2020-08-27 19:12:08
31,stopthecirclejerc,1598555489,I did something stupid... FB 08/28/2020 300.00 C,https://www.reddit.com/r/wallstreetbets/comments/ihrcyp/i_did_something_stupid_fb_08282020_30000_c/,1598555489.0,"{'author': 'stopthecirclejerc', 'created_utc': 1598555489, 'title': 'I did something stupid... FB 08/28/2020 300.00 C', 'url': 'https://www.reddit.com/r/wallstreetbets/comments/ihrcyp/i_did_something_stupid_fb_08282020_30000_c/', 'created': 1598555489.0}",2020-08-27 19:11:29
32,gimpgrunt,1598555451,When people start spamming videos on WSB,https://i.redd.it/val5bt8kglj51.jpg,1598555451.0,"{'author': 'gimpgrunt', 'created_utc': 1598555451, 'title': 'When people start spamming videos on WSB', 'url': 'https://i.redd.it/val5bt8kglj51.jpg', 'created': 1598555451.0}",2020-08-27 19:10:51
33,OpportunityKnockin,1598555424,Feel free to roast. Maybe I’ll learn something.,https://i.redd.it/5x9ceschglj51.jpg,1598555424.0,"{'author': 'OpportunityKnockin', 'created_utc': 1598555424, 'title': 'Feel free to roast. Maybe I’ll learn something.', 'url': 'https://i.redd.it/5x9ceschglj51.jpg', 'created': 1598555424.0}",2020-08-27 19:10:24
34,akfortyevan,1598555357,Runescape clan chat for stock options.,https://www.reddit.com/r/wallstreetbets/comments/ihrbbo/runescape_clan_chat_for_stock_options/,1598555357.0,"{'author': 'akfortyevan', 'created_utc': 1598555357, 'title': 'Runescape clan chat for stock options.', 'url': 'https://www.reddit.com/r/wallstreetbets/comments/ihrbbo/runescape_clan_chat_for_stock_options/', 'created': 1598555357.0}",2020-08-27 19:09:17
35,akfortyevan,1598555279,Runescape clan chat for stocks?,https://www.reddit.com/r/wallstreetbets/comments/ihrads/runescape_clan_chat_for_stocks/,1598555279.0,"{'author': 'akfortyevan', 'created_utc': 1598555279, 'title': 'Runescape clan chat for stocks?', 'url': 'https://www.reddit.com/r/wallstreetbets/comments/ihrads/runescape_clan_chat_for_stocks/', 'created': 1598555279.0}",2020-08-27 19:07:59
36,AJFiasco,1598555104,Free 3k tendies 💵 🌈,https://www.reddit.com/r/wallstreetbets/comments/ihr894/free_3k_tendies/,1598555104.0,"{'author': 'AJFiasco', 'created_utc': 1598555104, 'title': 'Free 3k tendies 💵 🌈', 'url': 'https://www.reddit.com/r/wallstreetbets/comments/ihr894/free_3k_tendies/', 'created': 1598555104.0}",2020-08-27 19:05:04
37,anal_casanova,1598555048,"Now I owe two hobos $5 each because Sweet Baby Jesus manipulated WMT for me. I'm as good as my word, Baby Jesus. You know this about me.",https://www.reddit.com/r/wallstreetbets/comments/ihr7k1/now_i_owe_two_hobos_5_each_because_sweet_baby/,1598555048.0,"{'author': 'anal_casanova', 'created_utc': 1598555048, 'title': ""Now I owe two hobos $5 each because Sweet Baby Jesus manipulated WMT for me. I'm as good as my word, Baby Jesus. You know this about me."", 'url': 'https://www.reddit.com/r/wallstreetbets/comments/ihr7k1/now_i_owe_two_hobos_5_each_because_sweet_baby/', 'created': 1598555048.0}",2020-08-27 19:04:08
38,joey_tv_show,1598554889,Anyone here shorting Tesla?,https://www.reddit.com/r/wallstreetbets/comments/ihr5gc/anyone_here_shorting_tesla/,1598554889.0,"{'author': 'joey_tv_show', 'created_utc': 1598554889, 'title': 'Anyone here shorting Tesla?', 'url': 'https://www.reddit.com/r/wallstreetbets/comments/ihr5gc/anyone_here_shorting_tesla/', 'created': 1598554889.0}",2020-08-27 19:01:29
39,joey_tv_show,1598554657,Anyone here shorting Telsa? Have you in the past? What are you thinking right now? Also why do you think you should short Telsa?,https://www.reddit.com/r/wallstreetbets/comments/ihr2oa/anyone_here_shorting_telsa_have_you_in_the_past/,1598554657.0,"{'author': 'joey_tv_show', 'created_utc': 1598554657, 'title': 'Anyone here shorting Telsa? Have you in the past? What are you thinking right now? Also why do you think you should short Telsa?', 'url': 'https://www.reddit.com/r/wallstreetbets/comments/ihr2oa/anyone_here_shorting_telsa_have_you_in_the_past/', 'created': 1598554657.0}",2020-08-27 18:57:37
40,ImperfectAnswer,1598554382,LI china numba 1,https://www.reddit.com/r/wallstreetbets/comments/ihqzjz/li_china_numba_1/,1598554382.0,"{'author': 'ImperfectAnswer', 'created_utc': 1598554382, 'title': 'LI china numba 1', 'url': 'https://www.reddit.com/r/wallstreetbets/comments/ihqzjz/li_china_numba_1/', 'created': 1598554382.0}",2020-08-27 18:53:02
41,stevenguyen201,1598554377,Opinion on XPEV,https://www.reddit.com/r/wallstreetbets/comments/ihqzi1/opinion_on_xpev/,1598554377.0,"{'author': 'stevenguyen201', 'created_utc': 1598554377, 'title': 'Opinion on XPEV', 'url': 'https://www.reddit.com/r/wallstreetbets/comments/ihqzi1/opinion_on_xpev/', 'created': 1598554377.0}",2020-08-27 18:52:57
42,Markley628,1598554242,Robinhood force close spreads,https://www.reddit.com/r/wallstreetbets/comments/ihqxw2/robinhood_force_close_spreads/,1598554242.0,"{'author': 'Markley628', 'created_utc': 1598554242, 'title': 'Robinhood force close spreads', 'url': 'https://www.reddit.com/r/wallstreetbets/comments/ihqxw2/robinhood_force_close_spreads/', 'created': 1598554242.0}",2020-08-27 18:50:42
43,joedacto,1598554099,Why won't the stimulus cause inflation?,https://www.reddit.com/r/wallstreetbets/comments/ihqw88/why_wont_the_stimulus_cause_inflation/,1598554099.0,"{'author': 'joedacto', 'created_utc': 1598554099, 'title': ""Why won't the stimulus cause inflation?"", 'url': 'https://www.reddit.com/r/wallstreetbets/comments/ihqw88/why_wont_the_stimulus_cause_inflation/', 'created': 1598554099.0}",2020-08-27 18:48:19
44,BedtimeTorture,1598554098,WSB Bears pulling up to the market with their puts,https://v.redd.it/3tswjo3jclj51,1598554098.0,"{'author': 'BedtimeTorture', 'created_utc': 1598554098, 'title': 'WSB Bears pulling up to the market with their puts', 'url': 'https://v.redd.it/3tswjo3jclj51', 'created': 1598554098.0}",2020-08-27 18:48:18
45,georgecostanzastoe,1598554096,First option my fellow autists! How bad did I do?,https://i.redd.it/dxfxj5ajclj51.jpg,1598554096.0,"{'author': 'georgecostanzastoe', 'created_utc': 1598554096, 'title': 'First option my fellow autists! How bad did I do?', 'url': 'https://i.redd.it/dxfxj5ajclj51.jpg', 'created': 1598554096.0}",2020-08-27 18:48:16
46,AviationAtom,1598554077,J-Pow slides into my inbox with that sweet stimulus,https://i.redd.it/n8tfgx6fclj51.png,1598554077.0,"{'author': 'AviationAtom', 'created_utc': 1598554077, 'title': 'J-Pow slides into my inbox with that sweet stimulus', 'url': 'https://i.redd.it/n8tfgx6fclj51.png', 'created': 1598554077.0}",2020-08-27 18:47:57
47,laflair90210,1598554057,New house on the way,https://www.reddit.com/gallery/ihqvqv,1598554057.0,"{'author': 'laflair90210', 'created_utc': 1598554057, 'title': 'New house on the way', 'url': 'https://www.reddit.com/gallery/ihqvqv', 'created': 1598554057.0}",2020-08-27 18:47:37
48,furrypurpledinosaur,1598553880,Funny Tesla Screenshot,https://i.redd.it/p7cbdb1tblj51.png,1598553880.0,"{'author': 'furrypurpledinosaur', 'created_utc': 1598553880, 'title': 'Funny Tesla Screenshot', 'url': 'https://i.redd.it/p7cbdb1tblj51.png', 'created': 1598553880.0}",2020-08-27 18:44:40
49,the420chronicler,1598553869,Warren Buffet is going to sue the Central Banks for manipulating the Gold market when his Barrick Gold investment ends up sucking wind.,https://www.reddit.com/r/wallstreetbets/comments/ihqtm2/warren_buffet_is_going_to_sue_the_central_banks/,1598553869.0,"{'author': 'the420chronicler', 'created_utc': 1598553869, 'title': 'Warren Buffet is going to sue the Central Banks for manipulating the Gold market when his Barrick Gold investment ends up sucking wind.', 'url': 'https://www.reddit.com/r/wallstreetbets/comments/ihqtm2/warren_buffet_is_going_to_sue_the_central_banks/', 'created': 1598553869.0}",2020-08-27 18:44:29
50,laflair90210,1598553776,"Both accounts have me dreaming of a new house very soon, I dont yolo, yolo is for 🤡, theta strategies is the smart way just saying 🤷‍♂️",https://www.reddit.com/gallery/ihqsif,1598553776.0,"{'author': 'laflair90210', 'created_utc': 1598553776, 'title': 'Both accounts have me dreaming of a new house very soon, I dont yolo, yolo is for 🤡, theta strategies is the smart way just saying 🤷\u200d♂️', 'url': 'https://www.reddit.com/gallery/ihqsif', 'created': 1598553776.0}",2020-08-27 18:42:56
51,TheOne7711,1598553763,MSFT Practice Account,https://i.redd.it/fhrsi98iblj51.png,1598553763.0,"{'author': 'TheOne7711', 'created_utc': 1598553763, 'title': 'MSFT Practice Account', 'url': 'https://i.redd.it/fhrsi98iblj51.png', 'created': 1598553763.0}",2020-08-27 18:42:43
52,DidntGetJoke,1598553497,All aboard the CHEW CHEW TRAIN!,https://www.reddit.com/r/wallstreetbets/comments/ihqp9o/all_aboard_the_chew_chew_train/,1598553497.0,"{'author': 'DidntGetJoke', 'created_utc': 1598553497, 'title': 'All aboard the CHEW CHEW TRAIN!', 'url': 'https://www.reddit.com/r/wallstreetbets/comments/ihqp9o/all_aboard_the_chew_chew_train/', 'created': 1598553497.0}",2020-08-27 18:38:17
53,EatAnimals_Yum,1598553402,A gay bear can still buy General Mills (GIS) calls because of the rainbow marshmallows.,https://i.redd.it/b5hacmto8lj51.jpg,1598553402.0,"{'author': 'EatAnimals_Yum', 'created_utc': 1598553402, 'title': 'A gay bear can still buy General Mills (GIS) calls because of the rainbow marshmallows.', 'url': 'https://i.redd.it/b5hacmto8lj51.jpg', 'created': 1598553402.0}",2020-08-27 18:36:42
54,qjk03,1598553386,Found this on my gallon of milk from Costco today... 9/18 $165 puts anyone?,https://i.redd.it/93pue86falj51.jpg,1598553386.0,"{'author': 'qjk03', 'created_utc': 1598553386, 'title': 'Found this on my gallon of milk from Costco today... 9/18 $165 puts anyone?', 'url': 'https://i.redd.it/93pue86falj51.jpg', 'created': 1598553386.0}",2020-08-27 18:36:26
55,echosx,1598553355,Looks like the Miami PD has a special unit for dealing with you fuckers,https://twitter.com/MiamiPD/status/1298667203064139776?,1598553355.0,"{'author': 'echosx', 'created_utc': 1598553355, 'title': 'Looks like the Miami PD has a special unit for dealing with you fuckers', 'url': 'https://twitter.com/MiamiPD/status/1298667203064139776?', 'created': 1598553355.0}",2020-08-27 18:35:55
56,loveisus12,1598553347,Hertz for one last hurrah???,https://www.reddit.com/r/wallstreetbets/comments/ihqni7/hertz_for_one_last_hurrah/,1598553347.0,"{'author': 'loveisus12', 'created_utc': 1598553347, 'title': 'Hertz for one last hurrah???', 'url': 'https://www.reddit.com/r/wallstreetbets/comments/ihqni7/hertz_for_one_last_hurrah/', 'created': 1598553347.0}",2020-08-27 18:35:47
57,ElNinoDelGato,1598553176,From bag holding to best day ever. 8/28 Walmart 135C,https://i.redd.it/cghecurs9lj51.jpg,1598553176.0,"{'author': 'ElNinoDelGato', 'created_utc': 1598553176, 'title': 'From bag holding to best day ever. 8/28 Walmart 135C', 'url': 'https://i.redd.it/cghecurs9lj51.jpg', 'created': 1598553176.0}",2020-08-27 18:32:56
58,mbacon1998,1598553042,Another EV IPO today!!! is it going to moon??,https://www.reddit.com/r/wallstreetbets/comments/ihqjzt/another_ev_ipo_today_is_it_going_to_moon/,1598553042.0,"{'author': 'mbacon1998', 'created_utc': 1598553042, 'title': 'Another EV IPO today!!! is it going to moon??', 'url': 'https://www.reddit.com/r/wallstreetbets/comments/ihqjzt/another_ev_ipo_today_is_it_going_to_moon/', 'created': 1598553042.0}",2020-08-27 18:30:42
59,tendies4life69,1598553032,Last chance to get on the turtle train. Moon or bust.,https://i.redd.it/utssrz1d9lj51.jpg,1598553032.0,"{'author': 'tendies4life69', 'created_utc': 1598553032, 'title': 'Last chance to get on the turtle train. Moon or bust.', 'url': 'https://i.redd.it/utssrz1d9lj51.jpg', 'created': 1598553032.0}",2020-08-27 18:30:32
60,the420chronicler,1598552887,Just wait for Warren Buffet to get frustrated when his Barrick Gold investment returns are negated by the blatant price manipulation of the Gold market.,https://www.reddit.com/r/wallstreetbets/comments/ihqi5u/just_wait_for_warren_buffet_to_get_frustrated/,1598552887.0,"{'author': 'the420chronicler', 'created_utc': 1598552887, 'title': 'Just wait for Warren Buffet to get frustrated when his Barrick Gold investment returns are negated by the blatant price manipulation of the Gold market.', 'url': 'https://www.reddit.com/r/wallstreetbets/comments/ihqi5u/just_wait_for_warren_buffet_to_get_frustrated/', 'created': 1598552887.0}",2020-08-27 18:28:07
