,author,created_utc,title,url,created,d_,created_utc_dt
0,bulemart,1617105576,Amazon got in the new somehow. https://www.reuters.com/article/us-gamestop-elliott-wilke/gamestop-names-amazon-executive-as-chief-growth-officer-idUSKBN2BM1CT,https://i.redd.it/1c5l0hxln5q61.jpg,1617105576.0,"{'author': 'bulemart', 'created_utc': 1617105576, 'title': 'Amazon got in the new somehow. https://www.reuters.com/article/us-gamestop-elliott-wilke/gamestop-names-amazon-executive-as-chief-growth-officer-idUSKBN2BM1CT', 'url': 'https://i.redd.it/1c5l0hxln5q61.jpg', 'created': 1617105576.0}",2021-03-30 11:59:36
1,writingstuffisfun,1617105551,GameStop names Amazon executive as chief growth officer - Reuters,https://www.reddit.com/r/wallstreetbets/comments/mgebvq/gamestop_names_amazon_executive_as_chief_growth/,1617105551.0,"{'author': 'writingstuffisfun', 'created_utc': 1617105551, 'title': 'GameStop names Amazon executive as chief growth officer - Reuters', 'url': 'https://www.reddit.com/r/wallstreetbets/comments/mgebvq/gamestop_names_amazon_executive_as_chief_growth/', 'created': 1617105551.0}",2021-03-30 11:59:11
2,McKeagney,1617105398,Could be lining up for a good day 🚀,https://i.redd.it/xym0f2v2n5q61.jpg,1617105398.0,"{'author': 'McKeagney', 'created_utc': 1617105398, 'title': 'Could be lining up for a good day 🚀', 'url': 'https://i.redd.it/xym0f2v2n5q61.jpg', 'created': 1617105398.0}",2021-03-30 11:56:38
3,jab116,1617105396,GameStop hires Amazon executive as chief growth officer in e-commerce shift,https://www.reuters.com/article/us-gamestop-elliott-wilke/gamestop-names-amazon-executive-as-chief-growth-officer-idUSKBN2BM1CT,1617105396.0,"{'author': 'jab116', 'created_utc': 1617105396, 'title': 'GameStop hires Amazon executive as chief growth officer in e-commerce shift', 'url': 'https://www.reuters.com/article/us-gamestop-elliott-wilke/gamestop-names-amazon-executive-as-chief-growth-officer-idUSKBN2BM1CT', 'created': 1617105396.0}",2021-03-30 11:56:36
4,OriginalGoatan,1617105338,Shitadel and friends want my name and address...... Can't hold a pen when my hands are made of diamonds 💎🙌,https://i.redd.it/o1bcb9dwm5q61.jpg,1617105338.0,"{'author': 'OriginalGoatan', 'created_utc': 1617105338, 'title': ""Shitadel and friends want my name and address...... Can't hold a pen when my hands are made of diamonds 💎🙌"", 'url': 'https://i.redd.it/o1bcb9dwm5q61.jpg', 'created': 1617105338.0}",2021-03-30 11:55:38
5,Quidahm,1617105335,NFT's,https://www.reddit.com/r/wallstreetbets/comments/mge9ll/nfts/,1617105335.0,"{'author': 'Quidahm', 'created_utc': 1617105335, 'title': ""NFT's"", 'url': 'https://www.reddit.com/r/wallstreetbets/comments/mge9ll/nfts/', 'created': 1617105335.0}",2021-03-30 11:55:35
6,Black_doflamingo,1617105248,MODS please Don’t Delete this. GME is outlining their business structure and transformation! WHY IS NO MEDIA TALKING ABOUT THIS?,https://i.redd.it/6pc2yhvmm5q61.jpg,1617105248.0,"{'author': 'Black_doflamingo', 'created_utc': 1617105248, 'title': 'MODS please Don’t Delete this. GME is outlining their business structure and transformation! WHY IS NO MEDIA TALKING ABOUT THIS?', 'url': 'https://i.redd.it/6pc2yhvmm5q61.jpg', 'created': 1617105248.0}",2021-03-30 11:54:08
7,playingdrumsonmars,1617105202,$GME $RKT $AMC - interesting spike in sync just now - discuss please,https://www.reddit.com/r/wallstreetbets/comments/mge887/gme_rkt_amc_interesting_spike_in_sync_just_now/,1617105202.0,"{'author': 'playingdrumsonmars', 'created_utc': 1617105202, 'title': '$GME $RKT $AMC - interesting spike in sync just now - discuss please', 'url': 'https://www.reddit.com/r/wallstreetbets/comments/mge887/gme_rkt_amc_interesting_spike_in_sync_just_now/', 'created': 1617105202.0}",2021-03-30 11:53:22
8,Hoopes-there-it-is,1617105201,What my friends think every time I talk about GME..,https://i.redd.it/awetofthm5q61.jpg,1617105201.0,"{'author': 'Hoopes-there-it-is', 'created_utc': 1617105201, 'title': 'What my friends think every time I talk about GME..', 'url': 'https://i.redd.it/awetofthm5q61.jpg', 'created': 1617105201.0}",2021-03-30 11:53:21
9,BiscottiHoliday,1617105178,Apparently motley fool Doesn’t like sundial. The fackers.......,https://www.fool.com/investing/2021/03/30/2-cannabis-stocks-to-avoid-no-matter-what/?source=eptyholnk0000202&amp;utm_source=yahoo-host&amp;utm_medium=feed&amp;utm_campaign=article&amp;yptr=yahoo,1617105178.0,"{'author': 'BiscottiHoliday', 'created_utc': 1617105178, 'title': 'Apparently motley fool Doesn’t like sundial. The fackers.......', 'url': 'https://www.fool.com/investing/2021/03/30/2-cannabis-stocks-to-avoid-no-matter-what/?source=eptyholnk0000202&amp;utm_source=yahoo-host&amp;utm_medium=feed&amp;utm_campaign=article&amp;yptr=yahoo', 'created': 1617105178.0}",2021-03-30 11:52:58
10,hexrei,1617105132,Skip the moon,https://www.reddit.com/r/wallstreetbets/comments/mge7g7/skip_the_moon/,1617105132.0,"{'author': 'hexrei', 'created_utc': 1617105132, 'title': 'Skip the moon', 'url': 'https://www.reddit.com/r/wallstreetbets/comments/mge7g7/skip_the_moon/', 'created': 1617105132.0}",2021-03-30 11:52:12
11,Aufngr,1617105130,Yahoo Finance creating FUD for the bulls,https://finance.yahoo.com/news/sp500-earnings-estimates-revised-down-morning-brief-102657494.html,1617105130.0,"{'author': 'Aufngr', 'created_utc': 1617105130, 'title': 'Yahoo Finance creating FUD for the bulls', 'url': 'https://finance.yahoo.com/news/sp500-earnings-estimates-revised-down-morning-brief-102657494.html', 'created': 1617105130.0}",2021-03-30 11:52:10
12,peterinjapan,1617105041,The most terrifying image to see in the morning…,https://i.redd.it/v8zoswm0m5q61.jpg,1617105041.0,"{'author': 'peterinjapan', 'created_utc': 1617105041, 'title': 'The most terrifying image to see in the morning…', 'url': 'https://i.redd.it/v8zoswm0m5q61.jpg', 'created': 1617105041.0}",2021-03-30 11:50:41
13,ReggieLab,1617105038,SCR on the move with its online betting,https://www.reddit.com/r/wallstreetbets/comments/mge6gi/scr_on_the_move_with_its_online_betting/,1617105038.0,"{'author': 'ReggieLab', 'created_utc': 1617105038, 'title': 'SCR on the move with its online betting', 'url': 'https://www.reddit.com/r/wallstreetbets/comments/mge6gi/scr_on_the_move_with_its_online_betting/', 'created': 1617105038.0}",2021-03-30 11:50:38
14,financialtouchtrades,1617105023,"GameStop names Amazon exec Elliot Wilke chief growth officer, adds two former Chewy's managers to roster. Get strapped in, this rocket is fueled the fuck up and ready to lift off.",https://i.redd.it/kvzlvtkvl5q61.jpg,1617105023.0,"{'author': 'financialtouchtrades', 'created_utc': 1617105023, 'title': ""GameStop names Amazon exec Elliot Wilke chief growth officer, adds two former Chewy's managers to roster. Get strapped in, this rocket is fueled the fuck up and ready to lift off."", 'url': 'https://i.redd.it/kvzlvtkvl5q61.jpg', 'created': 1617105023.0}",2021-03-30 11:50:23
15,peterinjapan,1617105004,The most terrifying image to see in the morning…,https://i.redd.it/0j6089nwl5q61.jpg,1617105004.0,"{'author': 'peterinjapan', 'created_utc': 1617105004, 'title': 'The most terrifying image to see in the morning…', 'url': 'https://i.redd.it/0j6089nwl5q61.jpg', 'created': 1617105004.0}",2021-03-30 11:50:04
16,Known_Abrocoma9214,1617104988,"$20b margin call? No problem! We like dips! Ranch, salsa, cheese. All that.",https://i.redd.it/bmomfvyul5q61.jpg,1617104988.0,"{'author': 'Known_Abrocoma9214', 'created_utc': 1617104988, 'title': '$20b margin call? No problem! We like dips! Ranch, salsa, cheese. All that.', 'url': 'https://i.redd.it/bmomfvyul5q61.jpg', 'created': 1617104988.0}",2021-03-30 11:49:48
17,bosdan80,1617104979,Fellow Apes in Stock/Nose Picking Contest,https://youtu.be/teByg0iMs6w,1617104979.0,"{'author': 'bosdan80', 'created_utc': 1617104979, 'title': 'Fellow Apes in Stock/Nose Picking Contest', 'url': 'https://youtu.be/teByg0iMs6w', 'created': 1617104979.0}",2021-03-30 11:49:39
18,queenshwarna,1617104969,What's happening now?,https://i.redd.it/lxdggdqsl5q61.jpg,1617104969.0,"{'author': 'queenshwarna', 'created_utc': 1617104969, 'title': ""What's happening now?"", 'url': 'https://i.redd.it/lxdggdqsl5q61.jpg', 'created': 1617104969.0}",2021-03-30 11:49:29
19,skippy65,1617104963,Just noticed this while watching an anti-Corona protest video from yesterday in the Netherlands,https://i.imgur.com/pms1wPH.png,1617104963.0,"{'author': 'skippy65', 'created_utc': 1617104963, 'title': 'Just noticed this while watching an anti-Corona protest video from yesterday in the Netherlands', 'url': 'https://i.imgur.com/pms1wPH.png', 'created': 1617104963.0}",2021-03-30 11:49:23
20,smokebreak1440,1617104948,THE SQUEEZE,https://www.reddit.com/r/wallstreetbets/comments/mge5hc/the_squeeze/,1617104948.0,"{'author': 'smokebreak1440', 'created_utc': 1617104948, 'title': 'THE SQUEEZE', 'url': 'https://www.reddit.com/r/wallstreetbets/comments/mge5hc/the_squeeze/', 'created': 1617104948.0}",2021-03-30 11:49:08
21,connsack,1617104940,Yahoo Finance is doing their best to try and be hip but yet still has GME listed as “overvalued”,https://i.redd.it/bfvgjkrpl5q61.jpg,1617104940.0,"{'author': 'connsack', 'created_utc': 1617104940, 'title': 'Yahoo Finance is doing their best to try and be hip but yet still has GME listed as “overvalued”', 'url': 'https://i.redd.it/bfvgjkrpl5q61.jpg', 'created': 1617104940.0}",2021-03-30 11:49:00
22,the-average-cook,1617104847,HEMP it up...,https://www.reddit.com/r/wallstreetbets/comments/mge4h1/hemp_it_up/,1617104847.0,"{'author': 'the-average-cook', 'created_utc': 1617104847, 'title': 'HEMP it up...', 'url': 'https://www.reddit.com/r/wallstreetbets/comments/mge4h1/hemp_it_up/', 'created': 1617104847.0}",2021-03-30 11:47:27
23,PerfectBake420,1617104777,I need help at AMC so I don't have to eat my Thursday calls.,https://www.reddit.com/r/wallstreetbets/comments/mge3q2/i_need_help_at_amc_so_i_dont_have_to_eat_my/,1617104777.0,"{'author': 'PerfectBake420', 'created_utc': 1617104777, 'title': ""I need help at AMC so I don't have to eat my Thursday calls."", 'url': 'https://www.reddit.com/r/wallstreetbets/comments/mge3q2/i_need_help_at_amc_so_i_dont_have_to_eat_my/', 'created': 1617104777.0}",2021-03-30 11:46:17
24,Embarrassed_Truck_94,1617104776,CCIV🤫🤑,https://www.reddit.com/r/wallstreetbets/comments/mge3pv/cciv/,1617104776.0,"{'author': 'Embarrassed_Truck_94', 'created_utc': 1617104776, 'title': 'CCIV🤫🤑', 'url': 'https://www.reddit.com/r/wallstreetbets/comments/mge3pv/cciv/', 'created': 1617104776.0}",2021-03-30 11:46:16
25,d1knight_,1617104749,AMC,https://www.reddit.com/r/wallstreetbets/comments/mge3fh/amc/,1617104749.0,"{'author': 'd1knight_', 'created_utc': 1617104749, 'title': 'AMC', 'url': 'https://www.reddit.com/r/wallstreetbets/comments/mge3fh/amc/', 'created': 1617104749.0}",2021-03-30 11:45:49
26,stiffd69,1617104727,Why do people still believe GME will go up or short squeeze?,https://www.reddit.com/r/wallstreetbets/comments/mge36m/why_do_people_still_believe_gme_will_go_up_or/,1617104727.0,"{'author': 'stiffd69', 'created_utc': 1617104727, 'title': 'Why do people still believe GME will go up or short squeeze?', 'url': 'https://www.reddit.com/r/wallstreetbets/comments/mge36m/why_do_people_still_believe_gme_will_go_up_or/', 'created': 1617104727.0}",2021-03-30 11:45:27
27,SnooGiraff,1617104720,Cramer finally saying something positive about gamestop !,https://www.reddit.com/r/wallstreetbets/comments/mge343/cramer_finally_saying_something_positive_about/,1617104720.0,"{'author': 'SnooGiraff', 'created_utc': 1617104720, 'title': 'Cramer finally saying something positive about gamestop !', 'url': 'https://www.reddit.com/r/wallstreetbets/comments/mge343/cramer_finally_saying_something_positive_about/', 'created': 1617104720.0}",2021-03-30 11:45:20
28,Crayola_flavors,1617104717,I had to hustle r/askreddit to bring you this 1 pro tip,https://www.reddit.com/r/wallstreetbets/comments/mge331/i_had_to_hustle_raskreddit_to_bring_you_this_1/,1617104717.0,"{'author': 'Crayola_flavors', 'created_utc': 1617104717, 'title': 'I had to hustle r/askreddit to bring you this 1 pro tip', 'url': 'https://www.reddit.com/r/wallstreetbets/comments/mge331/i_had_to_hustle_raskreddit_to_bring_you_this_1/', 'created': 1617104717.0}",2021-03-30 11:45:17
29,Zenow2000,1617104523,AMS,https://www.reddit.com/r/wallstreetbets/comments/mge11f/ams/,1617104523.0,"{'author': 'Zenow2000', 'created_utc': 1617104523, 'title': 'AMS', 'url': 'https://www.reddit.com/r/wallstreetbets/comments/mge11f/ams/', 'created': 1617104523.0}",2021-03-30 11:42:03
30,jackdanielteasdale,1617104459,Beginner... where and how do i start?,https://www.reddit.com/r/wallstreetbets/comments/mge0ei/beginner_where_and_how_do_i_start/,1617104459.0,"{'author': 'jackdanielteasdale', 'created_utc': 1617104459, 'title': 'Beginner... where and how do i start?', 'url': 'https://www.reddit.com/r/wallstreetbets/comments/mge0ei/beginner_where_and_how_do_i_start/', 'created': 1617104459.0}",2021-03-30 11:40:59
31,BabyJesusFetus420,1617104390,"GameStop names Amazon exec Elliot Wilke chief growth officer, adds two former Chewy's managers to roster",https://finance.yahoo.com/m/6c6e97cf-d921-3952-8ed2-6eaf4f424b74/gamestop-names-amazon-exec.html,1617104390.0,"{'author': 'BabyJesusFetus420', 'created_utc': 1617104390, 'title': ""GameStop names Amazon exec Elliot Wilke chief growth officer, adds two former Chewy's managers to roster"", 'url': 'https://finance.yahoo.com/m/6c6e97cf-d921-3952-8ed2-6eaf4f424b74/gamestop-names-amazon-exec.html', 'created': 1617104390.0}",2021-03-30 11:39:50
32,Onboarding92,1617104357,Ok. Ok. Inflation is caused by small traders. Ok. Well.....,https://www.reddit.com/r/wallstreetbets/comments/mfoi1w/ok_ok_inflation_is_caused_by_small_traders_ok_well/?utm_source=ifttt,1617104357.0,"{'author': 'Onboarding92', 'created_utc': 1617104357, 'title': 'Ok. Ok. Inflation is caused by small traders. Ok. Well.....', 'url': 'https://www.reddit.com/r/wallstreetbets/comments/mfoi1w/ok_ok_inflation_is_caused_by_small_traders_ok_well/?utm_source=ifttt', 'created': 1617104357.0}",2021-03-30 11:39:17
33,DanyeelsAnulmint,1617104320,"Bright Side Of Short Selling: GameStop, Tesla, And Beyond...""GameStop's share price has experienced large swings in recent months. If short sellers are unable to borrow and short the company's stock, there is a possibility that the price level only reflects the opinion of bullish investors...""",http://forbes.com/sites/amiyatoshpurnanandam/2021/03/30/bright-side-of-short-selling-gamestop-tesla-lehman-and-beyond/?sh=53d9cd1d7cdd,1617104320.0,"{'author': 'DanyeelsAnulmint', 'created_utc': 1617104320, 'title': 'Bright Side Of Short Selling: GameStop, Tesla, And Beyond...""GameStop\'s share price has experienced large swings in recent months. If short sellers are unable to borrow and short the company\'s stock, there is a possibility that the price level only reflects the opinion of bullish investors...""', 'url': 'http://forbes.com/sites/amiyatoshpurnanandam/2021/03/30/bright-side-of-short-selling-gamestop-tesla-lehman-and-beyond/?sh=53d9cd1d7cdd', 'created': 1617104320.0}",2021-03-30 11:38:40
34,Aufngr,1617104307,HODL.... the tendies are coming,https://i.redd.it/ets2653uj5q61.jpg,1617104307.0,"{'author': 'Aufngr', 'created_utc': 1617104307, 'title': 'HODL.... the tendies are coming', 'url': 'https://i.redd.it/ets2653uj5q61.jpg', 'created': 1617104307.0}",2021-03-30 11:38:27
35,Wooden-Dragonfruit-1,1617104296,Meme stocks = my life (FML),https://i.redd.it/capn4u9sj5q61.gif,1617104296.0,"{'author': 'Wooden-Dragonfruit-1', 'created_utc': 1617104296, 'title': 'Meme stocks = my life (FML)', 'url': 'https://i.redd.it/capn4u9sj5q61.gif', 'created': 1617104296.0}",2021-03-30 11:38:16
36,FullLightMoon,1617104200,"Cathie Wood’s Ark Invest launches a space exploration ETF, to begin trading Tuesday",https://www.reddit.com/r/wallstreetbets/comments/mgdxyc/cathie_woods_ark_invest_launches_a_space/,1617104200.0,"{'author': 'FullLightMoon', 'created_utc': 1617104200, 'title': 'Cathie Wood’s Ark Invest launches a space exploration ETF, to begin trading Tuesday', 'url': 'https://www.reddit.com/r/wallstreetbets/comments/mgdxyc/cathie_woods_ark_invest_launches_a_space/', 'created': 1617104200.0}",2021-03-30 11:36:40
37,ReggieLab,1617104180,WHKS still on the back stretch fighting for the lead on postal contract,https://www.reddit.com/r/wallstreetbets/comments/mgdxr8/whks_still_on_the_back_stretch_fighting_for_the/,1617104180.0,"{'author': 'ReggieLab', 'created_utc': 1617104180, 'title': 'WHKS still on the back stretch fighting for the lead on postal contract', 'url': 'https://www.reddit.com/r/wallstreetbets/comments/mgdxr8/whks_still_on_the_back_stretch_fighting_for_the/', 'created': 1617104180.0}",2021-03-30 11:36:20
38,pittluke,1617104032,They say we are irresponsible? Who's next?,https://v.redd.it/y52688rti5q61,1617104032.0,"{'author': 'pittluke', 'created_utc': 1617104032, 'title': ""They say we are irresponsible? Who's next?"", 'url': 'https://v.redd.it/y52688rti5q61', 'created': 1617104032.0}",2021-03-30 11:33:52
39,Citor3_scenes,1617104001,"The $34,000,000 bet against GME! Someone bought 4500 ITM 250P",https://www.reddit.com/r/wallstreetbets/comments/mgdvw9/the_34000000_bet_against_gme_someone_bought_4500/,1617104001.0,"{'author': 'Citor3_scenes', 'created_utc': 1617104001, 'title': 'The $34,000,000 bet against GME! Someone bought 4500 ITM 250P', 'url': 'https://www.reddit.com/r/wallstreetbets/comments/mgdvw9/the_34000000_bet_against_gme_someone_bought_4500/', 'created': 1617104001.0}",2021-03-30 11:33:21
40,Scottmalconsin,1617103942,Nio qs appl idex,https://www.reddit.com/r/wallstreetbets/comments/mgdval/nio_qs_appl_idex/,1617103942.0,"{'author': 'Scottmalconsin', 'created_utc': 1617103942, 'title': 'Nio qs appl idex', 'url': 'https://www.reddit.com/r/wallstreetbets/comments/mgdval/nio_qs_appl_idex/', 'created': 1617103942.0}",2021-03-30 11:32:22
41,maxpax161,1617103877,$HMBL HUMBL,https://www.reddit.com/r/wallstreetbets/comments/mgdunb/hmbl_humbl/,1617103877.0,"{'author': 'maxpax161', 'created_utc': 1617103877, 'title': '$HMBL HUMBL', 'url': 'https://www.reddit.com/r/wallstreetbets/comments/mgdunb/hmbl_humbl/', 'created': 1617103877.0}",2021-03-30 11:31:17
42,skqwege,1617103840,WSB shout-outs on WeBull news,https://www.reddit.com/r/wallstreetbets/comments/mgdu9o/wsb_shoutouts_on_webull_news/,1617103840.0,"{'author': 'skqwege', 'created_utc': 1617103840, 'title': 'WSB shout-outs on WeBull news', 'url': 'https://www.reddit.com/r/wallstreetbets/comments/mgdu9o/wsb_shoutouts_on_webull_news/', 'created': 1617103840.0}",2021-03-30 11:30:40
43,DanyeelsAnulmint,1617103767,GameStop names Amazon executive as chief growth officer,https://finance.yahoo.com/news/gamestop-names-amazon-executive-chief-110339952.html,1617103767.0,"{'author': 'DanyeelsAnulmint', 'created_utc': 1617103767, 'title': 'GameStop names Amazon executive as chief growth officer', 'url': 'https://finance.yahoo.com/news/gamestop-names-amazon-executive-chief-110339952.html', 'created': 1617103767.0}",2021-03-30 11:29:27
44,n8bman,1617103713,Waiting for liftoff.,https://i.redd.it/3v98an22i5q61.gif,1617103713.0,"{'author': 'n8bman', 'created_utc': 1617103713, 'title': 'Waiting for liftoff.', 'url': 'https://i.redd.it/3v98an22i5q61.gif', 'created': 1617103713.0}",2021-03-30 11:28:33
45,Pristine-Buffalo7280,1617103685,"ATTENTION!!! EVERYBODY... GAME STOP STOCK (GME). IS GOING TO BE THE NEXT AMAZON PLATFORM FOR THE GAMING COMMUNITY, WITH SURGING STOCK PRICES OF $3,500. READ THE ARTICLE BELOW.",https://i.redd.it/r6l0dbezh5q61.png,1617103685.0,"{'author': 'Pristine-Buffalo7280', 'created_utc': 1617103685, 'title': 'ATTENTION!!! EVERYBODY... GAME STOP STOCK (GME). IS GOING TO BE THE NEXT AMAZON PLATFORM FOR THE GAMING COMMUNITY, WITH SURGING STOCK PRICES OF $3,500. READ THE ARTICLE BELOW.', 'url': 'https://i.redd.it/r6l0dbezh5q61.png', 'created': 1617103685.0}",2021-03-30 11:28:05
46,RichardSlammerTaken,1617103583,Heidelberger Druckmachines that are the future post flair,https://www.reddit.com/r/wallstreetbets/comments/mgdrgo/heidelberger_druckmachines_that_are_the_future/,1617103583.0,"{'author': 'RichardSlammerTaken', 'created_utc': 1617103583, 'title': 'Heidelberger Druckmachines that are the future post flair', 'url': 'https://www.reddit.com/r/wallstreetbets/comments/mgdrgo/heidelberger_druckmachines_that_are_the_future/', 'created': 1617103583.0}",2021-03-30 11:26:23
47,yolostonktrader,1617103537,It’s gonna be a good day apes 🦍,https://www.reddit.com/r/wallstreetbets/comments/mgdr0t/its_gonna_be_a_good_day_apes/,1617103537.0,"{'author': 'yolostonktrader', 'created_utc': 1617103537, 'title': 'It’s gonna be a good day apes 🦍', 'url': 'https://www.reddit.com/r/wallstreetbets/comments/mgdr0t/its_gonna_be_a_good_day_apes/', 'created': 1617103537.0}",2021-03-30 11:25:37
48,SimpleStockSimian,1617103504,GME Executive shake up news,https://i.redd.it/jxqt2esfh5q61.jpg,1617103504.0,"{'author': 'SimpleStockSimian', 'created_utc': 1617103504, 'title': 'GME Executive shake up news', 'url': 'https://i.redd.it/jxqt2esfh5q61.jpg', 'created': 1617103504.0}",2021-03-30 11:25:04
49,smugzor,1617103428,"Everything red, am I doing this right?",https://www.reddit.com/gallery/mgdpys,1617103428.0,"{'author': 'smugzor', 'created_utc': 1617103428, 'title': 'Everything red, am I doing this right?', 'url': 'https://www.reddit.com/gallery/mgdpys', 'created': 1617103428.0}",2021-03-30 11:23:48
50,Grand_Cardiologist34,1617103427,We like the Stonk(s),https://www.reddit.com/r/wallstreetbets/comments/mgdpya/we_like_the_stonks/,1617103427.0,"{'author': 'Grand_Cardiologist34', 'created_utc': 1617103427, 'title': 'We like the Stonk(s)', 'url': 'https://www.reddit.com/r/wallstreetbets/comments/mgdpya/we_like_the_stonks/', 'created': 1617103427.0}",2021-03-30 11:23:47
51,logoweb,1617103343,"Moderator, please give a buying tip – we all follow",https://www.reddit.com/r/wallstreetbets/comments/mgdp36/moderator_please_give_a_buying_tip_we_all_follow/,1617103343.0,"{'author': 'logoweb', 'created_utc': 1617103343, 'title': 'Moderator, please give a buying tip – we all follow', 'url': 'https://www.reddit.com/r/wallstreetbets/comments/mgdp36/moderator_please_give_a_buying_tip_we_all_follow/', 'created': 1617103343.0}",2021-03-30 11:22:23
52,MethodSad476,1617103307,Jimboooooo is liking GME. Apes have now conquered the Universe.,https://i.redd.it/tj9vpxyug5q61.png,1617103307.0,"{'author': 'MethodSad476', 'created_utc': 1617103307, 'title': 'Jimboooooo is liking GME. Apes have now conquered the Universe.', 'url': 'https://i.redd.it/tj9vpxyug5q61.png', 'created': 1617103307.0}",2021-03-30 11:21:47
53,JoeExplainsBadly,1617103297,HEDGEFU,https://i.redd.it/g01slv2sg5q61.png,1617103297.0,"{'author': 'JoeExplainsBadly', 'created_utc': 1617103297, 'title': 'HEDGEFU', 'url': 'https://i.redd.it/g01slv2sg5q61.png', 'created': 1617103297.0}",2021-03-30 11:21:37
54,DogCompetitive5774,1617103260,How to get in the habit of getting up early in the morning?,https://paidforarticles.com/how-to-get-in-the-habit-of-getting-up-early-in-the-morning-64563,1617103260.0,"{'author': 'DogCompetitive5774', 'created_utc': 1617103260, 'title': 'How to get in the habit of getting up early in the morning?', 'url': 'https://paidforarticles.com/how-to-get-in-the-habit-of-getting-up-early-in-the-morning-64563', 'created': 1617103260.0}",2021-03-30 11:21:00
55,dastish94,1617103216,To the moon,https://www.reddit.com/r/wallstreetbets/comments/mgdntx/to_the_moon/,1617103216.0,"{'author': 'dastish94', 'created_utc': 1617103216, 'title': 'To the moon', 'url': 'https://www.reddit.com/r/wallstreetbets/comments/mgdntx/to_the_moon/', 'created': 1617103216.0}",2021-03-30 11:20:16
56,cell0101777,1617103209,CAAS China Automotive Systems,https://www.reddit.com/r/wallstreetbets/comments/mgdnrr/caas_china_automotive_systems/,1617103209.0,"{'author': 'cell0101777', 'created_utc': 1617103209, 'title': 'CAAS China Automotive Systems', 'url': 'https://www.reddit.com/r/wallstreetbets/comments/mgdnrr/caas_china_automotive_systems/', 'created': 1617103209.0}",2021-03-30 11:20:09
57,hadzooo,1617103197,"GameStop names Amazon exec Elliot Wilke chief growth officer, adds two former Chewy's managers to roster",https://www.reddit.com/r/wallstreetbets/comments/mgdnn7/gamestop_names_amazon_exec_elliot_wilke_chief/,1617103197.0,"{'author': 'hadzooo', 'created_utc': 1617103197, 'title': ""GameStop names Amazon exec Elliot Wilke chief growth officer, adds two former Chewy's managers to roster"", 'url': 'https://www.reddit.com/r/wallstreetbets/comments/mgdnn7/gamestop_names_amazon_exec_elliot_wilke_chief/', 'created': 1617103197.0}",2021-03-30 11:19:57
58,JDS2582,1617103196,🚀 🚀 Good Morning 😁,https://i.redd.it/1cy3p40ig5q61.jpg,1617103196.0,"{'author': 'JDS2582', 'created_utc': 1617103196, 'title': '🚀 🚀 Good Morning 😁', 'url': 'https://i.redd.it/1cy3p40ig5q61.jpg', 'created': 1617103196.0}",2021-03-30 11:19:56
59,Hairy-Ad-3575,1617103111,Chewy crew incoming,https://www.marketwatch.com/story/gamestop-names-amazon-exec-elliot-wilke-chief-growth-officer-adds-two-former-chewys-managers-to-roster-2021-03-30?mod=mw_quote_news,1617103111.0,"{'author': 'Hairy-Ad-3575', 'created_utc': 1617103111, 'title': 'Chewy crew incoming', 'url': 'https://www.marketwatch.com/story/gamestop-names-amazon-exec-elliot-wilke-chief-growth-officer-adds-two-former-chewys-managers-to-roster-2021-03-30?mod=mw_quote_news', 'created': 1617103111.0}",2021-03-30 11:18:31
