,author,created_utc,title,url,created,d_,created_utc_dt
0,CookieMelon1010,1611930207,New and wondering where the best place to invest is,https://i.redd.it/qyaymxpk6ae61.jpg,1611930207.0,"{'author': 'CookieMelon1010', 'created_utc': 1611930207, 'title': 'New and wondering where the best place to invest is', 'url': 'https://i.redd.it/qyaymxpk6ae61.jpg', 'created': 1611930207.0}",2021-01-29 14:23:27
1,Boki637,1611930207,WBE DOGE needs your help!,https://www.reddit.com/r/wallstreetbets/comments/l7tpq7/wbe_doge_needs_your_help/,1611930207.0,"{'author': 'Boki637', 'created_utc': 1611930207, 'title': 'WBE DOGE needs your help!', 'url': 'https://www.reddit.com/r/wallstreetbets/comments/l7tpq7/wbe_doge_needs_your_help/', 'created': 1611930207.0}",2021-01-29 14:23:27
2,fatalbert1986,1611930206,IPIX- Fast Tracked drug Brilacidin with 99% effectiveness against COVID in all laboratory tests starting global trial over the next coming days. Shown to be very effective with “SOC” remdesivir.,https://www.reddit.com/r/wallstreetbets/comments/l7tpq1/ipix_fast_tracked_drug_brilacidin_with_99/,1611930206.0,"{'author': 'fatalbert1986', 'created_utc': 1611930206, 'title': 'IPIX- Fast Tracked drug Brilacidin with 99% effectiveness against COVID in all laboratory tests starting global trial over the next coming days. Shown to be very effective with “SOC” remdesivir.', 'url': 'https://www.reddit.com/r/wallstreetbets/comments/l7tpq1/ipix_fast_tracked_drug_brilacidin_with_99/', 'created': 1611930206.0}",2021-01-29 14:23:26
3,mrgrumpis,1611930206,DON’T LET UP! 💎🙌🏻,https://i.redd.it/qdw0eptk6ae61.jpg,1611930206.0,"{'author': 'mrgrumpis', 'created_utc': 1611930206, 'title': 'DON’T LET UP! 💎🙌🏻', 'url': 'https://i.redd.it/qdw0eptk6ae61.jpg', 'created': 1611930206.0}",2021-01-29 14:23:26
4,SysErrA,1611930206,Bought GME...,https://www.reddit.com/r/wallstreetbets/comments/l7tppq/bought_gme/,1611930206.0,"{'author': 'SysErrA', 'created_utc': 1611930206, 'title': 'Bought GME...', 'url': 'https://www.reddit.com/r/wallstreetbets/comments/l7tppq/bought_gme/', 'created': 1611930206.0}",2021-01-29 14:23:26
5,channggyyy,1611930206,Next big question,https://www.reddit.com/r/wallstreetbets/comments/l7tppl/next_big_question/,1611930206.0,"{'author': 'channggyyy', 'created_utc': 1611930206, 'title': 'Next big question', 'url': 'https://www.reddit.com/r/wallstreetbets/comments/l7tppl/next_big_question/', 'created': 1611930206.0}",2021-01-29 14:23:26
6,Justanotherretard1,1611930205,"To all my fellow retards, We are holding it down here at NOK, bleed them dry over at GME and AMC. I can smell the reinforcements coming.",https://i.redd.it/gr166gpk6ae61.jpg,1611930205.0,"{'author': 'Justanotherretard1', 'created_utc': 1611930205, 'title': 'To all my fellow retards, We are holding it down here at NOK, bleed them dry over at GME and AMC. I can smell the reinforcements coming.', 'url': 'https://i.redd.it/gr166gpk6ae61.jpg', 'created': 1611930205.0}",2021-01-29 14:23:25
7,GreenEnergyboom,1611930205,HYSR aka Sun Hydrogen,https://www.reddit.com/r/wallstreetbets/comments/l7tpp8/hysr_aka_sun_hydrogen/,1611930205.0,"{'author': 'GreenEnergyboom', 'created_utc': 1611930205, 'title': 'HYSR aka Sun Hydrogen', 'url': 'https://www.reddit.com/r/wallstreetbets/comments/l7tpp8/hysr_aka_sun_hydrogen/', 'created': 1611930205.0}",2021-01-29 14:23:25
8,thejungleVIP21,1611930205,Will there be a dip like the one we seen yesterday?,https://www.reddit.com/r/wallstreetbets/comments/l7tpp7/will_there_be_a_dip_like_the_one_we_seen_yesterday/,1611930205.0,"{'author': 'thejungleVIP21', 'created_utc': 1611930205, 'title': 'Will there be a dip like the one we seen yesterday?', 'url': 'https://www.reddit.com/r/wallstreetbets/comments/l7tpp7/will_there_be_a_dip_like_the_one_we_seen_yesterday/', 'created': 1611930205.0}",2021-01-29 14:23:25
9,SaladPlace,1611930204,Can someone explain what exactly is a hedge fund???,https://www.reddit.com/r/wallstreetbets/comments/l7tpou/can_someone_explain_what_exactly_is_a_hedge_fund/,1611930204.0,"{'author': 'SaladPlace', 'created_utc': 1611930204, 'title': 'Can someone explain what exactly is a hedge fund???', 'url': 'https://www.reddit.com/r/wallstreetbets/comments/l7tpou/can_someone_explain_what_exactly_is_a_hedge_fund/', 'created': 1611930204.0}",2021-01-29 14:23:24
10,Temporary-Friend-276,1611930204,Can we organize like this and stop paying taxes?,https://www.reddit.com/r/wallstreetbets/comments/l7tpoo/can_we_organize_like_this_and_stop_paying_taxes/,1611930204.0,"{'author': 'Temporary-Friend-276', 'created_utc': 1611930204, 'title': 'Can we organize like this and stop paying taxes?', 'url': 'https://www.reddit.com/r/wallstreetbets/comments/l7tpoo/can_we_organize_like_this_and_stop_paying_taxes/', 'created': 1611930204.0}",2021-01-29 14:23:24
11,A_Quik_Question,1611930204,New Here,https://www.reddit.com/r/wallstreetbets/comments/l7tpoa/new_here/,1611930204.0,"{'author': 'A_Quik_Question', 'created_utc': 1611930204, 'title': 'New Here', 'url': 'https://www.reddit.com/r/wallstreetbets/comments/l7tpoa/new_here/', 'created': 1611930204.0}",2021-01-29 14:23:24
12,terrible_badguy,1611930203,Do Not Go Gentle Into That Good Night,https://www.reddit.com/r/wallstreetbets/comments/l7tpnx/do_not_go_gentle_into_that_good_night/,1611930203.0,"{'author': 'terrible_badguy', 'created_utc': 1611930203, 'title': 'Do Not Go Gentle Into That Good Night', 'url': 'https://www.reddit.com/r/wallstreetbets/comments/l7tpnx/do_not_go_gentle_into_that_good_night/', 'created': 1611930203.0}",2021-01-29 14:23:23
13,Marksilver942,1611930203,Lets everyone Buy Nokia (NOK) we can make it the next GME.,https://www.reddit.com/r/wallstreetbets/comments/l7tpnq/lets_everyone_buy_nokia_nok_we_can_make_it_the/,1611930203.0,"{'author': 'Marksilver942', 'created_utc': 1611930203, 'title': 'Lets everyone Buy Nokia (NOK) we can make it the next GME.', 'url': 'https://www.reddit.com/r/wallstreetbets/comments/l7tpnq/lets_everyone_buy_nokia_nok_we_can_make_it_the/', 'created': 1611930203.0}",2021-01-29 14:23:23
14,415ph,1611930202,No distractions. Let's make that movie,https://i.redd.it/zf68jkth6ae61.gif,1611930202.0,"{'author': '415ph', 'created_utc': 1611930202, 'title': ""No distractions. Let's make that movie"", 'url': 'https://i.redd.it/zf68jkth6ae61.gif', 'created': 1611930202.0}",2021-01-29 14:23:22
15,crukdkersed,1611930202,Robinhood halted options trading on $NOK for today’s date.,https://www.reddit.com/r/wallstreetbets/comments/l7tpna/robinhood_halted_options_trading_on_nok_for/,1611930202.0,"{'author': 'crukdkersed', 'created_utc': 1611930202, 'title': 'Robinhood halted options trading on $NOK for today’s date.', 'url': 'https://www.reddit.com/r/wallstreetbets/comments/l7tpna/robinhood_halted_options_trading_on_nok_for/', 'created': 1611930202.0}",2021-01-29 14:23:22
16,clleftguard,1611930202,"$500 to throw, where do I throw it?",https://www.reddit.com/r/wallstreetbets/comments/l7tpn8/500_to_throw_where_do_i_throw_it/,1611930202.0,"{'author': 'clleftguard', 'created_utc': 1611930202, 'title': '$500 to throw, where do I throw it?', 'url': 'https://www.reddit.com/r/wallstreetbets/comments/l7tpn8/500_to_throw_where_do_i_throw_it/', 'created': 1611930202.0}",2021-01-29 14:23:22
17,Fafrafpaf,1611930202,"So I wanted to chip in, but..",https://www.reddit.com/r/wallstreetbets/comments/l7tpn1/so_i_wanted_to_chip_in_but/,1611930202.0,"{'author': 'Fafrafpaf', 'created_utc': 1611930202, 'title': 'So I wanted to chip in, but..', 'url': 'https://www.reddit.com/r/wallstreetbets/comments/l7tpn1/so_i_wanted_to_chip_in_but/', 'created': 1611930202.0}",2021-01-29 14:23:22
18,chaturcheetah93,1611930201,"THE END GAME! Love 'em to the moon! 🚀 ⚠️$GME ⚠️$AMC⚠️$BB⚠️$SNDL ‼️Remember to wait for selling until later next week for a full squeeze and if you haven't boarded, what are you waiting for? GET IN NOW ‼️",https://www.reddit.com/r/wallstreetbets/comments/l7tpmy/the_end_game_love_em_to_the_moon_gme_amcbbsndl/,1611930201.0,"{'author': 'chaturcheetah93', 'created_utc': 1611930201, 'title': ""THE END GAME! Love 'em to the moon! 🚀 ⚠️$GME ⚠️$AMC⚠️$BB⚠️$SNDL ‼️Remember to wait for selling until later next week for a full squeeze and if you haven't boarded, what are you waiting for? GET IN NOW ‼️"", 'url': 'https://www.reddit.com/r/wallstreetbets/comments/l7tpmy/the_end_game_love_em_to_the_moon_gme_amcbbsndl/', 'created': 1611930201.0}",2021-01-29 14:23:21
19,DoritosHD,1611930201,We did it boys! No more bullshit from this clown 🤡,https://i.redd.it/rstu3d7k6ae61.jpg,1611930201.0,"{'author': 'DoritosHD', 'created_utc': 1611930201, 'title': 'We did it boys! No more bullshit from this clown 🤡', 'url': 'https://i.redd.it/rstu3d7k6ae61.jpg', 'created': 1611930201.0}",2021-01-29 14:23:21
20,[deleted],1611930201,"We have been infiltrated by hundreds of thousands of paper hands who are just looking to make a quick profit. GME will be even more volatile today. DO NOT GET SCARED! The squeeze has not yet been squoze. Be patient, the moon will soon be in our rear view mirrors.",https://www.reddit.com/r/wallstreetbets/comments/l7tpmo/we_have_been_infiltrated_by_hundreds_of_thousands/,1611930201.0,"{'author': '[deleted]', 'created_utc': 1611930201, 'title': 'We have been infiltrated by hundreds of thousands of paper hands who are just looking to make a quick profit. GME will be even more volatile today. DO NOT GET SCARED! The squeeze has not yet been squoze. Be patient, the moon will soon be in our rear view mirrors.', 'url': 'https://www.reddit.com/r/wallstreetbets/comments/l7tpmo/we_have_been_infiltrated_by_hundreds_of_thousands/', 'created': 1611930201.0}",2021-01-29 14:23:21
21,ScienceDave-RE,1611930199,"I HOPE YOU AUTISTS HAVE BEEN DOING YOUR KEGELS, BECAUSE IT’S TIME TO SQUEEEEZE.",https://i.redd.it/bag6ax2k6ae61.jpg,1611930199.0,"{'author': 'ScienceDave-RE', 'created_utc': 1611930199, 'title': 'I HOPE YOU AUTISTS HAVE BEEN DOING YOUR KEGELS, BECAUSE IT’S TIME TO SQUEEEEZE.', 'url': 'https://i.redd.it/bag6ax2k6ae61.jpg', 'created': 1611930199.0}",2021-01-29 14:23:19
22,DobackTrophyFish,1611930198,Forget GBR (New Concept Energy) -- AMPY (Amplify Energy) is the one,https://www.reddit.com/r/wallstreetbets/comments/l7tpl8/forget_gbr_new_concept_energy_ampy_amplify_energy/,1611930198.0,"{'author': 'DobackTrophyFish', 'created_utc': 1611930198, 'title': 'Forget GBR (New Concept Energy) -- AMPY (Amplify Energy) is the one', 'url': 'https://www.reddit.com/r/wallstreetbets/comments/l7tpl8/forget_gbr_new_concept_energy_ampy_amplify_energy/', 'created': 1611930198.0}",2021-01-29 14:23:18
23,heemeej,1611930197,MY FELLOW RETARDS,https://www.reddit.com/r/wallstreetbets/comments/l7tpl1/my_fellow_retards/,1611930197.0,"{'author': 'heemeej', 'created_utc': 1611930197, 'title': 'MY FELLOW RETARDS', 'url': 'https://www.reddit.com/r/wallstreetbets/comments/l7tpl1/my_fellow_retards/', 'created': 1611930197.0}",2021-01-29 14:23:17
24,im_mood4,1611930196,Trough tho....,https://i.redd.it/ebkp8wrj6ae61.jpg,1611930196.0,"{'author': 'im_mood4', 'created_utc': 1611930196, 'title': 'Trough tho....', 'url': 'https://i.redd.it/ebkp8wrj6ae61.jpg', 'created': 1611930196.0}",2021-01-29 14:23:16
25,RichTexasTrader,1611930196,$AMC &amp; $GME ETC. OPTION TIPS,https://www.reddit.com/r/wallstreetbets/comments/l7tpkm/amc_gme_etc_option_tips/,1611930196.0,"{'author': 'RichTexasTrader', 'created_utc': 1611930196, 'title': '$AMC &amp; $GME ETC. OPTION TIPS', 'url': 'https://www.reddit.com/r/wallstreetbets/comments/l7tpkm/amc_gme_etc_option_tips/', 'created': 1611930196.0}",2021-01-29 14:23:16
26,ghughes20,1611930196,Attention Michael Lewis... GME,https://www.reddit.com/r/wallstreetbets/comments/l7tpkg/attention_michael_lewis_gme/,1611930196.0,"{'author': 'ghughes20', 'created_utc': 1611930196, 'title': 'Attention Michael Lewis... GME', 'url': 'https://www.reddit.com/r/wallstreetbets/comments/l7tpkg/attention_michael_lewis_gme/', 'created': 1611930196.0}",2021-01-29 14:23:16
27,6lackhokage,1611930196,GME AMC BB HOOOOOOLD!!!!!!!!,https://www.reddit.com/r/wallstreetbets/comments/l7tpke/gme_amc_bb_hoooooold/,1611930196.0,"{'author': '6lackhokage', 'created_utc': 1611930196, 'title': 'GME AMC BB HOOOOOOLD!!!!!!!!', 'url': 'https://www.reddit.com/r/wallstreetbets/comments/l7tpke/gme_amc_bb_hoooooold/', 'created': 1611930196.0}",2021-01-29 14:23:16
28,AutomaticOcelot5194,1611930195,Petition to change WSB background logo to this,https://i.redd.it/iud3by4j6ae61.png,1611930195.0,"{'author': 'AutomaticOcelot5194', 'created_utc': 1611930195, 'title': 'Petition to change WSB background logo to this', 'url': 'https://i.redd.it/iud3by4j6ae61.png', 'created': 1611930195.0}",2021-01-29 14:23:15
29,BlG_PAPl,1611930195,EVERYTHING IS DISCOUNTED! Buy the fucking dip and HOLD THE LINE! $NOK $BB $GME $PLTR TODAY WE WIN OUR FIGHT!!!!!,https://i.redd.it/bolseooj6ae61.jpg,1611930195.0,"{'author': 'BlG_PAPl', 'created_utc': 1611930195, 'title': 'EVERYTHING IS DISCOUNTED! Buy the fucking dip and HOLD THE LINE! $NOK $BB $GME $PLTR TODAY WE WIN OUR FIGHT!!!!!', 'url': 'https://i.redd.it/bolseooj6ae61.jpg', 'created': 1611930195.0}",2021-01-29 14:23:15
30,xbwtyzbchs,1611930195,Seeing reports that RH is restricting DOGE.,https://www.reddit.com/r/wallstreetbets/comments/l7tpjz/seeing_reports_that_rh_is_restricting_doge/,1611930195.0,"{'author': 'xbwtyzbchs', 'created_utc': 1611930195, 'title': 'Seeing reports that RH is restricting DOGE.', 'url': 'https://www.reddit.com/r/wallstreetbets/comments/l7tpjz/seeing_reports_that_rh_is_restricting_doge/', 'created': 1611930195.0}",2021-01-29 14:23:15
31,ygmsc,1611930195,Is this a good idea?,https://www.reddit.com/r/wallstreetbets/comments/l7tpjx/is_this_a_good_idea/,1611930195.0,"{'author': 'ygmsc', 'created_utc': 1611930195, 'title': 'Is this a good idea?', 'url': 'https://www.reddit.com/r/wallstreetbets/comments/l7tpjx/is_this_a_good_idea/', 'created': 1611930195.0}",2021-01-29 14:23:15
32,kalajaji,1611930194,Whats DD???? Dunkin Donuts,https://www.reddit.com/r/wallstreetbets/comments/l7tpjs/whats_dd_dunkin_donuts/,1611930194.0,"{'author': 'kalajaji', 'created_utc': 1611930194, 'title': 'Whats DD???? Dunkin Donuts', 'url': 'https://www.reddit.com/r/wallstreetbets/comments/l7tpjs/whats_dd_dunkin_donuts/', 'created': 1611930194.0}",2021-01-29 14:23:14
33,InfinityCode0,1611930194,Wall St Bets be Like...,https://youtu.be/3ngp6GD3_fU,1611930194.0,"{'author': 'InfinityCode0', 'created_utc': 1611930194, 'title': 'Wall St Bets be Like...', 'url': 'https://youtu.be/3ngp6GD3_fU', 'created': 1611930194.0}",2021-01-29 14:23:14
34,UnknownOrigins1,1611930194,UK quick sign up,https://www.reddit.com/r/wallstreetbets/comments/l7tpjj/uk_quick_sign_up/,1611930194.0,"{'author': 'UnknownOrigins1', 'created_utc': 1611930194, 'title': 'UK quick sign up', 'url': 'https://www.reddit.com/r/wallstreetbets/comments/l7tpjj/uk_quick_sign_up/', 'created': 1611930194.0}",2021-01-29 14:23:14
35,MightyCharizard,1611930194,"I WANT TO JOIN THE BATTLE FOR GME, EXPLAIN ME HOW TO DO, I'M A SOLO MONK IN THIS GLORIOUS BATTLEFILED",https://www.reddit.com/r/wallstreetbets/comments/l7tpjf/i_want_to_join_the_battle_for_gme_explain_me_how/,1611930194.0,"{'author': 'MightyCharizard', 'created_utc': 1611930194, 'title': ""I WANT TO JOIN THE BATTLE FOR GME, EXPLAIN ME HOW TO DO, I'M A SOLO MONK IN THIS GLORIOUS BATTLEFILED"", 'url': 'https://www.reddit.com/r/wallstreetbets/comments/l7tpjf/i_want_to_join_the_battle_for_gme_explain_me_how/', 'created': 1611930194.0}",2021-01-29 14:23:14
36,Psychological_Mind60,1611930193,$PLTR,https://www.reddit.com/r/wallstreetbets/comments/l7tpj4/pltr/,1611930193.0,"{'author': 'Psychological_Mind60', 'created_utc': 1611930193, 'title': '$PLTR', 'url': 'https://www.reddit.com/r/wallstreetbets/comments/l7tpj4/pltr/', 'created': 1611930193.0}",2021-01-29 14:23:13
37,Twixy2,1611930191,GME to the moon🚀🚀🚀🚀🚀,https://v.redd.it/ettm9m0e6ae61,1611930191.0,"{'author': 'Twixy2', 'created_utc': 1611930191, 'title': 'GME to the moon🚀🚀🚀🚀🚀', 'url': 'https://v.redd.it/ettm9m0e6ae61', 'created': 1611930191.0}",2021-01-29 14:23:11
38,TangyZeus,1611930190,Why I'm no longer holding GME,https://www.reddit.com/r/wallstreetbets/comments/l7tpht/why_im_no_longer_holding_gme/,1611930190.0,"{'author': 'TangyZeus', 'created_utc': 1611930190, 'title': ""Why I'm no longer holding GME"", 'url': 'https://www.reddit.com/r/wallstreetbets/comments/l7tpht/why_im_no_longer_holding_gme/', 'created': 1611930190.0}",2021-01-29 14:23:10
39,jessewperez1,1611930190,Robinhood will not let me buy more than 5 shares of GME this morning. Still limiting their users.,https://www.reddit.com/gallery/l7tphm,1611930190.0,"{'author': 'jessewperez1', 'created_utc': 1611930190, 'title': 'Robinhood will not let me buy more than 5 shares of GME this morning. Still limiting their users.', 'url': 'https://www.reddit.com/gallery/l7tphm', 'created': 1611930190.0}",2021-01-29 14:23:10
40,Unable_Violinist_955,1611930190,Make Nokia great again!,https://www.reddit.com/r/wallstreetbets/comments/l7tphg/make_nokia_great_again/,1611930190.0,"{'author': 'Unable_Violinist_955', 'created_utc': 1611930190, 'title': 'Make Nokia great again!', 'url': 'https://www.reddit.com/r/wallstreetbets/comments/l7tphg/make_nokia_great_again/', 'created': 1611930190.0}",2021-01-29 14:23:10
41,Thefalsegamer177,1611930189,Say a prayer today boys. TODAY WE GET OUR NUGGIES,https://i.redd.it/2hw6pm5h6ae61.gif,1611930189.0,"{'author': 'Thefalsegamer177', 'created_utc': 1611930189, 'title': 'Say a prayer today boys. TODAY WE GET OUR NUGGIES', 'url': 'https://i.redd.it/2hw6pm5h6ae61.gif', 'created': 1611930189.0}",2021-01-29 14:23:09
42,Weird_LiL_Dude,1611930187,F@CK Robbinghood,https://www.reddit.com/r/wallstreetbets/comments/l7tpgl/fck_robbinghood/,1611930187.0,"{'author': 'Weird_LiL_Dude', 'created_utc': 1611930187, 'title': 'F@CK Robbinghood', 'url': 'https://www.reddit.com/r/wallstreetbets/comments/l7tpgl/fck_robbinghood/', 'created': 1611930187.0}",2021-01-29 14:23:07
43,unkg,1611930186,My first ever post here; just a quick reminder.,https://www.reddit.com/r/wallstreetbets/comments/l7tpg5/my_first_ever_post_here_just_a_quick_reminder/,1611930186.0,"{'author': 'unkg', 'created_utc': 1611930186, 'title': 'My first ever post here; just a quick reminder.', 'url': 'https://www.reddit.com/r/wallstreetbets/comments/l7tpg5/my_first_ever_post_here_just_a_quick_reminder/', 'created': 1611930186.0}",2021-01-29 14:23:06
44,Pretend_Commission_1,1611930186,"For those who are thinking into entering crypto, BEWARE it's stock market on steroids, and there are some mechanics that are different. For this purpose I would like to suggest a very good playlist of tutorials",https://www.reddit.com/r/wallstreetbets/comments/l7tpft/for_those_who_are_thinking_into_entering_crypto/,1611930186.0,"{'author': 'Pretend_Commission_1', 'created_utc': 1611930186, 'title': ""For those who are thinking into entering crypto, BEWARE it's stock market on steroids, and there are some mechanics that are different. For this purpose I would like to suggest a very good playlist of tutorials"", 'url': 'https://www.reddit.com/r/wallstreetbets/comments/l7tpft/for_those_who_are_thinking_into_entering_crypto/', 'created': 1611930186.0}",2021-01-29 14:23:06
45,jkmonger,1611930185,With hope... I'M JACKED TO THE TITS!,https://i.redd.it/iwec4i9h6ae61.png,1611930185.0,"{'author': 'jkmonger', 'created_utc': 1611930185, 'title': ""With hope... I'M JACKED TO THE TITS!"", 'url': 'https://i.redd.it/iwec4i9h6ae61.png', 'created': 1611930185.0}",2021-01-29 14:23:05
46,GardiendeFangorn,1611930185,Nutritional High International Inc,https://www.reddit.com/r/wallstreetbets/comments/l7tpfg/nutritional_high_international_inc/,1611930185.0,"{'author': 'GardiendeFangorn', 'created_utc': 1611930185, 'title': 'Nutritional High International Inc', 'url': 'https://www.reddit.com/r/wallstreetbets/comments/l7tpfg/nutritional_high_international_inc/', 'created': 1611930185.0}",2021-01-29 14:23:05
47,bryangoforwsb,1611930185,"I know it s little. But ! To the moon!!! Screw the motherfathers!!!! Tiny teeny tweety support from Beijing, China.",https://i.redd.it/cikrsp1i6ae61.jpg,1611930185.0,"{'author': 'bryangoforwsb', 'created_utc': 1611930185, 'title': 'I know it s little. But ! To the moon!!! Screw the motherfathers!!!! Tiny teeny tweety support from Beijing, China.', 'url': 'https://i.redd.it/cikrsp1i6ae61.jpg', 'created': 1611930185.0}",2021-01-29 14:23:05
48,33isme,1611930184,Out of principle,https://www.reddit.com/r/wallstreetbets/comments/l7tpf0/out_of_principle/,1611930184.0,"{'author': '33isme', 'created_utc': 1611930184, 'title': 'Out of principle', 'url': 'https://www.reddit.com/r/wallstreetbets/comments/l7tpf0/out_of_principle/', 'created': 1611930184.0}",2021-01-29 14:23:04
49,i-was-there-GME,1611930184,GME merch,https://www.reddit.com/r/wallstreetbets/comments/l7tpez/gme_merch/,1611930184.0,"{'author': 'i-was-there-GME', 'created_utc': 1611930184, 'title': 'GME merch', 'url': 'https://www.reddit.com/r/wallstreetbets/comments/l7tpez/gme_merch/', 'created': 1611930184.0}",2021-01-29 14:23:04
50,Alone_Not_A_loan,1611930184,NAKD has 75%+ short float this morning. Also volume of 1.1 Billion yesterday. Stock is trading at 2 bucks right now. What do does the MOAB (mother of all bets-mob) think of it? This looks like a ripe squeeze.,https://www.reddit.com/r/wallstreetbets/comments/l7tpeu/nakd_has_75_short_float_this_morning_also_volume/,1611930184.0,"{'author': 'Alone_Not_A_loan', 'created_utc': 1611930184, 'title': 'NAKD has 75%+ short float this morning. Also volume of 1.1 Billion yesterday. Stock is trading at 2 bucks right now. What do does the MOAB (mother of all bets-mob) think of it? This looks like a ripe squeeze.', 'url': 'https://www.reddit.com/r/wallstreetbets/comments/l7tpeu/nakd_has_75_short_float_this_morning_also_volume/', 'created': 1611930184.0}",2021-01-29 14:23:04
51,darkspd89,1611930183,To the promise land my brothers,https://i.redd.it/qo8iso056ae61.png,1611930183.0,"{'author': 'darkspd89', 'created_utc': 1611930183, 'title': 'To the promise land my brothers', 'url': 'https://i.redd.it/qo8iso056ae61.png', 'created': 1611930183.0}",2021-01-29 14:23:03
52,NATHANVADER206,1611930183,Hold that line!,https://www.reddit.com/r/wallstreetbets/comments/l7tpeh/hold_that_line/,1611930183.0,"{'author': 'NATHANVADER206', 'created_utc': 1611930183, 'title': 'Hold that line!', 'url': 'https://www.reddit.com/r/wallstreetbets/comments/l7tpeh/hold_that_line/', 'created': 1611930183.0}",2021-01-29 14:23:03
53,AbdrahmanDiab,1611930183,How to buy GME stock from Egypt?,https://www.reddit.com/r/wallstreetbets/comments/l7tpe9/how_to_buy_gme_stock_from_egypt/,1611930183.0,"{'author': 'AbdrahmanDiab', 'created_utc': 1611930183, 'title': 'How to buy GME stock from Egypt?', 'url': 'https://www.reddit.com/r/wallstreetbets/comments/l7tpe9/how_to_buy_gme_stock_from_egypt/', 'created': 1611930183.0}",2021-01-29 14:23:03
54,pklokgieters,1611930182,REMOVE YOUR SELL LIMITS! WE'RE TAKING THIS BABY HIGHER THEN 420 DONT MISS OUT BY SELLING @ 420,https://www.reddit.com/r/wallstreetbets/comments/l7tpdw/remove_your_sell_limits_were_taking_this_baby/,1611930182.0,"{'author': 'pklokgieters', 'created_utc': 1611930182, 'title': ""REMOVE YOUR SELL LIMITS! WE'RE TAKING THIS BABY HIGHER THEN 420 DONT MISS OUT BY SELLING @ 420"", 'url': 'https://www.reddit.com/r/wallstreetbets/comments/l7tpdw/remove_your_sell_limits_were_taking_this_baby/', 'created': 1611930182.0}",2021-01-29 14:23:02
55,IDontWantANewUser,1611930182,My view on the current state of things. Keep the pressure on. 🚀🚀🚀🚀🚀🚀🚀,https://i.redd.it/c9ybu8zd6ae61.jpg,1611930182.0,"{'author': 'IDontWantANewUser', 'created_utc': 1611930182, 'title': 'My view on the current state of things. Keep the pressure on. 🚀🚀🚀🚀🚀🚀🚀', 'url': 'https://i.redd.it/c9ybu8zd6ae61.jpg', 'created': 1611930182.0}",2021-01-29 14:23:02
56,Danktownmayor,1611930182,Bending the knee,https://twitter.com/CitronResearch/status/1355152873487798274?s=09,1611930182.0,"{'author': 'Danktownmayor', 'created_utc': 1611930182, 'title': 'Bending the knee', 'url': 'https://twitter.com/CitronResearch/status/1355152873487798274?s=09', 'created': 1611930182.0}",2021-01-29 14:23:02
57,SDWolf0149,1611930182,They put a limit on what we can own! Fuck Robinhood!,https://www.reddit.com/gallery/l7tpdo,1611930182.0,"{'author': 'SDWolf0149', 'created_utc': 1611930182, 'title': 'They put a limit on what we can own! Fuck Robinhood!', 'url': 'https://www.reddit.com/gallery/l7tpdo', 'created': 1611930182.0}",2021-01-29 14:23:02
58,phatlynx,1611930181,Where was your kindness when you squeezed every broke retard from their last penny. F Citron,https://i.redd.it/d1b7ur3i6ae61.jpg,1611930181.0,"{'author': 'phatlynx', 'created_utc': 1611930181, 'title': 'Where was your kindness when you squeezed every broke retard from their last penny. F Citron', 'url': 'https://i.redd.it/d1b7ur3i6ae61.jpg', 'created': 1611930181.0}",2021-01-29 14:23:01
59,mrdavis7777,1611930180,FOR THOSE WHO CANT AFFORD GME!!! *KIDS TABLE*,https://www.reddit.com/r/wallstreetbets/comments/l7tpd9/for_those_who_cant_afford_gme_kids_table/,1611930180.0,"{'author': 'mrdavis7777', 'created_utc': 1611930180, 'title': 'FOR THOSE WHO CANT AFFORD GME!!! *KIDS TABLE*', 'url': 'https://www.reddit.com/r/wallstreetbets/comments/l7tpd9/for_those_who_cant_afford_gme_kids_table/', 'created': 1611930180.0}",2021-01-29 14:23:00
