,author,created_utc,title,url,created,d_,created_utc_dt
0,[deleted],1612244276,Stake Trading have removed offer buys for Tuesday,https://i.redd.it/jgww8jgc40f61.png,1612244276.0,"{'author': '[deleted]', 'created_utc': 1612244276, 'title': 'Stake Trading have removed offer buys for Tuesday', 'url': 'https://i.redd.it/jgww8jgc40f61.png', 'created': 1612244276.0}",2021-02-02 05:37:56
1,[deleted],1612244273,"Stake - one of Australia's largest US Shares trading platforms - has just disabled buying of $GME, $AMC and $NOK",https://i.redd.it/u60wt43d40f61.png,1612244273.0,"{'author': '[deleted]', 'created_utc': 1612244273, 'title': ""Stake - one of Australia's largest US Shares trading platforms - has just disabled buying of $GME, $AMC and $NOK"", 'url': 'https://i.redd.it/u60wt43d40f61.png', 'created': 1612244273.0}",2021-02-02 05:37:53
2,[deleted],1612244268,KARMAGEDEON FOR THE GAY BEAR,https://www.reddit.com/r/wallstreetbets/comments/laol80/karmagedeon_for_the_gay_bear/,1612244268.0,"{'author': '[deleted]', 'created_utc': 1612244268, 'title': 'KARMAGEDEON FOR THE GAY BEAR', 'url': 'https://www.reddit.com/r/wallstreetbets/comments/laol80/karmagedeon_for_the_gay_bear/', 'created': 1612244268.0}",2021-02-02 05:37:48
3,Magictonay,1612244267,Large NZ/Aus trading platform blocks GME AMC and NOK purchases.,https://i.imgur.com/J5i6N4Z.png,1612244267.0,"{'author': 'Magictonay', 'created_utc': 1612244267, 'title': 'Large NZ/Aus trading platform blocks GME AMC and NOK purchases.', 'url': 'https://i.imgur.com/J5i6N4Z.png', 'created': 1612244267.0}",2021-02-02 05:37:47
4,Hagarsey,1612244266,E-mail i recieved from Stake.,https://i.redd.it/6icv1omf40f61.jpg,1612244266.0,"{'author': 'Hagarsey', 'created_utc': 1612244266, 'title': 'E-mail i recieved from Stake.', 'url': 'https://i.redd.it/6icv1omf40f61.jpg', 'created': 1612244266.0}",2021-02-02 05:37:46
5,SandyArtisto,1612244266,ENJOY THE WALLPAPER MY BEAUTIFUL DEGENS!,https://i.redd.it/6q66g0ec40f61.png,1612244266.0,"{'author': 'SandyArtisto', 'created_utc': 1612244266, 'title': 'ENJOY THE WALLPAPER MY BEAUTIFUL DEGENS!', 'url': 'https://i.redd.it/6q66g0ec40f61.png', 'created': 1612244266.0}",2021-02-02 05:37:46
6,breezywinn,1612244264,Where do I buy bc I wanna help send that bitch to the moon baby,https://www.reddit.com/r/wallstreetbets/comments/laol6w/where_do_i_buy_bc_i_wanna_help_send_that_bitch_to/,1612244264.0,"{'author': 'breezywinn', 'created_utc': 1612244264, 'title': 'Where do I buy bc I wanna help send that bitch to the moon baby', 'url': 'https://www.reddit.com/r/wallstreetbets/comments/laol6w/where_do_i_buy_bc_i_wanna_help_send_that_bitch_to/', 'created': 1612244264.0}",2021-02-02 05:37:44
7,[deleted],1612244261,"If fizzling means going to the moon, then heck yeah!",https://i.redd.it/xzxrmh9f40f61.jpg,1612244261.0,"{'author': '[deleted]', 'created_utc': 1612244261, 'title': 'If fizzling means going to the moon, then heck yeah!', 'url': 'https://i.redd.it/xzxrmh9f40f61.jpg', 'created': 1612244261.0}",2021-02-02 05:37:41
8,ograwdogg,1612244260,A VIDEO FOR ALL AMC HOLDERS TO WATCH AND GIVE YOU 100% RELIEVE !,https://www.reddit.com/r/wallstreetbets/comments/laol5p/a_video_for_all_amc_holders_to_watch_and_give_you/,1612244260.0,"{'author': 'ograwdogg', 'created_utc': 1612244260, 'title': 'A VIDEO FOR ALL AMC HOLDERS TO WATCH AND GIVE YOU 100% RELIEVE !', 'url': 'https://www.reddit.com/r/wallstreetbets/comments/laol5p/a_video_for_all_amc_holders_to_watch_and_give_you/', 'created': 1612244260.0}",2021-02-02 05:37:40
9,spankmewetmop,1612244260,HOLD! Some can no longer buy,https://www.reddit.com/r/wallstreetbets/comments/laol5c/hold_some_can_no_longer_buy/,1612244260.0,"{'author': 'spankmewetmop', 'created_utc': 1612244260, 'title': 'HOLD! Some can no longer buy', 'url': 'https://www.reddit.com/r/wallstreetbets/comments/laol5c/hold_some_can_no_longer_buy/', 'created': 1612244260.0}",2021-02-02 05:37:40
10,Davidina101,1612244257,"As of today Stake, as per Drivewealth's request, is restricting buying of gme, amc, etc",https://i.redd.it/zijg17re40f61.jpg,1612244257.0,"{'author': 'Davidina101', 'created_utc': 1612244257, 'title': ""As of today Stake, as per Drivewealth's request, is restricting buying of gme, amc, etc"", 'url': 'https://i.redd.it/zijg17re40f61.jpg', 'created': 1612244257.0}",2021-02-02 05:37:37
11,isaidgodamnn,1612244257,Wow they’ve reached us in Australia. Shocking,https://i.redd.it/w2kg6gse40f61.jpg,1612244257.0,"{'author': 'isaidgodamnn', 'created_utc': 1612244257, 'title': 'Wow they’ve reached us in Australia. Shocking', 'url': 'https://i.redd.it/w2kg6gse40f61.jpg', 'created': 1612244257.0}",2021-02-02 05:37:37
12,TheAutisticleGiraffe,1612244253,Stake (Primarily Aussie service) refusing buys of GME due to DriveWealth,https://i.redd.it/nr4smgfe40f61.jpg,1612244253.0,"{'author': 'TheAutisticleGiraffe', 'created_utc': 1612244253, 'title': 'Stake (Primarily Aussie service) refusing buys of GME due to DriveWealth', 'url': 'https://i.redd.it/nr4smgfe40f61.jpg', 'created': 1612244253.0}",2021-02-02 05:37:33
13,Coyote0fWallstreet,1612244251,$AKBA and $BCRX are PREPARING FOR LIFTOFF 🚀 Both are OVER 70% Owned by INSTITUTIONS and shorted OVER 20% (including CITADEL the backers of MELVIN CAPITAL)!! SOLID GAINS TODAY ON INCREASING VOLUME!! SHORT SQUEEZE is COMING 🔥🚀🔥👀,https://i.redd.it/ttp0cr5e40f61.jpg,1612244251.0,"{'author': 'Coyote0fWallstreet', 'created_utc': 1612244251, 'title': '$AKBA and $BCRX are PREPARING FOR LIFTOFF 🚀 Both are OVER 70% Owned by INSTITUTIONS and shorted OVER 20% (including CITADEL the backers of MELVIN CAPITAL)!! SOLID GAINS TODAY ON INCREASING VOLUME!! SHORT SQUEEZE is COMING 🔥🚀🔥👀', 'url': 'https://i.redd.it/ttp0cr5e40f61.jpg', 'created': 1612244251.0}",2021-02-02 05:37:31
14,veganwraps710,1612244250,AMC the top and GME at the bottom. Almost a mirror image.,https://i.redd.it/043uom3e40f61.jpg,1612244250.0,"{'author': 'veganwraps710', 'created_utc': 1612244250, 'title': 'AMC the top and GME at the bottom. Almost a mirror image.', 'url': 'https://i.redd.it/043uom3e40f61.jpg', 'created': 1612244250.0}",2021-02-02 05:37:30
15,Beautiful_Border2981,1612244249,We did it Guys!,https://www.reddit.com/r/wallstreetbets/comments/laol1k/we_did_it_guys/,1612244249.0,"{'author': 'Beautiful_Border2981', 'created_utc': 1612244249, 'title': 'We did it Guys!', 'url': 'https://www.reddit.com/r/wallstreetbets/comments/laol1k/we_did_it_guys/', 'created': 1612244249.0}",2021-02-02 05:37:29
16,joshilland,1612244249,GME Shares Being Blocked in Australia,https://i.redd.it/a61ub5zd40f61.jpg,1612244249.0,"{'author': 'joshilland', 'created_utc': 1612244249, 'title': 'GME Shares Being Blocked in Australia', 'url': 'https://i.redd.it/a61ub5zd40f61.jpg', 'created': 1612244249.0}",2021-02-02 05:37:29
17,koreanz,1612244249,Paper hands getting nervous!,https://i.redd.it/v1d72uwd40f61.jpg,1612244249.0,"{'author': 'koreanz', 'created_utc': 1612244249, 'title': 'Paper hands getting nervous!', 'url': 'https://i.redd.it/v1d72uwd40f61.jpg', 'created': 1612244249.0}",2021-02-02 05:37:29
18,Rightomate6,1612244249,This wedding is horseshit...,https://i.redd.it/aek5odxd40f61.jpg,1612244249.0,"{'author': 'Rightomate6', 'created_utc': 1612244249, 'title': 'This wedding is horseshit...', 'url': 'https://i.redd.it/aek5odxd40f61.jpg', 'created': 1612244249.0}",2021-02-02 05:37:29
19,elrodog,1612244246,Auto mod killed my post. But I sold a quarter of my certain dog coin to pay off credit cards. Used the rest to help HOLD the line!,https://i.redd.it/d5wgx8pd40f61.jpg,1612244246.0,"{'author': 'elrodog', 'created_utc': 1612244246, 'title': 'Auto mod killed my post. But I sold a quarter of my certain dog coin to pay off credit cards. Used the rest to help HOLD the line!', 'url': 'https://i.redd.it/d5wgx8pd40f61.jpg', 'created': 1612244246.0}",2021-02-02 05:37:26
20,micforkna,1612244246,Asshats,https://i.redd.it/vqnchknd40f61.jpg,1612244246.0,"{'author': 'micforkna', 'created_utc': 1612244246, 'title': 'Asshats', 'url': 'https://i.redd.it/vqnchknd40f61.jpg', 'created': 1612244246.0}",2021-02-02 05:37:26
21,[deleted],1612244245,"Retards, it's a short ladder!",https://i.redd.it/2te5xqhd40f61.jpg,1612244245.0,"{'author': '[deleted]', 'created_utc': 1612244245, 'title': ""Retards, it's a short ladder!"", 'url': 'https://i.redd.it/2te5xqhd40f61.jpg', 'created': 1612244245.0}",2021-02-02 05:37:25
22,FatBoyGamingYT,1612244243,GameStop Stocks,https://www.reddit.com/r/wallstreetbets/comments/laokze/gamestop_stocks/,1612244243.0,"{'author': 'FatBoyGamingYT', 'created_utc': 1612244243, 'title': 'GameStop Stocks', 'url': 'https://www.reddit.com/r/wallstreetbets/comments/laokze/gamestop_stocks/', 'created': 1612244243.0}",2021-02-02 05:37:23
23,FloridaRocketGurl,1612244243,💎 🙌 Wife,https://i.redd.it/vqx5yo8d40f61.jpg,1612244243.0,"{'author': 'FloridaRocketGurl', 'created_utc': 1612244243, 'title': '💎 🙌 Wife', 'url': 'https://i.redd.it/vqx5yo8d40f61.jpg', 'created': 1612244243.0}",2021-02-02 05:37:23
24,[deleted],1612244242,"Australian trading app “Stake” suspends trading for NOK, GME and AMC. Had an order placed for NOK already.",https://i.redd.it/evvf0r4d40f61.jpg,1612244242.0,"{'author': '[deleted]', 'created_utc': 1612244242, 'title': 'Australian trading app “Stake” suspends trading for NOK, GME and AMC. Had an order placed for NOK already.', 'url': 'https://i.redd.it/evvf0r4d40f61.jpg', 'created': 1612244242.0}",2021-02-02 05:37:22
25,NotTheTomatoHead,1612244240,STAKE UPDATE - Blocking Australians Now 🦍 😡,https://i.redd.it/ldooz81d40f61.jpg,1612244240.0,"{'author': 'NotTheTomatoHead', 'created_utc': 1612244240, 'title': 'STAKE UPDATE - Blocking Australians Now 🦍 😡', 'url': 'https://i.redd.it/ldooz81d40f61.jpg', 'created': 1612244240.0}",2021-02-02 05:37:20
26,new-to-revolution20,1612244239,Did credit just kill off r/silverstreetbets,https://www.reddit.com/r/wallstreetbets/comments/laokxr/did_credit_just_kill_off_rsilverstreetbets/,1612244239.0,"{'author': 'new-to-revolution20', 'created_utc': 1612244239, 'title': 'Did credit just kill off r/silverstreetbets', 'url': 'https://www.reddit.com/r/wallstreetbets/comments/laokxr/did_credit_just_kill_off_rsilverstreetbets/', 'created': 1612244239.0}",2021-02-02 05:37:19
27,[deleted],1612244238,Don’t Forget Who’s Always on Top!,https://i.redd.it/u2moc5qc40f61.jpg,1612244238.0,"{'author': '[deleted]', 'created_utc': 1612244238, 'title': 'Don’t Forget Who’s Always on Top!', 'url': 'https://i.redd.it/u2moc5qc40f61.jpg', 'created': 1612244238.0}",2021-02-02 05:37:18
28,[deleted],1612244236,Email received from HelloStake regarding increased capital requirements,https://i.redd.it/wk0oaafc40f61.jpg,1612244236.0,"{'author': '[deleted]', 'created_utc': 1612244236, 'title': 'Email received from HelloStake regarding increased capital requirements', 'url': 'https://i.redd.it/wk0oaafc40f61.jpg', 'created': 1612244236.0}",2021-02-02 05:37:16
29,Any_Click_7153,1612244234,SNDL,https://www.reddit.com/r/wallstreetbets/comments/laokwd/sndl/,1612244234.0,"{'author': 'Any_Click_7153', 'created_utc': 1612244234, 'title': 'SNDL', 'url': 'https://www.reddit.com/r/wallstreetbets/comments/laokwd/sndl/', 'created': 1612244234.0}",2021-02-02 05:37:14
30,[deleted],1612244233,I can't be the only one,https://i.redd.it/zbyyab8540f61.jpg,1612244233.0,"{'author': '[deleted]', 'created_utc': 1612244233, 'title': ""I can't be the only one"", 'url': 'https://i.redd.it/zbyyab8540f61.jpg', 'created': 1612244233.0}",2021-02-02 05:37:13
31,DisabledGoddess,1612244233,STAKE withdrawing Buy offers on GME AMC and NOK,https://i.redd.it/gkr1q12c40f61.jpg,1612244233.0,"{'author': 'DisabledGoddess', 'created_utc': 1612244233, 'title': 'STAKE withdrawing Buy offers on GME AMC and NOK', 'url': 'https://i.redd.it/gkr1q12c40f61.jpg', 'created': 1612244233.0}",2021-02-02 05:37:13
32,[deleted],1612244232,Why lithium is biggest Play in the coming next few weeks. $LAC Stonk can give you BIGGEST gains!,https://www.reddit.com/r/wallstreetbets/comments/laokvp/why_lithium_is_biggest_play_in_the_coming_next/,1612244232.0,"{'author': '[deleted]', 'created_utc': 1612244232, 'title': 'Why lithium is biggest Play in the coming next few weeks. $LAC Stonk can give you BIGGEST gains!', 'url': 'https://www.reddit.com/r/wallstreetbets/comments/laokvp/why_lithium_is_biggest_play_in_the_coming_next/', 'created': 1612244232.0}",2021-02-02 05:37:12
33,NickEhlers,1612244228,"Trading update from Stake. Trading of $GME, $AMC and $NOK suspended",https://i.redd.it/is5fk68b40f61.jpg,1612244228.0,"{'author': 'NickEhlers', 'created_utc': 1612244228, 'title': 'Trading update from Stake. Trading of $GME, $AMC and $NOK suspended', 'url': 'https://i.redd.it/is5fk68b40f61.jpg', 'created': 1612244228.0}",2021-02-02 05:37:08
34,[deleted],1612244227,"NZ and Aus retards, we are being cucked",https://i.redd.it/buha00hb40f61.jpg,1612244227.0,"{'author': '[deleted]', 'created_utc': 1612244227, 'title': 'NZ and Aus retards, we are being cucked', 'url': 'https://i.redd.it/buha00hb40f61.jpg', 'created': 1612244227.0}",2021-02-02 05:37:07
35,RadiantShadow216,1612244227,"So it begins.... 🤦🏻‍♂️🤦🏻‍♂️🤦🏻‍♂️ Stake just Suspended Buys on $GME, $NOK and $AMC.... Where we headed to next???",https://i.redd.it/w7brbbmb40f61.jpg,1612244227.0,"{'author': 'RadiantShadow216', 'created_utc': 1612244227, 'title': 'So it begins.... 🤦🏻\u200d♂️🤦🏻\u200d♂️🤦🏻\u200d♂️ Stake just Suspended Buys on $GME, $NOK and $AMC.... Where we headed to next???', 'url': 'https://i.redd.it/w7brbbmb40f61.jpg', 'created': 1612244227.0}",2021-02-02 05:37:07
36,[deleted],1612244227,badoonkadoonk,https://www.reddit.com/r/wallstreetbets/comments/laoktb/badoonkadoonk/,1612244227.0,"{'author': '[deleted]', 'created_utc': 1612244227, 'title': 'badoonkadoonk', 'url': 'https://www.reddit.com/r/wallstreetbets/comments/laoktb/badoonkadoonk/', 'created': 1612244227.0}",2021-02-02 05:37:07
37,Hanky_panky173925,1612244226,Uniswap $25+ today 400%+,https://www.reddit.com/r/wallstreetbets/comments/laoksy/uniswap_25_today_400/,1612244226.0,"{'author': 'Hanky_panky173925', 'created_utc': 1612244226, 'title': 'Uniswap $25+ today 400%+', 'url': 'https://www.reddit.com/r/wallstreetbets/comments/laoksy/uniswap_25_today_400/', 'created': 1612244226.0}",2021-02-02 05:37:06
38,[deleted],1612244223,"Stake, an Australian brokerage have cancelled buy orders for $GME, AMC and $NOK",https://i.redd.it/0oeqhlva40f61.jpg,1612244223.0,"{'author': '[deleted]', 'created_utc': 1612244223, 'title': 'Stake, an Australian brokerage have cancelled buy orders for $GME, AMC and $NOK', 'url': 'https://i.redd.it/0oeqhlva40f61.jpg', 'created': 1612244223.0}",2021-02-02 05:37:03
39,[deleted],1612244222,GAMESTOP,https://www.reddit.com/r/wallstreetbets/comments/laokrh/gamestop/,1612244222.0,"{'author': '[deleted]', 'created_utc': 1612244222, 'title': 'GAMESTOP', 'url': 'https://www.reddit.com/r/wallstreetbets/comments/laokrh/gamestop/', 'created': 1612244222.0}",2021-02-02 05:37:02
40,cofun116,1612244221,Noob Buying to support the cause.....,http://www.youtube.com/watch?v=FaF5MAY1Wow,1612244221.0,"{'author': 'cofun116', 'created_utc': 1612244221, 'title': 'Noob Buying to support the cause.....', 'url': 'http://www.youtube.com/watch?v=FaF5MAY1Wow', 'created': 1612244221.0}",2021-02-02 05:37:01
41,[deleted],1612244218,Stake now banning the purchase of $GME $AMC and $NOK,https://i.redd.it/ewrj0cma40f61.jpg,1612244218.0,"{'author': '[deleted]', 'created_utc': 1612244218, 'title': 'Stake now banning the purchase of $GME $AMC and $NOK', 'url': 'https://i.redd.it/ewrj0cma40f61.jpg', 'created': 1612244218.0}",2021-02-02 05:36:58
42,Realick,1612244216,Amen.,https://i.redd.it/up0ui0ga40f61.jpg,1612244216.0,"{'author': 'Realick', 'created_utc': 1612244216, 'title': 'Amen.', 'url': 'https://i.redd.it/up0ui0ga40f61.jpg', 'created': 1612244216.0}",2021-02-02 05:36:56
43,imsarcasticJD,1612244216,WSB not pumping $slv?? I'm confused.,https://www.reddit.com/r/wallstreetbets/comments/laokq6/wsb_not_pumping_slv_im_confused/,1612244216.0,"{'author': 'imsarcasticJD', 'created_utc': 1612244216, 'title': ""WSB not pumping $slv?? I'm confused."", 'url': 'https://www.reddit.com/r/wallstreetbets/comments/laokq6/wsb_not_pumping_slv_im_confused/', 'created': 1612244216.0}",2021-02-02 05:36:56
44,ItchyTriggaFingaNigg,1612244215,Australian platform Stake doesn't have 💎👐!,https://imgur.com/yIih6Hz,1612244215.0,"{'author': 'ItchyTriggaFingaNigg', 'created_utc': 1612244215, 'title': ""Australian platform Stake doesn't have 💎👐!"", 'url': 'https://imgur.com/yIih6Hz', 'created': 1612244215.0}",2021-02-02 05:36:55
45,[deleted],1612244214,GME &amp; AMC price fluctuations are identical,https://i.redd.it/idreyry740f61.png,1612244214.0,"{'author': '[deleted]', 'created_utc': 1612244214, 'title': 'GME &amp; AMC price fluctuations are identical', 'url': 'https://i.redd.it/idreyry740f61.png', 'created': 1612244214.0}",2021-02-02 05:36:54
46,GrayvonBarksdale,1612244212,THE ONLY OPTION LEFT,https://i.redd.it/2en9xl1a40f61.jpg,1612244212.0,"{'author': 'GrayvonBarksdale', 'created_utc': 1612244212, 'title': 'THE ONLY OPTION LEFT', 'url': 'https://i.redd.it/2en9xl1a40f61.jpg', 'created': 1612244212.0}",2021-02-02 05:36:52
47,[deleted],1612244210,Sound the horns! Time for Wall Street to salute their shorts!,https://i.redd.it/izedf7u940f61.jpg,1612244210.0,"{'author': '[deleted]', 'created_utc': 1612244210, 'title': 'Sound the horns! Time for Wall Street to salute their shorts!', 'url': 'https://i.redd.it/izedf7u940f61.jpg', 'created': 1612244210.0}",2021-02-02 05:36:50
48,Reedme21,1612244210,And so it continues,https://i.redd.it/ggog60q940f61.jpg,1612244210.0,"{'author': 'Reedme21', 'created_utc': 1612244210, 'title': 'And so it continues', 'url': 'https://i.redd.it/ggog60q940f61.jpg', 'created': 1612244210.0}",2021-02-02 05:36:50
49,[deleted],1612244205,When should I buy more GME?,https://www.reddit.com/r/wallstreetbets/comments/laokmb/when_should_i_buy_more_gme/,1612244205.0,"{'author': '[deleted]', 'created_utc': 1612244205, 'title': 'When should I buy more GME?', 'url': 'https://www.reddit.com/r/wallstreetbets/comments/laokmb/when_should_i_buy_more_gme/', 'created': 1612244205.0}",2021-02-02 05:36:45
50,[deleted],1612244204,Trading platform in Australia will not be trading GME AMC or NOK. Stake is a platform by Drivewealth which is ultimately owned by point72. This is fucking bullshit THE CUCKS WILL NOT WIN- AUSSIE AUTISTS STILL HOLDING,https://i.redd.it/3t95dsv840f61.jpg,1612244204.0,"{'author': '[deleted]', 'created_utc': 1612244204, 'title': 'Trading platform in Australia will not be trading GME AMC or NOK. Stake is a platform by Drivewealth which is ultimately owned by point72. This is fucking bullshit THE CUCKS WILL NOT WIN- AUSSIE AUTISTS STILL HOLDING', 'url': 'https://i.redd.it/3t95dsv840f61.jpg', 'created': 1612244204.0}",2021-02-02 05:36:44
51,Shadowedsphynx,1612244203,"Stake, one of the few options for US Stock Exchange Trading in Australia, will block buying on GME and AMD from Tuesday.",https://i.redd.it/nzp0b30940f61.png,1612244203.0,"{'author': 'Shadowedsphynx', 'created_utc': 1612244203, 'title': 'Stake, one of the few options for US Stock Exchange Trading in Australia, will block buying on GME and AMD from Tuesday.', 'url': 'https://i.redd.it/nzp0b30940f61.png', 'created': 1612244203.0}",2021-02-02 05:36:43
52,Majestic_Challenge43,1612244203,Save this poor 🐕 suffering from kidney stone pain Please share and donate 🙏🙏🙏 Love 💕 Peace ✌️ http://gf.me/u/zgnu96,https://www.reddit.com/r/wallstreetbets/comments/laoklc/save_this_poor_suffering_from_kidney_stone_pain/,1612244203.0,"{'author': 'Majestic_Challenge43', 'created_utc': 1612244203, 'title': 'Save this poor 🐕 suffering from kidney stone pain Please share and donate 🙏🙏🙏 Love 💕 Peace ✌️ http://gf.me/u/zgnu96', 'url': 'https://www.reddit.com/r/wallstreetbets/comments/laoklc/save_this_poor_suffering_from_kidney_stone_pain/', 'created': 1612244203.0}",2021-02-02 05:36:43
53,[deleted],1612244201,Got this today after trying to transfer to Fidelity last Thursday. Does this mean they halted the transfer? I asked them to when I got nervous about stocks in limbo but no one from RH has reached out and this is the only email I’ve gotten.,https://i.imgur.com/wWExrG7.jpg,1612244201.0,"{'author': '[deleted]', 'created_utc': 1612244201, 'title': 'Got this today after trying to transfer to Fidelity last Thursday. Does this mean they halted the transfer? I asked them to when I got nervous about stocks in limbo but no one from RH has reached out and this is the only email I’ve gotten.', 'url': 'https://i.imgur.com/wWExrG7.jpg', 'created': 1612244201.0}",2021-02-02 05:36:41
54,Earthscondido,1612244199,"Buying the dip and in for some more. I love all you fellow retards! 🚀🚀🚀🚀. First emoji use ever, took me an hour to find the rocket ship. Not financial advice, I’m old and totally retarded.",https://www.reddit.com/r/wallstreetbets/comments/laokk2/buying_the_dip_and_in_for_some_more_i_love_all/,1612244199.0,"{'author': 'Earthscondido', 'created_utc': 1612244199, 'title': 'Buying the dip and in for some more. I love all you fellow retards! 🚀🚀🚀🚀. First emoji use ever, took me an hour to find the rocket ship. Not financial advice, I’m old and totally retarded.', 'url': 'https://www.reddit.com/r/wallstreetbets/comments/laokk2/buying_the_dip_and_in_for_some_more_i_love_all/', 'created': 1612244199.0}",2021-02-02 05:36:39
55,[deleted],1612244196,Hedge Fund Shill Doesn’t Understand the Squeeze Has Only Just Begun 💎🙌,https://i.redd.it/ai1ucnb840f61.jpg,1612244196.0,"{'author': '[deleted]', 'created_utc': 1612244196, 'title': 'Hedge Fund Shill Doesn’t Understand the Squeeze Has Only Just Begun 💎🙌', 'url': 'https://i.redd.it/ai1ucnb840f61.jpg', 'created': 1612244196.0}",2021-02-02 05:36:36
56,200Dollartraders,1612244192,right now whats is going on to GME is that some dedicated people hold positions while other sneacky mf are taking profits which force price to go down we will see here people split up to 2 groups where no power will be demonstrated when i say this now many of you gives me dislike but I'll be remembe,https://www.reddit.com/r/wallstreetbets/comments/laokhf/right_now_whats_is_going_on_to_gme_is_that_some/,1612244192.0,"{'author': '200Dollartraders', 'created_utc': 1612244192, 'title': ""right now whats is going on to GME is that some dedicated people hold positions while other sneacky mf are taking profits which force price to go down we will see here people split up to 2 groups where no power will be demonstrated when i say this now many of you gives me dislike but I'll be remembe"", 'url': 'https://www.reddit.com/r/wallstreetbets/comments/laokhf/right_now_whats_is_going_on_to_gme_is_that_some/', 'created': 1612244192.0}",2021-02-02 05:36:32
57,kniduane,1612244190,More shenanigans (GME),https://www.reddit.com/r/wallstreetbets/comments/laokgw/more_shenanigans_gme/,1612244190.0,"{'author': 'kniduane', 'created_utc': 1612244190, 'title': 'More shenanigans (GME)', 'url': 'https://www.reddit.com/r/wallstreetbets/comments/laokgw/more_shenanigans_gme/', 'created': 1612244190.0}",2021-02-02 05:36:30
58,Danger_Mongoose_42,1612244190,The 99%,https://i.redd.it/mudh4eo740f61.jpg,1612244190.0,"{'author': 'Danger_Mongoose_42', 'created_utc': 1612244190, 'title': 'The 99%', 'url': 'https://i.redd.it/mudh4eo740f61.jpg', 'created': 1612244190.0}",2021-02-02 05:36:30
59,Inevitable-Garden-15,1612244186,A song for the movement,https://www.reddit.com/r/wallstreetbets/comments/laokfg/a_song_for_the_movement/,1612244186.0,"{'author': 'Inevitable-Garden-15', 'created_utc': 1612244186, 'title': 'A song for the movement', 'url': 'https://www.reddit.com/r/wallstreetbets/comments/laokfg/a_song_for_the_movement/', 'created': 1612244186.0}",2021-02-02 05:36:26
60,SirJerryLion,1612244186,Stake (broker popular in Oz &amp; Nz) announces restrictions to GME buys on behalf of their partner DriveWealth,https://i.redd.it/8pilgyv640f61.jpg,1612244186.0,"{'author': 'SirJerryLion', 'created_utc': 1612244186, 'title': 'Stake (broker popular in Oz &amp; Nz) announces restrictions to GME buys on behalf of their partner DriveWealth', 'url': 'https://i.redd.it/8pilgyv640f61.jpg', 'created': 1612244186.0}",2021-02-02 05:36:26
61,[deleted],1612244185,Watching all the strays roll in,https://i.redd.it/shi57h6740f61.png,1612244185.0,"{'author': '[deleted]', 'created_utc': 1612244185, 'title': 'Watching all the strays roll in', 'url': 'https://i.redd.it/shi57h6740f61.png', 'created': 1612244185.0}",2021-02-02 05:36:25
62,Beneficial-Warning-1,1612244183,I just want to buy stock from Australia. I like stock 😢,https://i.redd.it/ox83w4u640f61.jpg,1612244183.0,"{'author': 'Beneficial-Warning-1', 'created_utc': 1612244183, 'title': 'I just want to buy stock from Australia. I like stock 😢', 'url': 'https://i.redd.it/ox83w4u640f61.jpg', 'created': 1612244183.0}",2021-02-02 05:36:23
63,miamiatlanta1970,1612244183,No way !!!,https://i.redd.it/bholy1w640f61.jpg,1612244183.0,"{'author': 'miamiatlanta1970', 'created_utc': 1612244183, 'title': 'No way !!!', 'url': 'https://i.redd.it/bholy1w640f61.jpg', 'created': 1612244183.0}",2021-02-02 05:36:23
64,Bitter-Substance5980,1612244181,Stake (DriveWealth) no longer offering buys on $GME $AMC or $NOK,https://i.redd.it/b0zjovc640f61.jpg,1612244181.0,"{'author': 'Bitter-Substance5980', 'created_utc': 1612244181, 'title': 'Stake (DriveWealth) no longer offering buys on $GME $AMC or $NOK', 'url': 'https://i.redd.it/b0zjovc640f61.jpg', 'created': 1612244181.0}",2021-02-02 05:36:21
