,author,created_utc,title,url,created,d_,created_utc_dt
0,Mcgaivar,1606546138,PLTR,https://www.reddit.com/r/wallstreetbets/comments/k2j3c7/pltr/,1606546138.0,"{'author': 'Mcgaivar', 'created_utc': 1606546138, 'title': 'PLTR', 'url': 'https://www.reddit.com/r/wallstreetbets/comments/k2j3c7/pltr/', 'created': 1606546138.0}",2020-11-28 06:48:58
1,hooman_or_whatever,1606546048,❗️PLTR IS A CASINO,https://www.reddit.com/r/wallstreetbets/comments/k2j2q2/pltr_is_a_casino/,1606546048.0,"{'author': 'hooman_or_whatever', 'created_utc': 1606546048, 'title': '❗️PLTR IS A CASINO', 'url': 'https://www.reddit.com/r/wallstreetbets/comments/k2j2q2/pltr_is_a_casino/', 'created': 1606546048.0}",2020-11-28 06:47:28
2,itcanhappen247,1606545992,5k to YOLO besides PLTR,https://www.reddit.com/r/wallstreetbets/comments/k2j2cg/5k_to_yolo_besides_pltr/,1606545992.0,"{'author': 'itcanhappen247', 'created_utc': 1606545992, 'title': '5k to YOLO besides PLTR', 'url': 'https://www.reddit.com/r/wallstreetbets/comments/k2j2cg/5k_to_yolo_besides_pltr/', 'created': 1606545992.0}",2020-11-28 06:46:32
3,dontouchyourself,1606545989,Why does everyone on here talks like they're some big shots? 😂,https://www.reddit.com/r/wallstreetbets/comments/k2j2c1/why_does_everyone_on_here_talks_like_theyre_some/,1606545989.0,"{'author': 'dontouchyourself', 'created_utc': 1606545989, 'title': ""Why does everyone on here talks like they're some big shots? 😂"", 'url': 'https://www.reddit.com/r/wallstreetbets/comments/k2j2c1/why_does_everyone_on_here_talks_like_theyre_some/', 'created': 1606545989.0}",2020-11-28 06:46:29
4,kryerson702,1606545816,Even this guy trolls WSB... probably looking for his next “Big Short”.,https://i.redd.it/rgz0g9t0gx161.jpg,1606545816.0,"{'author': 'kryerson702', 'created_utc': 1606545816, 'title': 'Even this guy trolls WSB... probably looking for his next “Big Short”.', 'url': 'https://i.redd.it/rgz0g9t0gx161.jpg', 'created': 1606545816.0}",2020-11-28 06:43:36
5,TwoWaySpeedOfLight,1606545801,%37 Gains on ETH,https://i.redd.it/5927c36zfx161.jpg,1606545801.0,"{'author': 'TwoWaySpeedOfLight', 'created_utc': 1606545801, 'title': '%37 Gains on ETH', 'url': 'https://i.redd.it/5927c36zfx161.jpg', 'created': 1606545801.0}",2020-11-28 06:43:21
6,Initial-Medium504,1606545708,Had a dream that PLTR hit 38 on Monday,https://www.reddit.com/r/wallstreetbets/comments/k2j088/had_a_dream_that_pltr_hit_38_on_monday/,1606545708.0,"{'author': 'Initial-Medium504', 'created_utc': 1606545708, 'title': 'Had a dream that PLTR hit 38 on Monday', 'url': 'https://www.reddit.com/r/wallstreetbets/comments/k2j088/had_a_dream_that_pltr_hit_38_on_monday/', 'created': 1606545708.0}",2020-11-28 06:41:48
7,bandicootbandit,1606545559,We see your move Citron and raise you a trip to the 🌙. PLTR 🚀🚀🚀,https://i.redd.it/mb2qlkaxex161.jpg,1606545559.0,"{'author': 'bandicootbandit', 'created_utc': 1606545559, 'title': 'We see your move Citron and raise you a trip to the 🌙. PLTR 🚀🚀🚀', 'url': 'https://i.redd.it/mb2qlkaxex161.jpg', 'created': 1606545559.0}",2020-11-28 06:39:19
8,MelchekoYT,1606545509,does this get resolved over the weekend? this is my first time seeing something like this with options,https://i.redd.it/7e5q4129ex161.jpg,1606545509.0,"{'author': 'MelchekoYT', 'created_utc': 1606545509, 'title': 'does this get resolved over the weekend? this is my first time seeing something like this with options', 'url': 'https://i.redd.it/7e5q4129ex161.jpg', 'created': 1606545509.0}",2020-11-28 06:38:29
9,Lolzomolo,1606545486,Short Squeeze ALL IN. My friend just explained what short selling is. These tards are shorting more then there are GME stocks.,https://i.redd.it/m8idckhsex161.png,1606545486.0,"{'author': 'Lolzomolo', 'created_utc': 1606545486, 'title': 'Short Squeeze ALL IN. My friend just explained what short selling is. These tards are shorting more then there are GME stocks.', 'url': 'https://i.redd.it/m8idckhsex161.png', 'created': 1606545486.0}",2020-11-28 06:38:06
10,Lolzomolo,1606545359,GME Short Squeeze,https://i.redd.it/33mau2zmex161.png,1606545359.0,"{'author': 'Lolzomolo', 'created_utc': 1606545359, 'title': 'GME Short Squeeze', 'url': 'https://i.redd.it/33mau2zmex161.png', 'created': 1606545359.0}",2020-11-28 06:35:59
11,phillycheesesteak10,1606545317,buy $SEARS,https://www.reddit.com/gallery/k2ix9v,1606545317.0,"{'author': 'phillycheesesteak10', 'created_utc': 1606545317, 'title': 'buy $SEARS', 'url': 'https://www.reddit.com/gallery/k2ix9v', 'created': 1606545317.0}",2020-11-28 06:35:17
12,heyfuBABZ,1606545250,Just started trading options a few weeks ago. Thanks gang. 🚀🚀🚀,https://i.redd.it/kf50wo8cex161.png,1606545250.0,"{'author': 'heyfuBABZ', 'created_utc': 1606545250, 'title': 'Just started trading options a few weeks ago. Thanks gang. 🚀🚀🚀', 'url': 'https://i.redd.it/kf50wo8cex161.png', 'created': 1606545250.0}",2020-11-28 06:34:10
13,epicgohan,1606545152,me rn 😡😡😡,https://i.redd.it/mb3ubjn1ex161.jpg,1606545152.0,"{'author': 'epicgohan', 'created_utc': 1606545152, 'title': 'me rn 😡😡😡', 'url': 'https://i.redd.it/mb3ubjn1ex161.jpg', 'created': 1606545152.0}",2020-11-28 06:32:32
14,PossessionDapper609,1606545125,McCafe (MCFE),https://www.reddit.com/r/wallstreetbets/comments/k2ivup/mccafe_mcfe/,1606545125.0,"{'author': 'PossessionDapper609', 'created_utc': 1606545125, 'title': 'McCafe (MCFE)', 'url': 'https://www.reddit.com/r/wallstreetbets/comments/k2ivup/mccafe_mcfe/', 'created': 1606545125.0}",2020-11-28 06:32:05
15,andrewvl,1606545023,Account deficit after making a deposit. Don’t use margin,https://www.reddit.com/r/wallstreetbets/comments/k2iv4e/account_deficit_after_making_a_deposit_dont_use/,1606545023.0,"{'author': 'andrewvl', 'created_utc': 1606545023, 'title': 'Account deficit after making a deposit. Don’t use margin', 'url': 'https://www.reddit.com/r/wallstreetbets/comments/k2iv4e/account_deficit_after_making_a_deposit_dont_use/', 'created': 1606545023.0}",2020-11-28 06:30:23
16,WSB_BULL,1606545016,SUPPORT MY CRIPPLING ADDICTION,https://www.reddit.com/r/wallstreetbets/comments/k2iv2c/support_my_crippling_addiction/,1606545016.0,"{'author': 'WSB_BULL', 'created_utc': 1606545016, 'title': 'SUPPORT MY CRIPPLING ADDICTION', 'url': 'https://www.reddit.com/r/wallstreetbets/comments/k2iv2c/support_my_crippling_addiction/', 'created': 1606545016.0}",2020-11-28 06:30:16
17,Jwalktm,1606544897,Monday 🚀🚀🚀,https://i.redd.it/q89sbjt9dx161.jpg,1606544897.0,"{'author': 'Jwalktm', 'created_utc': 1606544897, 'title': 'Monday 🚀🚀🚀', 'url': 'https://i.redd.it/q89sbjt9dx161.jpg', 'created': 1606544897.0}",2020-11-28 06:28:17
18,heyfuBABZ,1606544886,APHA headed to the moon Monday?,https://www.reddit.com/r/wallstreetbets/comments/k2iu4k/apha_headed_to_the_moon_monday/,1606544886.0,"{'author': 'heyfuBABZ', 'created_utc': 1606544886, 'title': 'APHA headed to the moon Monday?', 'url': 'https://www.reddit.com/r/wallstreetbets/comments/k2iu4k/apha_headed_to_the_moon_monday/', 'created': 1606544886.0}",2020-11-28 06:28:06
19,ayn_rando,1606544580,Quick question,https://www.reddit.com/r/wallstreetbets/comments/k2irt0/quick_question/,1606544580.0,"{'author': 'ayn_rando', 'created_utc': 1606544580, 'title': 'Quick question', 'url': 'https://www.reddit.com/r/wallstreetbets/comments/k2irt0/quick_question/', 'created': 1606544580.0}",2020-11-28 06:23:00
20,Upstairs-Ad-2997,1606544576,Estimated price for PLTR on Monday?,https://www.reddit.com/r/wallstreetbets/comments/k2irs0/estimated_price_for_pltr_on_monday/,1606544576.0,"{'author': 'Upstairs-Ad-2997', 'created_utc': 1606544576, 'title': 'Estimated price for PLTR on Monday?', 'url': 'https://www.reddit.com/r/wallstreetbets/comments/k2irs0/estimated_price_for_pltr_on_monday/', 'created': 1606544576.0}",2020-11-28 06:22:56
21,StubaKuula,1606544453,Thcb / Microvast 🤑,https://www.reddit.com/r/wallstreetbets/comments/k2iqts/thcb_microvast/,1606544453.0,"{'author': 'StubaKuula', 'created_utc': 1606544453, 'title': 'Thcb / Microvast 🤑', 'url': 'https://www.reddit.com/r/wallstreetbets/comments/k2iqts/thcb_microvast/', 'created': 1606544453.0}",2020-11-28 06:20:53
22,SupaBboy,1606544387,"Don’t hate on my sundial plz. Most of the winnings are from SPCE calls, and tech calls",https://www.reddit.com/gallery/k2iqaw,1606544387.0,"{'author': 'SupaBboy', 'created_utc': 1606544387, 'title': 'Don’t hate on my sundial plz. Most of the winnings are from SPCE calls, and tech calls', 'url': 'https://www.reddit.com/gallery/k2iqaw', 'created': 1606544387.0}",2020-11-28 06:19:47
23,PossessionDapper609,1606544227,McCafe (MCFE),https://www.reddit.com/r/wallstreetbets/comments/k2ip3p/mccafe_mcfe/,1606544227.0,"{'author': 'PossessionDapper609', 'created_utc': 1606544227, 'title': 'McCafe (MCFE)', 'url': 'https://www.reddit.com/r/wallstreetbets/comments/k2ip3p/mccafe_mcfe/', 'created': 1606544227.0}",2020-11-28 06:17:07
24,PythonGod123,1606544165,Not massive but still something.,https://i.redd.it/ua04gs14bx161.jpg,1606544165.0,"{'author': 'PythonGod123', 'created_utc': 1606544165, 'title': 'Not massive but still something.', 'url': 'https://i.redd.it/ua04gs14bx161.jpg', 'created': 1606544165.0}",2020-11-28 06:16:05
25,Riggedy111,1606544016,Cash vs Margin Account,https://www.reddit.com/r/wallstreetbets/comments/k2inec/cash_vs_margin_account/,1606544016.0,"{'author': 'Riggedy111', 'created_utc': 1606544016, 'title': 'Cash vs Margin Account', 'url': 'https://www.reddit.com/r/wallstreetbets/comments/k2inec/cash_vs_margin_account/', 'created': 1606544016.0}",2020-11-28 06:13:36
26,DeuxPoutines,1606543936,"Not sure if I'll get banned for having a girlfriend, but she just got me the best gift in the world!",https://www.reddit.com/gallery/k2imsp,1606543936.0,"{'author': 'DeuxPoutines', 'created_utc': 1606543936, 'title': ""Not sure if I'll get banned for having a girlfriend, but she just got me the best gift in the world!"", 'url': 'https://www.reddit.com/gallery/k2imsp', 'created': 1606543936.0}",2020-11-28 06:12:16
27,Pfc_Pyle,1606543926,"Flairing meme on this one, ""tendies..."" banned @ arrr/investing",https://i.redd.it/2c8lnxo4ax161.jpg,1606543926.0,"{'author': 'Pfc_Pyle', 'created_utc': 1606543926, 'title': 'Flairing meme on this one, ""tendies..."" banned @ arrr/investing', 'url': 'https://i.redd.it/2c8lnxo4ax161.jpg', 'created': 1606543926.0}",2020-11-28 06:12:06
28,yeetfeet123,1606543832,Best way to learn basics of trading?,https://www.reddit.com/r/wallstreetbets/comments/k2im0x/best_way_to_learn_basics_of_trading/,1606543832.0,"{'author': 'yeetfeet123', 'created_utc': 1606543832, 'title': 'Best way to learn basics of trading?', 'url': 'https://www.reddit.com/r/wallstreetbets/comments/k2im0x/best_way_to_learn_basics_of_trading/', 'created': 1606543832.0}",2020-11-28 06:10:32
29,roz303,1606543798,Palantir go brrrr,https://i.redd.it/b0zvswp0ax161.png,1606543798.0,"{'author': 'roz303', 'created_utc': 1606543798, 'title': 'Palantir go brrrr', 'url': 'https://i.redd.it/b0zvswp0ax161.png', 'created': 1606543798.0}",2020-11-28 06:09:58
30,luckieboy8811,1606543763,Hope no ones holding calls. BABA.,https://i.redd.it/jt9w1exw9x161.jpg,1606543763.0,"{'author': 'luckieboy8811', 'created_utc': 1606543763, 'title': 'Hope no ones holding calls. BABA.', 'url': 'https://i.redd.it/jt9w1exw9x161.jpg', 'created': 1606543763.0}",2020-11-28 06:09:23
31,Cowboyre,1606543706,I want a million dollars,https://www.reddit.com/r/wallstreetbets/comments/k2ikyt/i_want_a_million_dollars/,1606543706.0,"{'author': 'Cowboyre', 'created_utc': 1606543706, 'title': 'I want a million dollars', 'url': 'https://www.reddit.com/r/wallstreetbets/comments/k2ikyt/i_want_a_million_dollars/', 'created': 1606543706.0}",2020-11-28 06:08:26
32,Snowballeffects,1606543562,Need a yolo to keep playing,https://www.reddit.com/r/wallstreetbets/comments/k2ijsx/need_a_yolo_to_keep_playing/,1606543562.0,"{'author': 'Snowballeffects', 'created_utc': 1606543562, 'title': 'Need a yolo to keep playing', 'url': 'https://www.reddit.com/r/wallstreetbets/comments/k2ijsx/need_a_yolo_to_keep_playing/', 'created': 1606543562.0}",2020-11-28 06:06:02
33,PopeFuckingFrancis,1606543510,Alright which one of you lost all your money.,https://i.redd.it/pniy61y59x161.jpg,1606543510.0,"{'author': 'PopeFuckingFrancis', 'created_utc': 1606543510, 'title': 'Alright which one of you lost all your money.', 'url': 'https://i.redd.it/pniy61y59x161.jpg', 'created': 1606543510.0}",2020-11-28 06:05:10
34,Doobag1,1606543365,Why would anyone buy a call option above the current price?,https://www.reddit.com/r/wallstreetbets/comments/k2ii6w/why_would_anyone_buy_a_call_option_above_the/,1606543365.0,"{'author': 'Doobag1', 'created_utc': 1606543365, 'title': 'Why would anyone buy a call option above the current price?', 'url': 'https://www.reddit.com/r/wallstreetbets/comments/k2ii6w/why_would_anyone_buy_a_call_option_above_the/', 'created': 1606543365.0}",2020-11-28 06:02:45
35,AAPL121200,1606543268,Just wanted to let you guys know I’m gonna be a multimillionaire fugitive on Monday,https://www.reddit.com/r/wallstreetbets/comments/k2ihg7/just_wanted_to_let_you_guys_know_im_gonna_be_a/,1606543268.0,"{'author': 'AAPL121200', 'created_utc': 1606543268, 'title': 'Just wanted to let you guys know I’m gonna be a multimillionaire fugitive on Monday', 'url': 'https://www.reddit.com/r/wallstreetbets/comments/k2ihg7/just_wanted_to_let_you_guys_know_im_gonna_be_a/', 'created': 1606543268.0}",2020-11-28 06:01:08
36,Xhafsn,1606543143,Another Haiku for you autists,https://www.reddit.com/r/wallstreetbets/comments/k2igdf/another_haiku_for_you_autists/,1606543143.0,"{'author': 'Xhafsn', 'created_utc': 1606543143, 'title': 'Another Haiku for you autists', 'url': 'https://www.reddit.com/r/wallstreetbets/comments/k2igdf/another_haiku_for_you_autists/', 'created': 1606543143.0}",2020-11-28 05:59:03
37,WallStreetBoomer,1606543034,Investing in PLTR is morally bankrupt behavior,https://www.reddit.com/r/wallstreetbets/comments/k2ifht/investing_in_pltr_is_morally_bankrupt_behavior/,1606543034.0,"{'author': 'WallStreetBoomer', 'created_utc': 1606543034, 'title': 'Investing in PLTR is morally bankrupt behavior', 'url': 'https://www.reddit.com/r/wallstreetbets/comments/k2ifht/investing_in_pltr_is_morally_bankrupt_behavior/', 'created': 1606543034.0}",2020-11-28 05:57:14
38,Ralf_Macho,1606542927,Everyone whos bought PLTR,https://i.redd.it/jqptewif7x161.jpg,1606542927.0,"{'author': 'Ralf_Macho', 'created_utc': 1606542927, 'title': 'Everyone whos bought PLTR', 'url': 'https://i.redd.it/jqptewif7x161.jpg', 'created': 1606542927.0}",2020-11-28 05:55:27
39,JohnChris1924,1606542902,BREAKING NEWS: PALENTIR TECHNOLOGIES RUNS OUT OF SHARES TO SELL WITH SURGE OF REDDITORS BUYING THEM,https://www.reddit.com/r/wallstreetbets/comments/k2ieh0/breaking_news_palentir_technologies_runs_out_of/,1606542902.0,"{'author': 'JohnChris1924', 'created_utc': 1606542902, 'title': 'BREAKING NEWS: PALENTIR TECHNOLOGIES RUNS OUT OF SHARES TO SELL WITH SURGE OF REDDITORS BUYING THEM', 'url': 'https://www.reddit.com/r/wallstreetbets/comments/k2ieh0/breaking_news_palentir_technologies_runs_out_of/', 'created': 1606542902.0}",2020-11-28 05:55:02
40,-ChandlerBing-,1606542885,Had to make an entire presentation on the money I lost on calls this morning to my dad “my error can make us rich”,https://i.redd.it/5133320b7x161.jpg,1606542885.0,"{'author': '-ChandlerBing-', 'created_utc': 1606542885, 'title': 'Had to make an entire presentation on the money I lost on calls this morning to my dad “my error can make us rich”', 'url': 'https://i.redd.it/5133320b7x161.jpg', 'created': 1606542885.0}",2020-11-28 05:54:45
41,fish1515,1606542823,MNKD FDA approval Q1 10x bagger,https://www.reddit.com/r/wallstreetbets/comments/k2idux/mnkd_fda_approval_q1_10x_bagger/,1606542823.0,"{'author': 'fish1515', 'created_utc': 1606542823, 'title': 'MNKD FDA approval Q1 10x bagger', 'url': 'https://www.reddit.com/r/wallstreetbets/comments/k2idux/mnkd_fda_approval_q1_10x_bagger/', 'created': 1606542823.0}",2020-11-28 05:53:43
42,PenultimateExemplar,1606542540,Citron is right: PLTR is going to crash,https://www.reddit.com/r/wallstreetbets/comments/k2ibl4/citron_is_right_pltr_is_going_to_crash/,1606542540.0,"{'author': 'PenultimateExemplar', 'created_utc': 1606542540, 'title': 'Citron is right: PLTR is going to crash', 'url': 'https://www.reddit.com/r/wallstreetbets/comments/k2ibl4/citron_is_right_pltr_is_going_to_crash/', 'created': 1606542540.0}",2020-11-28 05:49:00
43,Xhafsn,1606542342,Haiku,https://www.reddit.com/r/wallstreetbets/comments/k2ia2s/haiku/,1606542342.0,"{'author': 'Xhafsn', 'created_utc': 1606542342, 'title': 'Haiku', 'url': 'https://www.reddit.com/r/wallstreetbets/comments/k2ia2s/haiku/', 'created': 1606542342.0}",2020-11-28 05:45:42
44,newpcgamerjuly2,1606542264,Shitron Gets Fucking Rekt,https://v.redd.it/jal0f6vx4x161,1606542264.0,"{'author': 'newpcgamerjuly2', 'created_utc': 1606542264, 'title': 'Shitron Gets Fucking Rekt', 'url': 'https://v.redd.it/jal0f6vx4x161', 'created': 1606542264.0}",2020-11-28 05:44:24
45,SnooTangerines6953,1606542161,QS TO THE MOON,https://www.reddit.com/r/wallstreetbets/comments/k2i8nt/qs_to_the_moon/,1606542161.0,"{'author': 'SnooTangerines6953', 'created_utc': 1606542161, 'title': 'QS TO THE MOON', 'url': 'https://www.reddit.com/r/wallstreetbets/comments/k2i8nt/qs_to_the_moon/', 'created': 1606542161.0}",2020-11-28 05:42:41
46,Austint3168,1606542064,$PLTR 🌈🐻s waking up this morning,https://i.redd.it/dajklgfu4x161.gif,1606542064.0,"{'author': 'Austint3168', 'created_utc': 1606542064, 'title': '$PLTR 🌈🐻s waking up this morning', 'url': 'https://i.redd.it/dajklgfu4x161.gif', 'created': 1606542064.0}",2020-11-28 05:41:04
47,snatad,1606541991,"Keemstar confirmed it, pltr to the moon fellas 💪",https://i.redd.it/aroi07dn4x161.jpg,1606541991.0,"{'author': 'snatad', 'created_utc': 1606541991, 'title': 'Keemstar confirmed it, pltr to the moon fellas 💪', 'url': 'https://i.redd.it/aroi07dn4x161.jpg', 'created': 1606541991.0}",2020-11-28 05:39:51
48,Expert_Ad568,1606541990,No Not Again,https://i.redd.it/enti7n8n4x161.jpg,1606541990.0,"{'author': 'Expert_Ad568', 'created_utc': 1606541990, 'title': 'No Not Again', 'url': 'https://i.redd.it/enti7n8n4x161.jpg', 'created': 1606541990.0}",2020-11-28 05:39:50
49,Zestyclose_Ad_1566,1606541938,The South Korean gaming stock no one has heard of that will 10x : GRVY,https://www.reddit.com/r/wallstreetbets/comments/k2i6v1/the_south_korean_gaming_stock_no_one_has_heard_of/,1606541938.0,"{'author': 'Zestyclose_Ad_1566', 'created_utc': 1606541938, 'title': 'The South Korean gaming stock no one has heard of that will 10x : GRVY', 'url': 'https://www.reddit.com/r/wallstreetbets/comments/k2i6v1/the_south_korean_gaming_stock_no_one_has_heard_of/', 'created': 1606541938.0}",2020-11-28 05:38:58
50,orlyrlyowl,1606541542,THiC Boi's Volume Expected to Double in 2020🚀,http://m.chinabuses.org/news/12228.html,1606541542.0,"{'author': 'orlyrlyowl', 'created_utc': 1606541542, 'title': ""THiC Boi's Volume Expected to Double in 2020🚀"", 'url': 'http://m.chinabuses.org/news/12228.html', 'created': 1606541542.0}",2020-11-28 05:32:22
51,chucks97ss,1606541496,"After getting fucked like a duck this summer on some bs calls by some morons on twitter (cough CLSN cough), I decided to go long on some stuff I actually liked. COCP, ABUS, SPAQ, LCA, PIC, GNUS, and BYND. That didn’t go so well at first either... until it did.",https://v.redd.it/7s9yhx131x161,1606541496.0,"{'author': 'chucks97ss', 'created_utc': 1606541496, 'title': 'After getting fucked like a duck this summer on some bs calls by some morons on twitter (cough CLSN cough), I decided to go long on some stuff I actually liked. COCP, ABUS, SPAQ, LCA, PIC, GNUS, and BYND. That didn’t go so well at first either... until it did.', 'url': 'https://v.redd.it/7s9yhx131x161', 'created': 1606541496.0}",2020-11-28 05:31:36
52,newpcgamerjuly2,1606541442,Shitron Gets Fucking Rekt,https://v.redd.it/bbecwe7u2x161,1606541442.0,"{'author': 'newpcgamerjuly2', 'created_utc': 1606541442, 'title': 'Shitron Gets Fucking Rekt', 'url': 'https://v.redd.it/bbecwe7u2x161', 'created': 1606541442.0}",2020-11-28 05:30:42
53,restless09,1606541407,Investment advice,https://www.reddit.com/r/wallstreetbets/comments/k2i2iw/investment_advice/,1606541407.0,"{'author': 'restless09', 'created_utc': 1606541407, 'title': 'Investment advice', 'url': 'https://www.reddit.com/r/wallstreetbets/comments/k2i2iw/investment_advice/', 'created': 1606541407.0}",2020-11-28 05:30:07
54,megnuttsimp22,1606541379,What is the next PLTR?,https://www.reddit.com/r/wallstreetbets/comments/k2i2b6/what_is_the_next_pltr/,1606541379.0,"{'author': 'megnuttsimp22', 'created_utc': 1606541379, 'title': 'What is the next PLTR?', 'url': 'https://www.reddit.com/r/wallstreetbets/comments/k2i2b6/what_is_the_next_pltr/', 'created': 1606541379.0}",2020-11-28 05:29:39
55,SonOfMeme,1606541278,The 🚀ride🚀 never ends,https://v.redd.it/z6cyjg0b2x161,1606541278.0,"{'author': 'SonOfMeme', 'created_utc': 1606541278, 'title': 'The 🚀ride🚀 never ends', 'url': 'https://v.redd.it/z6cyjg0b2x161', 'created': 1606541278.0}",2020-11-28 05:27:58
56,ImKetchupmothafcka,1606541276,Hey fellow retards.... I think the boomer 🌈🐻 are catching on.,https://www.reddit.com/r/wallstreetbets/comments/k2i1hs/hey_fellow_retards_i_think_the_boomer_are/,1606541276.0,"{'author': 'ImKetchupmothafcka', 'created_utc': 1606541276, 'title': 'Hey fellow retards.... I think the boomer 🌈🐻 are catching on.', 'url': 'https://www.reddit.com/r/wallstreetbets/comments/k2i1hs/hey_fellow_retards_i_think_the_boomer_are/', 'created': 1606541276.0}",2020-11-28 05:27:56
57,newpcgamerjuly2,1606541261,Shitron Gets Fucking Rekt,https://v.redd.it/9ppebaht1x161,1606541261.0,"{'author': 'newpcgamerjuly2', 'created_utc': 1606541261, 'title': 'Shitron Gets Fucking Rekt', 'url': 'https://v.redd.it/9ppebaht1x161', 'created': 1606541261.0}",2020-11-28 05:27:41
58,Wy109,1606541213,SRAC ??,https://www.reddit.com/r/wallstreetbets/comments/k2i0zy/srac/,1606541213.0,"{'author': 'Wy109', 'created_utc': 1606541213, 'title': 'SRAC ??', 'url': 'https://www.reddit.com/r/wallstreetbets/comments/k2i0zy/srac/', 'created': 1606541213.0}",2020-11-28 05:26:53
59,ThrivingProject,1606541111,"FinVolution - Insane Fundamentals, Big Data, Artificial Intelligence $2.23/Share",https://www.reddit.com/r/wallstreetbets/comments/k2i057/finvolution_insane_fundamentals_big_data/,1606541111.0,"{'author': 'ThrivingProject', 'created_utc': 1606541111, 'title': 'FinVolution - Insane Fundamentals, Big Data, Artificial Intelligence $2.23/Share', 'url': 'https://www.reddit.com/r/wallstreetbets/comments/k2i057/finvolution_insane_fundamentals_big_data/', 'created': 1606541111.0}",2020-11-28 05:25:11
60,erasti32,1606541006,Do these Citron pussies ever fuck off?,https://i.redd.it/twctsqrp1x161.png,1606541006.0,"{'author': 'erasti32', 'created_utc': 1606541006, 'title': 'Do these Citron pussies ever fuck off?', 'url': 'https://i.redd.it/twctsqrp1x161.png', 'created': 1606541006.0}",2020-11-28 05:23:26
61,not_enough_characte,1606540967,Too late to hop on the GRWG train?,https://www.reddit.com/r/wallstreetbets/comments/k2hyxn/too_late_to_hop_on_the_grwg_train/,1606540967.0,"{'author': 'not_enough_characte', 'created_utc': 1606540967, 'title': 'Too late to hop on the GRWG train?', 'url': 'https://www.reddit.com/r/wallstreetbets/comments/k2hyxn/too_late_to_hop_on_the_grwg_train/', 'created': 1606540967.0}",2020-11-28 05:22:47
62,megnuttsimp22,1606540963,Wanting to make a YOLO,https://www.reddit.com/r/wallstreetbets/comments/k2hywd/wanting_to_make_a_yolo/,1606540963.0,"{'author': 'megnuttsimp22', 'created_utc': 1606540963, 'title': 'Wanting to make a YOLO', 'url': 'https://www.reddit.com/r/wallstreetbets/comments/k2hywd/wanting_to_make_a_yolo/', 'created': 1606540963.0}",2020-11-28 05:22:43
63,bfh956,1606540931,please help me turn $1000 into $1700 so I can afford a PC,https://www.reddit.com/r/wallstreetbets/comments/k2hyne/please_help_me_turn_1000_into_1700_so_i_can/,1606540931.0,"{'author': 'bfh956', 'created_utc': 1606540931, 'title': 'please help me turn $1000 into $1700 so I can afford a PC', 'url': 'https://www.reddit.com/r/wallstreetbets/comments/k2hyne/please_help_me_turn_1000_into_1700_so_i_can/', 'created': 1606540931.0}",2020-11-28 05:22:11
64,chumperx,1606540911,What if you buy more options than there are shares?,https://www.reddit.com/r/wallstreetbets/comments/k2hyhu/what_if_you_buy_more_options_than_there_are_shares/,1606540911.0,"{'author': 'chumperx', 'created_utc': 1606540911, 'title': 'What if you buy more options than there are shares?', 'url': 'https://www.reddit.com/r/wallstreetbets/comments/k2hyhu/what_if_you_buy_more_options_than_there_are_shares/', 'created': 1606540911.0}",2020-11-28 05:21:51
65,Qscfr,1606540883,Fuck Lil Yachty,https://www.reddit.com/r/wallstreetbets/comments/k2hy9t/fuck_lil_yachty/,1606540883.0,"{'author': 'Qscfr', 'created_utc': 1606540883, 'title': 'Fuck Lil Yachty', 'url': 'https://www.reddit.com/r/wallstreetbets/comments/k2hy9t/fuck_lil_yachty/', 'created': 1606540883.0}",2020-11-28 05:21:23
66,warflamingo,1606540656,Citron is a bet that YOU don’t know trading basics. Time for class autists PLTR $100,https://www.reddit.com/r/wallstreetbets/comments/j0agu8/ready_to_actually_start_making_a_lotta_bit_of/?utm_source=share&amp;utm_medium=ios_app&amp;utm_name=iossmf,1606540656.0,"{'author': 'warflamingo', 'created_utc': 1606540656, 'title': 'Citron is a bet that YOU don’t know trading basics. Time for class autists PLTR $100', 'url': 'https://www.reddit.com/r/wallstreetbets/comments/j0agu8/ready_to_actually_start_making_a_lotta_bit_of/?utm_source=share&amp;utm_medium=ios_app&amp;utm_name=iossmf', 'created': 1606540656.0}",2020-11-28 05:17:36
