,author,created_utc,title,url,created,d_,created_utc_dt
0,Mak992,1611868035,"All this sketchy Robinhood stuff, is exactly why you all should open an investment account with a legitimate bank. Phuck these dodgy apps",https://www.reddit.com/r/wallstreetbets/comments/l78v72/all_this_sketchy_robinhood_stuff_is_exactly_why/,1611868035.0,"{'author': 'Mak992', 'created_utc': 1611868035, 'title': 'All this sketchy Robinhood stuff, is exactly why you all should open an investment account with a legitimate bank. Phuck these dodgy apps', 'url': 'https://www.reddit.com/r/wallstreetbets/comments/l78v72/all_this_sketchy_robinhood_stuff_is_exactly_why/', 'created': 1611868035.0}",2021-01-28 21:07:15
1,ICanChangeTheWorld,1611868035,I'm sorry guys I think it was my fault 😢,https://i.redd.it/oe63ritm15e61.png,1611868035.0,"{'author': 'ICanChangeTheWorld', 'created_utc': 1611868035, 'title': ""I'm sorry guys I think it was my fault 😢"", 'url': 'https://i.redd.it/oe63ritm15e61.png', 'created': 1611868035.0}",2021-01-28 21:07:15
2,fuckingrocket,1611868035,Hahah,https://i.redd.it/p4ik86ep15e61.jpg,1611868035.0,"{'author': 'fuckingrocket', 'created_utc': 1611868035, 'title': 'Hahah', 'url': 'https://i.redd.it/p4ik86ep15e61.jpg', 'created': 1611868035.0}",2021-01-28 21:07:15
3,TelephoneDry7966,1611868035,Proof of market manipulation! Might be useful in court? No halts during pre/post market 😡😡,https://i.redd.it/4jtm8c7p15e61.jpg,1611868035.0,"{'author': 'TelephoneDry7966', 'created_utc': 1611868035, 'title': 'Proof of market manipulation! Might be useful in court? No halts during pre/post market 😡😡', 'url': 'https://i.redd.it/4jtm8c7p15e61.jpg', 'created': 1611868035.0}",2021-01-28 21:07:15
4,_Finegan_,1611868035,Feelin good might revive Blockbuster when were done holding,https://www.reddit.com/r/wallstreetbets/comments/l78v6f/feelin_good_might_revive_blockbuster_when_were/,1611868035.0,"{'author': '_Finegan_', 'created_utc': 1611868035, 'title': 'Feelin good might revive Blockbuster when were done holding', 'url': 'https://www.reddit.com/r/wallstreetbets/comments/l78v6f/feelin_good_might_revive_blockbuster_when_were/', 'created': 1611868035.0}",2021-01-28 21:07:15
5,Doom_Pyramid,1611868034,Hell new to stocks but what apps or sites do you guys recommend for investing in stocks,https://www.reddit.com/r/wallstreetbets/comments/l78v60/hell_new_to_stocks_but_what_apps_or_sites_do_you/,1611868034.0,"{'author': 'Doom_Pyramid', 'created_utc': 1611868034, 'title': 'Hell new to stocks but what apps or sites do you guys recommend for investing in stocks', 'url': 'https://www.reddit.com/r/wallstreetbets/comments/l78v60/hell_new_to_stocks_but_what_apps_or_sites_do_you/', 'created': 1611868034.0}",2021-01-28 21:07:14
6,LetterheadFluffy2044,1611868034,Someone is selling their stocks on Craigslist!,https://i.redd.it/nb65aygp15e61.jpg,1611868034.0,"{'author': 'LetterheadFluffy2044', 'created_utc': 1611868034, 'title': 'Someone is selling their stocks on Craigslist!', 'url': 'https://i.redd.it/nb65aygp15e61.jpg', 'created': 1611868034.0}",2021-01-28 21:07:14
7,ExtraGarlicy,1611868034,the grand unification,https://i.redd.it/1rn5ajfp15e61.jpg,1611868034.0,"{'author': 'ExtraGarlicy', 'created_utc': 1611868034, 'title': 'the grand unification', 'url': 'https://i.redd.it/1rn5ajfp15e61.jpg', 'created': 1611868034.0}",2021-01-28 21:07:14
8,Antique_Talk_6736,1611868034,"Everyone FUCKING hold NOK, BB, GME, THEY WANT US TO PANIC SELL, HOLD TILL THEY LET US TRADE. FUCK WALLSTREET ELITE STEALING MONEY FROM THE POOR.",https://www.reddit.com/r/wallstreetbets/comments/l78v5k/everyone_fucking_hold_nok_bb_gme_they_want_us_to/,1611868034.0,"{'author': 'Antique_Talk_6736', 'created_utc': 1611868034, 'title': 'Everyone FUCKING hold NOK, BB, GME, THEY WANT US TO PANIC SELL, HOLD TILL THEY LET US TRADE. FUCK WALLSTREET ELITE STEALING MONEY FROM THE POOR.', 'url': 'https://www.reddit.com/r/wallstreetbets/comments/l78v5k/everyone_fucking_hold_nok_bb_gme_they_want_us_to/', 'created': 1611868034.0}",2021-01-28 21:07:14
9,tyhurd,1611868033,Robinhood faces backlash from both parties for limiting trades and is hit with a class action - Now let's see if anything actually happens... :-(,https://www.engadget.com/robinhood-class-action-lawsuit-gamestop-191704848.html,1611868033.0,"{'author': 'tyhurd', 'created_utc': 1611868033, 'title': ""Robinhood faces backlash from both parties for limiting trades and is hit with a class action - Now let's see if anything actually happens... :-("", 'url': 'https://www.engadget.com/robinhood-class-action-lawsuit-gamestop-191704848.html', 'created': 1611868033.0}",2021-01-28 21:07:13
10,rfab22,1611868032,DOGEEEE,https://www.reddit.com/r/wallstreetbets/comments/l78v4u/dogeeee/,1611868032.0,"{'author': 'rfab22', 'created_utc': 1611868032, 'title': 'DOGEEEE', 'url': 'https://www.reddit.com/r/wallstreetbets/comments/l78v4u/dogeeee/', 'created': 1611868032.0}",2021-01-28 21:07:12
11,EducationalSetting,1611868032,From Randall,https://i.redd.it/67sute9p15e61.jpg,1611868032.0,"{'author': 'EducationalSetting', 'created_utc': 1611868032, 'title': 'From Randall', 'url': 'https://i.redd.it/67sute9p15e61.jpg', 'created': 1611868032.0}",2021-01-28 21:07:12
12,TheYellowAstronaut,1611868032,"Fellow Canadian here, holding the line with what I could afford. Allies since the World Wars, allies forever 🇺🇸🇨🇦",https://i.redd.it/0zyuk38p15e61.jpg,1611868032.0,"{'author': 'TheYellowAstronaut', 'created_utc': 1611868032, 'title': 'Fellow Canadian here, holding the line with what I could afford. Allies since the World Wars, allies forever 🇺🇸🇨🇦', 'url': 'https://i.redd.it/0zyuk38p15e61.jpg', 'created': 1611868032.0}",2021-01-28 21:07:12
13,Darth_Kal-El,1611868032,"AMC, GME shares able to be bought via the Dough app.",https://i.redd.it/samvb4ap15e61.jpg,1611868032.0,"{'author': 'Darth_Kal-El', 'created_utc': 1611868032, 'title': 'AMC, GME shares able to be bought via the Dough app.', 'url': 'https://i.redd.it/samvb4ap15e61.jpg', 'created': 1611868032.0}",2021-01-28 21:07:12
14,Khan9117706,1611868032,Bro I need a yes or no,https://www.reddit.com/r/wallstreetbets/comments/l78v4a/bro_i_need_a_yes_or_no/,1611868032.0,"{'author': 'Khan9117706', 'created_utc': 1611868032, 'title': 'Bro I need a yes or no', 'url': 'https://www.reddit.com/r/wallstreetbets/comments/l78v4a/bro_i_need_a_yes_or_no/', 'created': 1611868032.0}",2021-01-28 21:07:12
15,ItsMyBS,1611868032,The legend at work,https://i.redd.it/umr7898p15e61.jpg,1611868032.0,"{'author': 'ItsMyBS', 'created_utc': 1611868032, 'title': 'The legend at work', 'url': 'https://i.redd.it/umr7898p15e61.jpg', 'created': 1611868032.0}",2021-01-28 21:07:12
16,Silenteagle08,1611868031,TastyWorks is open folks,https://www.reddit.com/r/wallstreetbets/comments/l78v42/tastyworks_is_open_folks/,1611868031.0,"{'author': 'Silenteagle08', 'created_utc': 1611868031, 'title': 'TastyWorks is open folks', 'url': 'https://www.reddit.com/r/wallstreetbets/comments/l78v42/tastyworks_is_open_folks/', 'created': 1611868031.0}",2021-01-28 21:07:11
17,Doggoonewild,1611868031,YOU ARE THE BOSS OF GME IF YOU HOLD,https://www.reddit.com/r/wallstreetbets/comments/l78v3p/you_are_the_boss_of_gme_if_you_hold/,1611868031.0,"{'author': 'Doggoonewild', 'created_utc': 1611868031, 'title': 'YOU ARE THE BOSS OF GME IF YOU HOLD', 'url': 'https://www.reddit.com/r/wallstreetbets/comments/l78v3p/you_are_the_boss_of_gme_if_you_hold/', 'created': 1611868031.0}",2021-01-28 21:07:11
18,inaworldwithnonames,1611868031,wall street bets and reddit is the most famous thing in the world right now. this is historical.,https://www.google.ca/amp/s/globalnews.ca/news/7604872/reddit-gamestop-wallstreetbets-hold-the-line/amp/,1611868031.0,"{'author': 'inaworldwithnonames', 'created_utc': 1611868031, 'title': 'wall street bets and reddit is the most famous thing in the world right now. this is historical.', 'url': 'https://www.google.ca/amp/s/globalnews.ca/news/7604872/reddit-gamestop-wallstreetbets-hold-the-line/amp/', 'created': 1611868031.0}",2021-01-28 21:07:11
19,xcar911,1611868030,"HOLD THE LINE boys!!! this isn't over until we say so, To The MOON AND BEYOND!",https://i.redd.it/voq2eo2p15e61.jpg,1611868030.0,"{'author': 'xcar911', 'created_utc': 1611868030, 'title': ""HOLD THE LINE boys!!! this isn't over until we say so, To The MOON AND BEYOND!"", 'url': 'https://i.redd.it/voq2eo2p15e61.jpg', 'created': 1611868030.0}",2021-01-28 21:07:10
20,Kevg1111,1611868030,What can they do tomorrow?,https://www.reddit.com/r/wallstreetbets/comments/l78v2y/what_can_they_do_tomorrow/,1611868030.0,"{'author': 'Kevg1111', 'created_utc': 1611868030, 'title': 'What can they do tomorrow?', 'url': 'https://www.reddit.com/r/wallstreetbets/comments/l78v2y/what_can_they_do_tomorrow/', 'created': 1611868030.0}",2021-01-28 21:07:10
21,aRVAthrowaway,1611868030,Apex Clearing anyone?,https://www.wsj.com/articles/gamestop-trading-restrictions-blamed-on-wall-streets-clearing-firm-by-online-broker-11611867105,1611868030.0,"{'author': 'aRVAthrowaway', 'created_utc': 1611868030, 'title': 'Apex Clearing anyone?', 'url': 'https://www.wsj.com/articles/gamestop-trading-restrictions-blamed-on-wall-streets-clearing-firm-by-online-broker-11611867105', 'created': 1611868030.0}",2021-01-28 21:07:10
22,Oharastar27,1611868029,Proud owner of GME,https://www.reddit.com/r/wallstreetbets/comments/l78v2s/proud_owner_of_gme/,1611868029.0,"{'author': 'Oharastar27', 'created_utc': 1611868029, 'title': 'Proud owner of GME', 'url': 'https://www.reddit.com/r/wallstreetbets/comments/l78v2s/proud_owner_of_gme/', 'created': 1611868029.0}",2021-01-28 21:07:09
23,jeffb00,1611868029,NGL doge coin looking kinda thicc but ROBBINTHEHOOD FAILED US TODAY,https://i.redd.it/xdhmxfyo15e61.jpg,1611868029.0,"{'author': 'jeffb00', 'created_utc': 1611868029, 'title': 'NGL doge coin looking kinda thicc but ROBBINTHEHOOD FAILED US TODAY', 'url': 'https://i.redd.it/xdhmxfyo15e61.jpg', 'created': 1611868029.0}",2021-01-28 21:07:09
24,DimeBag18,1611868028,HOLD FOR EVER🚀🚀🚀 THEY MUST BLEED. I'M SO EXITED I'VE GOT CHILLS DOWN MY BALLS,https://www.reddit.com/r/wallstreetbets/comments/l78v1x/hold_for_ever_they_must_bleed_im_so_exited_ive/,1611868028.0,"{'author': 'DimeBag18', 'created_utc': 1611868028, 'title': ""HOLD FOR EVER🚀🚀🚀 THEY MUST BLEED. I'M SO EXITED I'VE GOT CHILLS DOWN MY BALLS"", 'url': 'https://www.reddit.com/r/wallstreetbets/comments/l78v1x/hold_for_ever_they_must_bleed_im_so_exited_ive/', 'created': 1611868028.0}",2021-01-28 21:07:08
25,MeapinatorRock,1611868028,Force Robinhood’s ratings to PLUMMET,https://www.reddit.com/r/wallstreetbets/comments/l78v1s/force_robinhoods_ratings_to_plummet/,1611868028.0,"{'author': 'MeapinatorRock', 'created_utc': 1611868028, 'title': 'Force Robinhood’s ratings to PLUMMET', 'url': 'https://www.reddit.com/r/wallstreetbets/comments/l78v1s/force_robinhoods_ratings_to_plummet/', 'created': 1611868028.0}",2021-01-28 21:07:08
26,Miko09091,1611868028,Hello Everyone,https://www.reddit.com/r/wallstreetbets/comments/l78v1r/hello_everyone/,1611868028.0,"{'author': 'Miko09091', 'created_utc': 1611868028, 'title': 'Hello Everyone', 'url': 'https://www.reddit.com/r/wallstreetbets/comments/l78v1r/hello_everyone/', 'created': 1611868028.0}",2021-01-28 21:07:08
27,Top-Spirit4991,1611868027,Second lawsuit has been filed from Illinois,https://i.redd.it/qscbyiro15e61.jpg,1611868027.0,"{'author': 'Top-Spirit4991', 'created_utc': 1611868027, 'title': 'Second lawsuit has been filed from Illinois', 'url': 'https://i.redd.it/qscbyiro15e61.jpg', 'created': 1611868027.0}",2021-01-28 21:07:07
28,kamenrothen,1611868027,"New to this whole stonks stuff, but wanted to help as well. Hope I'm doing this right! This is in pesos",https://i.redd.it/m6bo6pso15e61.jpg,1611868027.0,"{'author': 'kamenrothen', 'created_utc': 1611868027, 'title': ""New to this whole stonks stuff, but wanted to help as well. Hope I'm doing this right! This is in pesos"", 'url': 'https://i.redd.it/m6bo6pso15e61.jpg', 'created': 1611868027.0}",2021-01-28 21:07:07
29,Armand237,1611868027,JUST SOLD OFF ALL MY POSITIONS TO BUY MORE GME💪🏻💪🏻💪🏻. HOLD THE DOOR! HOLD THE DOOR! HODOR👄👄🥰🥰,https://www.reddit.com/r/wallstreetbets/comments/l78v1j/just_sold_off_all_my_positions_to_buy_more_gme/,1611868027.0,"{'author': 'Armand237', 'created_utc': 1611868027, 'title': 'JUST SOLD OFF ALL MY POSITIONS TO BUY MORE GME💪🏻💪🏻💪🏻. HOLD THE DOOR! HOLD THE DOOR! HODOR👄👄🥰🥰', 'url': 'https://www.reddit.com/r/wallstreetbets/comments/l78v1j/just_sold_off_all_my_positions_to_buy_more_gme/', 'created': 1611868027.0}",2021-01-28 21:07:07
30,th1s1skol,1611868026,Dodge?,https://www.reddit.com/r/wallstreetbets/comments/l78v15/dodge/,1611868026.0,"{'author': 'th1s1skol', 'created_utc': 1611868026, 'title': 'Dodge?', 'url': 'https://www.reddit.com/r/wallstreetbets/comments/l78v15/dodge/', 'created': 1611868026.0}",2021-01-28 21:07:06
31,PFCordell,1611868026,Robin Hood has a 4.8 rating on the App Store,https://i.redd.it/ay88k8mo15e61.jpg,1611868026.0,"{'author': 'PFCordell', 'created_utc': 1611868026, 'title': 'Robin Hood has a 4.8 rating on the App Store', 'url': 'https://i.redd.it/ay88k8mo15e61.jpg', 'created': 1611868026.0}",2021-01-28 21:07:06
32,rudyyy10,1611868026,New to this,https://www.reddit.com/r/wallstreetbets/comments/l78v0v/new_to_this/,1611868026.0,"{'author': 'rudyyy10', 'created_utc': 1611868026, 'title': 'New to this', 'url': 'https://www.reddit.com/r/wallstreetbets/comments/l78v0v/new_to_this/', 'created': 1611868026.0}",2021-01-28 21:07:06
33,IAmPattycakes,1611868026,Another one into the fray,https://i.redd.it/2decimmo15e61.jpg,1611868026.0,"{'author': 'IAmPattycakes', 'created_utc': 1611868026, 'title': 'Another one into the fray', 'url': 'https://i.redd.it/2decimmo15e61.jpg', 'created': 1611868026.0}",2021-01-28 21:07:06
34,Domdaniel1,1611868026,I'm fully prepared to sink with this ship! I'm holding and if this is the last thing my investment account will do,https://www.reddit.com/r/wallstreetbets/comments/l78v0r/im_fully_prepared_to_sink_with_this_ship_im/,1611868026.0,"{'author': 'Domdaniel1', 'created_utc': 1611868026, 'title': ""I'm fully prepared to sink with this ship! I'm holding and if this is the last thing my investment account will do"", 'url': 'https://www.reddit.com/r/wallstreetbets/comments/l78v0r/im_fully_prepared_to_sink_with_this_ship_im/', 'created': 1611868026.0}",2021-01-28 21:07:06
35,PersonalityLocal3314,1611868025,AG being held back? 22% short position,https://www.reddit.com/r/wallstreetbets/comments/l78v0i/ag_being_held_back_22_short_position/,1611868025.0,"{'author': 'PersonalityLocal3314', 'created_utc': 1611868025, 'title': 'AG being held back? 22% short position', 'url': 'https://www.reddit.com/r/wallstreetbets/comments/l78v0i/ag_being_held_back_22_short_position/', 'created': 1611868025.0}",2021-01-28 21:07:05
36,Popular-Candidate673,1611868025,SKT,https://www.reddit.com/r/wallstreetbets/comments/l78v0g/skt/,1611868025.0,"{'author': 'Popular-Candidate673', 'created_utc': 1611868025, 'title': 'SKT', 'url': 'https://www.reddit.com/r/wallstreetbets/comments/l78v0g/skt/', 'created': 1611868025.0}",2021-01-28 21:07:05
37,H3RE4BEER,1611868024,See you tomorrow whales!,https://www.reddit.com/r/wallstreetbets/comments/l78v06/see_you_tomorrow_whales/,1611868024.0,"{'author': 'H3RE4BEER', 'created_utc': 1611868024, 'title': 'See you tomorrow whales!', 'url': 'https://www.reddit.com/r/wallstreetbets/comments/l78v06/see_you_tomorrow_whales/', 'created': 1611868024.0}",2021-01-28 21:07:04
38,BehavingGnarley,1611868024,What Is Now Considered The Best Stock Trading Site?,https://www.reddit.com/r/wallstreetbets/comments/l78uzq/what_is_now_considered_the_best_stock_trading_site/,1611868024.0,"{'author': 'BehavingGnarley', 'created_utc': 1611868024, 'title': 'What Is Now Considered The Best Stock Trading Site?', 'url': 'https://www.reddit.com/r/wallstreetbets/comments/l78uzq/what_is_now_considered_the_best_stock_trading_site/', 'created': 1611868024.0}",2021-01-28 21:07:04
39,Neuraxis_,1611868023,Dogecoin,https://www.reddit.com/r/wallstreetbets/comments/l78uze/dogecoin/,1611868023.0,"{'author': 'Neuraxis_', 'created_utc': 1611868023, 'title': 'Dogecoin', 'url': 'https://www.reddit.com/r/wallstreetbets/comments/l78uze/dogecoin/', 'created': 1611868023.0}",2021-01-28 21:07:03
40,RobinHoodarescammers,1611868023,I'm so pissed of,https://www.reddit.com/r/wallstreetbets/comments/l78uz7/im_so_pissed_of/,1611868023.0,"{'author': 'RobinHoodarescammers', 'created_utc': 1611868023, 'title': ""I'm so pissed of"", 'url': 'https://www.reddit.com/r/wallstreetbets/comments/l78uz7/im_so_pissed_of/', 'created': 1611868023.0}",2021-01-28 21:07:03
41,SDJ123456789,1611868022,Im a young Europoor who's really counting on holding and buying until the stock reach the Andromeda!,https://www.reddit.com/r/wallstreetbets/comments/l78uyy/im_a_young_europoor_whos_really_counting_on/,1611868022.0,"{'author': 'SDJ123456789', 'created_utc': 1611868022, 'title': ""Im a young Europoor who's really counting on holding and buying until the stock reach the Andromeda!"", 'url': 'https://www.reddit.com/r/wallstreetbets/comments/l78uyy/im_a_young_europoor_whos_really_counting_on/', 'created': 1611868022.0}",2021-01-28 21:07:02
42,workwhatwork0909,1611868021,weeeeeeeeeeeeeeeee,https://i.redd.it/xwjiii0g15e61.png,1611868021.0,"{'author': 'workwhatwork0909', 'created_utc': 1611868021, 'title': 'weeeeeeeeeeeeeeeee', 'url': 'https://i.redd.it/xwjiii0g15e61.png', 'created': 1611868021.0}",2021-01-28 21:07:01
43,DzyanW,1611868021,Joining You Autists FOR FREEDOM! HOLD GME,https://i.redd.it/sd5tp7g915e61.jpg,1611868021.0,"{'author': 'DzyanW', 'created_utc': 1611868021, 'title': 'Joining You Autists FOR FREEDOM! HOLD GME', 'url': 'https://i.redd.it/sd5tp7g915e61.jpg', 'created': 1611868021.0}",2021-01-28 21:07:01
44,slacknup,1611868020,I'm in!,https://www.reddit.com/r/wallstreetbets/comments/l78uxx/im_in/,1611868020.0,"{'author': 'slacknup', 'created_utc': 1611868020, 'title': ""I'm in!"", 'url': 'https://www.reddit.com/r/wallstreetbets/comments/l78uxx/im_in/', 'created': 1611868020.0}",2021-01-28 21:07:00
45,Competitive-Tax-8993,1611868020,THEY'RE UP,https://www.reddit.com/r/wallstreetbets/comments/l78uxm/theyre_up/,1611868020.0,"{'author': 'Competitive-Tax-8993', 'created_utc': 1611868020, 'title': ""THEY'RE UP"", 'url': 'https://www.reddit.com/r/wallstreetbets/comments/l78uxm/theyre_up/', 'created': 1611868020.0}",2021-01-28 21:07:00
46,Im_Action,1611868020,Small claims or class action which one should I file?,https://www.reddit.com/r/wallstreetbets/comments/l78uxl/small_claims_or_class_action_which_one_should_i/,1611868020.0,"{'author': 'Im_Action', 'created_utc': 1611868020, 'title': 'Small claims or class action which one should I file?', 'url': 'https://www.reddit.com/r/wallstreetbets/comments/l78uxl/small_claims_or_class_action_which_one_should_i/', 'created': 1611868020.0}",2021-01-28 21:07:00
47,aaleon2793,1611868020,Which penny stock should we blow up?!?,https://www.reddit.com/r/wallstreetbets/comments/l78uxk/which_penny_stock_should_we_blow_up/,1611868020.0,"{'author': 'aaleon2793', 'created_utc': 1611868020, 'title': 'Which penny stock should we blow up?!?', 'url': 'https://www.reddit.com/r/wallstreetbets/comments/l78uxk/which_penny_stock_should_we_blow_up/', 'created': 1611868020.0}",2021-01-28 21:07:00
48,nubcake1234,1611868019,Etrade blocking I can't go full retard on the dip 😭😭😭😭😭,https://www.reddit.com/r/wallstreetbets/comments/l78uxd/etrade_blocking_i_cant_go_full_retard_on_the_dip/,1611868019.0,"{'author': 'nubcake1234', 'created_utc': 1611868019, 'title': ""Etrade blocking I can't go full retard on the dip 😭😭😭😭😭"", 'url': 'https://www.reddit.com/r/wallstreetbets/comments/l78uxd/etrade_blocking_i_cant_go_full_retard_on_the_dip/', 'created': 1611868019.0}",2021-01-28 21:06:59
49,evanfx123,1611868019,It's not much but it's honest work,https://i.redd.it/ks3c9gwl15e61.png,1611868019.0,"{'author': 'evanfx123', 'created_utc': 1611868019, 'title': ""It's not much but it's honest work"", 'url': 'https://i.redd.it/ks3c9gwl15e61.png', 'created': 1611868019.0}",2021-01-28 21:06:59
50,Convillious,1611868019,Elon is writing poems with the tears of Wall Street short-shit-sellers,https://i.redd.it/5akckf7i15e61.png,1611868019.0,"{'author': 'Convillious', 'created_utc': 1611868019, 'title': 'Elon is writing poems with the tears of Wall Street short-shit-sellers', 'url': 'https://i.redd.it/5akckf7i15e61.png', 'created': 1611868019.0}",2021-01-28 21:06:59
51,Feedthemcake,1611868017,"Fenyx Rising, A New God.",https://twitter.com/GameStop/status/1354897037330935809?s=20,1611868017.0,"{'author': 'Feedthemcake', 'created_utc': 1611868017, 'title': 'Fenyx Rising, A New God.', 'url': 'https://twitter.com/GameStop/status/1354897037330935809?s=20', 'created': 1611868017.0}",2021-01-28 21:06:57
52,rdsandy111,1611868016,ETrade just stopped GME buys an hour ago.,https://www.reddit.com/r/wallstreetbets/comments/l78uvw/etrade_just_stopped_gme_buys_an_hour_ago/,1611868016.0,"{'author': 'rdsandy111', 'created_utc': 1611868016, 'title': 'ETrade just stopped GME buys an hour ago.', 'url': 'https://www.reddit.com/r/wallstreetbets/comments/l78uvw/etrade_just_stopped_gme_buys_an_hour_ago/', 'created': 1611868016.0}",2021-01-28 21:06:56
53,Cumblemoree,1611868016,WHAT THE FUCK IS GOING ON,https://www.reddit.com/r/wallstreetbets/comments/l78uvd/what_the_fuck_is_going_on/,1611868016.0,"{'author': 'Cumblemoree', 'created_utc': 1611868016, 'title': 'WHAT THE FUCK IS GOING ON', 'url': 'https://www.reddit.com/r/wallstreetbets/comments/l78uvd/what_the_fuck_is_going_on/', 'created': 1611868016.0}",2021-01-28 21:06:56
54,That_One_Scrub57,1611868016,I finally learned what this was all about,https://www.reddit.com/r/wallstreetbets/comments/l78uv8/i_finally_learned_what_this_was_all_about/,1611868016.0,"{'author': 'That_One_Scrub57', 'created_utc': 1611868016, 'title': 'I finally learned what this was all about', 'url': 'https://www.reddit.com/r/wallstreetbets/comments/l78uv8/i_finally_learned_what_this_was_all_about/', 'created': 1611868016.0}",2021-01-28 21:06:56
55,BombSquadron,1611868015,Are there any good YouTube accounts that teach about stocks?,https://www.reddit.com/r/wallstreetbets/comments/l78uv1/are_there_any_good_youtube_accounts_that_teach/,1611868015.0,"{'author': 'BombSquadron', 'created_utc': 1611868015, 'title': 'Are there any good YouTube accounts that teach about stocks?', 'url': 'https://www.reddit.com/r/wallstreetbets/comments/l78uv1/are_there_any_good_youtube_accounts_that_teach/', 'created': 1611868015.0}",2021-01-28 21:06:55
56,zrow05,1611868015,"Now that we have unity in holding GME and we know the rich and congress will fight us, should we go in on something else?",https://www.reddit.com/r/wallstreetbets/comments/l78uuw/now_that_we_have_unity_in_holding_gme_and_we_know/,1611868015.0,"{'author': 'zrow05', 'created_utc': 1611868015, 'title': 'Now that we have unity in holding GME and we know the rich and congress will fight us, should we go in on something else?', 'url': 'https://www.reddit.com/r/wallstreetbets/comments/l78uuw/now_that_we_have_unity_in_holding_gme_and_we_know/', 'created': 1611868015.0}",2021-01-28 21:06:55
57,SpeculatorScott,1611868015,"Down 80k today, but this is me Not. Fucking. Blinking. Fuck the suits. FIZZ Update 28 Jan 2021",https://i.redd.it/cdc2hwfn15e61.jpg,1611868015.0,"{'author': 'SpeculatorScott', 'created_utc': 1611868015, 'title': 'Down 80k today, but this is me Not. Fucking. Blinking. Fuck the suits. FIZZ Update 28 Jan 2021', 'url': 'https://i.redd.it/cdc2hwfn15e61.jpg', 'created': 1611868015.0}",2021-01-28 21:06:55
58,Ramon_Daniel,1611868015,Recent Tweet from Tyler Winklevoss,https://i.redd.it/omucui4h15e61.jpg,1611868015.0,"{'author': 'Ramon_Daniel', 'created_utc': 1611868015, 'title': 'Recent Tweet from Tyler Winklevoss', 'url': 'https://i.redd.it/omucui4h15e61.jpg', 'created': 1611868015.0}",2021-01-28 21:06:55
59,super_brock,1611868015,Hmm large put volume the day before stock is restricted??? Manipulation right in front of own fucking eyes. Hold GME🚀🚀🚀,https://i.redd.it/13ixocfn15e61.jpg,1611868015.0,"{'author': 'super_brock', 'created_utc': 1611868015, 'title': 'Hmm large put volume the day before stock is restricted??? Manipulation right in front of own fucking eyes. Hold GME🚀🚀🚀', 'url': 'https://i.redd.it/13ixocfn15e61.jpg', 'created': 1611868015.0}",2021-01-28 21:06:55
60,reuuster,1611868014,F*CK EM,https://i.redd.it/ctlvl0fn15e61.jpg,1611868014.0,"{'author': 'reuuster', 'created_utc': 1611868014, 'title': 'F*CK EM', 'url': 'https://i.redd.it/ctlvl0fn15e61.jpg', 'created': 1611868014.0}",2021-01-28 21:06:54
61,InternetCautious7488,1611868014,ZSAN deny or confirm,https://www.reddit.com/r/wallstreetbets/comments/l78uuc/zsan_deny_or_confirm/,1611868014.0,"{'author': 'InternetCautious7488', 'created_utc': 1611868014, 'title': 'ZSAN deny or confirm', 'url': 'https://www.reddit.com/r/wallstreetbets/comments/l78uuc/zsan_deny_or_confirm/', 'created': 1611868014.0}",2021-01-28 21:06:54
62,Logan_Mac,1611868014,"""The Intelligent Investor"" is the current #1 in the Deals in Books list on Amazon lmao (Best Sellers Rank: #23 in Books)",https://www.amazon.com/bestsellers/books/45/ref=zg_b_bs_45_1,1611868014.0,"{'author': 'Logan_Mac', 'created_utc': 1611868014, 'title': '""The Intelligent Investor"" is the current #1 in the Deals in Books list on Amazon lmao (Best Sellers Rank: #23 in Books)', 'url': 'https://www.amazon.com/bestsellers/books/45/ref=zg_b_bs_45_1', 'created': 1611868014.0}",2021-01-28 21:06:54
