,author,created_utc,title,url,created,d_,created_utc_dt
0,ImNOTaLemon69,1591050479,"Zoom, Zscaler and Zynga... don't sleep on these 😴",https://www.reddit.com/r/wallstreetbets/comments/guul8s/zoom_zscaler_and_zynga_dont_sleep_on_these/,1591050479.0,"{'author': 'ImNOTaLemon69', 'created_utc': 1591050479, 'title': ""Zoom, Zscaler and Zynga... don't sleep on these 😴"", 'url': 'https://www.reddit.com/r/wallstreetbets/comments/guul8s/zoom_zscaler_and_zynga_dont_sleep_on_these/', 'created': 1591050479.0}",2020-06-01 22:27:59
1,JoseanEnrique,1591050449,"Will the bubble finally burst tomorrow, P/E at +2210, or TO THE MOON with Zoom?",https://i.redd.it/m8f5y9m4kd251.png,1591050449.0,"{'author': 'JoseanEnrique', 'created_utc': 1591050449, 'title': 'Will the bubble finally burst tomorrow, P/E at +2210, or TO THE MOON with Zoom?', 'url': 'https://i.redd.it/m8f5y9m4kd251.png', 'created': 1591050449.0}",2020-06-01 22:27:29
2,ACuriousFrenchie,1591050107,it's party time at my firm,https://i.redd.it/16j25hcajd251.png,1591050107.0,"{'author': 'ACuriousFrenchie', 'created_utc': 1591050107, 'title': ""it's party time at my firm"", 'url': 'https://i.redd.it/16j25hcajd251.png', 'created': 1591050107.0}",2020-06-01 22:21:47
3,Used_Fleshlight,1591050045,Who makes the wood for all these boarded up businesses?,https://www.reddit.com/r/wallstreetbets/comments/guuggf/who_makes_the_wood_for_all_these_boarded_up/,1591050045.0,"{'author': 'Used_Fleshlight', 'created_utc': 1591050045, 'title': 'Who makes the wood for all these boarded up businesses?', 'url': 'https://www.reddit.com/r/wallstreetbets/comments/guuggf/who_makes_the_wood_for_all_these_boarded_up/', 'created': 1591050045.0}",2020-06-01 22:20:45
4,Nghtmare-Moon,1591050045,I feel like I finally made it. After 8 long months.,https://i.redd.it/ca57bjy4jd251.jpg,1591050045.0,"{'author': 'Nghtmare-Moon', 'created_utc': 1591050045, 'title': 'I feel like I finally made it. After 8 long months.', 'url': 'https://i.redd.it/ca57bjy4jd251.jpg', 'created': 1591050045.0}",2020-06-01 22:20:45
5,[deleted],1591050004,"Anybody else up 50% in one month on FANG (Diamondback), or is that just me?&gt;",https://www.reddit.com/r/wallstreetbets/comments/guufyp/anybody_else_up_50_in_one_month_on_fang/,1591050004.0,"{'author': '[deleted]', 'created_utc': 1591050004, 'title': 'Anybody else up 50% in one month on FANG (Diamondback), or is that just me?&gt;', 'url': 'https://www.reddit.com/r/wallstreetbets/comments/guufyp/anybody_else_up_50_in_one_month_on_fang/', 'created': 1591050004.0}",2020-06-01 22:20:04
6,iWinned,1591049807,"Someone called me a 🌈 🐻 on my previous post, so I raise you a V-shaped with maxed margin day trading ZS 110C 6/4... Thxx WSB and JPow Printers.",https://i.redd.it/joapwqifid251.jpg,1591049807.0,"{'author': 'iWinned', 'created_utc': 1591049807, 'title': 'Someone called me a 🌈 🐻 on my previous post, so I raise you a V-shaped with maxed margin day trading ZS 110C 6/4... Thxx WSB and JPow Printers.', 'url': 'https://i.redd.it/joapwqifid251.jpg', 'created': 1591049807.0}",2020-06-01 22:16:47
7,NdSeIr,1591049596,Pfizer DD,https://www.reddit.com/r/wallstreetbets/comments/guubk0/pfizer_dd/,1591049596.0,"{'author': 'NdSeIr', 'created_utc': 1591049596, 'title': 'Pfizer DD', 'url': 'https://www.reddit.com/r/wallstreetbets/comments/guubk0/pfizer_dd/', 'created': 1591049596.0}",2020-06-01 22:13:16
8,Panthersfan1990,1591049495,Gun stocks for the riots? Looking at Swbi maybe hold for a week?,https://www.foxbusiness.com/markets/gun-stocks-riots-looting-erupt-across-america,1591049495.0,"{'author': 'Panthersfan1990', 'created_utc': 1591049495, 'title': 'Gun stocks for the riots? Looking at Swbi maybe hold for a week?', 'url': 'https://www.foxbusiness.com/markets/gun-stocks-riots-looting-erupt-across-america', 'created': 1591049495.0}",2020-06-01 22:11:35
9,jimmy_chillin8,1591049123,Extremely Gay Bear Finds WSB During Pandemic,https://i.redd.it/vxdji4fegd251.jpg,1591049123.0,"{'author': 'jimmy_chillin8', 'created_utc': 1591049123, 'title': 'Extremely Gay Bear Finds WSB During Pandemic', 'url': 'https://i.redd.it/vxdji4fegd251.jpg', 'created': 1591049123.0}",2020-06-01 22:05:23
10,moores9080,1591049014,One Way Bet $BA Boeing,https://i.redd.it/1eimykg2gd251.jpg,1591049014.0,"{'author': 'moores9080', 'created_utc': 1591049014, 'title': 'One Way Bet $BA Boeing', 'url': 'https://i.redd.it/1eimykg2gd251.jpg', 'created': 1591049014.0}",2020-06-01 22:03:34
11,Oldster5,1591048967,$BUD in the News again!,https://i.redd.it/4pvbtfmrfd251.jpg,1591048967.0,"{'author': 'Oldster5', 'created_utc': 1591048967, 'title': '$BUD in the News again!', 'url': 'https://i.redd.it/4pvbtfmrfd251.jpg', 'created': 1591048967.0}",2020-06-01 22:02:47
12,chumpaste,1591048963,No matter what bears can’t win,https://i.redd.it/uxwyd75xfd251.jpg,1591048963.0,"{'author': 'chumpaste', 'created_utc': 1591048963, 'title': 'No matter what bears can’t win', 'url': 'https://i.redd.it/uxwyd75xfd251.jpg', 'created': 1591048963.0}",2020-06-01 22:02:43
13,Fapple_Jax,1591048845,Stock Wars Episode IV,https://www.reddit.com/r/wallstreetbets/comments/guu370/stock_wars_episode_iv/,1591048845.0,"{'author': 'Fapple_Jax', 'created_utc': 1591048845, 'title': 'Stock Wars Episode IV', 'url': 'https://www.reddit.com/r/wallstreetbets/comments/guu370/stock_wars_episode_iv/', 'created': 1591048845.0}",2020-06-01 22:00:45
14,soyeahiknow,1591048833,HDS-Earnings next week 06/09- 06/19 35 CALL!,https://www.reddit.com/r/wallstreetbets/comments/guu31f/hdsearnings_next_week_0609_0619_35_call/,1591048833.0,"{'author': 'soyeahiknow', 'created_utc': 1591048833, 'title': 'HDS-Earnings next week 06/09- 06/19 35 CALL!', 'url': 'https://www.reddit.com/r/wallstreetbets/comments/guu31f/hdsearnings_next_week_0609_0619_35_call/', 'created': 1591048833.0}",2020-06-01 22:00:33
15,Shittalker23,1591048603,"During College, I will eat Chipotle almost every day.... after the scandal, I barely ever go there anymore. Who’s still eating there? Has the quality improved? I really don’t get $CMG",https://i.redd.it/23ztqcpued251.jpg,1591048603.0,"{'author': 'Shittalker23', 'created_utc': 1591048603, 'title': 'During College, I will eat Chipotle almost every day.... after the scandal, I barely ever go there anymore. Who’s still eating there? Has the quality improved? I really don’t get $CMG', 'url': 'https://i.redd.it/23ztqcpued251.jpg', 'created': 1591048603.0}",2020-06-01 21:56:43
16,[deleted],1591048463,Tesla calls Finnally unlocked green mode i was -50% yesterday lmao,https://i.redd.it/5sl4haz9ed251.png,1591048463.0,"{'author': '[deleted]', 'created_utc': 1591048463, 'title': 'Tesla calls Finnally unlocked green mode i was -50% yesterday lmao', 'url': 'https://i.redd.it/5sl4haz9ed251.png', 'created': 1591048463.0}",2020-06-01 21:54:23
17,dramaticdan,1591048379,Somebody's feeling confident about their $1/2mil in zoom calls... June 5 225c / IV 163% x970,https://i.redd.it/dxfsx2otdd251.png,1591048379.0,"{'author': 'dramaticdan', 'created_utc': 1591048379, 'title': ""Somebody's feeling confident about their $1/2mil in zoom calls... June 5 225c / IV 163% x970"", 'url': 'https://i.redd.it/dxfsx2otdd251.png', 'created': 1591048379.0}",2020-06-01 21:52:59
18,engomarse,1591048367,All in Draft Kings with Health Savings Account during a global pandemic.,https://i.redd.it/g3damdc5ed251.jpg,1591048367.0,"{'author': 'engomarse', 'created_utc': 1591048367, 'title': 'All in Draft Kings with Health Savings Account during a global pandemic.', 'url': 'https://i.redd.it/g3damdc5ed251.jpg', 'created': 1591048367.0}",2020-06-01 21:52:47
19,WSBGodIsDead,1591048198,"I'm far too autistic to understand why someone bought $3.7M of these 6/5 $270c (+31% B/E), paid $0.85 for 44,000. Someone explain.",https://i.redd.it/7wt09gandd251.jpg,1591048198.0,"{'author': 'WSBGodIsDead', 'created_utc': 1591048198, 'title': ""I'm far too autistic to understand why someone bought $3.7M of these 6/5 $270c (+31% B/E), paid $0.85 for 44,000. Someone explain."", 'url': 'https://i.redd.it/7wt09gandd251.jpg', 'created': 1591048198.0}",2020-06-01 21:49:58
20,-Raex-,1591048112,Some hot chick posted this on WeBull. $ENSV is up AH...thoughts?,https://i.redd.it/f90b6p2edd251.jpg,1591048112.0,"{'author': '-Raex-', 'created_utc': 1591048112, 'title': 'Some hot chick posted this on WeBull. $ENSV is up AH...thoughts?', 'url': 'https://i.redd.it/f90b6p2edd251.jpg', 'created': 1591048112.0}",2020-06-01 21:48:32
21,memecaptial,1591047975,$ZM is at a new ATH of 207 after hours!,https://www.reddit.com/r/wallstreetbets/comments/gutt7l/zm_is_at_a_new_ath_of_207_after_hours/,1591047975.0,"{'author': 'memecaptial', 'created_utc': 1591047975, 'title': '$ZM is at a new ATH of 207 after hours!', 'url': 'https://www.reddit.com/r/wallstreetbets/comments/gutt7l/zm_is_at_a_new_ath_of_207_after_hours/', 'created': 1591047975.0}",2020-06-01 21:46:15
22,JoeyTomasula,1591047675,Do we accept recovery porn? Still holding $GNUS to this day (Old Photo from early May),https://i.redd.it/0m1yqu43cd251.jpg,1591047675.0,"{'author': 'JoeyTomasula', 'created_utc': 1591047675, 'title': 'Do we accept recovery porn? Still holding $GNUS to this day (Old Photo from early May)', 'url': 'https://i.redd.it/0m1yqu43cd251.jpg', 'created': 1591047675.0}",2020-06-01 21:41:15
23,theognis1002,1591047285,Facebook employees stage virtual walkout after CEO leaves Trump posts alone while Twitter challenges president’s words,https://www.marketwatch.com/story/facebook-workers-revolt-against-zuckerberg-as-trump-posts-continue-to-go-unchallenged-2020-06-01,1591047285.0,"{'author': 'theognis1002', 'created_utc': 1591047285, 'title': 'Facebook employees stage virtual walkout after CEO leaves Trump posts alone while Twitter challenges president’s words', 'url': 'https://www.marketwatch.com/story/facebook-workers-revolt-against-zuckerberg-as-trump-posts-continue-to-go-unchallenged-2020-06-01', 'created': 1591047285.0}",2020-06-01 21:34:45
24,dishdasher,1591047259,Never double down. Only triple down and 'decadown' after that. It is the best possible drug out there to get high.,https://www.reddit.com/r/wallstreetbets/comments/gutl4t/never_double_down_only_triple_down_and_decadown/,1591047259.0,"{'author': 'dishdasher', 'created_utc': 1591047259, 'title': ""Never double down. Only triple down and 'decadown' after that. It is the best possible drug out there to get high."", 'url': 'https://www.reddit.com/r/wallstreetbets/comments/gutl4t/never_double_down_only_triple_down_and_decadown/', 'created': 1591047259.0}",2020-06-01 21:34:19
25,noentic,1591046762,Unusual Option Activity for 06/01/2020 -,https://www.reddit.com/r/wallstreetbets/comments/gutfes/unusual_option_activity_for_06012020/,1591046762.0,"{'author': 'noentic', 'created_utc': 1591046762, 'title': 'Unusual Option Activity for 06/01/2020 -', 'url': 'https://www.reddit.com/r/wallstreetbets/comments/gutfes/unusual_option_activity_for_06012020/', 'created': 1591046762.0}",2020-06-01 21:26:02
26,kingoffortlauderdale,1591046385,There is a tight correlation between VIX and COVID. The thing not contained in the SPY price is ...,https://www.reddit.com/r/wallstreetbets/comments/gutb2a/there_is_a_tight_correlation_between_vix_and/,1591046385.0,"{'author': 'kingoffortlauderdale', 'created_utc': 1591046385, 'title': 'There is a tight correlation between VIX and COVID. The thing not contained in the SPY price is ...', 'url': 'https://www.reddit.com/r/wallstreetbets/comments/gutb2a/there_is_a_tight_correlation_between_vix_and/', 'created': 1591046385.0}",2020-06-01 21:19:45
27,Uzuc_mp3,1591046358,What is the best broker at the time?,https://www.reddit.com/r/wallstreetbets/comments/gutas9/what_is_the_best_broker_at_the_time/,1591046358.0,"{'author': 'Uzuc_mp3', 'created_utc': 1591046358, 'title': 'What is the best broker at the time?', 'url': 'https://www.reddit.com/r/wallstreetbets/comments/gutas9/what_is_the_best_broker_at_the_time/', 'created': 1591046358.0}",2020-06-01 21:19:18
28,TJwhosurmomma,1591046071,Do you know what idiot would close out their VTIQ position before tomorrow?,https://i.redd.it/nl4gbenb7d251.jpg,1591046071.0,"{'author': 'TJwhosurmomma', 'created_utc': 1591046071, 'title': 'Do you know what idiot would close out their VTIQ position before tomorrow?', 'url': 'https://i.redd.it/nl4gbenb7d251.jpg', 'created': 1591046071.0}",2020-06-01 21:14:31
29,Baconator69420,1591045971,Tell me this isn’t free money 🤑🤑 FB 230 Calls 7/2,https://i.redd.it/7ar7n3y07d251.jpg,1591045971.0,"{'author': 'Baconator69420', 'created_utc': 1591045971, 'title': 'Tell me this isn’t free money 🤑🤑 FB 230 Calls 7/2', 'url': 'https://i.redd.it/7ar7n3y07d251.jpg', 'created': 1591045971.0}",2020-06-01 21:12:51
30,ChadsDadsGirlfriend,1591045279,$ZM will get crushed tomorrow,https://www.reddit.com/r/wallstreetbets/comments/gusy54/zm_will_get_crushed_tomorrow/,1591045279.0,"{'author': 'ChadsDadsGirlfriend', 'created_utc': 1591045279, 'title': '$ZM will get crushed tomorrow', 'url': 'https://www.reddit.com/r/wallstreetbets/comments/gusy54/zm_will_get_crushed_tomorrow/', 'created': 1591045279.0}",2020-06-01 21:01:19
31,PlofkimPlooie,1591045269,Buy $PYPL,https://www.reddit.com/r/wallstreetbets/comments/gusy12/buy_pypl/,1591045269.0,"{'author': 'PlofkimPlooie', 'created_utc': 1591045269, 'title': 'Buy $PYPL', 'url': 'https://www.reddit.com/r/wallstreetbets/comments/gusy12/buy_pypl/', 'created': 1591045269.0}",2020-06-01 21:01:09
32,Baiken42,1591045268,Crash coming 6/8 due to repetitive content,https://www.reddit.com/r/wallstreetbets/comments/gusy0c/crash_coming_68_due_to_repetitive_content/,1591045268.0,"{'author': 'Baiken42', 'created_utc': 1591045268, 'title': 'Crash coming 6/8 due to repetitive content', 'url': 'https://www.reddit.com/r/wallstreetbets/comments/gusy0c/crash_coming_68_due_to_repetitive_content/', 'created': 1591045268.0}",2020-06-01 21:01:08
33,charlesmartelfranks,1591045175,Atleast we done with the coronavirus story. We can move on to normal times.,https://i.redd.it/oixf9ykn4d251.jpg,1591045175.0,"{'author': 'charlesmartelfranks', 'created_utc': 1591045175, 'title': 'Atleast we done with the coronavirus story. We can move on to normal times.', 'url': 'https://i.redd.it/oixf9ykn4d251.jpg', 'created': 1591045175.0}",2020-06-01 20:59:35
34,samdevia,1591045082,It's been a rough ride today,https://i.redd.it/5tvnontd4d251.png,1591045082.0,"{'author': 'samdevia', 'created_utc': 1591045082, 'title': ""It's been a rough ride today"", 'url': 'https://i.redd.it/5tvnontd4d251.png', 'created': 1591045082.0}",2020-06-01 20:58:02
35,TahitiNickwick,1591044678,Bears hoping riots destroy retail,https://i.redd.it/jf0eg7d63d251.jpg,1591044678.0,"{'author': 'TahitiNickwick', 'created_utc': 1591044678, 'title': 'Bears hoping riots destroy retail', 'url': 'https://i.redd.it/jf0eg7d63d251.jpg', 'created': 1591044678.0}",2020-06-01 20:51:18
36,oceanluva2000,1591044650,"Over the next week Dow will hold near its 61.8%, SPY up, Nasdaq to 10K for a clean double top, my spy/qqq puts will continue to bleed.. I hate myself for believing in myself",https://www.reddit.com/r/wallstreetbets/comments/gusqqa/over_the_next_week_dow_will_hold_near_its_618_spy/,1591044650.0,"{'author': 'oceanluva2000', 'created_utc': 1591044650, 'title': 'Over the next week Dow will hold near its 61.8%, SPY up, Nasdaq to 10K for a clean double top, my spy/qqq puts will continue to bleed.. I hate myself for believing in myself', 'url': 'https://www.reddit.com/r/wallstreetbets/comments/gusqqa/over_the_next_week_dow_will_hold_near_its_618_spy/', 'created': 1591044650.0}",2020-06-01 20:50:50
37,bwang29,1591044576,Zoom call/put buyers and sellers.,https://www.reddit.com/r/wallstreetbets/comments/guspto/zoom_callput_buyers_and_sellers/,1591044576.0,"{'author': 'bwang29', 'created_utc': 1591044576, 'title': 'Zoom call/put buyers and sellers.', 'url': 'https://www.reddit.com/r/wallstreetbets/comments/guspto/zoom_callput_buyers_and_sellers/', 'created': 1591044576.0}",2020-06-01 20:49:36
38,Lil-Cancer-Vert,1591044344,A poem,https://www.reddit.com/r/wallstreetbets/comments/gusn76/a_poem/,1591044344.0,"{'author': 'Lil-Cancer-Vert', 'created_utc': 1591044344, 'title': 'A poem', 'url': 'https://www.reddit.com/r/wallstreetbets/comments/gusn76/a_poem/', 'created': 1591044344.0}",2020-06-01 20:45:44
39,inconspicuousITguy,1591044175,Bears after expecting today to be a red day,https://i.imgur.com/pBsB0g4.mp4,1591044175.0,"{'author': 'inconspicuousITguy', 'created_utc': 1591044175, 'title': 'Bears after expecting today to be a red day', 'url': 'https://i.imgur.com/pBsB0g4.mp4', 'created': 1591044175.0}",2020-06-01 20:42:55
40,CramerCoffee,1591044107,Empty Flights,https://www.reddit.com/r/wallstreetbets/comments/guskf8/empty_flights/,1591044107.0,"{'author': 'CramerCoffee', 'created_utc': 1591044107, 'title': 'Empty Flights', 'url': 'https://www.reddit.com/r/wallstreetbets/comments/guskf8/empty_flights/', 'created': 1591044107.0}",2020-06-01 20:41:47
41,Based_joe,1591043911,you amazing retards helped me afford next month's rent in a week by sitting on my ass. What a first week for poor ass dudr,https://i.imgur.com/x96obRo.jpg,1591043911.0,"{'author': 'Based_joe', 'created_utc': 1591043911, 'title': ""you amazing retards helped me afford next month's rent in a week by sitting on my ass. What a first week for poor ass dudr"", 'url': 'https://i.imgur.com/x96obRo.jpg', 'created': 1591043911.0}",2020-06-01 20:38:31
42,Ass-Kickin_Chicken,1591043880,SPY $400 confirmed,https://i.redd.it/twscw3ro0d251.png,1591043880.0,"{'author': 'Ass-Kickin_Chicken', 'created_utc': 1591043880, 'title': 'SPY $400 confirmed', 'url': 'https://i.redd.it/twscw3ro0d251.png', 'created': 1591043880.0}",2020-06-01 20:38:00
43,TewChaeenz,1591043823,Insightful comments from MarketWatch on looters,https://i.redd.it/m916ypq20d251.jpg,1591043823.0,"{'author': 'TewChaeenz', 'created_utc': 1591043823, 'title': 'Insightful comments from MarketWatch on looters', 'url': 'https://i.redd.it/m916ypq20d251.jpg', 'created': 1591043823.0}",2020-06-01 20:37:03
44,Flemskii,1591043772,GUN Stocks DD,https://www.reddit.com/r/wallstreetbets/comments/gusggf/gun_stocks_dd/,1591043772.0,"{'author': 'Flemskii', 'created_utc': 1591043772, 'title': 'GUN Stocks DD', 'url': 'https://www.reddit.com/r/wallstreetbets/comments/gusggf/gun_stocks_dd/', 'created': 1591043772.0}",2020-06-01 20:36:12
45,samspenc,1591043753,So who's right???,https://i.redd.it/bubcjw0a0d251.png,1591043753.0,"{'author': 'samspenc', 'created_utc': 1591043753, 'title': ""So who's right???"", 'url': 'https://i.redd.it/bubcjw0a0d251.png', 'created': 1591043753.0}",2020-06-01 20:35:53
46,hasbs,1591043383,There is no greater honour than having a video be made about your losses,https://youtu.be/mCHRjTEfOBU?t=1,1591043383.0,"{'author': 'hasbs', 'created_utc': 1591043383, 'title': 'There is no greater honour than having a video be made about your losses', 'url': 'https://youtu.be/mCHRjTEfOBU?t=1', 'created': 1591043383.0}",2020-06-01 20:29:43
47,but_how_do_i_go_fast,1591043217,BYND trading at AMAZN levels,https://i.redd.it/49hzcv2ryc251.png,1591043217.0,"{'author': 'but_how_do_i_go_fast', 'created_utc': 1591043217, 'title': 'BYND trading at AMAZN levels', 'url': 'https://i.redd.it/49hzcv2ryc251.png', 'created': 1591043217.0}",2020-06-01 20:26:57
48,tkhan456,1591043143,Meme stock of the last 3mo,https://i.redd.it/xl4yk1amyc251.jpg,1591043143.0,"{'author': 'tkhan456', 'created_utc': 1591043143, 'title': 'Meme stock of the last 3mo', 'url': 'https://i.redd.it/xl4yk1amyc251.jpg', 'created': 1591043143.0}",2020-06-01 20:25:43
49,SilbergleitJunior,1591043046,Do we remember what happened last time TSLA crossed $900?,https://i.redd.it/2z29qgubyc251.jpg,1591043046.0,"{'author': 'SilbergleitJunior', 'created_utc': 1591043046, 'title': 'Do we remember what happened last time TSLA crossed $900?', 'url': 'https://i.redd.it/2z29qgubyc251.jpg', 'created': 1591043046.0}",2020-06-01 20:24:06
50,ScaredofWhispers,1591042980,Only Bad bets float to the top of this sub./you're all gay retards and your wives deserve their boyfriends (DD inside),https://www.reddit.com/r/wallstreetbets/comments/gus7dl/only_bad_bets_float_to_the_top_of_this_subyoure/,1591042980.0,"{'author': 'ScaredofWhispers', 'created_utc': 1591042980, 'title': ""Only Bad bets float to the top of this sub./you're all gay retards and your wives deserve their boyfriends (DD inside)"", 'url': 'https://www.reddit.com/r/wallstreetbets/comments/gus7dl/only_bad_bets_float_to_the_top_of_this_subyoure/', 'created': 1591042980.0}",2020-06-01 20:23:00
51,avishaibitz,1591042970,Long $TSLA,https://www.reddit.com/r/wallstreetbets/comments/gus79w/long_tsla/,1591042970.0,"{'author': 'avishaibitz', 'created_utc': 1591042970, 'title': 'Long $TSLA', 'url': 'https://www.reddit.com/r/wallstreetbets/comments/gus79w/long_tsla/', 'created': 1591042970.0}",2020-06-01 20:22:50
52,GodlikeImmunity,1591042948,This was gonna be my big break,https://i.redd.it/5wi4c8b1yc251.jpg,1591042948.0,"{'author': 'GodlikeImmunity', 'created_utc': 1591042948, 'title': 'This was gonna be my big break', 'url': 'https://i.redd.it/5wi4c8b1yc251.jpg', 'created': 1591042948.0}",2020-06-01 20:22:28
53,wsbbeer,1591042819,TSLA to the moon or to the ground?,https://www.reddit.com/r/wallstreetbets/comments/gus5kp/tsla_to_the_moon_or_to_the_ground/,1591042819.0,"{'author': 'wsbbeer', 'created_utc': 1591042819, 'title': 'TSLA to the moon or to the ground?', 'url': 'https://www.reddit.com/r/wallstreetbets/comments/gus5kp/tsla_to_the_moon_or_to_the_ground/', 'created': 1591042819.0}",2020-06-01 20:20:19
54,gatsby03,1591042784,Only regret is that I didn't buy more. 526% return on this way OTM call in just 2 months.,https://i.redd.it/jigirgqjxc251.jpg,1591042784.0,"{'author': 'gatsby03', 'created_utc': 1591042784, 'title': ""Only regret is that I didn't buy more. 526% return on this way OTM call in just 2 months."", 'url': 'https://i.redd.it/jigirgqjxc251.jpg', 'created': 1591042784.0}",2020-06-01 20:19:44
55,Arthurd4321,1591042605,UCO Today,https://v.redd.it/m98iwqb0xc251,1591042605.0,"{'author': 'Arthurd4321', 'created_utc': 1591042605, 'title': 'UCO Today', 'url': 'https://v.redd.it/m98iwqb0xc251', 'created': 1591042605.0}",2020-06-01 20:16:45
56,kamkam82,1591042594,"ZM, TSLA, DKNG, etc!",https://i.redd.it/ugxvbwdywc251.jpg,1591042594.0,"{'author': 'kamkam82', 'created_utc': 1591042594, 'title': 'ZM, TSLA, DKNG, etc!', 'url': 'https://i.redd.it/ugxvbwdywc251.jpg', 'created': 1591042594.0}",2020-06-01 20:16:34
57,mureytasroc,1591042577,RIP u/Krogo_yago,https://www.reddit.com/user/Krogo_yago/comments/gq3fim/banned_for_life_from_wallstreetbets_guh/,1591042577.0,"{'author': 'mureytasroc', 'created_utc': 1591042577, 'title': 'RIP u/Krogo_yago', 'url': 'https://www.reddit.com/user/Krogo_yago/comments/gq3fim/banned_for_life_from_wallstreetbets_guh/', 'created': 1591042577.0}",2020-06-01 20:16:17
58,[deleted],1591042561,UCO,https://v.redd.it/mnyziz9vwc251,1591042561.0,"{'author': '[deleted]', 'created_utc': 1591042561, 'title': 'UCO', 'url': 'https://v.redd.it/mnyziz9vwc251', 'created': 1591042561.0}",2020-06-01 20:16:01
59,ColdBeing,1591042492,My only regret is not putting more money in,https://i.redd.it/60eiktjowc251.jpg,1591042492.0,"{'author': 'ColdBeing', 'created_utc': 1591042492, 'title': 'My only regret is not putting more money in', 'url': 'https://i.redd.it/60eiktjowc251.jpg', 'created': 1591042492.0}",2020-06-01 20:14:52
60,kiwiatv,1591042458,Donkey Kong took a Tesla to the ISS for me,https://i.redd.it/1yglaawcwc251.png,1591042458.0,"{'author': 'kiwiatv', 'created_utc': 1591042458, 'title': 'Donkey Kong took a Tesla to the ISS for me', 'url': 'https://i.redd.it/1yglaawcwc251.png', 'created': 1591042458.0}",2020-06-01 20:14:18
61,PreppingWolf,1591042344,Bezos is gonna be angy,https://twitter.com/Breaking911/status/1267219474668797961?s=19,1591042344.0,"{'author': 'PreppingWolf', 'created_utc': 1591042344, 'title': 'Bezos is gonna be angy', 'url': 'https://twitter.com/Breaking911/status/1267219474668797961?s=19', 'created': 1591042344.0}",2020-06-01 20:12:24
62,[deleted],1591042214,"Not quite a V shaped recovery, but I'll take it",https://i.redd.it/mschgx6gvc251.jpg,1591042214.0,"{'author': '[deleted]', 'created_utc': 1591042214, 'title': ""Not quite a V shaped recovery, but I'll take it"", 'url': 'https://i.redd.it/mschgx6gvc251.jpg', 'created': 1591042214.0}",2020-06-01 20:10:14
63,AutoModerator,1591042107,"What Are Your Moves Tomorrow, June 02, 2020",https://www.reddit.com/r/wallstreetbets/comments/gurxgt/what_are_your_moves_tomorrow_june_02_2020/,1591042107.0,"{'author': 'AutoModerator', 'created_utc': 1591042107, 'title': 'What Are Your Moves Tomorrow, June 02, 2020', 'url': 'https://www.reddit.com/r/wallstreetbets/comments/gurxgt/what_are_your_moves_tomorrow_june_02_2020/', 'created': 1591042107.0}",2020-06-01 20:08:27
64,sapdaddyflex,1591042045,Arcus Biosciences ($RCUS) Short,https://www.reddit.com/r/wallstreetbets/comments/gurwpj/arcus_biosciences_rcus_short/,1591042045.0,"{'author': 'sapdaddyflex', 'created_utc': 1591042045, 'title': 'Arcus Biosciences ($RCUS) Short', 'url': 'https://www.reddit.com/r/wallstreetbets/comments/gurwpj/arcus_biosciences_rcus_short/', 'created': 1591042045.0}",2020-06-01 20:07:25
65,Josh__19,1591041901,Should I Sell my Calls?,https://www.reddit.com/r/wallstreetbets/comments/gurv3g/should_i_sell_my_calls/,1591041901.0,"{'author': 'Josh__19', 'created_utc': 1591041901, 'title': 'Should I Sell my Calls?', 'url': 'https://www.reddit.com/r/wallstreetbets/comments/gurv3g/should_i_sell_my_calls/', 'created': 1591041901.0}",2020-06-01 20:05:01
