,author,created_utc,title,url,created,d_,created_utc_dt
63,Illustrious_King_397,1611868013,Let’s all give Robinhood a 1 star review for Market Manipulating buy blocking buying on stocks most hurting shorts.,https://www.reddit.com/r/wallstreetbets/comments/l78uts/lets_all_give_robinhood_a_1_star_review_for/,1611868013.0,"{'author': 'Illustrious_King_397', 'created_utc': 1611868013, 'title': 'Let’s all give Robinhood a 1 star review for Market Manipulating buy blocking buying on stocks most hurting shorts.', 'url': 'https://www.reddit.com/r/wallstreetbets/comments/l78uts/lets_all_give_robinhood_a_1_star_review_for/', 'created': 1611868013.0}",2021-01-28 21:06:53
64,Greenman8291,1611868013,This article pisses me off. It is blatant the hedge funds had their people limit trading to recover from loses. This is absolute bullshit.,https://imgur.com/a/iq1KpF3/,1611868013.0,"{'author': 'Greenman8291', 'created_utc': 1611868013, 'title': 'This article pisses me off. It is blatant the hedge funds had their people limit trading to recover from loses. This is absolute bullshit.', 'url': 'https://imgur.com/a/iq1KpF3/', 'created': 1611868013.0}",2021-01-28 21:06:53
65,CrunchyConniptions,1611868013,What! Who did this? Fes up.,https://i.redd.it/3zaut16i15e61.png,1611868013.0,"{'author': 'CrunchyConniptions', 'created_utc': 1611868013, 'title': 'What! Who did this? Fes up.', 'url': 'https://i.redd.it/3zaut16i15e61.png', 'created': 1611868013.0}",2021-01-28 21:06:53
66,Venozenic,1611868013,Apes Together Strong,http://shorturl.at/xDGMS,1611868013.0,"{'author': 'Venozenic', 'created_utc': 1611868013, 'title': 'Apes Together Strong', 'url': 'http://shorturl.at/xDGMS', 'created': 1611868013.0}",2021-01-28 21:06:53
67,HarryRehnquist,1611868012,Plebe 💎🙌🏼 vs. 🐀🏦,https://i.redd.it/2jlh4z4n15e61.jpg,1611868012.0,"{'author': 'HarryRehnquist', 'created_utc': 1611868012, 'title': 'Plebe 💎🙌🏼 vs. 🐀🏦', 'url': 'https://i.redd.it/2jlh4z4n15e61.jpg', 'created': 1611868012.0}",2021-01-28 21:06:52
68,theAliasOfAlias,1611868010,REPEAT AFTER ME,https://www.reddit.com/r/wallstreetbets/comments/l78usb/repeat_after_me/,1611868010.0,"{'author': 'theAliasOfAlias', 'created_utc': 1611868010, 'title': 'REPEAT AFTER ME', 'url': 'https://www.reddit.com/r/wallstreetbets/comments/l78usb/repeat_after_me/', 'created': 1611868010.0}",2021-01-28 21:06:50
69,stonks2rkts,1611868010,TIL media hates us regular folks,https://www.reddit.com/r/wallstreetbets/comments/l78us8/til_media_hates_us_regular_folks/,1611868010.0,"{'author': 'stonks2rkts', 'created_utc': 1611868010, 'title': 'TIL media hates us regular folks', 'url': 'https://www.reddit.com/r/wallstreetbets/comments/l78us8/til_media_hates_us_regular_folks/', 'created': 1611868010.0}",2021-01-28 21:06:50
70,xinistercheng,1611868009,Moomoo Trading might be an option to buy GME.,https://www.reddit.com/r/wallstreetbets/comments/l78urv/moomoo_trading_might_be_an_option_to_buy_gme/,1611868009.0,"{'author': 'xinistercheng', 'created_utc': 1611868009, 'title': 'Moomoo Trading might be an option to buy GME.', 'url': 'https://www.reddit.com/r/wallstreetbets/comments/l78urv/moomoo_trading_might_be_an_option_to_buy_gme/', 'created': 1611868009.0}",2021-01-28 21:06:49
71,tlkshowhst,1611868009,BUY. THE. DIP.,https://www.reddit.com/r/wallstreetbets/comments/l78urq/buy_the_dip/,1611868009.0,"{'author': 'tlkshowhst', 'created_utc': 1611868009, 'title': 'BUY. THE. DIP.', 'url': 'https://www.reddit.com/r/wallstreetbets/comments/l78urq/buy_the_dip/', 'created': 1611868009.0}",2021-01-28 21:06:49
72,Aayush9507,1611868009,Put my Fidelity savings into GME/AMC,https://www.reddit.com/r/wallstreetbets/comments/l78urp/put_my_fidelity_savings_into_gmeamc/,1611868009.0,"{'author': 'Aayush9507', 'created_utc': 1611868009, 'title': 'Put my Fidelity savings into GME/AMC', 'url': 'https://www.reddit.com/r/wallstreetbets/comments/l78urp/put_my_fidelity_savings_into_gmeamc/', 'created': 1611868009.0}",2021-01-28 21:06:49
73,MLXIII,1611868009,Rh still not available... but WB yes and it's almost half of 52wk high! I dunno I just like the stock!,https://www.reddit.com/gallery/l78urg,1611868009.0,"{'author': 'MLXIII', 'created_utc': 1611868009, 'title': ""Rh still not available... but WB yes and it's almost half of 52wk high! I dunno I just like the stock!"", 'url': 'https://www.reddit.com/gallery/l78urg', 'created': 1611868009.0}",2021-01-28 21:06:49
74,Think-Squirrel3071,1611868008,"Amc, hold?!?!",https://www.reddit.com/r/wallstreetbets/comments/l78ur7/amc_hold/,1611868008.0,"{'author': 'Think-Squirrel3071', 'created_utc': 1611868008, 'title': 'Amc, hold?!?!', 'url': 'https://www.reddit.com/r/wallstreetbets/comments/l78ur7/amc_hold/', 'created': 1611868008.0}",2021-01-28 21:06:48
75,PluralistUK,1611868008,Papa Musk,https://www.reddit.com/r/wallstreetbets/comments/l78ur5/papa_musk/,1611868008.0,"{'author': 'PluralistUK', 'created_utc': 1611868008, 'title': 'Papa Musk', 'url': 'https://www.reddit.com/r/wallstreetbets/comments/l78ur5/papa_musk/', 'created': 1611868008.0}",2021-01-28 21:06:48
76,JackOffRedditAccount,1611868008,PSA: $GAMR is an ETF with 27.02% stake in Gamestop! BUY BUY BUY,https://etfmg.com/funds/gamr/,1611868008.0,"{'author': 'JackOffRedditAccount', 'created_utc': 1611868008, 'title': 'PSA: $GAMR is an ETF with 27.02% stake in Gamestop! BUY BUY BUY', 'url': 'https://etfmg.com/funds/gamr/', 'created': 1611868008.0}",2021-01-28 21:06:48
77,judalion,1611868008,What do we do? BUY? HOLD? SELL?,https://www.reddit.com/r/wallstreetbets/comments/l78uqx/what_do_we_do_buy_hold_sell/,1611868008.0,"{'author': 'judalion', 'created_utc': 1611868008, 'title': 'What do we do? BUY? HOLD? SELL?', 'url': 'https://www.reddit.com/r/wallstreetbets/comments/l78uqx/what_do_we_do_buy_hold_sell/', 'created': 1611868008.0}",2021-01-28 21:06:48
78,coollikerei,1611868008,Rebrand for Robinhood,https://i.redd.it/64sn7cwj15e61.png,1611868008.0,"{'author': 'coollikerei', 'created_utc': 1611868008, 'title': 'Rebrand for Robinhood', 'url': 'https://i.redd.it/64sn7cwj15e61.png', 'created': 1611868008.0}",2021-01-28 21:06:48
79,shingox,1611868006,How long does it take to move shares from RH to Fidelity?,https://www.reddit.com/r/wallstreetbets/comments/l78uqa/how_long_does_it_take_to_move_shares_from_rh_to/,1611868006.0,"{'author': 'shingox', 'created_utc': 1611868006, 'title': 'How long does it take to move shares from RH to Fidelity?', 'url': 'https://www.reddit.com/r/wallstreetbets/comments/l78uqa/how_long_does_it_take_to_move_shares_from_rh_to/', 'created': 1611868006.0}",2021-01-28 21:06:46
80,CryptoFox88,1611868006,The future is now.,https://i.redd.it/wcwdgsgm15e61.jpg,1611868006.0,"{'author': 'CryptoFox88', 'created_utc': 1611868006, 'title': 'The future is now.', 'url': 'https://i.redd.it/wcwdgsgm15e61.jpg', 'created': 1611868006.0}",2021-01-28 21:06:46
81,arto26,1611868005,"I HAVE NO IDEA WHAT THE FUCK I'M DOING BUT I NEED ALL OF YOU TO HOP ON THIS GME RETARD ROCKET WITH ME AND LEAVE THIS SHITTY DYSTOPIAN FUCKFEST OF AN EXISTENCE BEHIND! FUCK THE MOON, I WANT TO TOUCH THE EDGE OF THE UNIVERSE WITH MY RETARDED DICK.",https://www.reddit.com/r/wallstreetbets/comments/l78upi/i_have_no_idea_what_the_fuck_im_doing_but_i_need/,1611868005.0,"{'author': 'arto26', 'created_utc': 1611868005, 'title': ""I HAVE NO IDEA WHAT THE FUCK I'M DOING BUT I NEED ALL OF YOU TO HOP ON THIS GME RETARD ROCKET WITH ME AND LEAVE THIS SHITTY DYSTOPIAN FUCKFEST OF AN EXISTENCE BEHIND! FUCK THE MOON, I WANT TO TOUCH THE EDGE OF THE UNIVERSE WITH MY RETARDED DICK."", 'url': 'https://www.reddit.com/r/wallstreetbets/comments/l78upi/i_have_no_idea_what_the_fuck_im_doing_but_i_need/', 'created': 1611868005.0}",2021-01-28 21:06:45
82,pterodactylptarty,1611868005,Me buying two shares of GME because of Robinhood deplatforming you guys,https://i.redd.it/p9rbbvxf15e61.jpg,1611868005.0,"{'author': 'pterodactylptarty', 'created_utc': 1611868005, 'title': 'Me buying two shares of GME because of Robinhood deplatforming you guys', 'url': 'https://i.redd.it/p9rbbvxf15e61.jpg', 'created': 1611868005.0}",2021-01-28 21:06:45
83,redditor9978,1611868004,Closing out of Robinhood is not fast or easy,https://www.reddit.com/r/wallstreetbets/comments/l78up6/closing_out_of_robinhood_is_not_fast_or_easy/,1611868004.0,"{'author': 'redditor9978', 'created_utc': 1611868004, 'title': 'Closing out of Robinhood is not fast or easy', 'url': 'https://www.reddit.com/r/wallstreetbets/comments/l78up6/closing_out_of_robinhood_is_not_fast_or_easy/', 'created': 1611868004.0}",2021-01-28 21:06:44
84,Working-Public-2066,1611868004,We can buy GME and AMC again.,https://i.redd.it/itbzos9m15e61.jpg,1611868004.0,"{'author': 'Working-Public-2066', 'created_utc': 1611868004, 'title': 'We can buy GME and AMC again.', 'url': 'https://i.redd.it/itbzos9m15e61.jpg', 'created': 1611868004.0}",2021-01-28 21:06:44
85,BigWhiteShark007,1611868003,Game on for GME after hours! 💎🤲🏼 🚀,https://www.reddit.com/r/wallstreetbets/comments/l78uor/game_on_for_gme_after_hours/,1611868003.0,"{'author': 'BigWhiteShark007', 'created_utc': 1611868003, 'title': 'Game on for GME after hours! 💎🤲🏼 🚀', 'url': 'https://www.reddit.com/r/wallstreetbets/comments/l78uor/game_on_for_gme_after_hours/', 'created': 1611868003.0}",2021-01-28 21:06:43
86,Lee-Dest-Roy,1611868002,Can someone please explain this to me. GME price is at 19.50 but if i want to buy then its at 197?,https://i.redd.it/0fz7s73m15e61.jpg,1611868002.0,"{'author': 'Lee-Dest-Roy', 'created_utc': 1611868002, 'title': 'Can someone please explain this to me. GME price is at 19.50 but if i want to buy then its at 197?', 'url': 'https://i.redd.it/0fz7s73m15e61.jpg', 'created': 1611868002.0}",2021-01-28 21:06:42
87,General-Blueberry-58,1611868002,Looks like it’s not supported anymore 😂😂,https://i.redd.it/qcuqvl2m15e61.jpg,1611868002.0,"{'author': 'General-Blueberry-58', 'created_utc': 1611868002, 'title': 'Looks like it’s not supported anymore 😂😂', 'url': 'https://i.redd.it/qcuqvl2m15e61.jpg', 'created': 1611868002.0}",2021-01-28 21:06:42
88,Accurate_Produce_796,1611868002,Anyone have diaper rash-I do,https://www.reddit.com/r/wallstreetbets/comments/l78uo0/anyone_have_diaper_rashi_do/,1611868002.0,"{'author': 'Accurate_Produce_796', 'created_utc': 1611868002, 'title': 'Anyone have diaper rash-I do', 'url': 'https://www.reddit.com/r/wallstreetbets/comments/l78uo0/anyone_have_diaper_rashi_do/', 'created': 1611868002.0}",2021-01-28 21:06:42
89,Torch436,1611868002,Facts !!!!,https://i.redd.it/fscs4q4m15e61.jpg,1611868002.0,"{'author': 'Torch436', 'created_utc': 1611868002, 'title': 'Facts !!!!', 'url': 'https://i.redd.it/fscs4q4m15e61.jpg', 'created': 1611868002.0}",2021-01-28 21:06:42
90,GUCClSSlMA,1611868002,Dogecoin,https://www.reddit.com/r/wallstreetbets/comments/l78unt/dogecoin/,1611868002.0,"{'author': 'GUCClSSlMA', 'created_utc': 1611868002, 'title': 'Dogecoin', 'url': 'https://www.reddit.com/r/wallstreetbets/comments/l78unt/dogecoin/', 'created': 1611868002.0}",2021-01-28 21:06:42
91,Scarrazaar,1611868002,Anyone knows when exactly?,https://i.redd.it/zylvol0m15e61.jpg,1611868002.0,"{'author': 'Scarrazaar', 'created_utc': 1611868002, 'title': 'Anyone knows when exactly?', 'url': 'https://i.redd.it/zylvol0m15e61.jpg', 'created': 1611868002.0}",2021-01-28 21:06:42
92,TheSaltyBarista,1611868001,ONLY TRIED TO SELL TO MOVE TO AMERITRADE WITH THE REST PLEASE EXPLAIN WHY IT DIDN’T SELL TODAY,https://i.redd.it/xl7sk52m15e61.jpg,1611868001.0,"{'author': 'TheSaltyBarista', 'created_utc': 1611868001, 'title': 'ONLY TRIED TO SELL TO MOVE TO AMERITRADE WITH THE REST PLEASE EXPLAIN WHY IT DIDN’T SELL TODAY', 'url': 'https://i.redd.it/xl7sk52m15e61.jpg', 'created': 1611868001.0}",2021-01-28 21:06:41
93,Atomkraft98,1611868001,shitpost status - $gme,https://i.redd.it/dovx46qk15e61.png,1611868001.0,"{'author': 'Atomkraft98', 'created_utc': 1611868001, 'title': 'shitpost status - $gme', 'url': 'https://i.redd.it/dovx46qk15e61.png', 'created': 1611868001.0}",2021-01-28 21:06:41
94,Phrenic436,1611868000,It do be like that,https://i.redd.it/iynhiuwl15e61.jpg,1611868000.0,"{'author': 'Phrenic436', 'created_utc': 1611868000, 'title': 'It do be like that', 'url': 'https://i.redd.it/iynhiuwl15e61.jpg', 'created': 1611868000.0}",2021-01-28 21:06:40
95,Roboteko,1611868000,💎💎💎 RETARDS ARMY 💎💎💎,https://i.redd.it/cs5tfko705e61.png,1611868000.0,"{'author': 'Roboteko', 'created_utc': 1611868000, 'title': '💎💎💎 RETARDS ARMY 💎💎💎', 'url': 'https://i.redd.it/cs5tfko705e61.png', 'created': 1611868000.0}",2021-01-28 21:06:40
96,Advanced-Panda-1069,1611868000,I can’t log into my scotiaitrade account. What ‘s happening?,https://www.reddit.com/r/wallstreetbets/comments/l78umk/i_cant_log_into_my_scotiaitrade_account_what_s/,1611868000.0,"{'author': 'Advanced-Panda-1069', 'created_utc': 1611868000, 'title': 'I can’t log into my scotiaitrade account. What ‘s happening?', 'url': 'https://www.reddit.com/r/wallstreetbets/comments/l78umk/i_cant_log_into_my_scotiaitrade_account_what_s/', 'created': 1611868000.0}",2021-01-28 21:06:40
97,jzanick01,1611867999,If retail investors can only sell. Then who the hell is buying?,https://www.reddit.com/r/wallstreetbets/comments/l78ulx/if_retail_investors_can_only_sell_then_who_the/,1611867999.0,"{'author': 'jzanick01', 'created_utc': 1611867999, 'title': 'If retail investors can only sell. Then who the hell is buying?', 'url': 'https://www.reddit.com/r/wallstreetbets/comments/l78ulx/if_retail_investors_can_only_sell_then_who_the/', 'created': 1611867999.0}",2021-01-28 21:06:39
98,SherlockStonk,1611867998,interactive brokers to underperform...,https://www.reddit.com/r/wallstreetbets/comments/l78ulq/interactive_brokers_to_underperform/,1611867998.0,"{'author': 'SherlockStonk', 'created_utc': 1611867998, 'title': 'interactive brokers to underperform...', 'url': 'https://www.reddit.com/r/wallstreetbets/comments/l78ulq/interactive_brokers_to_underperform/', 'created': 1611867998.0}",2021-01-28 21:06:38
99,toast2200,1611867998,New here: How high are we expecting the value of GME to go??,https://www.reddit.com/r/wallstreetbets/comments/l78ulp/new_here_how_high_are_we_expecting_the_value_of/,1611867998.0,"{'author': 'toast2200', 'created_utc': 1611867998, 'title': 'New here: How high are we expecting the value of GME to go??', 'url': 'https://www.reddit.com/r/wallstreetbets/comments/l78ulp/new_here_how_high_are_we_expecting_the_value_of/', 'created': 1611867998.0}",2021-01-28 21:06:38
