,author,created_utc,title,url,created,d_,created_utc_dt
57,TallSthrnGent,1611903961,PBI short interest + likely earnings surprise Feb 2 = boomshakalaka,https://www.reddit.com/r/wallstreetbets/comments/l7m44a/pbi_short_interest_likely_earnings_surprise_feb_2/,1611903961.0,"{'author': 'TallSthrnGent', 'created_utc': 1611903961, 'title': 'PBI short interest + likely earnings surprise Feb 2 = boomshakalaka', 'url': 'https://www.reddit.com/r/wallstreetbets/comments/l7m44a/pbi_short_interest_likely_earnings_surprise_feb_2/', 'created': 1611903961.0}",2021-01-29 07:06:01
58,Competitive_Road_451,1611903956,"19k deep in BB, wish me luck!",https://www.reddit.com/r/wallstreetbets/comments/l7m42n/19k_deep_in_bb_wish_me_luck/,1611903956.0,"{'author': 'Competitive_Road_451', 'created_utc': 1611903956, 'title': '19k deep in BB, wish me luck!', 'url': 'https://www.reddit.com/r/wallstreetbets/comments/l7m42n/19k_deep_in_bb_wish_me_luck/', 'created': 1611903956.0}",2021-01-29 07:05:56
59,Rebel90x,1611903955,$GME $BB WE LOVE THE STOCK,https://i.redd.it/ugqe6ssi08e61.jpg,1611903955.0,"{'author': 'Rebel90x', 'created_utc': 1611903955, 'title': '$GME $BB WE LOVE THE STOCK', 'url': 'https://i.redd.it/ugqe6ssi08e61.jpg', 'created': 1611903955.0}",2021-01-29 07:05:55
60,ThatGuru1008,1611903954,"AMC, BB, GME 🚀🚀",https://www.reddit.com/r/wallstreetbets/comments/l7m423/amc_bb_gme/,1611903954.0,"{'author': 'ThatGuru1008', 'created_utc': 1611903954, 'title': 'AMC, BB, GME 🚀🚀', 'url': 'https://www.reddit.com/r/wallstreetbets/comments/l7m423/amc_bb_gme/', 'created': 1611903954.0}",2021-01-29 07:05:54
61,Much-Confection-2097,1611903953,"BUY DOGECOIN ON VOYAGER EXCHANGE, 0 COMMISSION, COINBASE SUCKS!",https://www.reddit.com/r/wallstreetbets/comments/l7m41b/buy_dogecoin_on_voyager_exchange_0_commission/,1611903953.0,"{'author': 'Much-Confection-2097', 'created_utc': 1611903953, 'title': 'BUY DOGECOIN ON VOYAGER EXCHANGE, 0 COMMISSION, COINBASE SUCKS!', 'url': 'https://www.reddit.com/r/wallstreetbets/comments/l7m41b/buy_dogecoin_on_voyager_exchange_0_commission/', 'created': 1611903953.0}",2021-01-29 07:05:53
62,LurkerFailsLurking,1611903952,Doesn't this all end with the feds being forced to bail out the financial industry again?,https://www.reddit.com/r/wallstreetbets/comments/l7m410/doesnt_this_all_end_with_the_feds_being_forced_to/,1611903952.0,"{'author': 'LurkerFailsLurking', 'created_utc': 1611903952, 'title': ""Doesn't this all end with the feds being forced to bail out the financial industry again?"", 'url': 'https://www.reddit.com/r/wallstreetbets/comments/l7m410/doesnt_this_all_end_with_the_feds_being_forced_to/', 'created': 1611903952.0}",2021-01-29 07:05:52
63,Otherwise_Issue9474,1611903950,"Bigger scam : Payment for Order flow (Order routing) - Robinhood, TD, ETrade !",https://www.reddit.com/r/wallstreetbets/comments/l7m40g/bigger_scam_payment_for_order_flow_order_routing/,1611903950.0,"{'author': 'Otherwise_Issue9474', 'created_utc': 1611903950, 'title': 'Bigger scam : Payment for Order flow (Order routing) - Robinhood, TD, ETrade !', 'url': 'https://www.reddit.com/r/wallstreetbets/comments/l7m40g/bigger_scam_payment_for_order_flow_order_routing/', 'created': 1611903950.0}",2021-01-29 07:05:50
64,KonziptOfficial,1611903950,Fuck Robinhood,https://i.redd.it/uqkqyb4i08e61.jpg,1611903950.0,"{'author': 'KonziptOfficial', 'created_utc': 1611903950, 'title': 'Fuck Robinhood', 'url': 'https://i.redd.it/uqkqyb4i08e61.jpg', 'created': 1611903950.0}",2021-01-29 07:05:50
65,5leafedClover_,1611903950,“is no one else seeing what is quite obviously 3 kids stacked on top of each other in a trench coat” - tomorrow we expose Melvin adultman,https://i.redd.it/fyl1ks5i08e61.jpg,1611903950.0,"{'author': '5leafedClover_', 'created_utc': 1611903950, 'title': '“is no one else seeing what is quite obviously 3 kids stacked on top of each other in a trench coat” - tomorrow we expose Melvin adultman', 'url': 'https://i.redd.it/fyl1ks5i08e61.jpg', 'created': 1611903950.0}",2021-01-29 07:05:50
66,GrandmaJoe69,1611903948,Hold,https://i.redd.it/1portp0i08e61.jpg,1611903948.0,"{'author': 'GrandmaJoe69', 'created_utc': 1611903948, 'title': 'Hold', 'url': 'https://i.redd.it/1portp0i08e61.jpg', 'created': 1611903948.0}",2021-01-29 07:05:48
67,drem0r,1611903948,LET'S GO RETARDS! 🚀💎🙌,https://i.redd.it/namnpynh08e61.gif,1611903948.0,"{'author': 'drem0r', 'created_utc': 1611903948, 'title': ""LET'S GO RETARDS! 🚀💎🙌"", 'url': 'https://i.redd.it/namnpynh08e61.gif', 'created': 1611903948.0}",2021-01-29 07:05:48
68,AdSolid3163,1611903947,Buy DOGE road to 1$,https://www.reddit.com/r/wallstreetbets/comments/l7m3ys/buy_doge_road_to_1/,1611903947.0,"{'author': 'AdSolid3163', 'created_utc': 1611903947, 'title': 'Buy DOGE road to 1$', 'url': 'https://www.reddit.com/r/wallstreetbets/comments/l7m3ys/buy_doge_road_to_1/', 'created': 1611903947.0}",2021-01-29 07:05:47
69,Virtousos,1611903946,"We are at war with Wall Street, Hedge Funds. I swiped Left guys!",https://i.redd.it/r69demjg08e61.jpg,1611903946.0,"{'author': 'Virtousos', 'created_utc': 1611903946, 'title': 'We are at war with Wall Street, Hedge Funds. I swiped Left guys!', 'url': 'https://i.redd.it/r69demjg08e61.jpg', 'created': 1611903946.0}",2021-01-29 07:05:46
70,TheSmartInvestorBoys,1611903946,Ocugen $OCGN,https://www.reddit.com/r/wallstreetbets/comments/l7m3yc/ocugen_ocgn/,1611903946.0,"{'author': 'TheSmartInvestorBoys', 'created_utc': 1611903946, 'title': 'Ocugen $OCGN', 'url': 'https://www.reddit.com/r/wallstreetbets/comments/l7m3yc/ocugen_ocgn/', 'created': 1611903946.0}",2021-01-29 07:05:46
71,Sappok,1611903945,German bank and trading App Ing-diba just deleted $GME from their search when the stock exchange opened over here,https://i.redd.it/13hlxcph08e61.jpg,1611903945.0,"{'author': 'Sappok', 'created_utc': 1611903945, 'title': 'German bank and trading App Ing-diba just deleted $GME from their search when the stock exchange opened over here', 'url': 'https://i.redd.it/13hlxcph08e61.jpg', 'created': 1611903945.0}",2021-01-29 07:05:45
72,officepizza,1611903945,“For trying to eliminate hate speech” Or maybe everyone hated that you were trying to monetize the sub illegally,https://news.google.com/articles/CAIiEC0ysME4jpVE_TyVCazQFF4qGAgEKg8IACoHCAowhK-LAjD4ySww69W0BQ?hl=en-US&amp;gl=US&amp;ceid=US%3Aen,1611903945.0,"{'author': 'officepizza', 'created_utc': 1611903945, 'title': '“For trying to eliminate hate speech” Or maybe everyone hated that you were trying to monetize the sub illegally', 'url': 'https://news.google.com/articles/CAIiEC0ysME4jpVE_TyVCazQFF4qGAgEKg8IACoHCAowhK-LAjD4ySww69W0BQ?hl=en-US&amp;gl=US&amp;ceid=US%3Aen', 'created': 1611903945.0}",2021-01-29 07:05:45
73,livetodie918,1611903945,It's almost like they will get away with what they've done,https://i.redd.it/mnf1gvnh08e61.png,1611903945.0,"{'author': 'livetodie918', 'created_utc': 1611903945, 'title': ""It's almost like they will get away with what they've done"", 'url': 'https://i.redd.it/mnf1gvnh08e61.png', 'created': 1611903945.0}",2021-01-29 07:05:45
74,MolassesLong,1611903944,#MemeStonk It seems people made money in #dogecoin to pomp in #Gamestonk tomorrow,https://www.reddit.com/r/wallstreetbets/comments/l7m3xn/memestonk_it_seems_people_made_money_in_dogecoin/,1611903944.0,"{'author': 'MolassesLong', 'created_utc': 1611903944, 'title': '#MemeStonk It seems people made money in #dogecoin to pomp in #Gamestonk tomorrow', 'url': 'https://www.reddit.com/r/wallstreetbets/comments/l7m3xn/memestonk_it_seems_people_made_money_in_dogecoin/', 'created': 1611903944.0}",2021-01-29 07:05:44
75,Suitable-Turnover981,1611903940,Gamestop up 75% in Germany,https://www.reddit.com/r/wallstreetbets/comments/l7m3wb/gamestop_up_75_in_germany/,1611903940.0,"{'author': 'Suitable-Turnover981', 'created_utc': 1611903940, 'title': 'Gamestop up 75% in Germany', 'url': 'https://www.reddit.com/r/wallstreetbets/comments/l7m3wb/gamestop_up_75_in_germany/', 'created': 1611903940.0}",2021-01-29 07:05:40
76,LetsGetRichThisYear,1611903940,"What are some good stocks to invest on tomorrow? Where do we see NOK, AMC, GME?",https://www.reddit.com/r/wallstreetbets/comments/l7m3w3/what_are_some_good_stocks_to_invest_on_tomorrow/,1611903940.0,"{'author': 'LetsGetRichThisYear', 'created_utc': 1611903940, 'title': 'What are some good stocks to invest on tomorrow? Where do we see NOK, AMC, GME?', 'url': 'https://www.reddit.com/r/wallstreetbets/comments/l7m3w3/what_are_some_good_stocks_to_invest_on_tomorrow/', 'created': 1611903940.0}",2021-01-29 07:05:40
77,ams563,1611903939,Liquidity issues... fuck Robinhood,https://www.reddit.com/r/wallstreetbets/comments/l7m3vv/liquidity_issues_fuck_robinhood/,1611903939.0,"{'author': 'ams563', 'created_utc': 1611903939, 'title': 'Liquidity issues... fuck Robinhood', 'url': 'https://www.reddit.com/r/wallstreetbets/comments/l7m3vv/liquidity_issues_fuck_robinhood/', 'created': 1611903939.0}",2021-01-29 07:05:39
78,monkey220697,1611903939,Wanted to be a part of this historical moment. Down with the hood.,https://i.redd.it/99dj301h08e61.jpg,1611903939.0,"{'author': 'monkey220697', 'created_utc': 1611903939, 'title': 'Wanted to be a part of this historical moment. Down with the hood.', 'url': 'https://i.redd.it/99dj301h08e61.jpg', 'created': 1611903939.0}",2021-01-29 07:05:39
79,dillodill,1611903939,Bring back Department Stores,https://www.reddit.com/r/wallstreetbets/comments/l7m3vo/bring_back_department_stores/,1611903939.0,"{'author': 'dillodill', 'created_utc': 1611903939, 'title': 'Bring back Department Stores', 'url': 'https://www.reddit.com/r/wallstreetbets/comments/l7m3vo/bring_back_department_stores/', 'created': 1611903939.0}",2021-01-29 07:05:39
80,ndk97,1611903938,We will guide them as they guided us. With diamond hands.,https://i.redd.it/2imf6vrg08e61.jpg,1611903938.0,"{'author': 'ndk97', 'created_utc': 1611903938, 'title': 'We will guide them as they guided us. With diamond hands.', 'url': 'https://i.redd.it/2imf6vrg08e61.jpg', 'created': 1611903938.0}",2021-01-29 07:05:38
81,daddymcdadjokes,1611903938,"Robinhood, in Need of Cash, Raises $1 Billion From Its Investors",https://www.nytimes.com/2021/01/29/technology/robinhood-fundraising.html?referringSource=articleShare,1611903938.0,"{'author': 'daddymcdadjokes', 'created_utc': 1611903938, 'title': 'Robinhood, in Need of Cash, Raises $1 Billion From Its Investors', 'url': 'https://www.nytimes.com/2021/01/29/technology/robinhood-fundraising.html?referringSource=articleShare', 'created': 1611903938.0}",2021-01-29 07:05:38
82,Stockgawd6,1611903935,LUCID MERGER WUTH CCIV NEXT TESLA LAMBI MONEY!!!!!!,https://www.reddit.com/r/wallstreetbets/comments/l7m3u5/lucid_merger_wuth_cciv_next_tesla_lambi_money/,1611903935.0,"{'author': 'Stockgawd6', 'created_utc': 1611903935, 'title': 'LUCID MERGER WUTH CCIV NEXT TESLA LAMBI MONEY!!!!!!', 'url': 'https://www.reddit.com/r/wallstreetbets/comments/l7m3u5/lucid_merger_wuth_cciv_next_tesla_lambi_money/', 'created': 1611903935.0}",2021-01-29 07:05:35
83,Chef_09DC,1611903933,"Everything in AMC at opening!! Hold till the squeeze on Tuesday. $250 is coming but AMC has to stay above $9 by close on Friday for that to happen. Stick together, hold the line and we can fuck over these billionaire crooks!!",https://www.reddit.com/r/wallstreetbets/comments/l7m3tk/everything_in_amc_at_opening_hold_till_the/,1611903933.0,"{'author': 'Chef_09DC', 'created_utc': 1611903933, 'title': 'Everything in AMC at opening!! Hold till the squeeze on Tuesday. $250 is coming but AMC has to stay above $9 by close on Friday for that to happen. Stick together, hold the line and we can fuck over these billionaire crooks!!', 'url': 'https://www.reddit.com/r/wallstreetbets/comments/l7m3tk/everything_in_amc_at_opening_hold_till_the/', 'created': 1611903933.0}",2021-01-29 07:05:33
84,Mastermindh,1611903933,Put your money where your mouth is! 🦧💎,https://i.redd.it/jshoicdg08e61.jpg,1611903933.0,"{'author': 'Mastermindh', 'created_utc': 1611903933, 'title': 'Put your money where your mouth is! \U0001f9a7💎', 'url': 'https://i.redd.it/jshoicdg08e61.jpg', 'created': 1611903933.0}",2021-01-29 07:05:33
85,No-Veterinarian-3049,1611903933,IF WE STAND TOGETHER WE CAN HELP CHANGE NORMAL PEOPLE'S LIVES!! DOGECOIN ON THE RAISE THANKS TO EVERYONE HERE. LETS KEEP IT GOING.,https://i.redd.it/zgqmm2fg08e61.jpg,1611903933.0,"{'author': 'No-Veterinarian-3049', 'created_utc': 1611903933, 'title': ""IF WE STAND TOGETHER WE CAN HELP CHANGE NORMAL PEOPLE'S LIVES!! DOGECOIN ON THE RAISE THANKS TO EVERYONE HERE. LETS KEEP IT GOING."", 'url': 'https://i.redd.it/zgqmm2fg08e61.jpg', 'created': 1611903933.0}",2021-01-29 07:05:33
86,Supermykel,1611903928,Robinhood Buy ability is back,https://www.reddit.com/r/wallstreetbets/comments/l7m3rn/robinhood_buy_ability_is_back/,1611903928.0,"{'author': 'Supermykel', 'created_utc': 1611903928, 'title': 'Robinhood Buy ability is back', 'url': 'https://www.reddit.com/r/wallstreetbets/comments/l7m3rn/robinhood_buy_ability_is_back/', 'created': 1611903928.0}",2021-01-29 07:05:28
87,Affectionate-Lies69,1611903928,Anybody else see this?!?!?!,https://www.reddit.com/gallery/l7m3r6,1611903928.0,"{'author': 'Affectionate-Lies69', 'created_utc': 1611903928, 'title': 'Anybody else see this?!?!?!', 'url': 'https://www.reddit.com/gallery/l7m3r6', 'created': 1611903928.0}",2021-01-29 07:05:28
88,Nig_Pig,1611903928,"Here's some love from us Aussies, keep HODL'ing bois",https://i.redd.it/7b56xdjvz7e61.gif,1611903928.0,"{'author': 'Nig_Pig', 'created_utc': 1611903928, 'title': ""Here's some love from us Aussies, keep HODL'ing bois"", 'url': 'https://i.redd.it/7b56xdjvz7e61.gif', 'created': 1611903928.0}",2021-01-29 07:05:28
89,davidryan2468,1611903926,PREDICTION: What Comes Next,https://www.reddit.com/r/wallstreetbets/comments/l7m3qg/prediction_what_comes_next/,1611903926.0,"{'author': 'davidryan2468', 'created_utc': 1611903926, 'title': 'PREDICTION: What Comes Next', 'url': 'https://www.reddit.com/r/wallstreetbets/comments/l7m3qg/prediction_what_comes_next/', 'created': 1611903926.0}",2021-01-29 07:05:26
90,adrianrobison,1611903926,Silver is heavily shorted. If the market crashes it might be the best thing WSB piles onto... $SLV as a hedge and short squeeze?,https://www.reddit.com/r/wallstreetbets/comments/l7m3qd/silver_is_heavily_shorted_if_the_market_crashes/,1611903926.0,"{'author': 'adrianrobison', 'created_utc': 1611903926, 'title': 'Silver is heavily shorted. If the market crashes it might be the best thing WSB piles onto... $SLV as a hedge and short squeeze?', 'url': 'https://www.reddit.com/r/wallstreetbets/comments/l7m3qd/silver_is_heavily_shorted_if_the_market_crashes/', 'created': 1611903926.0}",2021-01-29 07:05:26
91,iputbananasinmybutt,1611903926,Buy and hold music video about GME 🚀,https://www.youtube.com/watch?v=G5698ywwXs4,1611903926.0,"{'author': 'iputbananasinmybutt', 'created_utc': 1611903926, 'title': 'Buy and hold music video about GME 🚀', 'url': 'https://www.youtube.com/watch?v=G5698ywwXs4', 'created': 1611903926.0}",2021-01-29 07:05:26
92,marius88034,1611903926,Boys you can use Revolute to buy AMC and GME 🚀🚀🚀🚀🚀🚀,https://i.redd.it/ges5gpif08e61.jpg,1611903926.0,"{'author': 'marius88034', 'created_utc': 1611903926, 'title': 'Boys you can use Revolute to buy AMC and GME 🚀🚀🚀🚀🚀🚀', 'url': 'https://i.redd.it/ges5gpif08e61.jpg', 'created': 1611903926.0}",2021-01-29 07:05:26
93,CMBeumont_,1611903925,"WE ARE SAVING 5,500+ STORES AND 60,000+ JOBS. THESE HEDGE FUNDS CONTINUE TO BET AGAINST THE ECONOMY AND CELEBRATE WHEN PEOPLE LOSE EVERYTHING. THIS IS PAYBACK FOR 2008 WHEN YOU DESTROYED THE GLOBAL ECONOMY, BEGGED THE GOVERNMENT TO GIVE YOU OUR TAX DOLLARS, THEN PAID YOURSELVES BILLIONS IN BONUSES.",https://www.reddit.com/r/wallstreetbets/comments/l7m3pw/we_are_saving_5500_stores_and_60000_jobs_these/,1611903925.0,"{'author': 'CMBeumont_', 'created_utc': 1611903925, 'title': 'WE ARE SAVING 5,500+ STORES AND 60,000+ JOBS. THESE HEDGE FUNDS CONTINUE TO BET AGAINST THE ECONOMY AND CELEBRATE WHEN PEOPLE LOSE EVERYTHING. THIS IS PAYBACK FOR 2008 WHEN YOU DESTROYED THE GLOBAL ECONOMY, BEGGED THE GOVERNMENT TO GIVE YOU OUR TAX DOLLARS, THEN PAID YOURSELVES BILLIONS IN BONUSES.', 'url': 'https://www.reddit.com/r/wallstreetbets/comments/l7m3pw/we_are_saving_5500_stores_and_60000_jobs_these/', 'created': 1611903925.0}",2021-01-29 07:05:25
94,DayDry7629,1611903925,Our War Poem,https://www.reddit.com/r/wallstreetbets/comments/l7m3pr/our_war_poem/,1611903925.0,"{'author': 'DayDry7629', 'created_utc': 1611903925, 'title': 'Our War Poem', 'url': 'https://www.reddit.com/r/wallstreetbets/comments/l7m3pr/our_war_poem/', 'created': 1611903925.0}",2021-01-29 07:05:25
95,deadfeesh,1611903922,If we all have diamond hands and we fucking hold tomorrow this will be beautiful,https://www.reddit.com/r/wallstreetbets/comments/l7m3oi/if_we_all_have_diamond_hands_and_we_fucking_hold/,1611903922.0,"{'author': 'deadfeesh', 'created_utc': 1611903922, 'title': 'If we all have diamond hands and we fucking hold tomorrow this will be beautiful', 'url': 'https://www.reddit.com/r/wallstreetbets/comments/l7m3oi/if_we_all_have_diamond_hands_and_we_fucking_hold/', 'created': 1611903922.0}",2021-01-29 07:05:22
96,InfiniteDeathsticks,1611903919,Is there a category for this kind of porn?,https://i.redd.it/2b7vtb8a08e61.png,1611903919.0,"{'author': 'InfiniteDeathsticks', 'created_utc': 1611903919, 'title': 'Is there a category for this kind of porn?', 'url': 'https://i.redd.it/2b7vtb8a08e61.png', 'created': 1611903919.0}",2021-01-29 07:05:19
97,chitty_chitty_,1611903918,Can someone please look at POWW!!they have some legit tech for the average shooting Joe!,https://www.reddit.com/r/wallstreetbets/comments/l7m3n5/can_someone_please_look_at_powwthey_have_some/,1611903918.0,"{'author': 'chitty_chitty_', 'created_utc': 1611903918, 'title': 'Can someone please look at POWW!!they have some legit tech for the average shooting Joe!', 'url': 'https://www.reddit.com/r/wallstreetbets/comments/l7m3n5/can_someone_please_look_at_powwthey_have_some/', 'created': 1611903918.0}",2021-01-29 07:05:18
98,Capable_Piano_3425,1611903917,QUITE THE PRESS!!! Show our love for Diabetics,https://www.reddit.com/r/wallstreetbets/comments/l7m3mr/quite_the_press_show_our_love_for_diabetics/,1611903917.0,"{'author': 'Capable_Piano_3425', 'created_utc': 1611903917, 'title': 'QUITE THE PRESS!!! Show our love for Diabetics', 'url': 'https://www.reddit.com/r/wallstreetbets/comments/l7m3mr/quite_the_press_show_our_love_for_diabetics/', 'created': 1611903917.0}",2021-01-29 07:05:17
99,NDsysAdmin,1611903915,AMC,https://www.reddit.com/r/wallstreetbets/comments/l7m3m5/amc/,1611903915.0,"{'author': 'NDsysAdmin', 'created_utc': 1611903915, 'title': 'AMC', 'url': 'https://www.reddit.com/r/wallstreetbets/comments/l7m3m5/amc/', 'created': 1611903915.0}",2021-01-29 07:05:15
