,author,created_utc,title,url,created,d_,created_utc_dt
0,Lazishadow11,1611904035,XLM anyone?,https://www.reddit.com/r/wallstreetbets/comments/l7m4vd/xlm_anyone/,1611904035.0,"{'author': 'Lazishadow11', 'created_utc': 1611904035, 'title': 'XLM anyone?', 'url': 'https://www.reddit.com/r/wallstreetbets/comments/l7m4vd/xlm_anyone/', 'created': 1611904035.0}",2021-01-29 07:07:15
1,StamnerHammer,1611904034,Can someone explain,https://www.reddit.com/r/wallstreetbets/comments/l7m4ut/can_someone_explain/,1611904034.0,"{'author': 'StamnerHammer', 'created_utc': 1611904034, 'title': 'Can someone explain', 'url': 'https://www.reddit.com/r/wallstreetbets/comments/l7m4ut/can_someone_explain/', 'created': 1611904034.0}",2021-01-29 07:07:14
2,GhostPower_10,1611904034,Next stock to hold ??,https://www.reddit.com/r/wallstreetbets/comments/l7m4us/next_stock_to_hold/,1611904034.0,"{'author': 'GhostPower_10', 'created_utc': 1611904034, 'title': 'Next stock to hold ??', 'url': 'https://www.reddit.com/r/wallstreetbets/comments/l7m4us/next_stock_to_hold/', 'created': 1611904034.0}",2021-01-29 07:07:14
3,Therahh,1611904033,APPS IN GERMANY,https://www.reddit.com/r/wallstreetbets/comments/l7m4ug/apps_in_germany/,1611904033.0,"{'author': 'Therahh', 'created_utc': 1611904033, 'title': 'APPS IN GERMANY', 'url': 'https://www.reddit.com/r/wallstreetbets/comments/l7m4ug/apps_in_germany/', 'created': 1611904033.0}",2021-01-29 07:07:13
4,Claesfranhjo,1611904033,Lets GOOO all WEEBS!,https://i.redd.it/t9l5re2h08e61.png,1611904033.0,"{'author': 'Claesfranhjo', 'created_utc': 1611904033, 'title': 'Lets GOOO all WEEBS!', 'url': 'https://i.redd.it/t9l5re2h08e61.png', 'created': 1611904033.0}",2021-01-29 07:07:13
5,Ra1d3n,1611904032,Question: Is GS2C:FRA the same as GME:NYSE ?,https://www.reddit.com/r/wallstreetbets/comments/l7m4u5/question_is_gs2cfra_the_same_as_gmenyse/,1611904032.0,"{'author': 'Ra1d3n', 'created_utc': 1611904032, 'title': 'Question: Is GS2C:FRA the same as GME:NYSE ?', 'url': 'https://www.reddit.com/r/wallstreetbets/comments/l7m4u5/question_is_gs2cfra_the_same_as_gmenyse/', 'created': 1611904032.0}",2021-01-29 07:07:12
6,Apprehensive_Star816,1611904031,"Wtf is this not even being mentioned. Bigs down at WS have no problem taking companies into the ground, but when the tides turn on them WS protects them. Fuk them. I hope these hedge funds go fukn under.",https://i.redd.it/tevr6ctq08e61.jpg,1611904031.0,"{'author': 'Apprehensive_Star816', 'created_utc': 1611904031, 'title': 'Wtf is this not even being mentioned. Bigs down at WS have no problem taking companies into the ground, but when the tides turn on them WS protects them. Fuk them. I hope these hedge funds go fukn under.', 'url': 'https://i.redd.it/tevr6ctq08e61.jpg', 'created': 1611904031.0}",2021-01-29 07:07:11
7,Gloomy_Ad_6175,1611904028,"Stock to own after Vaccination AHT -- Ashford Hospitality Trust, Inc.",https://www.reddit.com/r/wallstreetbets/comments/l7m4sj/stock_to_own_after_vaccination_aht_ashford/,1611904028.0,"{'author': 'Gloomy_Ad_6175', 'created_utc': 1611904028, 'title': 'Stock to own after Vaccination AHT -- Ashford Hospitality Trust, Inc.', 'url': 'https://www.reddit.com/r/wallstreetbets/comments/l7m4sj/stock_to_own_after_vaccination_aht_ashford/', 'created': 1611904028.0}",2021-01-29 07:07:08
8,bluevacummpump,1611904028,"$GME - Banks are Facing Unlimited Exposure, Potential for Govt. Bailout.",https://www.reddit.com/r/wallstreetbets/comments/l7m4se/gme_banks_are_facing_unlimited_exposure_potential/,1611904028.0,"{'author': 'bluevacummpump', 'created_utc': 1611904028, 'title': '$GME - Banks are Facing Unlimited Exposure, Potential for Govt. Bailout.', 'url': 'https://www.reddit.com/r/wallstreetbets/comments/l7m4se/gme_banks_are_facing_unlimited_exposure_potential/', 'created': 1611904028.0}",2021-01-29 07:07:08
9,SteinsDomain,1611904027,I can't afford any GME like you lucky bastards,https://www.reddit.com/r/wallstreetbets/comments/l7m4s5/i_cant_afford_any_gme_like_you_lucky_bastards/,1611904027.0,"{'author': 'SteinsDomain', 'created_utc': 1611904027, 'title': ""I can't afford any GME like you lucky bastards"", 'url': 'https://www.reddit.com/r/wallstreetbets/comments/l7m4s5/i_cant_afford_any_gme_like_you_lucky_bastards/', 'created': 1611904027.0}",2021-01-29 07:07:07
10,bobby_barbados,1611904027,"Hypothetically, If I were trying to set up a limit to sell a popular stock so I do not get 'locked ' out of my broker competing with everyone; Which is better, Stop loss or Stop limit?",https://www.reddit.com/r/wallstreetbets/comments/l7m4s4/hypothetically_if_i_were_trying_to_set_up_a_limit/,1611904027.0,"{'author': 'bobby_barbados', 'created_utc': 1611904027, 'title': ""Hypothetically, If I were trying to set up a limit to sell a popular stock so I do not get 'locked ' out of my broker competing with everyone; Which is better, Stop loss or Stop limit?"", 'url': 'https://www.reddit.com/r/wallstreetbets/comments/l7m4s4/hypothetically_if_i_were_trying_to_set_up_a_limit/', 'created': 1611904027.0}",2021-01-29 07:07:07
11,BastionNargothrond,1611904025,This just in RH ipo valued at 0,https://i.redd.it/ng9gtcaq08e61.png,1611904025.0,"{'author': 'BastionNargothrond', 'created_utc': 1611904025, 'title': 'This just in RH ipo valued at 0', 'url': 'https://i.redd.it/ng9gtcaq08e61.png', 'created': 1611904025.0}",2021-01-29 07:07:05
12,StrafeLord38,1611904025,GME BACK ONLINE,https://www.reddit.com/r/wallstreetbets/comments/l7m4r9/gme_back_online/,1611904025.0,"{'author': 'StrafeLord38', 'created_utc': 1611904025, 'title': 'GME BACK ONLINE', 'url': 'https://www.reddit.com/r/wallstreetbets/comments/l7m4r9/gme_back_online/', 'created': 1611904025.0}",2021-01-29 07:07:05
13,brayvalley1988,1611904023,Well we gotta pet something while we cant sleep before battle....,https://i.redd.it/tyocl5ha08e61.jpg,1611904023.0,"{'author': 'brayvalley1988', 'created_utc': 1611904023, 'title': 'Well we gotta pet something while we cant sleep before battle....', 'url': 'https://i.redd.it/tyocl5ha08e61.jpg', 'created': 1611904023.0}",2021-01-29 07:07:03
14,Boden30Dom,1611904022,🚀🚀DOGE COIN TO THE FUCKING MOON AUTISTS🚀🚀🚀 HOLD THE FUCKING LINE🚀🚀 IM ALL IN🚀🚀🚀,https://www.reddit.com/r/wallstreetbets/comments/l7m4qb/doge_coin_to_the_fucking_moon_autists_hold_the/,1611904022.0,"{'author': 'Boden30Dom', 'created_utc': 1611904022, 'title': '🚀🚀DOGE COIN TO THE FUCKING MOON AUTISTS🚀🚀🚀 HOLD THE FUCKING LINE🚀🚀 IM ALL IN🚀🚀🚀', 'url': 'https://www.reddit.com/r/wallstreetbets/comments/l7m4qb/doge_coin_to_the_fucking_moon_autists_hold_the/', 'created': 1611904022.0}",2021-01-29 07:07:02
15,hakutoexploration,1611904017,Is the AMC squeeze confirmed to happen by Friday?,https://www.reddit.com/r/wallstreetbets/comments/l7m4ol/is_the_amc_squeeze_confirmed_to_happen_by_friday/,1611904017.0,"{'author': 'hakutoexploration', 'created_utc': 1611904017, 'title': 'Is the AMC squeeze confirmed to happen by Friday?', 'url': 'https://www.reddit.com/r/wallstreetbets/comments/l7m4ol/is_the_amc_squeeze_confirmed_to_happen_by_friday/', 'created': 1611904017.0}",2021-01-29 07:06:57
16,xZACHEDELICx,1611904014,"So Robinhood and Thinkorswim are sketchy effers, what brokerage should I be using??",https://www.reddit.com/r/wallstreetbets/comments/l7m4nc/so_robinhood_and_thinkorswim_are_sketchy_effers/,1611904014.0,"{'author': 'xZACHEDELICx', 'created_utc': 1611904014, 'title': 'So Robinhood and Thinkorswim are sketchy effers, what brokerage should I be using??', 'url': 'https://www.reddit.com/r/wallstreetbets/comments/l7m4nc/so_robinhood_and_thinkorswim_are_sketchy_effers/', 'created': 1611904014.0}",2021-01-29 07:06:54
17,GetStarched,1611904013,"Are we fooling ourselves? This entire thing is a quixotic inflationary event, and possibly engineered as a cover for larger hedge funds to destroy smaller hedge funds. Dark pools owned by Goldman Sachs, JPMorgan, UBS, et al traded more than 200,000 shares of GME week ending 12/21/2020.",https://www.reddit.com/r/wallstreetbets/comments/l7m4n7/are_we_fooling_ourselves_this_entire_thing_is_a/,1611904013.0,"{'author': 'GetStarched', 'created_utc': 1611904013, 'title': 'Are we fooling ourselves? This entire thing is a quixotic inflationary event, and possibly engineered as a cover for larger hedge funds to destroy smaller hedge funds. Dark pools owned by Goldman Sachs, JPMorgan, UBS, et al traded more than 200,000 shares of GME week ending 12/21/2020.', 'url': 'https://www.reddit.com/r/wallstreetbets/comments/l7m4n7/are_we_fooling_ourselves_this_entire_thing_is_a/', 'created': 1611904013.0}",2021-01-29 07:06:53
18,MaheshTibrewal,1611904011,XRP,https://www.reddit.com/r/wallstreetbets/comments/l7m4mi/xrp/,1611904011.0,"{'author': 'MaheshTibrewal', 'created_utc': 1611904011, 'title': 'XRP', 'url': 'https://www.reddit.com/r/wallstreetbets/comments/l7m4mi/xrp/', 'created': 1611904011.0}",2021-01-29 07:06:51
19,Passion131190,1611904011,IN GERMANY 300€ .... let it go to 1000€!!!,https://www.reddit.com/r/wallstreetbets/comments/l7m4mf/in_germany_300_let_it_go_to_1000/,1611904011.0,"{'author': 'Passion131190', 'created_utc': 1611904011, 'title': 'IN GERMANY 300€ .... let it go to 1000€!!!', 'url': 'https://www.reddit.com/r/wallstreetbets/comments/l7m4mf/in_germany_300_let_it_go_to_1000/', 'created': 1611904011.0}",2021-01-29 07:06:51
20,Stocktokker,1611904010,Get ready for the XRP rush guys let’s all do this,https://www.reddit.com/r/wallstreetbets/comments/l7m4m1/get_ready_for_the_xrp_rush_guys_lets_all_do_this/,1611904010.0,"{'author': 'Stocktokker', 'created_utc': 1611904010, 'title': 'Get ready for the XRP rush guys let’s all do this', 'url': 'https://www.reddit.com/r/wallstreetbets/comments/l7m4m1/get_ready_for_the_xrp_rush_guys_lets_all_do_this/', 'created': 1611904010.0}",2021-01-29 07:06:50
21,Pink_Penetrator,1611904007,"So, what's the chance of another dip before the US bros gets involved? Just so I know what we re dealing with here",https://www.reddit.com/r/wallstreetbets/comments/l7m4ld/so_whats_the_chance_of_another_dip_before_the_us/,1611904007.0,"{'author': 'Pink_Penetrator', 'created_utc': 1611904007, 'title': ""So, what's the chance of another dip before the US bros gets involved? Just so I know what we re dealing with here"", 'url': 'https://www.reddit.com/r/wallstreetbets/comments/l7m4ld/so_whats_the_chance_of_another_dip_before_the_us/', 'created': 1611904007.0}",2021-01-29 07:06:47
22,Redditorrated,1611904007,"Dogecoin does have utility &amp; voted into XRP FlareNetwork, held its value vs Bitcoin, stuck around while others failed, cult following, Dogethereum (smart contracts) and more.",https://www.reddit.com/r/wallstreetbets/comments/l7m4l4/dogecoin_does_have_utility_voted_into_xrp/,1611904007.0,"{'author': 'Redditorrated', 'created_utc': 1611904007, 'title': 'Dogecoin does have utility &amp; voted into XRP FlareNetwork, held its value vs Bitcoin, stuck around while others failed, cult following, Dogethereum (smart contracts) and more.', 'url': 'https://www.reddit.com/r/wallstreetbets/comments/l7m4l4/dogecoin_does_have_utility_voted_into_xrp/', 'created': 1611904007.0}",2021-01-29 07:06:47
23,r0shann,1611904007,Wall Street brokers took the L !,https://i.redd.it/e2dbwc8o08e61.jpg,1611904007.0,"{'author': 'r0shann', 'created_utc': 1611904007, 'title': 'Wall Street brokers took the L !', 'url': 'https://i.redd.it/e2dbwc8o08e61.jpg', 'created': 1611904007.0}",2021-01-29 07:06:47
24,ve1ez,1611904006,Oversimplification of a tl;dr done as meme regarding what’s going on right now.,https://i.redd.it/grt9ui5o08e61.jpg,1611904006.0,"{'author': 've1ez', 'created_utc': 1611904006, 'title': 'Oversimplification of a tl;dr done as meme regarding what’s going on right now.', 'url': 'https://i.redd.it/grt9ui5o08e61.jpg', 'created': 1611904006.0}",2021-01-29 07:06:46
25,Crucible_King,1611904006,Whistleblower Fundraiser assistance,https://www.reddit.com/r/wallstreetbets/comments/l7m4kk/whistleblower_fundraiser_assistance/,1611904006.0,"{'author': 'Crucible_King', 'created_utc': 1611904006, 'title': 'Whistleblower Fundraiser assistance', 'url': 'https://www.reddit.com/r/wallstreetbets/comments/l7m4kk/whistleblower_fundraiser_assistance/', 'created': 1611904006.0}",2021-01-29 07:06:46
26,Agumo,1611904004,WE ARE GOING TO MAKE OUR DREAMS COME TRUE,https://www.reddit.com/r/wallstreetbets/comments/l7m4kc/we_are_going_to_make_our_dreams_come_true/,1611904004.0,"{'author': 'Agumo', 'created_utc': 1611904004, 'title': 'WE ARE GOING TO MAKE OUR DREAMS COME TRUE', 'url': 'https://www.reddit.com/r/wallstreetbets/comments/l7m4kc/we_are_going_to_make_our_dreams_come_true/', 'created': 1611904004.0}",2021-01-29 07:06:44
27,BrotherPancake,1611904003,Reminder: Hold on for one more day. (wait for it...),https://www.youtube.com/watch?v=sph0qVPkL4g&amp;ts=0,1611904003.0,"{'author': 'BrotherPancake', 'created_utc': 1611904003, 'title': 'Reminder: Hold on for one more day. (wait for it...)', 'url': 'https://www.youtube.com/watch?v=sph0qVPkL4g&amp;ts=0', 'created': 1611904003.0}",2021-01-29 07:06:43
28,goodtodiefor,1611904000,XLM,https://www.reddit.com/r/wallstreetbets/comments/l7m4iw/xlm/,1611904000.0,"{'author': 'goodtodiefor', 'created_utc': 1611904000, 'title': 'XLM', 'url': 'https://www.reddit.com/r/wallstreetbets/comments/l7m4iw/xlm/', 'created': 1611904000.0}",2021-01-29 07:06:40
29,ukrani_baby,1611903999,WE ARE NOT LEAVING,https://www.reddit.com/r/wallstreetbets/comments/l7m4if/we_are_not_leaving/,1611903999.0,"{'author': 'ukrani_baby', 'created_utc': 1611903999, 'title': 'WE ARE NOT LEAVING', 'url': 'https://www.reddit.com/r/wallstreetbets/comments/l7m4if/we_are_not_leaving/', 'created': 1611903999.0}",2021-01-29 07:06:39
30,No_Back3141,1611903996,I only have 50 bucks but i put it all on GME,https://www.reddit.com/r/wallstreetbets/comments/l7m4h1/i_only_have_50_bucks_but_i_put_it_all_on_gme/,1611903996.0,"{'author': 'No_Back3141', 'created_utc': 1611903996, 'title': 'I only have 50 bucks but i put it all on GME', 'url': 'https://www.reddit.com/r/wallstreetbets/comments/l7m4h1/i_only_have_50_bucks_but_i_put_it_all_on_gme/', 'created': 1611903996.0}",2021-01-29 07:06:36
31,macabrasive,1611903996,Fuck it selling everything tomorrow to go 100% GME,https://www.reddit.com/r/wallstreetbets/comments/l7m4h0/fuck_it_selling_everything_tomorrow_to_go_100_gme/,1611903996.0,"{'author': 'macabrasive', 'created_utc': 1611903996, 'title': 'Fuck it selling everything tomorrow to go 100% GME', 'url': 'https://www.reddit.com/r/wallstreetbets/comments/l7m4h0/fuck_it_selling_everything_tomorrow_to_go_100_gme/', 'created': 1611903996.0}",2021-01-29 07:06:36
32,Xposedhim,1611903993,DOGE is up 420% I can not make this shit up🚀🚀🚀🚀😩,https://i.redd.it/ua2g11pm08e61.jpg,1611903993.0,"{'author': 'Xposedhim', 'created_utc': 1611903993, 'title': 'DOGE is up 420% I can not make this shit up🚀🚀🚀🚀😩', 'url': 'https://i.redd.it/ua2g11pm08e61.jpg', 'created': 1611903993.0}",2021-01-29 07:06:33
33,PEEN-JUICE,1611903993,Fuckin with tha hood,https://www.reddit.com/r/wallstreetbets/comments/l7m4g6/fuckin_with_tha_hood/,1611903993.0,"{'author': 'PEEN-JUICE', 'created_utc': 1611903993, 'title': 'Fuckin with tha hood', 'url': 'https://www.reddit.com/r/wallstreetbets/comments/l7m4g6/fuckin_with_tha_hood/', 'created': 1611903993.0}",2021-01-29 07:06:33
34,midwestairdetailer,1611903992,Am I Doing This Right??,https://www.reddit.com/r/wallstreetbets/comments/l7m4fx/am_i_doing_this_right/,1611903992.0,"{'author': 'midwestairdetailer', 'created_utc': 1611903992, 'title': 'Am I Doing This Right??', 'url': 'https://www.reddit.com/r/wallstreetbets/comments/l7m4fx/am_i_doing_this_right/', 'created': 1611903992.0}",2021-01-29 07:06:32
35,kidnico,1611903991,DOGECOIN subreddit link below,https://www.reddit.com/r/wallstreetbets/comments/l7m4fs/dogecoin_subreddit_link_below/,1611903991.0,"{'author': 'kidnico', 'created_utc': 1611903991, 'title': 'DOGECOIN subreddit link below', 'url': 'https://www.reddit.com/r/wallstreetbets/comments/l7m4fs/dogecoin_subreddit_link_below/', 'created': 1611903991.0}",2021-01-29 07:06:31
36,Brilliant_Wall_9158,1611903991,Retards buy Silver,https://www.reddit.com/r/wallstreetbets/comments/l7m4fm/retards_buy_silver/,1611903991.0,"{'author': 'Brilliant_Wall_9158', 'created_utc': 1611903991, 'title': 'Retards buy Silver', 'url': 'https://www.reddit.com/r/wallstreetbets/comments/l7m4fm/retards_buy_silver/', 'created': 1611903991.0}",2021-01-29 07:06:31
37,Corysee,1611903991,Dogecoin ready to be purchased on Rh,https://www.reddit.com/r/wallstreetbets/comments/l7m4fk/dogecoin_ready_to_be_purchased_on_rh/,1611903991.0,"{'author': 'Corysee', 'created_utc': 1611903991, 'title': 'Dogecoin ready to be purchased on Rh', 'url': 'https://www.reddit.com/r/wallstreetbets/comments/l7m4fk/dogecoin_ready_to_be_purchased_on_rh/', 'created': 1611903991.0}",2021-01-29 07:06:31
38,didiman123,1611903990,Buying GME is possible again on German broker Traderepublic,https://www.reddit.com/r/wallstreetbets/comments/l7m4ez/buying_gme_is_possible_again_on_german_broker/,1611903990.0,"{'author': 'didiman123', 'created_utc': 1611903990, 'title': 'Buying GME is possible again on German broker Traderepublic', 'url': 'https://www.reddit.com/r/wallstreetbets/comments/l7m4ez/buying_gme_is_possible_again_on_german_broker/', 'created': 1611903990.0}",2021-01-29 07:06:30
39,LeastTradition8724,1611903988,Can I buy fractional GME stonks?,https://www.reddit.com/r/wallstreetbets/comments/l7m4ej/can_i_buy_fractional_gme_stonks/,1611903988.0,"{'author': 'LeastTradition8724', 'created_utc': 1611903988, 'title': 'Can I buy fractional GME stonks?', 'url': 'https://www.reddit.com/r/wallstreetbets/comments/l7m4ej/can_i_buy_fractional_gme_stonks/', 'created': 1611903988.0}",2021-01-29 07:06:28
40,Safr3nn,1611903984,Gamestop,https://www.reddit.com/r/wallstreetbets/comments/l7m4cw/gamestop/,1611903984.0,"{'author': 'Safr3nn', 'created_utc': 1611903984, 'title': 'Gamestop', 'url': 'https://www.reddit.com/r/wallstreetbets/comments/l7m4cw/gamestop/', 'created': 1611903984.0}",2021-01-29 07:06:24
41,random_user18370,1611903984,Obligatory 🚀🚀🚀 also fuck citadel,https://i.redd.it/f50krbpl08e61.jpg,1611903984.0,"{'author': 'random_user18370', 'created_utc': 1611903984, 'title': 'Obligatory 🚀🚀🚀 also fuck citadel', 'url': 'https://i.redd.it/f50krbpl08e61.jpg', 'created': 1611903984.0}",2021-01-29 07:06:24
42,Longjumping_Ad2537,1611903983,Apologies if this has already been made. Thanks for the inspiration!,https://i.redd.it/fvhiydjl08e61.png,1611903983.0,"{'author': 'Longjumping_Ad2537', 'created_utc': 1611903983, 'title': 'Apologies if this has already been made. Thanks for the inspiration!', 'url': 'https://i.redd.it/fvhiydjl08e61.png', 'created': 1611903983.0}",2021-01-29 07:06:23
43,Aggressive-Bar-3012,1611903983,69%Short!!!!Gossamer bio🚀🚀🚀🚀🎉,https://i.redd.it/8pfdl5ml08e61.jpg,1611903983.0,"{'author': 'Aggressive-Bar-3012', 'created_utc': 1611903983, 'title': '69%Short!!!!Gossamer bio🚀🚀🚀🚀🎉', 'url': 'https://i.redd.it/8pfdl5ml08e61.jpg', 'created': 1611903983.0}",2021-01-29 07:06:23
44,BrownTiger97,1611903979,XSPA looks interesting...,https://www.reddit.com/r/wallstreetbets/comments/l7m4bi/xspa_looks_interesting/,1611903979.0,"{'author': 'BrownTiger97', 'created_utc': 1611903979, 'title': 'XSPA looks interesting...', 'url': 'https://www.reddit.com/r/wallstreetbets/comments/l7m4bi/xspa_looks_interesting/', 'created': 1611903979.0}",2021-01-29 07:06:19
45,morecowwbell,1611903977,Meanwhile in the forest of Sherwood...,https://i.redd.it/nz6bo02l08e61.jpg,1611903977.0,"{'author': 'morecowwbell', 'created_utc': 1611903977, 'title': 'Meanwhile in the forest of Sherwood...', 'url': 'https://i.redd.it/nz6bo02l08e61.jpg', 'created': 1611903977.0}",2021-01-29 07:06:17
46,fatboy101_2,1611903976,"Ok I'm totally new to this I understand a few things so please help me out, the doge coin bullshit does it seem worth it??",https://www.reddit.com/r/wallstreetbets/comments/l7m49x/ok_im_totally_new_to_this_i_understand_a_few/,1611903976.0,"{'author': 'fatboy101_2', 'created_utc': 1611903976, 'title': ""Ok I'm totally new to this I understand a few things so please help me out, the doge coin bullshit does it seem worth it??"", 'url': 'https://www.reddit.com/r/wallstreetbets/comments/l7m49x/ok_im_totally_new_to_this_i_understand_a_few/', 'created': 1611903976.0}",2021-01-29 07:06:16
47,absolutelyrightsirr,1611903975,BUY DOGE LIKE PAPA ELON SAID AND LETS SEND IT TO THE MOON 🚀🚀🚀🚀🚀,https://i.redd.it/g24s7cxk08e61.jpg,1611903975.0,"{'author': 'absolutelyrightsirr', 'created_utc': 1611903975, 'title': 'BUY DOGE LIKE PAPA ELON SAID AND LETS SEND IT TO THE MOON 🚀🚀🚀🚀🚀', 'url': 'https://i.redd.it/g24s7cxk08e61.jpg', 'created': 1611903975.0}",2021-01-29 07:06:15
48,bigyellowbob,1611903973,I’m so proud of all u retards... Tomorrow we all become Bankruptcy Specialists at Melvin Capital,https://i.redd.it/bvsgebpk08e61.jpg,1611903973.0,"{'author': 'bigyellowbob', 'created_utc': 1611903973, 'title': 'I’m so proud of all u retards... Tomorrow we all become Bankruptcy Specialists at Melvin Capital', 'url': 'https://i.redd.it/bvsgebpk08e61.jpg', 'created': 1611903973.0}",2021-01-29 07:06:13
49,myverysecureaccount,1611903973,"Hedge funds are going to be triple checking their short positions to make sure their risk level (and risk of being a target) are lowered, so what comes next? How can we make sure we aren’t hurting each other, just HF shorties and the like?",https://www.reddit.com/r/wallstreetbets/comments/l7m48w/hedge_funds_are_going_to_be_triple_checking_their/,1611903973.0,"{'author': 'myverysecureaccount', 'created_utc': 1611903973, 'title': 'Hedge funds are going to be triple checking their short positions to make sure their risk level (and risk of being a target) are lowered, so what comes next? How can we make sure we aren’t hurting each other, just HF shorties and the like?', 'url': 'https://www.reddit.com/r/wallstreetbets/comments/l7m48w/hedge_funds_are_going_to_be_triple_checking_their/', 'created': 1611903973.0}",2021-01-29 07:06:13
50,RvnclawPotionsMaster,1611903972,"#SILVERSOLDIERS Peter Schiff has spoken! Push MUX, SLV, KGC, AG, &amp; SIVR at dawn! These will stick it to the pricks on WS and are a [retardedly] smart investment. LET'S GOOOOO.",https://i.redd.it/gmxuu42cz7e61.jpg,1611903972.0,"{'author': 'RvnclawPotionsMaster', 'created_utc': 1611903972, 'title': ""#SILVERSOLDIERS Peter Schiff has spoken! Push MUX, SLV, KGC, AG, &amp; SIVR at dawn! These will stick it to the pricks on WS and are a [retardedly] smart investment. LET'S GOOOOO."", 'url': 'https://i.redd.it/gmxuu42cz7e61.jpg', 'created': 1611903972.0}",2021-01-29 07:06:12
51,superking87,1611903970,"Quote of the night, “Don’t worry all you hedge fund investors. I’m sure all that Reddit investor money will eventually trickle down to you.” -Stephen Colbert.",https://www.reddit.com/r/wallstreetbets/comments/l7m47o/quote_of_the_night_dont_worry_all_you_hedge_fund/,1611903970.0,"{'author': 'superking87', 'created_utc': 1611903970, 'title': 'Quote of the night, “Don’t worry all you hedge fund investors. I’m sure all that Reddit investor money will eventually trickle down to you.” -Stephen Colbert.', 'url': 'https://www.reddit.com/r/wallstreetbets/comments/l7m47o/quote_of_the_night_dont_worry_all_you_hedge_fund/', 'created': 1611903970.0}",2021-01-29 07:06:10
52,Atrocious227,1611903969,WSB ASSEMBLE!!!!,https://vimeo.com/505993837,1611903969.0,"{'author': 'Atrocious227', 'created_utc': 1611903969, 'title': 'WSB ASSEMBLE!!!!', 'url': 'https://vimeo.com/505993837', 'created': 1611903969.0}",2021-01-29 07:06:09
53,modestmansion1,1611903966,What’s the difference between Robinhood &amp; Epstein?,https://www.reddit.com/r/wallstreetbets/comments/l7m463/whats_the_difference_between_robinhood_epstein/,1611903966.0,"{'author': 'modestmansion1', 'created_utc': 1611903966, 'title': 'What’s the difference between Robinhood &amp; Epstein?', 'url': 'https://www.reddit.com/r/wallstreetbets/comments/l7m463/whats_the_difference_between_robinhood_epstein/', 'created': 1611903966.0}",2021-01-29 07:06:06
54,Little_Economy4889,1611903965,#DOGECOIN needs your help. Shake it and make it to $1.🚀🚀🚀 @elonmusk (Elon Musk) loves it.,https://www.reddit.com/gallery/l7m45t,1611903965.0,"{'author': 'Little_Economy4889', 'created_utc': 1611903965, 'title': '#DOGECOIN needs your help. Shake it and make it to $1.🚀🚀🚀 @elonmusk (Elon Musk) loves it.', 'url': 'https://www.reddit.com/gallery/l7m45t', 'created': 1611903965.0}",2021-01-29 07:06:05
55,MarduKing,1611903963,Putting my whole life savings into dogecoin,https://www.reddit.com/r/wallstreetbets/comments/l7m45f/putting_my_whole_life_savings_into_dogecoin/,1611903963.0,"{'author': 'MarduKing', 'created_utc': 1611903963, 'title': 'Putting my whole life savings into dogecoin', 'url': 'https://www.reddit.com/r/wallstreetbets/comments/l7m45f/putting_my_whole_life_savings_into_dogecoin/', 'created': 1611903963.0}",2021-01-29 07:06:03
56,wallefan01,1611903962,quick question,https://www.reddit.com/r/wallstreetbets/comments/l7m44s/quick_question/,1611903962.0,"{'author': 'wallefan01', 'created_utc': 1611903962, 'title': 'quick question', 'url': 'https://www.reddit.com/r/wallstreetbets/comments/l7m44s/quick_question/', 'created': 1611903962.0}",2021-01-29 07:06:02
