,author,created_utc,title,url,created,d_,created_utc_dt
60,nitelight7,1613282712,First timer buying $GME at the very top,https://i.redd.it/n64vns3zvdh61.gif,1613282712.0,"{'author': 'nitelight7', 'created_utc': 1613282712, 'title': 'First timer buying $GME at the very top', 'url': 'https://i.redd.it/n64vns3zvdh61.gif', 'created': 1613282712.0}",2021-02-14 06:05:12
61,MeowMeowImACowww,1613282678,FB translation from Creole brings back gourd ole memories,https://i.redd.it/rwkmpx56wdh61.png,1613282678.0,"{'author': 'MeowMeowImACowww', 'created_utc': 1613282678, 'title': 'FB translation from Creole brings back gourd ole memories', 'url': 'https://i.redd.it/rwkmpx56wdh61.png', 'created': 1613282678.0}",2021-02-14 06:04:38
62,blakthewhiterapper,1613282565,Oh no no. Say his name,https://i.redd.it/xbcnku1uvdh61.jpg,1613282565.0,"{'author': 'blakthewhiterapper', 'created_utc': 1613282565, 'title': 'Oh no no. Say his name', 'url': 'https://i.redd.it/xbcnku1uvdh61.jpg', 'created': 1613282565.0}",2021-02-14 06:02:45
63,RicoIa,1613282546,GAINZ IN REAL LIFE,https://i.redd.it/wi7hmyyrvdh61.jpg,1613282546.0,"{'author': 'RicoIa', 'created_utc': 1613282546, 'title': 'GAINZ IN REAL LIFE', 'url': 'https://i.redd.it/wi7hmyyrvdh61.jpg', 'created': 1613282546.0}",2021-02-14 06:02:26
64,miamivicemami,1613282511,"ASMR crypto gf// hyperinflation, dogecoin and 6 trillion dollars l8r",https://youtu.be/KaHpf0coblM,1613282511.0,"{'author': 'miamivicemami', 'created_utc': 1613282511, 'title': 'ASMR crypto gf// hyperinflation, dogecoin and 6 trillion dollars l8r', 'url': 'https://youtu.be/KaHpf0coblM', 'created': 1613282511.0}",2021-02-14 06:01:51
65,zombieman001,1613282427,saw this post on linkedin. buy or hold you apes!,https://www.reddit.com/r/wallstreetbets/comments/ljipqv/saw_this_post_on_linkedin_buy_or_hold_you_apes/,1613282427.0,"{'author': 'zombieman001', 'created_utc': 1613282427, 'title': 'saw this post on linkedin. buy or hold you apes!', 'url': 'https://www.reddit.com/r/wallstreetbets/comments/ljipqv/saw_this_post_on_linkedin_buy_or_hold_you_apes/', 'created': 1613282427.0}",2021-02-14 06:00:27
66,Wob_Charlie,1613282367,"Nestle, Hershey Child Slavery Law Suits.",https://www.reddit.com/r/wallstreetbets/comments/ljip56/nestle_hershey_child_slavery_law_suits/,1613282367.0,"{'author': 'Wob_Charlie', 'created_utc': 1613282367, 'title': 'Nestle, Hershey Child Slavery Law Suits.', 'url': 'https://www.reddit.com/r/wallstreetbets/comments/ljip56/nestle_hershey_child_slavery_law_suits/', 'created': 1613282367.0}",2021-02-14 05:59:27
67,Dalalstreetgunda,1613282356,What’s the next big thing on Wall Street,https://www.reddit.com/r/wallstreetbets/comments/ljip1h/whats_the_next_big_thing_on_wall_street/,1613282356.0,"{'author': 'Dalalstreetgunda', 'created_utc': 1613282356, 'title': 'What’s the next big thing on Wall Street', 'url': 'https://www.reddit.com/r/wallstreetbets/comments/ljip1h/whats_the_next_big_thing_on_wall_street/', 'created': 1613282356.0}",2021-02-14 05:59:16
68,CDriv3,1613282327,Chainlink has more than doubled in value in the last month alone. Invest.,https://i.redd.it/tk4g8uk4vdh61.jpg,1613282327.0,"{'author': 'CDriv3', 'created_utc': 1613282327, 'title': 'Chainlink has more than doubled in value in the last month alone. Invest.', 'url': 'https://i.redd.it/tk4g8uk4vdh61.jpg', 'created': 1613282327.0}",2021-02-14 05:58:47
69,Natcapco,1613282265,Option Trading for retards &amp; apes. How not to get your face ripped off.,https://link.medium.com/uOELd8YvRdb,1613282265.0,"{'author': 'Natcapco', 'created_utc': 1613282265, 'title': 'Option Trading for retards &amp; apes. How not to get your face ripped off.', 'url': 'https://link.medium.com/uOELd8YvRdb', 'created': 1613282265.0}",2021-02-14 05:57:45
70,ImEmboss,1613282256,welcoming the topic of free stocks in feb 2021,https://www.reddit.com/r/wallstreetbets/comments/ljioar/welcoming_the_topic_of_free_stocks_in_feb_2021/,1613282256.0,"{'author': 'ImEmboss', 'created_utc': 1613282256, 'title': 'welcoming the topic of free stocks in feb 2021', 'url': 'https://www.reddit.com/r/wallstreetbets/comments/ljioar/welcoming_the_topic_of_free_stocks_in_feb_2021/', 'created': 1613282256.0}",2021-02-14 05:57:36
71,Far-Parsnip-6534,1613282245,Stonks📈📈,https://www.reddit.com/r/wallstreetbets/comments/ljio7k/stonks/,1613282245.0,"{'author': 'Far-Parsnip-6534', 'created_utc': 1613282245, 'title': 'Stonks📈📈', 'url': 'https://www.reddit.com/r/wallstreetbets/comments/ljio7k/stonks/', 'created': 1613282245.0}",2021-02-14 05:57:25
72,Gjodoka,1613282218,Ocugen,https://www.orissapost.com/covaxin-effective-for-9-12-months-no-serious-side-effects/,1613282218.0,"{'author': 'Gjodoka', 'created_utc': 1613282218, 'title': 'Ocugen', 'url': 'https://www.orissapost.com/covaxin-effective-for-9-12-months-no-serious-side-effects/', 'created': 1613282218.0}",2021-02-14 05:56:58
73,laxmolnar,1613282191,"I’m leaving the sub, it’s dumb now",https://www.reddit.com/r/wallstreetbets/comments/ljinro/im_leaving_the_sub_its_dumb_now/,1613282191.0,"{'author': 'laxmolnar', 'created_utc': 1613282191, 'title': 'I’m leaving the sub, it’s dumb now', 'url': 'https://www.reddit.com/r/wallstreetbets/comments/ljinro/im_leaving_the_sub_its_dumb_now/', 'created': 1613282191.0}",2021-02-14 05:56:31
74,Sell-Mission,1613282145,Buy High - Sell Low,https://imgflip.com/i/4xz46l,1613282145.0,"{'author': 'Sell-Mission', 'created_utc': 1613282145, 'title': 'Buy High - Sell Low', 'url': 'https://imgflip.com/i/4xz46l', 'created': 1613282145.0}",2021-02-14 05:55:45
75,ImEmboss,1613282122,helping with free stock,https://www.reddit.com/r/wallstreetbets/comments/ljimwi/helping_with_free_stock/,1613282122.0,"{'author': 'ImEmboss', 'created_utc': 1613282122, 'title': 'helping with free stock', 'url': 'https://www.reddit.com/r/wallstreetbets/comments/ljimwi/helping_with_free_stock/', 'created': 1613282122.0}",2021-02-14 05:55:22
76,DerriSsays,1613282108,What's this all about? Seems to be there are people infiltrating WSB lol. Old news. 🖐️💎🦍🖍️🚀🖕,https://i.redd.it/ekub7c1hudh61.png,1613282108.0,"{'author': 'DerriSsays', 'created_utc': 1613282108, 'title': ""What's this all about? Seems to be there are people infiltrating WSB lol. Old news. 🖐️💎🦍🖍️🚀🖕"", 'url': 'https://i.redd.it/ekub7c1hudh61.png', 'created': 1613282108.0}",2021-02-14 05:55:08
77,Said_It_in_Reddit,1613282097,I'm interested in buying bit coin to hold. What's the best way to do that?,https://www.reddit.com/r/wallstreetbets/comments/ljimoj/im_interested_in_buying_bit_coin_to_hold_whats/,1613282097.0,"{'author': 'Said_It_in_Reddit', 'created_utc': 1613282097, 'title': ""I'm interested in buying bit coin to hold. What's the best way to do that?"", 'url': 'https://www.reddit.com/r/wallstreetbets/comments/ljimoj/im_interested_in_buying_bit_coin_to_hold_whats/', 'created': 1613282097.0}",2021-02-14 05:54:57
78,ImEmboss,1613282075,Getting free stock working 2/14/21,https://www.reddit.com/r/wallstreetbets/comments/ljimim/getting_free_stock_working_21421/,1613282075.0,"{'author': 'ImEmboss', 'created_utc': 1613282075, 'title': 'Getting free stock working 2/14/21', 'url': 'https://www.reddit.com/r/wallstreetbets/comments/ljimim/getting_free_stock_working_21421/', 'created': 1613282075.0}",2021-02-14 05:54:35
79,Thelioninmegrrr,1613282040,Gain,https://www.reddit.com/r/wallstreetbets/comments/ljim8q/gain/,1613282040.0,"{'author': 'Thelioninmegrrr', 'created_utc': 1613282040, 'title': 'Gain', 'url': 'https://www.reddit.com/r/wallstreetbets/comments/ljim8q/gain/', 'created': 1613282040.0}",2021-02-14 05:54:00
80,sjdusieie,1613282031,First look at Tesla’s new semitrucks,https://vm.tiktok.com/ZMe8qSkmX/,1613282031.0,"{'author': 'sjdusieie', 'created_utc': 1613282031, 'title': 'First look at Tesla’s new semitrucks', 'url': 'https://vm.tiktok.com/ZMe8qSkmX/', 'created': 1613282031.0}",2021-02-14 05:53:51
81,LegioXIII_Gemina,1613282021,"~400K GME Options Loss Pr0n, Thoughts and Introspection. I Hope This Post Makes You Feel Better About Your Situation.",https://www.reddit.com/r/wallstreetbets/comments/ljim3o/400k_gme_options_loss_pr0n_thoughts_and/,1613282021.0,"{'author': 'LegioXIII_Gemina', 'created_utc': 1613282021, 'title': '~400K GME Options Loss Pr0n, Thoughts and Introspection. I Hope This Post Makes You Feel Better About Your Situation.', 'url': 'https://www.reddit.com/r/wallstreetbets/comments/ljim3o/400k_gme_options_loss_pr0n_thoughts_and/', 'created': 1613282021.0}",2021-02-14 05:53:41
82,Freedom503,1613281996,If you guys join the party we all can get tendies and nice short squeese in CCIV . Short 340%,https://i.redd.it/vnt1fa65udh61.jpg,1613281996.0,"{'author': 'Freedom503', 'created_utc': 1613281996, 'title': 'If you guys join the party we all can get tendies and nice short squeese in CCIV . Short 340%', 'url': 'https://i.redd.it/vnt1fa65udh61.jpg', 'created': 1613281996.0}",2021-02-14 05:53:16
83,fleebjuice69420,1613281994,Ok I think Wall Street is tryna fuck us back. Every stock that’s hot on here flops HARD a day after it trends. Do you guys think the Big Boys might be colluding to short stocks that trend here? Maybe collectively ruining a stock we like to bankrupt us to teach us a lesson?,https://www.reddit.com/r/wallstreetbets/comments/ljilwf/ok_i_think_wall_street_is_tryna_fuck_us_back/,1613281994.0,"{'author': 'fleebjuice69420', 'created_utc': 1613281994, 'title': 'Ok I think Wall Street is tryna fuck us back. Every stock that’s hot on here flops HARD a day after it trends. Do you guys think the Big Boys might be colluding to short stocks that trend here? Maybe collectively ruining a stock we like to bankrupt us to teach us a lesson?', 'url': 'https://www.reddit.com/r/wallstreetbets/comments/ljilwf/ok_i_think_wall_street_is_tryna_fuck_us_back/', 'created': 1613281994.0}",2021-02-14 05:53:14
84,THE_GINAMOS,1613281973,RECAF - Recon Africa a better choice,https://www.reddit.com/r/wallstreetbets/comments/ljilpz/recaf_recon_africa_a_better_choice/,1613281973.0,"{'author': 'THE_GINAMOS', 'created_utc': 1613281973, 'title': 'RECAF - Recon Africa a better choice', 'url': 'https://www.reddit.com/r/wallstreetbets/comments/ljilpz/recaf_recon_africa_a_better_choice/', 'created': 1613281973.0}",2021-02-14 05:52:53
85,DripSet312,1613281963,"Long/Short term GAINZZZ 15c 4/1 2,055 @13",https://i.redd.it/bsuww7m1udh61.jpg,1613281963.0,"{'author': 'DripSet312', 'created_utc': 1613281963, 'title': 'Long/Short term GAINZZZ 15c 4/1 2,055 @13', 'url': 'https://i.redd.it/bsuww7m1udh61.jpg', 'created': 1613281963.0}",2021-02-14 05:52:43
86,Thelioninmegrrr,1613281934,What the next gain so I don’t miss it like sndl,https://www.reddit.com/r/wallstreetbets/comments/ljileu/what_the_next_gain_so_i_dont_miss_it_like_sndl/,1613281934.0,"{'author': 'Thelioninmegrrr', 'created_utc': 1613281934, 'title': 'What the next gain so I don’t miss it like sndl', 'url': 'https://www.reddit.com/r/wallstreetbets/comments/ljileu/what_the_next_gain_so_i_dont_miss_it_like_sndl/', 'created': 1613281934.0}",2021-02-14 05:52:14
87,grizzmysta,1613281904,👀,https://www.reddit.com/r/wallstreetbets/comments/ljil5a/_/,1613281904.0,"{'author': 'grizzmysta', 'created_utc': 1613281904, 'title': '👀', 'url': 'https://www.reddit.com/r/wallstreetbets/comments/ljil5a/_/', 'created': 1613281904.0}",2021-02-14 05:51:44
88,Really-11,1613281871,Still holding???,https://www.reddit.com/r/wallstreetbets/comments/ljiksh/still_holding/,1613281871.0,"{'author': 'Really-11', 'created_utc': 1613281871, 'title': 'Still holding???', 'url': 'https://www.reddit.com/r/wallstreetbets/comments/ljiksh/still_holding/', 'created': 1613281871.0}",2021-02-14 05:51:11
89,UdoVaroo,1613281862,Environmental or cannabis ETF?,https://www.reddit.com/r/wallstreetbets/comments/ljikoa/environmental_or_cannabis_etf/,1613281862.0,"{'author': 'UdoVaroo', 'created_utc': 1613281862, 'title': 'Environmental or cannabis ETF?', 'url': 'https://www.reddit.com/r/wallstreetbets/comments/ljikoa/environmental_or_cannabis_etf/', 'created': 1613281862.0}",2021-02-14 05:51:02
90,oofman0-0,1613281839,My dear APHRIA,https://i.redd.it/iamdufdotdh61.jpg,1613281839.0,"{'author': 'oofman0-0', 'created_utc': 1613281839, 'title': 'My dear APHRIA', 'url': 'https://i.redd.it/iamdufdotdh61.jpg', 'created': 1613281839.0}",2021-02-14 05:50:39
91,Crazylady36,1613281834,Time to move on..,https://www.reddit.com/r/wallstreetbets/comments/ljikb0/time_to_move_on/,1613281834.0,"{'author': 'Crazylady36', 'created_utc': 1613281834, 'title': 'Time to move on..', 'url': 'https://www.reddit.com/r/wallstreetbets/comments/ljikb0/time_to_move_on/', 'created': 1613281834.0}",2021-02-14 05:50:34
92,MaleficentLaw8,1613281779,Does adding digi assets to balance sheet defend against shorts?,https://www.reddit.com/r/wallstreetbets/comments/ljijpt/does_adding_digi_assets_to_balance_sheet_defend/,1613281779.0,"{'author': 'MaleficentLaw8', 'created_utc': 1613281779, 'title': 'Does adding digi assets to balance sheet defend against shorts?', 'url': 'https://www.reddit.com/r/wallstreetbets/comments/ljijpt/does_adding_digi_assets_to_balance_sheet_defend/', 'created': 1613281779.0}",2021-02-14 05:49:39
93,AlejandroPesoa,1613281769,What do you think of raw materials?,https://www.reddit.com/r/wallstreetbets/comments/ljijmw/what_do_you_think_of_raw_materials/,1613281769.0,"{'author': 'AlejandroPesoa', 'created_utc': 1613281769, 'title': 'What do you think of raw materials?', 'url': 'https://www.reddit.com/r/wallstreetbets/comments/ljijmw/what_do_you_think_of_raw_materials/', 'created': 1613281769.0}",2021-02-14 05:49:29
94,treefellonme,1613281686,"Saw a post asking about orderflow, here's some orderflow data from Financial Times",https://www.reddit.com/gallery/ljiiyh,1613281686.0,"{'author': 'treefellonme', 'created_utc': 1613281686, 'title': ""Saw a post asking about orderflow, here's some orderflow data from Financial Times"", 'url': 'https://www.reddit.com/gallery/ljiiyh', 'created': 1613281686.0}",2021-02-14 05:48:06
95,Moneymoney2021,1613281624,Koo App’s impact on Twitter?,https://www.reddit.com/r/wallstreetbets/comments/ljiifs/koo_apps_impact_on_twitter/,1613281624.0,"{'author': 'Moneymoney2021', 'created_utc': 1613281624, 'title': 'Koo App’s impact on Twitter?', 'url': 'https://www.reddit.com/r/wallstreetbets/comments/ljiifs/koo_apps_impact_on_twitter/', 'created': 1613281624.0}",2021-02-14 05:47:04
96,MuryBoy,1613281603,(BCH) 🚀🚀🚀 Do not fall asleep let's break it ...$700 4 days ago was $500...,https://www.reddit.com/r/wallstreetbets/comments/ljii97/bch_do_not_fall_asleep_lets_break_it_700_4_days/,1613281603.0,"{'author': 'MuryBoy', 'created_utc': 1613281603, 'title': ""(BCH) 🚀🚀🚀 Do not fall asleep let's break it ...$700 4 days ago was $500..."", 'url': 'https://www.reddit.com/r/wallstreetbets/comments/ljii97/bch_do_not_fall_asleep_lets_break_it_700_4_days/', 'created': 1613281603.0}",2021-02-14 05:46:43
97,h8nshorts,1613281592,Accumulate APHA,https://www.reddit.com/r/wallstreetbets/comments/ljii5y/accumulate_apha/,1613281592.0,"{'author': 'h8nshorts', 'created_utc': 1613281592, 'title': 'Accumulate APHA', 'url': 'https://www.reddit.com/r/wallstreetbets/comments/ljii5y/accumulate_apha/', 'created': 1613281592.0}",2021-02-14 05:46:32
98,oofman0-0,1613281587,My weed stocks,https://i.redd.it/zs7iz0exsdh61.jpg,1613281587.0,"{'author': 'oofman0-0', 'created_utc': 1613281587, 'title': 'My weed stocks', 'url': 'https://i.redd.it/zs7iz0exsdh61.jpg', 'created': 1613281587.0}",2021-02-14 05:46:27
99,ThemightySamson20-29,1613281571,Starlink the future of the world,https://www.reddit.com/r/wallstreetbets/comments/ljii14/starlink_the_future_of_the_world/,1613281571.0,"{'author': 'ThemightySamson20-29', 'created_utc': 1613281571, 'title': 'Starlink the future of the world', 'url': 'https://www.reddit.com/r/wallstreetbets/comments/ljii14/starlink_the_future_of_the_world/', 'created': 1613281571.0}",2021-02-14 05:46:11
