,author,created_utc,title,url,created,d_,created_utc_dt
0,bdd1974,1611863475,How is this not market manipulation and criminal?,https://i.redd.it/vpa6fx10o4e61.png,1611863475.0,"{'author': 'bdd1974', 'created_utc': 1611863475, 'title': 'How is this not market manipulation and criminal?', 'url': 'https://i.redd.it/vpa6fx10o4e61.png', 'created': 1611863475.0}",2021-01-28 19:51:15
1,recreationalchemstry,1611863475,GME and the rest are back on Webull,https://www.reddit.com/r/wallstreetbets/comments/l76r24/gme_and_the_rest_are_back_on_webull/,1611863475.0,"{'author': 'recreationalchemstry', 'created_utc': 1611863475, 'title': 'GME and the rest are back on Webull', 'url': 'https://www.reddit.com/r/wallstreetbets/comments/l76r24/gme_and_the_rest_are_back_on_webull/', 'created': 1611863475.0}",2021-01-28 19:51:15
2,o-_i_-o,1611863475,CLASS ACTION AGAINST ROBINHOOD,https://www.reddit.com/r/wallstreetbets/comments/l76r21/class_action_against_robinhood/,1611863475.0,"{'author': 'o-_i_-o', 'created_utc': 1611863475, 'title': 'CLASS ACTION AGAINST ROBINHOOD', 'url': 'https://www.reddit.com/r/wallstreetbets/comments/l76r21/class_action_against_robinhood/', 'created': 1611863475.0}",2021-01-28 19:51:15
3,JinnPhD,1611863475,We need to discuss Melvins actions during restriction,https://www.reddit.com/r/wallstreetbets/comments/l76r1w/we_need_to_discuss_melvins_actions_during/,1611863475.0,"{'author': 'JinnPhD', 'created_utc': 1611863475, 'title': 'We need to discuss Melvins actions during restriction', 'url': 'https://www.reddit.com/r/wallstreetbets/comments/l76r1w/we_need_to_discuss_melvins_actions_during/', 'created': 1611863475.0}",2021-01-28 19:51:15
4,[deleted],1611863474,BROKE BOYS OF WSB - DO NOT STOP THE DOGE RALLY,https://www.reddit.com/r/wallstreetbets/comments/l76r1r/broke_boys_of_wsb_do_not_stop_the_doge_rally/,1611863474.0,"{'author': '[deleted]', 'created_utc': 1611863474, 'title': 'BROKE BOYS OF WSB - DO NOT STOP THE DOGE RALLY', 'url': 'https://www.reddit.com/r/wallstreetbets/comments/l76r1r/broke_boys_of_wsb_do_not_stop_the_doge_rally/', 'created': 1611863474.0}",2021-01-28 19:51:14
5,Impossible-Bird9474,1611863474,WSB Chairman on Twitter,https://twitter.com/wsbchairman/status/1354851905751707655?s=21,1611863474.0,"{'author': 'Impossible-Bird9474', 'created_utc': 1611863474, 'title': 'WSB Chairman on Twitter', 'url': 'https://twitter.com/wsbchairman/status/1354851905751707655?s=21', 'created': 1611863474.0}",2021-01-28 19:51:14
6,Particular-Resort-26,1611863474,NAKD,https://www.reddit.com/r/wallstreetbets/comments/l76r1i/nakd/,1611863474.0,"{'author': 'Particular-Resort-26', 'created_utc': 1611863474, 'title': 'NAKD', 'url': 'https://www.reddit.com/r/wallstreetbets/comments/l76r1i/nakd/', 'created': 1611863474.0}",2021-01-28 19:51:14
7,timopod5,1611863474,TD Ameritrade !!!,https://www.reddit.com/r/wallstreetbets/comments/l76r1c/td_ameritrade/,1611863474.0,"{'author': 'timopod5', 'created_utc': 1611863474, 'title': 'TD Ameritrade !!!', 'url': 'https://www.reddit.com/r/wallstreetbets/comments/l76r1c/td_ameritrade/', 'created': 1611863474.0}",2021-01-28 19:51:14
8,LetsGetEm3462,1611863474,Can we do the same with UWMC. Really need to pay my student loan :),https://www.reddit.com/r/wallstreetbets/comments/l76r13/can_we_do_the_same_with_uwmc_really_need_to_pay/,1611863474.0,"{'author': 'LetsGetEm3462', 'created_utc': 1611863474, 'title': 'Can we do the same with UWMC. Really need to pay my student loan :)', 'url': 'https://www.reddit.com/r/wallstreetbets/comments/l76r13/can_we_do_the_same_with_uwmc_really_need_to_pay/', 'created': 1611863474.0}",2021-01-28 19:51:14
9,[deleted],1611863473,AOC going live tonight to talk about GME 🚀🚀,https://i.redd.it/yef0kta5o4e61.jpg,1611863473.0,"{'author': '[deleted]', 'created_utc': 1611863473, 'title': 'AOC going live tonight to talk about GME 🚀🚀', 'url': 'https://i.redd.it/yef0kta5o4e61.jpg', 'created': 1611863473.0}",2021-01-28 19:51:13
10,pranik_pant,1611863473,WEBULL SELLING GME BOYS BUY AT THE DIP 🚀🚀🚀 THE MOON IS WAITING 💎🤝🚀,https://i.redd.it/quo3yx75o4e61.jpg,1611863473.0,"{'author': 'pranik_pant', 'created_utc': 1611863473, 'title': 'WEBULL SELLING GME BOYS BUY AT THE DIP 🚀🚀🚀 THE MOON IS WAITING 💎🤝🚀', 'url': 'https://i.redd.it/quo3yx75o4e61.jpg', 'created': 1611863473.0}",2021-01-28 19:51:13
11,natas333x2,1611863473,I don't think Stash and Apex Holdings should be able to fly under the radar.,https://i.redd.it/w4t0fw95o4e61.jpg,1611863473.0,"{'author': 'natas333x2', 'created_utc': 1611863473, 'title': ""I don't think Stash and Apex Holdings should be able to fly under the radar."", 'url': 'https://i.redd.it/w4t0fw95o4e61.jpg', 'created': 1611863473.0}",2021-01-28 19:51:13
12,Dogeto2themoonboyz,1611863473,Dogecointothemoonboyzzz,https://www.reddit.com/r/wallstreetbets/comments/l76r0m/dogecointothemoonboyzzz/,1611863473.0,"{'author': 'Dogeto2themoonboyz', 'created_utc': 1611863473, 'title': 'Dogecointothemoonboyzzz', 'url': 'https://www.reddit.com/r/wallstreetbets/comments/l76r0m/dogecointothemoonboyzzz/', 'created': 1611863473.0}",2021-01-28 19:51:13
13,Responsible_Swim_862,1611863471,Impostor 😠,https://i.redd.it/0csyt005o4e61.jpg,1611863471.0,"{'author': 'Responsible_Swim_862', 'created_utc': 1611863471, 'title': 'Impostor 😠', 'url': 'https://i.redd.it/0csyt005o4e61.jpg', 'created': 1611863471.0}",2021-01-28 19:51:11
14,miltz74,1611863469,Whts going on with GBR !?!?,https://www.reddit.com/r/wallstreetbets/comments/l76qz7/whts_going_on_with_gbr/,1611863469.0,"{'author': 'miltz74', 'created_utc': 1611863469, 'title': 'Whts going on with GBR !?!?', 'url': 'https://www.reddit.com/r/wallstreetbets/comments/l76qz7/whts_going_on_with_gbr/', 'created': 1611863469.0}",2021-01-28 19:51:09
15,georgekaragian,1611863469,List of **** like Robinhood,https://www.reddit.com/r/wallstreetbets/comments/l76qz4/list_of_like_robinhood/,1611863469.0,"{'author': 'georgekaragian', 'created_utc': 1611863469, 'title': 'List of **** like Robinhood', 'url': 'https://www.reddit.com/r/wallstreetbets/comments/l76qz4/list_of_like_robinhood/', 'created': 1611863469.0}",2021-01-28 19:51:09
16,Ozone021,1611863468,"THEY SHIT THEIR FUCKING PANTS , LADS",https://i.redd.it/01h98ws2o4e61.jpg,1611863468.0,"{'author': 'Ozone021', 'created_utc': 1611863468, 'title': 'THEY SHIT THEIR FUCKING PANTS , LADS', 'url': 'https://i.redd.it/01h98ws2o4e61.jpg', 'created': 1611863468.0}",2021-01-28 19:51:08
17,Gremlin-yo-algo,1611863468,"HODL Diamond Hands, You magnificent retards!",https://i.redd.it/yb0ynjj4o4e61.jpg,1611863468.0,"{'author': 'Gremlin-yo-algo', 'created_utc': 1611863468, 'title': 'HODL Diamond Hands, You magnificent retards!', 'url': 'https://i.redd.it/yb0ynjj4o4e61.jpg', 'created': 1611863468.0}",2021-01-28 19:51:08
18,Red_Icnivad,1611863468,Why wasn't trading automatically halted on GME when it plunged 75% down today? Shouldn't that be automatic?,https://i.redd.it/t7i3b844o4e61.png,1611863468.0,"{'author': 'Red_Icnivad', 'created_utc': 1611863468, 'title': ""Why wasn't trading automatically halted on GME when it plunged 75% down today? Shouldn't that be automatic?"", 'url': 'https://i.redd.it/t7i3b844o4e61.png', 'created': 1611863468.0}",2021-01-28 19:51:08
19,brokeharvard,1611863468,WSJ Already Reporting on WSB’s SLV Short Squeeze,https://www.wsj.com/articles/silver-surges-as-gamestop-day-traders-move-into-other-assets-11611848703,1611863468.0,"{'author': 'brokeharvard', 'created_utc': 1611863468, 'title': 'WSJ Already Reporting on WSB’s SLV Short Squeeze', 'url': 'https://www.wsj.com/articles/silver-surges-as-gamestop-day-traders-move-into-other-assets-11611848703', 'created': 1611863468.0}",2021-01-28 19:51:08
20,jd3131,1611863467,Which trading platform DIDN’T interfere with the free markets today?,https://www.reddit.com/r/wallstreetbets/comments/l76qxt/which_trading_platform_didnt_interfere_with_the/,1611863467.0,"{'author': 'jd3131', 'created_utc': 1611863467, 'title': 'Which trading platform DIDN’T interfere with the free markets today?', 'url': 'https://www.reddit.com/r/wallstreetbets/comments/l76qxt/which_trading_platform_didnt_interfere_with_the/', 'created': 1611863467.0}",2021-01-28 19:51:07
21,[deleted],1611863467,"Fuck it, I’m in",https://www.reddit.com/r/wallstreetbets/comments/l76qxp/fuck_it_im_in/,1611863467.0,"{'author': '[deleted]', 'created_utc': 1611863467, 'title': 'Fuck it, I’m in', 'url': 'https://www.reddit.com/r/wallstreetbets/comments/l76qxp/fuck_it_im_in/', 'created': 1611863467.0}",2021-01-28 19:51:07
22,AceEagles,1611863467,"Doing my part 🚀🚀 Holding GME from Spain to the moon 🌙 🚀🚀🚀🚀🛸🛸 (it aint much, but its honest work)",https://i.redd.it/q1wn41i4o4e61.jpg,1611863467.0,"{'author': 'AceEagles', 'created_utc': 1611863467, 'title': 'Doing my part 🚀🚀 Holding GME from Spain to the moon 🌙 🚀🚀🚀🚀🛸🛸 (it aint much, but its honest work)', 'url': 'https://i.redd.it/q1wn41i4o4e61.jpg', 'created': 1611863467.0}",2021-01-28 19:51:07
23,Raufi1983,1611863466,Melvin is also big short at Evotec (german biotech) and Varta (micro battery for apple earpods),https://www.bundesanzeiger.de/pub/en/nlp?5,1611863466.0,"{'author': 'Raufi1983', 'created_utc': 1611863466, 'title': 'Melvin is also big short at Evotec (german biotech) and Varta (micro battery for apple earpods)', 'url': 'https://www.bundesanzeiger.de/pub/en/nlp?5', 'created': 1611863466.0}",2021-01-28 19:51:06
24,Killerbeezs,1611863466,Go Up FOREVER They are scared,https://v.redd.it/x5102mj1o4e61,1611863466.0,"{'author': 'Killerbeezs', 'created_utc': 1611863466, 'title': 'Go Up FOREVER They are scared', 'url': 'https://v.redd.it/x5102mj1o4e61', 'created': 1611863466.0}",2021-01-28 19:51:06
25,guyy321,1611863466,"Webull just opened trading back up for GME, AMC, and KOSS",https://i.redd.it/50bmeia1o4e61.png,1611863466.0,"{'author': 'guyy321', 'created_utc': 1611863466, 'title': 'Webull just opened trading back up for GME, AMC, and KOSS', 'url': 'https://i.redd.it/50bmeia1o4e61.png', 'created': 1611863466.0}",2021-01-28 19:51:06
26,Rhsucks,1611863465,CEO: Webull just opened all stock to buy!!??,https://www.reddit.com/r/wallstreetbets/comments/l76qwb/ceo_webull_just_opened_all_stock_to_buy/,1611863465.0,"{'author': 'Rhsucks', 'created_utc': 1611863465, 'title': 'CEO: Webull just opened all stock to buy!!??', 'url': 'https://www.reddit.com/r/wallstreetbets/comments/l76qwb/ceo_webull_just_opened_all_stock_to_buy/', 'created': 1611863465.0}",2021-01-28 19:51:05
27,Conscious-Sea-7642,1611863465,What happening with GBR ?!!!,https://www.reddit.com/r/wallstreetbets/comments/l76qw8/what_happening_with_gbr/,1611863465.0,"{'author': 'Conscious-Sea-7642', 'created_utc': 1611863465, 'title': 'What happening with GBR ?!!!', 'url': 'https://www.reddit.com/r/wallstreetbets/comments/l76qw8/what_happening_with_gbr/', 'created': 1611863465.0}",2021-01-28 19:51:05
28,ChicksAreForFags,1611863465,"Bought 10 shares GME in my HSA, only place I can buy.",https://www.reddit.com/r/wallstreetbets/comments/l76qw2/bought_10_shares_gme_in_my_hsa_only_place_i_can/,1611863465.0,"{'author': 'ChicksAreForFags', 'created_utc': 1611863465, 'title': 'Bought 10 shares GME in my HSA, only place I can buy.', 'url': 'https://www.reddit.com/r/wallstreetbets/comments/l76qw2/bought_10_shares_gme_in_my_hsa_only_place_i_can/', 'created': 1611863465.0}",2021-01-28 19:51:05
29,optimal_carp,1611863464,Whats the Play for the 29th?,https://www.reddit.com/r/wallstreetbets/comments/l76qve/whats_the_play_for_the_29th/,1611863464.0,"{'author': 'optimal_carp', 'created_utc': 1611863464, 'title': 'Whats the Play for the 29th?', 'url': 'https://www.reddit.com/r/wallstreetbets/comments/l76qve/whats_the_play_for_the_29th/', 'created': 1611863464.0}",2021-01-28 19:51:04
30,nostringsnostrings,1611863464,Trading Halted For $AMC!!!,https://i.redd.it/z1elwbk1o4e61.png,1611863464.0,"{'author': 'nostringsnostrings', 'created_utc': 1611863464, 'title': 'Trading Halted For $AMC!!!', 'url': 'https://i.redd.it/z1elwbk1o4e61.png', 'created': 1611863464.0}",2021-01-28 19:51:04
31,christodanto,1611863464,My motivation is SKY HIGH,https://www.reddit.com/r/wallstreetbets/comments/l76qv9/my_motivation_is_sky_high/,1611863464.0,"{'author': 'christodanto', 'created_utc': 1611863464, 'title': 'My motivation is SKY HIGH', 'url': 'https://www.reddit.com/r/wallstreetbets/comments/l76qv9/my_motivation_is_sky_high/', 'created': 1611863464.0}",2021-01-28 19:51:04
32,MannyArce,1611863464,The lawsuits will keep coming!,https://i.redd.it/n3d316exn4e61.jpg,1611863464.0,"{'author': 'MannyArce', 'created_utc': 1611863464, 'title': 'The lawsuits will keep coming!', 'url': 'https://i.redd.it/n3d316exn4e61.jpg', 'created': 1611863464.0}",2021-01-28 19:51:04
33,comradebullworm,1611863464,AMC Delisted on Schwab?,https://www.reddit.com/r/wallstreetbets/comments/l76qv7/amc_delisted_on_schwab/,1611863464.0,"{'author': 'comradebullworm', 'created_utc': 1611863464, 'title': 'AMC Delisted on Schwab?', 'url': 'https://www.reddit.com/r/wallstreetbets/comments/l76qv7/amc_delisted_on_schwab/', 'created': 1611863464.0}",2021-01-28 19:51:04
34,907_ColdStone_Trader,1611863464,Eat the rich!! Go get them AOC!!,https://www.reddit.com/gallery/l76qv3,1611863464.0,"{'author': '907_ColdStone_Trader', 'created_utc': 1611863464, 'title': 'Eat the rich!! Go get them AOC!!', 'url': 'https://www.reddit.com/gallery/l76qv3', 'created': 1611863464.0}",2021-01-28 19:51:04
35,zeezor,1611863463,This retard sold my 0.11 GME shares for $2605/share somehow,https://i.imgur.com/89zEjoq.png,1611863463.0,"{'author': 'zeezor', 'created_utc': 1611863463, 'title': 'This retard sold my 0.11 GME shares for $2605/share somehow', 'url': 'https://i.imgur.com/89zEjoq.png', 'created': 1611863463.0}",2021-01-28 19:51:03
36,Lockhzac,1611863463,WSB waking up this morning,https://v.redd.it/95cxepiyn4e61,1611863463.0,"{'author': 'Lockhzac', 'created_utc': 1611863463, 'title': 'WSB waking up this morning', 'url': 'https://v.redd.it/95cxepiyn4e61', 'created': 1611863463.0}",2021-01-28 19:51:03
37,[deleted],1611863463,sTOCK DOC TALKING STOKK ON GAMESTOP,https://streamable.com/se5vuz,1611863463.0,"{'author': '[deleted]', 'created_utc': 1611863463, 'title': 'sTOCK DOC TALKING STOKK ON GAMESTOP', 'url': 'https://streamable.com/se5vuz', 'created': 1611863463.0}",2021-01-28 19:51:03
38,TrueBeam44,1611863463,"Rivers, Banks, and Humanity’s Fate",https://www.reddit.com/r/wallstreetbets/comments/l76quq/rivers_banks_and_humanitys_fate/,1611863463.0,"{'author': 'TrueBeam44', 'created_utc': 1611863463, 'title': 'Rivers, Banks, and Humanity’s Fate', 'url': 'https://www.reddit.com/r/wallstreetbets/comments/l76quq/rivers_banks_and_humanitys_fate/', 'created': 1611863463.0}",2021-01-28 19:51:03
39,Farhoodlum,1611863462,"‼️MY BROTHERS, HEAR ME OUT‼️WE ARE IN THE MIDDLE OF AN ALL OUT GALACTIC WAR AS WE LEAVE THE MILKY WAY 🚀🚀 PAPER HAND PANSIES DO NOT READ. I NEED ALL 💎🤲 ON DECK",https://www.reddit.com/r/wallstreetbets/comments/l76qul/my_brothers_hear_me_outwe_are_in_the_middle_of_an/,1611863462.0,"{'author': 'Farhoodlum', 'created_utc': 1611863462, 'title': '‼️MY BROTHERS, HEAR ME OUT‼️WE ARE IN THE MIDDLE OF AN ALL OUT GALACTIC WAR AS WE LEAVE THE MILKY WAY 🚀🚀 PAPER HAND PANSIES DO NOT READ. I NEED ALL 💎🤲 ON DECK', 'url': 'https://www.reddit.com/r/wallstreetbets/comments/l76qul/my_brothers_hear_me_outwe_are_in_the_middle_of_an/', 'created': 1611863462.0}",2021-01-28 19:51:02
40,Chrisclc13,1611863462,GME about to 🚀🚀🚀🚀 again,https://www.reddit.com/r/wallstreetbets/comments/l76qui/gme_about_to_again/,1611863462.0,"{'author': 'Chrisclc13', 'created_utc': 1611863462, 'title': 'GME about to 🚀🚀🚀🚀 again', 'url': 'https://www.reddit.com/r/wallstreetbets/comments/l76qui/gme_about_to_again/', 'created': 1611863462.0}",2021-01-28 19:51:02
41,GreedyFox,1611863462,M1 Finance is even joining Robinhood in not allowing trades.,https://i.redd.it/ltxzg714o4e61.jpg,1611863462.0,"{'author': 'GreedyFox', 'created_utc': 1611863462, 'title': 'M1 Finance is even joining Robinhood in not allowing trades.', 'url': 'https://i.redd.it/ltxzg714o4e61.jpg', 'created': 1611863462.0}",2021-01-28 19:51:02
42,HomeSpunBasher3,1611863462,"Wake the Fuck Up Retards, we got a hedge fund to burn",https://i.redd.it/aacpjvazn4e61.jpg,1611863462.0,"{'author': 'HomeSpunBasher3', 'created_utc': 1611863462, 'title': 'Wake the Fuck Up Retards, we got a hedge fund to burn', 'url': 'https://i.redd.it/aacpjvazn4e61.jpg', 'created': 1611863462.0}",2021-01-28 19:51:02
43,Cash-Objective,1611863462,AMC,https://www.reddit.com/r/wallstreetbets/comments/l76qu1/amc/,1611863462.0,"{'author': 'Cash-Objective', 'created_utc': 1611863462, 'title': 'AMC', 'url': 'https://www.reddit.com/r/wallstreetbets/comments/l76qu1/amc/', 'created': 1611863462.0}",2021-01-28 19:51:02
44,LethargicWhale,1611863461,GME back to being available to Buy on Public if anyone’s looking to switch from Robinhood,https://i.imgur.com/oYpRkz6.jpg,1611863461.0,"{'author': 'LethargicWhale', 'created_utc': 1611863461, 'title': 'GME back to being available to Buy on Public if anyone’s looking to switch from Robinhood', 'url': 'https://i.imgur.com/oYpRkz6.jpg', 'created': 1611863461.0}",2021-01-28 19:51:01
45,seanoic,1611863461,Robinhood is actually forcing people to sell their stocks LOL,https://www.reddit.com/r/wallstreetbets/comments/l76qtp/robinhood_is_actually_forcing_people_to_sell/,1611863461.0,"{'author': 'seanoic', 'created_utc': 1611863461, 'title': 'Robinhood is actually forcing people to sell their stocks LOL', 'url': 'https://www.reddit.com/r/wallstreetbets/comments/l76qtp/robinhood_is_actually_forcing_people_to_sell/', 'created': 1611863461.0}",2021-01-28 19:51:01
46,kkww87,1611863461,Still holding from Singapore. Also being blocked from buying more this is fucked up.,https://i.redd.it/8ctaydw3o4e61.jpg,1611863461.0,"{'author': 'kkww87', 'created_utc': 1611863461, 'title': 'Still holding from Singapore. Also being blocked from buying more this is fucked up.', 'url': 'https://i.redd.it/8ctaydw3o4e61.jpg', 'created': 1611863461.0}",2021-01-28 19:51:01
47,KaizenOnward,1611863460,"Webull is now supporting $GME, $AMC, and $KOSS. The restrictions are gone! Upvote so that everyone can see!",https://i.redd.it/x3s4wop3o4e61.jpg,1611863460.0,"{'author': 'KaizenOnward', 'created_utc': 1611863460, 'title': 'Webull is now supporting $GME, $AMC, and $KOSS. The restrictions are gone! Upvote so that everyone can see!', 'url': 'https://i.redd.it/x3s4wop3o4e61.jpg', 'created': 1611863460.0}",2021-01-28 19:51:00
48,AMZNGenius-Detective,1611863460,What happened at 2:05-2:10pm ET?,https://www.reddit.com/gallery/l76qt7,1611863460.0,"{'author': 'AMZNGenius-Detective', 'created_utc': 1611863460, 'title': 'What happened at 2:05-2:10pm ET?', 'url': 'https://www.reddit.com/gallery/l76qt7', 'created': 1611863460.0}",2021-01-28 19:51:00
49,[deleted],1611863460,Help out the most retarded retard,https://www.reddit.com/r/wallstreetbets/comments/l76qt6/help_out_the_most_retarded_retard/,1611863460.0,"{'author': '[deleted]', 'created_utc': 1611863460, 'title': 'Help out the most retarded retard', 'url': 'https://www.reddit.com/r/wallstreetbets/comments/l76qt6/help_out_the_most_retarded_retard/', 'created': 1611863460.0}",2021-01-28 19:51:00
50,RemakeGOT_Season8,1611863460,TendieTale$ - Chronicles of January,https://youtube.com/watch?v=x0-0YCA5aBs&amp;feature=share,1611863460.0,"{'author': 'RemakeGOT_Season8', 'created_utc': 1611863460, 'title': 'TendieTale$ - Chronicles of January', 'url': 'https://youtube.com/watch?v=x0-0YCA5aBs&amp;feature=share', 'created': 1611863460.0}",2021-01-28 19:51:00
51,Iostsignal,1611863460,LETS BRING SILVER BACK!,https://www.reddit.com/r/wallstreetbets/comments/l76qt2/lets_bring_silver_back/,1611863460.0,"{'author': 'Iostsignal', 'created_utc': 1611863460, 'title': 'LETS BRING SILVER BACK!', 'url': 'https://www.reddit.com/r/wallstreetbets/comments/l76qt2/lets_bring_silver_back/', 'created': 1611863460.0}",2021-01-28 19:51:00
52,vtnrwyers,1611863459,Do you think amc will go above 15$ again?,https://www.reddit.com/r/wallstreetbets/comments/l76qsr/do_you_think_amc_will_go_above_15_again/,1611863459.0,"{'author': 'vtnrwyers', 'created_utc': 1611863459, 'title': 'Do you think amc will go above 15$ again?', 'url': 'https://www.reddit.com/r/wallstreetbets/comments/l76qsr/do_you_think_amc_will_go_above_15_again/', 'created': 1611863459.0}",2021-01-28 19:50:59
53,N_Uppal,1611863459,What if - stay committed!!,https://www.reddit.com/r/wallstreetbets/comments/l76qs9/what_if_stay_committed/,1611863459.0,"{'author': 'N_Uppal', 'created_utc': 1611863459, 'title': 'What if - stay committed!!', 'url': 'https://www.reddit.com/r/wallstreetbets/comments/l76qs9/what_if_stay_committed/', 'created': 1611863459.0}",2021-01-28 19:50:59
54,throwaway99119911911,1611863458,What is supposed to happen tom?,https://www.reddit.com/r/wallstreetbets/comments/l76qs1/what_is_supposed_to_happen_tom/,1611863458.0,"{'author': 'throwaway99119911911', 'created_utc': 1611863458, 'title': 'What is supposed to happen tom?', 'url': 'https://www.reddit.com/r/wallstreetbets/comments/l76qs1/what_is_supposed_to_happen_tom/', 'created': 1611863458.0}",2021-01-28 19:50:58
55,EasyMoneySniperrrrr,1611863458,RESTRICTIONS ARE OFF !!,https://www.reddit.com/r/wallstreetbets/comments/l76qrz/restrictions_are_off/,1611863458.0,"{'author': 'EasyMoneySniperrrrr', 'created_utc': 1611863458, 'title': 'RESTRICTIONS ARE OFF !!', 'url': 'https://www.reddit.com/r/wallstreetbets/comments/l76qrz/restrictions_are_off/', 'created': 1611863458.0}",2021-01-28 19:50:58
56,AliceDefMetalGod,1611863458,Alright,https://www.reddit.com/r/wallstreetbets/comments/l76qru/alright/,1611863458.0,"{'author': 'AliceDefMetalGod', 'created_utc': 1611863458, 'title': 'Alright', 'url': 'https://www.reddit.com/r/wallstreetbets/comments/l76qru/alright/', 'created': 1611863458.0}",2021-01-28 19:50:58
57,graylingping,1611863458,Does anyone know when we'll be able to buy again?,https://www.reddit.com/r/wallstreetbets/comments/l76qrp/does_anyone_know_when_well_be_able_to_buy_again/,1611863458.0,"{'author': 'graylingping', 'created_utc': 1611863458, 'title': ""Does anyone know when we'll be able to buy again?"", 'url': 'https://www.reddit.com/r/wallstreetbets/comments/l76qrp/does_anyone_know_when_well_be_able_to_buy_again/', 'created': 1611863458.0}",2021-01-28 19:50:58
58,EasyE_NothingFree,1611863457,Role Reversal,https://www.reddit.com/r/wallstreetbets/comments/l76qrm/role_reversal/,1611863457.0,"{'author': 'EasyE_NothingFree', 'created_utc': 1611863457, 'title': 'Role Reversal', 'url': 'https://www.reddit.com/r/wallstreetbets/comments/l76qrm/role_reversal/', 'created': 1611863457.0}",2021-01-28 19:50:57
59,Glum_Key6508,1611863457,"HEMP stock, next big hit?!?!",https://www.reddit.com/r/wallstreetbets/comments/l76qr7/hemp_stock_next_big_hit/,1611863457.0,"{'author': 'Glum_Key6508', 'created_utc': 1611863457, 'title': 'HEMP stock, next big hit?!?!', 'url': 'https://www.reddit.com/r/wallstreetbets/comments/l76qr7/hemp_stock_next_big_hit/', 'created': 1611863457.0}",2021-01-28 19:50:57
60,GallantIce,1611863456,What’s funny/sad is all the pumpers have dumped already,https://www.reddit.com/r/wallstreetbets/comments/l76qqz/whats_funnysad_is_all_the_pumpers_have_dumped/,1611863456.0,"{'author': 'GallantIce', 'created_utc': 1611863456, 'title': 'What’s funny/sad is all the pumpers have dumped already', 'url': 'https://www.reddit.com/r/wallstreetbets/comments/l76qqz/whats_funnysad_is_all_the_pumpers_have_dumped/', 'created': 1611863456.0}",2021-01-28 19:50:56
61,Charannnnn,1611863455,$GNUS - TAKING OFF!!!,https://i.redd.it/4cy49kw2o4e61.png,1611863455.0,"{'author': 'Charannnnn', 'created_utc': 1611863455, 'title': '$GNUS - TAKING OFF!!!', 'url': 'https://i.redd.it/4cy49kw2o4e61.png', 'created': 1611863455.0}",2021-01-28 19:50:55
62,shresth2004,1611863455,HOLD THE LINE !!!,https://i.redd.it/wje5f333o4e61.jpg,1611863455.0,"{'author': 'shresth2004', 'created_utc': 1611863455, 'title': 'HOLD THE LINE !!!', 'url': 'https://i.redd.it/wje5f333o4e61.jpg', 'created': 1611863455.0}",2021-01-28 19:50:55
63,Immaguy6789,1611863455,$AMC?,https://www.reddit.com/r/wallstreetbets/comments/l76qq8/amc/,1611863455.0,"{'author': 'Immaguy6789', 'created_utc': 1611863455, 'title': '$AMC?', 'url': 'https://www.reddit.com/r/wallstreetbets/comments/l76qq8/amc/', 'created': 1611863455.0}",2021-01-28 19:50:55
64,mattwilmore,1611863455,Dodge coin!!!!!!! It is about to BLOW,https://www.reddit.com/r/wallstreetbets/comments/l76qq6/dodge_coin_it_is_about_to_blow/,1611863455.0,"{'author': 'mattwilmore', 'created_utc': 1611863455, 'title': 'Dodge coin!!!!!!! It is about to BLOW', 'url': 'https://www.reddit.com/r/wallstreetbets/comments/l76qq6/dodge_coin_it_is_about_to_blow/', 'created': 1611863455.0}",2021-01-28 19:50:55
65,[deleted],1611863454,"GME IS A NICE STOCK, I LIKE IT. AND RIGHT NOW IT'S PRETTY CHEAP",https://www.reddit.com/r/wallstreetbets/comments/l76qpx/gme_is_a_nice_stock_i_like_it_and_right_now_its/,1611863454.0,"{'author': '[deleted]', 'created_utc': 1611863454, 'title': ""GME IS A NICE STOCK, I LIKE IT. AND RIGHT NOW IT'S PRETTY CHEAP"", 'url': 'https://www.reddit.com/r/wallstreetbets/comments/l76qpx/gme_is_a_nice_stock_i_like_it_and_right_now_its/', 'created': 1611863454.0}",2021-01-28 19:50:54
66,GreedySpeculator,1611863454,u/deepfuckingvalue is a fraud that doesn't exist,https://www.reddit.com/r/wallstreetbets/comments/l76qpv/udeepfuckingvalue_is_a_fraud_that_doesnt_exist/,1611863454.0,"{'author': 'GreedySpeculator', 'created_utc': 1611863454, 'title': ""u/deepfuckingvalue is a fraud that doesn't exist"", 'url': 'https://www.reddit.com/r/wallstreetbets/comments/l76qpv/udeepfuckingvalue_is_a_fraud_that_doesnt_exist/', 'created': 1611863454.0}",2021-01-28 19:50:54
