,author,created_utc,title,url,created,d_,created_utc_dt
0,FriendOfTebow,1592529027,Is anyone going to acknowledge Robinhood made a kid kill himself?,https://www.reddit.com/r/wallstreetbets/comments/hbr532/is_anyone_going_to_acknowledge_robinhood_made_a/,1592529027.0,"{'author': 'FriendOfTebow', 'created_utc': 1592529027, 'title': 'Is anyone going to acknowledge Robinhood made a kid kill himself?', 'url': 'https://www.reddit.com/r/wallstreetbets/comments/hbr532/is_anyone_going_to_acknowledge_robinhood_made_a/', 'created': 1592529027.0}",2020-06-19 01:10:27
1,ImMoeLester,1592528838,Jpow taking bodybags,https://i.redd.it/92xj8hmcor551.jpg,1592528838.0,"{'author': 'ImMoeLester', 'created_utc': 1592528838, 'title': 'Jpow taking bodybags', 'url': 'https://i.redd.it/92xj8hmcor551.jpg', 'created': 1592528838.0}",2020-06-19 01:07:18
2,yarnhoj,1592528765,Coronavirus: Arizona will run out of hospital beds somewhere between June 27 and July 2nd,https://www.reddit.com/r/wallstreetbets/comments/hbr2nr/coronavirus_arizona_will_run_out_of_hospital_beds/,1592528765.0,"{'author': 'yarnhoj', 'created_utc': 1592528765, 'title': 'Coronavirus: Arizona will run out of hospital beds somewhere between June 27 and July 2nd', 'url': 'https://www.reddit.com/r/wallstreetbets/comments/hbr2nr/coronavirus_arizona_will_run_out_of_hospital_beds/', 'created': 1592528765.0}",2020-06-19 01:06:05
3,Midaswhale30,1592528755,Any tax loophole specialists?,https://i.redd.it/ixd54gq3or551.jpg,1592528755.0,"{'author': 'Midaswhale30', 'created_utc': 1592528755, 'title': 'Any tax loophole specialists?', 'url': 'https://i.redd.it/ixd54gq3or551.jpg', 'created': 1592528755.0}",2020-06-19 01:05:55
4,dysonGOAT,1592528753,Disliking a comment because...,https://i.redd.it/7em9tii1or551.jpg,1592528753.0,"{'author': 'dysonGOAT', 'created_utc': 1592528753, 'title': 'Disliking a comment because...', 'url': 'https://i.redd.it/7em9tii1or551.jpg', 'created': 1592528753.0}",2020-06-19 01:05:53
5,Rathadin,1592528662,Get the fuck out of Intel and get out immediately.,https://www.reddit.com/r/wallstreetbets/comments/hbr1ol/get_the_fuck_out_of_intel_and_get_out_immediately/,1592528662.0,"{'author': 'Rathadin', 'created_utc': 1592528662, 'title': 'Get the fuck out of Intel and get out immediately.', 'url': 'https://www.reddit.com/r/wallstreetbets/comments/hbr1ol/get_the_fuck_out_of_intel_and_get_out_immediately/', 'created': 1592528662.0}",2020-06-19 01:04:22
6,appzly,1592528427,18 y/o started in early march from 1.2k -&gt; 13k -&gt; 7.4k,https://i.redd.it/099mr8l4nr551.jpg,1592528427.0,"{'author': 'appzly', 'created_utc': 1592528427, 'title': '18 y/o started in early march from 1.2k -&gt; 13k -&gt; 7.4k', 'url': 'https://i.redd.it/099mr8l4nr551.jpg', 'created': 1592528427.0}",2020-06-19 01:00:27
7,Donexodus,1592528266,"1,700% gains on this trade today!",https://i.imgur.com/GuCvaYs.png,1592528266.0,"{'author': 'Donexodus', 'created_utc': 1592528266, 'title': '1,700% gains on this trade today!', 'url': 'https://i.imgur.com/GuCvaYs.png', 'created': 1592528266.0}",2020-06-19 00:57:46
8,youngjoshua2020,1592528208,Why do you choose weekly expiration? Looking to learn! I loose with weeklys generally as the stock always goes backwards. Just for attention I got aapl $400 c 8/30 and 300 fb c 8/30,https://www.reddit.com/r/wallstreetbets/comments/hbqxcc/why_do_you_choose_weekly_expiration_looking_to/,1592528208.0,"{'author': 'youngjoshua2020', 'created_utc': 1592528208, 'title': 'Why do you choose weekly expiration? Looking to learn! I loose with weeklys generally as the stock always goes backwards. Just for attention I got aapl $400 c 8/30 and 300 fb c 8/30', 'url': 'https://www.reddit.com/r/wallstreetbets/comments/hbqxcc/why_do_you_choose_weekly_expiration_looking_to/', 'created': 1592528208.0}",2020-06-19 00:56:48
9,lilschmekle,1592527980,He knew the risks yet went for it. Pour one out for this retard R.I.P. Wasnt a glitch he just went yolo,https://i.redd.it/93hioytslr551.jpg,1592527980.0,"{'author': 'lilschmekle', 'created_utc': 1592527980, 'title': 'He knew the risks yet went for it. Pour one out for this retard R.I.P. Wasnt a glitch he just went yolo', 'url': 'https://i.redd.it/93hioytslr551.jpg', 'created': 1592527980.0}",2020-06-19 00:53:00
10,flimsydutchesss,1592527975,Will the party continue tomorrow?,https://v.redd.it/9s2t3rlnlr551,1592527975.0,"{'author': 'flimsydutchesss', 'created_utc': 1592527975, 'title': 'Will the party continue tomorrow?', 'url': 'https://v.redd.it/9s2t3rlnlr551', 'created': 1592527975.0}",2020-06-19 00:52:55
11,MajikRobot,1592527905,When did I discover options?,https://i.redd.it/yflfocpklr551.png,1592527905.0,"{'author': 'MajikRobot', 'created_utc': 1592527905, 'title': 'When did I discover options?', 'url': 'https://i.redd.it/yflfocpklr551.png', 'created': 1592527905.0}",2020-06-19 00:51:45
12,Midaswhale30,1592527857,Any tax loophole specialists? (70k) of this was 90% of my savings. I turned 30 and missed a offer I put on a house so decided to use it to invest.Ill probably keep going till I lose it all. Cheers,https://i.redd.it/v667qwoflr551.jpg,1592527857.0,"{'author': 'Midaswhale30', 'created_utc': 1592527857, 'title': 'Any tax loophole specialists? (70k) of this was 90% of my savings. I turned 30 and missed a offer I put on a house so decided to use it to invest.Ill probably keep going till I lose it all. Cheers', 'url': 'https://i.redd.it/v667qwoflr551.jpg', 'created': 1592527857.0}",2020-06-19 00:50:57
13,StringyBeans69,1592527855,They finally caught me.,https://i.redd.it/ljvg5waflr551.jpg,1592527855.0,"{'author': 'StringyBeans69', 'created_utc': 1592527855, 'title': 'They finally caught me.', 'url': 'https://i.redd.it/ljvg5waflr551.jpg', 'created': 1592527855.0}",2020-06-19 00:50:55
14,gobears11,1592527628,Young trader dies by suicide after thinking he racked up big losses on Robinhood — CNBC,https://apple.news/A3dSOo8cZQHyF9xaFQk8H7g,1592527628.0,"{'author': 'gobears11', 'created_utc': 1592527628, 'title': 'Young trader dies by suicide after thinking he racked up big losses on Robinhood — CNBC', 'url': 'https://apple.news/A3dSOo8cZQHyF9xaFQk8H7g', 'created': 1592527628.0}",2020-06-19 00:47:08
15,ShovelBrother,1592527360,options profit calculator?,https://www.reddit.com/r/wallstreetbets/comments/hbqp8f/options_profit_calculator/,1592527360.0,"{'author': 'ShovelBrother', 'created_utc': 1592527360, 'title': 'options profit calculator?', 'url': 'https://www.reddit.com/r/wallstreetbets/comments/hbqp8f/options_profit_calculator/', 'created': 1592527360.0}",2020-06-19 00:42:40
16,StringyBeans69,1592527358,I used the free money glitch on Robinhood to buy NCLH puts this March and I lost 900 dollars. This was almost 3 months ago. They finally caught me.,https://i.redd.it/jswkcx2yjr551.jpg,1592527358.0,"{'author': 'StringyBeans69', 'created_utc': 1592527358, 'title': 'I used the free money glitch on Robinhood to buy NCLH puts this March and I lost 900 dollars. This was almost 3 months ago. They finally caught me.', 'url': 'https://i.redd.it/jswkcx2yjr551.jpg', 'created': 1592527358.0}",2020-06-19 00:42:38
17,SpaceWanderer006,1592527345,Donnie Pump is off his rocker,https://twitter.com/realDonaldTrump/status/1273770669214490626?s=20,1592527345.0,"{'author': 'SpaceWanderer006', 'created_utc': 1592527345, 'title': 'Donnie Pump is off his rocker', 'url': 'https://twitter.com/realDonaldTrump/status/1273770669214490626?s=20', 'created': 1592527345.0}",2020-06-19 00:42:25
18,MarquisDeCleland,1592527329,Jerome is a bit weird ain’t he?,https://www.reddit.com/r/wallstreetbets/comments/hbqoy8/jerome_is_a_bit_weird_aint_he/,1592527329.0,"{'author': 'MarquisDeCleland', 'created_utc': 1592527329, 'title': 'Jerome is a bit weird ain’t he?', 'url': 'https://www.reddit.com/r/wallstreetbets/comments/hbqoy8/jerome_is_a_bit_weird_aint_he/', 'created': 1592527329.0}",2020-06-19 00:42:09
19,OfficialSilkyJohnson,1592527198,Probably YOLO’ing SPY puts with the angels now 😔🙏🏼,https://i.redd.it/ismean0hjr551.jpg,1592527198.0,"{'author': 'OfficialSilkyJohnson', 'created_utc': 1592527198, 'title': 'Probably YOLO’ing SPY puts with the angels now 😔🙏🏼', 'url': 'https://i.redd.it/ismean0hjr551.jpg', 'created': 1592527198.0}",2020-06-19 00:39:58
20,willynator88,1592527006,Kid who experienced Robinhood glitch took his own life,https://i.redd.it/dc7aqr7wir551.jpg,1592527006.0,"{'author': 'willynator88', 'created_utc': 1592527006, 'title': 'Kid who experienced Robinhood glitch took his own life', 'url': 'https://i.redd.it/dc7aqr7wir551.jpg', 'created': 1592527006.0}",2020-06-19 00:36:46
21,willynator88,1592526940,Kid who experienced Robinhood glitch took his own life,https://i.redd.it/g5yykrzoir551.jpg,1592526940.0,"{'author': 'willynator88', 'created_utc': 1592526940, 'title': 'Kid who experienced Robinhood glitch took his own life', 'url': 'https://i.redd.it/g5yykrzoir551.jpg', 'created': 1592526940.0}",2020-06-19 00:35:40
22,willynator88,1592526929,Kid who experienced Robinhood glitch took his own life,https://i.redd.it/axma57znir551.jpg,1592526929.0,"{'author': 'willynator88', 'created_utc': 1592526929, 'title': 'Kid who experienced Robinhood glitch took his own life', 'url': 'https://i.redd.it/axma57znir551.jpg', 'created': 1592526929.0}",2020-06-19 00:35:29
23,willynator88,1592526887,Kid who experienced Robinhood glitch took his own life,https://i.redd.it/1pv2jhijir551.jpg,1592526887.0,"{'author': 'willynator88', 'created_utc': 1592526887, 'title': 'Kid who experienced Robinhood glitch took his own life', 'url': 'https://i.redd.it/1pv2jhijir551.jpg', 'created': 1592526887.0}",2020-06-19 00:34:47
24,DiarrheaBubblebat,1592526793,Man commits suicide because of Robinhood glitch,https://imgur.com/e2TMBNU,1592526793.0,"{'author': 'DiarrheaBubblebat', 'created_utc': 1592526793, 'title': 'Man commits suicide because of Robinhood glitch', 'url': 'https://imgur.com/e2TMBNU', 'created': 1592526793.0}",2020-06-19 00:33:13
25,Essentialphoneuser,1592526533,Tech Industry Visa Restrictions Inbound,https://www.reddit.com/r/wallstreetbets/comments/hbqhhv/tech_industry_visa_restrictions_inbound/,1592526533.0,"{'author': 'Essentialphoneuser', 'created_utc': 1592526533, 'title': 'Tech Industry Visa Restrictions Inbound', 'url': 'https://www.reddit.com/r/wallstreetbets/comments/hbqhhv/tech_industry_visa_restrictions_inbound/', 'created': 1592526533.0}",2020-06-19 00:28:53
26,SpyroTheYoloDragon,1592526363,Created my own Black Business ETF; Ticker: BLM,https://i.redd.it/lbtztggzgr551.jpg,1592526363.0,"{'author': 'SpyroTheYoloDragon', 'created_utc': 1592526363, 'title': 'Created my own Black Business ETF; Ticker: BLM', 'url': 'https://i.redd.it/lbtztggzgr551.jpg', 'created': 1592526363.0}",2020-06-19 00:26:03
27,shawnsblog,1592526259,6/20 - $NKLA dies,https://www.reddit.com/r/wallstreetbets/comments/hbqeww/620_nkla_dies/,1592526259.0,"{'author': 'shawnsblog', 'created_utc': 1592526259, 'title': '6/20 - $NKLA dies', 'url': 'https://www.reddit.com/r/wallstreetbets/comments/hbqeww/620_nkla_dies/', 'created': 1592526259.0}",2020-06-19 00:24:19
28,AnalystOfData,1592526214,Taking a chance on $MITT,https://www.reddit.com/r/wallstreetbets/comments/hbqefc/taking_a_chance_on_mitt/,1592526214.0,"{'author': 'AnalystOfData', 'created_utc': 1592526214, 'title': 'Taking a chance on $MITT', 'url': 'https://www.reddit.com/r/wallstreetbets/comments/hbqefc/taking_a_chance_on_mitt/', 'created': 1592526214.0}",2020-06-19 00:23:34
29,noah8597,1592526174,This guy obviously doesn’t get it,https://i.redd.it/r60qoyefgr551.jpg,1592526174.0,"{'author': 'noah8597', 'created_utc': 1592526174, 'title': 'This guy obviously doesn’t get it', 'url': 'https://i.redd.it/r60qoyefgr551.jpg', 'created': 1592526174.0}",2020-06-19 00:22:54
30,dmyles123,1592526152,WSB autist trynna rake in tendies,https://v.redd.it/ea8h9o84gr551,1592526152.0,"{'author': 'dmyles123', 'created_utc': 1592526152, 'title': 'WSB autist trynna rake in tendies', 'url': 'https://v.redd.it/ea8h9o84gr551', 'created': 1592526152.0}",2020-06-19 00:22:32
31,shadowstarx0,1592525879,Elon Musk accused of 3some w Johnny Depp’s ex Wife,https://www.dailymail.co.uk/news/article-8426719/Cara-Delevingne-three-way-affair-Amber-Heard-Elon-Musk.html,1592525879.0,"{'author': 'shadowstarx0', 'created_utc': 1592525879, 'title': 'Elon Musk accused of 3some w Johnny Depp’s ex Wife', 'url': 'https://www.dailymail.co.uk/news/article-8426719/Cara-Delevingne-three-way-affair-Amber-Heard-Elon-Musk.html', 'created': 1592525879.0}",2020-06-19 00:17:59
32,roofuskit,1592525549,Illinois man takes own life after seeing $730K negative balance on investment app,https://fox8.com/news/illinois-man-takes-own-life-after-seeing-730k-negative-balance-on-investment-app/,1592525549.0,"{'author': 'roofuskit', 'created_utc': 1592525549, 'title': 'Illinois man takes own life after seeing $730K negative balance on investment app', 'url': 'https://fox8.com/news/illinois-man-takes-own-life-after-seeing-730k-negative-balance-on-investment-app/', 'created': 1592525549.0}",2020-06-19 00:12:29
33,nudedirection,1592525539,Brought to you by WSB,https://i.redd.it/n38n6khjer551.jpg,1592525539.0,"{'author': 'nudedirection', 'created_utc': 1592525539, 'title': 'Brought to you by WSB', 'url': 'https://i.redd.it/n38n6khjer551.jpg', 'created': 1592525539.0}",2020-06-19 00:12:19
34,Cpt_Obvius,1592525539,"🌈🐻 promised to eat dog food if S&amp;P closes above 2500 tomorrow, I think Powell got to him first",https://i.redd.it/excy0fgjer551.jpg,1592525539.0,"{'author': 'Cpt_Obvius', 'created_utc': 1592525539, 'title': '🌈🐻 promised to eat dog food if S&amp;P closes above 2500 tomorrow, I think Powell got to him first', 'url': 'https://i.redd.it/excy0fgjer551.jpg', 'created': 1592525539.0}",2020-06-19 00:12:19
35,firegragon20,1592525445,Female Jerome Powell looking to end 🌈🐻,https://i.redd.it/vyjx29f9er551.jpg,1592525445.0,"{'author': 'firegragon20', 'created_utc': 1592525445, 'title': 'Female Jerome Powell looking to end 🌈🐻', 'url': 'https://i.redd.it/vyjx29f9er551.jpg', 'created': 1592525445.0}",2020-06-19 00:10:45
36,nagostin23,1592525215,kroger yolo,https://www.reddit.com/r/wallstreetbets/comments/hbq4rz/kroger_yolo/,1592525215.0,"{'author': 'nagostin23', 'created_utc': 1592525215, 'title': 'kroger yolo', 'url': 'https://www.reddit.com/r/wallstreetbets/comments/hbq4rz/kroger_yolo/', 'created': 1592525215.0}",2020-06-19 00:06:55
37,NarcolepticLifeGuard,1592525003,Hero Autist kills himself,https://www.cnbc.com/amp/2020/06/18/young-trader-dies-by-suicide-after-thinking-he-racked-up-big-losses-on-robinhood.html,1592525003.0,"{'author': 'NarcolepticLifeGuard', 'created_utc': 1592525003, 'title': 'Hero Autist kills himself', 'url': 'https://www.cnbc.com/amp/2020/06/18/young-trader-dies-by-suicide-after-thinking-he-racked-up-big-losses-on-robinhood.html', 'created': 1592525003.0}",2020-06-19 00:03:23
38,ExtremeSavings,1592524963,Nclh ccl short squeeze,https://www.reddit.com/r/wallstreetbets/comments/hbq273/nclh_ccl_short_squeeze/,1592524963.0,"{'author': 'ExtremeSavings', 'created_utc': 1592524963, 'title': 'Nclh ccl short squeeze', 'url': 'https://www.reddit.com/r/wallstreetbets/comments/hbq273/nclh_ccl_short_squeeze/', 'created': 1592524963.0}",2020-06-19 00:02:43
39,Nimrod5280,1592524751,"20-year-old Robinhood trader commits suicide after app shows $730,000 negative balance",https://www.reddit.com/r/wallstreetbets/comments/hbq027/20yearold_robinhood_trader_commits_suicide_after/,1592524751.0,"{'author': 'Nimrod5280', 'created_utc': 1592524751, 'title': '20-year-old Robinhood trader commits suicide after app shows $730,000 negative balance', 'url': 'https://www.reddit.com/r/wallstreetbets/comments/hbq027/20yearold_robinhood_trader_commits_suicide_after/', 'created': 1592524751.0}",2020-06-18 23:59:11
40,Leandrir,1592524749,When options gets more valuable?,https://www.reddit.com/r/wallstreetbets/comments/hbq01r/when_options_gets_more_valuable/,1592524749.0,"{'author': 'Leandrir', 'created_utc': 1592524749, 'title': 'When options gets more valuable?', 'url': 'https://www.reddit.com/r/wallstreetbets/comments/hbq01r/when_options_gets_more_valuable/', 'created': 1592524749.0}",2020-06-18 23:59:09
41,thesmokeyastronaut,1592524608,How a lot of our profilio is feeling.,https://i.redd.it/3p9ay0rrbr551.jpg,1592524608.0,"{'author': 'thesmokeyastronaut', 'created_utc': 1592524608, 'title': 'How a lot of our profilio is feeling.', 'url': 'https://i.redd.it/3p9ay0rrbr551.jpg', 'created': 1592524608.0}",2020-06-18 23:56:48
42,arbitrageisfreemoney,1592524429,Can you tell when I started trading options?,https://i.redd.it/30snusn8br551.png,1592524429.0,"{'author': 'arbitrageisfreemoney', 'created_utc': 1592524429, 'title': 'Can you tell when I started trading options?', 'url': 'https://i.redd.it/30snusn8br551.png', 'created': 1592524429.0}",2020-06-18 23:53:49
43,mosquito-genocide,1592524262,Chad needs some new suits for job interviews since his nerd boss fired him,https://www.reddit.com/r/wallstreetbets/comments/hbpvd8/chad_needs_some_new_suits_for_job_interviews/,1592524262.0,"{'author': 'mosquito-genocide', 'created_utc': 1592524262, 'title': 'Chad needs some new suits for job interviews since his nerd boss fired him', 'url': 'https://www.reddit.com/r/wallstreetbets/comments/hbpvd8/chad_needs_some_new_suits_for_job_interviews/', 'created': 1592524262.0}",2020-06-18 23:51:02
44,that_70_show_fan,1592524224,Qantas axes most overseas flights until October,https://www.bbc.com/news/business-53088432,1592524224.0,"{'author': 'that_70_show_fan', 'created_utc': 1592524224, 'title': 'Qantas axes most overseas flights until October', 'url': 'https://www.bbc.com/news/business-53088432', 'created': 1592524224.0}",2020-06-18 23:50:24
45,mosquito-genocide,1592524169,Chad needs some new suits for job interviews since his nerd boss fired him $TLRD,https://www.reddit.com/r/wallstreetbets/comments/hbpugd/chad_needs_some_new_suits_for_job_interviews/,1592524169.0,"{'author': 'mosquito-genocide', 'created_utc': 1592524169, 'title': 'Chad needs some new suits for job interviews since his nerd boss fired him $TLRD', 'url': 'https://www.reddit.com/r/wallstreetbets/comments/hbpugd/chad_needs_some_new_suits_for_job_interviews/', 'created': 1592524169.0}",2020-06-18 23:49:29
46,lewisearnst19,1592524060,URBAN ONE IS THE NEXT $PCE🚀🚀🚀,https://www.reddit.com/r/wallstreetbets/comments/hbpteu/urban_one_is_the_next_pce/,1592524060.0,"{'author': 'lewisearnst19', 'created_utc': 1592524060, 'title': 'URBAN ONE IS THE NEXT $PCE🚀🚀🚀', 'url': 'https://www.reddit.com/r/wallstreetbets/comments/hbpteu/urban_one_is_the_next_pce/', 'created': 1592524060.0}",2020-06-18 23:47:40
47,LilBitTired,1592524005,TIL Australia is a US corporation,https://i.redd.it/qm094a6z9r551.png,1592524005.0,"{'author': 'LilBitTired', 'created_utc': 1592524005, 'title': 'TIL Australia is a US corporation', 'url': 'https://i.redd.it/qm094a6z9r551.png', 'created': 1592524005.0}",2020-06-18 23:46:45
48,spooncountry,1592523965,GME DD,https://www.reddit.com/r/wallstreetbets/comments/hbpsha/gme_dd/,1592523965.0,"{'author': 'spooncountry', 'created_utc': 1592523965, 'title': 'GME DD', 'url': 'https://www.reddit.com/r/wallstreetbets/comments/hbpsha/gme_dd/', 'created': 1592523965.0}",2020-06-18 23:46:05
49,ryan3017,1592523898,CCL up after hours,https://www.reddit.com/r/wallstreetbets/comments/hbprwm/ccl_up_after_hours/,1592523898.0,"{'author': 'ryan3017', 'created_utc': 1592523898, 'title': 'CCL up after hours', 'url': 'https://www.reddit.com/r/wallstreetbets/comments/hbprwm/ccl_up_after_hours/', 'created': 1592523898.0}",2020-06-18 23:44:58
50,TheEaston,1592523733,Can you stock trade on apps if your under 18?,https://www.reddit.com/r/wallstreetbets/comments/hbpq9v/can_you_stock_trade_on_apps_if_your_under_18/,1592523733.0,"{'author': 'TheEaston', 'created_utc': 1592523733, 'title': 'Can you stock trade on apps if your under 18?', 'url': 'https://www.reddit.com/r/wallstreetbets/comments/hbpq9v/can_you_stock_trade_on_apps_if_your_under_18/', 'created': 1592523733.0}",2020-06-18 23:42:13
51,theodros1,1592523573,VROOM - Recent IPO,https://www.reddit.com/r/wallstreetbets/comments/hbpooi/vroom_recent_ipo/,1592523573.0,"{'author': 'theodros1', 'created_utc': 1592523573, 'title': 'VROOM - Recent IPO', 'url': 'https://www.reddit.com/r/wallstreetbets/comments/hbpooi/vroom_recent_ipo/', 'created': 1592523573.0}",2020-06-18 23:39:33
52,led4798657221611,1592523571,I have an idea,https://i.redd.it/ssilften8r551.png,1592523571.0,"{'author': 'led4798657221611', 'created_utc': 1592523571, 'title': 'I have an idea', 'url': 'https://i.redd.it/ssilften8r551.png', 'created': 1592523571.0}",2020-06-18 23:39:31
53,indonesian_activist,1592523485,"🦇🐻, I wrote 20 x 320C SPY Calls 6/19 expiring tomorrow",https://www.reddit.com/r/wallstreetbets/comments/hbpnth/i_wrote_20_x_320c_spy_calls_619_expiring_tomorrow/,1592523485.0,"{'author': 'indonesian_activist', 'created_utc': 1592523485, 'title': '🦇🐻, I wrote 20 x 320C SPY Calls 6/19 expiring tomorrow', 'url': 'https://www.reddit.com/r/wallstreetbets/comments/hbpnth/i_wrote_20_x_320c_spy_calls_619_expiring_tomorrow/', 'created': 1592523485.0}",2020-06-18 23:38:05
54,u8eR,1592523455,"20-Year-Old Robinhood Customer Dies By Suicide After Seeing A $730,000 Negative Balance",https://www.forbes.com/sites/sergeiklebnikov/2020/06/17/20-year-old-robinhood-customer-commits-suicide-after-seeing-a-730000-negative-balance/,1592523455.0,"{'author': 'u8eR', 'created_utc': 1592523455, 'title': '20-Year-Old Robinhood Customer Dies By Suicide After Seeing A $730,000 Negative Balance', 'url': 'https://www.forbes.com/sites/sergeiklebnikov/2020/06/17/20-year-old-robinhood-customer-commits-suicide-after-seeing-a-730000-negative-balance/', 'created': 1592523455.0}",2020-06-18 23:37:35
55,fundaikon,1592523325,"DIX is over 0.50, calling it now, SPY will end green tomorrow or I do the most upvoted thing in the comments and film it",https://i.redd.it/l0z2akpx7r551.png,1592523325.0,"{'author': 'fundaikon', 'created_utc': 1592523325, 'title': 'DIX is over 0.50, calling it now, SPY will end green tomorrow or I do the most upvoted thing in the comments and film it', 'url': 'https://i.redd.it/l0z2akpx7r551.png', 'created': 1592523325.0}",2020-06-18 23:35:25
56,AcademicPledge,1592523140,Fed Rebranded As Crazy Larry's Money Emporium,https://thestonkmarket.com/fed-rebranded-as-crazy-larrys-money-emporium/,1592523140.0,"{'author': 'AcademicPledge', 'created_utc': 1592523140, 'title': ""Fed Rebranded As Crazy Larry's Money Emporium"", 'url': 'https://thestonkmarket.com/fed-rebranded-as-crazy-larrys-money-emporium/', 'created': 1592523140.0}",2020-06-18 23:32:20
57,Pavona_,1592523072,Even Robinhoods subreddit isn't immune to shit coding,https://v.redd.it/2xvzm3127r551,1592523072.0,"{'author': 'Pavona_', 'created_utc': 1592523072, 'title': ""Even Robinhoods subreddit isn't immune to shit coding"", 'url': 'https://v.redd.it/2xvzm3127r551', 'created': 1592523072.0}",2020-06-18 23:31:12
58,ALLnin2WiN,1592523053,Put Options,https://www.reddit.com/r/wallstreetbets/comments/hbpjgo/put_options/,1592523053.0,"{'author': 'ALLnin2WiN', 'created_utc': 1592523053, 'title': 'Put Options', 'url': 'https://www.reddit.com/r/wallstreetbets/comments/hbpjgo/put_options/', 'created': 1592523053.0}",2020-06-18 23:30:53
59,boredcertified2054,1592522961,Take a moment to realize that this is just money and none of it is worth your life. Link in comment.,https://i.redd.it/j8amgghv6r551.jpg,1592522961.0,"{'author': 'boredcertified2054', 'created_utc': 1592522961, 'title': 'Take a moment to realize that this is just money and none of it is worth your life. Link in comment.', 'url': 'https://i.redd.it/j8amgghv6r551.jpg', 'created': 1592522961.0}",2020-06-18 23:29:21
60,IrregardlessOfFeels,1592522898,"Robinhood reviews options trading offering following suicide of 20-year old who believed he incurred losses of $730,000.",https://www.reuters.com/article/us-robinhood-options/robinhood-reviews-options-trading-offering-following-suicide-by-customer-idUSKBN23P3JO,1592522898.0,"{'author': 'IrregardlessOfFeels', 'created_utc': 1592522898, 'title': 'Robinhood reviews options trading offering following suicide of 20-year old who believed he incurred losses of $730,000.', 'url': 'https://www.reuters.com/article/us-robinhood-options/robinhood-reviews-options-trading-offering-following-suicide-by-customer-idUSKBN23P3JO', 'created': 1592522898.0}",2020-06-18 23:28:18
61,xcav8r,1592522787,"RIP, must’ve been his first day. Illinois man takes his own life after seeing $730K negative balance on investment app",https://www.wkrn.com/news/illinois-man-takes-his-own-life-after-seeing-730k-negative-balance-on-investment-app/,1592522787.0,"{'author': 'xcav8r', 'created_utc': 1592522787, 'title': 'RIP, must’ve been his first day. Illinois man takes his own life after seeing $730K negative balance on investment app', 'url': 'https://www.wkrn.com/news/illinois-man-takes-his-own-life-after-seeing-730k-negative-balance-on-investment-app/', 'created': 1592522787.0}",2020-06-18 23:26:27
62,mrgizmo212,1592522768,Robinhood Just Updated Their Homepage?!,https://i.redd.it/d1spxw536r551.jpg,1592522768.0,"{'author': 'mrgizmo212', 'created_utc': 1592522768, 'title': 'Robinhood Just Updated Their Homepage?!', 'url': 'https://i.redd.it/d1spxw536r551.jpg', 'created': 1592522768.0}",2020-06-18 23:26:08
63,NCGiant,1592522756,AMC theaters reopening mid July,https://www.reddit.com/r/wallstreetbets/comments/hbpgge/amc_theaters_reopening_mid_july/,1592522756.0,"{'author': 'NCGiant', 'created_utc': 1592522756, 'title': 'AMC theaters reopening mid July', 'url': 'https://www.reddit.com/r/wallstreetbets/comments/hbpgge/amc_theaters_reopening_mid_july/', 'created': 1592522756.0}",2020-06-18 23:25:56
