,author,created_utc,title,url,created,d_,created_utc_dt
0,WiseGuyYolo,1611860568,🚀COTY 🔥COTY 🚀COTY 🔥COTY 🚀COTY”,https://www.reddit.com/r/wallstreetbets/comments/l75et9/coty_coty_coty_coty_coty/,1611860568.0,"{'author': 'WiseGuyYolo', 'created_utc': 1611860568, 'title': '🚀COTY 🔥COTY 🚀COTY 🔥COTY 🚀COTY”', 'url': 'https://www.reddit.com/r/wallstreetbets/comments/l75et9/coty_coty_coty_coty_coty/', 'created': 1611860568.0}",2021-01-28 19:02:48
1,Intrepid-Elk5300,1611860568,BUYYY,https://www.reddit.com/r/wallstreetbets/comments/l75et0/buyyy/,1611860568.0,"{'author': 'Intrepid-Elk5300', 'created_utc': 1611860568, 'title': 'BUYYY', 'url': 'https://www.reddit.com/r/wallstreetbets/comments/l75et0/buyyy/', 'created': 1611860568.0}",2021-01-28 19:02:48
2,Juztaan,1611860568,"I put my stonks up on your hip, when it dips, I dip, you dip!",https://www.reddit.com/r/wallstreetbets/comments/l75esv/i_put_my_stonks_up_on_your_hip_when_it_dips_i_dip/,1611860568.0,"{'author': 'Juztaan', 'created_utc': 1611860568, 'title': 'I put my stonks up on your hip, when it dips, I dip, you dip!', 'url': 'https://www.reddit.com/r/wallstreetbets/comments/l75esv/i_put_my_stonks_up_on_your_hip_when_it_dips_i_dip/', 'created': 1611860568.0}",2021-01-28 19:02:48
3,[deleted],1611860567,GME is back on Robinhood!,https://i.redd.it/yea72s5if4e61.png,1611860567.0,"{'author': '[deleted]', 'created_utc': 1611860567, 'title': 'GME is back on Robinhood!', 'url': 'https://i.redd.it/yea72s5if4e61.png', 'created': 1611860567.0}",2021-01-28 19:02:47
4,bumrabbit,1611860567,nakd,https://www.reddit.com/r/wallstreetbets/comments/l75esm/nakd/,1611860567.0,"{'author': 'bumrabbit', 'created_utc': 1611860567, 'title': 'nakd', 'url': 'https://www.reddit.com/r/wallstreetbets/comments/l75esm/nakd/', 'created': 1611860567.0}",2021-01-28 19:02:47
5,misterhamm,1611860567,Alpaca pulling a Robinhood,https://i.redd.it/9oyxnrmgf4e61.png,1611860567.0,"{'author': 'misterhamm', 'created_utc': 1611860567, 'title': 'Alpaca pulling a Robinhood', 'url': 'https://i.redd.it/9oyxnrmgf4e61.png', 'created': 1611860567.0}",2021-01-28 19:02:47
6,JG_deluxe,1611860567,Help us boycott Robinhood once and for all! F*ck Robinhood,https://www.reddit.com/r/wallstreetbets/comments/l75ese/help_us_boycott_robinhood_once_and_for_all_fck/,1611860567.0,"{'author': 'JG_deluxe', 'created_utc': 1611860567, 'title': 'Help us boycott Robinhood once and for all! F*ck Robinhood', 'url': 'https://www.reddit.com/r/wallstreetbets/comments/l75ese/help_us_boycott_robinhood_once_and_for_all_fck/', 'created': 1611860567.0}",2021-01-28 19:02:47
7,-Joehands0me,1611860567,All the paper hands in this sub right now,https://i.redd.it/634zor3if4e61.jpg,1611860567.0,"{'author': '-Joehands0me', 'created_utc': 1611860567, 'title': 'All the paper hands in this sub right now', 'url': 'https://i.redd.it/634zor3if4e61.jpg', 'created': 1611860567.0}",2021-01-28 19:02:47
8,Reel2k,1611860566,Help GNUS for the sake of little kids.,https://www.reddit.com/r/wallstreetbets/comments/l75erx/help_gnus_for_the_sake_of_little_kids/,1611860566.0,"{'author': 'Reel2k', 'created_utc': 1611860566, 'title': 'Help GNUS for the sake of little kids.', 'url': 'https://www.reddit.com/r/wallstreetbets/comments/l75erx/help_gnus_for_the_sake_of_little_kids/', 'created': 1611860566.0}",2021-01-28 19:02:46
9,Intelligent-Gain87,1611860566,Thanks Stash.,https://i.redd.it/fviyh3whf4e61.jpg,1611860566.0,"{'author': 'Intelligent-Gain87', 'created_utc': 1611860566, 'title': 'Thanks Stash.', 'url': 'https://i.redd.it/fviyh3whf4e61.jpg', 'created': 1611860566.0}",2021-01-28 19:02:46
10,swithdad,1611860566,BUY YOU AUTISTS,https://i.redd.it/yk07fx1if4e61.jpg,1611860566.0,"{'author': 'swithdad', 'created_utc': 1611860566, 'title': 'BUY YOU AUTISTS', 'url': 'https://i.redd.it/yk07fx1if4e61.jpg', 'created': 1611860566.0}",2021-01-28 19:02:46
11,Jay_Ell_,1611860565,"Alexa, play C.R.E.A.M by Wu-Tang Clan. 😤",https://www.youtube.com/watch?v=PBwAxmrE194,1611860565.0,"{'author': 'Jay_Ell_', 'created_utc': 1611860565, 'title': 'Alexa, play C.R.E.A.M by Wu-Tang Clan. 😤', 'url': 'https://www.youtube.com/watch?v=PBwAxmrE194', 'created': 1611860565.0}",2021-01-28 19:02:45
12,[deleted],1611860565,FTX derivatives exchange listing Wall Street Bets index quarterly futures product,https://ftx.us/#a=wallstreet,1611860565.0,"{'author': '[deleted]', 'created_utc': 1611860565, 'title': 'FTX derivatives exchange listing Wall Street Bets index quarterly futures product', 'url': 'https://ftx.us/#a=wallstreet', 'created': 1611860565.0}",2021-01-28 19:02:45
13,SSgt-Harlow,1611860564,Don’t forget to do your part.,https://i.redd.it/g5q9fewhf4e61.jpg,1611860564.0,"{'author': 'SSgt-Harlow', 'created_utc': 1611860564, 'title': 'Don’t forget to do your part.', 'url': 'https://i.redd.it/g5q9fewhf4e61.jpg', 'created': 1611860564.0}",2021-01-28 19:02:44
14,twiidurrudiiwt,1611860564,Trade on DOUGH!!,https://www.reddit.com/r/wallstreetbets/comments/l75eqv/trade_on_dough/,1611860564.0,"{'author': 'twiidurrudiiwt', 'created_utc': 1611860564, 'title': 'Trade on DOUGH!!', 'url': 'https://www.reddit.com/r/wallstreetbets/comments/l75eqv/trade_on_dough/', 'created': 1611860564.0}",2021-01-28 19:02:44
15,kbrooney,1611860564,Did Australians just rally a mining stock GME to 100% which is NOT Gamespot?,https://www.reddit.com/r/wallstreetbets/comments/l75eqr/did_australians_just_rally_a_mining_stock_gme_to/,1611860564.0,"{'author': 'kbrooney', 'created_utc': 1611860564, 'title': 'Did Australians just rally a mining stock GME to 100% which is NOT Gamespot?', 'url': 'https://www.reddit.com/r/wallstreetbets/comments/l75eqr/did_australians_just_rally_a_mining_stock_gme_to/', 'created': 1611860564.0}",2021-01-28 19:02:44
16,Cautious_Cod4310,1611860564,Coty,https://www.reddit.com/r/wallstreetbets/comments/l75eqn/coty/,1611860564.0,"{'author': 'Cautious_Cod4310', 'created_utc': 1611860564, 'title': 'Coty', 'url': 'https://www.reddit.com/r/wallstreetbets/comments/l75eqn/coty/', 'created': 1611860564.0}",2021-01-28 19:02:44
17,Designmitho,1611860564,Can’t we shoot any Stock to the Moon?!,https://www.reddit.com/r/wallstreetbets/comments/l75eqj/cant_we_shoot_any_stock_to_the_moon/,1611860564.0,"{'author': 'Designmitho', 'created_utc': 1611860564, 'title': 'Can’t we shoot any Stock to the Moon?!', 'url': 'https://www.reddit.com/r/wallstreetbets/comments/l75eqj/cant_we_shoot_any_stock_to_the_moon/', 'created': 1611860564.0}",2021-01-28 19:02:44
18,xsat2234,1611860563,WHAT IF EVERYONE VISITED THEIR LOCAL GAMESTOP THIS WEEKEND AND BOUGHT OUT THE STORE? HOW WOULD THE *FUNDAMENTALS* LOOK THEN? #RestartGameStop,https://i.redd.it/p66zl5w4f4e61.jpg,1611860563.0,"{'author': 'xsat2234', 'created_utc': 1611860563, 'title': 'WHAT IF EVERYONE VISITED THEIR LOCAL GAMESTOP THIS WEEKEND AND BOUGHT OUT THE STORE? HOW WOULD THE *FUNDAMENTALS* LOOK THEN? #RestartGameStop', 'url': 'https://i.redd.it/p66zl5w4f4e61.jpg', 'created': 1611860563.0}",2021-01-28 19:02:43
19,Yslpaolo,1611860563,What brokerage still allows you to buy gme and amc fuck Robinhood,https://www.reddit.com/r/wallstreetbets/comments/l75eq3/what_brokerage_still_allows_you_to_buy_gme_and/,1611860563.0,"{'author': 'Yslpaolo', 'created_utc': 1611860563, 'title': 'What brokerage still allows you to buy gme and amc fuck Robinhood', 'url': 'https://www.reddit.com/r/wallstreetbets/comments/l75eq3/what_brokerage_still_allows_you_to_buy_gme_and/', 'created': 1611860563.0}",2021-01-28 19:02:43
20,popadi,1611860563,HODL! ALL YOU NEED TO DO IS HODL!,https://i.redd.it/mfzgoyldf4e61.png,1611860563.0,"{'author': 'popadi', 'created_utc': 1611860563, 'title': 'HODL! ALL YOU NEED TO DO IS HODL!', 'url': 'https://i.redd.it/mfzgoyldf4e61.png', 'created': 1611860563.0}",2021-01-28 19:02:43
21,AccomplishedWar6742,1611860563,Closing my robinhood account today. In addition to the fact they proved themselves wallstreet puppets they have bad service and they cheat their way in option pricing when compared to others. #Robnihoodsucks. #ditchrobinhood,https://www.reddit.com/r/wallstreetbets/comments/l75epu/closing_my_robinhood_account_today_in_addition_to/,1611860563.0,"{'author': 'AccomplishedWar6742', 'created_utc': 1611860563, 'title': 'Closing my robinhood account today. In addition to the fact they proved themselves wallstreet puppets they have bad service and they cheat their way in option pricing when compared to others. #Robnihoodsucks. #ditchrobinhood', 'url': 'https://www.reddit.com/r/wallstreetbets/comments/l75epu/closing_my_robinhood_account_today_in_addition_to/', 'created': 1611860563.0}",2021-01-28 19:02:43
22,nate_sayer,1611860562,"What does everyone use for an investing app, I’m done with Robin Hood",https://www.reddit.com/r/wallstreetbets/comments/l75epk/what_does_everyone_use_for_an_investing_app_im/,1611860562.0,"{'author': 'nate_sayer', 'created_utc': 1611860562, 'title': 'What does everyone use for an investing app, I’m done with Robin Hood', 'url': 'https://www.reddit.com/r/wallstreetbets/comments/l75epk/what_does_everyone_use_for_an_investing_app_im/', 'created': 1611860562.0}",2021-01-28 19:02:42
23,bigpoppa96ing,1611860562,Holding cuz im not a poonanny,https://www.reddit.com/r/wallstreetbets/comments/l75epi/holding_cuz_im_not_a_poonanny/,1611860562.0,"{'author': 'bigpoppa96ing', 'created_utc': 1611860562, 'title': 'Holding cuz im not a poonanny', 'url': 'https://www.reddit.com/r/wallstreetbets/comments/l75epi/holding_cuz_im_not_a_poonanny/', 'created': 1611860562.0}",2021-01-28 19:02:42
24,Howler_0ne,1611860561,Any platforms out there that work right now?,https://www.reddit.com/r/wallstreetbets/comments/l75ep9/any_platforms_out_there_that_work_right_now/,1611860561.0,"{'author': 'Howler_0ne', 'created_utc': 1611860561, 'title': 'Any platforms out there that work right now?', 'url': 'https://www.reddit.com/r/wallstreetbets/comments/l75ep9/any_platforms_out_there_that_work_right_now/', 'created': 1611860561.0}",2021-01-28 19:02:41
25,aizeygg,1611860561,Where should we go?,https://www.reddit.com/r/wallstreetbets/comments/l75eox/where_should_we_go/,1611860561.0,"{'author': 'aizeygg', 'created_utc': 1611860561, 'title': 'Where should we go?', 'url': 'https://www.reddit.com/r/wallstreetbets/comments/l75eox/where_should_we_go/', 'created': 1611860561.0}",2021-01-28 19:02:41
26,AtlasPistola,1611860561,"Tip for brazilian investors who want to buy NOK, GME, AMC etc: Avenue Securities is allowing this operations again, after the pressure from its clients.",https://www.reddit.com/r/wallstreetbets/comments/l75eor/tip_for_brazilian_investors_who_want_to_buy_nok/,1611860561.0,"{'author': 'AtlasPistola', 'created_utc': 1611860561, 'title': 'Tip for brazilian investors who want to buy NOK, GME, AMC etc: Avenue Securities is allowing this operations again, after the pressure from its clients.', 'url': 'https://www.reddit.com/r/wallstreetbets/comments/l75eor/tip_for_brazilian_investors_who_want_to_buy_nok/', 'created': 1611860561.0}",2021-01-28 19:02:41
27,V3N0M_SIERRA,1611860560,Wealth simple app still trading all stocks,https://www.reddit.com/r/wallstreetbets/comments/l75eoc/wealth_simple_app_still_trading_all_stocks/,1611860560.0,"{'author': 'V3N0M_SIERRA', 'created_utc': 1611860560, 'title': 'Wealth simple app still trading all stocks', 'url': 'https://www.reddit.com/r/wallstreetbets/comments/l75eoc/wealth_simple_app_still_trading_all_stocks/', 'created': 1611860560.0}",2021-01-28 19:02:40
28,Throwaway93ee90299,1611860559,"CNBC waking up to reality. Finally a bullish piece from this shitrag. ""GameStop head-spinning volatility may be only the beginning of a new wave""",https://www.cnbc.com/2021/01/28/gamestop-head-spinning-volatility-may-be-only-the-beginning.html?utm_term=Autofeed&amp;utm_medium=Social&amp;utm_content=Main&amp;utm_source=Twitter#Echobox=1611856580,1611860559.0,"{'author': 'Throwaway93ee90299', 'created_utc': 1611860559, 'title': 'CNBC waking up to reality. Finally a bullish piece from this shitrag. ""GameStop head-spinning volatility may be only the beginning of a new wave""', 'url': 'https://www.cnbc.com/2021/01/28/gamestop-head-spinning-volatility-may-be-only-the-beginning.html?utm_term=Autofeed&amp;utm_medium=Social&amp;utm_content=Main&amp;utm_source=Twitter#Echobox=1611856580', 'created': 1611860559.0}",2021-01-28 19:02:39
29,goobergopher,1611860559,"""So you lost 91 billion dollars.""",https://i.redd.it/a514qc9hf4e61.jpg,1611860559.0,"{'author': 'goobergopher', 'created_utc': 1611860559, 'title': '""So you lost 91 billion dollars.""', 'url': 'https://i.redd.it/a514qc9hf4e61.jpg', 'created': 1611860559.0}",2021-01-28 19:02:39
30,Foltax,1611860559,The fucking balls on Steven Cohen... thankfully nobody is having any part of it.,https://www.reddit.com/r/wallstreetbets/comments/l75enw/the_fucking_balls_on_steven_cohen_thankfully/,1611860559.0,"{'author': 'Foltax', 'created_utc': 1611860559, 'title': 'The fucking balls on Steven Cohen... thankfully nobody is having any part of it.', 'url': 'https://www.reddit.com/r/wallstreetbets/comments/l75enw/the_fucking_balls_on_steven_cohen_thankfully/', 'created': 1611860559.0}",2021-01-28 19:02:39
31,[deleted],1611860558,I wrote a track to rally the troops. We are at war. But they cannot beat us!,https://www.reddit.com/r/wallstreetbets/comments/l75enl/i_wrote_a_track_to_rally_the_troops_we_are_at_war/,1611860558.0,"{'author': '[deleted]', 'created_utc': 1611860558, 'title': 'I wrote a track to rally the troops. We are at war. But they cannot beat us!', 'url': 'https://www.reddit.com/r/wallstreetbets/comments/l75enl/i_wrote_a_track_to_rally_the_troops_we_are_at_war/', 'created': 1611860558.0}",2021-01-28 19:02:38
32,taylo1994,1611860558,What are other options to trade similar to Robinhood,https://www.reddit.com/r/wallstreetbets/comments/l75enk/what_are_other_options_to_trade_similar_to/,1611860558.0,"{'author': 'taylo1994', 'created_utc': 1611860558, 'title': 'What are other options to trade similar to Robinhood', 'url': 'https://www.reddit.com/r/wallstreetbets/comments/l75enk/what_are_other_options_to_trade_similar_to/', 'created': 1611860558.0}",2021-01-28 19:02:38
33,Darrel-Mandeka,1611860558,Ben Shapiro does not fully understand this movement.,https://podcasts.apple.com/us/podcast/the-ben-shapiro-show/id1047335260#episodeGuid=84512162-6180-11eb-89f6-4fee4e0bba88,1611860558.0,"{'author': 'Darrel-Mandeka', 'created_utc': 1611860558, 'title': 'Ben Shapiro does not fully understand this movement.', 'url': 'https://podcasts.apple.com/us/podcast/the-ben-shapiro-show/id1047335260#episodeGuid=84512162-6180-11eb-89f6-4fee4e0bba88', 'created': 1611860558.0}",2021-01-28 19:02:38
34,dumdumber131,1611860557,#banrobinhood,https://www.reddit.com/r/wallstreetbets/comments/l75emq/banrobinhood/,1611860557.0,"{'author': 'dumdumber131', 'created_utc': 1611860557, 'title': '#banrobinhood', 'url': 'https://www.reddit.com/r/wallstreetbets/comments/l75emq/banrobinhood/', 'created': 1611860557.0}",2021-01-28 19:02:37
35,Glittering-Cause149,1611860557,What’s the next move,https://www.reddit.com/r/wallstreetbets/comments/l75emp/whats_the_next_move/,1611860557.0,"{'author': 'Glittering-Cause149', 'created_utc': 1611860557, 'title': 'What’s the next move', 'url': 'https://www.reddit.com/r/wallstreetbets/comments/l75emp/whats_the_next_move/', 'created': 1611860557.0}",2021-01-28 19:02:37
36,air_max01,1611860557,"I know guys, rh is a son of a bitch... but don‘t miss the focus on $GME, $BB, $AMC",https://www.reddit.com/r/wallstreetbets/comments/l75eml/i_know_guys_rh_is_a_son_of_a_bitch_but_dont_miss/,1611860557.0,"{'author': 'air_max01', 'created_utc': 1611860557, 'title': 'I know guys, rh is a son of a bitch... but don‘t miss the focus on $GME, $BB, $AMC', 'url': 'https://www.reddit.com/r/wallstreetbets/comments/l75eml/i_know_guys_rh_is_a_son_of_a_bitch_but_dont_miss/', 'created': 1611860557.0}",2021-01-28 19:02:37
37,mvanhelsing,1611860556,Bought 50 AMC just now on TD. Finally did my part for the resistance. Do yours.,https://www.reddit.com/r/wallstreetbets/comments/l75emg/bought_50_amc_just_now_on_td_finally_did_my_part/,1611860556.0,"{'author': 'mvanhelsing', 'created_utc': 1611860556, 'title': 'Bought 50 AMC just now on TD. Finally did my part for the resistance. Do yours.', 'url': 'https://www.reddit.com/r/wallstreetbets/comments/l75emg/bought_50_amc_just_now_on_td_finally_did_my_part/', 'created': 1611860556.0}",2021-01-28 19:02:36
38,Sksai12,1611860555,"Tweet from @nytimestech: ""The most unusual thing about Wall Street being challenged by a rowdy band of Redditors is that it took so long to happen,"" our tech columnist @kevinroose writes about the populist investor revolt that started on the Wall Street Bets forum",http://www.nytimes.com/2021/01/28/technology/gamestop-stock.html?smtyp=cur&amp;smid=tw-nytimesbits,1611860555.0,"{'author': 'Sksai12', 'created_utc': 1611860555, 'title': 'Tweet from @nytimestech: ""The most unusual thing about Wall Street being challenged by a rowdy band of Redditors is that it took so long to happen,"" our tech columnist @kevinroose writes about the populist investor revolt that started on the Wall Street Bets forum', 'url': 'http://www.nytimes.com/2021/01/28/technology/gamestop-stock.html?smtyp=cur&amp;smid=tw-nytimesbits', 'created': 1611860555.0}",2021-01-28 19:02:35
39,Sresponse,1611860555,Cash App,https://www.reddit.com/r/wallstreetbets/comments/l75elr/cash_app/,1611860555.0,"{'author': 'Sresponse', 'created_utc': 1611860555, 'title': 'Cash App', 'url': 'https://www.reddit.com/r/wallstreetbets/comments/l75elr/cash_app/', 'created': 1611860555.0}",2021-01-28 19:02:35
40,SilentGrass,1611860555,Contact Your Representatives In Congress To Hold The Scum Accountable!,https://www.reddit.com/r/wallstreetbets/comments/l75elq/contact_your_representatives_in_congress_to_hold/,1611860555.0,"{'author': 'SilentGrass', 'created_utc': 1611860555, 'title': 'Contact Your Representatives In Congress To Hold The Scum Accountable!', 'url': 'https://www.reddit.com/r/wallstreetbets/comments/l75elq/contact_your_representatives_in_congress_to_hold/', 'created': 1611860555.0}",2021-01-28 19:02:35
41,Jake9118321,1611860554,Hold the fucking line,https://www.reddit.com/r/wallstreetbets/comments/l75eln/hold_the_fucking_line/,1611860554.0,"{'author': 'Jake9118321', 'created_utc': 1611860554, 'title': 'Hold the fucking line', 'url': 'https://www.reddit.com/r/wallstreetbets/comments/l75eln/hold_the_fucking_line/', 'created': 1611860554.0}",2021-01-28 19:02:34
42,pancakebun,1611860554,Let’s get doge to $1.00,https://www.reddit.com/r/wallstreetbets/comments/l75ele/lets_get_doge_to_100/,1611860554.0,"{'author': 'pancakebun', 'created_utc': 1611860554, 'title': 'Let’s get doge to $1.00', 'url': 'https://www.reddit.com/r/wallstreetbets/comments/l75ele/lets_get_doge_to_100/', 'created': 1611860554.0}",2021-01-28 19:02:34
43,based_m_and_p9,1611860554,DOGE MY WAY ALL TO PLUTO,https://www.reddit.com/r/wallstreetbets/comments/l75elb/doge_my_way_all_to_pluto/,1611860554.0,"{'author': 'based_m_and_p9', 'created_utc': 1611860554, 'title': 'DOGE MY WAY ALL TO PLUTO', 'url': 'https://www.reddit.com/r/wallstreetbets/comments/l75elb/doge_my_way_all_to_pluto/', 'created': 1611860554.0}",2021-01-28 19:02:34
44,NWAJeep,1611860553,We don’t give up!,https://i.redd.it/qcd86npgf4e61.jpg,1611860553.0,"{'author': 'NWAJeep', 'created_utc': 1611860553, 'title': 'We don’t give up!', 'url': 'https://i.redd.it/qcd86npgf4e61.jpg', 'created': 1611860553.0}",2021-01-28 19:02:33
45,Cbird2796,1611860553,Many Online Brokers are just Platforms,https://www.reddit.com/r/wallstreetbets/comments/l75eks/many_online_brokers_are_just_platforms/,1611860553.0,"{'author': 'Cbird2796', 'created_utc': 1611860553, 'title': 'Many Online Brokers are just Platforms', 'url': 'https://www.reddit.com/r/wallstreetbets/comments/l75eks/many_online_brokers_are_just_platforms/', 'created': 1611860553.0}",2021-01-28 19:02:33
46,timloeffel,1611860553,The real one is on the moon 🚀🚀🚀,https://i.redd.it/xxtdaqzbf4e61.jpg,1611860553.0,"{'author': 'timloeffel', 'created_utc': 1611860553, 'title': 'The real one is on the moon 🚀🚀🚀', 'url': 'https://i.redd.it/xxtdaqzbf4e61.jpg', 'created': 1611860553.0}",2021-01-28 19:02:33
47,The_Struggle_Bus_7,1611860553,Wow Thanks Robin Hood,https://i.redd.it/21mat6ngf4e61.jpg,1611860553.0,"{'author': 'The_Struggle_Bus_7', 'created_utc': 1611860553, 'title': 'Wow Thanks Robin Hood', 'url': 'https://i.redd.it/21mat6ngf4e61.jpg', 'created': 1611860553.0}",2021-01-28 19:02:33
48,anhpound_pl,1611860553,"T212 from UK updated. Fuck them, holding till we hit Mars 🚀🚀🚀",https://i.redd.it/993amifgf4e61.jpg,1611860553.0,"{'author': 'anhpound_pl', 'created_utc': 1611860553, 'title': 'T212 from UK updated. Fuck them, holding till we hit Mars 🚀🚀🚀', 'url': 'https://i.redd.it/993amifgf4e61.jpg', 'created': 1611860553.0}",2021-01-28 19:02:33
49,erichd7,1611860553,ONE STAR ROBINHOOD IN THE APP STORE,https://www.reddit.com/r/wallstreetbets/comments/l75eke/one_star_robinhood_in_the_app_store/,1611860553.0,"{'author': 'erichd7', 'created_utc': 1611860553, 'title': 'ONE STAR ROBINHOOD IN THE APP STORE', 'url': 'https://www.reddit.com/r/wallstreetbets/comments/l75eke/one_star_robinhood_in_the_app_store/', 'created': 1611860553.0}",2021-01-28 19:02:33
50,[deleted],1611860553,"Telling it exactly how it is, Bravo!",https://i.redd.it/itnkhymgf4e61.jpg,1611860553.0,"{'author': '[deleted]', 'created_utc': 1611860553, 'title': 'Telling it exactly how it is, Bravo!', 'url': 'https://i.redd.it/itnkhymgf4e61.jpg', 'created': 1611860553.0}",2021-01-28 19:02:33
51,Wild_out_west,1611860552,"Use Retail Brokerage App, Public",https://www.reddit.com/r/wallstreetbets/comments/l75ek6/use_retail_brokerage_app_public/,1611860552.0,"{'author': 'Wild_out_west', 'created_utc': 1611860552, 'title': 'Use Retail Brokerage App, Public', 'url': 'https://www.reddit.com/r/wallstreetbets/comments/l75ek6/use_retail_brokerage_app_public/', 'created': 1611860552.0}",2021-01-28 19:02:32
52,OhTehNose,1611860551,Merrill Lynch blocks GME,https://www.reddit.com/r/wallstreetbets/comments/l75ejn/merrill_lynch_blocks_gme/,1611860551.0,"{'author': 'OhTehNose', 'created_utc': 1611860551, 'title': 'Merrill Lynch blocks GME', 'url': 'https://www.reddit.com/r/wallstreetbets/comments/l75ejn/merrill_lynch_blocks_gme/', 'created': 1611860551.0}",2021-01-28 19:02:31
53,sweetdoggygerald,1611860551,"I wrote a battle-hymn for you all, my heroes. GME 🚀🚀🚀🚀🚀🚀🚀",https://www.reddit.com/r/wallstreetbets/comments/l75ej7/i_wrote_a_battlehymn_for_you_all_my_heroes_gme/,1611860551.0,"{'author': 'sweetdoggygerald', 'created_utc': 1611860551, 'title': 'I wrote a battle-hymn for you all, my heroes. GME 🚀🚀🚀🚀🚀🚀🚀', 'url': 'https://www.reddit.com/r/wallstreetbets/comments/l75ej7/i_wrote_a_battlehymn_for_you_all_my_heroes_gme/', 'created': 1611860551.0}",2021-01-28 19:02:31
54,Flameznix,1611860551,Should We be worried and start creating a better platform cause these dipshits could try strongarming reddit next to get rid of the subreddit,https://www.reddit.com/r/wallstreetbets/comments/l75ej5/should_we_be_worried_and_start_creating_a_better/,1611860551.0,"{'author': 'Flameznix', 'created_utc': 1611860551, 'title': 'Should We be worried and start creating a better platform cause these dipshits could try strongarming reddit next to get rid of the subreddit', 'url': 'https://www.reddit.com/r/wallstreetbets/comments/l75ej5/should_we_be_worried_and_start_creating_a_better/', 'created': 1611860551.0}",2021-01-28 19:02:31
55,A_MALE_FALAFEL_AMA,1611860550,Someone is deleting all App Store reviews for RobinHood. Latest reviews are from yesterday.,https://i.imgur.com/OgKUFZ8.jpg,1611860550.0,"{'author': 'A_MALE_FALAFEL_AMA', 'created_utc': 1611860550, 'title': 'Someone is deleting all App Store reviews for RobinHood. Latest reviews are from yesterday.', 'url': 'https://i.imgur.com/OgKUFZ8.jpg', 'created': 1611860550.0}",2021-01-28 19:02:30
56,DonnyBoy999,1611860550,How about MJNA stock?,https://www.reddit.com/r/wallstreetbets/comments/l75eio/how_about_mjna_stock/,1611860550.0,"{'author': 'DonnyBoy999', 'created_utc': 1611860550, 'title': 'How about MJNA stock?', 'url': 'https://www.reddit.com/r/wallstreetbets/comments/l75eio/how_about_mjna_stock/', 'created': 1611860550.0}",2021-01-28 19:02:30
57,RauLeCreuzet,1611860550,Robinhood force closing positions - delete if repost,https://www.reddit.com/r/wallstreetbets/comments/l75eim/robinhood_force_closing_positions_delete_if_repost/,1611860550.0,"{'author': 'RauLeCreuzet', 'created_utc': 1611860550, 'title': 'Robinhood force closing positions - delete if repost', 'url': 'https://www.reddit.com/r/wallstreetbets/comments/l75eim/robinhood_force_closing_positions_delete_if_repost/', 'created': 1611860550.0}",2021-01-28 19:02:30
58,baachou,1611860549,Chase YouInvest is still allowing GME trades,https://www.reddit.com/r/wallstreetbets/comments/l75eig/chase_youinvest_is_still_allowing_gme_trades/,1611860549.0,"{'author': 'baachou', 'created_utc': 1611860549, 'title': 'Chase YouInvest is still allowing GME trades', 'url': 'https://www.reddit.com/r/wallstreetbets/comments/l75eig/chase_youinvest_is_still_allowing_gme_trades/', 'created': 1611860549.0}",2021-01-28 19:02:29
59,Wholefooda,1611860549,Bought gme and amc on TD Ameritrade,https://www.reddit.com/r/wallstreetbets/comments/l75eid/bought_gme_and_amc_on_td_ameritrade/,1611860549.0,"{'author': 'Wholefooda', 'created_utc': 1611860549, 'title': 'Bought gme and amc on TD Ameritrade', 'url': 'https://www.reddit.com/r/wallstreetbets/comments/l75eid/bought_gme_and_amc_on_td_ameritrade/', 'created': 1611860549.0}",2021-01-28 19:02:29
