,author,created_utc,title,url,created,d_,created_utc_dt
64,drog00n,1592522650,"So..... who’s going to take one for the team?? A sneeze here, a cough there",https://i.redd.it/doo3tm7y5r551.jpg,1592522650.0,"{'author': 'drog00n', 'created_utc': 1592522650, 'title': 'So..... who’s going to take one for the team?? A sneeze here, a cough there', 'url': 'https://i.redd.it/doo3tm7y5r551.jpg', 'created': 1592522650.0}",2020-06-18 23:24:10
65,adam73810,1592522635,Have there been any posts about this yet?,https://i.redd.it/453biukw5r551.jpg,1592522635.0,"{'author': 'adam73810', 'created_utc': 1592522635, 'title': 'Have there been any posts about this yet?', 'url': 'https://i.redd.it/453biukw5r551.jpg', 'created': 1592522635.0}",2020-06-18 23:23:55
66,Dudebroha1,1592522593,Economy Taking Off!,https://www.reddit.com/r/wallstreetbets/comments/hbpeqy/economy_taking_off/,1592522593.0,"{'author': 'Dudebroha1', 'created_utc': 1592522593, 'title': 'Economy Taking Off!', 'url': 'https://www.reddit.com/r/wallstreetbets/comments/hbpeqy/economy_taking_off/', 'created': 1592522593.0}",2020-06-18 23:23:13
67,hertzgoesbrrr,1592522459,Does the username check out or what,https://www.reddit.com/r/wallstreetbets/comments/hbpdec/does_the_username_check_out_or_what/,1592522459.0,"{'author': 'hertzgoesbrrr', 'created_utc': 1592522459, 'title': 'Does the username check out or what', 'url': 'https://www.reddit.com/r/wallstreetbets/comments/hbpdec/does_the_username_check_out_or_what/', 'created': 1592522459.0}",2020-06-18 23:20:59
68,prateek33,1592522450,Anyone read this yet? https://www.kron4.com/news/national/illinois-man-takes-own-life-after-seeing-730k-negative-balance-on-investment-app/?fbclid=IwAR2zY_fdaIgzvtOBUgHipS_0PNMAEzGd_0kddZ1ye337tg3zo5Y7SZuIyyY,https://www.reddit.com/r/wallstreetbets/comments/hbpdb6/anyone_read_this_yet/,1592522450.0,"{'author': 'prateek33', 'created_utc': 1592522450, 'title': 'Anyone read this yet? https://www.kron4.com/news/national/illinois-man-takes-own-life-after-seeing-730k-negative-balance-on-investment-app/?fbclid=IwAR2zY_fdaIgzvtOBUgHipS_0PNMAEzGd_0kddZ1ye337tg3zo5Y7SZuIyyY', 'url': 'https://www.reddit.com/r/wallstreetbets/comments/hbpdb6/anyone_read_this_yet/', 'created': 1592522450.0}",2020-06-18 23:20:50
69,zabumafu369,1592522233,Divide and conquer,https://www.reddit.com/r/wallstreetbets/comments/hbpb5m/divide_and_conquer/,1592522233.0,"{'author': 'zabumafu369', 'created_utc': 1592522233, 'title': 'Divide and conquer', 'url': 'https://www.reddit.com/r/wallstreetbets/comments/hbpb5m/divide_and_conquer/', 'created': 1592522233.0}",2020-06-18 23:17:13
70,theSoftwareDev95,1592522202,Starting my stock market journey,https://www.reddit.com/r/wallstreetbets/comments/hbpauu/starting_my_stock_market_journey/,1592522202.0,"{'author': 'theSoftwareDev95', 'created_utc': 1592522202, 'title': 'Starting my stock market journey', 'url': 'https://www.reddit.com/r/wallstreetbets/comments/hbpauu/starting_my_stock_market_journey/', 'created': 1592522202.0}",2020-06-18 23:16:42
71,BurningTree50,1592522147,Donnie the Pump-master rambling off every single state receiving the $1.5 Trillion for infrastructure,https://i.redd.it/aw3yu9dg4r551.jpg,1592522147.0,"{'author': 'BurningTree50', 'created_utc': 1592522147, 'title': 'Donnie the Pump-master rambling off every single state receiving the $1.5 Trillion for infrastructure', 'url': 'https://i.redd.it/aw3yu9dg4r551.jpg', 'created': 1592522147.0}",2020-06-18 23:15:47
72,WaggishImpresario,1592522102,Can I do this if i'm already in a chapter 13 bankruptcy?,https://www.reddit.com/r/wallstreetbets/comments/hbp9sk/can_i_do_this_if_im_already_in_a_chapter_13/,1592522102.0,"{'author': 'WaggishImpresario', 'created_utc': 1592522102, 'title': ""Can I do this if i'm already in a chapter 13 bankruptcy?"", 'url': 'https://www.reddit.com/r/wallstreetbets/comments/hbp9sk/can_i_do_this_if_im_already_in_a_chapter_13/', 'created': 1592522102.0}",2020-06-18 23:15:02
73,flaccid_flan_licker,1592522008,"RIP, fellow autist",http://www.forbes.com/sites/sergeiklebnikov/2020/06/17/20-year-old-robinhood-customer-commits-suicide-after-seeing-a-730000-negative-balance,1592522008.0,"{'author': 'flaccid_flan_licker', 'created_utc': 1592522008, 'title': 'RIP, fellow autist', 'url': 'http://www.forbes.com/sites/sergeiklebnikov/2020/06/17/20-year-old-robinhood-customer-commits-suicide-after-seeing-a-730000-negative-balance', 'created': 1592522008.0}",2020-06-18 23:13:28
74,ImMoeLester,1592521998,JPOW TAKING BODYBAGS 🌈🐻 https://www.google.com/amp/s/www.forbes.com/sites/sergeiklebnikov/2020/06/17/20-year-old-robinhood-customer-commits-suicide-after-seeing-a-730000-negative-balance/amp/,https://i.redd.it/411n2ne04r551.jpg,1592521998.0,"{'author': 'ImMoeLester', 'created_utc': 1592521998, 'title': 'JPOW TAKING BODYBAGS 🌈🐻 https://www.google.com/amp/s/www.forbes.com/sites/sergeiklebnikov/2020/06/17/20-year-old-robinhood-customer-commits-suicide-after-seeing-a-730000-negative-balance/amp/', 'url': 'https://i.redd.it/411n2ne04r551.jpg', 'created': 1592521998.0}",2020-06-18 23:13:18
75,thatboynico,1592521981,A.I Options Trading Bot,https://www.reddit.com/r/wallstreetbets/comments/hbp8i7/ai_options_trading_bot/,1592521981.0,"{'author': 'thatboynico', 'created_utc': 1592521981, 'title': 'A.I Options Trading Bot', 'url': 'https://www.reddit.com/r/wallstreetbets/comments/hbp8i7/ai_options_trading_bot/', 'created': 1592521981.0}",2020-06-18 23:13:01
76,coopd3loop,1592521903,JPow: Coin printer go brrrr,https://i.redd.it/x7fq0ubq3r551.jpg,1592521903.0,"{'author': 'coopd3loop', 'created_utc': 1592521903, 'title': 'JPow: Coin printer go brrrr', 'url': 'https://i.redd.it/x7fq0ubq3r551.jpg', 'created': 1592521903.0}",2020-06-18 23:11:43
77,Breezy_t,1592521730,"20-Year-Old Robinhood Customer Dies By Suicide After Seeing A $730,000 Negative Balance Shit are we all on suicide watch now?",https://www.reddit.com/r/wallstreetbets/comments/hbp61h/20yearold_robinhood_customer_dies_by_suicide/,1592521730.0,"{'author': 'Breezy_t', 'created_utc': 1592521730, 'title': '20-Year-Old Robinhood Customer Dies By Suicide After Seeing A $730,000 Negative Balance Shit are we all on suicide watch now?', 'url': 'https://www.reddit.com/r/wallstreetbets/comments/hbp61h/20yearold_robinhood_customer_dies_by_suicide/', 'created': 1592521730.0}",2020-06-18 23:08:50
78,RCC909,1592521685,Covid and Wall Street inverse,https://www.reddit.com/r/wallstreetbets/comments/hbp5lp/covid_and_wall_street_inverse/,1592521685.0,"{'author': 'RCC909', 'created_utc': 1592521685, 'title': 'Covid and Wall Street inverse', 'url': 'https://www.reddit.com/r/wallstreetbets/comments/hbp5lp/covid_and_wall_street_inverse/', 'created': 1592521685.0}",2020-06-18 23:08:05
79,Evenwealth,1592521544,As soon as I buy options...,https://i.redd.it/pkm83ewn2r551.jpg,1592521544.0,"{'author': 'Evenwealth', 'created_utc': 1592521544, 'title': 'As soon as I buy options...', 'url': 'https://i.redd.it/pkm83ewn2r551.jpg', 'created': 1592521544.0}",2020-06-18 23:05:44
80,iiterator,1592521094,Metal Bear Solid,https://v.redd.it/cy9nkhv90r551,1592521094.0,"{'author': 'iiterator', 'created_utc': 1592521094, 'title': 'Metal Bear Solid', 'url': 'https://v.redd.it/cy9nkhv90r551', 'created': 1592521094.0}",2020-06-18 22:58:14
81,aiceberg,1592521071,My one month forecast,https://www.reddit.com/r/wallstreetbets/comments/hboza9/my_one_month_forecast/,1592521071.0,"{'author': 'aiceberg', 'created_utc': 1592521071, 'title': 'My one month forecast', 'url': 'https://www.reddit.com/r/wallstreetbets/comments/hboza9/my_one_month_forecast/', 'created': 1592521071.0}",2020-06-18 22:57:51
82,snortstonks,1592520990,Short-selled for the first time — do I belong here?,https://i.redd.it/lt5qwv2d0r551.png,1592520990.0,"{'author': 'snortstonks', 'created_utc': 1592520990, 'title': 'Short-selled for the first time — do I belong here?', 'url': 'https://i.redd.it/lt5qwv2d0r551.png', 'created': 1592520990.0}",2020-06-18 22:56:30
83,ImWellEndowed,1592520956,Who are you to take your profits and leave,https://www.reddit.com/r/wallstreetbets/comments/hboy6x/who_are_you_to_take_your_profits_and_leave/,1592520956.0,"{'author': 'ImWellEndowed', 'created_utc': 1592520956, 'title': 'Who are you to take your profits and leave', 'url': 'https://www.reddit.com/r/wallstreetbets/comments/hboy6x/who_are_you_to_take_your_profits_and_leave/', 'created': 1592520956.0}",2020-06-18 22:55:56
84,JackShepardOfficial,1592520821,"Robhinhood 23 yr old goes Bankrupt, Commits Suicide",https://www.reddit.com/r/wallstreetbets/comments/hbowtu/robhinhood_23_yr_old_goes_bankrupt_commits_suicide/,1592520821.0,"{'author': 'JackShepardOfficial', 'created_utc': 1592520821, 'title': 'Robhinhood 23 yr old goes Bankrupt, Commits Suicide', 'url': 'https://www.reddit.com/r/wallstreetbets/comments/hbowtu/robhinhood_23_yr_old_goes_bankrupt_commits_suicide/', 'created': 1592520821.0}",2020-06-18 22:53:41
85,confusedtaco,1592520726,All of WSB trying to make money this week,https://i.redd.it/23nk7f980r551.jpg,1592520726.0,"{'author': 'confusedtaco', 'created_utc': 1592520726, 'title': 'All of WSB trying to make money this week', 'url': 'https://i.redd.it/23nk7f980r551.jpg', 'created': 1592520726.0}",2020-06-18 22:52:06
86,purplemashpotato,1592520669,Robinhood cheat code! Remove red mode in settings by saying you're color blind. No more losses!,https://i.redd.it/j0jp52620r551.jpg,1592520669.0,"{'author': 'purplemashpotato', 'created_utc': 1592520669, 'title': ""Robinhood cheat code! Remove red mode in settings by saying you're color blind. No more losses!"", 'url': 'https://i.redd.it/j0jp52620r551.jpg', 'created': 1592520669.0}",2020-06-18 22:51:09
87,RCC909,1592520622,Infectious disease doctor tells me directly Los Angeles hospital visits where he practices are shooting up rapidly,https://i.redd.it/iab55z4xzq551.jpg,1592520622.0,"{'author': 'RCC909', 'created_utc': 1592520622, 'title': 'Infectious disease doctor tells me directly Los Angeles hospital visits where he practices are shooting up rapidly', 'url': 'https://i.redd.it/iab55z4xzq551.jpg', 'created': 1592520622.0}",2020-06-18 22:50:22
88,Derpinator_30,1592520607,I own Warren Buffet,https://www.reddit.com/r/wallstreetbets/comments/hboulz/i_own_warren_buffet/,1592520607.0,"{'author': 'Derpinator_30', 'created_utc': 1592520607, 'title': 'I own Warren Buffet', 'url': 'https://www.reddit.com/r/wallstreetbets/comments/hboulz/i_own_warren_buffet/', 'created': 1592520607.0}",2020-06-18 22:50:07
89,bfvplanetryhard,1592520502,Put 3k into UNOEK earlier today at 3.79/share,https://i.redd.it/52iuv85kzq551.jpg,1592520502.0,"{'author': 'bfvplanetryhard', 'created_utc': 1592520502, 'title': 'Put 3k into UNOEK earlier today at 3.79/share', 'url': 'https://i.redd.it/52iuv85kzq551.jpg', 'created': 1592520502.0}",2020-06-18 22:48:22
90,The_Power_of_Ammonia,1592520232,I've never heard of this [smol]PP capital management before. Is there any reason to believe these assholes? Am I retarded? Is ENPH about to get delisted?,https://www.presciencepoint.com/research/research-archives/enphase-energy-fraud/,1592520232.0,"{'author': 'The_Power_of_Ammonia', 'created_utc': 1592520232, 'title': ""I've never heard of this [smol]PP capital management before. Is there any reason to believe these assholes? Am I retarded? Is ENPH about to get delisted?"", 'url': 'https://www.presciencepoint.com/research/research-archives/enphase-energy-fraud/', 'created': 1592520232.0}",2020-06-18 22:43:52
91,DetectiveKAy_01,1592520138,Soooo how has everyone’s day been?,https://i.redd.it/3d5k2qbhyq551.jpg,1592520138.0,"{'author': 'DetectiveKAy_01', 'created_utc': 1592520138, 'title': 'Soooo how has everyone’s day been?', 'url': 'https://i.redd.it/3d5k2qbhyq551.jpg', 'created': 1592520138.0}",2020-06-18 22:42:18
92,Peanutbuttered,1592519772,Robinhood's Spread-Closing Design Oversight Lead Someone to Ki11 Themselves (And how RH can prevent this from happening again with 5 minutes of coding),https://www.reddit.com/r/wallstreetbets/comments/hbomef/robinhoods_spreadclosing_design_oversight_lead/,1592519772.0,"{'author': 'Peanutbuttered', 'created_utc': 1592519772, 'title': ""Robinhood's Spread-Closing Design Oversight Lead Someone to Ki11 Themselves (And how RH can prevent this from happening again with 5 minutes of coding)"", 'url': 'https://www.reddit.com/r/wallstreetbets/comments/hbomef/robinhoods_spreadclosing_design_oversight_lead/', 'created': 1592519772.0}",2020-06-18 22:36:12
93,devintravels23,1592519640,Zynerba Pharm ZYNE Recent Press,https://www.reddit.com/r/wallstreetbets/comments/hbol38/zynerba_pharm_zyne_recent_press/,1592519640.0,"{'author': 'devintravels23', 'created_utc': 1592519640, 'title': 'Zynerba Pharm ZYNE Recent Press', 'url': 'https://www.reddit.com/r/wallstreetbets/comments/hbol38/zynerba_pharm_zyne_recent_press/', 'created': 1592519640.0}",2020-06-18 22:34:00
94,kerplunckk,1592519596,Be careful and don't follow everything you see here,https://www.reddit.com/r/wallstreetbets/comments/hbokjw/be_careful_and_dont_follow_everything_you_see_here/,1592519596.0,"{'author': 'kerplunckk', 'created_utc': 1592519596, 'title': ""Be careful and don't follow everything you see here"", 'url': 'https://www.reddit.com/r/wallstreetbets/comments/hbokjw/be_careful_and_dont_follow_everything_you_see_here/', 'created': 1592519596.0}",2020-06-18 22:33:16
95,NitilusBeanus,1592519431,Someone from my school died because of RH,https://www.reddit.com/r/wallstreetbets/comments/hboixh/someone_from_my_school_died_because_of_rh/,1592519431.0,"{'author': 'NitilusBeanus', 'created_utc': 1592519431, 'title': 'Someone from my school died because of RH', 'url': 'https://www.reddit.com/r/wallstreetbets/comments/hboixh/someone_from_my_school_died_because_of_rh/', 'created': 1592519431.0}",2020-06-18 22:30:31
96,evan3825,1592519424,Will the real RobinTrack.net please stand up.,https://www.reddit.com/r/wallstreetbets/comments/hboiva/will_the_real_robintracknet_please_stand_up/,1592519424.0,"{'author': 'evan3825', 'created_utc': 1592519424, 'title': 'Will the real RobinTrack.net please stand up.', 'url': 'https://www.reddit.com/r/wallstreetbets/comments/hboiva/will_the_real_robintracknet_please_stand_up/', 'created': 1592519424.0}",2020-06-18 22:30:24
97,nudedirection,1592519239,Funeral services will be held on WSB this Friday at noon,https://i.redd.it/bhrdqw3tvq551.jpg,1592519239.0,"{'author': 'nudedirection', 'created_utc': 1592519239, 'title': 'Funeral services will be held on WSB this Friday at noon', 'url': 'https://i.redd.it/bhrdqw3tvq551.jpg', 'created': 1592519239.0}",2020-06-18 22:27:19
98,Phenom462,1592518734,Arizona casinos closing down again,https://www.reddit.com/r/wallstreetbets/comments/hbobr2/arizona_casinos_closing_down_again/,1592518734.0,"{'author': 'Phenom462', 'created_utc': 1592518734, 'title': 'Arizona casinos closing down again', 'url': 'https://www.reddit.com/r/wallstreetbets/comments/hbobr2/arizona_casinos_closing_down_again/', 'created': 1592518734.0}",2020-06-18 22:18:54
99,iamnitamyth,1592518661,"20-Year-Old Robinhood Customer Dies By Suicide After Seeing A $730,000 Negative Balance",https://i.redd.it/rv6mbc73uq551.jpg,1592518661.0,"{'author': 'iamnitamyth', 'created_utc': 1592518661, 'title': '20-Year-Old Robinhood Customer Dies By Suicide After Seeing A $730,000 Negative Balance', 'url': 'https://i.redd.it/rv6mbc73uq551.jpg', 'created': 1592518661.0}",2020-06-18 22:17:41
