,author,created_utc,title,url,created,d_,created_utc_dt
0,Uela4BnE,1611851301,Trying to hold AMC,https://www.reddit.com/r/wallstreetbets/comments/l71dah/trying_to_hold_amc/,1611851301.0,"{'author': 'Uela4BnE', 'created_utc': 1611851301, 'title': 'Trying to hold AMC', 'url': 'https://www.reddit.com/r/wallstreetbets/comments/l71dah/trying_to_hold_amc/', 'created': 1611851301.0}",2021-01-28 16:28:21
1,onionandbananajuice,1611851301,I'm HODL. Down 600 YTD but they can't shake these 💎🖐️,https://www.reddit.com/r/wallstreetbets/comments/l71dac/im_hodl_down_600_ytd_but_they_cant_shake_these/,1611851301.0,"{'author': 'onionandbananajuice', 'created_utc': 1611851301, 'title': ""I'm HODL. Down 600 YTD but they can't shake these 💎🖐️"", 'url': 'https://www.reddit.com/r/wallstreetbets/comments/l71dac/im_hodl_down_600_ytd_but_they_cant_shake_these/', 'created': 1611851301.0}",2021-01-28 16:28:21
2,lilpipijj,1611851301,F*ck Robinhood,http://chng.it/5ZxpXZxbbr,1611851301.0,"{'author': 'lilpipijj', 'created_utc': 1611851301, 'title': 'F*ck Robinhood', 'url': 'http://chng.it/5ZxpXZxbbr', 'created': 1611851301.0}",2021-01-28 16:28:21
3,GetOffTheInternet123,1611851301,Revenge Time,https://www.reddit.com/r/wallstreetbets/comments/l71da6/revenge_time/,1611851301.0,"{'author': 'GetOffTheInternet123', 'created_utc': 1611851301, 'title': 'Revenge Time', 'url': 'https://www.reddit.com/r/wallstreetbets/comments/l71da6/revenge_time/', 'created': 1611851301.0}",2021-01-28 16:28:21
4,shadow_clone69,1611851300,"OWNERS OF ROBINHOOD ARE ALSO THE OWNERS OF MELVIN CAPITAL. DONT GIVE INTO THE FEAR BEING INDUCED. We're on the moon, Uranus is within arms reach. Hodlllllll 🚀🚀🚀🚀🚀🚀🚀🚀🚀",https://www.reddit.com/r/wallstreetbets/comments/l71d9y/owners_of_robinhood_are_also_the_owners_of_melvin/,1611851300.0,"{'author': 'shadow_clone69', 'created_utc': 1611851300, 'title': ""OWNERS OF ROBINHOOD ARE ALSO THE OWNERS OF MELVIN CAPITAL. DONT GIVE INTO THE FEAR BEING INDUCED. We're on the moon, Uranus is within arms reach. Hodlllllll 🚀🚀🚀🚀🚀🚀🚀🚀🚀"", 'url': 'https://www.reddit.com/r/wallstreetbets/comments/l71d9y/owners_of_robinhood_are_also_the_owners_of_melvin/', 'created': 1611851300.0}",2021-01-28 16:28:20
5,No_Possibility_9299,1611851300,Robinhood Preventing Searches,https://www.reddit.com/r/wallstreetbets/comments/l71d9x/robinhood_preventing_searches/,1611851300.0,"{'author': 'No_Possibility_9299', 'created_utc': 1611851300, 'title': 'Robinhood Preventing Searches', 'url': 'https://www.reddit.com/r/wallstreetbets/comments/l71d9x/robinhood_preventing_searches/', 'created': 1611851300.0}",2021-01-28 16:28:20
6,Andgeo170,1611851300,The OG GME Holders will hold.,https://www.reddit.com/r/wallstreetbets/comments/l71d9u/the_og_gme_holders_will_hold/,1611851300.0,"{'author': 'Andgeo170', 'created_utc': 1611851300, 'title': 'The OG GME Holders will hold.', 'url': 'https://www.reddit.com/r/wallstreetbets/comments/l71d9u/the_og_gme_holders_will_hold/', 'created': 1611851300.0}",2021-01-28 16:28:20
7,cooperdoodlerooster,1611851300,Bought 10 shares @ $457,https://www.reddit.com/r/wallstreetbets/comments/l71d9s/bought_10_shares_457/,1611851300.0,"{'author': 'cooperdoodlerooster', 'created_utc': 1611851300, 'title': 'Bought 10 shares @ $457', 'url': 'https://www.reddit.com/r/wallstreetbets/comments/l71d9s/bought_10_shares_457/', 'created': 1611851300.0}",2021-01-28 16:28:20
8,ProtectTheVetsRights,1611851299,I don’t know why my post didn’t go up earlier here is a way to see GME still not possible to buy though because of RH’s market manipulation tactic,https://www.reddit.com/,1611851299.0,"{'author': 'ProtectTheVetsRights', 'created_utc': 1611851299, 'title': 'I don’t know why my post didn’t go up earlier here is a way to see GME still not possible to buy though because of RH’s market manipulation tactic', 'url': 'https://www.reddit.com/', 'created': 1611851299.0}",2021-01-28 16:28:19
9,mavyapsy,1611851299,Open letter to NASDAQ and SEC,https://www.reddit.com/r/wallstreetbets/comments/l71d99/open_letter_to_nasdaq_and_sec/,1611851299.0,"{'author': 'mavyapsy', 'created_utc': 1611851299, 'title': 'Open letter to NASDAQ and SEC', 'url': 'https://www.reddit.com/r/wallstreetbets/comments/l71d99/open_letter_to_nasdaq_and_sec/', 'created': 1611851299.0}",2021-01-28 16:28:19
10,uknowwha,1611851299,Israeli retards listen up! All Israeli broker apps let us buy GME - BUY THE FUCKING DIP AND HOLD! 3200 ILS LETS GOOOOO,https://www.reddit.com/r/wallstreetbets/comments/l71d97/israeli_retards_listen_up_all_israeli_broker_apps/,1611851299.0,"{'author': 'uknowwha', 'created_utc': 1611851299, 'title': 'Israeli retards listen up! All Israeli broker apps let us buy GME - BUY THE FUCKING DIP AND HOLD! 3200 ILS LETS GOOOOO', 'url': 'https://www.reddit.com/r/wallstreetbets/comments/l71d97/israeli_retards_listen_up_all_israeli_broker_apps/', 'created': 1611851299.0}",2021-01-28 16:28:19
11,Cybx,1611851299,DON'T LET THE DIRTY FUCKING TACTICS SCARE YOU INTO SELLING!!!,https://www.reddit.com/r/wallstreetbets/comments/l71d93/dont_let_the_dirty_fucking_tactics_scare_you_into/,1611851299.0,"{'author': 'Cybx', 'created_utc': 1611851299, 'title': ""DON'T LET THE DIRTY FUCKING TACTICS SCARE YOU INTO SELLING!!!"", 'url': 'https://www.reddit.com/r/wallstreetbets/comments/l71d93/dont_let_the_dirty_fucking_tactics_scare_you_into/', 'created': 1611851299.0}",2021-01-28 16:28:19
12,TurntPizzaBoi,1611851298,BB RALLYING GROUP (We like this stock),https://www.reddit.com/r/wallstreetbets/comments/l71d91/bb_rallying_group_we_like_this_stock/,1611851298.0,"{'author': 'TurntPizzaBoi', 'created_utc': 1611851298, 'title': 'BB RALLYING GROUP (We like this stock)', 'url': 'https://www.reddit.com/r/wallstreetbets/comments/l71d91/bb_rallying_group_we_like_this_stock/', 'created': 1611851298.0}",2021-01-28 16:28:18
13,MikeAlfaNovemberU,1611851298,FOCUS JUST NAKED,https://www.reddit.com/r/wallstreetbets/comments/l71d8x/focus_just_naked/,1611851298.0,"{'author': 'MikeAlfaNovemberU', 'created_utc': 1611851298, 'title': 'FOCUS JUST NAKED', 'url': 'https://www.reddit.com/r/wallstreetbets/comments/l71d8x/focus_just_naked/', 'created': 1611851298.0}",2021-01-28 16:28:18
14,Instagrams609,1611851298,😳,https://www.reddit.com/r/wallstreetbets/comments/l71d8s/_/,1611851298.0,"{'author': 'Instagrams609', 'created_utc': 1611851298, 'title': '😳', 'url': 'https://www.reddit.com/r/wallstreetbets/comments/l71d8s/_/', 'created': 1611851298.0}",2021-01-28 16:28:18
15,linux-boi,1611851298,Join It,https://www.reddit.com/r/wallstreetbets/comments/l71d8p/join_it/,1611851298.0,"{'author': 'linux-boi', 'created_utc': 1611851298, 'title': 'Join It', 'url': 'https://www.reddit.com/r/wallstreetbets/comments/l71d8p/join_it/', 'created': 1611851298.0}",2021-01-28 16:28:18
16,MadmanDM,1611851297,The RobinHood CEO just went to Men’s Wearhouse and bought a SUIT!,https://www.reddit.com/r/wallstreetbets/comments/l71d82/the_robinhood_ceo_just_went_to_mens_wearhouse_and/,1611851297.0,"{'author': 'MadmanDM', 'created_utc': 1611851297, 'title': 'The RobinHood CEO just went to Men’s Wearhouse and bought a SUIT!', 'url': 'https://www.reddit.com/r/wallstreetbets/comments/l71d82/the_robinhood_ceo_just_went_to_mens_wearhouse_and/', 'created': 1611851297.0}",2021-01-28 16:28:17
17,WickedSensitiveCrew,1611851297,"The stocks Robinhood is limiting to position closing only are $AAL, $AMC, $BB, $BBY, $CTRM, $EXPR, $GME, $KOSS, $NAKD, $NOK, $SNDL, $TR, and $TRVG",https://www.reddit.com/r/wallstreetbets/comments/l71d80/the_stocks_robinhood_is_limiting_to_position/,1611851297.0,"{'author': 'WickedSensitiveCrew', 'created_utc': 1611851297, 'title': 'The stocks Robinhood is limiting to position closing only are $AAL, $AMC, $BB, $BBY, $CTRM, $EXPR, $GME, $KOSS, $NAKD, $NOK, $SNDL, $TR, and $TRVG', 'url': 'https://www.reddit.com/r/wallstreetbets/comments/l71d80/the_stocks_robinhood_is_limiting_to_position/', 'created': 1611851297.0}",2021-01-28 16:28:17
18,itsblakewtf,1611851296,holding 😔🍿,https://www.reddit.com/r/wallstreetbets/comments/l71d7r/holding/,1611851296.0,"{'author': 'itsblakewtf', 'created_utc': 1611851296, 'title': 'holding 😔🍿', 'url': 'https://www.reddit.com/r/wallstreetbets/comments/l71d7r/holding/', 'created': 1611851296.0}",2021-01-28 16:28:16
19,ohyesimthatguy,1611851296,"Y'all, we knew this was going to happen. Don't freak out and stick to the plan. They're doing everything they can to drop the price. If anything buy more while it's lower. I just submitted an order on Fidelity and got part of it fulfilled for GME",https://www.reddit.com/r/wallstreetbets/comments/l71d7n/yall_we_knew_this_was_going_to_happen_dont_freak/,1611851296.0,"{'author': 'ohyesimthatguy', 'created_utc': 1611851296, 'title': ""Y'all, we knew this was going to happen. Don't freak out and stick to the plan. They're doing everything they can to drop the price. If anything buy more while it's lower. I just submitted an order on Fidelity and got part of it fulfilled for GME"", 'url': 'https://www.reddit.com/r/wallstreetbets/comments/l71d7n/yall_we_knew_this_was_going_to_happen_dont_freak/', 'created': 1611851296.0}",2021-01-28 16:28:16
20,Hoosker_Dos,1611851295,This has been an eye opening morning.,https://www.reddit.com/r/wallstreetbets/comments/l71d7h/this_has_been_an_eye_opening_morning/,1611851295.0,"{'author': 'Hoosker_Dos', 'created_utc': 1611851295, 'title': 'This has been an eye opening morning.', 'url': 'https://www.reddit.com/r/wallstreetbets/comments/l71d7h/this_has_been_an_eye_opening_morning/', 'created': 1611851295.0}",2021-01-28 16:28:15
21,ephale1,1611851295,Leave Robinhood,https://www.reddit.com/r/wallstreetbets/comments/l71d7d/leave_robinhood/,1611851295.0,"{'author': 'ephale1', 'created_utc': 1611851295, 'title': 'Leave Robinhood', 'url': 'https://www.reddit.com/r/wallstreetbets/comments/l71d7d/leave_robinhood/', 'created': 1611851295.0}",2021-01-28 16:28:15
22,Frosty-Requirement70,1611851295,COP STONKS,https://www.reddit.com/r/wallstreetbets/comments/l71d7c/cop_stonks/,1611851295.0,"{'author': 'Frosty-Requirement70', 'created_utc': 1611851295, 'title': 'COP STONKS', 'url': 'https://www.reddit.com/r/wallstreetbets/comments/l71d7c/cop_stonks/', 'created': 1611851295.0}",2021-01-28 16:28:15
23,Hofmeister_the_3rd,1611851295,Can you buy GME on Etoro? I'm in the UK and I can. Holding my position.,https://www.google.com/search?q=is+etoro+available+in+the+us&amp;oq=is+etoro&amp;aqs=chrome.1.69i57j35i39j0i67i131i433j0i131i433l2.2416j0j4&amp;client=ms-android-h3g-gb-revc&amp;sourceid=chrome-mobile&amp;ie=UTF-8,1611851295.0,"{'author': 'Hofmeister_the_3rd', 'created_utc': 1611851295, 'title': ""Can you buy GME on Etoro? I'm in the UK and I can. Holding my position."", 'url': 'https://www.google.com/search?q=is+etoro+available+in+the+us&amp;oq=is+etoro&amp;aqs=chrome.1.69i57j35i39j0i67i131i433j0i131i433l2.2416j0j4&amp;client=ms-android-h3g-gb-revc&amp;sourceid=chrome-mobile&amp;ie=UTF-8', 'created': 1611851295.0}",2021-01-28 16:28:15
24,UltraWolf88,1611851295,Let’s rate Robinhood on google play store and Apple Store.,https://www.reddit.com/r/wallstreetbets/comments/l71d7a/lets_rate_robinhood_on_google_play_store_and/,1611851295.0,"{'author': 'UltraWolf88', 'created_utc': 1611851295, 'title': 'Let’s rate Robinhood on google play store and Apple Store.', 'url': 'https://www.reddit.com/r/wallstreetbets/comments/l71d7a/lets_rate_robinhood_on_google_play_store_and/', 'created': 1611851295.0}",2021-01-28 16:28:15
25,tbw2012,1611851295,DOGE,https://www.reddit.com/r/wallstreetbets/comments/l71d6x/doge/,1611851295.0,"{'author': 'tbw2012', 'created_utc': 1611851295, 'title': 'DOGE', 'url': 'https://www.reddit.com/r/wallstreetbets/comments/l71d6x/doge/', 'created': 1611851295.0}",2021-01-28 16:28:15
26,Realistic-Courage356,1611851294,Bogus asl,https://i.redd.it/v3ep4ilxn3e61.jpg,1611851294.0,"{'author': 'Realistic-Courage356', 'created_utc': 1611851294, 'title': 'Bogus asl', 'url': 'https://i.redd.it/v3ep4ilxn3e61.jpg', 'created': 1611851294.0}",2021-01-28 16:28:14
27,SajjidAhamed,1611851294,"Out $545 in GME and AMC. not upset about losing the money, more upset about how the Everyman can’t do what the rich have been doing consistently. How is this not a bigger topic in media???",https://www.reddit.com/r/wallstreetbets/comments/l71d6u/out_545_in_gme_and_amc_not_upset_about_losing_the/,1611851294.0,"{'author': 'SajjidAhamed', 'created_utc': 1611851294, 'title': 'Out $545 in GME and AMC. not upset about losing the money, more upset about how the Everyman can’t do what the rich have been doing consistently. How is this not a bigger topic in media???', 'url': 'https://www.reddit.com/r/wallstreetbets/comments/l71d6u/out_545_in_gme_and_amc_not_upset_about_losing_the/', 'created': 1611851294.0}",2021-01-28 16:28:14
28,destructordio,1611851293,Fucking terrified (but holding,https://i.redd.it/cneyihgxn3e61.jpg,1611851293.0,"{'author': 'destructordio', 'created_utc': 1611851293, 'title': 'Fucking terrified (but holding', 'url': 'https://i.redd.it/cneyihgxn3e61.jpg', 'created': 1611851293.0}",2021-01-28 16:28:13
29,knuck1e,1611851293,"Anyone try searching for gme, amc, bb, nok on Robinhood....they are not coming up in the search report. They are hiding these stocks!!!",https://www.reddit.com/r/wallstreetbets/comments/l71d5y/anyone_try_searching_for_gme_amc_bb_nok_on/,1611851293.0,"{'author': 'knuck1e', 'created_utc': 1611851293, 'title': 'Anyone try searching for gme, amc, bb, nok on Robinhood....they are not coming up in the search report. They are hiding these stocks!!!', 'url': 'https://www.reddit.com/r/wallstreetbets/comments/l71d5y/anyone_try_searching_for_gme_amc_bb_nok_on/', 'created': 1611851293.0}",2021-01-28 16:28:13
30,mini_trost,1611851293,"We did it, boys. We were rich... but we all know what Robinhood does to the rich.....",https://i.redd.it/a6si479xn3e61.png,1611851293.0,"{'author': 'mini_trost', 'created_utc': 1611851293, 'title': 'We did it, boys. We were rich... but we all know what Robinhood does to the rich.....', 'url': 'https://i.redd.it/a6si479xn3e61.png', 'created': 1611851293.0}",2021-01-28 16:28:13
31,ofkarma,1611851293,"Bought 1000 more $BB, if you’re debating on doing a YOLO play, NOWS THE TIME",https://www.reddit.com/r/wallstreetbets/comments/l71d5u/bought_1000_more_bb_if_youre_debating_on_doing_a/,1611851293.0,"{'author': 'ofkarma', 'created_utc': 1611851293, 'title': 'Bought 1000 more $BB, if you’re debating on doing a YOLO play, NOWS THE TIME', 'url': 'https://www.reddit.com/r/wallstreetbets/comments/l71d5u/bought_1000_more_bb_if_youre_debating_on_doing_a/', 'created': 1611851293.0}",2021-01-28 16:28:13
32,NEEDLESSYELLINGSTUFF,1611851293,Give me tendies or give me death,https://i.redd.it/jsj927dxn3e61.jpg,1611851293.0,"{'author': 'NEEDLESSYELLINGSTUFF', 'created_utc': 1611851293, 'title': 'Give me tendies or give me death', 'url': 'https://i.redd.it/jsj927dxn3e61.jpg', 'created': 1611851293.0}",2021-01-28 16:28:13
33,StonkWrecker,1611851293,Alternate Plan in Response to Market Manipulation by Robinhood,https://www.reddit.com/r/wallstreetbets/comments/l71d5n/alternate_plan_in_response_to_market_manipulation/,1611851293.0,"{'author': 'StonkWrecker', 'created_utc': 1611851293, 'title': 'Alternate Plan in Response to Market Manipulation by Robinhood', 'url': 'https://www.reddit.com/r/wallstreetbets/comments/l71d5n/alternate_plan_in_response_to_market_manipulation/', 'created': 1611851293.0}",2021-01-28 16:28:13
34,Jluude,1611851293,Canadian’s For The Save,https://www.reddit.com/r/wallstreetbets/comments/l71d5m/canadians_for_the_save/,1611851293.0,"{'author': 'Jluude', 'created_utc': 1611851293, 'title': 'Canadian’s For The Save', 'url': 'https://www.reddit.com/r/wallstreetbets/comments/l71d5m/canadians_for_the_save/', 'created': 1611851293.0}",2021-01-28 16:28:13
35,Numero_Jones,1611851293,Just bought more !,https://www.reddit.com/r/wallstreetbets/comments/l71d5j/just_bought_more/,1611851293.0,"{'author': 'Numero_Jones', 'created_utc': 1611851293, 'title': 'Just bought more !', 'url': 'https://www.reddit.com/r/wallstreetbets/comments/l71d5j/just_bought_more/', 'created': 1611851293.0}",2021-01-28 16:28:13
36,v3ryt1r3d,1611851292,"“It’s a big club, and you ain’t in it!” Yellen makes $292,500 from Citadel speech.",https://i.redd.it/imw9u9dxn3e61.jpg,1611851292.0,"{'author': 'v3ryt1r3d', 'created_utc': 1611851292, 'title': '“It’s a big club, and you ain’t in it!” Yellen makes $292,500 from Citadel speech.', 'url': 'https://i.redd.it/imw9u9dxn3e61.jpg', 'created': 1611851292.0}",2021-01-28 16:28:12
37,nessforex,1611851292,"GME, BB... what else?",https://www.reddit.com/r/wallstreetbets/comments/l71d57/gme_bb_what_else/,1611851292.0,"{'author': 'nessforex', 'created_utc': 1611851292, 'title': 'GME, BB... what else?', 'url': 'https://www.reddit.com/r/wallstreetbets/comments/l71d57/gme_bb_what_else/', 'created': 1611851292.0}",2021-01-28 16:28:12
38,johnnycleveland,1611851292,"Make sure you screenshot your loses in GME, AMC, BBBY, BB, NOK, etc. on Robinhood if you have them! It will come in handy when lawsuits are filed against Robinhood for market manipulation",https://www.reddit.com/r/wallstreetbets/comments/l71d52/make_sure_you_screenshot_your_loses_in_gme_amc/,1611851292.0,"{'author': 'johnnycleveland', 'created_utc': 1611851292, 'title': 'Make sure you screenshot your loses in GME, AMC, BBBY, BB, NOK, etc. on Robinhood if you have them! It will come in handy when lawsuits are filed against Robinhood for market manipulation', 'url': 'https://www.reddit.com/r/wallstreetbets/comments/l71d52/make_sure_you_screenshot_your_loses_in_gme_amc/', 'created': 1611851292.0}",2021-01-28 16:28:12
39,cryptodesperate,1611851292,"Why the fear, guys? I am more than ready to buy if it falls below $100, even down to $50",https://www.reddit.com/r/wallstreetbets/comments/l71d50/why_the_fear_guys_i_am_more_than_ready_to_buy_if/,1611851292.0,"{'author': 'cryptodesperate', 'created_utc': 1611851292, 'title': 'Why the fear, guys? I am more than ready to buy if it falls below $100, even down to $50', 'url': 'https://www.reddit.com/r/wallstreetbets/comments/l71d50/why_the_fear_guys_i_am_more_than_ready_to_buy_if/', 'created': 1611851292.0}",2021-01-28 16:28:12
40,yungHenze,1611851292,#guysletsbringitbackontop!!! GERMANY IS SUPPORTING,https://i.redd.it/sirlmibxn3e61.jpg,1611851292.0,"{'author': 'yungHenze', 'created_utc': 1611851292, 'title': '#guysletsbringitbackontop!!! GERMANY IS SUPPORTING', 'url': 'https://i.redd.it/sirlmibxn3e61.jpg', 'created': 1611851292.0}",2021-01-28 16:28:12
41,SHekalla,1611851292,"DONT SELL, LOOK AT THE LAST SHORTSQUEEZE!!!",https://i.redd.it/93qicmbxn3e61.jpg,1611851292.0,"{'author': 'SHekalla', 'created_utc': 1611851292, 'title': 'DONT SELL, LOOK AT THE LAST SHORTSQUEEZE!!!', 'url': 'https://i.redd.it/93qicmbxn3e61.jpg', 'created': 1611851292.0}",2021-01-28 16:28:12
42,mr15o,1611851292,Petition over the barn on trading certain stocks,https://www.reddit.com/r/wallstreetbets/comments/l71d4p/petition_over_the_barn_on_trading_certain_stocks/,1611851292.0,"{'author': 'mr15o', 'created_utc': 1611851292, 'title': 'Petition over the barn on trading certain stocks', 'url': 'https://www.reddit.com/r/wallstreetbets/comments/l71d4p/petition_over_the_barn_on_trading_certain_stocks/', 'created': 1611851292.0}",2021-01-28 16:28:12
43,ricopapio,1611851291,"Off to Fidelity, luckily I had a backup trading account. I have been sitting on the sidelines but still, F them. Not gonna let them do this to us and just walk away.",https://i.redd.it/gj1e3b6xn3e61.jpg,1611851291.0,"{'author': 'ricopapio', 'created_utc': 1611851291, 'title': 'Off to Fidelity, luckily I had a backup trading account. I have been sitting on the sidelines but still, F them. Not gonna let them do this to us and just walk away.', 'url': 'https://i.redd.it/gj1e3b6xn3e61.jpg', 'created': 1611851291.0}",2021-01-28 16:28:11
44,6daddybonez,1611851291,Imagine being a paper handed puss. The squeeze has yet to begin and ppl are willingly losing their money haha.,https://www.reddit.com/r/wallstreetbets/comments/l71d4e/imagine_being_a_paper_handed_puss_the_squeeze_has/,1611851291.0,"{'author': '6daddybonez', 'created_utc': 1611851291, 'title': 'Imagine being a paper handed puss. The squeeze has yet to begin and ppl are willingly losing their money haha.', 'url': 'https://www.reddit.com/r/wallstreetbets/comments/l71d4e/imagine_being_a_paper_handed_puss_the_squeeze_has/', 'created': 1611851291.0}",2021-01-28 16:28:11
45,zqv7,1611851291,IMPORTANT: THERE ARE ONLY 5000 SHARES THAT NEED TO BE BOUGHT FOR GAMESTOP TO BE $400. DO NOT PANIC SELL. MOST OF THE ASKS ARE $400 AND ONLY THE SHORT ATTACK IS DRIVING THE PRICE DOWN.,https://i.redd.it/fs7ho7kqn3e61.png,1611851291.0,"{'author': 'zqv7', 'created_utc': 1611851291, 'title': 'IMPORTANT: THERE ARE ONLY 5000 SHARES THAT NEED TO BE BOUGHT FOR GAMESTOP TO BE $400. DO NOT PANIC SELL. MOST OF THE ASKS ARE $400 AND ONLY THE SHORT ATTACK IS DRIVING THE PRICE DOWN.', 'url': 'https://i.redd.it/fs7ho7kqn3e61.png', 'created': 1611851291.0}",2021-01-28 16:28:11
46,avjk,1611851290,Do you think GME is actually a good investment at these prices?,https://www.reddit.com/r/wallstreetbets/comments/l71d42/do_you_think_gme_is_actually_a_good_investment_at/,1611851290.0,"{'author': 'avjk', 'created_utc': 1611851290, 'title': 'Do you think GME is actually a good investment at these prices?', 'url': 'https://www.reddit.com/r/wallstreetbets/comments/l71d42/do_you_think_gme_is_actually_a_good_investment_at/', 'created': 1611851290.0}",2021-01-28 16:28:10
47,BertSnertBrautworst,1611851290,Class Action,https://www.reddit.com/r/wallstreetbets/comments/l71d3z/class_action/,1611851290.0,"{'author': 'BertSnertBrautworst', 'created_utc': 1611851290, 'title': 'Class Action', 'url': 'https://www.reddit.com/r/wallstreetbets/comments/l71d3z/class_action/', 'created': 1611851290.0}",2021-01-28 16:28:10
48,Freedom_War,1611851290,I'm out,https://www.reddit.com/r/wallstreetbets/comments/l71d3u/im_out/,1611851290.0,"{'author': 'Freedom_War', 'created_utc': 1611851290, 'title': ""I'm out"", 'url': 'https://www.reddit.com/r/wallstreetbets/comments/l71d3u/im_out/', 'created': 1611851290.0}",2021-01-28 16:28:10
49,esteban-oceguera,1611851290,Is this supposed to be bad?,https://i.redd.it/omtlbm1xn3e61.jpg,1611851290.0,"{'author': 'esteban-oceguera', 'created_utc': 1611851290, 'title': 'Is this supposed to be bad?', 'url': 'https://i.redd.it/omtlbm1xn3e61.jpg', 'created': 1611851290.0}",2021-01-28 16:28:10
50,pwndabeer,1611851290,OPEN A FIDELITY ACCOUNT,https://www.reddit.com/r/wallstreetbets/comments/l71d3q/open_a_fidelity_account/,1611851290.0,"{'author': 'pwndabeer', 'created_utc': 1611851290, 'title': 'OPEN A FIDELITY ACCOUNT', 'url': 'https://www.reddit.com/r/wallstreetbets/comments/l71d3q/open_a_fidelity_account/', 'created': 1611851290.0}",2021-01-28 16:28:10
51,Bowskis97,1611851290,LAST CHANCE TO GET ON THE ROCKET SHIP BOYS AND GIRLS SEC AND ROBINHOOD ARE TRYING TO FUCK US. BUT WE WILL BE THE FUCKER,https://www.reddit.com/r/wallstreetbets/comments/l71d3p/last_chance_to_get_on_the_rocket_ship_boys_and/,1611851290.0,"{'author': 'Bowskis97', 'created_utc': 1611851290, 'title': 'LAST CHANCE TO GET ON THE ROCKET SHIP BOYS AND GIRLS SEC AND ROBINHOOD ARE TRYING TO FUCK US. BUT WE WILL BE THE FUCKER', 'url': 'https://www.reddit.com/r/wallstreetbets/comments/l71d3p/last_chance_to_get_on_the_rocket_ship_boys_and/', 'created': 1611851290.0}",2021-01-28 16:28:10
52,Fun-Tangerine8734,1611851289,Amc 🚀,https://www.reddit.com/r/wallstreetbets/comments/l71d5a/amc/,1611851289.0,"{'author': 'Fun-Tangerine8734', 'created_utc': 1611851289, 'title': 'Amc 🚀', 'url': 'https://www.reddit.com/r/wallstreetbets/comments/l71d5a/amc/', 'created': 1611851289.0}",2021-01-28 16:28:09
53,Fun-Tangerine8734,1611851289,Amc 🚀,https://www.reddit.com/r/wallstreetbets/comments/l71d49/amc/,1611851289.0,"{'author': 'Fun-Tangerine8734', 'created_utc': 1611851289, 'title': 'Amc 🚀', 'url': 'https://www.reddit.com/r/wallstreetbets/comments/l71d49/amc/', 'created': 1611851289.0}",2021-01-28 16:28:09
54,swift-lizard,1611851289,FOREIGN MARKETS HAVE OUR BACK,https://www.reddit.com/r/wallstreetbets/comments/l71d3l/foreign_markets_have_our_back/,1611851289.0,"{'author': 'swift-lizard', 'created_utc': 1611851289, 'title': 'FOREIGN MARKETS HAVE OUR BACK', 'url': 'https://www.reddit.com/r/wallstreetbets/comments/l71d3l/foreign_markets_have_our_back/', 'created': 1611851289.0}",2021-01-28 16:28:09
55,iwillprevail030820,1611851289,Can anyone tell me a reliable trading app that is currently allowing new accounts to be opened????,https://www.reddit.com/r/wallstreetbets/comments/l71d3i/can_anyone_tell_me_a_reliable_trading_app_that_is/,1611851289.0,"{'author': 'iwillprevail030820', 'created_utc': 1611851289, 'title': 'Can anyone tell me a reliable trading app that is currently allowing new accounts to be opened????', 'url': 'https://www.reddit.com/r/wallstreetbets/comments/l71d3i/can_anyone_tell_me_a_reliable_trading_app_that_is/', 'created': 1611851289.0}",2021-01-28 16:28:09
56,MemesKilledGod,1611851289,"Holding on RH, starting on CA. Don’t have much to invest but I’m staying in this",https://i.imgur.com/0zmmpdr.jpg,1611851289.0,"{'author': 'MemesKilledGod', 'created_utc': 1611851289, 'title': 'Holding on RH, starting on CA. Don’t have much to invest but I’m staying in this', 'url': 'https://i.imgur.com/0zmmpdr.jpg', 'created': 1611851289.0}",2021-01-28 16:28:09
