,author,created_utc,title,url,created,d_,created_utc_dt
0,Lazy_Jellyfish7676,1612455104,I think we aint done yet 🦍🦍🦍,https://m.youtube.com/watch?v=0u7hDIy1jFA,1612455104.0,"{'author': 'Lazy_Jellyfish7676', 'created_utc': 1612455104, 'title': 'I think we aint done yet 🦍🦍🦍', 'url': 'https://m.youtube.com/watch?v=0u7hDIy1jFA', 'created': 1612455104.0}",2021-02-04 16:11:44
1,ScottWhyy,1612455103,With paperhands gone diamond hands will be made with a lot of pressure. Loss porn,https://i.redd.it/11do7r7djhf61.jpg,1612455103.0,"{'author': 'ScottWhyy', 'created_utc': 1612455103, 'title': 'With paperhands gone diamond hands will be made with a lot of pressure. Loss porn', 'url': 'https://i.redd.it/11do7r7djhf61.jpg', 'created': 1612455103.0}",2021-02-04 16:11:43
2,Annual-Season-627,1612455103,Im sick of how corrupt the financial system really is.,https://www.reddit.com/r/wallstreetbets/comments/lcj2hu/im_sick_of_how_corrupt_the_financial_system/,1612455103.0,"{'author': 'Annual-Season-627', 'created_utc': 1612455103, 'title': 'Im sick of how corrupt the financial system really is.', 'url': 'https://www.reddit.com/r/wallstreetbets/comments/lcj2hu/im_sick_of_how_corrupt_the_financial_system/', 'created': 1612455103.0}",2021-02-04 16:11:43
3,Allan-I,1612455100,Next buy,https://www.reddit.com/r/wallstreetbets/comments/lcj2gl/next_buy/,1612455100.0,"{'author': 'Allan-I', 'created_utc': 1612455100, 'title': 'Next buy', 'url': 'https://www.reddit.com/r/wallstreetbets/comments/lcj2gl/next_buy/', 'created': 1612455100.0}",2021-02-04 16:11:40
4,420BigDaddy420,1612455099,TIRED OF THEM HOLDING US DOWN! IT'S OUT TIME NOW,https://www.reddit.com/r/wallstreetbets/comments/lcj2fs/tired_of_them_holding_us_down_its_out_time_now/,1612455099.0,"{'author': '420BigDaddy420', 'created_utc': 1612455099, 'title': ""TIRED OF THEM HOLDING US DOWN! IT'S OUT TIME NOW"", 'url': 'https://www.reddit.com/r/wallstreetbets/comments/lcj2fs/tired_of_them_holding_us_down_its_out_time_now/', 'created': 1612455099.0}",2021-02-04 16:11:39
5,[deleted],1612455099,What the favourite stocks of r/wallstreetbets have in common,https://www.economist.com/graphic-detail/2021/02/06/what-the-favourite-stocks-of-r/wallstreetbets-have-in-common,1612455099.0,"{'author': '[deleted]', 'created_utc': 1612455099, 'title': 'What the favourite stocks of r/wallstreetbets have in common', 'url': 'https://www.economist.com/graphic-detail/2021/02/06/what-the-favourite-stocks-of-r/wallstreetbets-have-in-common', 'created': 1612455099.0}",2021-02-04 16:11:39
6,CommodeMouth,1612455095,I will not sell!,https://i.imgur.com/iXHrN9m.jpg,1612455095.0,"{'author': 'CommodeMouth', 'created_utc': 1612455095, 'title': 'I will not sell!', 'url': 'https://i.imgur.com/iXHrN9m.jpg', 'created': 1612455095.0}",2021-02-04 16:11:35
7,Sukaphuk,1612455095,"that Citadel dude, a man of priorities.",https://www.reddit.com/gallery/lcj2e2,1612455095.0,"{'author': 'Sukaphuk', 'created_utc': 1612455095, 'title': 'that Citadel dude, a man of priorities.', 'url': 'https://www.reddit.com/gallery/lcj2e2', 'created': 1612455095.0}",2021-02-04 16:11:35
8,Armyintel96b,1612455092,What's Next?,https://www.reddit.com/r/wallstreetbets/comments/lcj2ci/whats_next/,1612455092.0,"{'author': 'Armyintel96b', 'created_utc': 1612455092, 'title': ""What's Next?"", 'url': 'https://www.reddit.com/r/wallstreetbets/comments/lcj2ci/whats_next/', 'created': 1612455092.0}",2021-02-04 16:11:32
9,sameenaz,1612455090,AMC. Do not sell.,https://www.reddit.com/r/wallstreetbets/comments/lcj2be/amc_do_not_sell/,1612455090.0,"{'author': 'sameenaz', 'created_utc': 1612455090, 'title': 'AMC. Do not sell.', 'url': 'https://www.reddit.com/r/wallstreetbets/comments/lcj2be/amc_do_not_sell/', 'created': 1612455090.0}",2021-02-04 16:11:30
10,[deleted],1612455090,"Endless Revolut notifications about Revolut being down, even as it's going back up",https://www.reddit.com/r/wallstreetbets/comments/lcj2b1/endless_revolut_notifications_about_revolut_being/,1612455090.0,"{'author': '[deleted]', 'created_utc': 1612455090, 'title': ""Endless Revolut notifications about Revolut being down, even as it's going back up"", 'url': 'https://www.reddit.com/r/wallstreetbets/comments/lcj2b1/endless_revolut_notifications_about_revolut_being/', 'created': 1612455090.0}",2021-02-04 16:11:30
11,mYszjin,1612455089,Keep holding but I need a little help,https://www.reddit.com/r/wallstreetbets/comments/lcj2aq/keep_holding_but_i_need_a_little_help/,1612455089.0,"{'author': 'mYszjin', 'created_utc': 1612455089, 'title': 'Keep holding but I need a little help', 'url': 'https://www.reddit.com/r/wallstreetbets/comments/lcj2aq/keep_holding_but_i_need_a_little_help/', 'created': 1612455089.0}",2021-02-04 16:11:29
12,tueieo,1612455085,Investing as much as I can everyday. Holding through this. 💎 🙌,https://i.redd.it/imw54b6bjhf61.jpg,1612455085.0,"{'author': 'tueieo', 'created_utc': 1612455085, 'title': 'Investing as much as I can everyday. Holding through this. 💎 🙌', 'url': 'https://i.redd.it/imw54b6bjhf61.jpg', 'created': 1612455085.0}",2021-02-04 16:11:25
13,SneakkDoes,1612455083,A quick question from small ape to big ape,https://www.reddit.com/r/wallstreetbets/comments/lcj27u/a_quick_question_from_small_ape_to_big_ape/,1612455083.0,"{'author': 'SneakkDoes', 'created_utc': 1612455083, 'title': 'A quick question from small ape to big ape', 'url': 'https://www.reddit.com/r/wallstreetbets/comments/lcj27u/a_quick_question_from_small_ape_to_big_ape/', 'created': 1612455083.0}",2021-02-04 16:11:23
14,PoisedPerson,1612455083,Please stop setting deadlines,https://www.reddit.com/r/wallstreetbets/comments/lcj27g/please_stop_setting_deadlines/,1612455083.0,"{'author': 'PoisedPerson', 'created_utc': 1612455083, 'title': 'Please stop setting deadlines', 'url': 'https://www.reddit.com/r/wallstreetbets/comments/lcj27g/please_stop_setting_deadlines/', 'created': 1612455083.0}",2021-02-04 16:11:23
15,[deleted],1612455082,"Against all the market manipulation that Hedge-funds can conjure; all the share limits that Robinhood can produce; we will send unto them, only you. Buy and hold, until it is done.",https://i.redd.it/bl82s17ajhf61.png,1612455082.0,"{'author': '[deleted]', 'created_utc': 1612455082, 'title': 'Against all the market manipulation that Hedge-funds can conjure; all the share limits that Robinhood can produce; we will send unto them, only you. Buy and hold, until it is done.', 'url': 'https://i.redd.it/bl82s17ajhf61.png', 'created': 1612455082.0}",2021-02-04 16:11:22
16,franticsoftware,1612455081,Tough February? International community wait till 02/09. You know who is selling and must buy back.,https://i.redd.it/w1dg4atrihf61.png,1612455081.0,"{'author': 'franticsoftware', 'created_utc': 1612455081, 'title': 'Tough February? International community wait till 02/09. You know who is selling and must buy back.', 'url': 'https://i.redd.it/w1dg4atrihf61.png', 'created': 1612455081.0}",2021-02-04 16:11:21
17,Hereto_wastetime,1612455079,"$100 yolo, hope you degens make me rich. Have a nice day.",https://i.redd.it/obrj10jajhf61.jpg,1612455079.0,"{'author': 'Hereto_wastetime', 'created_utc': 1612455079, 'title': '$100 yolo, hope you degens make me rich. Have a nice day.', 'url': 'https://i.redd.it/obrj10jajhf61.jpg', 'created': 1612455079.0}",2021-02-04 16:11:19
18,AnotherBeginner,1612455079,Holding on AMC and SLV.,https://www.reddit.com/r/wallstreetbets/comments/lcj25r/holding_on_amc_and_slv/,1612455079.0,"{'author': 'AnotherBeginner', 'created_utc': 1612455079, 'title': 'Holding on AMC and SLV.', 'url': 'https://www.reddit.com/r/wallstreetbets/comments/lcj25r/holding_on_amc_and_slv/', 'created': 1612455079.0}",2021-02-04 16:11:19
19,Untamed_King_223,1612455075,DO NOT USE STASH TO INVEST,https://www.reddit.com/r/wallstreetbets/comments/lcj23w/do_not_use_stash_to_invest/,1612455075.0,"{'author': 'Untamed_King_223', 'created_utc': 1612455075, 'title': 'DO NOT USE STASH TO INVEST', 'url': 'https://www.reddit.com/r/wallstreetbets/comments/lcj23w/do_not_use_stash_to_invest/', 'created': 1612455075.0}",2021-02-04 16:11:15
20,throwawayduringcoron,1612455075,Good one,https://i.redd.it/dpmocup8jhf61.png,1612455075.0,"{'author': 'throwawayduringcoron', 'created_utc': 1612455075, 'title': 'Good one', 'url': 'https://i.redd.it/dpmocup8jhf61.png', 'created': 1612455075.0}",2021-02-04 16:11:15
21,MuchCrypto_SuchWow,1612455073,"Dont let uncertainty get to you, GME price does not matter, here is why.1",https://www.reddit.com/r/wallstreetbets/comments/lcj22o/dont_let_uncertainty_get_to_you_gme_price_does/,1612455073.0,"{'author': 'MuchCrypto_SuchWow', 'created_utc': 1612455073, 'title': 'Dont let uncertainty get to you, GME price does not matter, here is why.1', 'url': 'https://www.reddit.com/r/wallstreetbets/comments/lcj22o/dont_let_uncertainty_get_to_you_gme_price_does/', 'created': 1612455073.0}",2021-02-04 16:11:13
22,FormerReflection1841,1612455071,Quem puder seguir na NIMO TV TMJ,https://m.nimo.tv/live/6394639248?_uid=6394639248&amp;_source=1&amp;_identity=user&amp;_from=default&amp;_shareuid=6394639248&amp;_channel=6394639248&amp;_lang=1046,1612455071.0,"{'author': 'FormerReflection1841', 'created_utc': 1612455071, 'title': 'Quem puder seguir na NIMO TV TMJ', 'url': 'https://m.nimo.tv/live/6394639248?_uid=6394639248&amp;_source=1&amp;_identity=user&amp;_from=default&amp;_shareuid=6394639248&amp;_channel=6394639248&amp;_lang=1046', 'created': 1612455071.0}",2021-02-04 16:11:11
23,TeepGaming,1612455069,Unpopular opinion: GME is over and old WSB would make fun of you apes,https://www.reddit.com/r/wallstreetbets/comments/lcj20y/unpopular_opinion_gme_is_over_and_old_wsb_would/,1612455069.0,"{'author': 'TeepGaming', 'created_utc': 1612455069, 'title': 'Unpopular opinion: GME is over and old WSB would make fun of you apes', 'url': 'https://www.reddit.com/r/wallstreetbets/comments/lcj20y/unpopular_opinion_gme_is_over_and_old_wsb_would/', 'created': 1612455069.0}",2021-02-04 16:11:09
24,slothpurpp,1612455069,Results of “holding the line” all my gains gone. Second picture is when I joined wallstreetbets,https://www.reddit.com/gallery/lcj20p,1612455069.0,"{'author': 'slothpurpp', 'created_utc': 1612455069, 'title': 'Results of “holding the line” all my gains gone. Second picture is when I joined wallstreetbets', 'url': 'https://www.reddit.com/gallery/lcj20p', 'created': 1612455069.0}",2021-02-04 16:11:09
25,akov421,1612455066,Newb here...for other newbs,https://www.reddit.com/r/wallstreetbets/comments/lcj1zg/newb_herefor_other_newbs/,1612455066.0,"{'author': 'akov421', 'created_utc': 1612455066, 'title': 'Newb here...for other newbs', 'url': 'https://www.reddit.com/r/wallstreetbets/comments/lcj1zg/newb_herefor_other_newbs/', 'created': 1612455066.0}",2021-02-04 16:11:06
26,gmnproductions,1612455066,Just bought more #AMC stock I have faith!,https://www.reddit.com/r/wallstreetbets/comments/lcj1zd/just_bought_more_amc_stock_i_have_faith/,1612455066.0,"{'author': 'gmnproductions', 'created_utc': 1612455066, 'title': 'Just bought more #AMC stock I have faith!', 'url': 'https://www.reddit.com/r/wallstreetbets/comments/lcj1zd/just_bought_more_amc_stock_i_have_faith/', 'created': 1612455066.0}",2021-02-04 16:11:06
27,Erz808,1612455065,$GME price target at $326 - Argus Research Why was this not all over media? HOLD!!!,https://i.redd.it/6lu7mmy8jhf61.jpg,1612455065.0,"{'author': 'Erz808', 'created_utc': 1612455065, 'title': '$GME price target at $326 - Argus Research Why was this not all over media? HOLD!!!', 'url': 'https://i.redd.it/6lu7mmy8jhf61.jpg', 'created': 1612455065.0}",2021-02-04 16:11:05
28,PPformation,1612455063,"In the time of chimpanzees I was a monkey.... hold, ya primates!",https://i.redd.it/5p3jahm8jhf61.jpg,1612455063.0,"{'author': 'PPformation', 'created_utc': 1612455063, 'title': 'In the time of chimpanzees I was a monkey.... hold, ya primates!', 'url': 'https://i.redd.it/5p3jahm8jhf61.jpg', 'created': 1612455063.0}",2021-02-04 16:11:03
29,incredibly_dank,1612455063,What other SubReddits did the OG WSB migrate to?,https://www.reddit.com/r/wallstreetbets/comments/lcj1xv/what_other_subreddits_did_the_og_wsb_migrate_to/,1612455063.0,"{'author': 'incredibly_dank', 'created_utc': 1612455063, 'title': 'What other SubReddits did the OG WSB migrate to?', 'url': 'https://www.reddit.com/r/wallstreetbets/comments/lcj1xv/what_other_subreddits_did_the_og_wsb_migrate_to/', 'created': 1612455063.0}",2021-02-04 16:11:03
30,AngryPheldagrif,1612455058,So It's Persecution Then,https://www.reddit.com/r/wallstreetbets/comments/lcj1vc/so_its_persecution_then/,1612455058.0,"{'author': 'AngryPheldagrif', 'created_utc': 1612455058, 'title': ""So It's Persecution Then"", 'url': 'https://www.reddit.com/r/wallstreetbets/comments/lcj1vc/so_its_persecution_then/', 'created': 1612455058.0}",2021-02-04 16:10:58
31,[deleted],1612455057,"Genuine question here, why do many of you expect $GME and $AMC to rise again?",https://www.reddit.com/r/wallstreetbets/comments/lcj1ur/genuine_question_here_why_do_many_of_you_expect/,1612455057.0,"{'author': '[deleted]', 'created_utc': 1612455057, 'title': 'Genuine question here, why do many of you expect $GME and $AMC to rise again?', 'url': 'https://www.reddit.com/r/wallstreetbets/comments/lcj1ur/genuine_question_here_why_do_many_of_you_expect/', 'created': 1612455057.0}",2021-02-04 16:10:57
32,Fool182,1612455054,Is it over?,https://www.reddit.com/r/wallstreetbets/comments/lcj1t7/is_it_over/,1612455054.0,"{'author': 'Fool182', 'created_utc': 1612455054, 'title': 'Is it over?', 'url': 'https://www.reddit.com/r/wallstreetbets/comments/lcj1t7/is_it_over/', 'created': 1612455054.0}",2021-02-04 16:10:54
33,i-should-be-a-mod,1612455053,HOLD THE LINE YOU APES,https://www.reddit.com/r/wallstreetbets/comments/lcj1sw/hold_the_line_you_apes/,1612455053.0,"{'author': 'i-should-be-a-mod', 'created_utc': 1612455053, 'title': 'HOLD THE LINE YOU APES', 'url': 'https://www.reddit.com/r/wallstreetbets/comments/lcj1sw/hold_the_line_you_apes/', 'created': 1612455053.0}",2021-02-04 16:10:53
34,el_gordo_cbrn-este,1612455049,We are all retards on a 🚀🚀🚀,https://www.reddit.com/r/wallstreetbets/comments/lcj1qx/we_are_all_retards_on_a/,1612455049.0,"{'author': 'el_gordo_cbrn-este', 'created_utc': 1612455049, 'title': 'We are all retards on a 🚀🚀🚀', 'url': 'https://www.reddit.com/r/wallstreetbets/comments/lcj1qx/we_are_all_retards_on_a/', 'created': 1612455049.0}",2021-02-04 16:10:49
35,BigB3nis111,1612455044,I don't have a lot of capital to invest but I got 15 in AMC and 1 in GME and have been holding fast. #everystockcounts 🚀🚀🚀🚀🚀,https://www.reddit.com/r/wallstreetbets/comments/lcj1ok/i_dont_have_a_lot_of_capital_to_invest_but_i_got/,1612455044.0,"{'author': 'BigB3nis111', 'created_utc': 1612455044, 'title': ""I don't have a lot of capital to invest but I got 15 in AMC and 1 in GME and have been holding fast. #everystockcounts 🚀🚀🚀🚀🚀"", 'url': 'https://www.reddit.com/r/wallstreetbets/comments/lcj1ok/i_dont_have_a_lot_of_capital_to_invest_but_i_got/', 'created': 1612455044.0}",2021-02-04 16:10:44
36,TielerTurden,1612455042,Dear Chamath...,https://www.reddit.com/r/wallstreetbets/comments/lcj1nj/dear_chamath/,1612455042.0,"{'author': 'TielerTurden', 'created_utc': 1612455042, 'title': 'Dear Chamath...', 'url': 'https://www.reddit.com/r/wallstreetbets/comments/lcj1nj/dear_chamath/', 'created': 1612455042.0}",2021-02-04 16:10:42
37,KENWAY2DAY,1612455041,Hold the line,https://www.reddit.com/r/wallstreetbets/comments/lcj1n4/hold_the_line/,1612455041.0,"{'author': 'KENWAY2DAY', 'created_utc': 1612455041, 'title': 'Hold the line', 'url': 'https://www.reddit.com/r/wallstreetbets/comments/lcj1n4/hold_the_line/', 'created': 1612455041.0}",2021-02-04 16:10:41
38,Sea_Collection6969,1612455038,Is this the end?,https://i.redd.it/3u9u9t96jhf61.jpg,1612455038.0,"{'author': 'Sea_Collection6969', 'created_utc': 1612455038, 'title': 'Is this the end?', 'url': 'https://i.redd.it/3u9u9t96jhf61.jpg', 'created': 1612455038.0}",2021-02-04 16:10:38
39,sonny243545,1612455033,Australia crypto,https://www.reddit.com/r/wallstreetbets/comments/lcj1j3/australia_crypto/,1612455033.0,"{'author': 'sonny243545', 'created_utc': 1612455033, 'title': 'Australia crypto', 'url': 'https://www.reddit.com/r/wallstreetbets/comments/lcj1j3/australia_crypto/', 'created': 1612455033.0}",2021-02-04 16:10:33
40,[deleted],1612455032,This subreddit is dying. Go check /r/subredditdrama for proof. This will be removed and I’ll be banned immediately.,https://www.reddit.com/r/wallstreetbets/comments/lcj1ik/this_subreddit_is_dying_go_check_rsubredditdrama/,1612455032.0,"{'author': '[deleted]', 'created_utc': 1612455032, 'title': 'This subreddit is dying. Go check /r/subredditdrama for proof. This will be removed and I’ll be banned immediately.', 'url': 'https://www.reddit.com/r/wallstreetbets/comments/lcj1ik/this_subreddit_is_dying_go_check_rsubredditdrama/', 'created': 1612455032.0}",2021-02-04 16:10:32
41,BornLuckiest,1612455032,On this day...,https://www.reddit.com/r/wallstreetbets/comments/lcj1ii/on_this_day/,1612455032.0,"{'author': 'BornLuckiest', 'created_utc': 1612455032, 'title': 'On this day...', 'url': 'https://www.reddit.com/r/wallstreetbets/comments/lcj1ii/on_this_day/', 'created': 1612455032.0}",2021-02-04 16:10:32
42,IHaveitall100,1612455032,Next GME?,https://www.reddit.com/r/wallstreetbets/comments/lcj1hz/next_gme/,1612455032.0,"{'author': 'IHaveitall100', 'created_utc': 1612455032, 'title': 'Next GME?', 'url': 'https://www.reddit.com/r/wallstreetbets/comments/lcj1hz/next_gme/', 'created': 1612455032.0}",2021-02-04 16:10:32
43,[deleted],1612455031,Can someone explain why these 2 stocks seem to be mirroring each other been that way for the past 3 days. Btw I know I’m a small fish in the pond but I’m here!,https://i.redd.it/luzo3sf5jhf61.jpg,1612455031.0,"{'author': '[deleted]', 'created_utc': 1612455031, 'title': 'Can someone explain why these 2 stocks seem to be mirroring each other been that way for the past 3 days. Btw I know I’m a small fish in the pond but I’m here!', 'url': 'https://i.redd.it/luzo3sf5jhf61.jpg', 'created': 1612455031.0}",2021-02-04 16:10:31
44,princevegeta00,1612455028,"This isn’t about making a profit, this is about doing the right thing.",https://www.reddit.com/r/wallstreetbets/comments/lcj1g8/this_isnt_about_making_a_profit_this_is_about/,1612455028.0,"{'author': 'princevegeta00', 'created_utc': 1612455028, 'title': 'This isn’t about making a profit, this is about doing the right thing.', 'url': 'https://www.reddit.com/r/wallstreetbets/comments/lcj1g8/this_isnt_about_making_a_profit_this_is_about/', 'created': 1612455028.0}",2021-02-04 16:10:28
45,Limp_yomama,1612455028,"I will watch these mfks go straight to 0 while i drink my coffee and i live paycheck to paycheck, we aint selling baby!!!. HOLD!!! ""Its not a lot but its honest work""",https://www.reddit.com/gallery/lcj1g2,1612455028.0,"{'author': 'Limp_yomama', 'created_utc': 1612455028, 'title': 'I will watch these mfks go straight to 0 while i drink my coffee and i live paycheck to paycheck, we aint selling baby!!!. HOLD!!! ""Its not a lot but its honest work""', 'url': 'https://www.reddit.com/gallery/lcj1g2', 'created': 1612455028.0}",2021-02-04 16:10:28
46,hbo2007,1612455028,💭Thoughts of a warrior 💭,https://www.reddit.com/r/wallstreetbets/comments/lcj1ft/thoughts_of_a_warrior/,1612455028.0,"{'author': 'hbo2007', 'created_utc': 1612455028, 'title': '💭Thoughts of a warrior 💭', 'url': 'https://www.reddit.com/r/wallstreetbets/comments/lcj1ft/thoughts_of_a_warrior/', 'created': 1612455028.0}",2021-02-04 16:10:28
47,Sirus_Howell,1612455026,"Shallow Pockets, Diamond Hands",https://i.redd.it/2r4nlsw4jhf61.jpg,1612455026.0,"{'author': 'Sirus_Howell', 'created_utc': 1612455026, 'title': 'Shallow Pockets, Diamond Hands', 'url': 'https://i.redd.it/2r4nlsw4jhf61.jpg', 'created': 1612455026.0}",2021-02-04 16:10:26
48,tradedenmark,1612455020,Is AMC and GME down???,https://www.reddit.com/r/wallstreetbets/comments/lcj1c3/is_amc_and_gme_down/,1612455020.0,"{'author': 'tradedenmark', 'created_utc': 1612455020, 'title': 'Is AMC and GME down???', 'url': 'https://www.reddit.com/r/wallstreetbets/comments/lcj1c3/is_amc_and_gme_down/', 'created': 1612455020.0}",2021-02-04 16:10:20
49,Microseism01,1612455019,MNKKQ Stock,https://www.reddit.com/r/wallstreetbets/comments/lcj1bi/mnkkq_stock/,1612455019.0,"{'author': 'Microseism01', 'created_utc': 1612455019, 'title': 'MNKKQ Stock', 'url': 'https://www.reddit.com/r/wallstreetbets/comments/lcj1bi/mnkkq_stock/', 'created': 1612455019.0}",2021-02-04 16:10:19
50,WoopyShmoopy,1612455019,THIS IS AN IMPORTANT MESSAGE. PLEASE LET EVERYONE SEE,https://i.redd.it/na7kcv84jhf61.jpg,1612455019.0,"{'author': 'WoopyShmoopy', 'created_utc': 1612455019, 'title': 'THIS IS AN IMPORTANT MESSAGE. PLEASE LET EVERYONE SEE', 'url': 'https://i.redd.it/na7kcv84jhf61.jpg', 'created': 1612455019.0}",2021-02-04 16:10:19
51,SupremeAllxm,1612455016,STOP WORRYING,https://www.reddit.com/r/wallstreetbets/comments/lcj19h/stop_worrying/,1612455016.0,"{'author': 'SupremeAllxm', 'created_utc': 1612455016, 'title': 'STOP WORRYING', 'url': 'https://www.reddit.com/r/wallstreetbets/comments/lcj19h/stop_worrying/', 'created': 1612455016.0}",2021-02-04 16:10:16
52,Hefty-Investment-943,1612455015,Hold the line!!!!!!,https://www.reddit.com/r/wallstreetbets/comments/lcj190/hold_the_line/,1612455015.0,"{'author': 'Hefty-Investment-943', 'created_utc': 1612455015, 'title': 'Hold the line!!!!!!', 'url': 'https://www.reddit.com/r/wallstreetbets/comments/lcj190/hold_the_line/', 'created': 1612455015.0}",2021-02-04 16:10:15
53,angrybird7677,1612455013,Here's why GME will not recover over the next few months,https://www.reddit.com/r/wallstreetbets/comments/lcj180/heres_why_gme_will_not_recover_over_the_next_few/,1612455013.0,"{'author': 'angrybird7677', 'created_utc': 1612455013, 'title': ""Here's why GME will not recover over the next few months"", 'url': 'https://www.reddit.com/r/wallstreetbets/comments/lcj180/heres_why_gme_will_not_recover_over_the_next_few/', 'created': 1612455013.0}",2021-02-04 16:10:13
54,Fedxr_,1612455011,WE FUCKING DID IT!,https://www.reddit.com/r/wallstreetbets/comments/lcj174/we_fucking_did_it/,1612455011.0,"{'author': 'Fedxr_', 'created_utc': 1612455011, 'title': 'WE FUCKING DID IT!', 'url': 'https://www.reddit.com/r/wallstreetbets/comments/lcj174/we_fucking_did_it/', 'created': 1612455011.0}",2021-02-04 16:10:11
55,[deleted],1612455011,Make your own decisions,https://www.reddit.com/r/wallstreetbets/comments/lcj16r/make_your_own_decisions/,1612455011.0,"{'author': '[deleted]', 'created_utc': 1612455011, 'title': 'Make your own decisions', 'url': 'https://www.reddit.com/r/wallstreetbets/comments/lcj16r/make_your_own_decisions/', 'created': 1612455011.0}",2021-02-04 16:10:11
56,jjll83,1612455009,Just Bought a ton of $AMC because I really like the movies,https://www.reddit.com/r/wallstreetbets/comments/lcj15r/just_bought_a_ton_of_amc_because_i_really_like/,1612455009.0,"{'author': 'jjll83', 'created_utc': 1612455009, 'title': 'Just Bought a ton of $AMC because I really like the movies', 'url': 'https://www.reddit.com/r/wallstreetbets/comments/lcj15r/just_bought_a_ton_of_amc_because_i_really_like/', 'created': 1612455009.0}",2021-02-04 16:10:09
57,Carthago_deleta_est,1612455009,FLASH SALE,https://www.reddit.com/r/wallstreetbets/comments/lcj154/flash_sale/,1612455009.0,"{'author': 'Carthago_deleta_est', 'created_utc': 1612455009, 'title': 'FLASH SALE', 'url': 'https://www.reddit.com/r/wallstreetbets/comments/lcj154/flash_sale/', 'created': 1612455009.0}",2021-02-04 16:10:09
58,Sea_Collection6969,1612455008,Is this the end?,https://i.redd.it/efqnv4z2jhf61.jpg,1612455008.0,"{'author': 'Sea_Collection6969', 'created_utc': 1612455008, 'title': 'Is this the end?', 'url': 'https://i.redd.it/efqnv4z2jhf61.jpg', 'created': 1612455008.0}",2021-02-04 16:10:08
59,billybk261,1612455007,Is $HIPH the next play? 🚀 🚀,https://www.reddit.com/r/wallstreetbets/comments/lcj141/is_hiph_the_next_play/,1612455007.0,"{'author': 'billybk261', 'created_utc': 1612455007, 'title': 'Is $HIPH the next play? 🚀 🚀', 'url': 'https://www.reddit.com/r/wallstreetbets/comments/lcj141/is_hiph_the_next_play/', 'created': 1612455007.0}",2021-02-04 16:10:07
60,milosxv2,1612454996,Can this all just be denial and not heroism,https://www.reddit.com/r/wallstreetbets/comments/lcj0yo/can_this_all_just_be_denial_and_not_heroism/,1612454996.0,"{'author': 'milosxv2', 'created_utc': 1612454996, 'title': 'Can this all just be denial and not heroism', 'url': 'https://www.reddit.com/r/wallstreetbets/comments/lcj0yo/can_this_all_just_be_denial_and_not_heroism/', 'created': 1612454996.0}",2021-02-04 16:09:56
61,Independent_Umpire_6,1612454995,WE ARE UNITED.,https://i.redd.it/nx5ctoc1jhf61.png,1612454995.0,"{'author': 'Independent_Umpire_6', 'created_utc': 1612454995, 'title': 'WE ARE UNITED.', 'url': 'https://i.redd.it/nx5ctoc1jhf61.png', 'created': 1612454995.0}",2021-02-04 16:09:55
62,[deleted],1612454994,For real you guys are as tough as diamonds,https://www.reddit.com/r/wallstreetbets/comments/lcj0xx/for_real_you_guys_are_as_tough_as_diamonds/,1612454994.0,"{'author': '[deleted]', 'created_utc': 1612454994, 'title': 'For real you guys are as tough as diamonds', 'url': 'https://www.reddit.com/r/wallstreetbets/comments/lcj0xx/for_real_you_guys_are_as_tough_as_diamonds/', 'created': 1612454994.0}",2021-02-04 16:09:54
63,CrackHead-Raccoon,1612454994,Koss Corp. KOSS,https://www.reddit.com/r/wallstreetbets/comments/lcj0xh/koss_corp_koss/,1612454994.0,"{'author': 'CrackHead-Raccoon', 'created_utc': 1612454994, 'title': 'Koss Corp. KOSS', 'url': 'https://www.reddit.com/r/wallstreetbets/comments/lcj0xh/koss_corp_koss/', 'created': 1612454994.0}",2021-02-04 16:09:54
