,author,created_utc,title,url,created,d_,created_utc_dt
0,nakedocelotsnake,1598703224,im fucked,https://www.reddit.com/r/wallstreetbets/comments/iire3n/im_fucked/,1598703224.0,"{'author': 'nakedocelotsnake', 'created_utc': 1598703224, 'title': 'im fucked', 'url': 'https://www.reddit.com/r/wallstreetbets/comments/iire3n/im_fucked/', 'created': 1598703224.0}",2020-08-29 12:13:44
1,monkeyplaysz,1598702315,Robin Hood in Europe,https://www.reddit.com/r/wallstreetbets/comments/iir764/robin_hood_in_europe/,1598702315.0,"{'author': 'monkeyplaysz', 'created_utc': 1598702315, 'title': 'Robin Hood in Europe', 'url': 'https://www.reddit.com/r/wallstreetbets/comments/iir764/robin_hood_in_europe/', 'created': 1598702315.0}",2020-08-29 11:58:35
2,jadster64,1598702218,Apple taking a dip. Expected to slowly climb back up over the next few months.,https://i.redd.it/g82kep6zkxj51.jpg,1598702218.0,"{'author': 'jadster64', 'created_utc': 1598702218, 'title': 'Apple taking a dip. Expected to slowly climb back up over the next few months.', 'url': 'https://i.redd.it/g82kep6zkxj51.jpg', 'created': 1598702218.0}",2020-08-29 11:56:58
3,Arabeloo,1598702110,My attempt at timing the market,https://imgur.com/JL6YZtr,1598702110.0,"{'author': 'Arabeloo', 'created_utc': 1598702110, 'title': 'My attempt at timing the market', 'url': 'https://imgur.com/JL6YZtr', 'created': 1598702110.0}",2020-08-29 11:55:10
4,PufffDadddy,1598701959,Medical Cannabis Company Trulieve To Unveil New Milestone For Its Market: THC Edibles (OTC:TCNNF),https://www.forbes.com/sites/irisdorbian/2020/08/28/medical-cannabis-company-trulieve-to-unveil-new-milestone-for-its-market-thc-edibles/,1598701959.0,"{'author': 'PufffDadddy', 'created_utc': 1598701959, 'title': 'Medical Cannabis Company Trulieve To Unveil New Milestone For Its Market: THC Edibles (OTC:TCNNF)', 'url': 'https://www.forbes.com/sites/irisdorbian/2020/08/28/medical-cannabis-company-trulieve-to-unveil-new-milestone-for-its-market-thc-edibles/', 'created': 1598701959.0}",2020-08-29 11:52:39
5,sepphunter,1598701664,"Random scammer isn't in on it yet, but they'll get there",https://i.redd.it/27zysavbjxj51.jpg,1598701664.0,"{'author': 'sepphunter', 'created_utc': 1598701664, 'title': ""Random scammer isn't in on it yet, but they'll get there"", 'url': 'https://i.redd.it/27zysavbjxj51.jpg', 'created': 1598701664.0}",2020-08-29 11:47:44
6,EaglesPhilliesSixers,1598701603,"Thank you Papa Elon, Tim Apple and the Zuck! Not sure why Merrill can’t calculate a RoR though...",https://i.imgur.com/jdfiqHF.jpg,1598701603.0,"{'author': 'EaglesPhilliesSixers', 'created_utc': 1598701603, 'title': 'Thank you Papa Elon, Tim Apple and the Zuck! Not sure why Merrill can’t calculate a RoR though...', 'url': 'https://i.imgur.com/jdfiqHF.jpg', 'created': 1598701603.0}",2020-08-29 11:46:43
7,RagingMolusk,1598701277,Why does the Tesla Stock Split show on my app already? And as a loss?,https://v.redd.it/j828a1w0ixj51,1598701277.0,"{'author': 'RagingMolusk', 'created_utc': 1598701277, 'title': 'Why does the Tesla Stock Split show on my app already? And as a loss?', 'url': 'https://v.redd.it/j828a1w0ixj51', 'created': 1598701277.0}",2020-08-29 11:41:17
8,RagingMolusk,1598700605,"How did I lose 2k? Did the Tesla perform its stock split already and not give me additional shares? Am I gonna receive them on Monday?, why does it show as a loss? Im so confused.",https://v.redd.it/pz266bsvfxj51,1598700605.0,"{'author': 'RagingMolusk', 'created_utc': 1598700605, 'title': 'How did I lose 2k? Did the Tesla perform its stock split already and not give me additional shares? Am I gonna receive them on Monday?, why does it show as a loss? Im so confused.', 'url': 'https://v.redd.it/pz266bsvfxj51', 'created': 1598700605.0}",2020-08-29 11:30:05
9,vebsan,1598700057,I will never trust my retard mom again,https://i.redd.it/jknl14wjexj51.jpg,1598700057.0,"{'author': 'vebsan', 'created_utc': 1598700057, 'title': 'I will never trust my retard mom again', 'url': 'https://i.redd.it/jknl14wjexj51.jpg', 'created': 1598700057.0}",2020-08-29 11:20:57
10,stupdizbu,1598699725,"This article suggests SP500 should announce additions / deletions by 9/5. If TSLA gets added, who would they be replacing? Puts on that company!",https://www.thestreet.com/tesla/articles/when-will-tesla-be-added-to-the-s-p-500,1598699725.0,"{'author': 'stupdizbu', 'created_utc': 1598699725, 'title': 'This article suggests SP500 should announce additions / deletions by 9/5. If TSLA gets added, who would they be replacing? Puts on that company!', 'url': 'https://www.thestreet.com/tesla/articles/when-will-tesla-be-added-to-the-s-p-500', 'created': 1598699725.0}",2020-08-29 11:15:25
11,bigbear0083,1598699645,"Most Anticipated Earnings Releases for the week beginning August 31st, 2020",https://i.redd.it/9kb6obyadxj51.png,1598699645.0,"{'author': 'bigbear0083', 'created_utc': 1598699645, 'title': 'Most Anticipated Earnings Releases for the week beginning August 31st, 2020', 'url': 'https://i.redd.it/9kb6obyadxj51.png', 'created': 1598699645.0}",2020-08-29 11:14:05
12,fohuh,1598699403,Robinhood Glitch - Tesla shares split early instead of Monday!,https://www.reddit.com/gallery/iiqnxh,1598699403.0,"{'author': 'fohuh', 'created_utc': 1598699403, 'title': 'Robinhood Glitch - Tesla shares split early instead of Monday!', 'url': 'https://www.reddit.com/gallery/iiqnxh', 'created': 1598699403.0}",2020-08-29 11:10:03
13,fohuh,1598698787,"Robinhood Glitch, split tesla shares today instead of Monday. Current loses being shown are a result. This is my portfolio, 0 call/puts, strictly simple stock holding. Currently in touch with customer service!",https://www.reddit.com/gallery/iiqjui,1598698787.0,"{'author': 'fohuh', 'created_utc': 1598698787, 'title': 'Robinhood Glitch, split tesla shares today instead of Monday. Current loses being shown are a result. This is my portfolio, 0 call/puts, strictly simple stock holding. Currently in touch with customer service!', 'url': 'https://www.reddit.com/gallery/iiqjui', 'created': 1598698787.0}",2020-08-29 10:59:47
14,samisnotinsane,1598698196,Centricus and Triller into the Tik Tok fray. Where’s the smart money at?,https://www.reddit.com/r/wallstreetbets/comments/iiqgcu/centricus_and_triller_into_the_tik_tok_fray/,1598698196.0,"{'author': 'samisnotinsane', 'created_utc': 1598698196, 'title': 'Centricus and Triller into the Tik Tok fray. Where’s the smart money at?', 'url': 'https://www.reddit.com/r/wallstreetbets/comments/iiqgcu/centricus_and_triller_into_the_tik_tok_fray/', 'created': 1598698196.0}",2020-08-29 10:49:56
15,ArmageddonVG,1598698086,"Made 100k working at $TSLA, what do I do with it at 21yo?",https://www.reddit.com/r/wallstreetbets/comments/iiqfph/made_100k_working_at_tsla_what_do_i_do_with_it_at/,1598698086.0,"{'author': 'ArmageddonVG', 'created_utc': 1598698086, 'title': 'Made 100k working at $TSLA, what do I do with it at 21yo?', 'url': 'https://www.reddit.com/r/wallstreetbets/comments/iiqfph/made_100k_working_at_tsla_what_do_i_do_with_it_at/', 'created': 1598698086.0}",2020-08-29 10:48:06
16,calculated_bets,1598697860,"Robinhood says, Apple at 52 wk low and reasonable market cap. All in come monday morning",https://i.redd.it/xwqzxjg08xj51.jpg,1598697860.0,"{'author': 'calculated_bets', 'created_utc': 1598697860, 'title': 'Robinhood says, Apple at 52 wk low and reasonable market cap. All in come monday morning', 'url': 'https://i.redd.it/xwqzxjg08xj51.jpg', 'created': 1598697860.0}",2020-08-29 10:44:20
17,zane_321,1598697853,Tell me this is going to be ok 🥺,https://www.reddit.com/gallery/iiqe9k,1598697853.0,"{'author': 'zane_321', 'created_utc': 1598697853, 'title': 'Tell me this is going to be ok 🥺', 'url': 'https://www.reddit.com/gallery/iiqe9k', 'created': 1598697853.0}",2020-08-29 10:44:13
18,bosspicks,1598697839,Wtf to do with this help sos,https://www.reddit.com/r/wallstreetbets/comments/iiqe64/wtf_to_do_with_this_help_sos/,1598697839.0,"{'author': 'bosspicks', 'created_utc': 1598697839, 'title': 'Wtf to do with this help sos', 'url': 'https://www.reddit.com/r/wallstreetbets/comments/iiqe64/wtf_to_do_with_this_help_sos/', 'created': 1598697839.0}",2020-08-29 10:43:59
19,ArmageddonVG,1598697761,Made 100k in STONKS working for Tesla?!,https://www.reddit.com/r/wallstreetbets/comments/iiqdoe/made_100k_in_stonks_working_for_tesla/,1598697761.0,"{'author': 'ArmageddonVG', 'created_utc': 1598697761, 'title': 'Made 100k in STONKS working for Tesla?!', 'url': 'https://www.reddit.com/r/wallstreetbets/comments/iiqdoe/made_100k_in_stonks_working_for_tesla/', 'created': 1598697761.0}",2020-08-29 10:42:41
20,grvander,1598697177,Haven’t gotten my shares from Tesla and Apple split but their value has changed. Will Robinhood fuck me?,https://i.redd.it/4co126dz5xj51.jpg,1598697177.0,"{'author': 'grvander', 'created_utc': 1598697177, 'title': 'Haven’t gotten my shares from Tesla and Apple split but their value has changed. Will Robinhood fuck me?', 'url': 'https://i.redd.it/4co126dz5xj51.jpg', 'created': 1598697177.0}",2020-08-29 10:32:57
21,MutedLet6,1598696431,I just bought a Bloomberg Terminal Keyboard for $500!,https://www.reddit.com/r/wallstreetbets/comments/iiq5i2/i_just_bought_a_bloomberg_terminal_keyboard_for/,1598696431.0,"{'author': 'MutedLet6', 'created_utc': 1598696431, 'title': 'I just bought a Bloomberg Terminal Keyboard for $500!', 'url': 'https://www.reddit.com/r/wallstreetbets/comments/iiq5i2/i_just_bought_a_bloomberg_terminal_keyboard_for/', 'created': 1598696431.0}",2020-08-29 10:20:31
22,MutedLet6,1598696249,I just bought a Bloomberg Terminal Keyboard for $500!,https://www.reddit.com/r/wallstreetbets/comments/iiq4h7/i_just_bought_a_bloomberg_terminal_keyboard_for/,1598696249.0,"{'author': 'MutedLet6', 'created_utc': 1598696249, 'title': 'I just bought a Bloomberg Terminal Keyboard for $500!', 'url': 'https://www.reddit.com/r/wallstreetbets/comments/iiq4h7/i_just_bought_a_bloomberg_terminal_keyboard_for/', 'created': 1598696249.0}",2020-08-29 10:17:29
23,IFriedDemKids,1598694594,Glitch?,https://i.redd.it/pp8s7n29ywj51.png,1598694594.0,"{'author': 'IFriedDemKids', 'created_utc': 1598694594, 'title': 'Glitch?', 'url': 'https://i.redd.it/pp8s7n29ywj51.png', 'created': 1598694594.0}",2020-08-29 09:49:54
24,IFriedDemKids,1598694511,Is this a glitch?,https://i.redd.it/bnh1zi71ywj51.png,1598694511.0,"{'author': 'IFriedDemKids', 'created_utc': 1598694511, 'title': 'Is this a glitch?', 'url': 'https://i.redd.it/bnh1zi71ywj51.png', 'created': 1598694511.0}",2020-08-29 09:48:31
25,Zalot,1598694183,9/4 520c,https://www.reddit.com/r/wallstreetbets/comments/iips7g/94_520c/,1598694183.0,"{'author': 'Zalot', 'created_utc': 1598694183, 'title': '9/4 520c', 'url': 'https://www.reddit.com/r/wallstreetbets/comments/iips7g/94_520c/', 'created': 1598694183.0}",2020-08-29 09:43:03
26,RexMoore360,1598694088,This week airline stocks rose a bit (e.g. LUV). I wonder if folks are thinking a vaccine is close and people will return to flying? Is the cruise industry next (e.g. CCL)?,https://www.reddit.com/r/wallstreetbets/comments/iiprn2/this_week_airline_stocks_rose_a_bit_eg_luv_i/,1598694088.0,"{'author': 'RexMoore360', 'created_utc': 1598694088, 'title': 'This week airline stocks rose a bit (e.g. LUV). I wonder if folks are thinking a vaccine is close and people will return to flying? Is the cruise industry next (e.g. CCL)?', 'url': 'https://www.reddit.com/r/wallstreetbets/comments/iiprn2/this_week_airline_stocks_rose_a_bit_eg_luv_i/', 'created': 1598694088.0}",2020-08-29 09:41:28
27,trendystockz,1598694070,Things To Know About Tesla Ahead Of It's Stock Split,https://www.bullswaves.com/2020/08/things-to-know-about-tesla-ahead-of-its.html,1598694070.0,"{'author': 'trendystockz', 'created_utc': 1598694070, 'title': ""Things To Know About Tesla Ahead Of It's Stock Split"", 'url': 'https://www.bullswaves.com/2020/08/things-to-know-about-tesla-ahead-of-its.html', 'created': 1598694070.0}",2020-08-29 09:41:10
28,Solidnoworks,1598693793,IPO Desktop metal tendies fresh from the 3D printer,https://www.reddit.com/r/wallstreetbets/comments/iipprp/ipo_desktop_metal_tendies_fresh_from_the_3d/,1598693793.0,"{'author': 'Solidnoworks', 'created_utc': 1598693793, 'title': 'IPO Desktop metal tendies fresh from the 3D printer', 'url': 'https://www.reddit.com/r/wallstreetbets/comments/iipprp/ipo_desktop_metal_tendies_fresh_from_the_3d/', 'created': 1598693793.0}",2020-08-29 09:36:33
29,vadimyuryev,1598693143,Why Apple has much more room to grow within the next year. $AAPL,https://www.reddit.com/r/wallstreetbets/comments/iiplpg/why_apple_has_much_more_room_to_grow_within_the/,1598693143.0,"{'author': 'vadimyuryev', 'created_utc': 1598693143, 'title': 'Why Apple has much more room to grow within the next year. $AAPL', 'url': 'https://www.reddit.com/r/wallstreetbets/comments/iiplpg/why_apple_has_much_more_room_to_grow_within_the/', 'created': 1598693143.0}",2020-08-29 09:25:43
30,Thieving__Magpie,1598692756,"The more money the government prints, the more likely that big tech gets bigger$$$",https://www.reddit.com/r/wallstreetbets/comments/iipj7b/the_more_money_the_government_prints_the_more/,1598692756.0,"{'author': 'Thieving__Magpie', 'created_utc': 1598692756, 'title': 'The more money the government prints, the more likely that big tech gets bigger$$$', 'url': 'https://www.reddit.com/r/wallstreetbets/comments/iipj7b/the_more_money_the_government_prints_the_more/', 'created': 1598692756.0}",2020-08-29 09:19:16
31,B2daT,1598692704,Anyone know what car this is?,https://i.redd.it/kkj5bgsoswj51.jpg,1598692704.0,"{'author': 'B2daT', 'created_utc': 1598692704, 'title': 'Anyone know what car this is?', 'url': 'https://i.redd.it/kkj5bgsoswj51.jpg', 'created': 1598692704.0}",2020-08-29 09:18:24
32,BurnabyBoss,1598692192,Russian tourist offered employee $1 million to cripple Tesla with malware - SELL SIGNAL,https://arstechnica.com/information-technology/2020/08/russian-tourist-offered-employee-1-million-to-cripple-tesla-with-malware/?utm_brand=arstechnica&amp;utm_source=twitter&amp;utm_social-type=owned&amp;utm_medium=social,1598692192.0,"{'author': 'BurnabyBoss', 'created_utc': 1598692192, 'title': 'Russian tourist offered employee $1 million to cripple Tesla with malware - SELL SIGNAL', 'url': 'https://arstechnica.com/information-technology/2020/08/russian-tourist-offered-employee-1-million-to-cripple-tesla-with-malware/?utm_brand=arstechnica&amp;utm_source=twitter&amp;utm_social-type=owned&amp;utm_medium=social', 'created': 1598692192.0}",2020-08-29 09:09:52
33,duskembrace29,1598691881,To the moon 🚀 🌚,https://v.redd.it/o7we7jw5qwj51,1598691881.0,"{'author': 'duskembrace29', 'created_utc': 1598691881, 'title': 'To the moon 🚀 🌚', 'url': 'https://v.redd.it/o7we7jw5qwj51', 'created': 1598691881.0}",2020-08-29 09:04:41
34,voltcraft_r,1598691634,Easy USD devaluation play,https://www.reddit.com/r/wallstreetbets/comments/iipc7q/easy_usd_devaluation_play/,1598691634.0,"{'author': 'voltcraft_r', 'created_utc': 1598691634, 'title': 'Easy USD devaluation play', 'url': 'https://www.reddit.com/r/wallstreetbets/comments/iipc7q/easy_usd_devaluation_play/', 'created': 1598691634.0}",2020-08-29 09:00:34
35,Tajlorsource,1598690661,Plus500 opinions,https://www.reddit.com/r/wallstreetbets/comments/iip66p/plus500_opinions/,1598690661.0,"{'author': 'Tajlorsource', 'created_utc': 1598690661, 'title': 'Plus500 opinions', 'url': 'https://www.reddit.com/r/wallstreetbets/comments/iip66p/plus500_opinions/', 'created': 1598690661.0}",2020-08-29 08:44:21
36,ReduceHyperlinks,1598690441,In a nutshell,https://i.redd.it/zgnbb2iylwj51.jpg,1598690441.0,"{'author': 'ReduceHyperlinks', 'created_utc': 1598690441, 'title': 'In a nutshell', 'url': 'https://i.redd.it/zgnbb2iylwj51.jpg', 'created': 1598690441.0}",2020-08-29 08:40:41
37,i-kno-nothing,1598690409,"Get your tendy bags ready, $TSLA call holder about to get loaded papa musk our sugar daddy provides",https://www.vox.com/recode/2020/8/28/21404802/elon-musk-neuralink-brain-machine-interface-research,1598690409.0,"{'author': 'i-kno-nothing', 'created_utc': 1598690409, 'title': 'Get your tendy bags ready, $TSLA call holder about to get loaded papa musk our sugar daddy provides', 'url': 'https://www.vox.com/recode/2020/8/28/21404802/elon-musk-neuralink-brain-machine-interface-research', 'created': 1598690409.0}",2020-08-29 08:40:09
38,Useful_Security6122,1598689783,"a lot of seller on shopify they are spend a lot of money on facebook ads but the are not use SEO ,when the freelancer created my store i told him to add seo also that why it make me earn mre profite : who's want to creat profissionl store i will writ it in comment",https://i.redd.it/bxktsk8rewj51.jpg,1598689783.0,"{'author': 'Useful_Security6122', 'created_utc': 1598689783, 'title': ""a lot of seller on shopify they are spend a lot of money on facebook ads but the are not use SEO ,when the freelancer created my store i told him to add seo also that why it make me earn mre profite : who's want to creat profissionl store i will writ it in comment"", 'url': 'https://i.redd.it/bxktsk8rewj51.jpg', 'created': 1598689783.0}",2020-08-29 08:29:43
39,notafakeaccount88,1598689179,I know literally nothing,https://www.reddit.com/r/wallstreetbets/comments/iioxcj/i_know_literally_nothing/,1598689179.0,"{'author': 'notafakeaccount88', 'created_utc': 1598689179, 'title': 'I know literally nothing', 'url': 'https://www.reddit.com/r/wallstreetbets/comments/iioxcj/i_know_literally_nothing/', 'created': 1598689179.0}",2020-08-29 08:19:39
40,Oleeze,1598688683,My account dropped 8k because I was marked as a day trader. Will I get my money back?,https://www.reddit.com/r/wallstreetbets/comments/iioui1/my_account_dropped_8k_because_i_was_marked_as_a/,1598688683.0,"{'author': 'Oleeze', 'created_utc': 1598688683, 'title': 'My account dropped 8k because I was marked as a day trader. Will I get my money back?', 'url': 'https://www.reddit.com/r/wallstreetbets/comments/iioui1/my_account_dropped_8k_because_i_was_marked_as_a/', 'created': 1598688683.0}",2020-08-29 08:11:23
41,basic_math_doit,1598687915,17k (+50k 401k) -&gt; 197K,https://www.reddit.com/r/wallstreetbets/comments/iiopv7/17k_50k_401k_197k/,1598687915.0,"{'author': 'basic_math_doit', 'created_utc': 1598687915, 'title': '17k (+50k 401k) -&gt; 197K', 'url': 'https://www.reddit.com/r/wallstreetbets/comments/iiopv7/17k_50k_401k_197k/', 'created': 1598687915.0}",2020-08-29 07:58:35
42,soxid13,1598687839,Apple closes at 420€,https://i.redd.it/cqetrjt7ewj51.jpg,1598687839.0,"{'author': 'soxid13', 'created_utc': 1598687839, 'title': 'Apple closes at 420€', 'url': 'https://i.redd.it/cqetrjt7ewj51.jpg', 'created': 1598687839.0}",2020-08-29 07:57:19
43,Pseudonymphgmx,1598687463,"12,000 Down After-hours on Robinhood??",https://www.reddit.com/r/wallstreetbets/comments/iion9m/12000_down_afterhours_on_robinhood/,1598687463.0,"{'author': 'Pseudonymphgmx', 'created_utc': 1598687463, 'title': '12,000 Down After-hours on Robinhood??', 'url': 'https://www.reddit.com/r/wallstreetbets/comments/iion9m/12000_down_afterhours_on_robinhood/', 'created': 1598687463.0}",2020-08-29 07:51:03
44,lbadvibes,1598686306,My wife’s boyfriend said if I hit 100k I can have sex with her,https://v.redd.it/f3ks0t4h9wj51,1598686306.0,"{'author': 'lbadvibes', 'created_utc': 1598686306, 'title': 'My wife’s boyfriend said if I hit 100k I can have sex with her', 'url': 'https://v.redd.it/f3ks0t4h9wj51', 'created': 1598686306.0}",2020-08-29 07:31:46
45,bullishmem,1598686286,King Jeff teaches the laws of the stock market,https://i.redd.it/1886zvnl9wj51.jpg,1598686286.0,"{'author': 'bullishmem', 'created_utc': 1598686286, 'title': 'King Jeff teaches the laws of the stock market', 'url': 'https://i.redd.it/1886zvnl9wj51.jpg', 'created': 1598686286.0}",2020-08-29 07:31:26
46,robot141,1598686210,From $48k to $722k in 3 weeks.,https://www.reddit.com/gallery/iiofjx,1598686210.0,"{'author': 'robot141', 'created_utc': 1598686210, 'title': 'From $48k to $722k in 3 weeks.', 'url': 'https://www.reddit.com/gallery/iiofjx', 'created': 1598686210.0}",2020-08-29 07:30:10
47,notBKnoob,1598685087,Yes we all love WSB 🙄😑😑,https://i.redd.it/854c8je16wj51.jpg,1598685087.0,"{'author': 'notBKnoob', 'created_utc': 1598685087, 'title': 'Yes we all love WSB 🙄😑😑', 'url': 'https://i.redd.it/854c8je16wj51.jpg', 'created': 1598685087.0}",2020-08-29 07:11:27
48,chefduong,1598685004,Why did I lose money,https://www.reddit.com/gallery/iio7uu,1598685004.0,"{'author': 'chefduong', 'created_utc': 1598685004, 'title': 'Why did I lose money', 'url': 'https://www.reddit.com/gallery/iio7uu', 'created': 1598685004.0}",2020-08-29 07:10:04
49,PrinceOfBeasts24,1598684851,Question about spread options. How do i know if i made money or not?,https://i.redd.it/dkcczj5c5wj51.jpg,1598684851.0,"{'author': 'PrinceOfBeasts24', 'created_utc': 1598684851, 'title': 'Question about spread options. How do i know if i made money or not?', 'url': 'https://i.redd.it/dkcczj5c5wj51.jpg', 'created': 1598684851.0}",2020-08-29 07:07:31
50,chefduong,1598684683,Why did I lose money?,https://www.reddit.com/gallery/iio5qm,1598684683.0,"{'author': 'chefduong', 'created_utc': 1598684683, 'title': 'Why did I lose money?', 'url': 'https://www.reddit.com/gallery/iio5qm', 'created': 1598684683.0}",2020-08-29 07:04:43
51,paffcio2,1598684621,How to start with 2k? Stock or calls,https://www.reddit.com/r/wallstreetbets/comments/iio5bv/how_to_start_with_2k_stock_or_calls/,1598684621.0,"{'author': 'paffcio2', 'created_utc': 1598684621, 'title': 'How to start with 2k? Stock or calls', 'url': 'https://www.reddit.com/r/wallstreetbets/comments/iio5bv/how_to_start_with_2k_stock_or_calls/', 'created': 1598684621.0}",2020-08-29 07:03:41
52,terryacki,1598684514,"Big loss on Amazon, Tesla, and Silver",https://i.imgur.com/CKSl7kH.jpg,1598684514.0,"{'author': 'terryacki', 'created_utc': 1598684514, 'title': 'Big loss on Amazon, Tesla, and Silver', 'url': 'https://i.imgur.com/CKSl7kH.jpg', 'created': 1598684514.0}",2020-08-29 07:01:54
53,Darkfibre_,1598684469,Is Gilead priced in (GILD) FDA expands use of remdesivir as COVID-19 treatment,https://www.reddit.com/r/wallstreetbets/comments/iio48b/is_gilead_priced_in_gild_fda_expands_use_of/,1598684469.0,"{'author': 'Darkfibre_', 'created_utc': 1598684469, 'title': 'Is Gilead priced in (GILD) FDA expands use of remdesivir as COVID-19 treatment', 'url': 'https://www.reddit.com/r/wallstreetbets/comments/iio48b/is_gilead_priced_in_gild_fda_expands_use_of/', 'created': 1598684469.0}",2020-08-29 07:01:09
54,terryacki,1598684422,Just a minor dip in the road,https://i.imgur.com/QWpl4tF.jpg,1598684422.0,"{'author': 'terryacki', 'created_utc': 1598684422, 'title': 'Just a minor dip in the road', 'url': 'https://i.imgur.com/QWpl4tF.jpg', 'created': 1598684422.0}",2020-08-29 07:00:22
55,clankingyeti,1598684412,Ok actually the best DD you’ll see on this stupid subreddit,https://www.reddit.com/r/wallstreetbets/comments/iio3vl/ok_actually_the_best_dd_youll_see_on_this_stupid/,1598684412.0,"{'author': 'clankingyeti', 'created_utc': 1598684412, 'title': 'Ok actually the best DD you’ll see on this stupid subreddit', 'url': 'https://www.reddit.com/r/wallstreetbets/comments/iio3vl/ok_actually_the_best_dd_youll_see_on_this_stupid/', 'created': 1598684412.0}",2020-08-29 07:00:12
56,chefduong,1598684351,So confused,https://www.reddit.com/r/wallstreetbets/comments/iio3fr/so_confused/,1598684351.0,"{'author': 'chefduong', 'created_utc': 1598684351, 'title': 'So confused', 'url': 'https://www.reddit.com/r/wallstreetbets/comments/iio3fr/so_confused/', 'created': 1598684351.0}",2020-08-29 06:59:11
57,DivendedsRlife,1598683575,T Calls,https://www.reddit.com/r/wallstreetbets/comments/iinxzx/t_calls/,1598683575.0,"{'author': 'DivendedsRlife', 'created_utc': 1598683575, 'title': 'T Calls', 'url': 'https://www.reddit.com/r/wallstreetbets/comments/iinxzx/t_calls/', 'created': 1598683575.0}",2020-08-29 06:46:15
58,kapilnandwana,1598683415,Robinhood bug,https://www.reddit.com/r/wallstreetbets/comments/iinwux/robinhood_bug/,1598683415.0,"{'author': 'kapilnandwana', 'created_utc': 1598683415, 'title': 'Robinhood bug', 'url': 'https://www.reddit.com/r/wallstreetbets/comments/iinwux/robinhood_bug/', 'created': 1598683415.0}",2020-08-29 06:43:35
59,Keagan12321,1598682000,Corsair gaming can't go tits up.,https://www.reddit.com/r/wallstreetbets/comments/iinmtw/corsair_gaming_cant_go_tits_up/,1598682000.0,"{'author': 'Keagan12321', 'created_utc': 1598682000, 'title': ""Corsair gaming can't go tits up."", 'url': 'https://www.reddit.com/r/wallstreetbets/comments/iinmtw/corsair_gaming_cant_go_tits_up/', 'created': 1598682000.0}",2020-08-29 06:20:00
60,cuki321,1598681527,"Roses are red. Violets are blue. Green, you’re good. Red, you’re screwed.",https://v.redd.it/ibl687pevvj51,1598681527.0,"{'author': 'cuki321', 'created_utc': 1598681527, 'title': 'Roses are red. Violets are blue. Green, you’re good. Red, you’re screwed.', 'url': 'https://v.redd.it/ibl687pevvj51', 'created': 1598681527.0}",2020-08-29 06:12:07
61,cuki321,1598680911,"Roses are red. Violets are blue. Green, you’re good. Red, you’re screwed!",https://v.redd.it/7pa564yhtvj51,1598680911.0,"{'author': 'cuki321', 'created_utc': 1598680911, 'title': 'Roses are red. Violets are blue. Green, you’re good. Red, you’re screwed!', 'url': 'https://v.redd.it/7pa564yhtvj51', 'created': 1598680911.0}",2020-08-29 06:01:51
62,notBKnoob,1598680662,I swear to God I don’t know what I’m doing but somethings working... All I know is this is better than dealing meth. 💯,https://i.redd.it/xob4oplvsvj51.jpg,1598680662.0,"{'author': 'notBKnoob', 'created_utc': 1598680662, 'title': 'I swear to God I don’t know what I’m doing but somethings working... All I know is this is better than dealing meth. 💯', 'url': 'https://i.redd.it/xob4oplvsvj51.jpg', 'created': 1598680662.0}",2020-08-29 05:57:42
