,author,created_utc,title,url,created,d_,created_utc_dt
65,Fupatown,1612244179,Congratulations to u/Sup3rPotatoninja for getting his post featured in this CBS News article. Too bad the post got removed because you're a bot.... oh wait it didn't and you're not...😑,https://i.redd.it/1dpm3ci640f61.jpg,1612244179.0,"{'author': 'Fupatown', 'created_utc': 1612244179, 'title': ""Congratulations to u/Sup3rPotatoninja for getting his post featured in this CBS News article. Too bad the post got removed because you're a bot.... oh wait it didn't and you're not...😑"", 'url': 'https://i.redd.it/1dpm3ci640f61.jpg', 'created': 1612244179.0}",2021-02-02 05:36:19
66,spankmewetmop,1612244177,WTF! HOLD some cannot buy in,https://i.imgur.com/q3XXXD6.jpg,1612244177.0,"{'author': 'spankmewetmop', 'created_utc': 1612244177, 'title': 'WTF! HOLD some cannot buy in', 'url': 'https://i.imgur.com/q3XXXD6.jpg', 'created': 1612244177.0}",2021-02-02 05:36:17
67,Airline-Over,1612244173,New to reddit - I think I'm turning retarded,https://www.reddit.com/r/wallstreetbets/comments/laokac/new_to_reddit_i_think_im_turning_retarded/,1612244173.0,"{'author': 'Airline-Over', 'created_utc': 1612244173, 'title': ""New to reddit - I think I'm turning retarded"", 'url': 'https://www.reddit.com/r/wallstreetbets/comments/laokac/new_to_reddit_i_think_im_turning_retarded/', 'created': 1612244173.0}",2021-02-02 05:36:13
68,SandyArtisto,1612244173,Enjoy The Wallpaper I Created My Beautiful Degens!,https://i.redd.it/t6xssbr140f61.png,1612244173.0,"{'author': 'SandyArtisto', 'created_utc': 1612244173, 'title': 'Enjoy The Wallpaper I Created My Beautiful Degens!', 'url': 'https://i.redd.it/t6xssbr140f61.png', 'created': 1612244173.0}",2021-02-02 05:36:13
69,ryukun11,1612244172,SLV scam miles away,https://www.reddit.com/r/wallstreetbets/comments/laok9z/slv_scam_miles_away/,1612244172.0,"{'author': 'ryukun11', 'created_utc': 1612244172, 'title': 'SLV scam miles away', 'url': 'https://www.reddit.com/r/wallstreetbets/comments/laok9z/slv_scam_miles_away/', 'created': 1612244172.0}",2021-02-02 05:36:12
70,CaPtAiN_KiDd,1612244171,This has been the best education I have ever gotten.,https://www.reddit.com/r/wallstreetbets/comments/laok9l/this_has_been_the_best_education_i_have_ever/,1612244171.0,"{'author': 'CaPtAiN_KiDd', 'created_utc': 1612244171, 'title': 'This has been the best education I have ever gotten.', 'url': 'https://www.reddit.com/r/wallstreetbets/comments/laok9l/this_has_been_the_best_education_i_have_ever/', 'created': 1612244171.0}",2021-02-02 05:36:11
71,ninja8618,1612244170,Bought 1 through Robinhood - to the moon baybee !! how do I add those little pictures!?,https://www.reddit.com/r/wallstreetbets/comments/laok96/bought_1_through_robinhood_to_the_moon_baybee_how/,1612244170.0,"{'author': 'ninja8618', 'created_utc': 1612244170, 'title': 'Bought 1 through Robinhood - to the moon baybee !! how do I add those little pictures!?', 'url': 'https://www.reddit.com/r/wallstreetbets/comments/laok96/bought_1_through_robinhood_to_the_moon_baybee_how/', 'created': 1612244170.0}",2021-02-02 05:36:10
72,joachimorjoe,1612244169,"Just received this. US broker shuts out NZ app from buying GME, AMC and NOK",https://i.redd.it/dtf6yf8540f61.jpg,1612244169.0,"{'author': 'joachimorjoe', 'created_utc': 1612244169, 'title': 'Just received this. US broker shuts out NZ app from buying GME, AMC and NOK', 'url': 'https://i.redd.it/dtf6yf8540f61.jpg', 'created': 1612244169.0}",2021-02-02 05:36:09
73,HanAndLeah,1612244165,"According to Jimmy Kimmel, there’s a bunch of Russian spies in here ? I’ve got something for you ... 50 watts per channel baby",https://www.reddit.com/r/wallstreetbets/comments/laok7g/according_to_jimmy_kimmel_theres_a_bunch_of/,1612244165.0,"{'author': 'HanAndLeah', 'created_utc': 1612244165, 'title': 'According to Jimmy Kimmel, there’s a bunch of Russian spies in here ? I’ve got something for you ... 50 watts per channel baby', 'url': 'https://www.reddit.com/r/wallstreetbets/comments/laok7g/according_to_jimmy_kimmel_theres_a_bunch_of/', 'created': 1612244165.0}",2021-02-02 05:36:05
74,ChocolateSad,1612244164,DriveWealth (Stake) No longer allowing GME Buys.,https://www.reddit.com/r/wallstreetbets/comments/laok7b/drivewealth_stake_no_longer_allowing_gme_buys/,1612244164.0,"{'author': 'ChocolateSad', 'created_utc': 1612244164, 'title': 'DriveWealth (Stake) No longer allowing GME Buys.', 'url': 'https://www.reddit.com/r/wallstreetbets/comments/laok7b/drivewealth_stake_no_longer_allowing_gme_buys/', 'created': 1612244164.0}",2021-02-02 05:36:04
75,itsabigigloo,1612244164,I was already poor😭😭😭😭,https://i.redd.it/m1i977v440f61.jpg,1612244164.0,"{'author': 'itsabigigloo', 'created_utc': 1612244164, 'title': 'I was already poor😭😭😭😭', 'url': 'https://i.redd.it/m1i977v440f61.jpg', 'created': 1612244164.0}",2021-02-02 05:36:04
76,TakeTwoll,1612244162,Trick to Make Profit,https://www.reddit.com/r/wallstreetbets/comments/laok6h/trick_to_make_profit/,1612244162.0,"{'author': 'TakeTwoll', 'created_utc': 1612244162, 'title': 'Trick to Make Profit', 'url': 'https://www.reddit.com/r/wallstreetbets/comments/laok6h/trick_to_make_profit/', 'created': 1612244162.0}",2021-02-02 05:36:02
77,fumes,1612244161,My quotes calendar approves of you APES and your COMMITMENT!!,https://i.redd.it/lvp3zrd340f61.jpg,1612244161.0,"{'author': 'fumes', 'created_utc': 1612244161, 'title': 'My quotes calendar approves of you APES and your COMMITMENT!!', 'url': 'https://i.redd.it/lvp3zrd340f61.jpg', 'created': 1612244161.0}",2021-02-02 05:36:01
78,Jaded_Ad3904,1612244161,Spewing was about to get on board from Australia.,https://i.redd.it/kyk1ilh440f61.jpg,1612244161.0,"{'author': 'Jaded_Ad3904', 'created_utc': 1612244161, 'title': 'Spewing was about to get on board from Australia.', 'url': 'https://i.redd.it/kyk1ilh440f61.jpg', 'created': 1612244161.0}",2021-02-02 05:36:01
79,Turbulent_Reveal_737,1612244159,You can’t buy $GME on Cash App! More division tactics!,https://www.cnbc.com/2021/02/01/robinhoods-woes-could-be-squares-win-as-customers-flock-to-cash-app.html,1612244159.0,"{'author': 'Turbulent_Reveal_737', 'created_utc': 1612244159, 'title': 'You can’t buy $GME on Cash App! More division tactics!', 'url': 'https://www.cnbc.com/2021/02/01/robinhoods-woes-could-be-squares-win-as-customers-flock-to-cash-app.html', 'created': 1612244159.0}",2021-02-02 05:35:59
80,wildcomedy,1612244158,"Just received this. Sorry fellow WSB’ers, looks like us Aussies and Kiwis using stake will no longer be buying GME... all we can do now is hold.",https://i.redd.it/22u2547440f61.jpg,1612244158.0,"{'author': 'wildcomedy', 'created_utc': 1612244158, 'title': 'Just received this. Sorry fellow WSB’ers, looks like us Aussies and Kiwis using stake will no longer be buying GME... all we can do now is hold.', 'url': 'https://i.redd.it/22u2547440f61.jpg', 'created': 1612244158.0}",2021-02-02 05:35:58
81,classicjondor,1612244157,"Lamp oil? Rope? Bombs? You want it? It's yours my friend, as long as you hold enough $GME 🚀",https://v.redd.it/whahhhpt30f61,1612244157.0,"{'author': 'classicjondor', 'created_utc': 1612244157, 'title': ""Lamp oil? Rope? Bombs? You want it? It's yours my friend, as long as you hold enough $GME 🚀"", 'url': 'https://v.redd.it/whahhhpt30f61', 'created': 1612244157.0}",2021-02-02 05:35:57
82,z_morehouse,1612244154,No more GME for me then I guess...,https://i.redd.it/xgi0tft340f61.jpg,1612244154.0,"{'author': 'z_morehouse', 'created_utc': 1612244154, 'title': 'No more GME for me then I guess...', 'url': 'https://i.redd.it/xgi0tft340f61.jpg', 'created': 1612244154.0}",2021-02-02 05:35:54
83,ucegaming,1612244152,FKN SCUM BAGS won’t even let me buy AMC GME OR NOK FOR BS REASONS,https://i.redd.it/jtwnmkl340f61.jpg,1612244152.0,"{'author': 'ucegaming', 'created_utc': 1612244152, 'title': 'FKN SCUM BAGS won’t even let me buy AMC GME OR NOK FOR BS REASONS', 'url': 'https://i.redd.it/jtwnmkl340f61.jpg', 'created': 1612244152.0}",2021-02-02 05:35:52
84,Onpooyou,1612244150,Chinese stock market corruption...,https://www.reddit.com/r/wallstreetbets/comments/laok2l/chinese_stock_market_corruption/,1612244150.0,"{'author': 'Onpooyou', 'created_utc': 1612244150, 'title': 'Chinese stock market corruption...', 'url': 'https://www.reddit.com/r/wallstreetbets/comments/laok2l/chinese_stock_market_corruption/', 'created': 1612244150.0}",2021-02-02 05:35:50
85,SimplyEquivocal,1612244149,🤣🤣,https://i.redd.it/67y3h6a340f61.jpg,1612244149.0,"{'author': 'SimplyEquivocal', 'created_utc': 1612244149, 'title': '🤣🤣', 'url': 'https://i.redd.it/67y3h6a340f61.jpg', 'created': 1612244149.0}",2021-02-02 05:35:49
86,leevigraham,1612244148,"Stake's (Australia) broker DriveWealth (US) cancelling all $GME, $AMC and $NOK buy orders.",https://i.redd.it/xhhidt6t30f61.png,1612244148.0,"{'author': 'leevigraham', 'created_utc': 1612244148, 'title': ""Stake's (Australia) broker DriveWealth (US) cancelling all $GME, $AMC and $NOK buy orders."", 'url': 'https://i.redd.it/xhhidt6t30f61.png', 'created': 1612244148.0}",2021-02-02 05:35:48
87,Important-Ad-4000,1612244146,"WE ARE BECOMING THE LARGEST INVESTMENT FUND IN THE WORLD. STAY UNITED, WE ALL GO ON THE SAME DIRECTION. THAT MEANS DO NOT SELL AND BUY WHEN YOU CAN. THIS IS MY OPINION, THIS CPULD BE THE BEGGINING OF TAKING (REALLY) TAKING BACK TENDIES",https://www.reddit.com/r/wallstreetbets/comments/laok1k/we_are_becoming_the_largest_investment_fund_in/,1612244146.0,"{'author': 'Important-Ad-4000', 'created_utc': 1612244146, 'title': 'WE ARE BECOMING THE LARGEST INVESTMENT FUND IN THE WORLD. STAY UNITED, WE ALL GO ON THE SAME DIRECTION. THAT MEANS DO NOT SELL AND BUY WHEN YOU CAN. THIS IS MY OPINION, THIS CPULD BE THE BEGGINING OF TAKING (REALLY) TAKING BACK TENDIES', 'url': 'https://www.reddit.com/r/wallstreetbets/comments/laok1k/we_are_becoming_the_largest_investment_fund_in/', 'created': 1612244146.0}",2021-02-02 05:35:46
88,ThewildXP,1612244139,"STAKE just blocked trading of $GME, $AMC and $NOK",https://i.redd.it/j1yz5spz30f61.png,1612244139.0,"{'author': 'ThewildXP', 'created_utc': 1612244139, 'title': 'STAKE just blocked trading of $GME, $AMC and $NOK', 'url': 'https://i.redd.it/j1yz5spz30f61.png', 'created': 1612244139.0}",2021-02-02 05:35:39
89,Obi_96,1612244136,"DriveWealth suspends buying of $GME, $AMC and $NOK! (Affects Stake in Australia)",https://i.redd.it/a61bffw140f61.jpg,1612244136.0,"{'author': 'Obi_96', 'created_utc': 1612244136, 'title': 'DriveWealth suspends buying of $GME, $AMC and $NOK! (Affects Stake in Australia)', 'url': 'https://i.redd.it/a61bffw140f61.jpg', 'created': 1612244136.0}",2021-02-02 05:35:36
90,tensaba,1612244132,🚀🚀🚀,https://i.redd.it/ui1ss4i140f61.jpg,1612244132.0,"{'author': 'tensaba', 'created_utc': 1612244132, 'title': '🚀🚀🚀', 'url': 'https://i.redd.it/ui1ss4i140f61.jpg', 'created': 1612244132.0}",2021-02-02 05:35:32
91,rukyu100,1612244131,"Speedpainting a cute girl for morale, HODL!",https://youtu.be/8nFcHRnlrCA,1612244131.0,"{'author': 'rukyu100', 'created_utc': 1612244131, 'title': 'Speedpainting a cute girl for morale, HODL!', 'url': 'https://youtu.be/8nFcHRnlrCA', 'created': 1612244131.0}",2021-02-02 05:35:31
92,[deleted],1612244130,Mods please reply and tell me why I'm shadowbanned,https://www.reddit.com/r/wallstreetbets/comments/laojwx/mods_please_reply_and_tell_me_why_im_shadowbanned/,1612244130.0,"{'author': '[deleted]', 'created_utc': 1612244130, 'title': ""Mods please reply and tell me why I'm shadowbanned"", 'url': 'https://www.reddit.com/r/wallstreetbets/comments/laojwx/mods_please_reply_and_tell_me_why_im_shadowbanned/', 'created': 1612244130.0}",2021-02-02 05:35:30
93,Psychium7608,1612244129,$GME Broke college student loss porn for you. Still holding.💎 🤚,https://i.redd.it/7mi7y95140f61.jpg,1612244129.0,"{'author': 'Psychium7608', 'created_utc': 1612244129, 'title': '$GME Broke college student loss porn for you. Still holding.💎 🤚', 'url': 'https://i.redd.it/7mi7y95140f61.jpg', 'created': 1612244129.0}",2021-02-02 05:35:29
94,[deleted],1612244128,UNACCEPTABLE Stake has also pussied out try to stop us. BUT THEY CANT. 🚀💎 To the moon boys 💎🚀,https://i.redd.it/5cmu60v040f61.jpg,1612244128.0,"{'author': '[deleted]', 'created_utc': 1612244128, 'title': 'UNACCEPTABLE Stake has also pussied out try to stop us. BUT THEY CANT. 🚀💎 To the moon boys 💎🚀', 'url': 'https://i.redd.it/5cmu60v040f61.jpg', 'created': 1612244128.0}",2021-02-02 05:35:28
95,hsoj_1,1612244127,"Stake Stops Buying of GME, AMC and NOK",https://i.redd.it/z879n8r040f61.jpg,1612244127.0,"{'author': 'hsoj_1', 'created_utc': 1612244127, 'title': 'Stake Stops Buying of GME, AMC and NOK', 'url': 'https://i.redd.it/z879n8r040f61.jpg', 'created': 1612244127.0}",2021-02-02 05:35:27
96,Savings_Ferret_3428,1612244125,"Let’s fuck those hedge fund boys. We can HOLD, HOLD and HOLD. AMC to the fucking 🌕🌕🚀🚀",https://www.reddit.com/r/wallstreetbets/comments/laojv0/lets_fuck_those_hedge_fund_boys_we_can_hold_hold/,1612244125.0,"{'author': 'Savings_Ferret_3428', 'created_utc': 1612244125, 'title': 'Let’s fuck those hedge fund boys. We can HOLD, HOLD and HOLD. AMC to the fucking 🌕🌕🚀🚀', 'url': 'https://www.reddit.com/r/wallstreetbets/comments/laojv0/lets_fuck_those_hedge_fund_boys_we_can_hold_hold/', 'created': 1612244125.0}",2021-02-02 05:35:25
97,WaluigiBobaTime,1612244124,They are lying by saying that we are promoting silver. So I must say this to all the new people who have been joining here; DO NOT BUY SILVER!,https://i.redd.it/5k0qdan720f61.jpg,1612244124.0,"{'author': 'WaluigiBobaTime', 'created_utc': 1612244124, 'title': 'They are lying by saying that we are promoting silver. So I must say this to all the new people who have been joining here; DO NOT BUY SILVER!', 'url': 'https://i.redd.it/5k0qdan720f61.jpg', 'created': 1612244124.0}",2021-02-02 05:35:24
98,PlumbingLegend,1612244123,New Ape “reporting for duty”,https://www.reddit.com/r/wallstreetbets/comments/laojuh/new_ape_reporting_for_duty/,1612244123.0,"{'author': 'PlumbingLegend', 'created_utc': 1612244123, 'title': 'New Ape “reporting for duty”', 'url': 'https://www.reddit.com/r/wallstreetbets/comments/laojuh/new_ape_reporting_for_duty/', 'created': 1612244123.0}",2021-02-02 05:35:23
99,TheAutisticleGiraffe,1612244122,Stake (Primarily Aussie service) refusing buys of GME due to DriveWealth,https://i.redd.it/r70cgh9040f61.jpg,1612244122.0,"{'author': 'TheAutisticleGiraffe', 'created_utc': 1612244122, 'title': 'Stake (Primarily Aussie service) refusing buys of GME due to DriveWealth', 'url': 'https://i.redd.it/r70cgh9040f61.jpg', 'created': 1612244122.0}",2021-02-02 05:35:22
