,author,created_utc,title,url,created,d_,created_utc_dt
0,HetP0119,1598916977,17K Profit in less than a month. some from AAPL. 10K just today from Tesla,https://i.redd.it/7shz03hkbfk51.jpg,1598916977.0,"{'author': 'HetP0119', 'created_utc': 1598916977, 'title': '17K Profit in less than a month. some from AAPL. 10K just today from Tesla', 'url': 'https://i.redd.it/7shz03hkbfk51.jpg', 'created': 1598916977.0}",2020-08-31 23:36:17
1,holeyhail,1598916975,Do you have an all-in stock right now?,https://www.reddit.com/r/wallstreetbets/comments/ik9a48/do_you_have_an_allin_stock_right_now/,1598916975.0,"{'author': 'holeyhail', 'created_utc': 1598916975, 'title': 'Do you have an all-in stock right now?', 'url': 'https://www.reddit.com/r/wallstreetbets/comments/ik9a48/do_you_have_an_allin_stock_right_now/', 'created': 1598916975.0}",2020-08-31 23:36:15
2,MattMDL,1598916788,"Why $WKHS, a $1.9 Billion company will be worth many times more by December",https://www.reddit.com/r/wallstreetbets/comments/ik98bp/why_wkhs_a_19_billion_company_will_be_worth_many/,1598916788.0,"{'author': 'MattMDL', 'created_utc': 1598916788, 'title': 'Why $WKHS, a $1.9 Billion company will be worth many times more by December', 'url': 'https://www.reddit.com/r/wallstreetbets/comments/ik98bp/why_wkhs_a_19_billion_company_will_be_worth_many/', 'created': 1598916788.0}",2020-08-31 23:33:08
3,holeyhail,1598916760,Do you have an all-in stock right now?,https://www.reddit.com/r/wallstreetbets/comments/ik981v/do_you_have_an_allin_stock_right_now/,1598916760.0,"{'author': 'holeyhail', 'created_utc': 1598916760, 'title': 'Do you have an all-in stock right now?', 'url': 'https://www.reddit.com/r/wallstreetbets/comments/ik981v/do_you_have_an_allin_stock_right_now/', 'created': 1598916760.0}",2020-08-31 23:32:40
4,DonMiketheWise,1598916651,Is it time for VXX,https://www.reddit.com/r/wallstreetbets/comments/ik96y7/is_it_time_for_vxx/,1598916651.0,"{'author': 'DonMiketheWise', 'created_utc': 1598916651, 'title': 'Is it time for VXX', 'url': 'https://www.reddit.com/r/wallstreetbets/comments/ik96y7/is_it_time_for_vxx/', 'created': 1598916651.0}",2020-08-31 23:30:51
5,AstroG8R,1598916599,"Windfall of $20k, What would you do?",https://www.reddit.com/r/wallstreetbets/comments/ik96fh/windfall_of_20k_what_would_you_do/,1598916599.0,"{'author': 'AstroG8R', 'created_utc': 1598916599, 'title': 'Windfall of $20k, What would you do?', 'url': 'https://www.reddit.com/r/wallstreetbets/comments/ik96fh/windfall_of_20k_what_would_you_do/', 'created': 1598916599.0}",2020-08-31 23:29:59
6,anonymouse56,1598916528,yo srsly fuck this discord and fuck this subreddit. you stupid fucks said TSLA puts and this shit keeps mooning. fuck the stock market gay ass money trap,https://i.redd.it/i7mdr8bx9fk51.jpg,1598916528.0,"{'author': 'anonymouse56', 'created_utc': 1598916528, 'title': 'yo srsly fuck this discord and fuck this subreddit. you stupid fucks said TSLA puts and this shit keeps mooning. fuck the stock market gay ass money trap', 'url': 'https://i.redd.it/i7mdr8bx9fk51.jpg', 'created': 1598916528.0}",2020-08-31 23:28:48
7,AslanNoob,1598916501,My friend who knows nothing about the stock marker sent me this.,https://i.redd.it/5eq0p7c5afk51.jpg,1598916501.0,"{'author': 'AslanNoob', 'created_utc': 1598916501, 'title': 'My friend who knows nothing about the stock marker sent me this.', 'url': 'https://i.redd.it/5eq0p7c5afk51.jpg', 'created': 1598916501.0}",2020-08-31 23:28:21
8,fresh_start_101,1598916485,RH asking the SEC how to prepare for the Monday split days.,https://youtu.be/_pVNvSuA2mM,1598916485.0,"{'author': 'fresh_start_101', 'created_utc': 1598916485, 'title': 'RH asking the SEC how to prepare for the Monday split days.', 'url': 'https://youtu.be/_pVNvSuA2mM', 'created': 1598916485.0}",2020-08-31 23:28:05
9,laughingsamm,1598916436,Tard Bears really thought they could take on the Muskrat,https://v.redd.it/kkcle5fs9fk51,1598916436.0,"{'author': 'laughingsamm', 'created_utc': 1598916436, 'title': 'Tard Bears really thought they could take on the Muskrat', 'url': 'https://v.redd.it/kkcle5fs9fk51', 'created': 1598916436.0}",2020-08-31 23:27:16
10,holeyhail,1598916380,If you had to pick one stock to go all-in at the bell tomorrow and had to sell within 3 months what would your pick be,https://www.reddit.com/r/wallstreetbets/comments/ik9474/if_you_had_to_pick_one_stock_to_go_allin_at_the/,1598916380.0,"{'author': 'holeyhail', 'created_utc': 1598916380, 'title': 'If you had to pick one stock to go all-in at the bell tomorrow and had to sell within 3 months what would your pick be', 'url': 'https://www.reddit.com/r/wallstreetbets/comments/ik9474/if_you_had_to_pick_one_stock_to_go_allin_at_the/', 'created': 1598916380.0}",2020-08-31 23:26:20
11,ShAnE6660,1598916358,I'm new and need to know what are good ways to understand the stock market,https://www.reddit.com/r/wallstreetbets/comments/ik93ym/im_new_and_need_to_know_what_are_good_ways_to/,1598916358.0,"{'author': 'ShAnE6660', 'created_utc': 1598916358, 'title': ""I'm new and need to know what are good ways to understand the stock market"", 'url': 'https://www.reddit.com/r/wallstreetbets/comments/ik93ym/im_new_and_need_to_know_what_are_good_ways_to/', 'created': 1598916358.0}",2020-08-31 23:25:58
12,WSBrookie,1598916335,SERIOUS FUCKIN QUESTION,https://www.reddit.com/r/wallstreetbets/comments/ik93pu/serious_fuckin_question/,1598916335.0,"{'author': 'WSBrookie', 'created_utc': 1598916335, 'title': 'SERIOUS FUCKIN QUESTION', 'url': 'https://www.reddit.com/r/wallstreetbets/comments/ik93pu/serious_fuckin_question/', 'created': 1598916335.0}",2020-08-31 23:25:35
13,alexmrljak,1598916309,"Buying 0.2 shares before the split at around 300 I knew the split would just lock in a full share at that price because it’s X5 , I don’t know why I posted this but let’s see how far telsa can go lol",https://i.redd.it/eo2khrmk9fk51.jpg,1598916309.0,"{'author': 'alexmrljak', 'created_utc': 1598916309, 'title': 'Buying 0.2 shares before the split at around 300 I knew the split would just lock in a full share at that price because it’s X5 , I don’t know why I posted this but let’s see how far telsa can go lol', 'url': 'https://i.redd.it/eo2khrmk9fk51.jpg', 'created': 1598916309.0}",2020-08-31 23:25:09
14,holeyhail,1598916293,If you had to pick one stock to go all-in at the bell tomorrow and had to sell within 3 months what would your pick be,https://www.reddit.com/r/wallstreetbets/comments/ik93ap/if_you_had_to_pick_one_stock_to_go_allin_at_the/,1598916293.0,"{'author': 'holeyhail', 'created_utc': 1598916293, 'title': 'If you had to pick one stock to go all-in at the bell tomorrow and had to sell within 3 months what would your pick be', 'url': 'https://www.reddit.com/r/wallstreetbets/comments/ik93ap/if_you_had_to_pick_one_stock_to_go_allin_at_the/', 'created': 1598916293.0}",2020-08-31 23:24:53
15,sandawg_,1598916242,From instagram’s largest meme page. The top is in boys. Positions: $TSLA 14p $AAPL 6p 9/25,https://i.redd.it/r87opord9fk51.jpg,1598916242.0,"{'author': 'sandawg_', 'created_utc': 1598916242, 'title': 'From instagram’s largest meme page. The top is in boys. Positions: $TSLA 14p $AAPL 6p 9/25', 'url': 'https://i.redd.it/r87opord9fk51.jpg', 'created': 1598916242.0}",2020-08-31 23:24:02
16,[deleted],1598916217,The Degenerate Wager,https://www.reddit.com/r/wallstreetbets/comments/ik92fm/the_degenerate_wager/,1598916217.0,"{'author': '[deleted]', 'created_utc': 1598916217, 'title': 'The Degenerate Wager', 'url': 'https://www.reddit.com/r/wallstreetbets/comments/ik92fm/the_degenerate_wager/', 'created': 1598916217.0}",2020-08-31 23:23:37
17,elijahmadonia,1598916155,"Thank you Lon, it’s been a wild ride.",https://i.redd.it/ro71h8ar8fk51.jpg,1598916155.0,"{'author': 'elijahmadonia', 'created_utc': 1598916155, 'title': 'Thank you Lon, it’s been a wild ride.', 'url': 'https://i.redd.it/ro71h8ar8fk51.jpg', 'created': 1598916155.0}",2020-08-31 23:22:35
18,sydgrey12,1598916078,Stonks,https://i.redd.it/r9yrf5pv8fk51.jpg,1598916078.0,"{'author': 'sydgrey12', 'created_utc': 1598916078, 'title': 'Stonks', 'url': 'https://i.redd.it/r9yrf5pv8fk51.jpg', 'created': 1598916078.0}",2020-08-31 23:21:18
19,NoSiteForOldUsers,1598915795,How to predict Elon Musk,https://www.reddit.com/r/wallstreetbets/comments/ik8yde/how_to_predict_elon_musk/,1598915795.0,"{'author': 'NoSiteForOldUsers', 'created_utc': 1598915795, 'title': 'How to predict Elon Musk', 'url': 'https://www.reddit.com/r/wallstreetbets/comments/ik8yde/how_to_predict_elon_musk/', 'created': 1598915795.0}",2020-08-31 23:16:35
20,funkschweezy,1598915658,"Am I on the spectrum, why can’t I buy this? It’s on margin btw",https://www.reddit.com/gallery/ik8wus,1598915658.0,"{'author': 'funkschweezy', 'created_utc': 1598915658, 'title': 'Am I on the spectrum, why can’t I buy this? It’s on margin btw', 'url': 'https://www.reddit.com/gallery/ik8wus', 'created': 1598915658.0}",2020-08-31 23:14:18
21,sirtones1411,1598915639,What is a great resource for someone who is completely new to the investments/investing world?,https://www.reddit.com/r/wallstreetbets/comments/ik8wno/what_is_a_great_resource_for_someone_who_is/,1598915639.0,"{'author': 'sirtones1411', 'created_utc': 1598915639, 'title': 'What is a great resource for someone who is completely new to the investments/investing world?', 'url': 'https://www.reddit.com/r/wallstreetbets/comments/ik8wno/what_is_a_great_resource_for_someone_who_is/', 'created': 1598915639.0}",2020-08-31 23:13:59
22,funkschweezy,1598915565,Am I on the spectrum? Why can’t I buy this? It’s on margin btw,https://www.reddit.com/gallery/ik8vx9,1598915565.0,"{'author': 'funkschweezy', 'created_utc': 1598915565, 'title': 'Am I on the spectrum? Why can’t I buy this? It’s on margin btw', 'url': 'https://www.reddit.com/gallery/ik8vx9', 'created': 1598915565.0}",2020-08-31 23:12:45
23,Needgirlthrowaway,1598915524,"Koreans own Tesla, bull run confirmed.",https://www.bloomberg.com/amp/news/articles/2020-08-31/tesla-s-largest-investors-now-include-south-korea-retail-traders?__twitter_impression=true,1598915524.0,"{'author': 'Needgirlthrowaway', 'created_utc': 1598915524, 'title': 'Koreans own Tesla, bull run confirmed.', 'url': 'https://www.bloomberg.com/amp/news/articles/2020-08-31/tesla-s-largest-investors-now-include-south-korea-retail-traders?__twitter_impression=true', 'created': 1598915524.0}",2020-08-31 23:12:04
24,deviousplant,1598915474,Can one of you retards explain to another retard (me) what the point of options are,https://www.reddit.com/r/wallstreetbets/comments/ik8uw5/can_one_of_you_retards_explain_to_another_retard/,1598915474.0,"{'author': 'deviousplant', 'created_utc': 1598915474, 'title': 'Can one of you retards explain to another retard (me) what the point of options are', 'url': 'https://www.reddit.com/r/wallstreetbets/comments/ik8uw5/can_one_of_you_retards_explain_to_another_retard/', 'created': 1598915474.0}",2020-08-31 23:11:14
25,javawitherspoon,1598915465,those with TSLA or other Tech gains.. any gearheads going to build some badass builds with the $??,https://www.reddit.com/r/wallstreetbets/comments/ik8usk/those_with_tsla_or_other_tech_gains_any_gearheads/,1598915465.0,"{'author': 'javawitherspoon', 'created_utc': 1598915465, 'title': 'those with TSLA or other Tech gains.. any gearheads going to build some badass builds with the $??', 'url': 'https://www.reddit.com/r/wallstreetbets/comments/ik8usk/those_with_tsla_or_other_tech_gains_any_gearheads/', 'created': 1598915465.0}",2020-08-31 23:11:05
26,anikinfartsnacks,1598915433,Who is raking in the cash with $ZM,https://www.reddit.com/r/wallstreetbets/comments/ik8uhp/who_is_raking_in_the_cash_with_zm/,1598915433.0,"{'author': 'anikinfartsnacks', 'created_utc': 1598915433, 'title': 'Who is raking in the cash with $ZM', 'url': 'https://www.reddit.com/r/wallstreetbets/comments/ik8uhp/who_is_raking_in_the_cash_with_zm/', 'created': 1598915433.0}",2020-08-31 23:10:33
27,itsthisthrowasay,1598915194,I am a clown. Here are my clown thoughts from the past eight days.,https://www.reddit.com/r/wallstreetbets/comments/ik8s6k/i_am_a_clown_here_are_my_clown_thoughts_from_the/,1598915194.0,"{'author': 'itsthisthrowasay', 'created_utc': 1598915194, 'title': 'I am a clown. Here are my clown thoughts from the past eight days.', 'url': 'https://www.reddit.com/r/wallstreetbets/comments/ik8s6k/i_am_a_clown_here_are_my_clown_thoughts_from_the/', 'created': 1598915194.0}",2020-08-31 23:06:34
28,mvscjgs,1598915191,From $108K to $1.3M - thanks Papa Elon!,https://i.redd.it/9z12l2e56fk51.png,1598915191.0,"{'author': 'mvscjgs', 'created_utc': 1598915191, 'title': 'From $108K to $1.3M - thanks Papa Elon!', 'url': 'https://i.redd.it/9z12l2e56fk51.png', 'created': 1598915191.0}",2020-08-31 23:06:31
29,dontknowboutme,1598915102,But Tesla just makes cars! They’re an industrials company!,https://i.redd.it/eylkterz5fk51.jpg,1598915102.0,"{'author': 'dontknowboutme', 'created_utc': 1598915102, 'title': 'But Tesla just makes cars! They’re an industrials company!', 'url': 'https://i.redd.it/eylkterz5fk51.jpg', 'created': 1598915102.0}",2020-08-31 23:05:02
30,Broseph__Stylin,1598915077,"Doubled my money in 3 months buying actual stonks. F, D, and C rating kings",https://i.redd.it/q00ay6jm5fk51.png,1598915077.0,"{'author': 'Broseph__Stylin', 'created_utc': 1598915077, 'title': 'Doubled my money in 3 months buying actual stonks. F, D, and C rating kings', 'url': 'https://i.redd.it/q00ay6jm5fk51.png', 'created': 1598915077.0}",2020-08-31 23:04:37
31,gregfromjersey,1598915070,SU Bae Takes No Prisoners,https://i.imgur.com/8QLQARJ.jpg,1598915070.0,"{'author': 'gregfromjersey', 'created_utc': 1598915070, 'title': 'SU Bae Takes No Prisoners', 'url': 'https://i.imgur.com/8QLQARJ.jpg', 'created': 1598915070.0}",2020-08-31 23:04:30
32,Nolimon1,1598914996,Papa Elon has saved me from my stupidity,https://v.redd.it/kkh4vz8d5fk51,1598914996.0,"{'author': 'Nolimon1', 'created_utc': 1598914996, 'title': 'Papa Elon has saved me from my stupidity', 'url': 'https://v.redd.it/kkh4vz8d5fk51', 'created': 1598914996.0}",2020-08-31 23:03:16
33,Graingerx6,1598914745,What should I dump my 1k check into?,https://www.reddit.com/r/wallstreetbets/comments/ik8nez/what_should_i_dump_my_1k_check_into/,1598914745.0,"{'author': 'Graingerx6', 'created_utc': 1598914745, 'title': 'What should I dump my 1k check into?', 'url': 'https://www.reddit.com/r/wallstreetbets/comments/ik8nez/what_should_i_dump_my_1k_check_into/', 'created': 1598914745.0}",2020-08-31 22:59:05
34,_WinnerTakesAll_,1598914585,FML. $15k mistake just because I thought Zoom reported before market opens instead of after. Closed my position one day early.,https://i.redd.it/yn65p2fg4fk51.png,1598914585.0,"{'author': '_WinnerTakesAll_', 'created_utc': 1598914585, 'title': 'FML. $15k mistake just because I thought Zoom reported before market opens instead of after. Closed my position one day early.', 'url': 'https://i.redd.it/yn65p2fg4fk51.png', 'created': 1598914585.0}",2020-08-31 22:56:25
35,fyingpancakes,1598914581,To be RICH is immoral.,https://www.reddit.com/r/wallstreetbets/comments/ik8lu4/to_be_rich_is_immoral/,1598914581.0,"{'author': 'fyingpancakes', 'created_utc': 1598914581, 'title': 'To be RICH is immoral.', 'url': 'https://www.reddit.com/r/wallstreetbets/comments/ik8lu4/to_be_rich_is_immoral/', 'created': 1598914581.0}",2020-08-31 22:56:21
36,jstop547,1598914448,Serious DD: Just saw a Tesla in my neighborhood for the first time,https://www.reddit.com/r/wallstreetbets/comments/ik8kib/serious_dd_just_saw_a_tesla_in_my_neighborhood/,1598914448.0,"{'author': 'jstop547', 'created_utc': 1598914448, 'title': 'Serious DD: Just saw a Tesla in my neighborhood for the first time', 'url': 'https://www.reddit.com/r/wallstreetbets/comments/ik8kib/serious_dd_just_saw_a_tesla_in_my_neighborhood/', 'created': 1598914448.0}",2020-08-31 22:54:08
37,MrSteelio,1598914281,NIO to the moon?,https://www.reddit.com/r/wallstreetbets/comments/ik8iq7/nio_to_the_moon/,1598914281.0,"{'author': 'MrSteelio', 'created_utc': 1598914281, 'title': 'NIO to the moon?', 'url': 'https://www.reddit.com/r/wallstreetbets/comments/ik8iq7/nio_to_the_moon/', 'created': 1598914281.0}",2020-08-31 22:51:21
38,secretlanky,1598914256,Why stocks only go up,https://www.reddit.com/r/wallstreetbets/comments/ik8igj/why_stocks_only_go_up/,1598914256.0,"{'author': 'secretlanky', 'created_utc': 1598914256, 'title': 'Why stocks only go up', 'url': 'https://www.reddit.com/r/wallstreetbets/comments/ik8igj/why_stocks_only_go_up/', 'created': 1598914256.0}",2020-08-31 22:50:56
39,abtoz,1598914167,Is Tesla overvalued?,https://www.reddit.com/r/wallstreetbets/comments/ik8hbs/is_tesla_overvalued/,1598914167.0,"{'author': 'abtoz', 'created_utc': 1598914167, 'title': 'Is Tesla overvalued?', 'url': 'https://www.reddit.com/r/wallstreetbets/comments/ik8hbs/is_tesla_overvalued/', 'created': 1598914167.0}",2020-08-31 22:49:27
40,Broseph__Stylin,1598914104,My first 100% gain in a day. Thanks daddy Musk.,https://i.redd.it/w4mxj9xx2fk51.png,1598914104.0,"{'author': 'Broseph__Stylin', 'created_utc': 1598914104, 'title': 'My first 100% gain in a day. Thanks daddy Musk.', 'url': 'https://i.redd.it/w4mxj9xx2fk51.png', 'created': 1598914104.0}",2020-08-31 22:48:24
41,MaybeElonMaybeNot,1598913976,“Don’t sell puts on tesla!”,https://i.redd.it/vaq7eo1n2fk51.jpg,1598913976.0,"{'author': 'MaybeElonMaybeNot', 'created_utc': 1598913976, 'title': '“Don’t sell puts on tesla!”', 'url': 'https://i.redd.it/vaq7eo1n2fk51.jpg', 'created': 1598913976.0}",2020-08-31 22:46:16
42,v____v,1598913975,"Weaboo Buffett increasing stakes to over 9000% in Mitsubishi, Itochu, Marubeni, Mitsui &amp; Co and Sumitomo",https://i.redd.it/env2vg6h2fk51.png,1598913975.0,"{'author': 'v____v', 'created_utc': 1598913975, 'title': 'Weaboo Buffett increasing stakes to over 9000% in Mitsubishi, Itochu, Marubeni, Mitsui &amp; Co and Sumitomo', 'url': 'https://i.redd.it/env2vg6h2fk51.png', 'created': 1598913975.0}",2020-08-31 22:46:15
43,suyash7a,1598913896,Tesla Stock is for 420.69% Retards,https://www.reddit.com/r/wallstreetbets/comments/ik8egb/tesla_stock_is_for_42069_retards/,1598913896.0,"{'author': 'suyash7a', 'created_utc': 1598913896, 'title': 'Tesla Stock is for 420.69% Retards', 'url': 'https://www.reddit.com/r/wallstreetbets/comments/ik8egb/tesla_stock_is_for_42069_retards/', 'created': 1598913896.0}",2020-08-31 22:44:56
44,TheOptionsTrader,1598913883,How about some TSLA leap calls ?,https://www.reddit.com/r/wallstreetbets/comments/ik8ec7/how_about_some_tsla_leap_calls/,1598913883.0,"{'author': 'TheOptionsTrader', 'created_utc': 1598913883, 'title': 'How about some TSLA leap calls ?', 'url': 'https://www.reddit.com/r/wallstreetbets/comments/ik8ec7/how_about_some_tsla_leap_calls/', 'created': 1598913883.0}",2020-08-31 22:44:43
45,MyPetEskimo,1598913871,my trading starts tomorrow,https://www.reddit.com/r/wallstreetbets/comments/ik8e7g/my_trading_starts_tomorrow/,1598913871.0,"{'author': 'MyPetEskimo', 'created_utc': 1598913871, 'title': 'my trading starts tomorrow', 'url': 'https://www.reddit.com/r/wallstreetbets/comments/ik8e7g/my_trading_starts_tomorrow/', 'created': 1598913871.0}",2020-08-31 22:44:31
46,Rhino4788,1598913870,ThetaGange questions,https://www.reddit.com/r/wallstreetbets/comments/ik8e7b/thetagange_questions/,1598913870.0,"{'author': 'Rhino4788', 'created_utc': 1598913870, 'title': 'ThetaGange questions', 'url': 'https://www.reddit.com/r/wallstreetbets/comments/ik8e7b/thetagange_questions/', 'created': 1598913870.0}",2020-08-31 22:44:30
47,kickace,1598913773,'Twas the Night Before Earnings ($WORK),https://www.reddit.com/r/wallstreetbets/comments/ik8d7j/twas_the_night_before_earnings_work/,1598913773.0,"{'author': 'kickace', 'created_utc': 1598913773, 'title': ""'Twas the Night Before Earnings ($WORK)"", 'url': 'https://www.reddit.com/r/wallstreetbets/comments/ik8d7j/twas_the_night_before_earnings_work/', 'created': 1598913773.0}",2020-08-31 22:42:53
48,FlagCity24769,1598913749,FUCK TESLA. I HOPE Y'ALL HOLD THE BAG UNTIL IT GOES TO $50,https://www.reddit.com/r/wallstreetbets/comments/ik8cyg/fuck_tesla_i_hope_yall_hold_the_bag_until_it_goes/,1598913749.0,"{'author': 'FlagCity24769', 'created_utc': 1598913749, 'title': ""FUCK TESLA. I HOPE Y'ALL HOLD THE BAG UNTIL IT GOES TO $50"", 'url': 'https://www.reddit.com/r/wallstreetbets/comments/ik8cyg/fuck_tesla_i_hope_yall_hold_the_bag_until_it_goes/', 'created': 1598913749.0}",2020-08-31 22:42:29
49,TheOptionsTrader,1598913749,How about some TSLA leap calls,https://www.reddit.com/r/wallstreetbets/comments/ik8cya/how_about_some_tsla_leap_calls/,1598913749.0,"{'author': 'TheOptionsTrader', 'created_utc': 1598913749, 'title': 'How about some TSLA leap calls', 'url': 'https://www.reddit.com/r/wallstreetbets/comments/ik8cya/how_about_some_tsla_leap_calls/', 'created': 1598913749.0}",2020-08-31 22:42:29
50,909808606,1598913404,Why is Robinhood doing this?!?!,https://www.reddit.com/r/wallstreetbets/comments/ik89de/why_is_robinhood_doing_this/,1598913404.0,"{'author': '909808606', 'created_utc': 1598913404, 'title': 'Why is Robinhood doing this?!?!', 'url': 'https://www.reddit.com/r/wallstreetbets/comments/ik89de/why_is_robinhood_doing_this/', 'created': 1598913404.0}",2020-08-31 22:36:44
51,Alyosha_at_sea,1598913391,Guns! And ammo,https://www.reddit.com/r/wallstreetbets/comments/ik898n/guns_and_ammo/,1598913391.0,"{'author': 'Alyosha_at_sea', 'created_utc': 1598913391, 'title': 'Guns! And ammo', 'url': 'https://www.reddit.com/r/wallstreetbets/comments/ik898n/guns_and_ammo/', 'created': 1598913391.0}",2020-08-31 22:36:31
52,StocksDreamer,1598913316,Crm zm kind of option picks,https://www.reddit.com/r/wallstreetbets/comments/ik88hd/crm_zm_kind_of_option_picks/,1598913316.0,"{'author': 'StocksDreamer', 'created_utc': 1598913316, 'title': 'Crm zm kind of option picks', 'url': 'https://www.reddit.com/r/wallstreetbets/comments/ik88hd/crm_zm_kind_of_option_picks/', 'created': 1598913316.0}",2020-08-31 22:35:16
53,gregfromjersey,1598913141,"AMD Gang RISE UP, SU BAE takes No Prisoners",https://i.redd.it/t3y54es00fk51.png,1598913141.0,"{'author': 'gregfromjersey', 'created_utc': 1598913141, 'title': 'AMD Gang RISE UP, SU BAE takes No Prisoners', 'url': 'https://i.redd.it/t3y54es00fk51.png', 'created': 1598913141.0}",2020-08-31 22:32:21
54,youseeberkeley,1598913006,You don't always get second chances. This is your second chance. [TSLA],https://www.reddit.com/r/wallstreetbets/comments/ik858x/you_dont_always_get_second_chances_this_is_your/,1598913006.0,"{'author': 'youseeberkeley', 'created_utc': 1598913006, 'title': ""You don't always get second chances. This is your second chance. [TSLA]"", 'url': 'https://www.reddit.com/r/wallstreetbets/comments/ik858x/you_dont_always_get_second_chances_this_is_your/', 'created': 1598913006.0}",2020-08-31 22:30:06
55,I_love_boobs86,1598912945,It begins.....I’ll be down to $0 in a few days at this rate,https://ibb.co/S7m97FL,1598912945.0,"{'author': 'I_love_boobs86', 'created_utc': 1598912945, 'title': 'It begins.....I’ll be down to $0 in a few days at this rate', 'url': 'https://ibb.co/S7m97FL', 'created': 1598912945.0}",2020-08-31 22:29:05
56,Game_Ace,1598912866,if this is not a sign that market is overvalued I don't know what will,https://www.reddit.com/r/wallstreetbets/comments/ik83up/if_this_is_not_a_sign_that_market_is_overvalued_i/,1598912866.0,"{'author': 'Game_Ace', 'created_utc': 1598912866, 'title': ""if this is not a sign that market is overvalued I don't know what will"", 'url': 'https://www.reddit.com/r/wallstreetbets/comments/ik83up/if_this_is_not_a_sign_that_market_is_overvalued_i/', 'created': 1598912866.0}",2020-08-31 22:27:46
57,mclark2000,1598912851,Some TSLA gain porn🔥🔥🔥,https://i.redd.it/mw0pvinazek51.jpg,1598912851.0,"{'author': 'mclark2000', 'created_utc': 1598912851, 'title': 'Some TSLA gain porn🔥🔥🔥', 'url': 'https://i.redd.it/mw0pvinazek51.jpg', 'created': 1598912851.0}",2020-08-31 22:27:31
58,Bosslol41,1598912790,DONT FUCK WITH DA MUSKRAT,https://i.redd.it/6g9oe074zek51.jpg,1598912790.0,"{'author': 'Bosslol41', 'created_utc': 1598912790, 'title': 'DONT FUCK WITH DA MUSKRAT', 'url': 'https://i.redd.it/6g9oe074zek51.jpg', 'created': 1598912790.0}",2020-08-31 22:26:30
59,alexmrljak,1598912786,Buy kyckr on the asx wait for 6 days &amp; thank me later.,https://www.reddit.com/r/wallstreetbets/comments/ik830o/buy_kyckr_on_the_asx_wait_for_6_days_thank_me/,1598912786.0,"{'author': 'alexmrljak', 'created_utc': 1598912786, 'title': 'Buy kyckr on the asx wait for 6 days &amp; thank me later.', 'url': 'https://www.reddit.com/r/wallstreetbets/comments/ik830o/buy_kyckr_on_the_asx_wait_for_6_days_thank_me/', 'created': 1598912786.0}",2020-08-31 22:26:26
60,samspenc,1598912784,Papa Musk now 3rd richest in the world; worth more than Zuckerberg,https://i.redd.it/pfpkp7dwyek51.jpg,1598912784.0,"{'author': 'samspenc', 'created_utc': 1598912784, 'title': 'Papa Musk now 3rd richest in the world; worth more than Zuckerberg', 'url': 'https://i.redd.it/pfpkp7dwyek51.jpg', 'created': 1598912784.0}",2020-08-31 22:26:24
61,MalyGanjik,1598912719,"Fuck you, random citizen !",https://i.redd.it/n6m3xveuyek51.png,1598912719.0,"{'author': 'MalyGanjik', 'created_utc': 1598912719, 'title': 'Fuck you, random citizen !', 'url': 'https://i.redd.it/n6m3xveuyek51.png', 'created': 1598912719.0}",2020-08-31 22:25:19
62,MrJarhead_,1598912662,"Bought my first call today, could have made $100 easy but i sold too early. Stage fright..",https://i.redd.it/vfpirtiqyek51.jpg,1598912662.0,"{'author': 'MrJarhead_', 'created_utc': 1598912662, 'title': 'Bought my first call today, could have made $100 easy but i sold too early. Stage fright..', 'url': 'https://i.redd.it/vfpirtiqyek51.jpg', 'created': 1598912662.0}",2020-08-31 22:24:22
