,author,created_utc,title,url,created,d_,created_utc_dt
0,PvtBrasilball,1607541901,Rocket has been fueled and ready for takeoff.,https://i.redd.it/b4qkvrhsp7461.jpg,1607541901.0,"{'author': 'PvtBrasilball', 'created_utc': 1607541901, 'title': 'Rocket has been fueled and ready for takeoff.', 'url': 'https://i.redd.it/b4qkvrhsp7461.jpg', 'created': 1607541901.0}",2020-12-09 19:25:01
1,BobbyAxeAxelrod,1607541896,WSB giveth. WSB taketh away.,https://i.redd.it/9bgvcpdvp7461.jpg,1607541896.0,"{'author': 'BobbyAxeAxelrod', 'created_utc': 1607541896, 'title': 'WSB giveth. WSB taketh away.', 'url': 'https://i.redd.it/9bgvcpdvp7461.jpg', 'created': 1607541896.0}",2020-12-09 19:24:56
2,TreeStarsLookJuicy,1607541878,Listed 9/25 for $5. Today it went up 2000%. How and why? I truly don’t understand,https://i.redd.it/obmwz1qtp7461.jpg,1607541878.0,"{'author': 'TreeStarsLookJuicy', 'created_utc': 1607541878, 'title': 'Listed 9/25 for $5. Today it went up 2000%. How and why? I truly don’t understand', 'url': 'https://i.redd.it/obmwz1qtp7461.jpg', 'created': 1607541878.0}",2020-12-09 19:24:38
3,vaultguru123,1607541765,What do y’all think will happen to United States Steel(X) over the rest of January?,https://www.reddit.com/r/wallstreetbets/comments/k9ykub/what_do_yall_think_will_happen_to_united_states/,1607541765.0,"{'author': 'vaultguru123', 'created_utc': 1607541765, 'title': 'What do y’all think will happen to United States Steel(X) over the rest of January?', 'url': 'https://www.reddit.com/r/wallstreetbets/comments/k9ykub/what_do_yall_think_will_happen_to_united_states/', 'created': 1607541765.0}",2020-12-09 19:22:45
4,jpeura4,1607541758,ASTI to the moon 🚀🚀🌙🚀🚀🚀🚀and beyond,https://www.reddit.com/r/wallstreetbets/comments/k9uoa6/how_do_you_help_friends_like_these_hes_in_his_3rd/?utm_source=share&amp;utm_medium=ios_app&amp;utm_name=iossmf,1607541758.0,"{'author': 'jpeura4', 'created_utc': 1607541758, 'title': 'ASTI to the moon 🚀🚀🌙🚀🚀🚀🚀and beyond', 'url': 'https://www.reddit.com/r/wallstreetbets/comments/k9uoa6/how_do_you_help_friends_like_these_hes_in_his_3rd/?utm_source=share&amp;utm_medium=ios_app&amp;utm_name=iossmf', 'created': 1607541758.0}",2020-12-09 19:22:38
5,praisomnisf,1607541758,Options on Pfizer and GameStop... Also I've decided that I'm switching to E-Trade. I need trailing stops.,https://i.redd.it/wuudw3vgp7461.png,1607541758.0,"{'author': 'praisomnisf', 'created_utc': 1607541758, 'title': ""Options on Pfizer and GameStop... Also I've decided that I'm switching to E-Trade. I need trailing stops."", 'url': 'https://i.redd.it/wuudw3vgp7461.png', 'created': 1607541758.0}",2020-12-09 19:22:38
6,Pangalac_gargleblstr,1607541749,Doordash cash out,https://www.reddit.com/r/wallstreetbets/comments/k9ykmk/doordash_cash_out/,1607541749.0,"{'author': 'Pangalac_gargleblstr', 'created_utc': 1607541749, 'title': 'Doordash cash out', 'url': 'https://www.reddit.com/r/wallstreetbets/comments/k9ykmk/doordash_cash_out/', 'created': 1607541749.0}",2020-12-09 19:22:29
7,heimsins_konungr,1607541720,"No market manipulation to see here, everyone just decided to sell stock at the same rate as all these other unrelated stock, move along now...",https://imgur.com/hy9h5Th,1607541720.0,"{'author': 'heimsins_konungr', 'created_utc': 1607541720, 'title': 'No market manipulation to see here, everyone just decided to sell stock at the same rate as all these other unrelated stock, move along now...', 'url': 'https://imgur.com/hy9h5Th', 'created': 1607541720.0}",2020-12-09 19:22:00
8,TronPaul,1607541706,Breaking: NKLA testing new technology making options impervious to delta,https://imgur.com/v7kGO4Z,1607541706.0,"{'author': 'TronPaul', 'created_utc': 1607541706, 'title': 'Breaking: NKLA testing new technology making options impervious to delta', 'url': 'https://imgur.com/v7kGO4Z', 'created': 1607541706.0}",2020-12-09 19:21:46
9,throwawaynumber1ne,1607541693,How retarded am I? Banking on the WKHS/USPS contract and CVS vaccine distribution,https://i.redd.it/dwzp56x9p7461.jpg,1607541693.0,"{'author': 'throwawaynumber1ne', 'created_utc': 1607541693, 'title': 'How retarded am I? Banking on the WKHS/USPS contract and CVS vaccine distribution', 'url': 'https://i.redd.it/dwzp56x9p7461.jpg', 'created': 1607541693.0}",2020-12-09 19:21:33
10,letsgo999ship,1607541689,Is this extremely stupid?,https://www.reddit.com/r/wallstreetbets/comments/k9yjvs/is_this_extremely_stupid/,1607541689.0,"{'author': 'letsgo999ship', 'created_utc': 1607541689, 'title': 'Is this extremely stupid?', 'url': 'https://www.reddit.com/r/wallstreetbets/comments/k9yjvs/is_this_extremely_stupid/', 'created': 1607541689.0}",2020-12-09 19:21:29
11,BigBlackCrocs,1607541627,"Hey Fitbit, you good there?",https://i.redd.it/5expjow2p7461.jpg,1607541627.0,"{'author': 'BigBlackCrocs', 'created_utc': 1607541627, 'title': 'Hey Fitbit, you good there?', 'url': 'https://i.redd.it/5expjow2p7461.jpg', 'created': 1607541627.0}",2020-12-09 19:20:27
12,lmaccaro,1607541503,GM cruise first fully autonomous car on public roads no safety driver. GM to the moon!,https://techcrunch.com/2020/12/09/cruise-begins-driverless-testing-in-san-francisco/,1607541503.0,"{'author': 'lmaccaro', 'created_utc': 1607541503, 'title': 'GM cruise first fully autonomous car on public roads no safety driver. GM to the moon!', 'url': 'https://techcrunch.com/2020/12/09/cruise-begins-driverless-testing-in-san-francisco/', 'created': 1607541503.0}",2020-12-09 19:18:23
13,Gollygop55,1607541465,the market this afternoon 😲🥺,https://youtu.be/HNnCL0q3EuI,1607541465.0,"{'author': 'Gollygop55', 'created_utc': 1607541465, 'title': 'the market this afternoon 😲🥺', 'url': 'https://youtu.be/HNnCL0q3EuI', 'created': 1607541465.0}",2020-12-09 19:17:45
14,Ivalueyouropinionman,1607541461,"You guys suck, you ruin your own portfolio and inadvertently harm real investors portfolios",https://www.reddit.com/r/wallstreetbets/comments/k9yh2m/you_guys_suck_you_ruin_your_own_portfolio_and/,1607541461.0,"{'author': 'Ivalueyouropinionman', 'created_utc': 1607541461, 'title': 'You guys suck, you ruin your own portfolio and inadvertently harm real investors portfolios', 'url': 'https://www.reddit.com/r/wallstreetbets/comments/k9yh2m/you_guys_suck_you_ruin_your_own_portfolio_and/', 'created': 1607541461.0}",2020-12-09 19:17:41
15,Betweenirl,1607541421,GME🚀🚀🚀🚀🚀🚀,https://i.redd.it/2ji3btsgo7461.jpg,1607541421.0,"{'author': 'Betweenirl', 'created_utc': 1607541421, 'title': 'GME🚀🚀🚀🚀🚀🚀', 'url': 'https://i.redd.it/2ji3btsgo7461.jpg', 'created': 1607541421.0}",2020-12-09 19:17:01
16,jesus321,1607541405,Anyone else in on Fitbit?,https://www.reddit.com/r/wallstreetbets/comments/k9ygff/anyone_else_in_on_fitbit/,1607541405.0,"{'author': 'jesus321', 'created_utc': 1607541405, 'title': 'Anyone else in on Fitbit?', 'url': 'https://www.reddit.com/r/wallstreetbets/comments/k9ygff/anyone_else_in_on_fitbit/', 'created': 1607541405.0}",2020-12-09 19:16:45
17,esketemineking1400,1607541387,Am I doing this right?,https://i.redd.it/3ap31b8do7461.jpg,1607541387.0,"{'author': 'esketemineking1400', 'created_utc': 1607541387, 'title': 'Am I doing this right?', 'url': 'https://i.redd.it/3ap31b8do7461.jpg', 'created': 1607541387.0}",2020-12-09 19:16:27
18,DrBingBong69,1607541301,Update on Greenwich- threw everything I had in my bank account at them and they responded with gains. We eating ramen tonight but we eating goooood retards,https://i.redd.it/vv4yitt3o7461.jpg,1607541301.0,"{'author': 'DrBingBong69', 'created_utc': 1607541301, 'title': 'Update on Greenwich- threw everything I had in my bank account at them and they responded with gains. We eating ramen tonight but we eating goooood retards', 'url': 'https://i.redd.it/vv4yitt3o7461.jpg', 'created': 1607541301.0}",2020-12-09 19:15:01
19,mattchambers4199,1607541297,"$TSLA, buy the dip boys",https://i.redd.it/6wnhine3o7461.jpg,1607541297.0,"{'author': 'mattchambers4199', 'created_utc': 1607541297, 'title': '$TSLA, buy the dip boys', 'url': 'https://i.redd.it/6wnhine3o7461.jpg', 'created': 1607541297.0}",2020-12-09 19:14:57
20,yaga3w3,1607541232,godspeed autists,https://i.redd.it/5fqogubun7461.png,1607541232.0,"{'author': 'yaga3w3', 'created_utc': 1607541232, 'title': 'godspeed autists', 'url': 'https://i.redd.it/5fqogubun7461.png', 'created': 1607541232.0}",2020-12-09 19:13:52
21,enfiniti27,1607541221,Got banned from /r/daytradingoptions after calling out a mod for not knowing the difference between negative and positive numbers for earnings,https://i.redd.it/1p6uwk9pn7461.jpg,1607541221.0,"{'author': 'enfiniti27', 'created_utc': 1607541221, 'title': 'Got banned from /r/daytradingoptions after calling out a mod for not knowing the difference between negative and positive numbers for earnings', 'url': 'https://i.redd.it/1p6uwk9pn7461.jpg', 'created': 1607541221.0}",2020-12-09 19:13:41
22,DrBingBong69,1607541203,Update on GLSI- just threw everything in my bank account at Greenwich and they blessed me with gains. Eating ramen tonight but we eating goooooooood retards,https://i.redd.it/uo1sogitn7461.jpg,1607541203.0,"{'author': 'DrBingBong69', 'created_utc': 1607541203, 'title': 'Update on GLSI- just threw everything in my bank account at Greenwich and they blessed me with gains. Eating ramen tonight but we eating goooooooood retards', 'url': 'https://i.redd.it/uo1sogitn7461.jpg', 'created': 1607541203.0}",2020-12-09 19:13:23
23,josiahcampbell10,1607541171,BruhBerry,https://www.reddit.com/r/wallstreetbets/comments/k9ydib/bruhberry/,1607541171.0,"{'author': 'josiahcampbell10', 'created_utc': 1607541171, 'title': 'BruhBerry', 'url': 'https://www.reddit.com/r/wallstreetbets/comments/k9ydib/bruhberry/', 'created': 1607541171.0}",2020-12-09 19:12:51
24,MarginCallMagnus,1607541166,Dominating since day 1,https://i.redd.it/fz58iffpn7461.jpg,1607541166.0,"{'author': 'MarginCallMagnus', 'created_utc': 1607541166, 'title': 'Dominating since day 1', 'url': 'https://i.redd.it/fz58iffpn7461.jpg', 'created': 1607541166.0}",2020-12-09 19:12:46
25,Gnarly_Sarley,1607541105,Did anyone else get in on GLSI this morning?,https://i.redd.it/exp1gaxin7461.jpg,1607541105.0,"{'author': 'Gnarly_Sarley', 'created_utc': 1607541105, 'title': 'Did anyone else get in on GLSI this morning?', 'url': 'https://i.redd.it/exp1gaxin7461.jpg', 'created': 1607541105.0}",2020-12-09 19:11:45
26,RektByWallstreet,1607541092,RKT-&gt;PRPL-&gt;DONNIE PUMP AND DUMP-&gt;ELON TWEETING BATTERY DAY-&gt; PALINTARDS -&gt; TODAY,https://i.redd.it/mtdwp2nhn7461.jpg,1607541092.0,"{'author': 'RektByWallstreet', 'created_utc': 1607541092, 'title': 'RKT-&gt;PRPL-&gt;DONNIE PUMP AND DUMP-&gt;ELON TWEETING BATTERY DAY-&gt; PALINTARDS -&gt; TODAY', 'url': 'https://i.redd.it/mtdwp2nhn7461.jpg', 'created': 1607541092.0}",2020-12-09 19:11:32
27,Nana1879,1607541073,WHAT ARE YOUR THOUGHTS ABOUT CALL ON PFIZER,https://www.reddit.com/r/wallstreetbets/comments/k9ycae/what_are_your_thoughts_about_call_on_pfizer/,1607541073.0,"{'author': 'Nana1879', 'created_utc': 1607541073, 'title': 'WHAT ARE YOUR THOUGHTS ABOUT CALL ON PFIZER', 'url': 'https://www.reddit.com/r/wallstreetbets/comments/k9ycae/what_are_your_thoughts_about_call_on_pfizer/', 'created': 1607541073.0}",2020-12-09 19:11:13
28,CreatingCreatively,1607541013,RED ALERT. HUGE SELL OFF HAPPENING NOW. BIG BEAR MARKET INC.,https://www.reddit.com/r/wallstreetbets/comments/k9ybk2/red_alert_huge_sell_off_happening_now_big_bear/,1607541013.0,"{'author': 'CreatingCreatively', 'created_utc': 1607541013, 'title': 'RED ALERT. HUGE SELL OFF HAPPENING NOW. BIG BEAR MARKET INC.', 'url': 'https://www.reddit.com/r/wallstreetbets/comments/k9ybk2/red_alert_huge_sell_off_happening_now_big_bear/', 'created': 1607541013.0}",2020-12-09 19:10:13
29,Wu-Han,1607540975,SUPPORT THE MARKETS!!,https://www.reddit.com/r/wallstreetbets/comments/k9yb2h/support_the_markets/,1607540975.0,"{'author': 'Wu-Han', 'created_utc': 1607540975, 'title': 'SUPPORT THE MARKETS!!', 'url': 'https://www.reddit.com/r/wallstreetbets/comments/k9yb2h/support_the_markets/', 'created': 1607540975.0}",2020-12-09 19:09:35
30,WTHRYSC3D,1607540963,anyone knows whats going on here?,https://i.redd.it/bhluaul1n7461.png,1607540963.0,"{'author': 'WTHRYSC3D', 'created_utc': 1607540963, 'title': 'anyone knows whats going on here?', 'url': 'https://i.redd.it/bhluaul1n7461.png', 'created': 1607540963.0}",2020-12-09 19:09:23
31,slimsloop,1607540925,It sucks to suck!,https://i.redd.it/8iik652rm7461.png,1607540925.0,"{'author': 'slimsloop', 'created_utc': 1607540925, 'title': 'It sucks to suck!', 'url': 'https://i.redd.it/8iik652rm7461.png', 'created': 1607540925.0}",2020-12-09 19:08:45
32,Shadow_Bullet,1607540892,Have your damn loss porn,https://i.imgur.com/EVHg8Ls.jpg,1607540892.0,"{'author': 'Shadow_Bullet', 'created_utc': 1607540892, 'title': 'Have your damn loss porn', 'url': 'https://i.imgur.com/EVHg8Ls.jpg', 'created': 1607540892.0}",2020-12-09 19:08:12
33,wsbbeer,1607540876,TSLA Bag Holders - Where’s all the posts today?,https://www.reddit.com/r/wallstreetbets/comments/k9y9sg/tsla_bag_holders_wheres_all_the_posts_today/,1607540876.0,"{'author': 'wsbbeer', 'created_utc': 1607540876, 'title': 'TSLA Bag Holders - Where’s all the posts today?', 'url': 'https://www.reddit.com/r/wallstreetbets/comments/k9y9sg/tsla_bag_holders_wheres_all_the_posts_today/', 'created': 1607540876.0}",2020-12-09 19:07:56
34,CoolHandHazard,1607540864,Always disappointment,https://i.redd.it/im1xim3tm7461.jpg,1607540864.0,"{'author': 'CoolHandHazard', 'created_utc': 1607540864, 'title': 'Always disappointment', 'url': 'https://i.redd.it/im1xim3tm7461.jpg', 'created': 1607540864.0}",2020-12-09 19:07:44
35,TKGTAVMysteryHunter,1607540851,"How we can all easily make millions on stocks, while spending very little money.",https://www.reddit.com/r/wallstreetbets/comments/k9y9iu/how_we_can_all_easily_make_millions_on_stocks/,1607540851.0,"{'author': 'TKGTAVMysteryHunter', 'created_utc': 1607540851, 'title': 'How we can all easily make millions on stocks, while spending very little money.', 'url': 'https://www.reddit.com/r/wallstreetbets/comments/k9y9iu/how_we_can_all_easily_make_millions_on_stocks/', 'created': 1607540851.0}",2020-12-09 19:07:31
36,PapiGrande52,1607540837,Breast cancer cure?,https://i.redd.it/rvdq7i7qm7461.jpg,1607540837.0,"{'author': 'PapiGrande52', 'created_utc': 1607540837, 'title': 'Breast cancer cure?', 'url': 'https://i.redd.it/rvdq7i7qm7461.jpg', 'created': 1607540837.0}",2020-12-09 19:07:17
37,Boemerangman2,1607540815,"TESLA IS DOWN, BUY THE DIP!!!!",https://www.reddit.com/r/wallstreetbets/comments/k9y93j/tesla_is_down_buy_the_dip/,1607540815.0,"{'author': 'Boemerangman2', 'created_utc': 1607540815, 'title': 'TESLA IS DOWN, BUY THE DIP!!!!', 'url': 'https://www.reddit.com/r/wallstreetbets/comments/k9y93j/tesla_is_down_buy_the_dip/', 'created': 1607540815.0}",2020-12-09 19:06:55
38,ShtLLBuffout,1607540808,Ummmm... anyone watching this sh!t?,https://i.redd.it/8jip912nm7461.jpg,1607540808.0,"{'author': 'ShtLLBuffout', 'created_utc': 1607540808, 'title': 'Ummmm... anyone watching this sh!t?', 'url': 'https://i.redd.it/8jip912nm7461.jpg', 'created': 1607540808.0}",2020-12-09 19:06:48
39,pb-peanutbutter,1607540773,"First time doing options, and let’s just say I got a little greedy.",https://i.redd.it/y52qergjm7461.jpg,1607540773.0,"{'author': 'pb-peanutbutter', 'created_utc': 1607540773, 'title': 'First time doing options, and let’s just say I got a little greedy.', 'url': 'https://i.redd.it/y52qergjm7461.jpg', 'created': 1607540773.0}",2020-12-09 19:06:13
40,basingse_coffee,1607540773,Real Question: today is a fire sale. What’s the best option for a stock that will quickly recover?,https://www.reddit.com/r/wallstreetbets/comments/k9y8k9/real_question_today_is_a_fire_sale_whats_the_best/,1607540773.0,"{'author': 'basingse_coffee', 'created_utc': 1607540773, 'title': 'Real Question: today is a fire sale. What’s the best option for a stock that will quickly recover?', 'url': 'https://www.reddit.com/r/wallstreetbets/comments/k9y8k9/real_question_today_is_a_fire_sale_whats_the_best/', 'created': 1607540773.0}",2020-12-09 19:06:13
41,Bhamilton0347,1607540738,Update,https://i.redd.it/hzxn1hpfm7461.jpg,1607540738.0,"{'author': 'Bhamilton0347', 'created_utc': 1607540738, 'title': 'Update', 'url': 'https://i.redd.it/hzxn1hpfm7461.jpg', 'created': 1607540738.0}",2020-12-09 19:05:38
42,WSBConsensus,1607540719,"Equities continue to see downside, without any obvious headline trigger",https://www.reddit.com/r/wallstreetbets/comments/k9y7vk/equities_continue_to_see_downside_without_any/,1607540719.0,"{'author': 'WSBConsensus', 'created_utc': 1607540719, 'title': 'Equities continue to see downside, without any obvious headline trigger', 'url': 'https://www.reddit.com/r/wallstreetbets/comments/k9y7vk/equities_continue_to_see_downside_without_any/', 'created': 1607540719.0}",2020-12-09 19:05:19
43,Im_extrastupid,1607540709,Unban this autist he called the top but got banned on Sunday by gay mods,https://i.redd.it/1kcrcilcm7461.jpg,1607540709.0,"{'author': 'Im_extrastupid', 'created_utc': 1607540709, 'title': 'Unban this autist he called the top but got banned on Sunday by gay mods', 'url': 'https://i.redd.it/1kcrcilcm7461.jpg', 'created': 1607540709.0}",2020-12-09 19:05:09
44,Dashover,1607540628,Oof,https://i.redd.it/u2vhacv3m7461.jpg,1607540628.0,"{'author': 'Dashover', 'created_utc': 1607540628, 'title': 'Oof', 'url': 'https://i.redd.it/u2vhacv3m7461.jpg', 'created': 1607540628.0}",2020-12-09 19:03:48
45,WoOoOoOoShHhHh,1607540610,Stocks are dropping rn. Please tell me what to buy in the dip,https://www.reddit.com/r/wallstreetbets/comments/k9y6j3/stocks_are_dropping_rn_please_tell_me_what_to_buy/,1607540610.0,"{'author': 'WoOoOoOoShHhHh', 'created_utc': 1607540610, 'title': 'Stocks are dropping rn. Please tell me what to buy in the dip', 'url': 'https://www.reddit.com/r/wallstreetbets/comments/k9y6j3/stocks_are_dropping_rn_please_tell_me_what_to_buy/', 'created': 1607540610.0}",2020-12-09 19:03:30
46,jdmuru99,1607540578,Cineworld,https://www.reddit.com/r/wallstreetbets/comments/k9y644/cineworld/,1607540578.0,"{'author': 'jdmuru99', 'created_utc': 1607540578, 'title': 'Cineworld', 'url': 'https://www.reddit.com/r/wallstreetbets/comments/k9y644/cineworld/', 'created': 1607540578.0}",2020-12-09 19:02:58
47,MclaurinPCBuilds,1607540577,"What Tesla did in 5 years, this just did (even more) in under 5 hours.",https://i.redd.it/4rb7dbdyl7461.jpg,1607540577.0,"{'author': 'MclaurinPCBuilds', 'created_utc': 1607540577, 'title': 'What Tesla did in 5 years, this just did (even more) in under 5 hours.', 'url': 'https://i.redd.it/4rb7dbdyl7461.jpg', 'created': 1607540577.0}",2020-12-09 19:02:57
48,nacholibre123movies,1607540547,And so it begins,https://i.redd.it/d6tajm2vl7461.png,1607540547.0,"{'author': 'nacholibre123movies', 'created_utc': 1607540547, 'title': 'And so it begins', 'url': 'https://i.redd.it/d6tajm2vl7461.png', 'created': 1607540547.0}",2020-12-09 19:02:27
49,Joeizpro,1607540540,"So i listened to y’all, but i guess a bit late 🥴 Went from +40% all time to -20% in a few seconds",https://i.redd.it/6vsx2vuql7461.jpg,1607540540.0,"{'author': 'Joeizpro', 'created_utc': 1607540540, 'title': 'So i listened to y’all, but i guess a bit late 🥴 Went from +40% all time to -20% in a few seconds', 'url': 'https://i.redd.it/6vsx2vuql7461.jpg', 'created': 1607540540.0}",2020-12-09 19:02:20
50,PufferfishJamz,1607540518,PUMPPP,https://www.reddit.com/gallery/k9y5d9,1607540518.0,"{'author': 'PufferfishJamz', 'created_utc': 1607540518, 'title': 'PUMPPP', 'url': 'https://www.reddit.com/gallery/k9y5d9', 'created': 1607540518.0}",2020-12-09 19:01:58
51,DanuckInUSA,1607540465,DoorDash is another crazy overpriced IPO at $185...does this mean more acquisitions of smaller food delivery companies?,https://www.reddit.com/r/wallstreetbets/comments/k9y4ot/doordash_is_another_crazy_overpriced_ipo_at/,1607540465.0,"{'author': 'DanuckInUSA', 'created_utc': 1607540465, 'title': 'DoorDash is another crazy overpriced IPO at $185...does this mean more acquisitions of smaller food delivery companies?', 'url': 'https://www.reddit.com/r/wallstreetbets/comments/k9y4ot/doordash_is_another_crazy_overpriced_ipo_at/', 'created': 1607540465.0}",2020-12-09 19:01:05
52,Dermitdending,1607540457,Lost all Gainz,https://www.reddit.com/r/wallstreetbets/comments/k9y4ll/lost_all_gainz/,1607540457.0,"{'author': 'Dermitdending', 'created_utc': 1607540457, 'title': 'Lost all Gainz', 'url': 'https://www.reddit.com/r/wallstreetbets/comments/k9y4ll/lost_all_gainz/', 'created': 1607540457.0}",2020-12-09 19:00:57
53,passportbully,1607540418,"Um excuse me, wtf is Tesla doing?",https://www.reddit.com/r/wallstreetbets/comments/k9y41t/um_excuse_me_wtf_is_tesla_doing/,1607540418.0,"{'author': 'passportbully', 'created_utc': 1607540418, 'title': 'Um excuse me, wtf is Tesla doing?', 'url': 'https://www.reddit.com/r/wallstreetbets/comments/k9y41t/um_excuse_me_wtf_is_tesla_doing/', 'created': 1607540418.0}",2020-12-09 19:00:18
54,Anus_For_Breakfast,1607540309,"for those who think TSLA is overvalued, this says quite the opposite",https://www.reddit.com/r/wallstreetbets/comments/k9y2od/for_those_who_think_tsla_is_overvalued_this_says/,1607540309.0,"{'author': 'Anus_For_Breakfast', 'created_utc': 1607540309, 'title': 'for those who think TSLA is overvalued, this says quite the opposite', 'url': 'https://www.reddit.com/r/wallstreetbets/comments/k9y2od/for_those_who_think_tsla_is_overvalued_this_says/', 'created': 1607540309.0}",2020-12-09 18:58:29
55,Betweenirl,1607540302,GME🚀🚀🚀🚀🚀🚀,https://i.redd.it/lkjh6j05l7461.jpg,1607540302.0,"{'author': 'Betweenirl', 'created_utc': 1607540302, 'title': 'GME🚀🚀🚀🚀🚀🚀', 'url': 'https://i.redd.it/lkjh6j05l7461.jpg', 'created': 1607540302.0}",2020-12-09 18:58:22
56,PufferfishJamz,1607540299,YOLO on RCON,https://www.reddit.com/r/wallstreetbets/comments/k9y2k0/yolo_on_rcon/,1607540299.0,"{'author': 'PufferfishJamz', 'created_utc': 1607540299, 'title': 'YOLO on RCON', 'url': 'https://www.reddit.com/r/wallstreetbets/comments/k9y2k0/yolo_on_rcon/', 'created': 1607540299.0}",2020-12-09 18:58:19
57,marcus_magoo,1607540299,Let’s see where this goes...,https://www.reddit.com/gallery/k9y2jm,1607540299.0,"{'author': 'marcus_magoo', 'created_utc': 1607540299, 'title': 'Let’s see where this goes...', 'url': 'https://www.reddit.com/gallery/k9y2jm', 'created': 1607540299.0}",2020-12-09 18:58:19
58,Qkid98,1607540258,Uvxy for the haters,https://v.redd.it/ysjv0kiwk7461,1607540258.0,"{'author': 'Qkid98', 'created_utc': 1607540258, 'title': 'Uvxy for the haters', 'url': 'https://v.redd.it/ysjv0kiwk7461', 'created': 1607540258.0}",2020-12-09 18:57:38
59,kumurule,1607540247,Get Rich with this Strategy.Min Profit of 600 and Max profit of 1100 for each spread,https://www.reddit.com/r/wallstreetbets/comments/k9y1vv/get_rich_with_this_strategymin_profit_of_600_and/,1607540247.0,"{'author': 'kumurule', 'created_utc': 1607540247, 'title': 'Get Rich with this Strategy.Min Profit of 600 and Max profit of 1100 for each spread', 'url': 'https://www.reddit.com/r/wallstreetbets/comments/k9y1vv/get_rich_with_this_strategymin_profit_of_600_and/', 'created': 1607540247.0}",2020-12-09 18:57:27
60,DrBingBong69,1607540172,To the fucking MOOOOOOON!!!!!,https://i.redd.it/j3ynb25rk7461.jpg,1607540172.0,"{'author': 'DrBingBong69', 'created_utc': 1607540172, 'title': 'To the fucking MOOOOOOON!!!!!', 'url': 'https://i.redd.it/j3ynb25rk7461.jpg', 'created': 1607540172.0}",2020-12-09 18:56:12
61,Footsteps_10,1607540135,"I give you the money, and you give me the donut.",https://v.redd.it/fioektvlk7461,1607540135.0,"{'author': 'Footsteps_10', 'created_utc': 1607540135, 'title': 'I give you the money, and you give me the donut.', 'url': 'https://v.redd.it/fioektvlk7461', 'created': 1607540135.0}",2020-12-09 18:55:35
62,macpad095,1607540122,Anybody else got Spy Calls and is getting pissed?,https://www.reddit.com/r/wallstreetbets/comments/k9y0cj/anybody_else_got_spy_calls_and_is_getting_pissed/,1607540122.0,"{'author': 'macpad095', 'created_utc': 1607540122, 'title': 'Anybody else got Spy Calls and is getting pissed?', 'url': 'https://www.reddit.com/r/wallstreetbets/comments/k9y0cj/anybody_else_got_spy_calls_and_is_getting_pissed/', 'created': 1607540122.0}",2020-12-09 18:55:22
63,Manureprenuer,1607540084,Just trying to make sense of wtf is going on. Stonks are supposed to only go up!,https://www.reddit.com/r/wallstreetbets/comments/k9xzwo/just_trying_to_make_sense_of_wtf_is_going_on/,1607540084.0,"{'author': 'Manureprenuer', 'created_utc': 1607540084, 'title': 'Just trying to make sense of wtf is going on. Stonks are supposed to only go up!', 'url': 'https://www.reddit.com/r/wallstreetbets/comments/k9xzwo/just_trying_to_make_sense_of_wtf_is_going_on/', 'created': 1607540084.0}",2020-12-09 18:54:44
64,LegalAdvantage2,1607540056,Buy the blackberry dip,https://www.reddit.com/r/wallstreetbets/comments/k9xzjf/buy_the_blackberry_dip/,1607540056.0,"{'author': 'LegalAdvantage2', 'created_utc': 1607540056, 'title': 'Buy the blackberry dip', 'url': 'https://www.reddit.com/r/wallstreetbets/comments/k9xzjf/buy_the_blackberry_dip/', 'created': 1607540056.0}",2020-12-09 18:54:16
65,SF_Stonr,1607539983,Stock/ Crypto Dip,https://www.reddit.com/r/wallstreetbets/comments/k9xynn/stock_crypto_dip/,1607539983.0,"{'author': 'SF_Stonr', 'created_utc': 1607539983, 'title': 'Stock/ Crypto Dip', 'url': 'https://www.reddit.com/r/wallstreetbets/comments/k9xynn/stock_crypto_dip/', 'created': 1607539983.0}",2020-12-09 18:53:03
66,Bigpopperss,1607539979,Terrible,https://i.redd.it/f3osqre6k7461.jpg,1607539979.0,"{'author': 'Bigpopperss', 'created_utc': 1607539979, 'title': 'Terrible', 'url': 'https://i.redd.it/f3osqre6k7461.jpg', 'created': 1607539979.0}",2020-12-09 18:52:59
