,author,created_utc,title,url,created,d_,created_utc_dt
61,[deleted],1611860359,Throw some movie popcorn butter on my ass and eat it up,https://i.redd.it/4xrwor2te4e61.png,1611860359.0,"{'author': '[deleted]', 'created_utc': 1611860359, 'title': 'Throw some movie popcorn butter on my ass and eat it up', 'url': 'https://i.redd.it/4xrwor2te4e61.png', 'created': 1611860359.0}",2021-01-28 18:59:19
62,shocklane,1611860359,F**** RH!! but please dont go..,https://i.redd.it/x7zrdnbqe4e61.jpg,1611860359.0,"{'author': 'shocklane', 'created_utc': 1611860359, 'title': 'F**** RH!! but please dont go..', 'url': 'https://i.redd.it/x7zrdnbqe4e61.jpg', 'created': 1611860359.0}",2021-01-28 18:59:19
63,Dashigos,1611860359,Show Robinhood who they are messing with! Let them know what we think about their practices by reviewing them on the App Store!,https://www.reddit.com/r/wallstreetbets/comments/l75b0k/show_robinhood_who_they_are_messing_with_let_them/,1611860359.0,"{'author': 'Dashigos', 'created_utc': 1611860359, 'title': 'Show Robinhood who they are messing with! Let them know what we think about their practices by reviewing them on the App Store!', 'url': 'https://www.reddit.com/r/wallstreetbets/comments/l75b0k/show_robinhood_who_they_are_messing_with_let_them/', 'created': 1611860359.0}",2021-01-28 18:59:19
64,[deleted],1611860359,buying AMC works on eTrade! Confirmed! 🚀💎🙌🏽,https://i.redd.it/m7dzrjvve4e61.jpg,1611860359.0,"{'author': '[deleted]', 'created_utc': 1611860359, 'title': 'buying AMC works on eTrade! Confirmed! 🚀💎🙌🏽', 'url': 'https://i.redd.it/m7dzrjvve4e61.jpg', 'created': 1611860359.0}",2021-01-28 18:59:19
65,Shpi-Shpique,1611860359,Robinhood is automatically closing people's positions.,https://www.reddit.com/r/wallstreetbets/comments/l75b0d/robinhood_is_automatically_closing_peoples/,1611860359.0,"{'author': 'Shpi-Shpique', 'created_utc': 1611860359, 'title': ""Robinhood is automatically closing people's positions."", 'url': 'https://www.reddit.com/r/wallstreetbets/comments/l75b0d/robinhood_is_automatically_closing_peoples/', 'created': 1611860359.0}",2021-01-28 18:59:19
66,LessQuit2516,1611860357,Were taking Over. They can temp hold us but we will break through. Let this song be our anthem,https://www.youtube.com/watch?v=KbNL9ZyB49c&amp;ab_channel=LeagueofLegends,1611860357.0,"{'author': 'LessQuit2516', 'created_utc': 1611860357, 'title': 'Were taking Over. They can temp hold us but we will break through. Let this song be our anthem', 'url': 'https://www.youtube.com/watch?v=KbNL9ZyB49c&amp;ab_channel=LeagueofLegends', 'created': 1611860357.0}",2021-01-28 18:59:17
67,ZettabyteGamer,1611860356,PAPA ELON IS HERE,https://i.redd.it/k14rardue4e61.png,1611860356.0,"{'author': 'ZettabyteGamer', 'created_utc': 1611860356, 'title': 'PAPA ELON IS HERE', 'url': 'https://i.redd.it/k14rardue4e61.png', 'created': 1611860356.0}",2021-01-28 18:59:16
68,ItsAllJustASickGame,1611860356,IS THIS REAL? Whistleblower confirms Hedge and US GOVT pushing Robinhood to ban GME!,https://pbs.twimg.com/media/Es1vfVEUYAAiwqm.jpg:large,1611860356.0,"{'author': 'ItsAllJustASickGame', 'created_utc': 1611860356, 'title': 'IS THIS REAL? Whistleblower confirms Hedge and US GOVT pushing Robinhood to ban GME!', 'url': 'https://pbs.twimg.com/media/Es1vfVEUYAAiwqm.jpg:large', 'created': 1611860356.0}",2021-01-28 18:59:16
69,_TinTan_,1611860355,DO NOT CAVE IN APES!!,https://i.redd.it/415k5lbve4e61.jpg,1611860355.0,"{'author': '_TinTan_', 'created_utc': 1611860355, 'title': 'DO NOT CAVE IN APES!!', 'url': 'https://i.redd.it/415k5lbve4e61.jpg', 'created': 1611860355.0}",2021-01-28 18:59:15
70,DirtyGerdy,1611860355,Cannot deposit into Webull?,https://www.reddit.com/r/wallstreetbets/comments/l75ayd/cannot_deposit_into_webull/,1611860355.0,"{'author': 'DirtyGerdy', 'created_utc': 1611860355, 'title': 'Cannot deposit into Webull?', 'url': 'https://www.reddit.com/r/wallstreetbets/comments/l75ayd/cannot_deposit_into_webull/', 'created': 1611860355.0}",2021-01-28 18:59:15
71,pinacoleadam,1611860354,How to buy Dogecoin?,https://www.reddit.com/r/wallstreetbets/comments/l75axt/how_to_buy_dogecoin/,1611860354.0,"{'author': 'pinacoleadam', 'created_utc': 1611860354, 'title': 'How to buy Dogecoin?', 'url': 'https://www.reddit.com/r/wallstreetbets/comments/l75axt/how_to_buy_dogecoin/', 'created': 1611860354.0}",2021-01-28 18:59:14
72,The_Hoff-YouTube,1611860354,I own a lot of WPG stock should I hold or sell and buy into a new stock?,https://www.reddit.com/r/wallstreetbets/comments/l75axr/i_own_a_lot_of_wpg_stock_should_i_hold_or_sell/,1611860354.0,"{'author': 'The_Hoff-YouTube', 'created_utc': 1611860354, 'title': 'I own a lot of WPG stock should I hold or sell and buy into a new stock?', 'url': 'https://www.reddit.com/r/wallstreetbets/comments/l75axr/i_own_a_lot_of_wpg_stock_should_i_hold_or_sell/', 'created': 1611860354.0}",2021-01-28 18:59:14
73,Simmyx98,1611860353,AOC and Elon said APES TOGETHER STRONG,https://i.redd.it/lasrfx8ve4e61.jpg,1611860353.0,"{'author': 'Simmyx98', 'created_utc': 1611860353, 'title': 'AOC and Elon said APES TOGETHER STRONG', 'url': 'https://i.redd.it/lasrfx8ve4e61.jpg', 'created': 1611860353.0}",2021-01-28 18:59:13
74,EnergyOrnery,1611860353,Buy doge coin get that shit to 1 dollar before Robinhood deletes it !!!,https://www.reddit.com/r/wallstreetbets/comments/l75axc/buy_doge_coin_get_that_shit_to_1_dollar_before/,1611860353.0,"{'author': 'EnergyOrnery', 'created_utc': 1611860353, 'title': 'Buy doge coin get that shit to 1 dollar before Robinhood deletes it !!!', 'url': 'https://www.reddit.com/r/wallstreetbets/comments/l75axc/buy_doge_coin_get_that_shit_to_1_dollar_before/', 'created': 1611860353.0}",2021-01-28 18:59:13
75,Advanced_Cut9411,1611860353,JUST BOUGHT FOR $1MLN ☄️SNDL ☄️NAKD CTRM☄️,https://www.reddit.com/r/wallstreetbets/comments/l75ax9/just_bought_for_1mln_sndl_nakd_ctrm/,1611860353.0,"{'author': 'Advanced_Cut9411', 'created_utc': 1611860353, 'title': 'JUST BOUGHT FOR $1MLN ☄️SNDL ☄️NAKD CTRM☄️', 'url': 'https://www.reddit.com/r/wallstreetbets/comments/l75ax9/just_bought_for_1mln_sndl_nakd_ctrm/', 'created': 1611860353.0}",2021-01-28 18:59:13
76,Nicklanhamm,1611860351,The more it drops the more I'm buying,https://www.reddit.com/r/wallstreetbets/comments/l75awf/the_more_it_drops_the_more_im_buying/,1611860351.0,"{'author': 'Nicklanhamm', 'created_utc': 1611860351, 'title': ""The more it drops the more I'm buying"", 'url': 'https://www.reddit.com/r/wallstreetbets/comments/l75awf/the_more_it_drops_the_more_im_buying/', 'created': 1611860351.0}",2021-01-28 18:59:11
77,-Joehands0me,1611860351,Fuck Robinhood,https://i.redd.it/j99nzsyue4e61.jpg,1611860351.0,"{'author': '-Joehands0me', 'created_utc': 1611860351, 'title': 'Fuck Robinhood', 'url': 'https://i.redd.it/j99nzsyue4e61.jpg', 'created': 1611860351.0}",2021-01-28 18:59:11
78,WisdomWaster,1611860350,The real Robinhood from today,https://i.redd.it/r71kcgzue4e61.png,1611860350.0,"{'author': 'WisdomWaster', 'created_utc': 1611860350, 'title': 'The real Robinhood from today', 'url': 'https://i.redd.it/r71kcgzue4e61.png', 'created': 1611860350.0}",2021-01-28 18:59:10
79,Sincerewoo,1611860350,GameStop GME is more of a Symbol than it is a way to be Super Rich.,https://www.reddit.com/r/wallstreetbets/comments/l75avx/gamestop_gme_is_more_of_a_symbol_than_it_is_a_way/,1611860350.0,"{'author': 'Sincerewoo', 'created_utc': 1611860350, 'title': 'GameStop GME is more of a Symbol than it is a way to be Super Rich.', 'url': 'https://www.reddit.com/r/wallstreetbets/comments/l75avx/gamestop_gme_is_more_of_a_symbol_than_it_is_a_way/', 'created': 1611860350.0}",2021-01-28 18:59:10
80,jello87,1611860350,How much of the shorts did they cover today?,https://www.reddit.com/r/wallstreetbets/comments/l75avt/how_much_of_the_shorts_did_they_cover_today/,1611860350.0,"{'author': 'jello87', 'created_utc': 1611860350, 'title': 'How much of the shorts did they cover today?', 'url': 'https://www.reddit.com/r/wallstreetbets/comments/l75avt/how_much_of_the_shorts_did_they_cover_today/', 'created': 1611860350.0}",2021-01-28 18:59:10
81,SlipAndRip,1611860349,Nice,https://i.redd.it/caqh1mgte4e61.png,1611860349.0,"{'author': 'SlipAndRip', 'created_utc': 1611860349, 'title': 'Nice', 'url': 'https://i.redd.it/caqh1mgte4e61.png', 'created': 1611860349.0}",2021-01-28 18:59:09
82,GoldenTicketHolder,1611860349,Evil geniuses,https://i.redd.it/rf8h0dnue4e61.jpg,1611860349.0,"{'author': 'GoldenTicketHolder', 'created_utc': 1611860349, 'title': 'Evil geniuses', 'url': 'https://i.redd.it/rf8h0dnue4e61.jpg', 'created': 1611860349.0}",2021-01-28 18:59:09
83,MathematicianNo9373,1611860349,"Chase, Fidelity is allowing people to buy GME still. Just spreading the word",https://www.reddit.com/r/wallstreetbets/comments/l75av9/chase_fidelity_is_allowing_people_to_buy_gme/,1611860349.0,"{'author': 'MathematicianNo9373', 'created_utc': 1611860349, 'title': 'Chase, Fidelity is allowing people to buy GME still. Just spreading the word', 'url': 'https://www.reddit.com/r/wallstreetbets/comments/l75av9/chase_fidelity_is_allowing_people_to_buy_gme/', 'created': 1611860349.0}",2021-01-28 18:59:09
84,NewVAinvestor1,1611860349,I am very impressed with both sides finding common ground on this!,https://www.reddit.com/r/wallstreetbets/comments/l75av0/i_am_very_impressed_with_both_sides_finding/,1611860349.0,"{'author': 'NewVAinvestor1', 'created_utc': 1611860349, 'title': 'I am very impressed with both sides finding common ground on this!', 'url': 'https://www.reddit.com/r/wallstreetbets/comments/l75av0/i_am_very_impressed_with_both_sides_finding/', 'created': 1611860349.0}",2021-01-28 18:59:09
85,Pedal-Guy,1611860348,SNDL,https://www.reddit.com/r/wallstreetbets/comments/l75aut/sndl/,1611860348.0,"{'author': 'Pedal-Guy', 'created_utc': 1611860348, 'title': 'SNDL', 'url': 'https://www.reddit.com/r/wallstreetbets/comments/l75aut/sndl/', 'created': 1611860348.0}",2021-01-28 18:59:08
86,xbachix,1611860348,USA GME where can i buy?,https://www.reddit.com/r/wallstreetbets/comments/l75aun/usa_gme_where_can_i_buy/,1611860348.0,"{'author': 'xbachix', 'created_utc': 1611860348, 'title': 'USA GME where can i buy?', 'url': 'https://www.reddit.com/r/wallstreetbets/comments/l75aun/usa_gme_where_can_i_buy/', 'created': 1611860348.0}",2021-01-28 18:59:08
87,juanma9872719,1611860348,Etoro bloquea las compras,https://www.reddit.com/r/wallstreetbets/comments/l75aue/etoro_bloquea_las_compras/,1611860348.0,"{'author': 'juanma9872719', 'created_utc': 1611860348, 'title': 'Etoro bloquea las compras', 'url': 'https://www.reddit.com/r/wallstreetbets/comments/l75aue/etoro_bloquea_las_compras/', 'created': 1611860348.0}",2021-01-28 18:59:08
88,GangrenousQuincey,1611860347,What's the status on NOK?,https://www.reddit.com/r/wallstreetbets/comments/l75au8/whats_the_status_on_nok/,1611860347.0,"{'author': 'GangrenousQuincey', 'created_utc': 1611860347, 'title': ""What's the status on NOK?"", 'url': 'https://www.reddit.com/r/wallstreetbets/comments/l75au8/whats_the_status_on_nok/', 'created': 1611860347.0}",2021-01-28 18:59:07
89,testz0rz,1611860347,"Just got here - cannot buy GME, but will AMC help out?",https://www.reddit.com/r/wallstreetbets/comments/l75atz/just_got_here_cannot_buy_gme_but_will_amc_help_out/,1611860347.0,"{'author': 'testz0rz', 'created_utc': 1611860347, 'title': 'Just got here - cannot buy GME, but will AMC help out?', 'url': 'https://www.reddit.com/r/wallstreetbets/comments/l75atz/just_got_here_cannot_buy_gme_but_will_amc_help_out/', 'created': 1611860347.0}",2021-01-28 18:59:07
90,Anxious_Disk,1611860347,Robinhood,https://www.reddit.com/r/wallstreetbets/comments/l75atx/robinhood/,1611860347.0,"{'author': 'Anxious_Disk', 'created_utc': 1611860347, 'title': 'Robinhood', 'url': 'https://www.reddit.com/r/wallstreetbets/comments/l75atx/robinhood/', 'created': 1611860347.0}",2021-01-28 18:59:07
91,buttsloan,1611860346,My thoughts and prayers to these beautiful r3t@rds,https://i.redd.it/su4lc1cte4e61.png,1611860346.0,"{'author': 'buttsloan', 'created_utc': 1611860346, 'title': 'My thoughts and prayers to these beautiful r3t@rds', 'url': 'https://i.redd.it/su4lc1cte4e61.png', 'created': 1611860346.0}",2021-01-28 18:59:06
92,[deleted],1611860346,They can’t stop crypto DOGE COIN TO THE MOON,https://www.reddit.com/r/wallstreetbets/comments/l75atf/they_cant_stop_crypto_doge_coin_to_the_moon/,1611860346.0,"{'author': '[deleted]', 'created_utc': 1611860346, 'title': 'They can’t stop crypto DOGE COIN TO THE MOON', 'url': 'https://www.reddit.com/r/wallstreetbets/comments/l75atf/they_cant_stop_crypto_doge_coin_to_the_moon/', 'created': 1611860346.0}",2021-01-28 18:59:06
93,Anthrax_Huffer,1611860345,Flood Robinhood’s Phones! Pressure the fuck outta them!,https://i.redd.it/ccxuljgue4e61.jpg,1611860345.0,"{'author': 'Anthrax_Huffer', 'created_utc': 1611860345, 'title': 'Flood Robinhood’s Phones! Pressure the fuck outta them!', 'url': 'https://i.redd.it/ccxuljgue4e61.jpg', 'created': 1611860345.0}",2021-01-28 18:59:05
94,spanishrocket,1611860345,Buy Dogecoin NOWWWW,https://www.reddit.com/r/wallstreetbets/comments/l75asu/buy_dogecoin_nowwww/,1611860345.0,"{'author': 'spanishrocket', 'created_utc': 1611860345, 'title': 'Buy Dogecoin NOWWWW', 'url': 'https://www.reddit.com/r/wallstreetbets/comments/l75asu/buy_dogecoin_nowwww/', 'created': 1611860345.0}",2021-01-28 18:59:05
95,dgavin4234,1611860344,Hold! buy more shares. Don’t be bullied. We have been talking about how this would happen for days. Don’t get scared. Buy and hold 🚀🤚💎🤚🚀,https://www.reddit.com/r/wallstreetbets/comments/l75asi/hold_buy_more_shares_dont_be_bullied_we_have_been/,1611860344.0,"{'author': 'dgavin4234', 'created_utc': 1611860344, 'title': 'Hold! buy more shares. Don’t be bullied. We have been talking about how this would happen for days. Don’t get scared. Buy and hold 🚀🤚💎🤚🚀', 'url': 'https://www.reddit.com/r/wallstreetbets/comments/l75asi/hold_buy_more_shares_dont_be_bullied_we_have_been/', 'created': 1611860344.0}",2021-01-28 18:59:04
96,Longjumping_Cod_1014,1611860344,Steven Cohen and SAC Capital: A Trail of Bodies,https://www.reddit.com/r/wallstreetbets/comments/l75as6/steven_cohen_and_sac_capital_a_trail_of_bodies/,1611860344.0,"{'author': 'Longjumping_Cod_1014', 'created_utc': 1611860344, 'title': 'Steven Cohen and SAC Capital: A Trail of Bodies', 'url': 'https://www.reddit.com/r/wallstreetbets/comments/l75as6/steven_cohen_and_sac_capital_a_trail_of_bodies/', 'created': 1611860344.0}",2021-01-28 18:59:04
97,ElegantWatercress887,1611860343,TSE: CGX🤷‍♂️ Cinemas are suffering during the pandemia,https://www.reddit.com/r/wallstreetbets/comments/l75art/tse_cgx_cinemas_are_suffering_during_the_pandemia/,1611860343.0,"{'author': 'ElegantWatercress887', 'created_utc': 1611860343, 'title': 'TSE: CGX🤷\u200d♂️ Cinemas are suffering during the pandemia', 'url': 'https://www.reddit.com/r/wallstreetbets/comments/l75art/tse_cgx_cinemas_are_suffering_during_the_pandemia/', 'created': 1611860343.0}",2021-01-28 18:59:03
98,HolyCrapImJesus,1611860343,Petition to delete and sue RobinHoodApp,https://www.reddit.com/r/wallstreetbets/comments/l75arn/petition_to_delete_and_sue_robinhoodapp/,1611860343.0,"{'author': 'HolyCrapImJesus', 'created_utc': 1611860343, 'title': 'Petition to delete and sue RobinHoodApp', 'url': 'https://www.reddit.com/r/wallstreetbets/comments/l75arn/petition_to_delete_and_sue_robinhoodapp/', 'created': 1611860343.0}",2021-01-28 18:59:03
99,Bnd25,1611860343,The fortune cookie doesn’t lie. TO THE MOON🚀🚀🚀,https://i.redd.it/ht025uxte4e61.jpg,1611860343.0,"{'author': 'Bnd25', 'created_utc': 1611860343, 'title': 'The fortune cookie doesn’t lie. TO THE MOON🚀🚀🚀', 'url': 'https://i.redd.it/ht025uxte4e61.jpg', 'created': 1611860343.0}",2021-01-28 18:59:03
