,author,created_utc,title,url,created,d_,created_utc_dt
60,CarpenterSouthern313,1617103108,Worst FOMO decision to date. Paid 7% more than highest asking price. 25% down in 4hrs,https://i.redd.it/o30c6tw8g5q61.png,1617103108.0,"{'author': 'CarpenterSouthern313', 'created_utc': 1617103108, 'title': 'Worst FOMO decision to date. Paid 7% more than highest asking price. 25% down in 4hrs', 'url': 'https://i.redd.it/o30c6tw8g5q61.png', 'created': 1617103108.0}",2021-03-30 11:18:28
61,OSXAdam,1617103091,GameStop (GME) Names Ex-Amazon Exec Elliott Wilke Chief Growth Officer 🚀 🚀 🚀,https://www.streetinsider.com/Corporate+News/GameStop+(GME)+Names+Ex-Amazon+Exec+Elliott+Wilke+Chief+Growth+Officer/18193057.html,1617103091.0,"{'author': 'OSXAdam', 'created_utc': 1617103091, 'title': 'GameStop (GME) Names Ex-Amazon Exec Elliott Wilke Chief Growth Officer 🚀 🚀 🚀', 'url': 'https://www.streetinsider.com/Corporate+News/GameStop+(GME)+Names+Ex-Amazon+Exec+Elliott+Wilke+Chief+Growth+Officer/18193057.html', 'created': 1617103091.0}",2021-03-30 11:18:11
62,Rellicus,1617103029,Gamestop $GME Appoints Chief Growth Officer and 2 former Chewy execs.,https://news.gamestop.com/news-releases/news-release-details/gamestop-appoints-chief-growth-officer,1617103029.0,"{'author': 'Rellicus', 'created_utc': 1617103029, 'title': 'Gamestop $GME Appoints Chief Growth Officer and 2 former Chewy execs.', 'url': 'https://news.gamestop.com/news-releases/news-release-details/gamestop-appoints-chief-growth-officer', 'created': 1617103029.0}",2021-03-30 11:17:09
63,Snaagle,1617103021,"GameStop names Amazon exec Elliot Wilke chief growth officer, adds two former Chewy's managers to roster",https://www.marketwatch.com/story/gamestop-names-amazon-exec-elliot-wilke-chief-growth-officer-adds-two-former-chewys-managers-to-roster-2021-03-30?mod=home-page,1617103021.0,"{'author': 'Snaagle', 'created_utc': 1617103021, 'title': ""GameStop names Amazon exec Elliot Wilke chief growth officer, adds two former Chewy's managers to roster"", 'url': 'https://www.marketwatch.com/story/gamestop-names-amazon-exec-elliot-wilke-chief-growth-officer-adds-two-former-chewys-managers-to-roster-2021-03-30?mod=home-page', 'created': 1617103021.0}",2021-03-30 11:17:01
64,ginsengwarrior,1617103017,What’s the chances the driver of this car is a member of this sub reddit?,https://i.redd.it/hb4n76tzf5q61.jpg,1617103017.0,"{'author': 'ginsengwarrior', 'created_utc': 1617103017, 'title': 'What’s the chances the driver of this car is a member of this sub reddit?', 'url': 'https://i.redd.it/hb4n76tzf5q61.jpg', 'created': 1617103017.0}",2021-03-30 11:16:57
65,robindatank,1617102934,How GME 🦍 gang gets ready for new day of trading,https://v.redd.it/sps3n77kf5q61,1617102934.0,"{'author': 'robindatank', 'created_utc': 1617102934, 'title': 'How GME 🦍 gang gets ready for new day of trading', 'url': 'https://v.redd.it/sps3n77kf5q61', 'created': 1617102934.0}",2021-03-30 11:15:34
66,sabzero,1617102934,🙌🏽💎 TOGETHER STRONG,https://v.redd.it/8a02gospf5q61,1617102934.0,"{'author': 'sabzero', 'created_utc': 1617102934, 'title': '🙌🏽💎 TOGETHER STRONG', 'url': 'https://v.redd.it/8a02gospf5q61', 'created': 1617102934.0}",2021-03-30 11:15:34
67,CarpenterSouthern313,1617102910,Have you ever FOMO'd so hard that you bought 7% over highest ask?,https://i.imgur.com/79hgGhw.png,1617102910.0,"{'author': 'CarpenterSouthern313', 'created_utc': 1617102910, 'title': ""Have you ever FOMO'd so hard that you bought 7% over highest ask?"", 'url': 'https://i.imgur.com/79hgGhw.png', 'created': 1617102910.0}",2021-03-30 11:15:10
68,PoorArmyApe69,1617102885,New Coin on CoinMarketCap..Pepr?,https://www.reddit.com/r/wallstreetbets/comments/mgdkpp/new_coin_on_coinmarketcappepr/,1617102885.0,"{'author': 'PoorArmyApe69', 'created_utc': 1617102885, 'title': 'New Coin on CoinMarketCap..Pepr?', 'url': 'https://www.reddit.com/r/wallstreetbets/comments/mgdkpp/new_coin_on_coinmarketcappepr/', 'created': 1617102885.0}",2021-03-30 11:14:45
69,LoneStarInSpace,1617102847,Don't Believe The Media,https://www.reddit.com/r/wallstreetbets/comments/mgdkdd/dont_believe_the_media/,1617102847.0,"{'author': 'LoneStarInSpace', 'created_utc': 1617102847, 'title': ""Don't Believe The Media"", 'url': 'https://www.reddit.com/r/wallstreetbets/comments/mgdkdd/dont_believe_the_media/', 'created': 1617102847.0}",2021-03-30 11:14:07
70,Paullyo3,1617102727,GameStop appoints chief growth officer with Amazon background,https://seekingalpha.com/news/3677474-gamestop-appoints-chief-growth-officer-with-amazon-background?utm_source=webull.com&amp;utm_medium=referral,1617102727.0,"{'author': 'Paullyo3', 'created_utc': 1617102727, 'title': 'GameStop appoints chief growth officer with Amazon background', 'url': 'https://seekingalpha.com/news/3677474-gamestop-appoints-chief-growth-officer-with-amazon-background?utm_source=webull.com&amp;utm_medium=referral', 'created': 1617102727.0}",2021-03-30 11:12:07
71,sabzero,1617102714,🙌🏽💎 TOGETHER STRONG,https://v.redd.it/98yqdlf0f5q61,1617102714.0,"{'author': 'sabzero', 'created_utc': 1617102714, 'title': '🙌🏽💎 TOGETHER STRONG', 'url': 'https://v.redd.it/98yqdlf0f5q61', 'created': 1617102714.0}",2021-03-30 11:11:54
72,MaleficentAd4773,1617102650,Typical Benzinga ???,https://www.reddit.com/r/wallstreetbets/comments/mgdig0/typical_benzinga/,1617102650.0,"{'author': 'MaleficentAd4773', 'created_utc': 1617102650, 'title': 'Typical Benzinga ???', 'url': 'https://www.reddit.com/r/wallstreetbets/comments/mgdig0/typical_benzinga/', 'created': 1617102650.0}",2021-03-30 11:10:50
73,Unitalianoacaso,1617102644,GameStop undergoes makeover as 8 board members leave,https://www.industryleadersmagazine.com/?p=10890,1617102644.0,"{'author': 'Unitalianoacaso', 'created_utc': 1617102644, 'title': 'GameStop undergoes makeover as 8 board members leave', 'url': 'https://www.industryleadersmagazine.com/?p=10890', 'created': 1617102644.0}",2021-03-30 11:10:44
74,ohpsies,1617102610,"Thank you NFT stocks for saving my ass, fuck you Weed and Tech stocks. I thought I would never financially recover.",https://i.redd.it/2j1a0agse5q61.jpg,1617102610.0,"{'author': 'ohpsies', 'created_utc': 1617102610, 'title': 'Thank you NFT stocks for saving my ass, fuck you Weed and Tech stocks. I thought I would never financially recover.', 'url': 'https://i.redd.it/2j1a0agse5q61.jpg', 'created': 1617102610.0}",2021-03-30 11:10:10
75,LeeroyJenkinssssss,1617102567,GME Appoints Chief Growth Officer with Amazon Background,https://i.redd.it/fgbh5atke5q61.png,1617102567.0,"{'author': 'LeeroyJenkinssssss', 'created_utc': 1617102567, 'title': 'GME Appoints Chief Growth Officer with Amazon Background', 'url': 'https://i.redd.it/fgbh5atke5q61.png', 'created': 1617102567.0}",2021-03-30 11:09:27
76,Rye-Rye-Rocco,1617102535,"“Jim Cramer: The Game Isn't Rigged, There's No Vast Conspiracy”...Says the man facilitating the rigging!",https://realmoney.thestreet.com/jim-cramer/jim-cramer-the-game-isn-t-rigged-there-s-no-vast-conspiracy-15607797?puc=yahoo&amp;cm_ven=YAHOO&amp;yptr=yahoo,1617102535.0,"{'author': 'Rye-Rye-Rocco', 'created_utc': 1617102535, 'title': ""“Jim Cramer: The Game Isn't Rigged, There's No Vast Conspiracy”...Says the man facilitating the rigging!"", 'url': 'https://realmoney.thestreet.com/jim-cramer/jim-cramer-the-game-isn-t-rigged-there-s-no-vast-conspiracy-15607797?puc=yahoo&amp;cm_ven=YAHOO&amp;yptr=yahoo', 'created': 1617102535.0}",2021-03-30 11:08:55
77,iPLANESWALK,1617102531,JC Wears Floats (In the Shallow End),https://i.redd.it/hhcf9hqbe5q61.png,1617102531.0,"{'author': 'iPLANESWALK', 'created_utc': 1617102531, 'title': 'JC Wears Floats (In the Shallow End)', 'url': 'https://i.redd.it/hhcf9hqbe5q61.png', 'created': 1617102531.0}",2021-03-30 11:08:51
78,DanyeelsAnulmint,1617102432,"Archegos-Linked Stocks Continue Rebound Following Massive Selloff - ViacomCBS, Discovery and other stocks linked to a massive selling spree from investment fund Archegos Capital Management are on the rebound for a second day.",https://www.thestreet.com/investing/archegos-selloff-viacomcbs-discovery-baidu-tencent-shares-rebound,1617102432.0,"{'author': 'DanyeelsAnulmint', 'created_utc': 1617102432, 'title': 'Archegos-Linked Stocks Continue Rebound Following Massive Selloff - ViacomCBS, Discovery and other stocks linked to a massive selling spree from investment fund Archegos Capital Management are on the rebound for a second day.', 'url': 'https://www.thestreet.com/investing/archegos-selloff-viacomcbs-discovery-baidu-tencent-shares-rebound', 'created': 1617102432.0}",2021-03-30 11:07:12
79,Uptomyhighballs,1617102431,You want catalysts? I'LL GIVE YOU CATALYSTS 🔥🚀 $GME,https://i.redd.it/57uq9789e5q61.jpg,1617102431.0,"{'author': 'Uptomyhighballs', 'created_utc': 1617102431, 'title': ""You want catalysts? I'LL GIVE YOU CATALYSTS 🔥🚀 $GME"", 'url': 'https://i.redd.it/57uq9789e5q61.jpg', 'created': 1617102431.0}",2021-03-30 11:07:11
80,NonCorporealEntity,1617102381,"The leads are weak? If the fuckin leads are weak, YOUR WEAK!",https://youtu.be/vonVC_eDA8E,1617102381.0,"{'author': 'NonCorporealEntity', 'created_utc': 1617102381, 'title': 'The leads are weak? If the fuckin leads are weak, YOUR WEAK!', 'url': 'https://youtu.be/vonVC_eDA8E', 'created': 1617102381.0}",2021-03-30 11:06:21
81,Unitalianoacaso,1617102336,Nokia and Safaricom launch East Africa’s first commercial 5G services in Kenya.,https://www.reddit.com/r/wallstreetbets/comments/mgdf66/nokia_and_safaricom_launch_east_africas_first/,1617102336.0,"{'author': 'Unitalianoacaso', 'created_utc': 1617102336, 'title': 'Nokia and Safaricom launch East Africa’s first commercial 5G services in Kenya.', 'url': 'https://www.reddit.com/r/wallstreetbets/comments/mgdf66/nokia_and_safaricom_launch_east_africas_first/', 'created': 1617102336.0}",2021-03-30 11:05:36
82,Kr0atoan,1617102273,"GameStop names Amazon exec Elliot Wilke chief growth officer, adds two former Chewy's managers to roster",https://www.marketwatch.com/story/gamestop-names-amazon-exec-elliot-wilke-chief-growth-officer-adds-two-former-chewys-managers-to-roster-2021-03-30?mod=mw_latestnews,1617102273.0,"{'author': 'Kr0atoan', 'created_utc': 1617102273, 'title': ""GameStop names Amazon exec Elliot Wilke chief growth officer, adds two former Chewy's managers to roster"", 'url': 'https://www.marketwatch.com/story/gamestop-names-amazon-exec-elliot-wilke-chief-growth-officer-adds-two-former-chewys-managers-to-roster-2021-03-30?mod=mw_latestnews', 'created': 1617102273.0}",2021-03-30 11:04:33
83,mirvlaa,1617102206,"They fear, we not. 🦧🙌💎",https://i.redd.it/21j1nbpad5q61.png,1617102206.0,"{'author': 'mirvlaa', 'created_utc': 1617102206, 'title': 'They fear, we not. \U0001f9a7🙌💎', 'url': 'https://i.redd.it/21j1nbpad5q61.png', 'created': 1617102206.0}",2021-03-30 11:03:26
84,Educational_Sector50,1617102176,🚀 How Bill Hwang got back into banks’ good books — more banks are still exposed,https://www.google.com.hk/amp/s/amp.ft.com/content/b7e0f57b-3751-42b8-8a17-eb7749f4dbc8,1617102176.0,"{'author': 'Educational_Sector50', 'created_utc': 1617102176, 'title': '🚀 How Bill Hwang got back into banks’ good books — more banks are still exposed', 'url': 'https://www.google.com.hk/amp/s/amp.ft.com/content/b7e0f57b-3751-42b8-8a17-eb7749f4dbc8', 'created': 1617102176.0}",2021-03-30 11:02:56
85,Guero3663,1617102155,"GME NEWS 3/30/21 New talent announced this morning and Yass, I knew we are the ones that bending over and f**king big banks to sell off!!!! 🦍💨💨💨",https://i.redd.it/oem4worfd5q61.jpg,1617102155.0,"{'author': 'Guero3663', 'created_utc': 1617102155, 'title': 'GME NEWS 3/30/21 New talent announced this morning and Yass, I knew we are the ones that bending over and f**king big banks to sell off!!!! 🦍💨💨💨', 'url': 'https://i.redd.it/oem4worfd5q61.jpg', 'created': 1617102155.0}",2021-03-30 11:02:35
86,Impossible-Main8408,1617102120,NFT PLAY $CSCW,https://www.reddit.com/r/wallstreetbets/comments/mgdd25/nft_play_cscw/,1617102120.0,"{'author': 'Impossible-Main8408', 'created_utc': 1617102120, 'title': 'NFT PLAY $CSCW', 'url': 'https://www.reddit.com/r/wallstreetbets/comments/mgdd25/nft_play_cscw/', 'created': 1617102120.0}",2021-03-30 11:02:00
87,DanyeelsAnulmint,1617101968,Credit Suisse Buybacks at Risk as Analysts Tally Archegos Losses,https://www.msn.com/en-us/money/companies/credit-suisse-buybacks-at-risk-as-analysts-tally-archegos-losses/ar-BB1f7bIx,1617101968.0,"{'author': 'DanyeelsAnulmint', 'created_utc': 1617101968, 'title': 'Credit Suisse Buybacks at Risk as Analysts Tally Archegos Losses', 'url': 'https://www.msn.com/en-us/money/companies/credit-suisse-buybacks-at-risk-as-analysts-tally-archegos-losses/ar-BB1f7bIx', 'created': 1617101968.0}",2021-03-30 10:59:28
88,JvdBerg92,1617101904,Cohenization,https://i.redd.it/xaiua1voc5q61.jpg,1617101904.0,"{'author': 'JvdBerg92', 'created_utc': 1617101904, 'title': 'Cohenization', 'url': 'https://i.redd.it/xaiua1voc5q61.jpg', 'created': 1617101904.0}",2021-03-30 10:58:24
89,skips_picks,1617101888,"I have an tingle that EARS and EYES are going to have a reversal, its the day before earnings for EARS.",https://bovnews.com/2021/03/27/futures-directions-for-auris-medical-holding-ltd-ears-gamco-global-gold-natural-resources-income-trust-ggn/,1617101888.0,"{'author': 'skips_picks', 'created_utc': 1617101888, 'title': 'I have an tingle that EARS and EYES are going to have a reversal, its the day before earnings for EARS.', 'url': 'https://bovnews.com/2021/03/27/futures-directions-for-auris-medical-holding-ltd-ears-gamco-global-gold-natural-resources-income-trust-ggn/', 'created': 1617101888.0}",2021-03-30 10:58:08
90,CoachTal,1617101870,Wsb ICO scam????!! Or legit,https://i.redd.it/6ijqlvfkc5q61.jpg,1617101870.0,"{'author': 'CoachTal', 'created_utc': 1617101870, 'title': 'Wsb ICO scam????!! Or legit', 'url': 'https://i.redd.it/6ijqlvfkc5q61.jpg', 'created': 1617101870.0}",2021-03-30 10:57:50
91,JvdBerg92,1617101824,Perhaps the catalyst GME needs.,https://i.redd.it/tpyhaj3gc5q61.jpg,1617101824.0,"{'author': 'JvdBerg92', 'created_utc': 1617101824, 'title': 'Perhaps the catalyst GME needs.', 'url': 'https://i.redd.it/tpyhaj3gc5q61.jpg', 'created': 1617101824.0}",2021-03-30 10:57:04
92,Guero3663,1617101786,GME NEWS 3/30/21 New talent announced this morning and Yass we are the ones that are the ones bending over and fucking big banks to sell off!!!! 🦍💨💨💨,https://i.redd.it/z0sxw68cc5q61.jpg,1617101786.0,"{'author': 'Guero3663', 'created_utc': 1617101786, 'title': 'GME NEWS 3/30/21 New talent announced this morning and Yass we are the ones that are the ones bending over and fucking big banks to sell off!!!! 🦍💨💨💨', 'url': 'https://i.redd.it/z0sxw68cc5q61.jpg', 'created': 1617101786.0}",2021-03-30 10:56:26
93,Glittering_Life8962,1617101770,Genius Brands International,https://www.reddit.com/r/wallstreetbets/comments/mgd9qj/genius_brands_international/,1617101770.0,"{'author': 'Glittering_Life8962', 'created_utc': 1617101770, 'title': 'Genius Brands International', 'url': 'https://www.reddit.com/r/wallstreetbets/comments/mgd9qj/genius_brands_international/', 'created': 1617101770.0}",2021-03-30 10:56:10
94,BrexitBitcoin,1617101712,Global banks lose more money from downfall of hedge funds than Suez Canal blockage,https://www.reddit.com/r/wallstreetbets/comments/mgd99f/global_banks_lose_more_money_from_downfall_of/,1617101712.0,"{'author': 'BrexitBitcoin', 'created_utc': 1617101712, 'title': 'Global banks lose more money from downfall of hedge funds than Suez Canal blockage', 'url': 'https://www.reddit.com/r/wallstreetbets/comments/mgd99f/global_banks_lose_more_money_from_downfall_of/', 'created': 1617101712.0}",2021-03-30 10:55:12
95,Angeleyestrades,1617101711,GME news! Another hire from Amazon!,https://i.redd.it/x3to4s84c5q61.jpg,1617101711.0,"{'author': 'Angeleyestrades', 'created_utc': 1617101711, 'title': 'GME news! Another hire from Amazon!', 'url': 'https://i.redd.it/x3to4s84c5q61.jpg', 'created': 1617101711.0}",2021-03-30 10:55:11
96,farridink,1617101523,Help!!,https://www.reddit.com/r/wallstreetbets/comments/mgd7ik/help/,1617101523.0,"{'author': 'farridink', 'created_utc': 1617101523, 'title': 'Help!!', 'url': 'https://www.reddit.com/r/wallstreetbets/comments/mgd7ik/help/', 'created': 1617101523.0}",2021-03-30 10:52:03
97,cypec_Afrotec_1973,1617101456,Go Frequentis Go,https://www.reddit.com/r/wallstreetbets/comments/mgd6yo/go_frequentis_go/,1617101456.0,"{'author': 'cypec_Afrotec_1973', 'created_utc': 1617101456, 'title': 'Go Frequentis Go', 'url': 'https://www.reddit.com/r/wallstreetbets/comments/mgd6yo/go_frequentis_go/', 'created': 1617101456.0}",2021-03-30 10:50:56
98,BrexitBitcoin,1617101412,Global banks lose more money from downfall of hedge funds than Suez Canal blockage,https://www.reddit.com/r/wallstreetbets/comments/mgd6li/global_banks_lose_more_money_from_downfall_of/,1617101412.0,"{'author': 'BrexitBitcoin', 'created_utc': 1617101412, 'title': 'Global banks lose more money from downfall of hedge funds than Suez Canal blockage', 'url': 'https://www.reddit.com/r/wallstreetbets/comments/mgd6li/global_banks_lose_more_money_from_downfall_of/', 'created': 1617101412.0}",2021-03-30 10:50:12
99,Pay-Homage,1617101379,Evel Pie in Vegas,https://www.reddit.com/gallery/mgd6ap,1617101379.0,"{'author': 'Pay-Homage', 'created_utc': 1617101379, 'title': 'Evel Pie in Vegas', 'url': 'https://www.reddit.com/gallery/mgd6ap', 'created': 1617101379.0}",2021-03-30 10:49:39
