,author,created_utc,title,url,created,d_,created_utc_dt
0,NationalIdiot14,1611977858,"Newbie here, what to do?",https://www.reddit.com/r/wallstreetbets/comments/l8cu83/newbie_here_what_to_do/,1611977858.0,"{'author': 'NationalIdiot14', 'created_utc': 1611977858, 'title': 'Newbie here, what to do?', 'url': 'https://www.reddit.com/r/wallstreetbets/comments/l8cu83/newbie_here_what_to_do/', 'created': 1611977858.0}",2021-01-30 03:37:38
1,RevplagueTv,1611977858,"A thought I had, which was funny to me.",https://i.redd.it/935adpt94ee61.jpg,1611977858.0,"{'author': 'RevplagueTv', 'created_utc': 1611977858, 'title': 'A thought I had, which was funny to me.', 'url': 'https://i.redd.it/935adpt94ee61.jpg', 'created': 1611977858.0}",2021-01-30 03:37:38
2,AccomplishedChart225,1611977857,.,https://i.redd.it/jztygok94ee61.jpg,1611977857.0,"{'author': 'AccomplishedChart225', 'created_utc': 1611977857, 'title': '.', 'url': 'https://i.redd.it/jztygok94ee61.jpg', 'created': 1611977857.0}",2021-01-30 03:37:37
3,ike0072,1611977856,The Diamond Hander's Ball! Let all who have HODL'd GME come together and celebrate! The DIAMOND-HANDERS BALL.,https://www.reddit.com/r/wallstreetbets/comments/l8cu72/the_diamond_handers_ball_let_all_who_have_hodld/,1611977856.0,"{'author': 'ike0072', 'created_utc': 1611977856, 'title': ""The Diamond Hander's Ball! Let all who have HODL'd GME come together and celebrate! The DIAMOND-HANDERS BALL."", 'url': 'https://www.reddit.com/r/wallstreetbets/comments/l8cu72/the_diamond_handers_ball_let_all_who_have_hodld/', 'created': 1611977856.0}",2021-01-30 03:37:36
4,LoneWolf1123,1611977856,Michael Reeves likes the stock 🙌 💎,https://i.redd.it/a0qd8gj94ee61.jpg,1611977856.0,"{'author': 'LoneWolf1123', 'created_utc': 1611977856, 'title': 'Michael Reeves likes the stock 🙌 💎', 'url': 'https://i.redd.it/a0qd8gj94ee61.jpg', 'created': 1611977856.0}",2021-01-30 03:37:36
5,Anogeissus,1611977856,Can somebody reply with the copy pasta about gorilla and banana to explain short sales? I wanna send it to my dad.,https://www.reddit.com/r/wallstreetbets/comments/l8cu6u/can_somebody_reply_with_the_copy_pasta_about/,1611977856.0,"{'author': 'Anogeissus', 'created_utc': 1611977856, 'title': 'Can somebody reply with the copy pasta about gorilla and banana to explain short sales? I wanna send it to my dad.', 'url': 'https://www.reddit.com/r/wallstreetbets/comments/l8cu6u/can_somebody_reply_with_the_copy_pasta_about/', 'created': 1611977856.0}",2021-01-30 03:37:36
6,vwvwvww,1611977856,One of the greatest weeks I’ve ever had,https://www.reddit.com/r/wallstreetbets/comments/l8cu6s/one_of_the_greatest_weeks_ive_ever_had/,1611977856.0,"{'author': 'vwvwvww', 'created_utc': 1611977856, 'title': 'One of the greatest weeks I’ve ever had', 'url': 'https://www.reddit.com/r/wallstreetbets/comments/l8cu6s/one_of_the_greatest_weeks_ive_ever_had/', 'created': 1611977856.0}",2021-01-30 03:37:36
7,ItsHardBeingStupid,1611977855,New war song🤔,https://www.reddit.com/r/wallstreetbets/comments/l8cu6f/new_war_song/,1611977855.0,"{'author': 'ItsHardBeingStupid', 'created_utc': 1611977855, 'title': 'New war song🤔', 'url': 'https://www.reddit.com/r/wallstreetbets/comments/l8cu6f/new_war_song/', 'created': 1611977855.0}",2021-01-30 03:37:35
8,Dracstar,1611977855,"Nearly tripled my portfolio. If I can hold, so can you! (third repost, please don't delete mods)",https://i.redd.it/nv62uwi64ee61.jpg,1611977855.0,"{'author': 'Dracstar', 'created_utc': 1611977855, 'title': ""Nearly tripled my portfolio. If I can hold, so can you! (third repost, please don't delete mods)"", 'url': 'https://i.redd.it/nv62uwi64ee61.jpg', 'created': 1611977855.0}",2021-01-30 03:37:35
9,azmsngk,1611977854,What is wallstreetbets buying on monday?,https://www.reddit.com/r/wallstreetbets/comments/l8cu5x/what_is_wallstreetbets_buying_on_monday/,1611977854.0,"{'author': 'azmsngk', 'created_utc': 1611977854, 'title': 'What is wallstreetbets buying on monday?', 'url': 'https://www.reddit.com/r/wallstreetbets/comments/l8cu5x/what_is_wallstreetbets_buying_on_monday/', 'created': 1611977854.0}",2021-01-30 03:37:34
10,twerkteamjapan,1611977854,HOLD THE LINE DOGE,https://www.reddit.com/r/wallstreetbets/comments/l8cu5v/hold_the_line_doge/,1611977854.0,"{'author': 'twerkteamjapan', 'created_utc': 1611977854, 'title': 'HOLD THE LINE DOGE', 'url': 'https://www.reddit.com/r/wallstreetbets/comments/l8cu5v/hold_the_line_doge/', 'created': 1611977854.0}",2021-01-30 03:37:34
11,Qulifav,1611977853,"SoFi is a direct competitor to Robinhood and the stock is going up!!! (ticker: IPOE) up 23% today. I have 15% of my portfolio in this stock, since the beginning of this year. And for anyone that doesn't want to use robin hood you can use SoFi",https://www.reddit.com/r/wallstreetbets/comments/l8cu5l/sofi_is_a_direct_competitor_to_robinhood_and_the/,1611977853.0,"{'author': 'Qulifav', 'created_utc': 1611977853, 'title': ""SoFi is a direct competitor to Robinhood and the stock is going up!!! (ticker: IPOE) up 23% today. I have 15% of my portfolio in this stock, since the beginning of this year. And for anyone that doesn't want to use robin hood you can use SoFi"", 'url': 'https://www.reddit.com/r/wallstreetbets/comments/l8cu5l/sofi_is_a_direct_competitor_to_robinhood_and_the/', 'created': 1611977853.0}",2021-01-30 03:37:33
12,wlurk502,1611977853,Never Forget: Robin Hood Failing Basic Math... Explains A Lot Lately.,https://i.redd.it/81273are3ee61.jpg,1611977853.0,"{'author': 'wlurk502', 'created_utc': 1611977853, 'title': 'Never Forget: Robin Hood Failing Basic Math... Explains A Lot Lately.', 'url': 'https://i.redd.it/81273are3ee61.jpg', 'created': 1611977853.0}",2021-01-30 03:37:33
13,Candid_Assistance_58,1611977851,EVERYONE JUST KEEP THE FUCKING HYPE ON 1-2 STOCKS! OTHERWISE WE LOSE FOCUS AND LOSE TO THE HEDGE HOES!!!! GME &amp; AMC TO THE FUCKING PLUTO FIRST,https://www.reddit.com/r/wallstreetbets/comments/l8cu4q/everyone_just_keep_the_fucking_hype_on_12_stocks/,1611977851.0,"{'author': 'Candid_Assistance_58', 'created_utc': 1611977851, 'title': 'EVERYONE JUST KEEP THE FUCKING HYPE ON 1-2 STOCKS! OTHERWISE WE LOSE FOCUS AND LOSE TO THE HEDGE HOES!!!! GME &amp; AMC TO THE FUCKING PLUTO FIRST', 'url': 'https://www.reddit.com/r/wallstreetbets/comments/l8cu4q/everyone_just_keep_the_fucking_hype_on_12_stocks/', 'created': 1611977851.0}",2021-01-30 03:37:31
14,LRushby89,1611977850,Best/easiest way to get involved in buying stocks in UK?,https://www.reddit.com/r/wallstreetbets/comments/l8cu4o/besteasiest_way_to_get_involved_in_buying_stocks/,1611977850.0,"{'author': 'LRushby89', 'created_utc': 1611977850, 'title': 'Best/easiest way to get involved in buying stocks in UK?', 'url': 'https://www.reddit.com/r/wallstreetbets/comments/l8cu4o/besteasiest_way_to_get_involved_in_buying_stocks/', 'created': 1611977850.0}",2021-01-30 03:37:30
15,AcceptableJudgment68,1611977850,GOOD TIME FOR A REDDIT IPO????🤔????,https://www.reddit.com/r/wallstreetbets/comments/l8cu4m/good_time_for_a_reddit_ipo/,1611977850.0,"{'author': 'AcceptableJudgment68', 'created_utc': 1611977850, 'title': 'GOOD TIME FOR A REDDIT IPO????🤔????', 'url': 'https://www.reddit.com/r/wallstreetbets/comments/l8cu4m/good_time_for_a_reddit_ipo/', 'created': 1611977850.0}",2021-01-30 03:37:30
16,tecvoid,1611977848,Simple Question About Short Selling,https://www.reddit.com/r/wallstreetbets/comments/l8cu3s/simple_question_about_short_selling/,1611977848.0,"{'author': 'tecvoid', 'created_utc': 1611977848, 'title': 'Simple Question About Short Selling', 'url': 'https://www.reddit.com/r/wallstreetbets/comments/l8cu3s/simple_question_about_short_selling/', 'created': 1611977848.0}",2021-01-30 03:37:28
17,evilgart,1611977847,Hi can someone explain to me why the SEC won't halt the trade of GME to avoid a market crash just because they can?,https://www.reddit.com/r/wallstreetbets/comments/l8cu3e/hi_can_someone_explain_to_me_why_the_sec_wont/,1611977847.0,"{'author': 'evilgart', 'created_utc': 1611977847, 'title': ""Hi can someone explain to me why the SEC won't halt the trade of GME to avoid a market crash just because they can?"", 'url': 'https://www.reddit.com/r/wallstreetbets/comments/l8cu3e/hi_can_someone_explain_to_me_why_the_sec_wont/', 'created': 1611977847.0}",2021-01-30 03:37:27
18,RhodesHouse,1611977846,Where should I go?,https://www.reddit.com/r/wallstreetbets/comments/l8cu39/where_should_i_go/,1611977846.0,"{'author': 'RhodesHouse', 'created_utc': 1611977846, 'title': 'Where should I go?', 'url': 'https://www.reddit.com/r/wallstreetbets/comments/l8cu39/where_should_i_go/', 'created': 1611977846.0}",2021-01-30 03:37:26
19,StallionTG,1611977845,"Is this propaganda? do we care to discuss the threads over at neoliberal? ""why did robinhood stop trade""",https://www.reddit.com/r/neoliberal/comments/l81tif/why_did_robinhood_stop_allowing_their_customers/,1611977845.0,"{'author': 'StallionTG', 'created_utc': 1611977845, 'title': 'Is this propaganda? do we care to discuss the threads over at neoliberal? ""why did robinhood stop trade""', 'url': 'https://www.reddit.com/r/neoliberal/comments/l81tif/why_did_robinhood_stop_allowing_their_customers/', 'created': 1611977845.0}",2021-01-30 03:37:25
20,noicework,1611977841,AMC got much needed cash and a Teacher's Pension got the same because of WSB,https://www.reddit.com/r/wallstreetbets/comments/l8cu15/amc_got_much_needed_cash_and_a_teachers_pension/,1611977841.0,"{'author': 'noicework', 'created_utc': 1611977841, 'title': ""AMC got much needed cash and a Teacher's Pension got the same because of WSB"", 'url': 'https://www.reddit.com/r/wallstreetbets/comments/l8cu15/amc_got_much_needed_cash_and_a_teachers_pension/', 'created': 1611977841.0}",2021-01-30 03:37:21
21,thegoobyking,1611977841,I EDITED AN NARUTO OP INTO ONE FOR THE BATTLE/RECENT EVENTS,https://www.reddit.com/r/wallstreetbets/comments/l8cu13/i_edited_an_naruto_op_into_one_for_the/,1611977841.0,"{'author': 'thegoobyking', 'created_utc': 1611977841, 'title': 'I EDITED AN NARUTO OP INTO ONE FOR THE BATTLE/RECENT EVENTS', 'url': 'https://www.reddit.com/r/wallstreetbets/comments/l8cu13/i_edited_an_naruto_op_into_one_for_the/', 'created': 1611977841.0}",2021-01-30 03:37:21
22,totiisawesome,1611977840,I'm a minor (16) who wants to start investing in the sock market. (I also work) any recommended amount I hold start with?,https://www.reddit.com/r/wallstreetbets/comments/l8cu0s/im_a_minor_16_who_wants_to_start_investing_in_the/,1611977840.0,"{'author': 'totiisawesome', 'created_utc': 1611977840, 'title': ""I'm a minor (16) who wants to start investing in the sock market. (I also work) any recommended amount I hold start with?"", 'url': 'https://www.reddit.com/r/wallstreetbets/comments/l8cu0s/im_a_minor_16_who_wants_to_start_investing_in_the/', 'created': 1611977840.0}",2021-01-30 03:37:20
23,shipexlo,1611977839,Dogecoin. What are we doing?,https://www.reddit.com/r/wallstreetbets/comments/l8cu0m/dogecoin_what_are_we_doing/,1611977839.0,"{'author': 'shipexlo', 'created_utc': 1611977839, 'title': 'Dogecoin. What are we doing?', 'url': 'https://www.reddit.com/r/wallstreetbets/comments/l8cu0m/dogecoin_what_are_we_doing/', 'created': 1611977839.0}",2021-01-30 03:37:19
24,chan-23,1611977837,Confused,https://www.reddit.com/r/wallstreetbets/comments/l8cu04/confused/,1611977837.0,"{'author': 'chan-23', 'created_utc': 1611977837, 'title': 'Confused', 'url': 'https://www.reddit.com/r/wallstreetbets/comments/l8cu04/confused/', 'created': 1611977837.0}",2021-01-30 03:37:17
25,kaptainkraze,1611977836,Noob from AU here needing some suggestions where to buy GME,https://www.reddit.com/r/wallstreetbets/comments/l8ctzi/noob_from_au_here_needing_some_suggestions_where/,1611977836.0,"{'author': 'kaptainkraze', 'created_utc': 1611977836, 'title': 'Noob from AU here needing some suggestions where to buy GME', 'url': 'https://www.reddit.com/r/wallstreetbets/comments/l8ctzi/noob_from_au_here_needing_some_suggestions_where/', 'created': 1611977836.0}",2021-01-30 03:37:16
26,Drammin,1611977836,This is the way.,https://i.redd.it/8jlvfsh74ee61.jpg,1611977836.0,"{'author': 'Drammin', 'created_utc': 1611977836, 'title': 'This is the way.', 'url': 'https://i.redd.it/8jlvfsh74ee61.jpg', 'created': 1611977836.0}",2021-01-30 03:37:16
27,VictorCBLL,1611977835,GameStop Phenomenon,https://i.redd.it/cjfliga74ee61.jpg,1611977835.0,"{'author': 'VictorCBLL', 'created_utc': 1611977835, 'title': 'GameStop Phenomenon', 'url': 'https://i.redd.it/cjfliga74ee61.jpg', 'created': 1611977835.0}",2021-01-30 03:37:15
28,DAXminer,1611977832,"Welp there goes my profit for not cutting my losses when it started falling to the lows 0.04s, I guess imma play the long game now, see if it reaches 0.1 by the end of the year",https://i.redd.it/oji37wx64ee61.jpg,1611977832.0,"{'author': 'DAXminer', 'created_utc': 1611977832, 'title': 'Welp there goes my profit for not cutting my losses when it started falling to the lows 0.04s, I guess imma play the long game now, see if it reaches 0.1 by the end of the year', 'url': 'https://i.redd.it/oji37wx64ee61.jpg', 'created': 1611977832.0}",2021-01-30 03:37:12
29,asmrJack,1611977832,It all makes sense now,https://i.redd.it/fkfy3q564ee61.png,1611977832.0,"{'author': 'asmrJack', 'created_utc': 1611977832, 'title': 'It all makes sense now', 'url': 'https://i.redd.it/fkfy3q564ee61.png', 'created': 1611977832.0}",2021-01-30 03:37:12
30,Mother-Speed2850,1611977830,DOGE,https://www.reddit.com/r/wallstreetbets/comments/l8ctws/doge/,1611977830.0,"{'author': 'Mother-Speed2850', 'created_utc': 1611977830, 'title': 'DOGE', 'url': 'https://www.reddit.com/r/wallstreetbets/comments/l8ctws/doge/', 'created': 1611977830.0}",2021-01-30 03:37:10
31,Short_Card_739,1611977830,MISSED GME .. what’s next ?,https://www.reddit.com/r/wallstreetbets/comments/l8ctwr/missed_gme_whats_next/,1611977830.0,"{'author': 'Short_Card_739', 'created_utc': 1611977830, 'title': 'MISSED GME .. what’s next ?', 'url': 'https://www.reddit.com/r/wallstreetbets/comments/l8ctwr/missed_gme_whats_next/', 'created': 1611977830.0}",2021-01-30 03:37:10
32,savagecabbage64,1611977828,"Let's not forget our Dogecoin brethren, their dip is the lowest its ever been BUY &amp; HOLD🚀🚀🚀🚀🚀🚀",https://www.reddit.com/r/wallstreetbets/comments/l8ctw7/lets_not_forget_our_dogecoin_brethren_their_dip/,1611977828.0,"{'author': 'savagecabbage64', 'created_utc': 1611977828, 'title': ""Let's not forget our Dogecoin brethren, their dip is the lowest its ever been BUY &amp; HOLD🚀🚀🚀🚀🚀🚀"", 'url': 'https://www.reddit.com/r/wallstreetbets/comments/l8ctw7/lets_not_forget_our_dogecoin_brethren_their_dip/', 'created': 1611977828.0}",2021-01-30 03:37:08
33,FirstMagician2011,1611977828,ROBINHOOD PUMPING UP BTS (bitshares),https://www.reddit.com/r/wallstreetbets/comments/l8ctvy/robinhood_pumping_up_bts_bitshares/,1611977828.0,"{'author': 'FirstMagician2011', 'created_utc': 1611977828, 'title': 'ROBINHOOD PUMPING UP BTS (bitshares)', 'url': 'https://www.reddit.com/r/wallstreetbets/comments/l8ctvy/robinhood_pumping_up_bts_bitshares/', 'created': 1611977828.0}",2021-01-30 03:37:08
34,adfgrg,1611977827,RIP dogecoin,https://www.reddit.com/r/wallstreetbets/comments/l8ctvp/rip_dogecoin/,1611977827.0,"{'author': 'adfgrg', 'created_utc': 1611977827, 'title': 'RIP dogecoin', 'url': 'https://www.reddit.com/r/wallstreetbets/comments/l8ctvp/rip_dogecoin/', 'created': 1611977827.0}",2021-01-30 03:37:07
35,danewt420,1611977825,Dominion Energy &amp; Chesapeake Utilities,https://www.reddit.com/r/wallstreetbets/comments/l8ctuz/dominion_energy_chesapeake_utilities/,1611977825.0,"{'author': 'danewt420', 'created_utc': 1611977825, 'title': 'Dominion Energy &amp; Chesapeake Utilities', 'url': 'https://www.reddit.com/r/wallstreetbets/comments/l8ctuz/dominion_energy_chesapeake_utilities/', 'created': 1611977825.0}",2021-01-30 03:37:05
36,Meet_the_Meat,1611977825,I'M DOING MY PART!!,https://kapwi.ng/c/DUarll1d,1611977825.0,"{'author': 'Meet_the_Meat', 'created_utc': 1611977825, 'title': ""I'M DOING MY PART!!"", 'url': 'https://kapwi.ng/c/DUarll1d', 'created': 1611977825.0}",2021-01-30 03:37:05
37,Ipipefit2,1611977824,Silver Lake,https://www.reddit.com/r/wallstreetbets/comments/l8ctug/silver_lake/,1611977824.0,"{'author': 'Ipipefit2', 'created_utc': 1611977824, 'title': 'Silver Lake', 'url': 'https://www.reddit.com/r/wallstreetbets/comments/l8ctug/silver_lake/', 'created': 1611977824.0}",2021-01-30 03:37:04
38,LordJonMichael,1611977823,Petition to change Robinhood to RobbingTheHood,https://www.reddit.com/r/wallstreetbets/comments/l8ctu6/petition_to_change_robinhood_to_robbingthehood/,1611977823.0,"{'author': 'LordJonMichael', 'created_utc': 1611977823, 'title': 'Petition to change Robinhood to RobbingTheHood', 'url': 'https://www.reddit.com/r/wallstreetbets/comments/l8ctu6/petition_to_change_robinhood_to_robbingthehood/', 'created': 1611977823.0}",2021-01-30 03:37:03
39,Daddywardollarz,1611977823,EAT MY SHORTS,https://www.reddit.com/r/wallstreetbets/comments/l8ctty/eat_my_shorts/,1611977823.0,"{'author': 'Daddywardollarz', 'created_utc': 1611977823, 'title': 'EAT MY SHORTS', 'url': 'https://www.reddit.com/r/wallstreetbets/comments/l8ctty/eat_my_shorts/', 'created': 1611977823.0}",2021-01-30 03:37:03
40,tresh15,1611977822,Does anyone even understand the Suit’s argument?,https://www.reddit.com/r/wallstreetbets/comments/l8cttj/does_anyone_even_understand_the_suits_argument/,1611977822.0,"{'author': 'tresh15', 'created_utc': 1611977822, 'title': 'Does anyone even understand the Suit’s argument?', 'url': 'https://www.reddit.com/r/wallstreetbets/comments/l8cttj/does_anyone_even_understand_the_suits_argument/', 'created': 1611977822.0}",2021-01-30 03:37:02
41,WSB_ROCKETSHIP_PILOT,1611977821,Robinhood employees talk shit about Robinhood on Blind,https://i.redd.it/0sjoa99u3ee61.png,1611977821.0,"{'author': 'WSB_ROCKETSHIP_PILOT', 'created_utc': 1611977821, 'title': 'Robinhood employees talk shit about Robinhood on Blind', 'url': 'https://i.redd.it/0sjoa99u3ee61.png', 'created': 1611977821.0}",2021-01-30 03:37:01
42,CallsOnly,1611977820,MAN BUYS 50K OF GME,https://youtu.be/Ic7NhQ62njg?t=2260,1611977820.0,"{'author': 'CallsOnly', 'created_utc': 1611977820, 'title': 'MAN BUYS 50K OF GME', 'url': 'https://youtu.be/Ic7NhQ62njg?t=2260', 'created': 1611977820.0}",2021-01-30 03:37:00
43,KVVVNJ4MZ,1611977820,SHORT THIS HOSS!,https://i.redd.it/j5juq3p54ee61.jpg,1611977820.0,"{'author': 'KVVVNJ4MZ', 'created_utc': 1611977820, 'title': 'SHORT THIS HOSS!', 'url': 'https://i.redd.it/j5juq3p54ee61.jpg', 'created': 1611977820.0}",2021-01-30 03:37:00
44,thatfrenchcanadian,1611977817,We like the stock Sharon 🚀🚀🚀🚀,https://i.redd.it/s10i3ga54ee61.jpg,1611977817.0,"{'author': 'thatfrenchcanadian', 'created_utc': 1611977817, 'title': 'We like the stock Sharon 🚀🚀🚀🚀', 'url': 'https://i.redd.it/s10i3ga54ee61.jpg', 'created': 1611977817.0}",2021-01-30 03:36:57
45,Toonstop,1611977815,"Can’t buy single AMC share on RobinHood? I have the cash, but it throws a “CANT buy fractional shares” nonsense. Am I doing something wrong?",https://i.redd.it/2pb03l754ee61.jpg,1611977815.0,"{'author': 'Toonstop', 'created_utc': 1611977815, 'title': 'Can’t buy single AMC share on RobinHood? I have the cash, but it throws a “CANT buy fractional shares” nonsense. Am I doing something wrong?', 'url': 'https://i.redd.it/2pb03l754ee61.jpg', 'created': 1611977815.0}",2021-01-30 03:36:55
46,THEREAL_DAVE,1611977813,hmmm,https://i.redd.it/u5b99i034ee61.png,1611977813.0,"{'author': 'THEREAL_DAVE', 'created_utc': 1611977813, 'title': 'hmmm', 'url': 'https://i.redd.it/u5b99i034ee61.png', 'created': 1611977813.0}",2021-01-30 03:36:53
47,I_Launder_Shekels,1611977813,Doing my part to help out our lord and savior DEEPFUCKINGVALUE/Roaring Kitty,https://i.redd.it/u378cgze3ee61.jpg,1611977813.0,"{'author': 'I_Launder_Shekels', 'created_utc': 1611977813, 'title': 'Doing my part to help out our lord and savior DEEPFUCKINGVALUE/Roaring Kitty', 'url': 'https://i.redd.it/u378cgze3ee61.jpg', 'created': 1611977813.0}",2021-01-30 03:36:53
48,Rozender12,1611977813,RIDE THAT SHIT LIKE PIPER PERI BOIIS,https://i.redd.it/xqaru8x44ee61.jpg,1611977813.0,"{'author': 'Rozender12', 'created_utc': 1611977813, 'title': 'RIDE THAT SHIT LIKE PIPER PERI BOIIS', 'url': 'https://i.redd.it/xqaru8x44ee61.jpg', 'created': 1611977813.0}",2021-01-30 03:36:53
49,alaagarwin,1611977810,Holding like a true retard!,https://i.redd.it/lm62eab14ee61.jpg,1611977810.0,"{'author': 'alaagarwin', 'created_utc': 1611977810, 'title': 'Holding like a true retard!', 'url': 'https://i.redd.it/lm62eab14ee61.jpg', 'created': 1611977810.0}",2021-01-30 03:36:50
50,Weak_Veterinarian_43,1611977810,I’m brand new to stock market investing. I need some advice and would like to join the WallStreetBets army,https://www.reddit.com/r/wallstreetbets/comments/l8ctpi/im_brand_new_to_stock_market_investing_i_need/,1611977810.0,"{'author': 'Weak_Veterinarian_43', 'created_utc': 1611977810, 'title': 'I’m brand new to stock market investing. I need some advice and would like to join the WallStreetBets army', 'url': 'https://www.reddit.com/r/wallstreetbets/comments/l8ctpi/im_brand_new_to_stock_market_investing_i_need/', 'created': 1611977810.0}",2021-01-30 03:36:50
51,fastnicky69,1611977810,🚀🙌💎,https://i.redd.it/vw2mpln44ee61.jpg,1611977810.0,"{'author': 'fastnicky69', 'created_utc': 1611977810, 'title': '🚀🙌💎', 'url': 'https://i.redd.it/vw2mpln44ee61.jpg', 'created': 1611977810.0}",2021-01-30 03:36:50
52,Fallenlion2,1611977810,Dogecoin limited on Robinhood no surprise,https://www.reddit.com/r/wallstreetbets/comments/l8ctpc/dogecoin_limited_on_robinhood_no_surprise/,1611977810.0,"{'author': 'Fallenlion2', 'created_utc': 1611977810, 'title': 'Dogecoin limited on Robinhood no surprise', 'url': 'https://www.reddit.com/r/wallstreetbets/comments/l8ctpc/dogecoin_limited_on_robinhood_no_surprise/', 'created': 1611977810.0}",2021-01-30 03:36:50
53,midwestairdetailer,1611977808,"We like the Stonk, I'm not fucking selling! 🚀🚀🚀",https://www.reddit.com/gallery/l8ctoc,1611977808.0,"{'author': 'midwestairdetailer', 'created_utc': 1611977808, 'title': ""We like the Stonk, I'm not fucking selling! 🚀🚀🚀"", 'url': 'https://www.reddit.com/gallery/l8ctoc', 'created': 1611977808.0}",2021-01-30 03:36:48
54,Scoopu247,1611977808,"Hedge Funds taking a bath that paid for Robinhood trades. I'm guessing Citadel, Susquehanna, Wolverine, Virtu and Two Sigma go belly up.",https://i.redd.it/5qn054m24ee61.jpg,1611977808.0,"{'author': 'Scoopu247', 'created_utc': 1611977808, 'title': ""Hedge Funds taking a bath that paid for Robinhood trades. I'm guessing Citadel, Susquehanna, Wolverine, Virtu and Two Sigma go belly up."", 'url': 'https://i.redd.it/5qn054m24ee61.jpg', 'created': 1611977808.0}",2021-01-30 03:36:48
55,TitoPR91,1611977808,Hold!! Every Single Share count.,https://v.redd.it/oimfm55y3ee61,1611977808.0,"{'author': 'TitoPR91', 'created_utc': 1611977808, 'title': 'Hold!! Every Single Share count.', 'url': 'https://v.redd.it/oimfm55y3ee61', 'created': 1611977808.0}",2021-01-30 03:36:48
56,KaptainCorrupt,1611977806,Holding AMC for my fellow retards🌙,https://www.reddit.com/r/wallstreetbets/comments/l8ctnl/holding_amc_for_my_fellow_retards/,1611977806.0,"{'author': 'KaptainCorrupt', 'created_utc': 1611977806, 'title': 'Holding AMC for my fellow retards🌙', 'url': 'https://www.reddit.com/r/wallstreetbets/comments/l8ctnl/holding_amc_for_my_fellow_retards/', 'created': 1611977806.0}",2021-01-30 03:36:46
57,Klutzy-Research7082,1611977806,When are we selling gme?!,https://www.reddit.com/r/wallstreetbets/comments/l8ctnk/when_are_we_selling_gme/,1611977806.0,"{'author': 'Klutzy-Research7082', 'created_utc': 1611977806, 'title': 'When are we selling gme?!', 'url': 'https://www.reddit.com/r/wallstreetbets/comments/l8ctnk/when_are_we_selling_gme/', 'created': 1611977806.0}",2021-01-30 03:36:46
58,OliverDatlon,1611977806,Got £6k WHICH SHARES ARE LOOKING BEST !?,https://www.reddit.com/r/wallstreetbets/comments/l8ctnh/got_6k_which_shares_are_looking_best/,1611977806.0,"{'author': 'OliverDatlon', 'created_utc': 1611977806, 'title': 'Got £6k WHICH SHARES ARE LOOKING BEST !?', 'url': 'https://www.reddit.com/r/wallstreetbets/comments/l8ctnh/got_6k_which_shares_are_looking_best/', 'created': 1611977806.0}",2021-01-30 03:36:46
59,[deleted],1611977806,"Remember, He died because he was not able to...? Note: Not an advisor. 🙌🦍💎",https://i.redd.it/gnz4ym744ee61.jpg,1611977806.0,"{'author': '[deleted]', 'created_utc': 1611977806, 'title': 'Remember, He died because he was not able to...? Note: Not an advisor. 🙌🦍💎', 'url': 'https://i.redd.it/gnz4ym744ee61.jpg', 'created': 1611977806.0}",2021-01-30 03:36:46
60,future_zip,1611977806,Hear me out: Doge,https://www.reddit.com/r/wallstreetbets/comments/l8ctne/hear_me_out_doge/,1611977806.0,"{'author': 'future_zip', 'created_utc': 1611977806, 'title': 'Hear me out: Doge', 'url': 'https://www.reddit.com/r/wallstreetbets/comments/l8ctne/hear_me_out_doge/', 'created': 1611977806.0}",2021-01-30 03:36:46
61,Beerddviking626,1611977804,"Ok, real talk to a RETARD, what will REALISTICALLY happen if all of us hold our positions? Do the hedge funds go bankrupt? Does GME just go up infinitely? What happens?",https://www.reddit.com/r/wallstreetbets/comments/l8ctmz/ok_real_talk_to_a_retard_what_will_realistically/,1611977804.0,"{'author': 'Beerddviking626', 'created_utc': 1611977804, 'title': 'Ok, real talk to a RETARD, what will REALISTICALLY happen if all of us hold our positions? Do the hedge funds go bankrupt? Does GME just go up infinitely? What happens?', 'url': 'https://www.reddit.com/r/wallstreetbets/comments/l8ctmz/ok_real_talk_to_a_retard_what_will_realistically/', 'created': 1611977804.0}",2021-01-30 03:36:44
