,author,created_utc,title,url,created,d_,created_utc_dt
0,Somniaxis,1611878431,CTRM - Shipping stock ready to set sail to moon,https://www.reddit.com/r/wallstreetbets/comments/l7d6qk/ctrm_shipping_stock_ready_to_set_sail_to_moon/,1611878431.0,"{'author': 'Somniaxis', 'created_utc': 1611878431, 'title': 'CTRM - Shipping stock ready to set sail to moon', 'url': 'https://www.reddit.com/r/wallstreetbets/comments/l7d6qk/ctrm_shipping_stock_ready_to_set_sail_to_moon/', 'created': 1611878431.0}",2021-01-29 00:00:31
1,InstructionDry8160,1611878430,Robinhood must pay,https://www.reddit.com/r/wallstreetbets/comments/l7d6qb/robinhood_must_pay/,1611878430.0,"{'author': 'InstructionDry8160', 'created_utc': 1611878430, 'title': 'Robinhood must pay', 'url': 'https://www.reddit.com/r/wallstreetbets/comments/l7d6qb/robinhood_must_pay/', 'created': 1611878430.0}",2021-01-29 00:00:30
2,Mauskrazor3rd,1611878430,ROBINHOOD JUST GOT A BUNCH OF REVIEWS RENOVED,https://www.reddit.com/r/wallstreetbets/comments/l7d6q3/robinhood_just_got_a_bunch_of_reviews_renoved/,1611878430.0,"{'author': 'Mauskrazor3rd', 'created_utc': 1611878430, 'title': 'ROBINHOOD JUST GOT A BUNCH OF REVIEWS RENOVED', 'url': 'https://www.reddit.com/r/wallstreetbets/comments/l7d6q3/robinhood_just_got_a_bunch_of_reviews_renoved/', 'created': 1611878430.0}",2021-01-29 00:00:30
3,AwayState,1611878430,"Never Back Down, Never Give Up. Elon Is On Our Side.",https://i.redd.it/ny1v0xplw5e61.png,1611878430.0,"{'author': 'AwayState', 'created_utc': 1611878430, 'title': 'Never Back Down, Never Give Up. Elon Is On Our Side.', 'url': 'https://i.redd.it/ny1v0xplw5e61.png', 'created': 1611878430.0}",2021-01-29 00:00:30
4,Cursed60Car,1611878429,GME Doubling after hours. They’re trying to price us out. The squeeze is coming 🚀🚀🚀🚀🚀,https://i.redd.it/tnqrsq9mw5e61.jpg,1611878429.0,"{'author': 'Cursed60Car', 'created_utc': 1611878429, 'title': 'GME Doubling after hours. They’re trying to price us out. The squeeze is coming 🚀🚀🚀🚀🚀', 'url': 'https://i.redd.it/tnqrsq9mw5e61.jpg', 'created': 1611878429.0}",2021-01-29 00:00:29
5,Free-Procedure2614,1611878429,Can this be done?,https://www.reddit.com/r/wallstreetbets/comments/l7d6pk/can_this_be_done/,1611878429.0,"{'author': 'Free-Procedure2614', 'created_utc': 1611878429, 'title': 'Can this be done?', 'url': 'https://www.reddit.com/r/wallstreetbets/comments/l7d6pk/can_this_be_done/', 'created': 1611878429.0}",2021-01-29 00:00:29
6,Huesion3,1611878429,Clown CEO Vlad of Robinhood on CNBC,https://www.reddit.com/r/wallstreetbets/comments/l7d6pg/clown_ceo_vlad_of_robinhood_on_cnbc/,1611878429.0,"{'author': 'Huesion3', 'created_utc': 1611878429, 'title': 'Clown CEO Vlad of Robinhood on CNBC', 'url': 'https://www.reddit.com/r/wallstreetbets/comments/l7d6pg/clown_ceo_vlad_of_robinhood_on_cnbc/', 'created': 1611878429.0}",2021-01-29 00:00:29
7,tranding,1611878429,ROCK HARD 💎💎👏👏,https://gfycat.com/forthrightfilthyamericanratsnake,1611878429.0,"{'author': 'tranding', 'created_utc': 1611878429, 'title': 'ROCK HARD 💎💎👏👏', 'url': 'https://gfycat.com/forthrightfilthyamericanratsnake', 'created': 1611878429.0}",2021-01-29 00:00:29
8,Due_Airline_4311,1611878428,Ready to reload retards. 🚀🚀🚀🌙,https://i.redd.it/ooc3t90mw5e61.jpg,1611878428.0,"{'author': 'Due_Airline_4311', 'created_utc': 1611878428, 'title': 'Ready to reload retards. 🚀🚀🚀🌙', 'url': 'https://i.redd.it/ooc3t90mw5e61.jpg', 'created': 1611878428.0}",2021-01-29 00:00:28
9,Appropriate-Ad1751,1611878427,Dogecoin 🚀🚀🚀🚀🚀,https://www.reddit.com/r/wallstreetbets/comments/l7d6oq/dogecoin/,1611878427.0,"{'author': 'Appropriate-Ad1751', 'created_utc': 1611878427, 'title': 'Dogecoin 🚀🚀🚀🚀🚀', 'url': 'https://www.reddit.com/r/wallstreetbets/comments/l7d6oq/dogecoin/', 'created': 1611878427.0}",2021-01-29 00:00:27
10,Financial-Slice-5309,1611878427,Vlad stammering on CNBC. Empty your quiver into Robinhood!,https://www.reddit.com/r/wallstreetbets/comments/l7d6oa/vlad_stammering_on_cnbc_empty_your_quiver_into/,1611878427.0,"{'author': 'Financial-Slice-5309', 'created_utc': 1611878427, 'title': 'Vlad stammering on CNBC. Empty your quiver into Robinhood!', 'url': 'https://www.reddit.com/r/wallstreetbets/comments/l7d6oa/vlad_stammering_on_cnbc_empty_your_quiver_into/', 'created': 1611878427.0}",2021-01-29 00:00:27
11,justforcodingthings,1611878427,$GME to the fkn moon,https://www.youtube.com/watch?v=K9tr064nb3c,1611878427.0,"{'author': 'justforcodingthings', 'created_utc': 1611878427, 'title': '$GME to the fkn moon', 'url': 'https://www.youtube.com/watch?v=K9tr064nb3c', 'created': 1611878427.0}",2021-01-29 00:00:27
12,j909m,1611878427,PSA: close your Robinhood accounts,https://www.reddit.com/r/wallstreetbets/comments/l7d6o6/psa_close_your_robinhood_accounts/,1611878427.0,"{'author': 'j909m', 'created_utc': 1611878427, 'title': 'PSA: close your Robinhood accounts', 'url': 'https://www.reddit.com/r/wallstreetbets/comments/l7d6o6/psa_close_your_robinhood_accounts/', 'created': 1611878427.0}",2021-01-29 00:00:27
13,shittymustang,1611878426,"Dogecoin is going to $1 and then some, come get this bag NOW",https://www.reddit.com/r/wallstreetbets/comments/l7d6nm/dogecoin_is_going_to_1_and_then_some_come_get/,1611878426.0,"{'author': 'shittymustang', 'created_utc': 1611878426, 'title': 'Dogecoin is going to $1 and then some, come get this bag NOW', 'url': 'https://www.reddit.com/r/wallstreetbets/comments/l7d6nm/dogecoin_is_going_to_1_and_then_some_come_get/', 'created': 1611878426.0}",2021-01-29 00:00:26
14,DARKUNIT22,1611878425,The graphs need to break tomorrow!,https://www.reddit.com/r/wallstreetbets/comments/l7d6nj/the_graphs_need_to_break_tomorrow/,1611878425.0,"{'author': 'DARKUNIT22', 'created_utc': 1611878425, 'title': 'The graphs need to break tomorrow!', 'url': 'https://www.reddit.com/r/wallstreetbets/comments/l7d6nj/the_graphs_need_to_break_tomorrow/', 'created': 1611878425.0}",2021-01-29 00:00:25
15,Mindspiked,1611878425,Buy back tomorrow?,https://www.reddit.com/r/wallstreetbets/comments/l7d6n9/buy_back_tomorrow/,1611878425.0,"{'author': 'Mindspiked', 'created_utc': 1611878425, 'title': 'Buy back tomorrow?', 'url': 'https://www.reddit.com/r/wallstreetbets/comments/l7d6n9/buy_back_tomorrow/', 'created': 1611878425.0}",2021-01-29 00:00:25
16,d1vvk,1611878425,YOU ARE THE BEST RETARDS I HAVE EVER SEEN 💎👐,https://i.redd.it/jao0heqlw5e61.jpg,1611878425.0,"{'author': 'd1vvk', 'created_utc': 1611878425, 'title': 'YOU ARE THE BEST RETARDS I HAVE EVER SEEN 💎👐', 'url': 'https://i.redd.it/jao0heqlw5e61.jpg', 'created': 1611878425.0}",2021-01-29 00:00:25
17,nerdook,1611878424,Lord of the Stonks,https://i.redd.it/46rocn7kw5e61.png,1611878424.0,"{'author': 'nerdook', 'created_utc': 1611878424, 'title': 'Lord of the Stonks', 'url': 'https://i.redd.it/46rocn7kw5e61.png', 'created': 1611878424.0}",2021-01-29 00:00:24
18,Appropriate-Doctor63,1611878424,DogeCoin next!,https://www.reddit.com/r/wallstreetbets/comments/l7d6mj/dogecoin_next/,1611878424.0,"{'author': 'Appropriate-Doctor63', 'created_utc': 1611878424, 'title': 'DogeCoin next!', 'url': 'https://www.reddit.com/r/wallstreetbets/comments/l7d6mj/dogecoin_next/', 'created': 1611878424.0}",2021-01-29 00:00:24
19,mkaykov,1611878423,Keep pushing! GME and AMC in “Top Gainers” for After Hours. Bleed the hedgefunds dry!,https://i.redd.it/fuxgfwmlw5e61.jpg,1611878423.0,"{'author': 'mkaykov', 'created_utc': 1611878423, 'title': 'Keep pushing! GME and AMC in “Top Gainers” for After Hours. Bleed the hedgefunds dry!', 'url': 'https://i.redd.it/fuxgfwmlw5e61.jpg', 'created': 1611878423.0}",2021-01-29 00:00:23
20,pgrdub,1611878423,Can you help me proofread my response? “It was a rough day because of you. Fuck you.”,https://i.redd.it/na9kidalw5e61.jpg,1611878423.0,"{'author': 'pgrdub', 'created_utc': 1611878423, 'title': 'Can you help me proofread my response? “It was a rough day because of you. Fuck you.”', 'url': 'https://i.redd.it/na9kidalw5e61.jpg', 'created': 1611878423.0}",2021-01-29 00:00:23
21,PluckMyGooch,1611878422,DIFFICULT DECISION MY ASS,https://i.redd.it/xiffr2hlw5e61.jpg,1611878422.0,"{'author': 'PluckMyGooch', 'created_utc': 1611878422, 'title': 'DIFFICULT DECISION MY ASS', 'url': 'https://i.redd.it/xiffr2hlw5e61.jpg', 'created': 1611878422.0}",2021-01-29 00:00:22
22,Thee_Dr,1611878421,Its about sending a message.,https://www.reddit.com/r/wallstreetbets/comments/l7d6l8/its_about_sending_a_message/,1611878421.0,"{'author': 'Thee_Dr', 'created_utc': 1611878421, 'title': 'Its about sending a message.', 'url': 'https://www.reddit.com/r/wallstreetbets/comments/l7d6l8/its_about_sending_a_message/', 'created': 1611878421.0}",2021-01-29 00:00:21
23,CloverPixels,1611878421,GameStop be like,https://i.redd.it/b0lw9ijjw5e61.png,1611878421.0,"{'author': 'CloverPixels', 'created_utc': 1611878421, 'title': 'GameStop be like', 'url': 'https://i.redd.it/b0lw9ijjw5e61.png', 'created': 1611878421.0}",2021-01-29 00:00:21
24,Dry-Seaworthiness356,1611878419,New!!,https://i.redd.it/f3z68x8lw5e61.jpg,1611878419.0,"{'author': 'Dry-Seaworthiness356', 'created_utc': 1611878419, 'title': 'New!!', 'url': 'https://i.redd.it/f3z68x8lw5e61.jpg', 'created': 1611878419.0}",2021-01-29 00:00:19
25,pistilli87,1611878419,"Cash App pulling some f*ckery. Purchased $20 of AMC stocks (cause I love movies) last night, which showed as ""scheduled"" for 9:30AM today 1/28/21. I emailed them about an hour ago and just checked up on it now. CANCELLED! Anyone else having this issue?",https://i.redd.it/43xajj5lw5e61.jpg,1611878419.0,"{'author': 'pistilli87', 'created_utc': 1611878419, 'title': 'Cash App pulling some f*ckery. Purchased $20 of AMC stocks (cause I love movies) last night, which showed as ""scheduled"" for 9:30AM today 1/28/21. I emailed them about an hour ago and just checked up on it now. CANCELLED! Anyone else having this issue?', 'url': 'https://i.redd.it/43xajj5lw5e61.jpg', 'created': 1611878419.0}",2021-01-29 00:00:19
26,Ok-Manager-2306,1611878418,Doge 1$ 🥸,https://www.reddit.com/r/wallstreetbets/comments/l7d6jo/doge_1/,1611878418.0,"{'author': 'Ok-Manager-2306', 'created_utc': 1611878418, 'title': 'Doge 1$ \U0001f978', 'url': 'https://www.reddit.com/r/wallstreetbets/comments/l7d6jo/doge_1/', 'created': 1611878418.0}",2021-01-29 00:00:18
27,TheQueen_Of_England,1611878418,"IF HE’S IN, WE’RE IN, $GME TO THE MOON 🚀🚀🚀🚀",https://i.redd.it/l1g65kykw5e61.jpg,1611878418.0,"{'author': 'TheQueen_Of_England', 'created_utc': 1611878418, 'title': 'IF HE’S IN, WE’RE IN, $GME TO THE MOON 🚀🚀🚀🚀', 'url': 'https://i.redd.it/l1g65kykw5e61.jpg', 'created': 1611878418.0}",2021-01-29 00:00:18
28,DrinkNatural,1611878418,Sold gme on robinhood and never got my money... Beware,https://www.reddit.com/gallery/l7d6i1,1611878418.0,"{'author': 'DrinkNatural', 'created_utc': 1611878418, 'title': 'Sold gme on robinhood and never got my money... Beware', 'url': 'https://www.reddit.com/gallery/l7d6i1', 'created': 1611878418.0}",2021-01-29 00:00:18
29,[deleted],1611878417,You Sons of Bitches!,https://i.redd.it/pbuez1zkw5e61.jpg,1611878417.0,"{'author': '[deleted]', 'created_utc': 1611878417, 'title': 'You Sons of Bitches!', 'url': 'https://i.redd.it/pbuez1zkw5e61.jpg', 'created': 1611878417.0}",2021-01-29 00:00:17
30,ChildOfHonor,1611878417,Fighting the good fight,https://i.redd.it/0q69y9p9w5e61.png,1611878417.0,"{'author': 'ChildOfHonor', 'created_utc': 1611878417, 'title': 'Fighting the good fight', 'url': 'https://i.redd.it/0q69y9p9w5e61.png', 'created': 1611878417.0}",2021-01-29 00:00:17
31,2D_Flows,1611878416,This is the way.,https://i.redd.it/ir09fg3jw5e61.jpg,1611878416.0,"{'author': '2D_Flows', 'created_utc': 1611878416, 'title': 'This is the way.', 'url': 'https://i.redd.it/ir09fg3jw5e61.jpg', 'created': 1611878416.0}",2021-01-29 00:00:16
32,twweeezzyy,1611878415,Hey from the UK - just got on this train and got 50 shares of $BB - Are we taking this to the moon over the next few days!?!?,https://www.reddit.com/r/wallstreetbets/comments/l7d6dj/hey_from_the_uk_just_got_on_this_train_and_got_50/,1611878415.0,"{'author': 'twweeezzyy', 'created_utc': 1611878415, 'title': 'Hey from the UK - just got on this train and got 50 shares of $BB - Are we taking this to the moon over the next few days!?!?', 'url': 'https://www.reddit.com/r/wallstreetbets/comments/l7d6dj/hey_from_the_uk_just_got_on_this_train_and_got_50/', 'created': 1611878415.0}",2021-01-29 00:00:15
33,digitalgoodtime,1611878415,"This is an attempt by majority to consolidate the wealth of the world. This is a good thing. Our survival as a species is dependent on equality. Whenever the odds are heavily tipped, the majority and individuals of the world market need to coordinate to correct this inequality.",https://www.reddit.com/r/wallstreetbets/comments/l7d6df/this_is_an_attempt_by_majority_to_consolidate_the/,1611878415.0,"{'author': 'digitalgoodtime', 'created_utc': 1611878415, 'title': 'This is an attempt by majority to consolidate the wealth of the world. This is a good thing. Our survival as a species is dependent on equality. Whenever the odds are heavily tipped, the majority and individuals of the world market need to coordinate to correct this inequality.', 'url': 'https://www.reddit.com/r/wallstreetbets/comments/l7d6df/this_is_an_attempt_by_majority_to_consolidate_the/', 'created': 1611878415.0}",2021-01-29 00:00:15
34,cyborg637,1611878415,Robinhood know they in trouble... “limited buys” start tomorrow,https://www.reddit.com/gallery/l7d6d9,1611878415.0,"{'author': 'cyborg637', 'created_utc': 1611878415, 'title': 'Robinhood know they in trouble... “limited buys” start tomorrow', 'url': 'https://www.reddit.com/gallery/l7d6d9', 'created': 1611878415.0}",2021-01-29 00:00:15
35,KonoSenwa,1611878415,"Reminder for tomorrow! Always hold, however low they might squeeze, the slingshot will go only higher due to buys on dips! Hold on to your seats and go flying 🚀🚀🚀🚀🚀🚀🚀",https://www.reddit.com/r/wallstreetbets/comments/l7d6d6/reminder_for_tomorrow_always_hold_however_low/,1611878415.0,"{'author': 'KonoSenwa', 'created_utc': 1611878415, 'title': 'Reminder for tomorrow! Always hold, however low they might squeeze, the slingshot will go only higher due to buys on dips! Hold on to your seats and go flying 🚀🚀🚀🚀🚀🚀🚀', 'url': 'https://www.reddit.com/r/wallstreetbets/comments/l7d6d6/reminder_for_tomorrow_always_hold_however_low/', 'created': 1611878415.0}",2021-01-29 00:00:15
36,adhda,1611878415,Amazing,https://www.reddit.com/r/wallstreetbets/comments/l7d6d5/amazing/,1611878415.0,"{'author': 'adhda', 'created_utc': 1611878415, 'title': 'Amazing', 'url': 'https://www.reddit.com/r/wallstreetbets/comments/l7d6d5/amazing/', 'created': 1611878415.0}",2021-01-29 00:00:15
37,hvkrox,1611878413,This is sad. Which brokerage y’all switching to? 🤧,https://i.redd.it/bg16spjkw5e61.jpg,1611878413.0,"{'author': 'hvkrox', 'created_utc': 1611878413, 'title': 'This is sad. Which brokerage y’all switching to? 🤧', 'url': 'https://i.redd.it/bg16spjkw5e61.jpg', 'created': 1611878413.0}",2021-01-29 00:00:13
38,TryingToFindAJerb,1611878412,"If Melvin Capital already closed their shorts, who is getting squeezed now?",https://www.reddit.com/r/wallstreetbets/comments/l7d6c3/if_melvin_capital_already_closed_their_shorts_who/,1611878412.0,"{'author': 'TryingToFindAJerb', 'created_utc': 1611878412, 'title': 'If Melvin Capital already closed their shorts, who is getting squeezed now?', 'url': 'https://www.reddit.com/r/wallstreetbets/comments/l7d6c3/if_melvin_capital_already_closed_their_shorts_who/', 'created': 1611878412.0}",2021-01-29 00:00:12
39,robertmanchild,1611878410,Robinhood ≠ Clorox,https://i.redd.it/l4oacwakw5e61.jpg,1611878410.0,"{'author': 'robertmanchild', 'created_utc': 1611878410, 'title': 'Robinhood ≠ Clorox', 'url': 'https://i.redd.it/l4oacwakw5e61.jpg', 'created': 1611878410.0}",2021-01-29 00:00:10
40,BrokeRda,1611878410,Dogecoin,https://www.reddit.com/r/wallstreetbets/comments/l7d6aq/dogecoin/,1611878410.0,"{'author': 'BrokeRda', 'created_utc': 1611878410, 'title': 'Dogecoin', 'url': 'https://www.reddit.com/r/wallstreetbets/comments/l7d6aq/dogecoin/', 'created': 1611878410.0}",2021-01-29 00:00:10
41,Specialist-Thanks532,1611878410,Joining the mob for justice. THIS IS FOR THE PEOPLE. FUCK THE FUNDS AND BROKERS. ITS NOW OR NEVER,https://www.reddit.com/r/wallstreetbets/comments/l7d6ai/joining_the_mob_for_justice_this_is_for_the/,1611878410.0,"{'author': 'Specialist-Thanks532', 'created_utc': 1611878410, 'title': 'Joining the mob for justice. THIS IS FOR THE PEOPLE. FUCK THE FUNDS AND BROKERS. ITS NOW OR NEVER', 'url': 'https://www.reddit.com/r/wallstreetbets/comments/l7d6ai/joining_the_mob_for_justice_this_is_for_the/', 'created': 1611878410.0}",2021-01-29 00:00:10
42,AgreeableOriginal607,1611878410,Is it to late to join in and at least help,https://www.reddit.com/r/wallstreetbets/comments/l7d6ah/is_it_to_late_to_join_in_and_at_least_help/,1611878410.0,"{'author': 'AgreeableOriginal607', 'created_utc': 1611878410, 'title': 'Is it to late to join in and at least help', 'url': 'https://www.reddit.com/r/wallstreetbets/comments/l7d6ah/is_it_to_late_to_join_in_and_at_least_help/', 'created': 1611878410.0}",2021-01-29 00:00:10
43,tommos,1611878410,Will this end the same way? In the end will all the hard work be for nothing?,https://www.youtube.com/watch?v=Nmxox3oqRZo,1611878410.0,"{'author': 'tommos', 'created_utc': 1611878410, 'title': 'Will this end the same way? In the end will all the hard work be for nothing?', 'url': 'https://www.youtube.com/watch?v=Nmxox3oqRZo', 'created': 1611878410.0}",2021-01-29 00:00:10
44,aidan_w13,1611878410,looking for u/notfinancialadvisor 🚀,https://www.reddit.com/r/wallstreetbets/comments/l7d6ab/looking_for_unotfinancialadvisor/,1611878410.0,"{'author': 'aidan_w13', 'created_utc': 1611878410, 'title': 'looking for u/notfinancialadvisor 🚀', 'url': 'https://www.reddit.com/r/wallstreetbets/comments/l7d6ab/looking_for_unotfinancialadvisor/', 'created': 1611878410.0}",2021-01-29 00:00:10
45,Rep_Fashion,1611878409,"IDC ABOUT THE MONEY, THIS IS FOR US!!!",https://www.reddit.com/r/wallstreetbets/comments/l7d69m/idc_about_the_money_this_is_for_us/,1611878409.0,"{'author': 'Rep_Fashion', 'created_utc': 1611878409, 'title': 'IDC ABOUT THE MONEY, THIS IS FOR US!!!', 'url': 'https://www.reddit.com/r/wallstreetbets/comments/l7d69m/idc_about_the_money_this_is_for_us/', 'created': 1611878409.0}",2021-01-29 00:00:09
46,TheOcean24,1611878409,"I put in a. Transfer request to Webull, tried to cancel and it said I couldn't.",https://www.reddit.com/r/wallstreetbets/comments/l7d699/i_put_in_a_transfer_request_to_webull_tried_to/,1611878409.0,"{'author': 'TheOcean24', 'created_utc': 1611878409, 'title': ""I put in a. Transfer request to Webull, tried to cancel and it said I couldn't."", 'url': 'https://www.reddit.com/r/wallstreetbets/comments/l7d699/i_put_in_a_transfer_request_to_webull_tried_to/', 'created': 1611878409.0}",2021-01-29 00:00:09
47,negevs_pls,1611878408,"They are writing contracts with infinite downside, and not paying the price when they lose.",https://www.reddit.com/r/wallstreetbets/comments/l7d691/they_are_writing_contracts_with_infinite_downside/,1611878408.0,"{'author': 'negevs_pls', 'created_utc': 1611878408, 'title': 'They are writing contracts with infinite downside, and not paying the price when they lose.', 'url': 'https://www.reddit.com/r/wallstreetbets/comments/l7d691/they_are_writing_contracts_with_infinite_downside/', 'created': 1611878408.0}",2021-01-29 00:00:08
48,iisirka,1611878408,Melvin Capitol &amp; WSB,https://i.redd.it/tkugmywjw5e61.jpg,1611878408.0,"{'author': 'iisirka', 'created_utc': 1611878408, 'title': 'Melvin Capitol &amp; WSB', 'url': 'https://i.redd.it/tkugmywjw5e61.jpg', 'created': 1611878408.0}",2021-01-29 00:00:08
49,Altoist2000,1611878407,Hold.....HOLDDDDDD,https://i.redd.it/au8s97wjw5e61.jpg,1611878407.0,"{'author': 'Altoist2000', 'created_utc': 1611878407, 'title': 'Hold.....HOLDDDDDD', 'url': 'https://i.redd.it/au8s97wjw5e61.jpg', 'created': 1611878407.0}",2021-01-29 00:00:07
50,Fernoloco10,1611878406,Let’s make TRTC great again. Legal weed deserves it!,https://www.reddit.com/r/wallstreetbets/comments/l7d67y/lets_make_trtc_great_again_legal_weed_deserves_it/,1611878406.0,"{'author': 'Fernoloco10', 'created_utc': 1611878406, 'title': 'Let’s make TRTC great again. Legal weed deserves it!', 'url': 'https://www.reddit.com/r/wallstreetbets/comments/l7d67y/lets_make_trtc_great_again_legal_weed_deserves_it/', 'created': 1611878406.0}",2021-01-29 00:00:06
51,AssyButter,1611878406,EVERYBODY HAMMER DOGECOIN; let’s get her to $1 boys 🚀,https://i.redd.it/s3uqktnjw5e61.jpg,1611878406.0,"{'author': 'AssyButter', 'created_utc': 1611878406, 'title': 'EVERYBODY HAMMER DOGECOIN; let’s get her to $1 boys 🚀', 'url': 'https://i.redd.it/s3uqktnjw5e61.jpg', 'created': 1611878406.0}",2021-01-29 00:00:06
52,ldog50,1611878406,WHO IS THE SHERIFF OF NOTTINGHAM THAT WAS ON THE OTHER SIDE OF THE LINE WITH ROBIN HOOD?,https://www.reddit.com/r/wallstreetbets/comments/l7d67c/who_is_the_sheriff_of_nottingham_that_was_on_the/,1611878406.0,"{'author': 'ldog50', 'created_utc': 1611878406, 'title': 'WHO IS THE SHERIFF OF NOTTINGHAM THAT WAS ON THE OTHER SIDE OF THE LINE WITH ROBIN HOOD?', 'url': 'https://www.reddit.com/r/wallstreetbets/comments/l7d67c/who_is_the_sheriff_of_nottingham_that_was_on_the/', 'created': 1611878406.0}",2021-01-29 00:00:06
53,Maver1ck2ooo,1611878406,Trading 212 - GME,https://www.reddit.com/r/wallstreetbets/comments/l7d679/trading_212_gme/,1611878406.0,"{'author': 'Maver1ck2ooo', 'created_utc': 1611878406, 'title': 'Trading 212 - GME', 'url': 'https://www.reddit.com/r/wallstreetbets/comments/l7d679/trading_212_gme/', 'created': 1611878406.0}",2021-01-29 00:00:06
54,cybernewtype2,1611878406,Time to shine my friends,https://i.redd.it/58jcodngw5e61.png,1611878406.0,"{'author': 'cybernewtype2', 'created_utc': 1611878406, 'title': 'Time to shine my friends', 'url': 'https://i.redd.it/58jcodngw5e61.png', 'created': 1611878406.0}",2021-01-29 00:00:06
55,kieranbrownlee,1611878406,The support is crazy,https://i.redd.it/e22frtqjw5e61.jpg,1611878406.0,"{'author': 'kieranbrownlee', 'created_utc': 1611878406, 'title': 'The support is crazy', 'url': 'https://i.redd.it/e22frtqjw5e61.jpg', 'created': 1611878406.0}",2021-01-29 00:00:06
56,RIP_Robinhood1-28-21,1611878403,^^^^^^^^ R.I.P. Robinhood,https://www.reddit.com/r/wallstreetbets/comments/l7d65j/rip_robinhood/,1611878403.0,"{'author': 'RIP_Robinhood1-28-21', 'created_utc': 1611878403, 'title': '^^^^^^^^ R.I.P. Robinhood', 'url': 'https://www.reddit.com/r/wallstreetbets/comments/l7d65j/rip_robinhood/', 'created': 1611878403.0}",2021-01-29 00:00:03
57,SynKapps,1611878403,DOGE TO THE FUCKING MOON BOYS🚀🚀🚀,https://www.reddit.com/r/wallstreetbets/comments/l7d65b/doge_to_the_fucking_moon_boys/,1611878403.0,"{'author': 'SynKapps', 'created_utc': 1611878403, 'title': 'DOGE TO THE FUCKING MOON BOYS🚀🚀🚀', 'url': 'https://www.reddit.com/r/wallstreetbets/comments/l7d65b/doge_to_the_fucking_moon_boys/', 'created': 1611878403.0}",2021-01-29 00:00:03
58,billynotrlyy,1611878403,How the Forbes article about short sellers being heroes might as well have read:,https://i.redd.it/50xj6gejw5e61.jpg,1611878403.0,"{'author': 'billynotrlyy', 'created_utc': 1611878403, 'title': 'How the Forbes article about short sellers being heroes might as well have read:', 'url': 'https://i.redd.it/50xj6gejw5e61.jpg', 'created': 1611878403.0}",2021-01-29 00:00:03
59,FollowMe22,1611878403,Here's the Illinois Attorney General's Office -- Consider Reaching Out to Them About Citadel,https://www.reddit.com/r/wallstreetbets/comments/l7d654/heres_the_illinois_attorney_generals_office/,1611878403.0,"{'author': 'FollowMe22', 'created_utc': 1611878403, 'title': ""Here's the Illinois Attorney General's Office -- Consider Reaching Out to Them About Citadel"", 'url': 'https://www.reddit.com/r/wallstreetbets/comments/l7d654/heres_the_illinois_attorney_generals_office/', 'created': 1611878403.0}",2021-01-29 00:00:03
60,Act_Consistent,1611878401,Google Play removing reviews on robinhood!!!,https://www.reddit.com/r/wallstreetbets/comments/l7d646/google_play_removing_reviews_on_robinhood/,1611878401.0,"{'author': 'Act_Consistent', 'created_utc': 1611878401, 'title': 'Google Play removing reviews on robinhood!!!', 'url': 'https://www.reddit.com/r/wallstreetbets/comments/l7d646/google_play_removing_reviews_on_robinhood/', 'created': 1611878401.0}",2021-01-29 00:00:01
61,hepdaddio,1611878401,"Just a little technical analysis for the hedgefund/marketmaker lurkers. shmelvin, I'm ready to accept my job offer",https://i.redd.it/ugwr40bqv5e61.png,1611878401.0,"{'author': 'hepdaddio', 'created_utc': 1611878401, 'title': ""Just a little technical analysis for the hedgefund/marketmaker lurkers. shmelvin, I'm ready to accept my job offer"", 'url': 'https://i.redd.it/ugwr40bqv5e61.png', 'created': 1611878401.0}",2021-01-29 00:00:01
62,garylary25,1611878400,If you plan to transfer brokers,https://www.reddit.com/r/wallstreetbets/comments/l7d63k/if_you_plan_to_transfer_brokers/,1611878400.0,"{'author': 'garylary25', 'created_utc': 1611878400, 'title': 'If you plan to transfer brokers', 'url': 'https://www.reddit.com/r/wallstreetbets/comments/l7d63k/if_you_plan_to_transfer_brokers/', 'created': 1611878400.0}",2021-01-29 00:00:00
63,Caccolobang,1611878400,Look at Tiscali (BIT: TIS.MI),https://www.reddit.com/r/wallstreetbets/comments/l7d63g/look_at_tiscali_bit_tismi/,1611878400.0,"{'author': 'Caccolobang', 'created_utc': 1611878400, 'title': 'Look at Tiscali (BIT: TIS.MI)', 'url': 'https://www.reddit.com/r/wallstreetbets/comments/l7d63g/look_at_tiscali_bit_tismi/', 'created': 1611878400.0}",2021-01-29 00:00:00
