,author,created_utc,title,url,created,d_,created_utc_dt
66,Background-Ask-463,1612741664,Cryptocurrencies Potential,https://www.reddit.com/r/wallstreetbets/comments/leyxi8/cryptocurrencies_potential/,1612741664.0,"{'author': 'Background-Ask-463', 'created_utc': 1612741664, 'title': 'Cryptocurrencies Potential', 'url': 'https://www.reddit.com/r/wallstreetbets/comments/leyxi8/cryptocurrencies_potential/', 'created': 1612741664.0}",2021-02-07 23:47:44
67,Akml141,1612741661,-_-,https://www.reddit.com/r/wallstreetbets/comments/leyxgy/_/,1612741661.0,"{'author': 'Akml141', 'created_utc': 1612741661, 'title': '-_-', 'url': 'https://www.reddit.com/r/wallstreetbets/comments/leyxgy/_/', 'created': 1612741661.0}",2021-02-07 23:47:41
68,JADuCharme,1612741651,Dogecoin?,https://www.reddit.com/r/wallstreetbets/comments/leyxdt/dogecoin/,1612741651.0,"{'author': 'JADuCharme', 'created_utc': 1612741651, 'title': 'Dogecoin?', 'url': 'https://www.reddit.com/r/wallstreetbets/comments/leyxdt/dogecoin/', 'created': 1612741651.0}",2021-02-07 23:47:31
69,flovidchan,1612741643,"What is to stop hedge funds from illegally covering their GME shorts, and simply paying a negligible fine of a few million as opposed to hundreds of billions of dollars?",https://www.reddit.com/r/wallstreetbets/comments/leyxbb/what_is_to_stop_hedge_funds_from_illegally/,1612741643.0,"{'author': 'flovidchan', 'created_utc': 1612741643, 'title': 'What is to stop hedge funds from illegally covering their GME shorts, and simply paying a negligible fine of a few million as opposed to hundreds of billions of dollars?', 'url': 'https://www.reddit.com/r/wallstreetbets/comments/leyxbb/what_is_to_stop_hedge_funds_from_illegally/', 'created': 1612741643.0}",2021-02-07 23:47:23
70,JPMSMILES,1612741641,"Short interest on gme and why it's no longer gunna squeeze, because new SI positioning WAY higher (volume as of Friday) if you have a position it ain't looking good",https://i.redd.it/hbcjd5xd75g61.png,1612741641.0,"{'author': 'JPMSMILES', 'created_utc': 1612741641, 'title': ""Short interest on gme and why it's no longer gunna squeeze, because new SI positioning WAY higher (volume as of Friday) if you have a position it ain't looking good"", 'url': 'https://i.redd.it/hbcjd5xd75g61.png', 'created': 1612741641.0}",2021-02-07 23:47:21
71,LAWildcats,1612741632,Next week is the Daytona 500 and a couple teams still do not have sponsorship.... This is what a different community on Reddit did a couple years back for a different NASCAR race,https://i.redd.it/rm79rihb75g61.jpg,1612741632.0,"{'author': 'LAWildcats', 'created_utc': 1612741632, 'title': 'Next week is the Daytona 500 and a couple teams still do not have sponsorship.... This is what a different community on Reddit did a couple years back for a different NASCAR race', 'url': 'https://i.redd.it/rm79rihb75g61.jpg', 'created': 1612741632.0}",2021-02-07 23:47:12
72,20OCT2020,1612741607,"Wtf man, not cool!",https://i.redd.it/74aq2jda75g61.jpg,1612741607.0,"{'author': '20OCT2020', 'created_utc': 1612741607, 'title': 'Wtf man, not cool!', 'url': 'https://i.redd.it/74aq2jda75g61.jpg', 'created': 1612741607.0}",2021-02-07 23:46:47
73,Southern-Lab-2399,1612741602,"Ode to WSB from me--a new member in on GME 22 shares @ $285, AMC 1080 shares @ $15",https://mindsplain.com/wallstreetbets-attack-wall-street-narcissism/,1612741602.0,"{'author': 'Southern-Lab-2399', 'created_utc': 1612741602, 'title': 'Ode to WSB from me--a new member in on GME 22 shares @ $285, AMC 1080 shares @ $15', 'url': 'https://mindsplain.com/wallstreetbets-attack-wall-street-narcissism/', 'created': 1612741602.0}",2021-02-07 23:46:42
74,_nevso,1612741586,Apes together! HOLD! Next week...,https://www.instagram.com/reel/CKtJ2EMqb9P/?igshid=12ccgd2e64gdd,1612741586.0,"{'author': '_nevso', 'created_utc': 1612741586, 'title': 'Apes together! HOLD! Next week...', 'url': 'https://www.instagram.com/reel/CKtJ2EMqb9P/?igshid=12ccgd2e64gdd', 'created': 1612741586.0}",2021-02-07 23:46:26
75,itzglobal,1612741574,$BBW,https://www.reddit.com/r/wallstreetbets/comments/leywk0/bbw/,1612741574.0,"{'author': 'itzglobal', 'created_utc': 1612741574, 'title': '$BBW', 'url': 'https://www.reddit.com/r/wallstreetbets/comments/leywk0/bbw/', 'created': 1612741574.0}",2021-02-07 23:46:14
76,[deleted],1612741545,Possible $BB vs $FB Settlement on 10k form?,https://www.reddit.com/r/wallstreetbets/comments/leyw8u/possible_bb_vs_fb_settlement_on_10k_form/,1612741545.0,"{'author': '[deleted]', 'created_utc': 1612741545, 'title': 'Possible $BB vs $FB Settlement on 10k form?', 'url': 'https://www.reddit.com/r/wallstreetbets/comments/leyw8u/possible_bb_vs_fb_settlement_on_10k_form/', 'created': 1612741545.0}",2021-02-07 23:45:45
77,WolfOfWallstreet2021,1612741529,Do we have a Dogecoin Billboard or advertisement at the sa SuperBowl?? 🚀🚀🚀🚀🐕🐕,https://i.redd.it/r0ojn81275g61.jpg,1612741529.0,"{'author': 'WolfOfWallstreet2021', 'created_utc': 1612741529, 'title': 'Do we have a Dogecoin Billboard or advertisement at the sa SuperBowl?? 🚀🚀🚀🚀🐕🐕', 'url': 'https://i.redd.it/r0ojn81275g61.jpg', 'created': 1612741529.0}",2021-02-07 23:45:29
78,kevsudos,1612741523,I Painted a WSB Mascot! 💎🙌🚀,https://i.redd.it/3rqffeeu65g61.jpg,1612741523.0,"{'author': 'kevsudos', 'created_utc': 1612741523, 'title': 'I Painted a WSB Mascot! 💎🙌🚀', 'url': 'https://i.redd.it/3rqffeeu65g61.jpg', 'created': 1612741523.0}",2021-02-07 23:45:23
79,zmoneycalla,1612741521,Nakd,https://www.reddit.com/r/wallstreetbets/comments/leyvzj/nakd/,1612741521.0,"{'author': 'zmoneycalla', 'created_utc': 1612741521, 'title': 'Nakd', 'url': 'https://www.reddit.com/r/wallstreetbets/comments/leyvzj/nakd/', 'created': 1612741521.0}",2021-02-07 23:45:21
80,SzTechnology,1612741514,Superbowl ADD,https://www.reddit.com/r/wallstreetbets/comments/leyvwg/superbowl_add/,1612741514.0,"{'author': 'SzTechnology', 'created_utc': 1612741514, 'title': 'Superbowl ADD', 'url': 'https://www.reddit.com/r/wallstreetbets/comments/leyvwg/superbowl_add/', 'created': 1612741514.0}",2021-02-07 23:45:14
81,mitchman7365,1612741498,Doge,https://www.reddit.com/r/wallstreetbets/comments/leyvox/doge/,1612741498.0,"{'author': 'mitchman7365', 'created_utc': 1612741498, 'title': 'Doge', 'url': 'https://www.reddit.com/r/wallstreetbets/comments/leyvox/doge/', 'created': 1612741498.0}",2021-02-07 23:44:58
82,Moneymoves2121,1612741495,Let’s get organize for tomorrow . What stock do me like the most? 🦍 🚀,https://www.reddit.com/r/wallstreetbets/comments/leyvny/lets_get_organize_for_tomorrow_what_stock_do_me/,1612741495.0,"{'author': 'Moneymoves2121', 'created_utc': 1612741495, 'title': 'Let’s get organize for tomorrow . What stock do me like the most? 🦍 🚀', 'url': 'https://www.reddit.com/r/wallstreetbets/comments/leyvny/lets_get_organize_for_tomorrow_what_stock_do_me/', 'created': 1612741495.0}",2021-02-07 23:44:55
83,HorseFacedDipShit,1612741492,"Have fundamentals become obsolete in trading, and we should all just focus on the technicals? (Excluding long term investments)",https://www.reddit.com/r/wallstreetbets/comments/leyvmu/have_fundamentals_become_obsolete_in_trading_and/,1612741492.0,"{'author': 'HorseFacedDipShit', 'created_utc': 1612741492, 'title': 'Have fundamentals become obsolete in trading, and we should all just focus on the technicals? (Excluding long term investments)', 'url': 'https://www.reddit.com/r/wallstreetbets/comments/leyvmu/have_fundamentals_become_obsolete_in_trading_and/', 'created': 1612741492.0}",2021-02-07 23:44:52
84,pensando3,1612741489,A little bit of DD re: Elon's takedown of Vlad and the ongoing role of Citadel,https://www.reddit.com/r/wallstreetbets/comments/leyvlj/a_little_bit_of_dd_re_elons_takedown_of_vlad_and/,1612741489.0,"{'author': 'pensando3', 'created_utc': 1612741489, 'title': ""A little bit of DD re: Elon's takedown of Vlad and the ongoing role of Citadel"", 'url': 'https://www.reddit.com/r/wallstreetbets/comments/leyvlj/a_little_bit_of_dd_re_elons_takedown_of_vlad_and/', 'created': 1612741489.0}",2021-02-07 23:44:49
85,zmoneycalla,1612741475,Just gunna send n a k d to the moon yo. Check them out,https://www.reddit.com/r/wallstreetbets/comments/leyvg0/just_gunna_send_n_a_k_d_to_the_moon_yo_check_them/,1612741475.0,"{'author': 'zmoneycalla', 'created_utc': 1612741475, 'title': 'Just gunna send n a k d to the moon yo. Check them out', 'url': 'https://www.reddit.com/r/wallstreetbets/comments/leyvg0/just_gunna_send_n_a_k_d_to_the_moon_yo_check_them/', 'created': 1612741475.0}",2021-02-07 23:44:35
86,arthulk,1612741473,"Not a shill, WSB u screwed me, I'm only buying doge from now on, what did u think would happen? WSB = PAPER HANDS, DOGE = DIAMOND MOONSTONE HANDS",https://i.redd.it/j9i6p3dp65g61.png,1612741473.0,"{'author': 'arthulk', 'created_utc': 1612741473, 'title': ""Not a shill, WSB u screwed me, I'm only buying doge from now on, what did u think would happen? WSB = PAPER HANDS, DOGE = DIAMOND MOONSTONE HANDS"", 'url': 'https://i.redd.it/j9i6p3dp65g61.png', 'created': 1612741473.0}",2021-02-07 23:44:33
87,[deleted],1612741460,Only some of my loss porn. Expensive lessons learned but still hodling. 9/2 can't come soon enough.,https://i.redd.it/1wkox9bp65g61.jpg,1612741460.0,"{'author': '[deleted]', 'created_utc': 1612741460, 'title': ""Only some of my loss porn. Expensive lessons learned but still hodling. 9/2 can't come soon enough."", 'url': 'https://i.redd.it/1wkox9bp65g61.jpg', 'created': 1612741460.0}",2021-02-07 23:44:20
88,Aggravating-Cook9322,1612741451,Dogecoin to the moon,https://www.reddit.com/r/wallstreetbets/comments/leyv6o/dogecoin_to_the_moon/,1612741451.0,"{'author': 'Aggravating-Cook9322', 'created_utc': 1612741451, 'title': 'Dogecoin to the moon', 'url': 'https://www.reddit.com/r/wallstreetbets/comments/leyv6o/dogecoin_to_the_moon/', 'created': 1612741451.0}",2021-02-07 23:44:11
89,Bobbaugh3,1612741446,Yo! I had to pause this! Did anyone else happen to see this??,https://i.redd.it/0xqoidao65g61.jpg,1612741446.0,"{'author': 'Bobbaugh3', 'created_utc': 1612741446, 'title': 'Yo! I had to pause this! Did anyone else happen to see this??', 'url': 'https://i.redd.it/0xqoidao65g61.jpg', 'created': 1612741446.0}",2021-02-07 23:44:06
90,letsch,1612741437,Going to .10 before Monday in the States?? 💎🙌🏼 waiting for another $200 to transfer from my bank and I’ll be buying more.,https://i.redd.it/iq79do9s65g61.jpg,1612741437.0,"{'author': 'letsch', 'created_utc': 1612741437, 'title': 'Going to .10 before Monday in the States?? 💎🙌🏼 waiting for another $200 to transfer from my bank and I’ll be buying more.', 'url': 'https://i.redd.it/iq79do9s65g61.jpg', 'created': 1612741437.0}",2021-02-07 23:43:57
91,ihatedisneyland,1612741376,A couple years back r/dogecoin sponsored a car during a NASCAR race... Just saying next week is the Daytona 500 and a couple drivers still do not have sponsorship....,https://i.redd.it/3v4tyjxe65g61.jpg,1612741376.0,"{'author': 'ihatedisneyland', 'created_utc': 1612741376, 'title': 'A couple years back r/dogecoin sponsored a car during a NASCAR race... Just saying next week is the Daytona 500 and a couple drivers still do not have sponsorship....', 'url': 'https://i.redd.it/3v4tyjxe65g61.jpg', 'created': 1612741376.0}",2021-02-07 23:42:56
92,Bobbaugh3,1612741343,"Yo, I paused it!",https://www.reddit.com/r/wallstreetbets/comments/leyu1r/yo_i_paused_it/,1612741343.0,"{'author': 'Bobbaugh3', 'created_utc': 1612741343, 'title': 'Yo, I paused it!', 'url': 'https://www.reddit.com/r/wallstreetbets/comments/leyu1r/yo_i_paused_it/', 'created': 1612741343.0}",2021-02-07 23:42:23
93,randychan1983,1612741334,VeChain $75?,https://www.reddit.com/r/wallstreetbets/comments/leytyi/vechain_75/,1612741334.0,"{'author': 'randychan1983', 'created_utc': 1612741334, 'title': 'VeChain $75?', 'url': 'https://www.reddit.com/r/wallstreetbets/comments/leytyi/vechain_75/', 'created': 1612741334.0}",2021-02-07 23:42:14
94,GraybushActual916,1612741322,"Up 300% YTD, Update on FUTU, new analysis in comments",https://i.redd.it/98gql3qf65g61.jpg,1612741322.0,"{'author': 'GraybushActual916', 'created_utc': 1612741322, 'title': 'Up 300% YTD, Update on FUTU, new analysis in comments', 'url': 'https://i.redd.it/98gql3qf65g61.jpg', 'created': 1612741322.0}",2021-02-07 23:42:02
95,[deleted],1612741304,Possible $BB vs $FB Settlement Disclosure on 10k form,https://www.reddit.com/r/wallstreetbets/comments/leytnw/possible_bb_vs_fb_settlement_disclosure_on_10k/,1612741304.0,"{'author': '[deleted]', 'created_utc': 1612741304, 'title': 'Possible $BB vs $FB Settlement Disclosure on 10k form', 'url': 'https://www.reddit.com/r/wallstreetbets/comments/leytnw/possible_bb_vs_fb_settlement_disclosure_on_10k/', 'created': 1612741304.0}",2021-02-07 23:41:44
96,HighwayG,1612741264,Just the Beginning,https://www.koreatimes.co.kr/www/biz/2021/02/175_303717.html,1612741264.0,"{'author': 'HighwayG', 'created_utc': 1612741264, 'title': 'Just the Beginning', 'url': 'https://www.koreatimes.co.kr/www/biz/2021/02/175_303717.html', 'created': 1612741264.0}",2021-02-07 23:41:04
97,FunDragonfly7777,1612741264,Why is Translate Bio moving up,https://www.reddit.com/r/wallstreetbets/comments/leyt8j/why_is_translate_bio_moving_up/,1612741264.0,"{'author': 'FunDragonfly7777', 'created_utc': 1612741264, 'title': 'Why is Translate Bio moving up', 'url': 'https://www.reddit.com/r/wallstreetbets/comments/leyt8j/why_is_translate_bio_moving_up/', 'created': 1612741264.0}",2021-02-07 23:41:04
98,teexpression,1612741249,Well this deserves attention,https://i.redd.it/un4yh96865g61.jpg,1612741249.0,"{'author': 'teexpression', 'created_utc': 1612741249, 'title': 'Well this deserves attention', 'url': 'https://i.redd.it/un4yh96865g61.jpg', 'created': 1612741249.0}",2021-02-07 23:40:49
99,[deleted],1612741237,Possible $BB vs $FB Settlement Disclosure on SEC Filing,https://www.reddit.com/r/wallstreetbets/comments/leyswy/possible_bb_vs_fb_settlement_disclosure_on_sec/,1612741237.0,"{'author': '[deleted]', 'created_utc': 1612741237, 'title': 'Possible $BB vs $FB Settlement Disclosure on SEC Filing', 'url': 'https://www.reddit.com/r/wallstreetbets/comments/leyswy/possible_bb_vs_fb_settlement_disclosure_on_sec/', 'created': 1612741237.0}",2021-02-07 23:40:37
