,author,created_utc,title,url,created,d_,created_utc_dt
57,PM_ME_CUTE_FRIENDS,1611851289,I'm a new retard and have a bid/ask question,https://www.reddit.com/r/wallstreetbets/comments/l71d38/im_a_new_retard_and_have_a_bidask_question/,1611851289.0,"{'author': 'PM_ME_CUTE_FRIENDS', 'created_utc': 1611851289, 'title': ""I'm a new retard and have a bid/ask question"", 'url': 'https://www.reddit.com/r/wallstreetbets/comments/l71d38/im_a_new_retard_and_have_a_bidask_question/', 'created': 1611851289.0}",2021-01-28 16:28:09
58,kratos_boii,1611851289,💎🙌🏻,https://i.redd.it/iznndomwn3e61.jpg,1611851289.0,"{'author': 'kratos_boii', 'created_utc': 1611851289, 'title': '💎🙌🏻', 'url': 'https://i.redd.it/iznndomwn3e61.jpg', 'created': 1611851289.0}",2021-01-28 16:28:09
59,LittleSympathy,1611851288,GME &amp; AMC CANT BE BROUGHT SO STOP SELLING TO SHORTERS. GME BOYS THIS IS OUR TIME!!!,https://www.reddit.com/r/wallstreetbets/comments/l71d2w/gme_amc_cant_be_brought_so_stop_selling_to/,1611851288.0,"{'author': 'LittleSympathy', 'created_utc': 1611851288, 'title': 'GME &amp; AMC CANT BE BROUGHT SO STOP SELLING TO SHORTERS. GME BOYS THIS IS OUR TIME!!!', 'url': 'https://www.reddit.com/r/wallstreetbets/comments/l71d2w/gme_amc_cant_be_brought_so_stop_selling_to/', 'created': 1611851288.0}",2021-01-28 16:28:08
60,tommy29333,1611851288,Why is it getting rejected,https://i.redd.it/hx1b8sxwn3e61.jpg,1611851288.0,"{'author': 'tommy29333', 'created_utc': 1611851288, 'title': 'Why is it getting rejected', 'url': 'https://i.redd.it/hx1b8sxwn3e61.jpg', 'created': 1611851288.0}",2021-01-28 16:28:08
61,Version911,1611851288,"Even HTMW won’t let me trade, and it’s fake money!",https://www.reddit.com/r/wallstreetbets/comments/l71d2q/even_htmw_wont_let_me_trade_and_its_fake_money/,1611851288.0,"{'author': 'Version911', 'created_utc': 1611851288, 'title': 'Even HTMW won’t let me trade, and it’s fake money!', 'url': 'https://www.reddit.com/r/wallstreetbets/comments/l71d2q/even_htmw_wont_let_me_trade_and_its_fake_money/', 'created': 1611851288.0}",2021-01-28 16:28:08
62,Cjmj28,1611851288,"Fidelity lets you buy GME, AMC and more!!",https://www.reddit.com/r/wallstreetbets/comments/l71d2o/fidelity_lets_you_buy_gme_amc_and_more/,1611851288.0,"{'author': 'Cjmj28', 'created_utc': 1611851288, 'title': 'Fidelity lets you buy GME, AMC and more!!', 'url': 'https://www.reddit.com/r/wallstreetbets/comments/l71d2o/fidelity_lets_you_buy_gme_amc_and_more/', 'created': 1611851288.0}",2021-01-28 16:28:08
63,shadow_clone69,1611851288,"OWNERS OF ROBINHOOD ARE ALSO THE OWNERS OF MELVIN CAPITAL. DONT GIVE INTO THE FEAR BEING INDUCED. We're on the moon, Uranus is within arms reach. Hodlllllll 🚀🚀🚀🚀🚀🚀🚀🚀🚀",https://www.reddit.com/r/wallstreetbets/comments/l71d29/owners_of_robinhood_are_also_the_owners_of_melvin/,1611851288.0,"{'author': 'shadow_clone69', 'created_utc': 1611851288, 'title': ""OWNERS OF ROBINHOOD ARE ALSO THE OWNERS OF MELVIN CAPITAL. DONT GIVE INTO THE FEAR BEING INDUCED. We're on the moon, Uranus is within arms reach. Hodlllllll 🚀🚀🚀🚀🚀🚀🚀🚀🚀"", 'url': 'https://www.reddit.com/r/wallstreetbets/comments/l71d29/owners_of_robinhood_are_also_the_owners_of_melvin/', 'created': 1611851288.0}",2021-01-28 16:28:08
64,TripleDeckerPBJ,1611851288,Where is u/DeepFuckingValue,https://www.reddit.com/r/wallstreetbets/comments/l71d28/where_is_udeepfuckingvalue/,1611851288.0,"{'author': 'TripleDeckerPBJ', 'created_utc': 1611851288, 'title': 'Where is u/DeepFuckingValue', 'url': 'https://www.reddit.com/r/wallstreetbets/comments/l71d28/where_is_udeepfuckingvalue/', 'created': 1611851288.0}",2021-01-28 16:28:08
65,bomko,1611851287,"Look at volume guys, this shit is manifactured, just hooooold",https://i.imgur.com/8BLQ3lb.png,1611851287.0,"{'author': 'bomko', 'created_utc': 1611851287, 'title': 'Look at volume guys, this shit is manifactured, just hooooold', 'url': 'https://i.imgur.com/8BLQ3lb.png', 'created': 1611851287.0}",2021-01-28 16:28:07
66,Oblivion______,1611851287,Tastyworks has joined the buying ban. Just got this email.,https://i.redd.it/lx5jnyrwn3e61.jpg,1611851287.0,"{'author': 'Oblivion______', 'created_utc': 1611851287, 'title': 'Tastyworks has joined the buying ban. Just got this email.', 'url': 'https://i.redd.it/lx5jnyrwn3e61.jpg', 'created': 1611851287.0}",2021-01-28 16:28:07
67,JoeGrotton,1611851287,Someone list some apps or sites I can still buy from.,https://www.reddit.com/r/wallstreetbets/comments/l71d1x/someone_list_some_apps_or_sites_i_can_still_buy/,1611851287.0,"{'author': 'JoeGrotton', 'created_utc': 1611851287, 'title': 'Someone list some apps or sites I can still buy from.', 'url': 'https://www.reddit.com/r/wallstreetbets/comments/l71d1x/someone_list_some_apps_or_sites_i_can_still_buy/', 'created': 1611851287.0}",2021-01-28 16:28:07
68,jeffreyjetson,1611851287,Block GME/AMC What’s next? Let’s invest into another stock that’s unblocked 💪🏻,https://www.reddit.com/r/wallstreetbets/comments/l71d1w/block_gmeamc_whats_next_lets_invest_into_another/,1611851287.0,"{'author': 'jeffreyjetson', 'created_utc': 1611851287, 'title': 'Block GME/AMC What’s next? Let’s invest into another stock that’s unblocked 💪🏻', 'url': 'https://www.reddit.com/r/wallstreetbets/comments/l71d1w/block_gmeamc_whats_next_lets_invest_into_another/', 'created': 1611851287.0}",2021-01-28 16:28:07
69,Hari2277,1611851287,Fastest Deposit Brokerage? (Moving away from you know who),https://www.reddit.com/r/wallstreetbets/comments/l71d1u/fastest_deposit_brokerage_moving_away_from_you/,1611851287.0,"{'author': 'Hari2277', 'created_utc': 1611851287, 'title': 'Fastest Deposit Brokerage? (Moving away from you know who)', 'url': 'https://www.reddit.com/r/wallstreetbets/comments/l71d1u/fastest_deposit_brokerage_moving_away_from_you/', 'created': 1611851287.0}",2021-01-28 16:28:07
70,Accomplished-Still99,1611851287,Covering shorts,https://www.reddit.com/r/wallstreetbets/comments/l71d1k/covering_shorts/,1611851287.0,"{'author': 'Accomplished-Still99', 'created_utc': 1611851287, 'title': 'Covering shorts', 'url': 'https://www.reddit.com/r/wallstreetbets/comments/l71d1k/covering_shorts/', 'created': 1611851287.0}",2021-01-28 16:28:07
71,SadPhilosopher8803,1611851286,STOCK MARKET,https://www.reddit.com/r/wallstreetbets/comments/l71d19/stock_market/,1611851286.0,"{'author': 'SadPhilosopher8803', 'created_utc': 1611851286, 'title': 'STOCK MARKET', 'url': 'https://www.reddit.com/r/wallstreetbets/comments/l71d19/stock_market/', 'created': 1611851286.0}",2021-01-28 16:28:06
72,IntroductionWaste607,1611851286,"CANADA READY TO FIGHT"" PUT SOME MORE BUY ORDER AROUND 126 USD. IT IS NOT GOING DOWN TODAY MOTHAFUCKER SOME MORE IDIOTS ARE COMING. MAYBE THEY SHOULD WONDER WHY SO MANY RETARDS ARE JOINING THE FIGHT",https://www.reddit.com/r/wallstreetbets/comments/l71d14/canada_ready_to_fight_put_some_more_buy_order/,1611851286.0,"{'author': 'IntroductionWaste607', 'created_utc': 1611851286, 'title': 'CANADA READY TO FIGHT"" PUT SOME MORE BUY ORDER AROUND 126 USD. IT IS NOT GOING DOWN TODAY MOTHAFUCKER SOME MORE IDIOTS ARE COMING. MAYBE THEY SHOULD WONDER WHY SO MANY RETARDS ARE JOINING THE FIGHT', 'url': 'https://www.reddit.com/r/wallstreetbets/comments/l71d14/canada_ready_to_fight_put_some_more_buy_order/', 'created': 1611851286.0}",2021-01-28 16:28:06
73,tkggear,1611851286,WeBull stoppes AMC And GME trading,https://www.reddit.com/r/wallstreetbets/comments/l71d10/webull_stoppes_amc_and_gme_trading/,1611851286.0,"{'author': 'tkggear', 'created_utc': 1611851286, 'title': 'WeBull stoppes AMC And GME trading', 'url': 'https://www.reddit.com/r/wallstreetbets/comments/l71d10/webull_stoppes_amc_and_gme_trading/', 'created': 1611851286.0}",2021-01-28 16:28:06
74,BetPreview,1611851285,"FUCK ROBINHOOD! eToro allowing purchase of GME, NOK, AMC and more!",https://www.reddit.com/r/wallstreetbets/comments/l71d0o/fuck_robinhood_etoro_allowing_purchase_of_gme_nok/,1611851285.0,"{'author': 'BetPreview', 'created_utc': 1611851285, 'title': 'FUCK ROBINHOOD! eToro allowing purchase of GME, NOK, AMC and more!', 'url': 'https://www.reddit.com/r/wallstreetbets/comments/l71d0o/fuck_robinhood_etoro_allowing_purchase_of_gme_nok/', 'created': 1611851285.0}",2021-01-28 16:28:05
75,Stife408,1611851285,Hedge,https://www.reddit.com/r/wallstreetbets/comments/l71d0f/hedge/,1611851285.0,"{'author': 'Stife408', 'created_utc': 1611851285, 'title': 'Hedge', 'url': 'https://www.reddit.com/r/wallstreetbets/comments/l71d0f/hedge/', 'created': 1611851285.0}",2021-01-28 16:28:05
76,ForeverJamona,1611851284,"Long time lurker, but what Robinhood did today, I am buying!",https://www.reddit.com/r/wallstreetbets/comments/l71d01/long_time_lurker_but_what_robinhood_did_today_i/,1611851284.0,"{'author': 'ForeverJamona', 'created_utc': 1611851284, 'title': 'Long time lurker, but what Robinhood did today, I am buying!', 'url': 'https://www.reddit.com/r/wallstreetbets/comments/l71d01/long_time_lurker_but_what_robinhood_did_today_i/', 'created': 1611851284.0}",2021-01-28 16:28:04
77,beanstalk11,1611851284,HOLD till your last breath. BUY BUY GME wherever possible. We are gonna win this battle.,https://www.reddit.com/r/wallstreetbets/comments/l71czy/hold_till_your_last_breath_buy_buy_gme_wherever/,1611851284.0,"{'author': 'beanstalk11', 'created_utc': 1611851284, 'title': 'HOLD till your last breath. BUY BUY GME wherever possible. We are gonna win this battle.', 'url': 'https://www.reddit.com/r/wallstreetbets/comments/l71czy/hold_till_your_last_breath_buy_buy_gme_wherever/', 'created': 1611851284.0}",2021-01-28 16:28:04
78,Ronald_J_Trumpeta,1611851284,MY FELLOW AMERICANS,https://www.reddit.com/r/wallstreetbets/comments/l71czw/my_fellow_americans/,1611851284.0,"{'author': 'Ronald_J_Trumpeta', 'created_utc': 1611851284, 'title': 'MY FELLOW AMERICANS', 'url': 'https://www.reddit.com/r/wallstreetbets/comments/l71czw/my_fellow_americans/', 'created': 1611851284.0}",2021-01-28 16:28:04
79,Zobizoba0fg,1611851284,Trading was free because you were the sheep to skin,https://www.reddit.com/r/wallstreetbets/comments/l71czv/trading_was_free_because_you_were_the_sheep_to/,1611851284.0,"{'author': 'Zobizoba0fg', 'created_utc': 1611851284, 'title': 'Trading was free because you were the sheep to skin', 'url': 'https://www.reddit.com/r/wallstreetbets/comments/l71czv/trading_was_free_because_you_were_the_sheep_to/', 'created': 1611851284.0}",2021-01-28 16:28:04
80,penisinesq,1611851284,Sweden buys! 📈,https://i.redd.it/v7qtfb3wn3e61.jpg,1611851284.0,"{'author': 'penisinesq', 'created_utc': 1611851284, 'title': 'Sweden buys! 📈', 'url': 'https://i.redd.it/v7qtfb3wn3e61.jpg', 'created': 1611851284.0}",2021-01-28 16:28:04
81,CashCruncher-92,1611851283,Black rock and wall street can see this.,https://www.reddit.com/r/wallstreetbets/comments/l71czd/black_rock_and_wall_street_can_see_this/,1611851283.0,"{'author': 'CashCruncher-92', 'created_utc': 1611851283, 'title': 'Black rock and wall street can see this.', 'url': 'https://www.reddit.com/r/wallstreetbets/comments/l71czd/black_rock_and_wall_street_can_see_this/', 'created': 1611851283.0}",2021-01-28 16:28:03
82,JDHedrick,1611851283,Everyone Send Letters and Emails to your state congressman and senator,https://www.reddit.com/r/wallstreetbets/comments/l71cz9/everyone_send_letters_and_emails_to_your_state/,1611851283.0,"{'author': 'JDHedrick', 'created_utc': 1611851283, 'title': 'Everyone Send Letters and Emails to your state congressman and senator', 'url': 'https://www.reddit.com/r/wallstreetbets/comments/l71cz9/everyone_send_letters_and_emails_to_your_state/', 'created': 1611851283.0}",2021-01-28 16:28:03
83,ZionEnglish,1611851282,It's Always Darkest Before Dawn,https://i.redd.it/f4vson8rn3e61.png,1611851282.0,"{'author': 'ZionEnglish', 'created_utc': 1611851282, 'title': ""It's Always Darkest Before Dawn"", 'url': 'https://i.redd.it/f4vson8rn3e61.png', 'created': 1611851282.0}",2021-01-28 16:28:02
84,exithe,1611851282,GME just opened for 5 seconds then halted again!!!,https://www.reddit.com/r/wallstreetbets/comments/l71cyv/gme_just_opened_for_5_seconds_then_halted_again/,1611851282.0,"{'author': 'exithe', 'created_utc': 1611851282, 'title': 'GME just opened for 5 seconds then halted again!!!', 'url': 'https://www.reddit.com/r/wallstreetbets/comments/l71cyv/gme_just_opened_for_5_seconds_then_halted_again/', 'created': 1611851282.0}",2021-01-28 16:28:02
85,Gallow_Bob,1611851282,CLASS ACTION AGAINST E*TRADE. I was a BEAR a few minutes ago and attempted to put in a sell order. It was rejected because they said I did not have enough shares in my account. I still have more than that amount of shares in my account,https://www.reddit.com/r/wallstreetbets/comments/l71cyt/class_action_against_etrade_i_was_a_bear_a_few/,1611851282.0,"{'author': 'Gallow_Bob', 'created_utc': 1611851282, 'title': 'CLASS ACTION AGAINST E*TRADE. I was a BEAR a few minutes ago and attempted to put in a sell order. It was rejected because they said I did not have enough shares in my account. I still have more than that amount of shares in my account', 'url': 'https://www.reddit.com/r/wallstreetbets/comments/l71cyt/class_action_against_etrade_i_was_a_bear_a_few/', 'created': 1611851282.0}",2021-01-28 16:28:02
86,mickeys_dead,1611851282,Tastyworks - the fucking nerve of these people,https://i.imgur.com/3DzARLn.jpg,1611851282.0,"{'author': 'mickeys_dead', 'created_utc': 1611851282, 'title': 'Tastyworks - the fucking nerve of these people', 'url': 'https://i.imgur.com/3DzARLn.jpg', 'created': 1611851282.0}",2021-01-28 16:28:02
87,Tadi56,1611851282,Im with him,https://i.redd.it/se9u3houn3e61.png,1611851282.0,"{'author': 'Tadi56', 'created_utc': 1611851282, 'title': 'Im with him', 'url': 'https://i.redd.it/se9u3houn3e61.png', 'created': 1611851282.0}",2021-01-28 16:28:02
88,Tadi56,1611851281,Im with him,https://i.redd.it/se9u3houn3e61.png,1611851281.0,"{'author': 'Tadi56', 'created_utc': 1611851281, 'title': 'Im with him', 'url': 'https://i.redd.it/se9u3houn3e61.png', 'created': 1611851281.0}",2021-01-28 16:28:01
89,fishlord115,1611851281,"Robinhood's user agreement explicitly states that they ""may at any time, in its sole discretion and without prior notice to Me, prohibit or restrict My ability to trade securities"". This is absolutely fucking outlandish. The only way to fight this is through a class action suit. STAY VIGILANT.",https://i.redd.it/waky6ce4n3e61.png,1611851281.0,"{'author': 'fishlord115', 'created_utc': 1611851281, 'title': 'Robinhood\'s user agreement explicitly states that they ""may at any time, in its sole discretion and without prior notice to Me, prohibit or restrict My ability to trade securities"". This is absolutely fucking outlandish. The only way to fight this is through a class action suit. STAY VIGILANT.', 'url': 'https://i.redd.it/waky6ce4n3e61.png', 'created': 1611851281.0}",2021-01-28 16:28:01
90,Tretrue3,1611851281,"Realistically, when can we expect the traders to take off this “sell only” thing? Will a lawsuit have to come first?",https://www.reddit.com/r/wallstreetbets/comments/l71cy8/realistically_when_can_we_expect_the_traders_to/,1611851281.0,"{'author': 'Tretrue3', 'created_utc': 1611851281, 'title': 'Realistically, when can we expect the traders to take off this “sell only” thing? Will a lawsuit have to come first?', 'url': 'https://www.reddit.com/r/wallstreetbets/comments/l71cy8/realistically_when_can_we_expect_the_traders_to/', 'created': 1611851281.0}",2021-01-28 16:28:01
91,nogizako,1611851281,IT'S EVERY PLATFORM! NOT JUST ROBINHOOD,https://www.reddit.com/r/wallstreetbets/comments/l71cxy/its_every_platform_not_just_robinhood/,1611851281.0,"{'author': 'nogizako', 'created_utc': 1611851281, 'title': ""IT'S EVERY PLATFORM! NOT JUST ROBINHOOD"", 'url': 'https://www.reddit.com/r/wallstreetbets/comments/l71cxy/its_every_platform_not_just_robinhood/', 'created': 1611851281.0}",2021-01-28 16:28:01
92,Fast-Switch-2630,1611851280,IM STILL STANDING,https://www.youtube.com/watch?v=ZHwVBirqD2s,1611851280.0,"{'author': 'Fast-Switch-2630', 'created_utc': 1611851280, 'title': 'IM STILL STANDING', 'url': 'https://www.youtube.com/watch?v=ZHwVBirqD2s', 'created': 1611851280.0}",2021-01-28 16:28:00
93,MagicHaggis,1611851280,"NOK TO THE MOON, JUST BOUGHT 420 SHARES AT $4.73 LETS FUCKING GOOOOOOOO",https://i.redd.it/qlrdzleyk3e61.gif,1611851280.0,"{'author': 'MagicHaggis', 'created_utc': 1611851280, 'title': 'NOK TO THE MOON, JUST BOUGHT 420 SHARES AT $4.73 LETS FUCKING GOOOOOOOO', 'url': 'https://i.redd.it/qlrdzleyk3e61.gif', 'created': 1611851280.0}",2021-01-28 16:28:00
94,Imnotfcknleavin,1611851280,Next up ⬆️ 🚀,https://www.reddit.com/r/wallstreetbets/comments/l71cxd/next_up/,1611851280.0,"{'author': 'Imnotfcknleavin', 'created_utc': 1611851280, 'title': 'Next up ⬆️ 🚀', 'url': 'https://www.reddit.com/r/wallstreetbets/comments/l71cxd/next_up/', 'created': 1611851280.0}",2021-01-28 16:28:00
95,benaffleks,1611851279,Don't care if GME goes to 0. I'm proud to stand here with you.,https://www.reddit.com/r/wallstreetbets/comments/l71cx6/dont_care_if_gme_goes_to_0_im_proud_to_stand_here/,1611851279.0,"{'author': 'benaffleks', 'created_utc': 1611851279, 'title': ""Don't care if GME goes to 0. I'm proud to stand here with you."", 'url': 'https://www.reddit.com/r/wallstreetbets/comments/l71cx6/dont_care_if_gme_goes_to_0_im_proud_to_stand_here/', 'created': 1611851279.0}",2021-01-28 16:27:59
96,Ok_Bar4971,1611851279,Webull is still live!,https://www.reddit.com/r/wallstreetbets/comments/l71cx5/webull_is_still_live/,1611851279.0,"{'author': 'Ok_Bar4971', 'created_utc': 1611851279, 'title': 'Webull is still live!', 'url': 'https://www.reddit.com/r/wallstreetbets/comments/l71cx5/webull_is_still_live/', 'created': 1611851279.0}",2021-01-28 16:27:59
97,efe287,1611851279,HOOOOLLLLLDDDDDD HOOOLLLDDD hold GME,https://www.reddit.com/r/wallstreetbets/comments/l71cwx/hoooollllldddddd_hooolllddd_hold_gme/,1611851279.0,"{'author': 'efe287', 'created_utc': 1611851279, 'title': 'HOOOOLLLLLDDDDDD HOOOLLLDDD hold GME', 'url': 'https://www.reddit.com/r/wallstreetbets/comments/l71cwx/hoooollllldddddd_hooolllddd_hold_gme/', 'created': 1611851279.0}",2021-01-28 16:27:59
98,MohamedMansour,1611851279,#deleterobinhood they deactivated my account,https://i.redd.it/1ts818xvn3e61.jpg,1611851279.0,"{'author': 'MohamedMansour', 'created_utc': 1611851279, 'title': '#deleterobinhood they deactivated my account', 'url': 'https://i.redd.it/1ts818xvn3e61.jpg', 'created': 1611851279.0}",2021-01-28 16:27:59
99,BigSosa300-,1611851279,WE WILL WIN!!! GME GME GME!,https://www.reddit.com/r/wallstreetbets/comments/l71cwo/we_will_win_gme_gme_gme/,1611851279.0,"{'author': 'BigSosa300-', 'created_utc': 1611851279, 'title': 'WE WILL WIN!!! GME GME GME!', 'url': 'https://www.reddit.com/r/wallstreetbets/comments/l71cwo/we_will_win_gme_gme_gme/', 'created': 1611851279.0}",2021-01-28 16:27:59
