,author,created_utc,title,url,created,d_,created_utc_dt
0,stocktawk,1609379301,What does Elon Mean With This Tweet? Help Me Decipher His Code,https://i.redd.it/7p017gefhf861.jpg,1609379301.0,"{'author': 'stocktawk', 'created_utc': 1609379301, 'title': 'What does Elon Mean With This Tweet? Help Me Decipher His Code', 'url': 'https://i.redd.it/7p017gefhf861.jpg', 'created': 1609379301.0}",2020-12-31 01:48:21
1,MangoManYummy,1609379262,Watching $BABA in HK while holding calls.,https://i.redd.it/h6h9gv6bhf861.jpg,1609379262.0,"{'author': 'MangoManYummy', 'created_utc': 1609379262, 'title': 'Watching $BABA in HK while holding calls.', 'url': 'https://i.redd.it/h6h9gv6bhf861.jpg', 'created': 1609379262.0}",2020-12-31 01:47:42
2,mandingob,1609379171,Any good conspiracy theories about trading or the community?,https://www.reddit.com/r/wallstreetbets/comments/kng3dz/any_good_conspiracy_theories_about_trading_or_the/,1609379171.0,"{'author': 'mandingob', 'created_utc': 1609379171, 'title': 'Any good conspiracy theories about trading or the community?', 'url': 'https://www.reddit.com/r/wallstreetbets/comments/kng3dz/any_good_conspiracy_theories_about_trading_or_the/', 'created': 1609379171.0}",2020-12-31 01:46:11
3,Obsidian707,1609379078,BNGO,https://www.reddit.com/r/wallstreetbets/comments/kng2fx/bngo/,1609379078.0,"{'author': 'Obsidian707', 'created_utc': 1609379078, 'title': 'BNGO', 'url': 'https://www.reddit.com/r/wallstreetbets/comments/kng2fx/bngo/', 'created': 1609379078.0}",2020-12-31 01:44:38
4,stocktawk,1609379043,Can Anyone Decode Elon’s Latest Tweet? What is He Trying to Tell Us?,https://i.redd.it/bh1pohtngf861.jpg,1609379043.0,"{'author': 'stocktawk', 'created_utc': 1609379043, 'title': 'Can Anyone Decode Elon’s Latest Tweet? What is He Trying to Tell Us?', 'url': 'https://i.redd.it/bh1pohtngf861.jpg', 'created': 1609379043.0}",2020-12-31 01:44:03
5,DanielAPO,1609378989,Found this TSLA bull on Instagram. Which one you is it?,https://www.reddit.com/gallery/kng1gd,1609378989.0,"{'author': 'DanielAPO', 'created_utc': 1609378989, 'title': 'Found this TSLA bull on Instagram. Which one you is it?', 'url': 'https://www.reddit.com/gallery/kng1gd', 'created': 1609378989.0}",2020-12-31 01:43:09
6,Xsyther,1609378966,A man can dream,https://i.redd.it/sgzz7wgfgf861.jpg,1609378966.0,"{'author': 'Xsyther', 'created_utc': 1609378966, 'title': 'A man can dream', 'url': 'https://i.redd.it/sgzz7wgfgf861.jpg', 'created': 1609378966.0}",2020-12-31 01:42:46
7,CodeToLiveBy,1609378817,99% of the people in here,https://v.redd.it/k1z6jzuuff861,1609378817.0,"{'author': 'CodeToLiveBy', 'created_utc': 1609378817, 'title': '99% of the people in here', 'url': 'https://v.redd.it/k1z6jzuuff861', 'created': 1609378817.0}",2020-12-31 01:40:17
8,ValenciaTrading,1609378620,$ODT DD,https://www.reddit.com/r/wallstreetbets/comments/knfxgv/odt_dd/,1609378620.0,"{'author': 'ValenciaTrading', 'created_utc': 1609378620, 'title': '$ODT DD', 'url': 'https://www.reddit.com/r/wallstreetbets/comments/knfxgv/odt_dd/', 'created': 1609378620.0}",2020-12-31 01:37:00
9,Fucktheyuribears,1609378564,"So hear me out, AAPL recently leaked that they are getting into the EV space... with hundreds of billions of dollars in cash reserves they could buy basically any pre established auto maker except TSLA. Who makes the most sense?",https://www.reddit.com/r/wallstreetbets/comments/knfwv9/so_hear_me_out_aapl_recently_leaked_that_they_are/,1609378564.0,"{'author': 'Fucktheyuribears', 'created_utc': 1609378564, 'title': 'So hear me out, AAPL recently leaked that they are getting into the EV space... with hundreds of billions of dollars in cash reserves they could buy basically any pre established auto maker except TSLA. Who makes the most sense?', 'url': 'https://www.reddit.com/r/wallstreetbets/comments/knfwv9/so_hear_me_out_aapl_recently_leaked_that_they_are/', 'created': 1609378564.0}",2020-12-31 01:36:04
10,The_Cuda,1609378540,"I'll make it BIG this time, I swear!",https://i.redd.it/1bkflhhxef861.jpg,1609378540.0,"{'author': 'The_Cuda', 'created_utc': 1609378540, 'title': ""I'll make it BIG this time, I swear!"", 'url': 'https://i.redd.it/1bkflhhxef861.jpg', 'created': 1609378540.0}",2020-12-31 01:35:40
11,CIassik,1609378463,The people in this sub are the future,https://www.reddit.com/r/wallstreetbets/comments/knfvuo/the_people_in_this_sub_are_the_future/,1609378463.0,"{'author': 'CIassik', 'created_utc': 1609378463, 'title': 'The people in this sub are the future', 'url': 'https://www.reddit.com/r/wallstreetbets/comments/knfvuo/the_people_in_this_sub_are_the_future/', 'created': 1609378463.0}",2020-12-31 01:34:23
12,TheoHoww,1609378450,Rate my portfolio,https://www.reddit.com/r/wallstreetbets/comments/knfvp4/rate_my_portfolio/,1609378450.0,"{'author': 'TheoHoww', 'created_utc': 1609378450, 'title': 'Rate my portfolio', 'url': 'https://www.reddit.com/r/wallstreetbets/comments/knfvp4/rate_my_portfolio/', 'created': 1609378450.0}",2020-12-31 01:34:10
13,Nate782,1609378398,Smoke $TLRY Everyday,https://www.reddit.com/r/wallstreetbets/comments/knfv2w/smoke_tlry_everyday/,1609378398.0,"{'author': 'Nate782', 'created_utc': 1609378398, 'title': 'Smoke $TLRY Everyday', 'url': 'https://www.reddit.com/r/wallstreetbets/comments/knfv2w/smoke_tlry_everyday/', 'created': 1609378398.0}",2020-12-31 01:33:18
14,gkibbe,1609378374,"E-Trade confirms, don't listen to the gay bears. 🚀🚀🚀GME🚀🚀🚀",https://i.redd.it/1gkkl3z3ef861.png,1609378374.0,"{'author': 'gkibbe', 'created_utc': 1609378374, 'title': ""E-Trade confirms, don't listen to the gay bears. 🚀🚀🚀GME🚀🚀🚀"", 'url': 'https://i.redd.it/1gkkl3z3ef861.png', 'created': 1609378374.0}",2020-12-31 01:32:54
15,Upside-down-tree,1609378103,Confirmation bias confirmed we ride tomorrow 🚀,https://i.redd.it/q99ugu3vdf861.jpg,1609378103.0,"{'author': 'Upside-down-tree', 'created_utc': 1609378103, 'title': 'Confirmation bias confirmed we ride tomorrow 🚀', 'url': 'https://i.redd.it/q99ugu3vdf861.jpg', 'created': 1609378103.0}",2020-12-31 01:28:23
16,greasyjoe,1609377999,GME testing my resolve,https://imgflip.com/i/4s360k,1609377999.0,"{'author': 'greasyjoe', 'created_utc': 1609377999, 'title': 'GME testing my resolve', 'url': 'https://imgflip.com/i/4s360k', 'created': 1609377999.0}",2020-12-31 01:26:39
17,jabamodern,1609377893,"Guaranteed 50% return, courtesy of Uncle Sam for low income earners",https://www.reddit.com/r/wallstreetbets/comments/knfpt4/guaranteed_50_return_courtesy_of_uncle_sam_for/,1609377893.0,"{'author': 'jabamodern', 'created_utc': 1609377893, 'title': 'Guaranteed 50% return, courtesy of Uncle Sam for low income earners', 'url': 'https://www.reddit.com/r/wallstreetbets/comments/knfpt4/guaranteed_50_return_courtesy_of_uncle_sam_for/', 'created': 1609377893.0}",2020-12-31 01:24:53
18,HindsightTrader,1609377892,Pltr gonna be big for Jan!,https://www.reddit.com/r/wallstreetbets/comments/knfpse/pltr_gonna_be_big_for_jan/,1609377892.0,"{'author': 'HindsightTrader', 'created_utc': 1609377892, 'title': 'Pltr gonna be big for Jan!', 'url': 'https://www.reddit.com/r/wallstreetbets/comments/knfpse/pltr_gonna_be_big_for_jan/', 'created': 1609377892.0}",2020-12-31 01:24:52
19,Daviskiig,1609377865,Urgent Help in my area please any amount,https://www.airfunding.net/project/229283?hl=en&amp;utm_source=copied_url&amp;utm_medium=social&amp;utm_campaign=project_first_shares&amp;utm_content=project_id_229283,1609377865.0,"{'author': 'Daviskiig', 'created_utc': 1609377865, 'title': 'Urgent Help in my area please any amount', 'url': 'https://www.airfunding.net/project/229283?hl=en&amp;utm_source=copied_url&amp;utm_medium=social&amp;utm_campaign=project_first_shares&amp;utm_content=project_id_229283', 'created': 1609377865.0}",2020-12-31 01:24:25
20,MemesByTim,1609377817,"When you just lost everything, but wsb is the only dd you know of.",https://i.redd.it/1ybnnbk0df861.jpg,1609377817.0,"{'author': 'MemesByTim', 'created_utc': 1609377817, 'title': 'When you just lost everything, but wsb is the only dd you know of.', 'url': 'https://i.redd.it/1ybnnbk0df861.jpg', 'created': 1609377817.0}",2020-12-31 01:23:37
21,TMoney1157,1609377752,Nio $65 Calls 1/15,https://www.reddit.com/r/wallstreetbets/comments/knfo83/nio_65_calls_115/,1609377752.0,"{'author': 'TMoney1157', 'created_utc': 1609377752, 'title': 'Nio $65 Calls 1/15', 'url': 'https://www.reddit.com/r/wallstreetbets/comments/knfo83/nio_65_calls_115/', 'created': 1609377752.0}",2020-12-31 01:22:32
22,tokmer,1609377713,"Mitch McConnell wont let the $2,000 stimulus because he shorted GME and knows its gonna go straight to new consoles",https://www.reddit.com/r/wallstreetbets/comments/knfnsy/mitch_mcconnell_wont_let_the_2000_stimulus/,1609377713.0,"{'author': 'tokmer', 'created_utc': 1609377713, 'title': 'Mitch McConnell wont let the $2,000 stimulus because he shorted GME and knows its gonna go straight to new consoles', 'url': 'https://www.reddit.com/r/wallstreetbets/comments/knfnsy/mitch_mcconnell_wont_let_the_2000_stimulus/', 'created': 1609377713.0}",2020-12-31 01:21:53
23,AUSTINpowers050,1609377543,TSLA 🚀🚀 so that penis suit loses money,https://i.redd.it/zfhx7j57cf861.jpg,1609377543.0,"{'author': 'AUSTINpowers050', 'created_utc': 1609377543, 'title': 'TSLA 🚀🚀 so that penis suit loses money', 'url': 'https://i.redd.it/zfhx7j57cf861.jpg', 'created': 1609377543.0}",2020-12-31 01:19:03
24,No_Seesaw1134,1609377528,My Watchlist For 12/31/2020,https://www.reddit.com/gallery/knfls8,1609377528.0,"{'author': 'No_Seesaw1134', 'created_utc': 1609377528, 'title': 'My Watchlist For 12/31/2020', 'url': 'https://www.reddit.com/gallery/knfls8', 'created': 1609377528.0}",2020-12-31 01:18:48
25,Upside-down-tree,1609377516,Well I can’t use the technical FLAIR for some reason but here you go lines have confirmed my bias technically GME 12/31 🚀🚀🚀🚀🚀🚀🚀🚀🚀🚀🚀🚀🚀🚀,https://i.redd.it/lcu5dsb4cf861.jpg,1609377516.0,"{'author': 'Upside-down-tree', 'created_utc': 1609377516, 'title': 'Well I can’t use the technical FLAIR for some reason but here you go lines have confirmed my bias technically GME 12/31 🚀🚀🚀🚀🚀🚀🚀🚀🚀🚀🚀🚀🚀🚀', 'url': 'https://i.redd.it/lcu5dsb4cf861.jpg', 'created': 1609377516.0}",2020-12-31 01:18:36
26,AnotherWhiteOther,1609377428,STOKU MARKIT BASICS,https://i.redd.it/xcomuxxubf861.jpg,1609377428.0,"{'author': 'AnotherWhiteOther', 'created_utc': 1609377428, 'title': 'STOKU MARKIT BASICS', 'url': 'https://i.redd.it/xcomuxxubf861.jpg', 'created': 1609377428.0}",2020-12-31 01:17:08
27,Jeffrey-Steenburg,1609377246,Good metal play Silver miner,https://i.redd.it/8g1d02abbf861.jpg,1609377246.0,"{'author': 'Jeffrey-Steenburg', 'created_utc': 1609377246, 'title': 'Good metal play Silver miner', 'url': 'https://i.redd.it/8g1d02abbf861.jpg', 'created': 1609377246.0}",2020-12-31 01:14:06
28,dannywong518,1609377207,What are your thoughts on STEVEN VAN METRE?,https://www.reddit.com/r/wallstreetbets/comments/knfi9g/what_are_your_thoughts_on_steven_van_metre/,1609377207.0,"{'author': 'dannywong518', 'created_utc': 1609377207, 'title': 'What are your thoughts on STEVEN VAN METRE?', 'url': 'https://www.reddit.com/r/wallstreetbets/comments/knfi9g/what_are_your_thoughts_on_steven_van_metre/', 'created': 1609377207.0}",2020-12-31 01:13:27
29,No_Seesaw1134,1609377070,Tendy Approved Watchlist 12/31/2020,https://www.reddit.com/gallery/knfguc,1609377070.0,"{'author': 'No_Seesaw1134', 'created_utc': 1609377070, 'title': 'Tendy Approved Watchlist 12/31/2020', 'url': 'https://www.reddit.com/gallery/knfguc', 'created': 1609377070.0}",2020-12-31 01:11:10
30,Gmmai,1609377029,Cramer on GME🚀🚀🚀🚀🚀🚀,https://www.reddit.com/r/wallstreetbets/comments/knfgeu/cramer_on_gme/,1609377029.0,"{'author': 'Gmmai', 'created_utc': 1609377029, 'title': 'Cramer on GME🚀🚀🚀🚀🚀🚀', 'url': 'https://www.reddit.com/r/wallstreetbets/comments/knfgeu/cramer_on_gme/', 'created': 1609377029.0}",2020-12-31 01:10:29
31,Janto_2021,1609376936,It burns!,https://i.redd.it/8778as9eaf861.jpg,1609376936.0,"{'author': 'Janto_2021', 'created_utc': 1609376936, 'title': 'It burns!', 'url': 'https://i.redd.it/8778as9eaf861.jpg', 'created': 1609376936.0}",2020-12-31 01:08:56
32,Two_takedown,1609376919,Ambri?,https://www.reddit.com/r/wallstreetbets/comments/knff71/ambri/,1609376919.0,"{'author': 'Two_takedown', 'created_utc': 1609376919, 'title': 'Ambri?', 'url': 'https://www.reddit.com/r/wallstreetbets/comments/knff71/ambri/', 'created': 1609376919.0}",2020-12-31 01:08:39
33,TheHancock,1609376857,"Guy posted about how to block ads, what he doesn’t know is that’s how I get my investment information. 😎🚀🚀",https://i.redd.it/gjqi4jq5af861.jpg,1609376857.0,"{'author': 'TheHancock', 'created_utc': 1609376857, 'title': 'Guy posted about how to block ads, what he doesn’t know is that’s how I get my investment information. 😎🚀🚀', 'url': 'https://i.redd.it/gjqi4jq5af861.jpg', 'created': 1609376857.0}",2020-12-31 01:07:37
34,Psychadelius,1609376777,"It's confirmed, PLTR to the moon 🚀🚀🚀🚀🚀🚀🚀🚀🚀",https://i.redd.it/ef97ve9x9f861.jpg,1609376777.0,"{'author': 'Psychadelius', 'created_utc': 1609376777, 'title': ""It's confirmed, PLTR to the moon 🚀🚀🚀🚀🚀🚀🚀🚀🚀"", 'url': 'https://i.redd.it/ef97ve9x9f861.jpg', 'created': 1609376777.0}",2020-12-31 01:06:17
35,dontFart_InSpaceSuit,1609376639,Stock from startup went public. Which brokerage firm to use?,https://www.reddit.com/r/wallstreetbets/comments/knfc4q/stock_from_startup_went_public_which_brokerage/,1609376639.0,"{'author': 'dontFart_InSpaceSuit', 'created_utc': 1609376639, 'title': 'Stock from startup went public. Which brokerage firm to use?', 'url': 'https://www.reddit.com/r/wallstreetbets/comments/knfc4q/stock_from_startup_went_public_which_brokerage/', 'created': 1609376639.0}",2020-12-31 01:03:59
36,Noah_B_Dee,1609376475,Well.... DO YA? / GME GANG,https://i.redd.it/i96aj0gv8f861.jpg,1609376475.0,"{'author': 'Noah_B_Dee', 'created_utc': 1609376475, 'title': 'Well.... DO YA? / GME GANG', 'url': 'https://i.redd.it/i96aj0gv8f861.jpg', 'created': 1609376475.0}",2020-12-31 01:01:15
37,Fisherman2209,1609376465,I'll make a million in 2021 or I'll get a Mitch McConnell heart tattoo,https://www.reddit.com/r/wallstreetbets/comments/knfa5y/ill_make_a_million_in_2021_or_ill_get_a_mitch/,1609376465.0,"{'author': 'Fisherman2209', 'created_utc': 1609376465, 'title': ""I'll make a million in 2021 or I'll get a Mitch McConnell heart tattoo"", 'url': 'https://www.reddit.com/r/wallstreetbets/comments/knfa5y/ill_make_a_million_in_2021_or_ill_get_a_mitch/', 'created': 1609376465.0}",2020-12-31 01:01:05
38,theunknown4315,1609376453,Tesla call $700 12/31,https://www.reddit.com/r/wallstreetbets/comments/knfa11/tesla_call_700_1231/,1609376453.0,"{'author': 'theunknown4315', 'created_utc': 1609376453, 'title': 'Tesla call $700 12/31', 'url': 'https://www.reddit.com/r/wallstreetbets/comments/knfa11/tesla_call_700_1231/', 'created': 1609376453.0}",2020-12-31 01:00:53
39,tomatohead69,1609376420,Can you tell when I stopped being a gay ETF investor? About 15k in deposits this year though. 23k realized gains according to my cost basis,https://i.redd.it/c9bq6u1v8f861.jpg,1609376420.0,"{'author': 'tomatohead69', 'created_utc': 1609376420, 'title': 'Can you tell when I stopped being a gay ETF investor? About 15k in deposits this year though. 23k realized gains according to my cost basis', 'url': 'https://i.redd.it/c9bq6u1v8f861.jpg', 'created': 1609376420.0}",2020-12-31 01:00:20
40,eaja,1609376402,Let me tell you about my Christmas ELF,https://www.reddit.com/gallery/knf9ds,1609376402.0,"{'author': 'eaja', 'created_utc': 1609376402, 'title': 'Let me tell you about my Christmas ELF', 'url': 'https://www.reddit.com/gallery/knf9ds', 'created': 1609376402.0}",2020-12-31 01:00:02
41,CouldTryMyBest,1609376182,Anyone still trade TSLA calls?,https://www.reddit.com/r/wallstreetbets/comments/knf707/anyone_still_trade_tsla_calls/,1609376182.0,"{'author': 'CouldTryMyBest', 'created_utc': 1609376182, 'title': 'Anyone still trade TSLA calls?', 'url': 'https://www.reddit.com/r/wallstreetbets/comments/knf707/anyone_still_trade_tsla_calls/', 'created': 1609376182.0}",2020-12-31 00:56:22
42,Mr_Bing_Bong_man,1609376161,For everyone asking for more information on what trading options is like,https://i.redd.it/5hqem3p18f861.png,1609376161.0,"{'author': 'Mr_Bing_Bong_man', 'created_utc': 1609376161, 'title': 'For everyone asking for more information on what trading options is like', 'url': 'https://i.redd.it/5hqem3p18f861.png', 'created': 1609376161.0}",2020-12-31 00:56:01
43,Jace910,1609376125,I need you dumb fucks to pump this bitch over the next year. Thanks.,https://i.redd.it/2fye9rfz7f861.jpg,1609376125.0,"{'author': 'Jace910', 'created_utc': 1609376125, 'title': 'I need you dumb fucks to pump this bitch over the next year. Thanks.', 'url': 'https://i.redd.it/2fye9rfz7f861.jpg', 'created': 1609376125.0}",2020-12-31 00:55:25
44,captain_blabbin,1609376098,Meanwhile 🇺🇸 raising consumers,https://i.redd.it/3hkb45er7f861.png,1609376098.0,"{'author': 'captain_blabbin', 'created_utc': 1609376098, 'title': 'Meanwhile 🇺🇸 raising consumers', 'url': 'https://i.redd.it/3hkb45er7f861.png', 'created': 1609376098.0}",2020-12-31 00:54:58
45,RojerLockless,1609375983,Sometimes you have to cash out. Fuck you.,https://www.reddit.com/r/wallstreetbets/comments/knf4tg/sometimes_you_have_to_cash_out_fuck_you/,1609375983.0,"{'author': 'RojerLockless', 'created_utc': 1609375983, 'title': 'Sometimes you have to cash out. Fuck you.', 'url': 'https://www.reddit.com/r/wallstreetbets/comments/knf4tg/sometimes_you_have_to_cash_out_fuck_you/', 'created': 1609375983.0}",2020-12-31 00:53:03
46,Ricegas,1609375856,Buy the rumor sell the news -GILD buy out—,https://www.griproom.com/fun/market-cap-spread-between-gilead-and-roche-continues-to-widen,1609375856.0,"{'author': 'Ricegas', 'created_utc': 1609375856, 'title': 'Buy the rumor sell the news -GILD buy out—', 'url': 'https://www.griproom.com/fun/market-cap-spread-between-gilead-and-roche-continues-to-widen', 'created': 1609375856.0}",2020-12-31 00:50:56
47,ThePizzaDeliveryM3n,1609375785,Melvin at it again with the hit pieces,https://www.reddit.com/r/wallstreetbets/comments/knf2io/melvin_at_it_again_with_the_hit_pieces/,1609375785.0,"{'author': 'ThePizzaDeliveryM3n', 'created_utc': 1609375785, 'title': 'Melvin at it again with the hit pieces', 'url': 'https://www.reddit.com/r/wallstreetbets/comments/knf2io/melvin_at_it_again_with_the_hit_pieces/', 'created': 1609375785.0}",2020-12-31 00:49:45
48,cushyl,1609375727,Robinhood is the New Menace - Scott Galloway,https://youtu.be/umUmrzounFI?t=2355,1609375727.0,"{'author': 'cushyl', 'created_utc': 1609375727, 'title': 'Robinhood is the New Menace - Scott Galloway', 'url': 'https://youtu.be/umUmrzounFI?t=2355', 'created': 1609375727.0}",2020-12-31 00:48:47
49,atrophy1999,1609375538,"Shilling, shadow bans and censorship!",https://www.reddit.com/r/wallstreetbets/comments/knezu2/shilling_shadow_bans_and_censorship/,1609375538.0,"{'author': 'atrophy1999', 'created_utc': 1609375538, 'title': 'Shilling, shadow bans and censorship!', 'url': 'https://www.reddit.com/r/wallstreetbets/comments/knezu2/shilling_shadow_bans_and_censorship/', 'created': 1609375538.0}",2020-12-31 00:45:38
50,stfnqllt,1609375522,PLTR hasn't even begun to peak,https://v.redd.it/f48phrxw5f861,1609375522.0,"{'author': 'stfnqllt', 'created_utc': 1609375522, 'title': ""PLTR hasn't even begun to peak"", 'url': 'https://v.redd.it/f48phrxw5f861', 'created': 1609375522.0}",2020-12-31 00:45:22
51,billwaters,1609375402,"26k in a month doing put credit spreads on NVDA. Still 59k down overall tho, baby steps.",https://i.redd.it/o0wogafl5f861.png,1609375402.0,"{'author': 'billwaters', 'created_utc': 1609375402, 'title': '26k in a month doing put credit spreads on NVDA. Still 59k down overall tho, baby steps.', 'url': 'https://i.redd.it/o0wogafl5f861.png', 'created': 1609375402.0}",2020-12-31 00:43:22
52,bruceNook,1609375260,GME Shorts after holiday sales update in January blows past expectations,https://i.redd.it/o1ak4wba5f861.png,1609375260.0,"{'author': 'bruceNook', 'created_utc': 1609375260, 'title': 'GME Shorts after holiday sales update in January blows past expectations', 'url': 'https://i.redd.it/o1ak4wba5f861.png', 'created': 1609375260.0}",2020-12-31 00:41:00
53,Bashmckill,1609375146,New Strategy,https://www.reddit.com/gallery/knevkm,1609375146.0,"{'author': 'Bashmckill', 'created_utc': 1609375146, 'title': 'New Strategy', 'url': 'https://www.reddit.com/gallery/knevkm', 'created': 1609375146.0}",2020-12-31 00:39:06
54,solenyapinkman,1609375038,Btc,https://www.reddit.com/r/wallstreetbets/comments/kneudh/btc/,1609375038.0,"{'author': 'solenyapinkman', 'created_utc': 1609375038, 'title': 'Btc', 'url': 'https://www.reddit.com/r/wallstreetbets/comments/kneudh/btc/', 'created': 1609375038.0}",2020-12-31 00:37:18
55,billwaters,1609374913,26k in a month by doing put OTM credit spreads on NVDA. Still 59k down overall tho.,https://imgur.com/J3Q3BKT,1609374913.0,"{'author': 'billwaters', 'created_utc': 1609374913, 'title': '26k in a month by doing put OTM credit spreads on NVDA. Still 59k down overall tho.', 'url': 'https://imgur.com/J3Q3BKT', 'created': 1609374913.0}",2020-12-31 00:35:13
56,JeffreyDoe,1609374639,"DD: GME, E Z CLAP, 🚀🚀🚀🚀🚀🚀🚀🚀🚀🚀🚀🚀🚀🚀🚀🚀🚀🚀🚀🚀🚀🚀🚀🚀🚀🚀🚀🚀🚀",https://i.redd.it/his38uxi3f861.png,1609374639.0,"{'author': 'JeffreyDoe', 'created_utc': 1609374639, 'title': 'DD: GME, E Z CLAP, 🚀🚀🚀🚀🚀🚀🚀🚀🚀🚀🚀🚀🚀🚀🚀🚀🚀🚀🚀🚀🚀🚀🚀🚀🚀🚀🚀🚀🚀', 'url': 'https://i.redd.it/his38uxi3f861.png', 'created': 1609374639.0}",2020-12-31 00:30:39
57,JeffreyDoe,1609374542,"DD: GME, E Z CLAP, 🚀🚀🚀🚀🚀🚀🚀🚀🚀🚀🚀🚀🚀🚀🚀🚀🚀🚀🚀🚀🚀🚀🚀🚀🚀🚀🚀🚀🚀",https://i.redd.it/opi86la83f861.png,1609374542.0,"{'author': 'JeffreyDoe', 'created_utc': 1609374542, 'title': 'DD: GME, E Z CLAP, 🚀🚀🚀🚀🚀🚀🚀🚀🚀🚀🚀🚀🚀🚀🚀🚀🚀🚀🚀🚀🚀🚀🚀🚀🚀🚀🚀🚀🚀', 'url': 'https://i.redd.it/opi86la83f861.png', 'created': 1609374542.0}",2020-12-31 00:29:02
58,litcapital,1609374408,"Amazing new clip from Litquidity, fellow tendy yolo stonks autists",https://v.redd.it/ehoil5ny1f861,1609374408.0,"{'author': 'litcapital', 'created_utc': 1609374408, 'title': 'Amazing new clip from Litquidity, fellow tendy yolo stonks autists', 'url': 'https://v.redd.it/ehoil5ny1f861', 'created': 1609374408.0}",2020-12-31 00:26:48
59,National-Meet2131,1609374329,Can you guess where I started trading options?,https://i.redd.it/7mr1288n2f861.jpg,1609374329.0,"{'author': 'National-Meet2131', 'created_utc': 1609374329, 'title': 'Can you guess where I started trading options?', 'url': 'https://i.redd.it/7mr1288n2f861.jpg', 'created': 1609374329.0}",2020-12-31 00:25:29
60,squigglyniggly,1609374232,Looking for a 32 bagger? It's IZEA 🚀 🚀 🚀 🚀,https://www.reddit.com/r/wallstreetbets/comments/knelh8/looking_for_a_32_bagger_its_izea/,1609374232.0,"{'author': 'squigglyniggly', 'created_utc': 1609374232, 'title': ""Looking for a 32 bagger? It's IZEA 🚀 🚀 🚀 🚀"", 'url': 'https://www.reddit.com/r/wallstreetbets/comments/knelh8/looking_for_a_32_bagger_its_izea/', 'created': 1609374232.0}",2020-12-31 00:23:52
61,National-Meet2131,1609374170,Can you guess where I started trading options?,https://i.redd.it/no6jx4562f861.jpg,1609374170.0,"{'author': 'National-Meet2131', 'created_utc': 1609374170, 'title': 'Can you guess where I started trading options?', 'url': 'https://i.redd.it/no6jx4562f861.jpg', 'created': 1609374170.0}",2020-12-31 00:22:50
62,Either_Loan_6516,1609374035,VTRS short term run is coming DD,https://www.reddit.com/r/wallstreetbets/comments/knejcr/vtrs_short_term_run_is_coming_dd/,1609374035.0,"{'author': 'Either_Loan_6516', 'created_utc': 1609374035, 'title': 'VTRS short term run is coming DD', 'url': 'https://www.reddit.com/r/wallstreetbets/comments/knejcr/vtrs_short_term_run_is_coming_dd/', 'created': 1609374035.0}",2020-12-31 00:20:35
63,painter_business,1609373877,Help w/ SoFi IRA account?,https://www.reddit.com/r/wallstreetbets/comments/knehn6/help_w_sofi_ira_account/,1609373877.0,"{'author': 'painter_business', 'created_utc': 1609373877, 'title': 'Help w/ SoFi IRA account?', 'url': 'https://www.reddit.com/r/wallstreetbets/comments/knehn6/help_w_sofi_ira_account/', 'created': 1609373877.0}",2020-12-31 00:17:57
64,longandthickx,1609373856,Lost money on Mommy’s account,https://www.reddit.com/r/wallstreetbets/comments/knehfh/lost_money_on_mommys_account/,1609373856.0,"{'author': 'longandthickx', 'created_utc': 1609373856, 'title': 'Lost money on Mommy’s account', 'url': 'https://www.reddit.com/r/wallstreetbets/comments/knehfh/lost_money_on_mommys_account/', 'created': 1609373856.0}",2020-12-31 00:17:36
65,MathematicianWhole29,1609373794,HIMX gains. Y’all slept on this. Holding till it pulls a AMD or get bought by Apple.,https://i.redd.it/hqwnlyw11f861.jpg,1609373794.0,"{'author': 'MathematicianWhole29', 'created_utc': 1609373794, 'title': 'HIMX gains. Y’all slept on this. Holding till it pulls a AMD or get bought by Apple.', 'url': 'https://i.redd.it/hqwnlyw11f861.jpg', 'created': 1609373794.0}",2020-12-31 00:16:34
66,arrival77,1609373745,SPY High Score: 378.46,https://www.reddit.com/r/wallstreetbets/comments/kneg9x/spy_high_score_37846/,1609373745.0,"{'author': 'arrival77', 'created_utc': 1609373745, 'title': 'SPY High Score: 378.46', 'url': 'https://www.reddit.com/r/wallstreetbets/comments/kneg9x/spy_high_score_37846/', 'created': 1609373745.0}",2020-12-31 00:15:45
