,author,created_utc,title,url,created,d_,created_utc_dt
0,itsyoboymatt,1605110982,"We live together, we die together, THETA GANG 4 LIFE",https://www.reddit.com/r/wallstreetbets/comments/jsavou/we_live_together_we_die_together_theta_gang_4_life/,1605110982.0,"{'author': 'itsyoboymatt', 'created_utc': 1605110982, 'title': 'We live together, we die together, THETA GANG 4 LIFE', 'url': 'https://www.reddit.com/r/wallstreetbets/comments/jsavou/we_live_together_we_die_together_theta_gang_4_life/', 'created': 1605110982.0}",2020-11-11 16:09:42
1,mr_birkenblatt,1605110953,Robinhood is a joke,https://imgur.com/uoV3GE4,1605110953.0,"{'author': 'mr_birkenblatt', 'created_utc': 1605110953, 'title': 'Robinhood is a joke', 'url': 'https://imgur.com/uoV3GE4', 'created': 1605110953.0}",2020-11-11 16:09:13
2,TheCoolestCannon,1605110917,Crypto is a meme but going short on crypto stock is for Kings🍻,https://i.redd.it/r4s4hvybxmy51.jpg,1605110917.0,"{'author': 'TheCoolestCannon', 'created_utc': 1605110917, 'title': 'Crypto is a meme but going short on crypto stock is for Kings🍻', 'url': 'https://i.redd.it/r4s4hvybxmy51.jpg', 'created': 1605110917.0}",2020-11-11 16:08:37
3,Drywalleater03,1605110806,Is it too late to invest in NIO,https://www.reddit.com/r/wallstreetbets/comments/jsatlf/is_it_too_late_to_invest_in_nio/,1605110806.0,"{'author': 'Drywalleater03', 'created_utc': 1605110806, 'title': 'Is it too late to invest in NIO', 'url': 'https://www.reddit.com/r/wallstreetbets/comments/jsatlf/is_it_too_late_to_invest_in_nio/', 'created': 1605110806.0}",2020-11-11 16:06:46
4,SmileExternal569,1605110754,Free Tendies anyone? You guys are starting to get to me started my yolo's 2 weeks ago,https://i.redd.it/r2vb7veowmy51.png,1605110754.0,"{'author': 'SmileExternal569', 'created_utc': 1605110754, 'title': ""Free Tendies anyone? You guys are starting to get to me started my yolo's 2 weeks ago"", 'url': 'https://i.redd.it/r2vb7veowmy51.png', 'created': 1605110754.0}",2020-11-11 16:05:54
5,throwawaydepressed98,1605110700,Should I hold $PLTR $15 2/19c through earnings? What’s the DD?,https://www.reddit.com/r/wallstreetbets/comments/jsasbb/should_i_hold_pltr_15_219c_through_earnings_whats/,1605110700.0,"{'author': 'throwawaydepressed98', 'created_utc': 1605110700, 'title': 'Should I hold $PLTR $15 2/19c through earnings? What’s the DD?', 'url': 'https://www.reddit.com/r/wallstreetbets/comments/jsasbb/should_i_hold_pltr_15_219c_through_earnings_whats/', 'created': 1605110700.0}",2020-11-11 16:05:00
6,Dr_THC,1605110615,How we feeling $PLTR GANG?,https://i.redd.it/my5gdxjewmy51.jpg,1605110615.0,"{'author': 'Dr_THC', 'created_utc': 1605110615, 'title': 'How we feeling $PLTR GANG?', 'url': 'https://i.redd.it/my5gdxjewmy51.jpg', 'created': 1605110615.0}",2020-11-11 16:03:35
7,TheCoolestCannon,1605110586,Riding the crypto wave like a king 🍻,https://i.redd.it/kgwcjfjcwmy51.jpg,1605110586.0,"{'author': 'TheCoolestCannon', 'created_utc': 1605110586, 'title': 'Riding the crypto wave like a king 🍻', 'url': 'https://i.redd.it/kgwcjfjcwmy51.jpg', 'created': 1605110586.0}",2020-11-11 16:03:06
8,cheetah-sloth,1605110474,Good hotel stocks to look into?,https://www.reddit.com/r/wallstreetbets/comments/jsappf/good_hotel_stocks_to_look_into/,1605110474.0,"{'author': 'cheetah-sloth', 'created_utc': 1605110474, 'title': 'Good hotel stocks to look into?', 'url': 'https://www.reddit.com/r/wallstreetbets/comments/jsappf/good_hotel_stocks_to_look_into/', 'created': 1605110474.0}",2020-11-11 16:01:14
9,RandomLurker9,1605110440,Hope you guys are getting in on the action today :D,https://www.reddit.com/r/wallstreetbets/comments/jsapbe/hope_you_guys_are_getting_in_on_the_action_today_d/,1605110440.0,"{'author': 'RandomLurker9', 'created_utc': 1605110440, 'title': 'Hope you guys are getting in on the action today :D', 'url': 'https://www.reddit.com/r/wallstreetbets/comments/jsapbe/hope_you_guys_are_getting_in_on_the_action_today_d/', 'created': 1605110440.0}",2020-11-11 16:00:40
10,SportsCardsOnly,1605110427,biggest yolo yet,https://i.redd.it/ydvi2chvvmy51.jpg,1605110427.0,"{'author': 'SportsCardsOnly', 'created_utc': 1605110427, 'title': 'biggest yolo yet', 'url': 'https://i.redd.it/ydvi2chvvmy51.jpg', 'created': 1605110427.0}",2020-11-11 16:00:27
11,SnooLobsters8798,1605110425,Thoughts on $adt at this price ?,https://www.reddit.com/r/wallstreetbets/comments/jsap5h/thoughts_on_adt_at_this_price/,1605110425.0,"{'author': 'SnooLobsters8798', 'created_utc': 1605110425, 'title': 'Thoughts on $adt at this price ?', 'url': 'https://www.reddit.com/r/wallstreetbets/comments/jsap5h/thoughts_on_adt_at_this_price/', 'created': 1605110425.0}",2020-11-11 16:00:25
12,throwaway70958,1605110357,I found our anthem,https://i.redd.it/iggr3jynvmy51.jpg,1605110357.0,"{'author': 'throwaway70958', 'created_utc': 1605110357, 'title': 'I found our anthem', 'url': 'https://i.redd.it/iggr3jynvmy51.jpg', 'created': 1605110357.0}",2020-11-11 15:59:17
13,Ski_g,1605110264,We Don't do Profits Here,https://i.redd.it/7ebu181avmy51.jpg,1605110264.0,"{'author': 'Ski_g', 'created_utc': 1605110264, 'title': ""We Don't do Profits Here"", 'url': 'https://i.redd.it/7ebu181avmy51.jpg', 'created': 1605110264.0}",2020-11-11 15:57:44
14,Denverdude98,1605110205,CSGP. volume is low but this thing has only gone up for it's entire existence,https://www.reddit.com/gallery/jsamo1,1605110205.0,"{'author': 'Denverdude98', 'created_utc': 1605110205, 'title': ""CSGP. volume is low but this thing has only gone up for it's entire existence"", 'url': 'https://www.reddit.com/gallery/jsamo1', 'created': 1605110205.0}",2020-11-11 15:56:45
15,Miker541854,1605109976,WMT is the FUTURE,https://www.reddit.com/r/wallstreetbets/comments/jsak4l/wmt_is_the_future/,1605109976.0,"{'author': 'Miker541854', 'created_utc': 1605109976, 'title': 'WMT is the FUTURE', 'url': 'https://www.reddit.com/r/wallstreetbets/comments/jsak4l/wmt_is_the_future/', 'created': 1605109976.0}",2020-11-11 15:52:56
16,AltF4-please,1605109908,Looking for legitimate help.,https://www.reddit.com/r/wallstreetbets/comments/jsajc8/looking_for_legitimate_help/,1605109908.0,"{'author': 'AltF4-please', 'created_utc': 1605109908, 'title': 'Looking for legitimate help.', 'url': 'https://www.reddit.com/r/wallstreetbets/comments/jsajc8/looking_for_legitimate_help/', 'created': 1605109908.0}",2020-11-11 15:51:48
17,Dr_THC,1605109900,"NIO, XPEV, and LI Report Earnings Soon. Here's What to Expect.",https://www.reddit.com/r/wallstreetbets/comments/jsaj8o/nio_xpev_and_li_report_earnings_soon_heres_what/,1605109900.0,"{'author': 'Dr_THC', 'created_utc': 1605109900, 'title': ""NIO, XPEV, and LI Report Earnings Soon. Here's What to Expect."", 'url': 'https://www.reddit.com/r/wallstreetbets/comments/jsaj8o/nio_xpev_and_li_report_earnings_soon_heres_what/', 'created': 1605109900.0}",2020-11-11 15:51:40
18,CockyFunny,1605109638,$RKT BE LIKE,https://www.youtube.com/watch?v=iHh-zGkZcDc&amp;t=34s,1605109638.0,"{'author': 'CockyFunny', 'created_utc': 1605109638, 'title': '$RKT BE LIKE', 'url': 'https://www.youtube.com/watch?v=iHh-zGkZcDc&amp;t=34s', 'created': 1605109638.0}",2020-11-11 15:47:18
19,MintBerryCrunch98,1605109493,Just put my whole Wendy’s check into NIO,https://www.reddit.com/r/wallstreetbets/comments/jsaesh/just_put_my_whole_wendys_check_into_nio/,1605109493.0,"{'author': 'MintBerryCrunch98', 'created_utc': 1605109493, 'title': 'Just put my whole Wendy’s check into NIO', 'url': 'https://www.reddit.com/r/wallstreetbets/comments/jsaesh/just_put_my_whole_wendys_check_into_nio/', 'created': 1605109493.0}",2020-11-11 15:44:53
20,Timsta180,1605109357,PSA: Robinhood now supports trading on day of expiration for options.,https://www.reddit.com/r/wallstreetbets/comments/jsad88/psa_robinhood_now_supports_trading_on_day_of/,1605109357.0,"{'author': 'Timsta180', 'created_utc': 1605109357, 'title': 'PSA: Robinhood now supports trading on day of expiration for options.', 'url': 'https://www.reddit.com/r/wallstreetbets/comments/jsad88/psa_robinhood_now_supports_trading_on_day_of/', 'created': 1605109357.0}",2020-11-11 15:42:37
21,6seasonandamovie,1605109293,Thoughts on Draft Kings?,https://www.reddit.com/r/wallstreetbets/comments/jsacl5/thoughts_on_draft_kings/,1605109293.0,"{'author': '6seasonandamovie', 'created_utc': 1605109293, 'title': 'Thoughts on Draft Kings?', 'url': 'https://www.reddit.com/r/wallstreetbets/comments/jsacl5/thoughts_on_draft_kings/', 'created': 1605109293.0}",2020-11-11 15:41:33
22,sevillada,1605109096,Pfizer's CEO cashed out 60% of his stock on the same day the company unveiled the results of its COVID-19 vaccine trial,https://www.msn.com/en-us/health/medical/pfizer-s-ceo-cashed-out-60-of-his-stock-on-the-same-day-the-company-unveiled-the-results-of-its-covid-19-vaccine-trial/ar-BB1aU6iq?ocid=msedgntp,1605109096.0,"{'author': 'sevillada', 'created_utc': 1605109096, 'title': ""Pfizer's CEO cashed out 60% of his stock on the same day the company unveiled the results of its COVID-19 vaccine trial"", 'url': 'https://www.msn.com/en-us/health/medical/pfizer-s-ceo-cashed-out-60-of-his-stock-on-the-same-day-the-company-unveiled-the-results-of-its-covid-19-vaccine-trial/ar-BB1aU6iq?ocid=msedgntp', 'created': 1605109096.0}",2020-11-11 15:38:16
23,MichaelooooWesten,1605109026,China’s Anti Monopoly Policy Alibaba Puts🚀🚀🚀,https://www.reddit.com/r/wallstreetbets/comments/jsa9o2/chinas_anti_monopoly_policy_alibaba_puts/,1605109026.0,"{'author': 'MichaelooooWesten', 'created_utc': 1605109026, 'title': 'China’s Anti Monopoly Policy Alibaba Puts🚀🚀🚀', 'url': 'https://www.reddit.com/r/wallstreetbets/comments/jsa9o2/chinas_anti_monopoly_policy_alibaba_puts/', 'created': 1605109026.0}",2020-11-11 15:37:06
24,autismlover,1605109004,others went up because of Pfizer except Pfizer. What should i do now?,https://i.redd.it/mqt1i1sgrmy51.jpg,1605109004.0,"{'author': 'autismlover', 'created_utc': 1605109004, 'title': 'others went up because of Pfizer except Pfizer. What should i do now?', 'url': 'https://i.redd.it/mqt1i1sgrmy51.jpg', 'created': 1605109004.0}",2020-11-11 15:36:44
25,derekorjustD,1605108684,GLW - products that both create and transport vaccine,https://www.reddit.com/r/wallstreetbets/comments/jsa5uo/glw_products_that_both_create_and_transport/,1605108684.0,"{'author': 'derekorjustD', 'created_utc': 1605108684, 'title': 'GLW - products that both create and transport vaccine', 'url': 'https://www.reddit.com/r/wallstreetbets/comments/jsa5uo/glw_products_that_both_create_and_transport/', 'created': 1605108684.0}",2020-11-11 15:31:24
26,Beast0045,1605108323,Low temp freezer companies,https://www.reddit.com/r/wallstreetbets/comments/jsa1wa/low_temp_freezer_companies/,1605108323.0,"{'author': 'Beast0045', 'created_utc': 1605108323, 'title': 'Low temp freezer companies', 'url': 'https://www.reddit.com/r/wallstreetbets/comments/jsa1wa/low_temp_freezer_companies/', 'created': 1605108323.0}",2020-11-11 15:25:23
27,EdwardMauer,1605108290,Alright fess up. Which one of you degens has this wall of an order running?,https://www.reddit.com/r/wallstreetbets/comments/jsa1j2/alright_fess_up_which_one_of_you_degens_has_this/,1605108290.0,"{'author': 'EdwardMauer', 'created_utc': 1605108290, 'title': 'Alright fess up. Which one of you degens has this wall of an order running?', 'url': 'https://www.reddit.com/r/wallstreetbets/comments/jsa1j2/alright_fess_up_which_one_of_you_degens_has_this/', 'created': 1605108290.0}",2020-11-11 15:24:50
28,undernoillusions,1605108075,New to this shit. Why is 1D return negative today despite the stock price is climbing?,https://i.redd.it/o3opnfjvomy51.jpg,1605108075.0,"{'author': 'undernoillusions', 'created_utc': 1605108075, 'title': 'New to this shit. Why is 1D return negative today despite the stock price is climbing?', 'url': 'https://i.redd.it/o3opnfjvomy51.jpg', 'created': 1605108075.0}",2020-11-11 15:21:15
29,mkaykov,1605108027,An example of IV crush stealing all the tendies. RKT puts and calls - after earnings yesterday.,https://www.reddit.com/gallery/js9ypz,1605108027.0,"{'author': 'mkaykov', 'created_utc': 1605108027, 'title': 'An example of IV crush stealing all the tendies. RKT puts and calls - after earnings yesterday.', 'url': 'https://www.reddit.com/gallery/js9ypz', 'created': 1605108027.0}",2020-11-11 15:20:27
30,TheOptionsBettor,1605108025,Can I hold my nio 11/20 calls or will theta rape my bum?,https://www.reddit.com/r/wallstreetbets/comments/js9yp5/can_i_hold_my_nio_1120_calls_or_will_theta_rape/,1605108025.0,"{'author': 'TheOptionsBettor', 'created_utc': 1605108025, 'title': 'Can I hold my nio 11/20 calls or will theta rape my bum?', 'url': 'https://www.reddit.com/r/wallstreetbets/comments/js9yp5/can_i_hold_my_nio_1120_calls_or_will_theta_rape/', 'created': 1605108025.0}",2020-11-11 15:20:25
31,PersimmonTurbulent40,1605108003,Buying weekly call options after huge dip,https://www.reddit.com/r/wallstreetbets/comments/js9yge/buying_weekly_call_options_after_huge_dip/,1605108003.0,"{'author': 'PersimmonTurbulent40', 'created_utc': 1605108003, 'title': 'Buying weekly call options after huge dip', 'url': 'https://www.reddit.com/r/wallstreetbets/comments/js9yge/buying_weekly_call_options_after_huge_dip/', 'created': 1605108003.0}",2020-11-11 15:20:03
32,Diimiitrii7,1605107662,I’m new here. What should I throw $1000 dollars on right now ?,https://www.reddit.com/r/wallstreetbets/comments/js9uvx/im_new_here_what_should_i_throw_1000_dollars_on/,1605107662.0,"{'author': 'Diimiitrii7', 'created_utc': 1605107662, 'title': 'I’m new here. What should I throw $1000 dollars on right now ?', 'url': 'https://www.reddit.com/r/wallstreetbets/comments/js9uvx/im_new_here_what_should_i_throw_1000_dollars_on/', 'created': 1605107662.0}",2020-11-11 15:14:22
33,Cold-Cash-1842,1605107617,PLTR update - Tendie bouf / suppository Wendy’s,https://i.redd.it/eb5l4rninmy51.jpg,1605107617.0,"{'author': 'Cold-Cash-1842', 'created_utc': 1605107617, 'title': 'PLTR update - Tendie bouf / suppository Wendy’s', 'url': 'https://i.redd.it/eb5l4rninmy51.jpg', 'created': 1605107617.0}",2020-11-11 15:13:37
34,adamdropshipping,1605107532,Invest in this stock 100% gain next week,https://www.reddit.com/r/wallstreetbets/comments/js9tjo/invest_in_this_stock_100_gain_next_week/,1605107532.0,"{'author': 'adamdropshipping', 'created_utc': 1605107532, 'title': 'Invest in this stock 100% gain next week', 'url': 'https://www.reddit.com/r/wallstreetbets/comments/js9tjo/invest_in_this_stock_100_gain_next_week/', 'created': 1605107532.0}",2020-11-11 15:12:12
35,SnooPaintings8503,1605107483,Day Trading Options - Day 2,https://i.redd.it/w9k5dr84nmy51.jpg,1605107483.0,"{'author': 'SnooPaintings8503', 'created_utc': 1605107483, 'title': 'Day Trading Options - Day 2', 'url': 'https://i.redd.it/w9k5dr84nmy51.jpg', 'created': 1605107483.0}",2020-11-11 15:11:23
36,sam_mufasa_,1605107188,Do you take days off when you make too fast of a profit ?,https://www.reddit.com/r/wallstreetbets/comments/js9puk/do_you_take_days_off_when_you_make_too_fast_of_a/,1605107188.0,"{'author': 'sam_mufasa_', 'created_utc': 1605107188, 'title': 'Do you take days off when you make too fast of a profit ?', 'url': 'https://www.reddit.com/r/wallstreetbets/comments/js9puk/do_you_take_days_off_when_you_make_too_fast_of_a/', 'created': 1605107188.0}",2020-11-11 15:06:28
37,ke263565,1605107188,Nio puts to zm call. Yolo and done. For now.,https://v.redd.it/6eoflvg5mmy51,1605107188.0,"{'author': 'ke263565', 'created_utc': 1605107188, 'title': 'Nio puts to zm call. Yolo and done. For now.', 'url': 'https://v.redd.it/6eoflvg5mmy51', 'created': 1605107188.0}",2020-11-11 15:06:28
38,Imzyfed,1605107101,Small epic comeback after being a noob at the stock market,https://i.redd.it/ydghn5czlmy51.jpg,1605107101.0,"{'author': 'Imzyfed', 'created_utc': 1605107101, 'title': 'Small epic comeback after being a noob at the stock market', 'url': 'https://i.redd.it/ydghn5czlmy51.jpg', 'created': 1605107101.0}",2020-11-11 15:05:01
39,TheOptionsBettor,1605107058,Calls please hit,https://i.redd.it/1fru51tulmy51.jpg,1605107058.0,"{'author': 'TheOptionsBettor', 'created_utc': 1605107058, 'title': 'Calls please hit', 'url': 'https://i.redd.it/1fru51tulmy51.jpg', 'created': 1605107058.0}",2020-11-11 15:04:18
40,dadwhomstfucks12,1605106957,Sundial Growers?,https://www.reddit.com/r/wallstreetbets/comments/js9naq/sundial_growers/,1605106957.0,"{'author': 'dadwhomstfucks12', 'created_utc': 1605106957, 'title': 'Sundial Growers?', 'url': 'https://www.reddit.com/r/wallstreetbets/comments/js9naq/sundial_growers/', 'created': 1605106957.0}",2020-11-11 15:02:37
41,iWillAnnoyYouBadly,1605106944,SPCE Virgin Galactic to the moon on a successful test flight next week?,https://www.reddit.com/r/wallstreetbets/comments/js9n6k/spce_virgin_galactic_to_the_moon_on_a_successful/,1605106944.0,"{'author': 'iWillAnnoyYouBadly', 'created_utc': 1605106944, 'title': 'SPCE Virgin Galactic to the moon on a successful test flight next week?', 'url': 'https://www.reddit.com/r/wallstreetbets/comments/js9n6k/spce_virgin_galactic_to_the_moon_on_a_successful/', 'created': 1605106944.0}",2020-11-11 15:02:24
42,ABA61,1605106891,Honda (HMC) will mass produce level 3 autonomous cars by March 2021.,https://www.reuters.com/article/us-honda-autonomous-level3/honda-says-will-be-first-to-mass-produce-level-3-autonomous-cars-idUSKBN27R0LV,1605106891.0,"{'author': 'ABA61', 'created_utc': 1605106891, 'title': 'Honda (HMC) will mass produce level 3 autonomous cars by March 2021.', 'url': 'https://www.reuters.com/article/us-honda-autonomous-level3/honda-says-will-be-first-to-mass-produce-level-3-autonomous-cars-idUSKBN27R0LV', 'created': 1605106891.0}",2020-11-11 15:01:31
43,Pat_Mawenni,1605106790,I’m seeing no good plays on the Sub RN lmk your plays down below,https://www.reddit.com/r/wallstreetbets/comments/js9lhs/im_seeing_no_good_plays_on_the_sub_rn_lmk_your/,1605106790.0,"{'author': 'Pat_Mawenni', 'created_utc': 1605106790, 'title': 'I’m seeing no good plays on the Sub RN lmk your plays down below', 'url': 'https://www.reddit.com/r/wallstreetbets/comments/js9lhs/im_seeing_no_good_plays_on_the_sub_rn_lmk_your/', 'created': 1605106790.0}",2020-11-11 14:59:50
44,KJKleins,1605106714,Went boomer and bought stock.... Fucking bullshit 200@$50.60,https://i.redd.it/0ir575bikmy51.png,1605106714.0,"{'author': 'KJKleins', 'created_utc': 1605106714, 'title': 'Went boomer and bought stock.... Fucking bullshit 200@$50.60', 'url': 'https://i.redd.it/0ir575bikmy51.png', 'created': 1605106714.0}",2020-11-11 14:58:34
45,xIAmethystIx,1605106607,"Okay so basically, this happened. Hopeful for PLTR. RKT hopefully goes up by next week at least to 25...",https://www.reddit.com/gallery/js9jns,1605106607.0,"{'author': 'xIAmethystIx', 'created_utc': 1605106607, 'title': 'Okay so basically, this happened. Hopeful for PLTR. RKT hopefully goes up by next week at least to 25...', 'url': 'https://www.reddit.com/gallery/js9jns', 'created': 1605106607.0}",2020-11-11 14:56:47
46,RowanHarley,1605106187,"To the retard who bought calls on FPRX, Congrats. You're stock is up 300%",https://www.reddit.com/r/wallstreetbets/comments/js9fdn/to_the_retard_who_bought_calls_on_fprx_congrats/,1605106187.0,"{'author': 'RowanHarley', 'created_utc': 1605106187, 'title': ""To the retard who bought calls on FPRX, Congrats. You're stock is up 300%"", 'url': 'https://www.reddit.com/r/wallstreetbets/comments/js9fdn/to_the_retard_who_bought_calls_on_fprx_congrats/', 'created': 1605106187.0}",2020-11-11 14:49:47
47,Bigglosepoppa69,1605106143,Small YOLO,https://www.reddit.com/r/wallstreetbets/comments/js9exu/small_yolo/,1605106143.0,"{'author': 'Bigglosepoppa69', 'created_utc': 1605106143, 'title': 'Small YOLO', 'url': 'https://www.reddit.com/r/wallstreetbets/comments/js9exu/small_yolo/', 'created': 1605106143.0}",2020-11-11 14:49:03
48,yettithmettith,1605106111,Am I just a moron or are these Corsair debit spreads a fucking steal,https://www.reddit.com/r/wallstreetbets/comments/js9ema/am_i_just_a_moron_or_are_these_corsair_debit/,1605106111.0,"{'author': 'yettithmettith', 'created_utc': 1605106111, 'title': 'Am I just a moron or are these Corsair debit spreads a fucking steal', 'url': 'https://www.reddit.com/r/wallstreetbets/comments/js9ema/am_i_just_a_moron_or_are_these_corsair_debit/', 'created': 1605106111.0}",2020-11-11 14:48:31
49,Antonygrowsup,1605106100,No one else playing the obvious $SPHD,https://i.redd.it/51fzsla0jmy51.jpg,1605106100.0,"{'author': 'Antonygrowsup', 'created_utc': 1605106100, 'title': 'No one else playing the obvious $SPHD', 'url': 'https://i.redd.it/51fzsla0jmy51.jpg', 'created': 1605106100.0}",2020-11-11 14:48:20
50,Swinghodler,1605106090,The experts have spoken,https://i.redd.it/0ckuyt6zimy51.jpg,1605106090.0,"{'author': 'Swinghodler', 'created_utc': 1605106090, 'title': 'The experts have spoken', 'url': 'https://i.redd.it/0ckuyt6zimy51.jpg', 'created': 1605106090.0}",2020-11-11 14:48:10
51,SpicyBeanBoy2,1605106072,Waking up to NIO this morning,https://v.redd.it/8wcc0citimy51,1605106072.0,"{'author': 'SpicyBeanBoy2', 'created_utc': 1605106072, 'title': 'Waking up to NIO this morning', 'url': 'https://v.redd.it/8wcc0citimy51', 'created': 1605106072.0}",2020-11-11 14:47:52
52,SniperViperV2,1605106025,"I saw ""Elastisearch"" on several tech job posting I'm interested in throughout London. Spreads with approx 20k riding. Enough for me to jump in Long!",https://i.redd.it/hzcr4p1simy51.jpg,1605106025.0,"{'author': 'SniperViperV2', 'created_utc': 1605106025, 'title': 'I saw ""Elastisearch"" on several tech job posting I\'m interested in throughout London. Spreads with approx 20k riding. Enough for me to jump in Long!', 'url': 'https://i.redd.it/hzcr4p1simy51.jpg', 'created': 1605106025.0}",2020-11-11 14:47:05
53,weliveina_simulation,1605105947,Nothing Can Stop What Is Coming - GME,https://www.reddit.com/r/wallstreetbets/comments/js9cys/nothing_can_stop_what_is_coming_gme/,1605105947.0,"{'author': 'weliveina_simulation', 'created_utc': 1605105947, 'title': 'Nothing Can Stop What Is Coming - GME', 'url': 'https://www.reddit.com/r/wallstreetbets/comments/js9cys/nothing_can_stop_what_is_coming_gme/', 'created': 1605105947.0}",2020-11-11 14:45:47
54,dadwhomstfucks12,1605105945,Sundial Growers,https://www.reddit.com/r/wallstreetbets/comments/js9cy6/sundial_growers/,1605105945.0,"{'author': 'dadwhomstfucks12', 'created_utc': 1605105945, 'title': 'Sundial Growers', 'url': 'https://www.reddit.com/r/wallstreetbets/comments/js9cy6/sundial_growers/', 'created': 1605105945.0}",2020-11-11 14:45:45
55,PennyStonks94,1605105936,Hey I’m 15 years old and my cousin opened me a brokerage account on WeBull. Do you guys have any advice for me here thanks!❤️,https://www.reddit.com/r/wallstreetbets/comments/js9cv0/hey_im_15_years_old_and_my_cousin_opened_me_a/,1605105936.0,"{'author': 'PennyStonks94', 'created_utc': 1605105936, 'title': 'Hey I’m 15 years old and my cousin opened me a brokerage account on WeBull. Do you guys have any advice for me here thanks!❤️', 'url': 'https://www.reddit.com/r/wallstreetbets/comments/js9cv0/hey_im_15_years_old_and_my_cousin_opened_me_a/', 'created': 1605105936.0}",2020-11-11 14:45:36
56,Alternative-Bell-439,1605105851,Fuck my life,https://i.redd.it/hxsktdl9imy51.jpg,1605105851.0,"{'author': 'Alternative-Bell-439', 'created_utc': 1605105851, 'title': 'Fuck my life', 'url': 'https://i.redd.it/hxsktdl9imy51.jpg', 'created': 1605105851.0}",2020-11-11 14:44:11
57,psychedelicrebel13,1605105818,Robinhood gang lets gooo,https://www.reddit.com/r/wallstreetbets/comments/js9bow/robinhood_gang_lets_gooo/,1605105818.0,"{'author': 'psychedelicrebel13', 'created_utc': 1605105818, 'title': 'Robinhood gang lets gooo', 'url': 'https://www.reddit.com/r/wallstreetbets/comments/js9bow/robinhood_gang_lets_gooo/', 'created': 1605105818.0}",2020-11-11 14:43:38
58,psychedelicrebel13,1605105818,Robinhood gang lets gooo,https://www.reddit.com/r/wallstreetbets/comments/js9bou/robinhood_gang_lets_gooo/,1605105818.0,"{'author': 'psychedelicrebel13', 'created_utc': 1605105818, 'title': 'Robinhood gang lets gooo', 'url': 'https://www.reddit.com/r/wallstreetbets/comments/js9bou/robinhood_gang_lets_gooo/', 'created': 1605105818.0}",2020-11-11 14:43:38
59,psychedelicrebel13,1605105817,Robinhood gang lets gooo,https://www.reddit.com/r/wallstreetbets/comments/js9boi/robinhood_gang_lets_gooo/,1605105817.0,"{'author': 'psychedelicrebel13', 'created_utc': 1605105817, 'title': 'Robinhood gang lets gooo', 'url': 'https://www.reddit.com/r/wallstreetbets/comments/js9boi/robinhood_gang_lets_gooo/', 'created': 1605105817.0}",2020-11-11 14:43:37
60,psychedelicrebel13,1605105817,Robinhood gang lets gooo,https://www.reddit.com/r/wallstreetbets/comments/js9bo9/robinhood_gang_lets_gooo/,1605105817.0,"{'author': 'psychedelicrebel13', 'created_utc': 1605105817, 'title': 'Robinhood gang lets gooo', 'url': 'https://www.reddit.com/r/wallstreetbets/comments/js9bo9/robinhood_gang_lets_gooo/', 'created': 1605105817.0}",2020-11-11 14:43:37
61,psychedelicrebel13,1605105813,Robinhood gang lets gooo,https://www.reddit.com/r/wallstreetbets/comments/js9bn7/robinhood_gang_lets_gooo/,1605105813.0,"{'author': 'psychedelicrebel13', 'created_utc': 1605105813, 'title': 'Robinhood gang lets gooo', 'url': 'https://www.reddit.com/r/wallstreetbets/comments/js9bn7/robinhood_gang_lets_gooo/', 'created': 1605105813.0}",2020-11-11 14:43:33
62,psychedelicrebel13,1605105809,Robinhood gang lets gooo,https://www.reddit.com/r/wallstreetbets/comments/js9bll/robinhood_gang_lets_gooo/,1605105809.0,"{'author': 'psychedelicrebel13', 'created_utc': 1605105809, 'title': 'Robinhood gang lets gooo', 'url': 'https://www.reddit.com/r/wallstreetbets/comments/js9bll/robinhood_gang_lets_gooo/', 'created': 1605105809.0}",2020-11-11 14:43:29
