,author,created_utc,title,url,created,d_,created_utc_dt
63,cuki321,1598680298,"Roses are red. Violets are blue. Green, you’re good. Red, you’re screwed.",https://v.redd.it/9g6ucgrqrvj51,1598680298.0,"{'author': 'cuki321', 'created_utc': 1598680298, 'title': 'Roses are red. Violets are blue. Green, you’re good. Red, you’re screwed.', 'url': 'https://v.redd.it/9g6ucgrqrvj51', 'created': 1598680298.0}",2020-08-29 05:51:38
64,goingtodeleteaccount,1598680284,I actually lost 191% but I added more money into the account,https://i.redd.it/qwbpit9rrvj51.jpg,1598680284.0,"{'author': 'goingtodeleteaccount', 'created_utc': 1598680284, 'title': 'I actually lost 191% but I added more money into the account', 'url': 'https://i.redd.it/qwbpit9rrvj51.jpg', 'created': 1598680284.0}",2020-08-29 05:51:24
65,MidniteOG,1598680189,Retail info,https://www.reddit.com/r/wallstreetbets/comments/iinan4/retail_info/,1598680189.0,"{'author': 'MidniteOG', 'created_utc': 1598680189, 'title': 'Retail info', 'url': 'https://www.reddit.com/r/wallstreetbets/comments/iinan4/retail_info/', 'created': 1598680189.0}",2020-08-29 05:49:49
66,notBKnoob,1598680054,Down almost 6k Holding on by a thread. Wish me luck boisss,https://www.reddit.com/gallery/iin9qn,1598680054.0,"{'author': 'notBKnoob', 'created_utc': 1598680054, 'title': 'Down almost 6k Holding on by a thread. Wish me luck boisss', 'url': 'https://www.reddit.com/gallery/iin9qn', 'created': 1598680054.0}",2020-08-29 05:47:34
67,Mountain-Dig,1598679982,My best ideas: CHWY and CWH,https://www.reddit.com/r/wallstreetbets/comments/iin99v/my_best_ideas_chwy_and_cwh/,1598679982.0,"{'author': 'Mountain-Dig', 'created_utc': 1598679982, 'title': 'My best ideas: CHWY and CWH', 'url': 'https://www.reddit.com/r/wallstreetbets/comments/iin99v/my_best_ideas_chwy_and_cwh/', 'created': 1598679982.0}",2020-08-29 05:46:22
68,Stevemd410,1598679857,Stocks with the most upside,https://www.reddit.com/r/wallstreetbets/comments/iin8fa/stocks_with_the_most_upside/,1598679857.0,"{'author': 'Stevemd410', 'created_utc': 1598679857, 'title': 'Stocks with the most upside', 'url': 'https://www.reddit.com/r/wallstreetbets/comments/iin8fa/stocks_with_the_most_upside/', 'created': 1598679857.0}",2020-08-29 05:44:17
69,ecfadi,1598679583,Can You Pass This 9 Questions In Financial Literacy?,https://www.financeandsavings.com/9-quiz-questions-in-financial-literacy/,1598679583.0,"{'author': 'ecfadi', 'created_utc': 1598679583, 'title': 'Can You Pass This 9 Questions In Financial Literacy?', 'url': 'https://www.financeandsavings.com/9-quiz-questions-in-financial-literacy/', 'created': 1598679583.0}",2020-08-29 05:39:43
70,itsamplifly,1598679281,Am I the only retard who typed in ROPE trying to find the stock....,https://www.reddit.com/r/wallstreetbets/comments/iin4hx/am_i_the_only_retard_who_typed_in_rope_trying_to/,1598679281.0,"{'author': 'itsamplifly', 'created_utc': 1598679281, 'title': 'Am I the only retard who typed in ROPE trying to find the stock....', 'url': 'https://www.reddit.com/r/wallstreetbets/comments/iin4hx/am_i_the_only_retard_who_typed_in_rope_trying_to/', 'created': 1598679281.0}",2020-08-29 05:34:41
71,JediMindTrick188,1598679202,"Hi, professional dumbass who only submits to small street bets, what the hell is calls, puts, and positions?",https://www.reddit.com/r/wallstreetbets/comments/iin3yj/hi_professional_dumbass_who_only_submits_to_small/,1598679202.0,"{'author': 'JediMindTrick188', 'created_utc': 1598679202, 'title': 'Hi, professional dumbass who only submits to small street bets, what the hell is calls, puts, and positions?', 'url': 'https://www.reddit.com/r/wallstreetbets/comments/iin3yj/hi_professional_dumbass_who_only_submits_to_small/', 'created': 1598679202.0}",2020-08-29 05:33:22
72,IBreakLegends,1598679119,Good job retards,https://i.redd.it/oqdyuilaovj51.jpg,1598679119.0,"{'author': 'IBreakLegends', 'created_utc': 1598679119, 'title': 'Good job retards', 'url': 'https://i.redd.it/oqdyuilaovj51.jpg', 'created': 1598679119.0}",2020-08-29 05:31:59
73,Sebastipole,1598679094,Can this Aussie join in on the autism?,https://i.redd.it/za3rgxs7ovj51.jpg,1598679094.0,"{'author': 'Sebastipole', 'created_utc': 1598679094, 'title': 'Can this Aussie join in on the autism?', 'url': 'https://i.redd.it/za3rgxs7ovj51.jpg', 'created': 1598679094.0}",2020-08-29 05:31:34
74,jdfic,1598678635,lord and savior Jerome Powell seeing dark hell in forward guidance,https://i.redd.it/zw0ku1s8kvj51.png,1598678635.0,"{'author': 'jdfic', 'created_utc': 1598678635, 'title': 'lord and savior Jerome Powell seeing dark hell in forward guidance', 'url': 'https://i.redd.it/zw0ku1s8kvj51.png', 'created': 1598678635.0}",2020-08-29 05:23:55
75,poopdick69yoloswag,1598678344,WSB IRL,https://i.redd.it/jxk8tkoflvj51.jpg,1598678344.0,"{'author': 'poopdick69yoloswag', 'created_utc': 1598678344, 'title': 'WSB IRL', 'url': 'https://i.redd.it/jxk8tkoflvj51.jpg', 'created': 1598678344.0}",2020-08-29 05:19:04
76,wjin0352,1598677714,abt otms not a bad way to spend 2k,https://i.redd.it/hm4tom0rjvj51.png,1598677714.0,"{'author': 'wjin0352', 'created_utc': 1598677714, 'title': 'abt otms not a bad way to spend 2k', 'url': 'https://i.redd.it/hm4tom0rjvj51.png', 'created': 1598677714.0}",2020-08-29 05:08:34
77,PapaJayThree,1598677698,I am a WSB slave,https://www.reddit.com/r/wallstreetbets/comments/iimt6f/i_am_a_wsb_slave/,1598677698.0,"{'author': 'PapaJayThree', 'created_utc': 1598677698, 'title': 'I am a WSB slave', 'url': 'https://www.reddit.com/r/wallstreetbets/comments/iimt6f/i_am_a_wsb_slave/', 'created': 1598677698.0}",2020-08-29 05:08:18
78,Etong123,1598677657,I was green this entire month on my 1K trading challenge!,https://v.redd.it/pabjzxrxjvj51,1598677657.0,"{'author': 'Etong123', 'created_utc': 1598677657, 'title': 'I was green this entire month on my 1K trading challenge!', 'url': 'https://v.redd.it/pabjzxrxjvj51', 'created': 1598677657.0}",2020-08-29 05:07:37
79,unpopulrOpini0n,1598677311,"Thinking about buying ITM SPY LEAP Puts, am I autistic, or retarded?",https://www.reddit.com/r/wallstreetbets/comments/iimqdj/thinking_about_buying_itm_spy_leap_puts_am_i/,1598677311.0,"{'author': 'unpopulrOpini0n', 'created_utc': 1598677311, 'title': 'Thinking about buying ITM SPY LEAP Puts, am I autistic, or retarded?', 'url': 'https://www.reddit.com/r/wallstreetbets/comments/iimqdj/thinking_about_buying_itm_spy_leap_puts_am_i/', 'created': 1598677311.0}",2020-08-29 05:01:51
80,Matrix10011,1598676443,Petition to replace daddy elon with daddy bezos.,https://www.reddit.com/r/wallstreetbets/comments/iimjzr/petition_to_replace_daddy_elon_with_daddy_bezos/,1598676443.0,"{'author': 'Matrix10011', 'created_utc': 1598676443, 'title': 'Petition to replace daddy elon with daddy bezos.', 'url': 'https://www.reddit.com/r/wallstreetbets/comments/iimjzr/petition_to_replace_daddy_elon_with_daddy_bezos/', 'created': 1598676443.0}",2020-08-29 04:47:23
81,anonrektard,1598676327,We're infamous boys,https://www.youtube.com/watch?v=kRkFbwbUg6w&amp;t=6m33s,1598676327.0,"{'author': 'anonrektard', 'created_utc': 1598676327, 'title': ""We're infamous boys"", 'url': 'https://www.youtube.com/watch?v=kRkFbwbUg6w&amp;t=6m33s', 'created': 1598676327.0}",2020-08-29 04:45:27
82,gndoty,1598676087,Get In Degenerates - We're Going to SPY 434,https://www.reddit.com/r/wallstreetbets/comments/iimh9p/get_in_degenerates_were_going_to_spy_434/,1598676087.0,"{'author': 'gndoty', 'created_utc': 1598676087, 'title': ""Get In Degenerates - We're Going to SPY 434"", 'url': 'https://www.reddit.com/r/wallstreetbets/comments/iimh9p/get_in_degenerates_were_going_to_spy_434/', 'created': 1598676087.0}",2020-08-29 04:41:27
83,Jarteks_Alt,1598676008,"The Real Big Short - I'm Going To Take Out Over 30,000$ in Debt To Buy 6 DEC 16 2022 SPY 380 Puts",https://www.reddit.com/r/wallstreetbets/comments/iimgmh/the_real_big_short_im_going_to_take_out_over/,1598676008.0,"{'author': 'Jarteks_Alt', 'created_utc': 1598676008, 'title': ""The Real Big Short - I'm Going To Take Out Over 30,000$ in Debt To Buy 6 DEC 16 2022 SPY 380 Puts"", 'url': 'https://www.reddit.com/r/wallstreetbets/comments/iimgmh/the_real_big_short_im_going_to_take_out_over/', 'created': 1598676008.0}",2020-08-29 04:40:08
84,SteveReddon,1598675693,Hamster Prison Break Game,https://www.igorbnews.com/2020/08/hamster-prison-break-game.html,1598675693.0,"{'author': 'SteveReddon', 'created_utc': 1598675693, 'title': 'Hamster Prison Break Game', 'url': 'https://www.igorbnews.com/2020/08/hamster-prison-break-game.html', 'created': 1598675693.0}",2020-08-29 04:34:53
85,jbadcrew,1598675691,100% all in TSLA @ $963. This is how I win,https://i.redd.it/vicsgyb2evj51.png,1598675691.0,"{'author': 'jbadcrew', 'created_utc': 1598675691, 'title': '100% all in TSLA @ $963. This is how I win', 'url': 'https://i.redd.it/vicsgyb2evj51.png', 'created': 1598675691.0}",2020-08-29 04:34:51
86,wallstreet_cfa,1598675531,Alright guys how much Is my ass getting gapped by tesla next week? Should I hold or sell it?,https://i.redd.it/ugxsc4imdvj51.jpg,1598675531.0,"{'author': 'wallstreet_cfa', 'created_utc': 1598675531, 'title': 'Alright guys how much Is my ass getting gapped by tesla next week? Should I hold or sell it?', 'url': 'https://i.redd.it/ugxsc4imdvj51.jpg', 'created': 1598675531.0}",2020-08-29 04:32:11
87,JeremyJWinter,1598675169,"I'm not good with the 1's and 2's, but I think I overpaid.",https://i.redd.it/4fllro5icvj51.png,1598675169.0,"{'author': 'JeremyJWinter', 'created_utc': 1598675169, 'title': ""I'm not good with the 1's and 2's, but I think I overpaid."", 'url': 'https://i.redd.it/4fllro5icvj51.png', 'created': 1598675169.0}",2020-08-29 04:26:09
88,LowPossibility2792,1598675065,Sign up for free and earn a new crypto before it enters ICO. Use my code (Slayffin) to earn free PI today!,https://minepi.com/Slayffinandusemyusername(Slayffin)asyourinvitationcode.,1598675065.0,"{'author': 'LowPossibility2792', 'created_utc': 1598675065, 'title': 'Sign up for free and earn a new crypto before it enters ICO. Use my code (Slayffin) to earn free PI today!', 'url': 'https://minepi.com/Slayffinandusemyusername(Slayffin)asyourinvitationcode.', 'created': 1598675065.0}",2020-08-29 04:24:25
89,MrHindoG,1598674935,Guaranteed profit strat with Tesla,https://www.reddit.com/r/wallstreetbets/comments/iim8h7/guaranteed_profit_strat_with_tesla/,1598674935.0,"{'author': 'MrHindoG', 'created_utc': 1598674935, 'title': 'Guaranteed profit strat with Tesla', 'url': 'https://www.reddit.com/r/wallstreetbets/comments/iim8h7/guaranteed_profit_strat_with_tesla/', 'created': 1598674935.0}",2020-08-29 04:22:15
90,Ap32001,1598674652,DOCRF and the future of Telehealth,https://www.reddit.com/r/wallstreetbets/comments/iim6ad/docrf_and_the_future_of_telehealth/,1598674652.0,"{'author': 'Ap32001', 'created_utc': 1598674652, 'title': 'DOCRF and the future of Telehealth', 'url': 'https://www.reddit.com/r/wallstreetbets/comments/iim6ad/docrf_and_the_future_of_telehealth/', 'created': 1598674652.0}",2020-08-29 04:17:32
91,VisualResidual,1598674620,"WELP, TIME TO GO LONG $ROPE",https://i.redd.it/zq5vg8ywavj51.jpg,1598674620.0,"{'author': 'VisualResidual', 'created_utc': 1598674620, 'title': 'WELP, TIME TO GO LONG $ROPE', 'url': 'https://i.redd.it/zq5vg8ywavj51.jpg', 'created': 1598674620.0}",2020-08-29 04:17:00
92,WorestFittaker,1598674336,Bears on Parade.,https://i.redd.it/qs15mkf2avj51.jpg,1598674336.0,"{'author': 'WorestFittaker', 'created_utc': 1598674336, 'title': 'Bears on Parade.', 'url': 'https://i.redd.it/qs15mkf2avj51.jpg', 'created': 1598674336.0}",2020-08-29 04:12:16
93,redditvillageidiot,1598673906,So a retard goes into a bar and buys all stocks via cashapp...,https://www.reddit.com/r/wallstreetbets/comments/iim0da/so_a_retard_goes_into_a_bar_and_buys_all_stocks/,1598673906.0,"{'author': 'redditvillageidiot', 'created_utc': 1598673906, 'title': 'So a retard goes into a bar and buys all stocks via cashapp...', 'url': 'https://www.reddit.com/r/wallstreetbets/comments/iim0da/so_a_retard_goes_into_a_bar_and_buys_all_stocks/', 'created': 1598673906.0}",2020-08-29 04:05:06
94,cuki321,1598673884,"Roses are red. Violets are blue. Green, you’re good. Red, you’re screwed.",https://v.redd.it/cwzq1oio8vj51,1598673884.0,"{'author': 'cuki321', 'created_utc': 1598673884, 'title': 'Roses are red. Violets are blue. Green, you’re good. Red, you’re screwed.', 'url': 'https://v.redd.it/cwzq1oio8vj51', 'created': 1598673884.0}",2020-08-29 04:04:44
95,cuki321,1598673580,"Roses are red. Violets are blue. Green, you’re good. Red, you’re screwed.",https://v.redd.it/7yjbc76m7vj51,1598673580.0,"{'author': 'cuki321', 'created_utc': 1598673580, 'title': 'Roses are red. Violets are blue. Green, you’re good. Red, you’re screwed.', 'url': 'https://v.redd.it/7yjbc76m7vj51', 'created': 1598673580.0}",2020-08-29 03:59:40
96,thelonerainer,1598673409,the essence of WSB,https://v.redd.it/n6jw11u87vj51,1598673409.0,"{'author': 'thelonerainer', 'created_utc': 1598673409, 'title': 'the essence of WSB', 'url': 'https://v.redd.it/n6jw11u87vj51', 'created': 1598673409.0}",2020-08-29 03:56:49
97,PotatoTrader1,1598673301,Is Tesla a proxy for the value of all of Elon's companies?,https://www.reddit.com/r/wallstreetbets/comments/iilvr7/is_tesla_a_proxy_for_the_value_of_all_of_elons/,1598673301.0,"{'author': 'PotatoTrader1', 'created_utc': 1598673301, 'title': ""Is Tesla a proxy for the value of all of Elon's companies?"", 'url': 'https://www.reddit.com/r/wallstreetbets/comments/iilvr7/is_tesla_a_proxy_for_the_value_of_all_of_elons/', 'created': 1598673301.0}",2020-08-29 03:55:01
98,jacobcabral13,1598673290,idk what to do now..,https://i.imgur.com/hZvozAN.png,1598673290.0,"{'author': 'jacobcabral13', 'created_utc': 1598673290, 'title': 'idk what to do now..', 'url': 'https://i.imgur.com/hZvozAN.png', 'created': 1598673290.0}",2020-08-29 03:54:50
99,WingKongTradingCo,1598673184,Average Bull of course,https://i.redd.it/wczi2nan6vj51.jpg,1598673184.0,"{'author': 'WingKongTradingCo', 'created_utc': 1598673184, 'title': 'Average Bull of course', 'url': 'https://i.redd.it/wczi2nan6vj51.jpg', 'created': 1598673184.0}",2020-08-29 03:53:04
