,author,created_utc,title,url,created,d_,created_utc_dt
68,Suspicious_Pizza_429,1612753052,*******monitor discussions on message boards,https://www.reddit.com/r/wallstreetbets/comments/lf2bky/monitor_discussions_on_message_boards/,1612753052.0,"{'author': 'Suspicious_Pizza_429', 'created_utc': 1612753052, 'title': '*******monitor discussions on message boards', 'url': 'https://www.reddit.com/r/wallstreetbets/comments/lf2bky/monitor_discussions_on_message_boards/', 'created': 1612753052.0}",2021-02-08 02:57:32
69,ThenMedia9010,1612753045,Fucking Robinhood,https://www.reddit.com/r/wallstreetbets/comments/lf2bhx/fucking_robinhood/,1612753045.0,"{'author': 'ThenMedia9010', 'created_utc': 1612753045, 'title': 'Fucking Robinhood', 'url': 'https://www.reddit.com/r/wallstreetbets/comments/lf2bhx/fucking_robinhood/', 'created': 1612753045.0}",2021-02-08 02:57:25
70,[deleted],1612753042,"Hey everybidy, iTs mE GME JaCk!! GOod LucK oN oUR mOOn riDe tHis wEek!",https://i.redd.it/rxr1lmha56g61.jpg,1612753042.0,"{'author': '[deleted]', 'created_utc': 1612753042, 'title': 'Hey everybidy, iTs mE GME JaCk!! GOod LucK oN oUR mOOn riDe tHis wEek!', 'url': 'https://i.redd.it/rxr1lmha56g61.jpg', 'created': 1612753042.0}",2021-02-08 02:57:22
71,sembley18,1612753038,ROBINHOOD REALLY JUST TRIED TO PUT OUT AN AD SO WE’D FORGET WHAT THEY DID,https://www.reddit.com/r/wallstreetbets/comments/lf2bet/robinhood_really_just_tried_to_put_out_an_ad_so/,1612753038.0,"{'author': 'sembley18', 'created_utc': 1612753038, 'title': 'ROBINHOOD REALLY JUST TRIED TO PUT OUT AN AD SO WE’D FORGET WHAT THEY DID', 'url': 'https://www.reddit.com/r/wallstreetbets/comments/lf2bet/robinhood_really_just_tried_to_put_out_an_ad_so/', 'created': 1612753038.0}",2021-02-08 02:57:18
72,KnightRiders7,1612753035,Did I just see Robinhood’s ad for Super Bowl?,https://www.reddit.com/r/wallstreetbets/comments/lf2bdi/did_i_just_see_robinhoods_ad_for_super_bowl/,1612753035.0,"{'author': 'KnightRiders7', 'created_utc': 1612753035, 'title': 'Did I just see Robinhood’s ad for Super Bowl?', 'url': 'https://www.reddit.com/r/wallstreetbets/comments/lf2bdi/did_i_just_see_robinhoods_ad_for_super_bowl/', 'created': 1612753035.0}",2021-02-08 02:57:15
73,hansenabram,1612753030,Robinhood did it. They put a superbowl commercial. 😡,https://www.reddit.com/r/wallstreetbets/comments/lf2bb9/robinhood_did_it_they_put_a_superbowl_commercial/,1612753030.0,"{'author': 'hansenabram', 'created_utc': 1612753030, 'title': 'Robinhood did it. They put a superbowl commercial. 😡', 'url': 'https://www.reddit.com/r/wallstreetbets/comments/lf2bb9/robinhood_did_it_they_put_a_superbowl_commercial/', 'created': 1612753030.0}",2021-02-08 02:57:10
74,fukn_meat_head,1612753027,Reddit add for those who missed it,https://www.reddit.com/r/wallstreetbets/comments/lf2ba6/reddit_add_for_those_who_missed_it/,1612753027.0,"{'author': 'fukn_meat_head', 'created_utc': 1612753027, 'title': 'Reddit add for those who missed it', 'url': 'https://www.reddit.com/r/wallstreetbets/comments/lf2ba6/reddit_add_for_those_who_missed_it/', 'created': 1612753027.0}",2021-02-08 02:57:07
75,ieathouses,1612753027,Macy’s,https://www.reddit.com/r/wallstreetbets/comments/lf2b9y/macys/,1612753027.0,"{'author': 'ieathouses', 'created_utc': 1612753027, 'title': 'Macy’s', 'url': 'https://www.reddit.com/r/wallstreetbets/comments/lf2b9y/macys/', 'created': 1612753027.0}",2021-02-08 02:57:07
76,Mrmurderporn,1612753027,Did anyone else just tell their TV to fuck off when that Robinhood commercial aired?,https://www.reddit.com/r/wallstreetbets/comments/lf2b9x/did_anyone_else_just_tell_their_tv_to_fuck_off/,1612753027.0,"{'author': 'Mrmurderporn', 'created_utc': 1612753027, 'title': 'Did anyone else just tell their TV to fuck off when that Robinhood commercial aired?', 'url': 'https://www.reddit.com/r/wallstreetbets/comments/lf2b9x/did_anyone_else_just_tell_their_tv_to_fuck_off/', 'created': 1612753027.0}",2021-02-08 02:57:07
77,Shoalhole,1612753026,"Heard WKHS might be getting some love here. Now would actually be a good time for you dummies to spike it. Honestly, I could care less.",https://www.reddit.com/r/wallstreetbets/comments/lf2b9b/heard_wkhs_might_be_getting_some_love_here_now/,1612753026.0,"{'author': 'Shoalhole', 'created_utc': 1612753026, 'title': 'Heard WKHS might be getting some love here. Now would actually be a good time for you dummies to spike it. Honestly, I could care less.', 'url': 'https://www.reddit.com/r/wallstreetbets/comments/lf2b9b/heard_wkhs_might_be_getting_some_love_here_now/', 'created': 1612753026.0}",2021-02-08 02:57:06
78,JimmyMiracle,1612753021,Are they related? vlad tenev &amp; martin shkreli,https://i.redd.it/mfuiqng356g61.png,1612753021.0,"{'author': 'JimmyMiracle', 'created_utc': 1612753021, 'title': 'Are they related? vlad tenev &amp; martin shkreli', 'url': 'https://i.redd.it/mfuiqng356g61.png', 'created': 1612753021.0}",2021-02-08 02:57:01
79,deedsishere,1612753020,Question,https://www.reddit.com/r/wallstreetbets/comments/lf2b6n/question/,1612753020.0,"{'author': 'deedsishere', 'created_utc': 1612753020, 'title': 'Question', 'url': 'https://www.reddit.com/r/wallstreetbets/comments/lf2b6n/question/', 'created': 1612753020.0}",2021-02-08 02:57:00
80,matrix_trading,1612753006,$EBON,https://www.reddit.com/r/wallstreetbets/comments/lf2b20/ebon/,1612753006.0,"{'author': 'matrix_trading', 'created_utc': 1612753006, 'title': '$EBON', 'url': 'https://www.reddit.com/r/wallstreetbets/comments/lf2b20/ebon/', 'created': 1612753006.0}",2021-02-08 02:56:46
81,berman1981,1612752997,Robinhood Commercial.... and go.....,https://www.reddit.com/r/wallstreetbets/comments/lf2ayq/robinhood_commercial_and_go/,1612752997.0,"{'author': 'berman1981', 'created_utc': 1612752997, 'title': 'Robinhood Commercial.... and go.....', 'url': 'https://www.reddit.com/r/wallstreetbets/comments/lf2ayq/robinhood_commercial_and_go/', 'created': 1612752997.0}",2021-02-08 02:56:37
82,OneMoscaTwo,1612752987,"Keep 10, Kill 1",https://www.reddit.com/r/wallstreetbets/comments/lf2ave/keep_10_kill_1/,1612752987.0,"{'author': 'OneMoscaTwo', 'created_utc': 1612752987, 'title': 'Keep 10, Kill 1', 'url': 'https://www.reddit.com/r/wallstreetbets/comments/lf2ave/keep_10_kill_1/', 'created': 1612752987.0}",2021-02-08 02:56:27
83,[deleted],1612752986,"Hey everybidy, iTs mE GME JaCk!! GOod LucK oN oUR mOOn riDe tHis wEek!",https://i.redd.it/693e329456g61.jpg,1612752986.0,"{'author': '[deleted]', 'created_utc': 1612752986, 'title': 'Hey everybidy, iTs mE GME JaCk!! GOod LucK oN oUR mOOn riDe tHis wEek!', 'url': 'https://i.redd.it/693e329456g61.jpg', 'created': 1612752986.0}",2021-02-08 02:56:26
84,kingsolomon66,1612752982,The Forecast has buy on clr at 18.85,https://theforecast.co,1612752982.0,"{'author': 'kingsolomon66', 'created_utc': 1612752982, 'title': 'The Forecast has buy on clr at 18.85', 'url': 'https://theforecast.co', 'created': 1612752982.0}",2021-02-08 02:56:22
85,funkeym0nkey,1612752972,5 second Super Bowl commercial.,https://i.redd.it/ak3ftl0356g61.jpg,1612752972.0,"{'author': 'funkeym0nkey', 'created_utc': 1612752972, 'title': '5 second Super Bowl commercial.', 'url': 'https://i.redd.it/ak3ftl0356g61.jpg', 'created': 1612752972.0}",2021-02-08 02:56:12
86,HeyMeathead,1612752946,I bought a ton of Hertz.,https://www.reddit.com/r/wallstreetbets/comments/lf2afq/i_bought_a_ton_of_hertz/,1612752946.0,"{'author': 'HeyMeathead', 'created_utc': 1612752946, 'title': 'I bought a ton of Hertz.', 'url': 'https://www.reddit.com/r/wallstreetbets/comments/lf2afq/i_bought_a_ton_of_hertz/', 'created': 1612752946.0}",2021-02-08 02:55:46
87,BroStoic,1612752944,"Hey everybidy, iTs mE GME JaCk!! GOod LucK oN oUR mOOn riDe tHis wEek!",https://i.redd.it/hh7ba0zz46g61.jpg,1612752944.0,"{'author': 'BroStoic', 'created_utc': 1612752944, 'title': 'Hey everybidy, iTs mE GME JaCk!! GOod LucK oN oUR mOOn riDe tHis wEek!', 'url': 'https://i.redd.it/hh7ba0zz46g61.jpg', 'created': 1612752944.0}",2021-02-08 02:55:44
88,hqle26,1612752941,How 'about this? Or should I raise it to $400?,https://i.redd.it/m38cd5rz46g61.jpg,1612752941.0,"{'author': 'hqle26', 'created_utc': 1612752941, 'title': ""How 'about this? Or should I raise it to $400?"", 'url': 'https://i.redd.it/m38cd5rz46g61.jpg', 'created': 1612752941.0}",2021-02-08 02:55:41
89,LeVeloursRouge,1612752916,I interviewed a hedge fund manager for a new podcast...,https://www.reddit.com/r/wallstreetbets/comments/lf2a48/i_interviewed_a_hedge_fund_manager_for_a_new/,1612752916.0,"{'author': 'LeVeloursRouge', 'created_utc': 1612752916, 'title': 'I interviewed a hedge fund manager for a new podcast...', 'url': 'https://www.reddit.com/r/wallstreetbets/comments/lf2a48/i_interviewed_a_hedge_fund_manager_for_a_new/', 'created': 1612752916.0}",2021-02-08 02:55:16
90,Lambosambo1238,1612752910,Set limits sell!,https://www.reddit.com/r/wallstreetbets/comments/lf2a1y/set_limits_sell/,1612752910.0,"{'author': 'Lambosambo1238', 'created_utc': 1612752910, 'title': 'Set limits sell!', 'url': 'https://www.reddit.com/r/wallstreetbets/comments/lf2a1y/set_limits_sell/', 'created': 1612752910.0}",2021-02-08 02:55:10
91,CappedCrib,1612752903,Made this about three weeks ago &amp; never posted it. Even funnier now because of how much the plot has thickened since,https://streamable.com/6hilpv,1612752903.0,"{'author': 'CappedCrib', 'created_utc': 1612752903, 'title': 'Made this about three weeks ago &amp; never posted it. Even funnier now because of how much the plot has thickened since', 'url': 'https://streamable.com/6hilpv', 'created': 1612752903.0}",2021-02-08 02:55:03
92,Comfortable-Box-9891,1612752877,Did a fan actually run out on the field of the Superbowl? Hope he ran out with a sign saying HOLD THE LINE!!! 💎 💎 🙌 🙌,https://www.reddit.com/r/wallstreetbets/comments/lf29oi/did_a_fan_actually_run_out_on_the_field_of_the/,1612752877.0,"{'author': 'Comfortable-Box-9891', 'created_utc': 1612752877, 'title': 'Did a fan actually run out on the field of the Superbowl? Hope he ran out with a sign saying HOLD THE LINE!!! 💎 💎 🙌 🙌', 'url': 'https://www.reddit.com/r/wallstreetbets/comments/lf29oi/did_a_fan_actually_run_out_on_the_field_of_the/', 'created': 1612752877.0}",2021-02-08 02:54:37
93,Ambugat0n,1612752870,GIVING FINACIAL ADVICE IS ILLEGAL!,https://www.reddit.com/r/wallstreetbets/comments/lf29lq/giving_finacial_advice_is_illegal/,1612752870.0,"{'author': 'Ambugat0n', 'created_utc': 1612752870, 'title': 'GIVING FINACIAL ADVICE IS ILLEGAL!', 'url': 'https://www.reddit.com/r/wallstreetbets/comments/lf29lq/giving_finacial_advice_is_illegal/', 'created': 1612752870.0}",2021-02-08 02:54:30
94,Shoalhole,1612752869,"Heard WKHS might be getting some love here. Now would actually be a good time for you dummies to spike it, but I honestly could care less if you do.",https://www.reddit.com/r/wallstreetbets/comments/lf29le/heard_wkhs_might_be_getting_some_love_here_now/,1612752869.0,"{'author': 'Shoalhole', 'created_utc': 1612752869, 'title': 'Heard WKHS might be getting some love here. Now would actually be a good time for you dummies to spike it, but I honestly could care less if you do.', 'url': 'https://www.reddit.com/r/wallstreetbets/comments/lf29le/heard_wkhs_might_be_getting_some_love_here_now/', 'created': 1612752869.0}",2021-02-08 02:54:29
95,Jehsun1,1612752865,"Haven't watched any superbowl ads, any of you retards buy out some ads for GME?",https://www.reddit.com/r/wallstreetbets/comments/lf29jo/havent_watched_any_superbowl_ads_any_of_you/,1612752865.0,"{'author': 'Jehsun1', 'created_utc': 1612752865, 'title': ""Haven't watched any superbowl ads, any of you retards buy out some ads for GME?"", 'url': 'https://www.reddit.com/r/wallstreetbets/comments/lf29jo/havent_watched_any_superbowl_ads_any_of_you/', 'created': 1612752865.0}",2021-02-08 02:54:25
96,jhetfield126,1612752857,What is the best service to sign up with to buy stocks?,https://www.reddit.com/r/wallstreetbets/comments/lf29ga/what_is_the_best_service_to_sign_up_with_to_buy/,1612752857.0,"{'author': 'jhetfield126', 'created_utc': 1612752857, 'title': 'What is the best service to sign up with to buy stocks?', 'url': 'https://www.reddit.com/r/wallstreetbets/comments/lf29ga/what_is_the_best_service_to_sign_up_with_to_buy/', 'created': 1612752857.0}",2021-02-08 02:54:17
97,[deleted],1612752803,"Found ""new"" website that analyzes stock sentiment, v useful for predictions",https://www.reddit.com/r/wallstreetbets/comments/lf28wt/found_new_website_that_analyzes_stock_sentiment_v/,1612752803.0,"{'author': '[deleted]', 'created_utc': 1612752803, 'title': 'Found ""new"" website that analyzes stock sentiment, v useful for predictions', 'url': 'https://www.reddit.com/r/wallstreetbets/comments/lf28wt/found_new_website_that_analyzes_stock_sentiment_v/', 'created': 1612752803.0}",2021-02-08 02:53:23
98,Jahshua159258,1612752803,They tryna clap us again?,https://i.redd.it/r4wuh2mk46g61.jpg,1612752803.0,"{'author': 'Jahshua159258', 'created_utc': 1612752803, 'title': 'They tryna clap us again?', 'url': 'https://i.redd.it/r4wuh2mk46g61.jpg', 'created': 1612752803.0}",2021-02-08 02:53:23
99,kingsolomon66,1612752800,Clr 21$ continental resources oil,https://www.reddit.com/r/wallstreetbets/comments/lf28v4/clr_21_continental_resources_oil/,1612752800.0,"{'author': 'kingsolomon66', 'created_utc': 1612752800, 'title': 'Clr 21$ continental resources oil', 'url': 'https://www.reddit.com/r/wallstreetbets/comments/lf28v4/clr_21_continental_resources_oil/', 'created': 1612752800.0}",2021-02-08 02:53:20
