,author,created_utc,title,url,created,d_,created_utc_dt
0,teh86,1607892129,I made this informed decision based on lots of research in WSB,https://i.redd.it/qq01ip35n0561.png,1607892129.0,"{'author': 'teh86', 'created_utc': 1607892129, 'title': 'I made this informed decision based on lots of research in WSB', 'url': 'https://i.redd.it/qq01ip35n0561.png', 'created': 1607892129.0}",2020-12-13 20:42:09
1,redbulletinvestor,1607892107,funny meme,https://i.redd.it/9agdpwt6n0561.jpg,1607892107.0,"{'author': 'redbulletinvestor', 'created_utc': 1607892107, 'title': 'funny meme', 'url': 'https://i.redd.it/9agdpwt6n0561.jpg', 'created': 1607892107.0}",2020-12-13 20:41:47
2,sweetsweettendies,1607892078,Every SPCE holder on Monday,https://v.redd.it/9l3th2d1n0561,1607892078.0,"{'author': 'sweetsweettendies', 'created_utc': 1607892078, 'title': 'Every SPCE holder on Monday', 'url': 'https://v.redd.it/9l3th2d1n0561', 'created': 1607892078.0}",2020-12-13 20:41:18
3,rumblingpoet,1607892072,Guidance needed,https://www.reddit.com/r/wallstreetbets/comments/kcib9q/guidance_needed/,1607892072.0,"{'author': 'rumblingpoet', 'created_utc': 1607892072, 'title': 'Guidance needed', 'url': 'https://www.reddit.com/r/wallstreetbets/comments/kcib9q/guidance_needed/', 'created': 1607892072.0}",2020-12-13 20:41:12
4,Lazy-Introduction467,1607892002,$51K to $13K to $65K,https://i.redd.it/oj2duy8xm0561.jpg,1607892002.0,"{'author': 'Lazy-Introduction467', 'created_utc': 1607892002, 'title': '$51K to $13K to $65K', 'url': 'https://i.redd.it/oj2duy8xm0561.jpg', 'created': 1607892002.0}",2020-12-13 20:40:02
5,sweetsweettendies,1607891934,Every SPCE holder this coming Monday,https://v.redd.it/uv3ktb8mm0561,1607891934.0,"{'author': 'sweetsweettendies', 'created_utc': 1607891934, 'title': 'Every SPCE holder this coming Monday', 'url': 'https://v.redd.it/uv3ktb8mm0561', 'created': 1607891934.0}",2020-12-13 20:38:54
6,BlarpUM,1607891384,Me Every Sunday,https://i.imgflip.com/29dv2n.jpg,1607891384.0,"{'author': 'BlarpUM', 'created_utc': 1607891384, 'title': 'Me Every Sunday', 'url': 'https://i.imgflip.com/29dv2n.jpg', 'created': 1607891384.0}",2020-12-13 20:29:44
7,shawnjhustles,1607891380,Subversive Capital JayZ Caliva LeftCoast Ventures Rollup Deal,https://www.reddit.com/r/wallstreetbets/comments/kci34u/subversive_capital_jayz_caliva_leftcoast_ventures/,1607891380.0,"{'author': 'shawnjhustles', 'created_utc': 1607891380, 'title': 'Subversive Capital JayZ Caliva LeftCoast Ventures Rollup Deal', 'url': 'https://www.reddit.com/r/wallstreetbets/comments/kci34u/subversive_capital_jayz_caliva_leftcoast_ventures/', 'created': 1607891380.0}",2020-12-13 20:29:40
8,0toHeroInvesting,1607891341,My Tesla Stock Price Predictions | Buy or Sell Before Entering the SP500? Tesla Stock Price Target [12-13],https://www.reddit.com/r/wallstreetbets/comments/kci2lk/my_tesla_stock_price_predictions_buy_or_sell/,1607891341.0,"{'author': '0toHeroInvesting', 'created_utc': 1607891341, 'title': 'My Tesla Stock Price Predictions | Buy or Sell Before Entering the SP500? Tesla Stock Price Target [12-13]', 'url': 'https://www.reddit.com/r/wallstreetbets/comments/kci2lk/my_tesla_stock_price_predictions_buy_or_sell/', 'created': 1607891341.0}",2020-12-13 20:29:01
9,Temporary_Emu_216,1607891137,Dumb stock bet as a gift?,https://www.reddit.com/r/wallstreetbets/comments/kci093/dumb_stock_bet_as_a_gift/,1607891137.0,"{'author': 'Temporary_Emu_216', 'created_utc': 1607891137, 'title': 'Dumb stock bet as a gift?', 'url': 'https://www.reddit.com/r/wallstreetbets/comments/kci093/dumb_stock_bet_as_a_gift/', 'created': 1607891137.0}",2020-12-13 20:25:37
10,jagmot,1607890993,Buying options,https://www.reddit.com/r/wallstreetbets/comments/kchykz/buying_options/,1607890993.0,"{'author': 'jagmot', 'created_utc': 1607890993, 'title': 'Buying options', 'url': 'https://www.reddit.com/r/wallstreetbets/comments/kchykz/buying_options/', 'created': 1607890993.0}",2020-12-13 20:23:13
11,Stonks134,1607890713,Is now the time to jump in on Fannie and Freddie,https://www.reddit.com/r/wallstreetbets/comments/kchv6x/is_now_the_time_to_jump_in_on_fannie_and_freddie/,1607890713.0,"{'author': 'Stonks134', 'created_utc': 1607890713, 'title': 'Is now the time to jump in on Fannie and Freddie', 'url': 'https://www.reddit.com/r/wallstreetbets/comments/kchv6x/is_now_the_time_to_jump_in_on_fannie_and_freddie/', 'created': 1607890713.0}",2020-12-13 20:18:33
12,boss_taco,1607890663,Dogecoin,https://www.reddit.com/r/wallstreetbets/comments/kchukb/dogecoin/,1607890663.0,"{'author': 'boss_taco', 'created_utc': 1607890663, 'title': 'Dogecoin', 'url': 'https://www.reddit.com/r/wallstreetbets/comments/kchukb/dogecoin/', 'created': 1607890663.0}",2020-12-13 20:17:43
13,AtbBerare,1607890559,"Did anyone ever get banned for not answering to ""positions or ban""?",https://www.reddit.com/r/wallstreetbets/comments/kchtb4/did_anyone_ever_get_banned_for_not_answering_to/,1607890559.0,"{'author': 'AtbBerare', 'created_utc': 1607890559, 'title': 'Did anyone ever get banned for not answering to ""positions or ban""?', 'url': 'https://www.reddit.com/r/wallstreetbets/comments/kchtb4/did_anyone_ever_get_banned_for_not_answering_to/', 'created': 1607890559.0}",2020-12-13 20:15:59
14,Deaththekid02,1607890364,Trying to buy a low volume option but got hit with this error screen. Anyone know what this means?,https://i.redd.it/r8mlyvw1i0561.jpg,1607890364.0,"{'author': 'Deaththekid02', 'created_utc': 1607890364, 'title': 'Trying to buy a low volume option but got hit with this error screen. Anyone know what this means?', 'url': 'https://i.redd.it/r8mlyvw1i0561.jpg', 'created': 1607890364.0}",2020-12-13 20:12:44
15,Sryan1990,1607890148,Where should this gay bear buy puts this week?,https://i.redd.it/dngsf5qeh0561.jpg,1607890148.0,"{'author': 'Sryan1990', 'created_utc': 1607890148, 'title': 'Where should this gay bear buy puts this week?', 'url': 'https://i.redd.it/dngsf5qeh0561.jpg', 'created': 1607890148.0}",2020-12-13 20:09:08
16,BlankBlank829,1607889848,CVS,https://www.reddit.com/r/wallstreetbets/comments/kchl19/cvs/,1607889848.0,"{'author': 'BlankBlank829', 'created_utc': 1607889848, 'title': 'CVS', 'url': 'https://www.reddit.com/r/wallstreetbets/comments/kchl19/cvs/', 'created': 1607889848.0}",2020-12-13 20:04:08
17,ScoutTheStankDog,1607889705,Meme worthy. USA USA USA U.S. Treasury breached by hackers backed by foreign government,https://www.reuters.com/article/us-usa-cyber-treasury-exclsuive-idUSKBN28N0PG,1607889705.0,"{'author': 'ScoutTheStankDog', 'created_utc': 1607889705, 'title': 'Meme worthy. USA USA USA U.S. Treasury breached by hackers backed by foreign government', 'url': 'https://www.reuters.com/article/us-usa-cyber-treasury-exclsuive-idUSKBN28N0PG', 'created': 1607889705.0}",2020-12-13 20:01:45
18,JasonColin,1607889207,"Will Tesla have massive soar at open (mon) due to S&amp;P 500 replacement news, Texas news, and old model production savings?",https://www.reddit.com/r/wallstreetbets/comments/kchdhw/will_tesla_have_massive_soar_at_open_mon_due_to/,1607889207.0,"{'author': 'JasonColin', 'created_utc': 1607889207, 'title': 'Will Tesla have massive soar at open (mon) due to S&amp;P 500 replacement news, Texas news, and old model production savings?', 'url': 'https://www.reddit.com/r/wallstreetbets/comments/kchdhw/will_tesla_have_massive_soar_at_open_mon_due_to/', 'created': 1607889207.0}",2020-12-13 19:53:27
19,ReasonableCitizen,1607889180,SPACs to the moon,https://www.reddit.com/r/wallstreetbets/comments/kchd62/spacs_to_the_moon/,1607889180.0,"{'author': 'ReasonableCitizen', 'created_utc': 1607889180, 'title': 'SPACs to the moon', 'url': 'https://www.reddit.com/r/wallstreetbets/comments/kchd62/spacs_to_the_moon/', 'created': 1607889180.0}",2020-12-13 19:53:00
20,Sen_Hillary_Clinton,1607889150,PLTR - True and Simple DD,https://www.reddit.com/r/wallstreetbets/comments/kchcs1/pltr_true_and_simple_dd/,1607889150.0,"{'author': 'Sen_Hillary_Clinton', 'created_utc': 1607889150, 'title': 'PLTR - True and Simple DD', 'url': 'https://www.reddit.com/r/wallstreetbets/comments/kchcs1/pltr_true_and_simple_dd/', 'created': 1607889150.0}",2020-12-13 19:52:30
21,MathFerret1013,1607888999,TSMC holds the Crown,https://www.reddit.com/r/wallstreetbets/comments/kchb2p/tsmc_holds_the_crown/,1607888999.0,"{'author': 'MathFerret1013', 'created_utc': 1607888999, 'title': 'TSMC holds the Crown', 'url': 'https://www.reddit.com/r/wallstreetbets/comments/kchb2p/tsmc_holds_the_crown/', 'created': 1607888999.0}",2020-12-13 19:49:59
22,internet_emporium,1607888974,r0bI0x DD. This stock gunna fucking MOON on IPO!!🚀🚀🚀🚀🚀🚀🚀,https://v.redd.it/d62u0rxmd0561,1607888974.0,"{'author': 'internet_emporium', 'created_utc': 1607888974, 'title': 'r0bI0x DD. This stock gunna fucking MOON on IPO!!🚀🚀🚀🚀🚀🚀🚀', 'url': 'https://v.redd.it/d62u0rxmd0561', 'created': 1607888974.0}",2020-12-13 19:49:34
23,itmetheSEC,1607888974,Which one of you retards is this?,https://i.redd.it/917nbl3xd0561.jpg,1607888974.0,"{'author': 'itmetheSEC', 'created_utc': 1607888974, 'title': 'Which one of you retards is this?', 'url': 'https://i.redd.it/917nbl3xd0561.jpg', 'created': 1607888974.0}",2020-12-13 19:49:34
24,Chexburger,1607888801,"GME Gang Rise up, the War Has Only Just Begun 🚀🚀🚀",https://v.redd.it/ll3c2xoad0561,1607888801.0,"{'author': 'Chexburger', 'created_utc': 1607888801, 'title': 'GME Gang Rise up, the War Has Only Just Begun 🚀🚀🚀', 'url': 'https://v.redd.it/ll3c2xoad0561', 'created': 1607888801.0}",2020-12-13 19:46:41
25,Chexburger,1607888723,"GME Gang Rise up, the War has only Just Begun 🚀🚀🚀",https://v.redd.it/a6fzvs1cc0561,1607888723.0,"{'author': 'Chexburger', 'created_utc': 1607888723, 'title': 'GME Gang Rise up, the War has only Just Begun 🚀🚀🚀', 'url': 'https://v.redd.it/a6fzvs1cc0561', 'created': 1607888723.0}",2020-12-13 19:45:23
26,Georgieperogie22,1607888704,If I make an app that scrapes this subreddit and gives weekly picks based on the number of 🚀 activity would you retards use it?,https://www.reddit.com/r/wallstreetbets/comments/kch7o0/if_i_make_an_app_that_scrapes_this_subreddit_and/,1607888704.0,"{'author': 'Georgieperogie22', 'created_utc': 1607888704, 'title': 'If I make an app that scrapes this subreddit and gives weekly picks based on the number of 🚀 activity would you retards use it?', 'url': 'https://www.reddit.com/r/wallstreetbets/comments/kch7o0/if_i_make_an_app_that_scrapes_this_subreddit_and/', 'created': 1607888704.0}",2020-12-13 19:45:04
27,Makingbwed,1607888406,PFE 🚀🚀🚀,https://i.redd.it/kpj7igc8c0561.jpg,1607888406.0,"{'author': 'Makingbwed', 'created_utc': 1607888406, 'title': 'PFE 🚀🚀🚀', 'url': 'https://i.redd.it/kpj7igc8c0561.jpg', 'created': 1607888406.0}",2020-12-13 19:40:06
28,keynel12,1607888312,"New week, new, um, opportunities",https://i.redd.it/hfl1a3uxb0561.gif,1607888312.0,"{'author': 'keynel12', 'created_utc': 1607888312, 'title': 'New week, new, um, opportunities', 'url': 'https://i.redd.it/hfl1a3uxb0561.gif', 'created': 1607888312.0}",2020-12-13 19:38:32
29,btoned,1607888051,Is It Monday Yet?,https://i.redd.it/vf2mnxq5b0561.jpg,1607888051.0,"{'author': 'btoned', 'created_utc': 1607888051, 'title': 'Is It Monday Yet?', 'url': 'https://i.redd.it/vf2mnxq5b0561.jpg', 'created': 1607888051.0}",2020-12-13 19:34:11
30,Daytraderjoey,1607887830,10K yolo bet what would you do this week?,https://www.reddit.com/r/wallstreetbets/comments/kcgxne/10k_yolo_bet_what_would_you_do_this_week/,1607887830.0,"{'author': 'Daytraderjoey', 'created_utc': 1607887830, 'title': '10K yolo bet what would you do this week?', 'url': 'https://www.reddit.com/r/wallstreetbets/comments/kcgxne/10k_yolo_bet_what_would_you_do_this_week/', 'created': 1607887830.0}",2020-12-13 19:30:30
31,ghostyjr,1607887731,Thoughts on 3/19/2021 PLTR 50c yolo?,https://www.reddit.com/r/wallstreetbets/comments/kcgwj7/thoughts_on_3192021_pltr_50c_yolo/,1607887731.0,"{'author': 'ghostyjr', 'created_utc': 1607887731, 'title': 'Thoughts on 3/19/2021 PLTR 50c yolo?', 'url': 'https://www.reddit.com/r/wallstreetbets/comments/kcgwj7/thoughts_on_3192021_pltr_50c_yolo/', 'created': 1607887731.0}",2020-12-13 19:28:51
32,Ihavealpacas,1607887588,Bears are fucking and making Super GrizzlyPolar Bears. Stonks at ATH. No bearish position other than some boring bonds. Gl Traders &amp; Retards,https://i.redd.it/lt02p0hs90561.png,1607887588.0,"{'author': 'Ihavealpacas', 'created_utc': 1607887588, 'title': 'Bears are fucking and making Super GrizzlyPolar Bears. Stonks at ATH. No bearish position other than some boring bonds. Gl Traders &amp; Retards', 'url': 'https://i.redd.it/lt02p0hs90561.png', 'created': 1607887588.0}",2020-12-13 19:26:28
33,flyingprogrammer,1607887251,It's Time to Pull the Plug on ChargePoint (SBE). The SBE SPAC Deal Is A Shit Deal.,https://www.reddit.com/r/wallstreetbets/comments/kcgr8e/its_time_to_pull_the_plug_on_chargepoint_sbe_the/,1607887251.0,"{'author': 'flyingprogrammer', 'created_utc': 1607887251, 'title': ""It's Time to Pull the Plug on ChargePoint (SBE). The SBE SPAC Deal Is A Shit Deal."", 'url': 'https://www.reddit.com/r/wallstreetbets/comments/kcgr8e/its_time_to_pull_the_plug_on_chargepoint_sbe_the/', 'created': 1607887251.0}",2020-12-13 19:20:51
34,richijefe1,1607887234,Big YOLO gains invested in real estate,https://i.redd.it/tm195ewq80561.jpg,1607887234.0,"{'author': 'richijefe1', 'created_utc': 1607887234, 'title': 'Big YOLO gains invested in real estate', 'url': 'https://i.redd.it/tm195ewq80561.jpg', 'created': 1607887234.0}",2020-12-13 19:20:34
35,tigerbackwoods94,1607886985,A formal “Thank You”,https://www.reddit.com/r/wallstreetbets/comments/kcgo49/a_formal_thank_you/,1607886985.0,"{'author': 'tigerbackwoods94', 'created_utc': 1607886985, 'title': 'A formal “Thank You”', 'url': 'https://www.reddit.com/r/wallstreetbets/comments/kcgo49/a_formal_thank_you/', 'created': 1607886985.0}",2020-12-13 19:16:25
36,DayTraderEddy,1607886924,"Pls Nio needs to moon, pls.",https://www.reddit.com/r/wallstreetbets/comments/kcgnek/pls_nio_needs_to_moon_pls/,1607886924.0,"{'author': 'DayTraderEddy', 'created_utc': 1607886924, 'title': 'Pls Nio needs to moon, pls.', 'url': 'https://www.reddit.com/r/wallstreetbets/comments/kcgnek/pls_nio_needs_to_moon_pls/', 'created': 1607886924.0}",2020-12-13 19:15:24
37,EntertainmentEast986,1607886899,Buy quality cannabis and get premium delivery service within Canada,https://www.reddit.com/r/wallstreetbets/comments/kcgn43/buy_quality_cannabis_and_get_premium_delivery/,1607886899.0,"{'author': 'EntertainmentEast986', 'created_utc': 1607886899, 'title': 'Buy quality cannabis and get premium delivery service within Canada', 'url': 'https://www.reddit.com/r/wallstreetbets/comments/kcgn43/buy_quality_cannabis_and_get_premium_delivery/', 'created': 1607886899.0}",2020-12-13 19:14:59
38,Kia72,1607886760,DoorDash Puts,https://www.reddit.com/r/wallstreetbets/comments/kcglh4/doordash_puts/,1607886760.0,"{'author': 'Kia72', 'created_utc': 1607886760, 'title': 'DoorDash Puts', 'url': 'https://www.reddit.com/r/wallstreetbets/comments/kcglh4/doordash_puts/', 'created': 1607886760.0}",2020-12-13 19:12:40
39,BecksBannedBoyfriend,1607886641,PUTS on CD Projekt (PLOPTTC00011),https://i.redd.it/zfjrou2r60561.png,1607886641.0,"{'author': 'BecksBannedBoyfriend', 'created_utc': 1607886641, 'title': 'PUTS on CD Projekt (PLOPTTC00011)', 'url': 'https://i.redd.it/zfjrou2r60561.png', 'created': 1607886641.0}",2020-12-13 19:10:41
40,DankEDankerton,1607886547,Lol,https://i.redd.it/tknwj69p60561.jpg,1607886547.0,"{'author': 'DankEDankerton', 'created_utc': 1607886547, 'title': 'Lol', 'url': 'https://i.redd.it/tknwj69p60561.jpg', 'created': 1607886547.0}",2020-12-13 19:09:07
41,PhoenixStonks67,1607886511,I hope you all are jumping on Cryptocurrencies for this bull run 🤑,https://youtu.be/_mjkrl_wo1k,1607886511.0,"{'author': 'PhoenixStonks67', 'created_utc': 1607886511, 'title': 'I hope you all are jumping on Cryptocurrencies for this bull run 🤑', 'url': 'https://youtu.be/_mjkrl_wo1k', 'created': 1607886511.0}",2020-12-13 19:08:31
42,152057,1607886321,When stimulus and vaccine delivery hits on the same Monday,https://v.redd.it/d1e3o27t50561,1607886321.0,"{'author': '152057', 'created_utc': 1607886321, 'title': 'When stimulus and vaccine delivery hits on the same Monday', 'url': 'https://v.redd.it/d1e3o27t50561', 'created': 1607886321.0}",2020-12-13 19:05:21
43,J_KingXD12,1607886145,DD: ABNB PUTS - FUK THEM,https://www.reddit.com/r/wallstreetbets/comments/kcge8h/dd_abnb_puts_fuk_them/,1607886145.0,"{'author': 'J_KingXD12', 'created_utc': 1607886145, 'title': 'DD: ABNB PUTS - FUK THEM', 'url': 'https://www.reddit.com/r/wallstreetbets/comments/kcge8h/dd_abnb_puts_fuk_them/', 'created': 1607886145.0}",2020-12-13 19:02:25
44,Jcaf8,1607885820,What we all fear tomorrow,https://v.redd.it/ep558f2g40561,1607885820.0,"{'author': 'Jcaf8', 'created_utc': 1607885820, 'title': 'What we all fear tomorrow', 'url': 'https://v.redd.it/ep558f2g40561', 'created': 1607885820.0}",2020-12-13 18:57:00
45,unimpressed_observer,1607885515,"Cystic Fibrosis is one of the worst genetic mutations. A company called Proteostasis Therapeutics makes treatments for CF patients, they are reverse merging next week and will sell their IP. People with cystic fibrosis requires a double lung transplant and failure is 50% after 5 years",https://www.reddit.com/gallery/kcg6r0,1607885515.0,"{'author': 'unimpressed_observer', 'created_utc': 1607885515, 'title': 'Cystic Fibrosis is one of the worst genetic mutations. A company called Proteostasis Therapeutics makes treatments for CF patients, they are reverse merging next week and will sell their IP. People with cystic fibrosis requires a double lung transplant and failure is 50% after 5 years', 'url': 'https://www.reddit.com/gallery/kcg6r0', 'created': 1607885515.0}",2020-12-13 18:51:55
46,Every_Ad_1215,1607885314,Great gift for any bagholder or meme lord,https://www.reddit.com/r/RobinHoodPennyStocks/comments/kcbmbk/great_gift_for_any_bagholder_or_meme_lord/?utm_source=share&amp;utm_medium=ios_app&amp;utm_name=iossmf&amp;utm_term=link,1607885314.0,"{'author': 'Every_Ad_1215', 'created_utc': 1607885314, 'title': 'Great gift for any bagholder or meme lord', 'url': 'https://www.reddit.com/r/RobinHoodPennyStocks/comments/kcbmbk/great_gift_for_any_bagholder_or_meme_lord/?utm_source=share&amp;utm_medium=ios_app&amp;utm_name=iossmf&amp;utm_term=link', 'created': 1607885314.0}",2020-12-13 18:48:34
47,PM_ME_THE_SELF,1607885313,That sweet sweet Mind Med,https://i.redd.it/ryar7j6130561.jpg,1607885313.0,"{'author': 'PM_ME_THE_SELF', 'created_utc': 1607885313, 'title': 'That sweet sweet Mind Med', 'url': 'https://i.redd.it/ryar7j6130561.jpg', 'created': 1607885313.0}",2020-12-13 18:48:33
48,impricedin11,1607885128,"Forget the moon, we're headed to Uranus",https://www.reddit.com/r/wallstreetbets/comments/kcg2bi/forget_the_moon_were_headed_to_uranus/,1607885128.0,"{'author': 'impricedin11', 'created_utc': 1607885128, 'title': ""Forget the moon, we're headed to Uranus"", 'url': 'https://www.reddit.com/r/wallstreetbets/comments/kcg2bi/forget_the_moon_were_headed_to_uranus/', 'created': 1607885128.0}",2020-12-13 18:45:28
49,unimpressed_observer,1607884978,"PTI (company that has treatments for Cystic Fibrosis) reverse merging next week. People with cystic fibrosis requires a double lung transplant in their twenties, and transplant failure is 50% after 5 years",https://www.reddit.com/gallery/kcg0iu,1607884978.0,"{'author': 'unimpressed_observer', 'created_utc': 1607884978, 'title': 'PTI (company that has treatments for Cystic Fibrosis) reverse merging next week. People with cystic fibrosis requires a double lung transplant in their twenties, and transplant failure is 50% after 5 years', 'url': 'https://www.reddit.com/gallery/kcg0iu', 'created': 1607884978.0}",2020-12-13 18:42:58
50,MFWANG,1607884893,Would investing in Pfizer right now be a good decision in the long run?,https://www.reddit.com/r/wallstreetbets/comments/kcfzjh/would_investing_in_pfizer_right_now_be_a_good/,1607884893.0,"{'author': 'MFWANG', 'created_utc': 1607884893, 'title': 'Would investing in Pfizer right now be a good decision in the long run?', 'url': 'https://www.reddit.com/r/wallstreetbets/comments/kcfzjh/would_investing_in_pfizer_right_now_be_a_good/', 'created': 1607884893.0}",2020-12-13 18:41:33
51,cablebill_,1607884875,I know what route i’m taking,https://i.redd.it/gam23jdq10561.jpg,1607884875.0,"{'author': 'cablebill_', 'created_utc': 1607884875, 'title': 'I know what route i’m taking', 'url': 'https://i.redd.it/gam23jdq10561.jpg', 'created': 1607884875.0}",2020-12-13 18:41:15
52,EntertainmentEast986,1607884796,Buy quality cannabis and get premium delivery service within Canada,https://www.reddit.com/r/wallstreetbets/comments/kcfyff/buy_quality_cannabis_and_get_premium_delivery/,1607884796.0,"{'author': 'EntertainmentEast986', 'created_utc': 1607884796, 'title': 'Buy quality cannabis and get premium delivery service within Canada', 'url': 'https://www.reddit.com/r/wallstreetbets/comments/kcfyff/buy_quality_cannabis_and_get_premium_delivery/', 'created': 1607884796.0}",2020-12-13 18:39:56
53,import_bible,1607884621,"My friend asked me to make a green starship with HULK on the side, I don't get it",https://i.redd.it/ds47to2y00561.jpg,1607884621.0,"{'author': 'import_bible', 'created_utc': 1607884621, 'title': ""My friend asked me to make a green starship with HULK on the side, I don't get it"", 'url': 'https://i.redd.it/ds47to2y00561.jpg', 'created': 1607884621.0}",2020-12-13 18:37:01
54,hookersnblow420,1607884504,Now this.... this is advertising,https://i.redd.it/0njejmnm00561.jpg,1607884504.0,"{'author': 'hookersnblow420', 'created_utc': 1607884504, 'title': 'Now this.... this is advertising', 'url': 'https://i.redd.it/0njejmnm00561.jpg', 'created': 1607884504.0}",2020-12-13 18:35:04
55,baddfish2,1607884379,Some ABNB Hosts Had A Chance To Buy Shares At $68? Many Disregarded The Email. 🤦🏻‍♂️,https://www.npr.org/2020/12/12/945871818/they-ignored-or-deleted-the-email-from-airbnb-it-was-a-15-000-mistake?ft=nprml&amp;f=1001,1607884379.0,"{'author': 'baddfish2', 'created_utc': 1607884379, 'title': 'Some ABNB Hosts Had A Chance To Buy Shares At $68? Many Disregarded The Email. 🤦🏻\u200d♂️', 'url': 'https://www.npr.org/2020/12/12/945871818/they-ignored-or-deleted-the-email-from-airbnb-it-was-a-15-000-mistake?ft=nprml&amp;f=1001', 'created': 1607884379.0}",2020-12-13 18:32:59
56,import_bible,1607884362,"My friend asked me to make a green starship with HULK on the side, I don't get it",https://i.redd.it/cbljuvt500561.jpg,1607884362.0,"{'author': 'import_bible', 'created_utc': 1607884362, 'title': ""My friend asked me to make a green starship with HULK on the side, I don't get it"", 'url': 'https://i.redd.it/cbljuvt500561.jpg', 'created': 1607884362.0}",2020-12-13 18:32:42
57,beaunont,1607884311,Love PLTR 1/15 41c 5/21 30c 🚀🚀🚀,https://www.reddit.com/r/wallstreetbets/comments/kcfstu/love_pltr_115_41c_521_30c/,1607884311.0,"{'author': 'beaunont', 'created_utc': 1607884311, 'title': 'Love PLTR 1/15 41c 5/21 30c 🚀🚀🚀', 'url': 'https://www.reddit.com/r/wallstreetbets/comments/kcfstu/love_pltr_115_41c_521_30c/', 'created': 1607884311.0}",2020-12-13 18:31:51
58,strEss_out090,1607884292,WTI $3C 12/18 - Might be a retarded move but we’ll see - Wish me luck!,https://i.redd.it/g6rcv6ezzz461.jpg,1607884292.0,"{'author': 'strEss_out090', 'created_utc': 1607884292, 'title': 'WTI $3C 12/18 - Might be a retarded move but we’ll see - Wish me luck!', 'url': 'https://i.redd.it/g6rcv6ezzz461.jpg', 'created': 1607884292.0}",2020-12-13 18:31:32
59,MPC_93,1607884130,What does green mean?,https://i.redd.it/uwqplckizz461.jpg,1607884130.0,"{'author': 'MPC_93', 'created_utc': 1607884130, 'title': 'What does green mean?', 'url': 'https://i.redd.it/uwqplckizz461.jpg', 'created': 1607884130.0}",2020-12-13 18:28:50
60,barnetta,1607883940,The F-Team,https://v.redd.it/pf1mntf7yz461,1607883940.0,"{'author': 'barnetta', 'created_utc': 1607883940, 'title': 'The F-Team', 'url': 'https://v.redd.it/pf1mntf7yz461', 'created': 1607883940.0}",2020-12-13 18:25:40
61,jalapenojacker,1607883888,"Santa Claus Rally, will it happen this year Or are we topped out?",https://www.reddit.com/r/wallstreetbets/comments/kcfnw8/santa_claus_rally_will_it_happen_this_year_or_are/,1607883888.0,"{'author': 'jalapenojacker', 'created_utc': 1607883888, 'title': 'Santa Claus Rally, will it happen this year Or are we topped out?', 'url': 'https://www.reddit.com/r/wallstreetbets/comments/kcfnw8/santa_claus_rally_will_it_happen_this_year_or_are/', 'created': 1607883888.0}",2020-12-13 18:24:48
62,Outside-Description5,1607883753,NIU $45C 12/18- Half Retarded- Half Genius ? Wish me luck!,https://i.redd.it/ty9v7z8eyz461.jpg,1607883753.0,"{'author': 'Outside-Description5', 'created_utc': 1607883753, 'title': 'NIU $45C 12/18- Half Retarded- Half Genius ? Wish me luck!', 'url': 'https://i.redd.it/ty9v7z8eyz461.jpg', 'created': 1607883753.0}",2020-12-13 18:22:33
63,Longjumping_Deer_698,1607883616,starting with 100$ on robin hood what stocks am I buying,https://www.reddit.com/r/wallstreetbets/comments/kcfkrd/starting_with_100_on_robin_hood_what_stocks_am_i/,1607883616.0,"{'author': 'Longjumping_Deer_698', 'created_utc': 1607883616, 'title': 'starting with 100$ on robin hood what stocks am I buying', 'url': 'https://www.reddit.com/r/wallstreetbets/comments/kcfkrd/starting_with_100_on_robin_hood_what_stocks_am_i/', 'created': 1607883616.0}",2020-12-13 18:20:16
