,author,created_utc,title,url,created,d_,created_utc_dt
0,flocho22,1612078425,Diamond hands brothers 💎👐🏾,https://i.redd.it/q7m4c85bfme61.jpg,1612078425.0,"{'author': 'flocho22', 'created_utc': 1612078425, 'title': 'Diamond hands brothers 💎👐🏾', 'url': 'https://i.redd.it/q7m4c85bfme61.jpg', 'created': 1612078425.0}",2021-01-31 07:33:45
1,silvrado,1612078420,Stitched them up proper. That's how it's done!!,https://i.redd.it/fy366ou9fme61.png,1612078420.0,"{'author': 'silvrado', 'created_utc': 1612078420, 'title': ""Stitched them up proper. That's how it's done!!"", 'url': 'https://i.redd.it/fy366ou9fme61.png', 'created': 1612078420.0}",2021-01-31 07:33:40
2,sjt1738,1612078420,Can we take a moment and just appreciate this?,https://www.reddit.com/r/wallstreetbets/comments/l97g83/can_we_take_a_moment_and_just_appreciate_this/,1612078420.0,"{'author': 'sjt1738', 'created_utc': 1612078420, 'title': 'Can we take a moment and just appreciate this?', 'url': 'https://www.reddit.com/r/wallstreetbets/comments/l97g83/can_we_take_a_moment_and_just_appreciate_this/', 'created': 1612078420.0}",2021-01-31 07:33:40
3,Manoushe,1612078416,My Plans For Monday,https://www.reddit.com/r/wallstreetbets/comments/l97g73/my_plans_for_monday/,1612078416.0,"{'author': 'Manoushe', 'created_utc': 1612078416, 'title': 'My Plans For Monday', 'url': 'https://www.reddit.com/r/wallstreetbets/comments/l97g73/my_plans_for_monday/', 'created': 1612078416.0}",2021-01-31 07:33:36
4,These-Speed1535,1612078416,Can I post?,https://www.reddit.com/r/wallstreetbets/comments/l97g6y/can_i_post/,1612078416.0,"{'author': 'These-Speed1535', 'created_utc': 1612078416, 'title': 'Can I post?', 'url': 'https://www.reddit.com/r/wallstreetbets/comments/l97g6y/can_i_post/', 'created': 1612078416.0}",2021-01-31 07:33:36
5,Tamicus,1612078415,HOLD THE LINE AND HAVE FAITH INVESTORS 🚀. #GME #DOGE,https://i.redd.it/m7ctd92afme61.jpg,1612078415.0,"{'author': 'Tamicus', 'created_utc': 1612078415, 'title': 'HOLD THE LINE AND HAVE FAITH INVESTORS 🚀. #GME #DOGE', 'url': 'https://i.redd.it/m7ctd92afme61.jpg', 'created': 1612078415.0}",2021-01-31 07:33:35
6,TheWorstGameDev,1612078414,Is GME and AMC once in a lifetime?,https://www.reddit.com/r/wallstreetbets/comments/l97g6d/is_gme_and_amc_once_in_a_lifetime/,1612078414.0,"{'author': 'TheWorstGameDev', 'created_utc': 1612078414, 'title': 'Is GME and AMC once in a lifetime?', 'url': 'https://www.reddit.com/r/wallstreetbets/comments/l97g6d/is_gme_and_amc_once_in_a_lifetime/', 'created': 1612078414.0}",2021-01-31 07:33:34
7,WhycanTviftheycan,1612078408,Let’s get “Naked” at WallStreet,https://www.reddit.com/r/wallstreetbets/comments/l97g4n/lets_get_naked_at_wallstreet/,1612078408.0,"{'author': 'WhycanTviftheycan', 'created_utc': 1612078408, 'title': 'Let’s get “Naked” at WallStreet', 'url': 'https://www.reddit.com/r/wallstreetbets/comments/l97g4n/lets_get_naked_at_wallstreet/', 'created': 1612078408.0}",2021-01-31 07:33:28
8,YOURFRIENDMIKO,1612078403,Subtle smear campaign on Saturday Night Live,https://www.reddit.com/r/wallstreetbets/comments/l97g36/subtle_smear_campaign_on_saturday_night_live/,1612078403.0,"{'author': 'YOURFRIENDMIKO', 'created_utc': 1612078403, 'title': 'Subtle smear campaign on Saturday Night Live', 'url': 'https://www.reddit.com/r/wallstreetbets/comments/l97g36/subtle_smear_campaign_on_saturday_night_live/', 'created': 1612078403.0}",2021-01-31 07:33:23
9,Superb_Roof_8524,1612078403,New bi,https://www.reddit.com/r/wallstreetbets/comments/l97g2r/new_bi/,1612078403.0,"{'author': 'Superb_Roof_8524', 'created_utc': 1612078403, 'title': 'New bi', 'url': 'https://www.reddit.com/r/wallstreetbets/comments/l97g2r/new_bi/', 'created': 1612078403.0}",2021-01-31 07:33:23
10,z3r0z3rz0,1612078399,May do little difference but it’s the weekend I can’t buy.,https://i.redd.it/5ky8gg68fme61.jpg,1612078399.0,"{'author': 'z3r0z3rz0', 'created_utc': 1612078399, 'title': 'May do little difference but it’s the weekend I can’t buy.', 'url': 'https://i.redd.it/5ky8gg68fme61.jpg', 'created': 1612078399.0}",2021-01-31 07:33:19
11,cryptofeez,1612078398,AMC dudes we must unite !!!!! Please upvote !,https://www.reddit.com/r/wallstreetbets/comments/l97g1i/amc_dudes_we_must_unite_please_upvote/,1612078398.0,"{'author': 'cryptofeez', 'created_utc': 1612078398, 'title': 'AMC dudes we must unite !!!!! Please upvote !', 'url': 'https://www.reddit.com/r/wallstreetbets/comments/l97g1i/amc_dudes_we_must_unite_please_upvote/', 'created': 1612078398.0}",2021-01-31 07:33:18
12,ElonMuskSpaceX,1612078398,"This ad space in my hometown has a minimum price of $9,999,999. I'm not selling my GME shares until it's trading at $9,999,999!",https://i.redd.it/vk2i1z9weme61.png,1612078398.0,"{'author': 'ElonMuskSpaceX', 'created_utc': 1612078398, 'title': ""This ad space in my hometown has a minimum price of $9,999,999. I'm not selling my GME shares until it's trading at $9,999,999!"", 'url': 'https://i.redd.it/vk2i1z9weme61.png', 'created': 1612078398.0}",2021-01-31 07:33:18
13,SpecialistCry8549,1612078398,tell mee,https://www.reddit.com/r/wallstreetbets/comments/l97g1c/tell_mee/,1612078398.0,"{'author': 'SpecialistCry8549', 'created_utc': 1612078398, 'title': 'tell mee', 'url': 'https://www.reddit.com/r/wallstreetbets/comments/l97g1c/tell_mee/', 'created': 1612078398.0}",2021-01-31 07:33:18
14,Planedefender323,1612078398,AMC AMC AMC,https://www.reddit.com/r/wallstreetbets/comments/l97g18/amc_amc_amc/,1612078398.0,"{'author': 'Planedefender323', 'created_utc': 1612078398, 'title': 'AMC AMC AMC', 'url': 'https://www.reddit.com/r/wallstreetbets/comments/l97g18/amc_amc_amc/', 'created': 1612078398.0}",2021-01-31 07:33:18
15,Crush4567,1612078392,DOGECOIN is going to hit 0.06 again on Monday at 9:30 when the market opens and people get their deposits in. Just letting you guys know now if you wanted to buy in a lot of DOGECOIN. Can’t wait! 📈🚀,https://www.reddit.com/r/wallstreetbets/comments/l97fzd/dogecoin_is_going_to_hit_006_again_on_monday_at/,1612078392.0,"{'author': 'Crush4567', 'created_utc': 1612078392, 'title': 'DOGECOIN is going to hit 0.06 again on Monday at 9:30 when the market opens and people get their deposits in. Just letting you guys know now if you wanted to buy in a lot of DOGECOIN. Can’t wait! 📈🚀', 'url': 'https://www.reddit.com/r/wallstreetbets/comments/l97fzd/dogecoin_is_going_to_hit_006_again_on_monday_at/', 'created': 1612078392.0}",2021-01-31 07:33:12
16,Safe_Construction_53,1612078392,I am new to this and want be part of the community.,https://www.reddit.com/r/wallstreetbets/comments/l97fza/i_am_new_to_this_and_want_be_part_of_the_community/,1612078392.0,"{'author': 'Safe_Construction_53', 'created_utc': 1612078392, 'title': 'I am new to this and want be part of the community.', 'url': 'https://www.reddit.com/r/wallstreetbets/comments/l97fza/i_am_new_to_this_and_want_be_part_of_the_community/', 'created': 1612078392.0}",2021-01-31 07:33:12
17,mehul_v_s03,1612078389,LET'S GO!,https://i.redd.it/7tfcbls3fme61.jpg,1612078389.0,"{'author': 'mehul_v_s03', 'created_utc': 1612078389, 'title': ""LET'S GO!"", 'url': 'https://i.redd.it/7tfcbls3fme61.jpg', 'created': 1612078389.0}",2021-01-31 07:33:09
18,Flan-Extra,1612078388,Look how hf shorting this stock,https://www.reddit.com/gallery/l97fy5,1612078388.0,"{'author': 'Flan-Extra', 'created_utc': 1612078388, 'title': 'Look how hf shorting this stock', 'url': 'https://www.reddit.com/gallery/l97fy5', 'created': 1612078388.0}",2021-01-31 07:33:08
19,Better-Coffee,1612078385,petition to make u/deepfuckingvalue to be the TIME'S person of the year and give him a Nobel Prize for Ecomonics,https://www.reddit.com/r/wallstreetbets/comments/l97fxp/petition_to_make_udeepfuckingvalue_to_be_the/,1612078385.0,"{'author': 'Better-Coffee', 'created_utc': 1612078385, 'title': ""petition to make u/deepfuckingvalue to be the TIME'S person of the year and give him a Nobel Prize for Ecomonics"", 'url': 'https://www.reddit.com/r/wallstreetbets/comments/l97fxp/petition_to_make_udeepfuckingvalue_to_be_the/', 'created': 1612078385.0}",2021-01-31 07:33:05
20,jjimenez0,1612078385,🚀🚀🚀BB TO THE MOON,https://www.reddit.com/gallery/l97fxo,1612078385.0,"{'author': 'jjimenez0', 'created_utc': 1612078385, 'title': '🚀🚀🚀BB TO THE MOON', 'url': 'https://www.reddit.com/gallery/l97fxo', 'created': 1612078385.0}",2021-01-31 07:33:05
21,Decaying_Hero,1612078383,Lol they’re trying so hard to saves themselves,https://i.redd.it/2m5yinj6fme61.jpg,1612078383.0,"{'author': 'Decaying_Hero', 'created_utc': 1612078383, 'title': 'Lol they’re trying so hard to saves themselves', 'url': 'https://i.redd.it/2m5yinj6fme61.jpg', 'created': 1612078383.0}",2021-01-31 07:33:03
22,KingMidas013,1612078377,Partial $GME or whole $AMC,https://www.reddit.com/r/wallstreetbets/comments/l97fuv/partial_gme_or_whole_amc/,1612078377.0,"{'author': 'KingMidas013', 'created_utc': 1612078377, 'title': 'Partial $GME or whole $AMC', 'url': 'https://www.reddit.com/r/wallstreetbets/comments/l97fuv/partial_gme_or_whole_amc/', 'created': 1612078377.0}",2021-01-31 07:32:57
23,Juicemerksalot,1612078376,Outta the F%#in Milkey Way!,https://www.reddit.com/gallery/l97fuj,1612078376.0,"{'author': 'Juicemerksalot', 'created_utc': 1612078376, 'title': 'Outta the F%#in Milkey Way!', 'url': 'https://www.reddit.com/gallery/l97fuj', 'created': 1612078376.0}",2021-01-31 07:32:56
24,Ok-Log2140,1612078374,Which company should I invest in?,https://www.reddit.com/r/wallstreetbets/comments/l97ftx/which_company_should_i_invest_in/,1612078374.0,"{'author': 'Ok-Log2140', 'created_utc': 1612078374, 'title': 'Which company should I invest in?', 'url': 'https://www.reddit.com/r/wallstreetbets/comments/l97ftx/which_company_should_i_invest_in/', 'created': 1612078374.0}",2021-01-31 07:32:54
25,headkick_fax,1612078374,Best Tinder profile I've seen all week. Super-like for GME HOLY WAR!,https://www.reddit.com/gallery/l97fts,1612078374.0,"{'author': 'headkick_fax', 'created_utc': 1612078374, 'title': ""Best Tinder profile I've seen all week. Super-like for GME HOLY WAR!"", 'url': 'https://www.reddit.com/gallery/l97fts', 'created': 1612078374.0}",2021-01-31 07:32:54
26,Woobiru,1612078364,Bros.Wut about BB? Should I hold it?,https://www.reddit.com/r/wallstreetbets/comments/l97fqg/broswut_about_bb_should_i_hold_it/,1612078364.0,"{'author': 'Woobiru', 'created_utc': 1612078364, 'title': 'Bros.Wut about BB? Should I hold it?', 'url': 'https://www.reddit.com/r/wallstreetbets/comments/l97fqg/broswut_about_bb_should_i_hold_it/', 'created': 1612078364.0}",2021-01-31 07:32:44
27,ParticularPeach4192,1612078364,AMC😎,https://www.reddit.com/r/wallstreetbets/comments/l97fq8/amc/,1612078364.0,"{'author': 'ParticularPeach4192', 'created_utc': 1612078364, 'title': 'AMC😎', 'url': 'https://www.reddit.com/r/wallstreetbets/comments/l97fq8/amc/', 'created': 1612078364.0}",2021-01-31 07:32:44
28,Shop-NGo,1612078364,When the time comes,https://v.redd.it/yo4x83xpeme61,1612078364.0,"{'author': 'Shop-NGo', 'created_utc': 1612078364, 'title': 'When the time comes', 'url': 'https://v.redd.it/yo4x83xpeme61', 'created': 1612078364.0}",2021-01-31 07:32:44
29,dosie101,1612078363,Bypass Wall Street Trade Blocking,https://www.reddit.com/r/wallstreetbets/comments/l97fq3/bypass_wall_street_trade_blocking/,1612078363.0,"{'author': 'dosie101', 'created_utc': 1612078363, 'title': 'Bypass Wall Street Trade Blocking', 'url': 'https://www.reddit.com/r/wallstreetbets/comments/l97fq3/bypass_wall_street_trade_blocking/', 'created': 1612078363.0}",2021-01-31 07:32:43
30,xAllonso,1612078358,Robinhood Not Letting People Buy More Shares of $GME,https://i.redd.it/ulqo1izxeme61.png,1612078358.0,"{'author': 'xAllonso', 'created_utc': 1612078358, 'title': 'Robinhood Not Letting People Buy More Shares of $GME', 'url': 'https://i.redd.it/ulqo1izxeme61.png', 'created': 1612078358.0}",2021-01-31 07:32:38
31,Relative_Clue_7117,1612078355,Conflicted on the move,https://www.reddit.com/r/wallstreetbets/comments/l97fn9/conflicted_on_the_move/,1612078355.0,"{'author': 'Relative_Clue_7117', 'created_utc': 1612078355, 'title': 'Conflicted on the move', 'url': 'https://www.reddit.com/r/wallstreetbets/comments/l97fn9/conflicted_on_the_move/', 'created': 1612078355.0}",2021-01-31 07:32:35
32,admiral_drake,1612078348,"Webull shut down their ""community"" for the weekend AND they're trying to get me to take a beginners course! DONT THEY KNOW IM TOO RETARDED FOR BEGINNERS COURSE??!",https://i.redd.it/nsexx4lcdme61.jpg,1612078348.0,"{'author': 'admiral_drake', 'created_utc': 1612078348, 'title': 'Webull shut down their ""community"" for the weekend AND they\'re trying to get me to take a beginners course! DONT THEY KNOW IM TOO RETARDED FOR BEGINNERS COURSE??!', 'url': 'https://i.redd.it/nsexx4lcdme61.jpg', 'created': 1612078348.0}",2021-01-31 07:32:28
33,Danterahi,1612078338,Melvin Capital CEO Ted Talk,https://www.youtube.com/watch?v=DjIDHtemoaY,1612078338.0,"{'author': 'Danterahi', 'created_utc': 1612078338, 'title': 'Melvin Capital CEO Ted Talk', 'url': 'https://www.youtube.com/watch?v=DjIDHtemoaY', 'created': 1612078338.0}",2021-01-31 07:32:18
34,SKVK_,1612078337,The Robin Hood Paradox:,https://www.reddit.com/r/wallstreetbets/comments/l97fhz/the_robin_hood_paradox/,1612078337.0,"{'author': 'SKVK_', 'created_utc': 1612078337, 'title': 'The Robin Hood Paradox:', 'url': 'https://www.reddit.com/r/wallstreetbets/comments/l97fhz/the_robin_hood_paradox/', 'created': 1612078337.0}",2021-01-31 07:32:17
35,ChineseRocket,1612078334,Go Rocket Fubo,https://www.reddit.com/r/wallstreetbets/comments/l97fg8/go_rocket_fubo/,1612078334.0,"{'author': 'ChineseRocket', 'created_utc': 1612078334, 'title': 'Go Rocket Fubo', 'url': 'https://www.reddit.com/r/wallstreetbets/comments/l97fg8/go_rocket_fubo/', 'created': 1612078334.0}",2021-01-31 07:32:14
36,Darkvalek2021,1612078330,Wallstreetbets worldwide,https://www.reddit.com/r/wallstreetbets/comments/l97ff2/wallstreetbets_worldwide/,1612078330.0,"{'author': 'Darkvalek2021', 'created_utc': 1612078330, 'title': 'Wallstreetbets worldwide', 'url': 'https://www.reddit.com/r/wallstreetbets/comments/l97ff2/wallstreetbets_worldwide/', 'created': 1612078330.0}",2021-01-31 07:32:10
37,andre-agassi,1612078330,It's not because we can! It's because we must!,https://www.reddit.com/r/wallstreetbets/comments/l97fez/its_not_because_we_can_its_because_we_must/,1612078330.0,"{'author': 'andre-agassi', 'created_utc': 1612078330, 'title': ""It's not because we can! It's because we must!"", 'url': 'https://www.reddit.com/r/wallstreetbets/comments/l97fez/its_not_because_we_can_its_because_we_must/', 'created': 1612078330.0}",2021-01-31 07:32:10
38,Vantadad,1612078324,AMC,https://www.reddit.com/r/wallstreetbets/comments/l97fdb/amc/,1612078324.0,"{'author': 'Vantadad', 'created_utc': 1612078324, 'title': 'AMC', 'url': 'https://www.reddit.com/r/wallstreetbets/comments/l97fdb/amc/', 'created': 1612078324.0}",2021-01-31 07:32:04
39,curious_pinniped,1612078324,"Autobot City on Monday - first time doing a meme vid, export seemed to fuck up the timing but hey I'm retarded",https://kapwi.ng/c/zfoXGJBb,1612078324.0,"{'author': 'curious_pinniped', 'created_utc': 1612078324, 'title': ""Autobot City on Monday - first time doing a meme vid, export seemed to fuck up the timing but hey I'm retarded"", 'url': 'https://kapwi.ng/c/zfoXGJBb', 'created': 1612078324.0}",2021-01-31 07:32:04
40,Make-A-Kill2021,1612078315,GME is not the only one...,https://www.reddit.com/r/wallstreetbets/comments/l97fas/gme_is_not_the_only_one/,1612078315.0,"{'author': 'Make-A-Kill2021', 'created_utc': 1612078315, 'title': 'GME is not the only one...', 'url': 'https://www.reddit.com/r/wallstreetbets/comments/l97fas/gme_is_not_the_only_one/', 'created': 1612078315.0}",2021-01-31 07:31:55
41,Lil_Tsunchi,1612078313,"ONE WORD: HOLD THE LINE, $GME, $DOGE, $NOK, $AMC, $BB TO THE MOON!! 🚀🚀",https://i.redd.it/rotg7k7zeme61.jpg,1612078313.0,"{'author': 'Lil_Tsunchi', 'created_utc': 1612078313, 'title': 'ONE WORD: HOLD THE LINE, $GME, $DOGE, $NOK, $AMC, $BB TO THE MOON!! 🚀🚀', 'url': 'https://i.redd.it/rotg7k7zeme61.jpg', 'created': 1612078313.0}",2021-01-31 07:31:53
42,SpookiRuski,1612078313,I'm just an autist who likes the stock,https://v.redd.it/a6w64xyoeme61,1612078313.0,"{'author': 'SpookiRuski', 'created_utc': 1612078313, 'title': ""I'm just an autist who likes the stock"", 'url': 'https://v.redd.it/a6w64xyoeme61', 'created': 1612078313.0}",2021-01-31 07:31:53
43,satansbuttholehair,1612078311,Open Letter to Silver shills,https://www.reddit.com/r/wallstreetbets/comments/l97f9i/open_letter_to_silver_shills/,1612078311.0,"{'author': 'satansbuttholehair', 'created_utc': 1612078311, 'title': 'Open Letter to Silver shills', 'url': 'https://www.reddit.com/r/wallstreetbets/comments/l97f9i/open_letter_to_silver_shills/', 'created': 1612078311.0}",2021-01-31 07:31:51
44,BBWInvader,1612078311,I feel like share holders should be paid dividends. We have a lot of faith into GameStop and considering it’s extreme growth in a short period time it seems appropriate. Any of you retards knows who pays dividend on borrowed shares?,https://www.reddit.com/r/wallstreetbets/comments/l97f9f/i_feel_like_share_holders_should_be_paid/,1612078311.0,"{'author': 'BBWInvader', 'created_utc': 1612078311, 'title': 'I feel like share holders should be paid dividends. We have a lot of faith into GameStop and considering it’s extreme growth in a short period time it seems appropriate. Any of you retards knows who pays dividend on borrowed shares?', 'url': 'https://www.reddit.com/r/wallstreetbets/comments/l97f9f/i_feel_like_share_holders_should_be_paid/', 'created': 1612078311.0}",2021-01-31 07:31:51
45,skidoig,1612078311,"Aussies being recruited for trip to the moon with diamond hands, get ready for a tsunami of Hedgie tears, how many aussies are on here let me know, I’m in Adelaide but about to move to the moon",https://www.reddit.com/r/wallstreetbets/comments/l97f9e/aussies_being_recruited_for_trip_to_the_moon_with/,1612078311.0,"{'author': 'skidoig', 'created_utc': 1612078311, 'title': 'Aussies being recruited for trip to the moon with diamond hands, get ready for a tsunami of Hedgie tears, how many aussies are on here let me know, I’m in Adelaide but about to move to the moon', 'url': 'https://www.reddit.com/r/wallstreetbets/comments/l97f9e/aussies_being_recruited_for_trip_to_the_moon_with/', 'created': 1612078311.0}",2021-01-31 07:31:51
46,RelationshipOk433,1612078299,Dodgecoin To the moon,https://www.reddit.com/r/wallstreetbets/comments/l97f6g/dodgecoin_to_the_moon/,1612078299.0,"{'author': 'RelationshipOk433', 'created_utc': 1612078299, 'title': 'Dodgecoin To the moon', 'url': 'https://www.reddit.com/r/wallstreetbets/comments/l97f6g/dodgecoin_to_the_moon/', 'created': 1612078299.0}",2021-01-31 07:31:39
47,Rev-777,1612078297,Chamath on Robinhood's GameStop decision: All-In Podcast 🚀,https://youtu.be/rWEPSKkkdKQ?t=132,1612078297.0,"{'author': 'Rev-777', 'created_utc': 1612078297, 'title': ""Chamath on Robinhood's GameStop decision: All-In Podcast 🚀"", 'url': 'https://youtu.be/rWEPSKkkdKQ?t=132', 'created': 1612078297.0}",2021-01-31 07:31:37
48,bubblesqueezer,1612078290,"Not financial advice, but if you believe in $GME, buy 1-5+ shares! All else, HODL!",https://i.redd.it/hn589zsneme61.jpg,1612078290.0,"{'author': 'bubblesqueezer', 'created_utc': 1612078290, 'title': 'Not financial advice, but if you believe in $GME, buy 1-5+ shares! All else, HODL!', 'url': 'https://i.redd.it/hn589zsneme61.jpg', 'created': 1612078290.0}",2021-01-31 07:31:30
49,dosie101,1612078289,How to bypass Wall Street trade blocks,https://www.reddit.com/r/wallstreetbets/comments/l97f31/how_to_bypass_wall_street_trade_blocks/,1612078289.0,"{'author': 'dosie101', 'created_utc': 1612078289, 'title': 'How to bypass Wall Street trade blocks', 'url': 'https://www.reddit.com/r/wallstreetbets/comments/l97f31/how_to_bypass_wall_street_trade_blocks/', 'created': 1612078289.0}",2021-01-31 07:31:29
50,my-time-has-odor,1612078286,"Price analysis on $AMC. The stonk goes brr and we transcend time and space. Fr tho, $20 close on Monday.",https://i.redd.it/w77q6u8weme61.jpg,1612078286.0,"{'author': 'my-time-has-odor', 'created_utc': 1612078286, 'title': 'Price analysis on $AMC. The stonk goes brr and we transcend time and space. Fr tho, $20 close on Monday.', 'url': 'https://i.redd.it/w77q6u8weme61.jpg', 'created': 1612078286.0}",2021-01-31 07:31:26
51,InternationalLeek202,1612078286,Want to make a change with you guys,https://www.reddit.com/r/wallstreetbets/comments/l97f1v/want_to_make_a_change_with_you_guys/,1612078286.0,"{'author': 'InternationalLeek202', 'created_utc': 1612078286, 'title': 'Want to make a change with you guys', 'url': 'https://www.reddit.com/r/wallstreetbets/comments/l97f1v/want_to_make_a_change_with_you_guys/', 'created': 1612078286.0}",2021-01-31 07:31:26
52,redpilltrades,1612078285,They will be afraid to hand out more free money!,https://i.redd.it/w90bk6toeme61.png,1612078285.0,"{'author': 'redpilltrades', 'created_utc': 1612078285, 'title': 'They will be afraid to hand out more free money!', 'url': 'https://i.redd.it/w90bk6toeme61.png', 'created': 1612078285.0}",2021-01-31 07:31:25
53,webberc,1612078275,Gotta spread the word about this stock I like in the Tinder bio. I like the stock.,https://i.redd.it/f2sazc3veme61.jpg,1612078275.0,"{'author': 'webberc', 'created_utc': 1612078275, 'title': 'Gotta spread the word about this stock I like in the Tinder bio. I like the stock.', 'url': 'https://i.redd.it/f2sazc3veme61.jpg', 'created': 1612078275.0}",2021-01-31 07:31:15
54,TonyLiberty,1612078275,My EPIC updated DD (due diligence) for $SLV (part II). I feel like I just discovered Quantum Theory after putting this together. I Spent 3 hours researching. I am excited. I Would love to hear feedback (positive of negative). Thanks,https://www.reddit.com/r/wallstreetbets/comments/l97eym/my_epic_updated_dd_due_diligence_for_slv_part_ii/,1612078275.0,"{'author': 'TonyLiberty', 'created_utc': 1612078275, 'title': 'My EPIC updated DD (due diligence) for $SLV (part II). I feel like I just discovered Quantum Theory after putting this together. I Spent 3 hours researching. I am excited. I Would love to hear feedback (positive of negative). Thanks', 'url': 'https://www.reddit.com/r/wallstreetbets/comments/l97eym/my_epic_updated_dd_due_diligence_for_slv_part_ii/', 'created': 1612078275.0}",2021-01-31 07:31:15
55,typicalinvestor_808,1612078263,Justin Sun got our back gang. 🦍💎🚀 Hold the line.,https://i.redd.it/d79cabpteme61.jpg,1612078263.0,"{'author': 'typicalinvestor_808', 'created_utc': 1612078263, 'title': 'Justin Sun got our back gang. 🦍💎🚀 Hold the line.', 'url': 'https://i.redd.it/d79cabpteme61.jpg', 'created': 1612078263.0}",2021-01-31 07:31:03
56,wackysock,1612078261,"Lost my job. In debt for over $6,000.00. Used my last bit of money to buy GME at 350.00. I will HOLD.",https://www.reddit.com/r/wallstreetbets/comments/l97etz/lost_my_job_in_debt_for_over_600000_used_my_last/,1612078261.0,"{'author': 'wackysock', 'created_utc': 1612078261, 'title': 'Lost my job. In debt for over $6,000.00. Used my last bit of money to buy GME at 350.00. I will HOLD.', 'url': 'https://www.reddit.com/r/wallstreetbets/comments/l97etz/lost_my_job_in_debt_for_over_600000_used_my_last/', 'created': 1612078261.0}",2021-01-31 07:31:01
57,CelloTrails,1612078260,"Seriously though, I've never seen so many people simultaneously fighting for the truth and individually putting their fucking money where their mouths are. Thanks for letting us noobs tag along 💎✋🤚",https://v.redd.it/k2nns3iy9me61,1612078260.0,"{'author': 'CelloTrails', 'created_utc': 1612078260, 'title': ""Seriously though, I've never seen so many people simultaneously fighting for the truth and individually putting their fucking money where their mouths are. Thanks for letting us noobs tag along 💎✋🤚"", 'url': 'https://v.redd.it/k2nns3iy9me61', 'created': 1612078260.0}",2021-01-31 07:31:00
58,smnwit,1612078250,Dogecoin... enough said. Lets take this bitch to the moon,https://www.reddit.com/r/wallstreetbets/comments/l97eqj/dogecoin_enough_said_lets_take_this_bitch_to_the/,1612078250.0,"{'author': 'smnwit', 'created_utc': 1612078250, 'title': 'Dogecoin... enough said. Lets take this bitch to the moon', 'url': 'https://www.reddit.com/r/wallstreetbets/comments/l97eqj/dogecoin_enough_said_lets_take_this_bitch_to_the/', 'created': 1612078250.0}",2021-01-31 07:30:50
59,Pr1me_8,1612078248,Buying in Turkey,https://www.reddit.com/r/wallstreetbets/comments/l97eq2/buying_in_turkey/,1612078248.0,"{'author': 'Pr1me_8', 'created_utc': 1612078248, 'title': 'Buying in Turkey', 'url': 'https://www.reddit.com/r/wallstreetbets/comments/l97eq2/buying_in_turkey/', 'created': 1612078248.0}",2021-01-31 07:30:48
60,Kevk86,1612078244,Time to hunt them whales me lads,https://i.redd.it/gy410ksreme61.jpg,1612078244.0,"{'author': 'Kevk86', 'created_utc': 1612078244, 'title': 'Time to hunt them whales me lads', 'url': 'https://i.redd.it/gy410ksreme61.jpg', 'created': 1612078244.0}",2021-01-31 07:30:44
61,Hadam093,1612078243,#trx #TRON #gamestop #dogecoin,https://www.reddit.com/r/wallstreetbets/comments/l97eoh/trx_tron_gamestop_dogecoin/,1612078243.0,"{'author': 'Hadam093', 'created_utc': 1612078243, 'title': '#trx #TRON #gamestop #dogecoin', 'url': 'https://www.reddit.com/r/wallstreetbets/comments/l97eoh/trx_tron_gamestop_dogecoin/', 'created': 1612078243.0}",2021-01-31 07:30:43
