,author,created_utc,title,url,created,d_,created_utc_dt
0,Proper-Professor-365,1612742801,Email to me from LKNCY,https://www.reddit.com/r/wallstreetbets/comments/lezaq3/email_to_me_from_lkncy/,1612742801.0,"{'author': 'Proper-Professor-365', 'created_utc': 1612742801, 'title': 'Email to me from LKNCY', 'url': 'https://www.reddit.com/r/wallstreetbets/comments/lezaq3/email_to_me_from_lkncy/', 'created': 1612742801.0}",2021-02-08 00:06:41
1,RoughProfile8,1612742764,Pray for me.,https://i.redd.it/tu9no09qa5g61.jpg,1612742764.0,"{'author': 'RoughProfile8', 'created_utc': 1612742764, 'title': 'Pray for me.', 'url': 'https://i.redd.it/tu9no09qa5g61.jpg', 'created': 1612742764.0}",2021-02-08 00:06:04
2,[deleted],1612742744,Shorts attacking a stonk that is currently battling a share reduction! Potential outstanding to go from 230 million shares to 30 million shares,https://www.reddit.com/r/wallstreetbets/comments/leza4x/shorts_attacking_a_stonk_that_is_currently/,1612742744.0,"{'author': '[deleted]', 'created_utc': 1612742744, 'title': 'Shorts attacking a stonk that is currently battling a share reduction! Potential outstanding to go from 230 million shares to 30 million shares', 'url': 'https://www.reddit.com/r/wallstreetbets/comments/leza4x/shorts_attacking_a_stonk_that_is_currently/', 'created': 1612742744.0}",2021-02-08 00:05:44
3,Ok-Secretary-3236,1612742728,$Doge to the moon primates!!,https://www.reddit.com/r/wallstreetbets/comments/lez9yx/doge_to_the_moon_primates/,1612742728.0,"{'author': 'Ok-Secretary-3236', 'created_utc': 1612742728, 'title': '$Doge to the moon primates!!', 'url': 'https://www.reddit.com/r/wallstreetbets/comments/lez9yx/doge_to_the_moon_primates/', 'created': 1612742728.0}",2021-02-08 00:05:28
4,christophertinger,1612742701,How Reddit Took Down Wall Street,https://www.reddit.com/r/wallstreetbets/comments/lez9o2/how_reddit_took_down_wall_street/,1612742701.0,"{'author': 'christophertinger', 'created_utc': 1612742701, 'title': 'How Reddit Took Down Wall Street', 'url': 'https://www.reddit.com/r/wallstreetbets/comments/lez9o2/how_reddit_took_down_wall_street/', 'created': 1612742701.0}",2021-02-08 00:05:01
5,senpai-parsa,1612742640,DOGECOin,https://www.reddit.com/r/wallstreetbets/comments/lez8zc/dogecoin/,1612742640.0,"{'author': 'senpai-parsa', 'created_utc': 1612742640, 'title': 'DOGECOin', 'url': 'https://www.reddit.com/r/wallstreetbets/comments/lez8zc/dogecoin/', 'created': 1612742640.0}",2021-02-08 00:04:00
6,3Dadventurer,1612742638,I just made a 3D printed coin holder because it HOLD!,https://www.reddit.com/gallery/lez8yh,1612742638.0,"{'author': '3Dadventurer', 'created_utc': 1612742638, 'title': 'I just made a 3D printed coin holder because it HOLD!', 'url': 'https://www.reddit.com/gallery/lez8yh', 'created': 1612742638.0}",2021-02-08 00:03:58
7,hhdvuez,1612742635,Down 412 K and i feel like this meme fully applies to me,https://www.reddit.com/gallery/lez8xi,1612742635.0,"{'author': 'hhdvuez', 'created_utc': 1612742635, 'title': 'Down 412 K and i feel like this meme fully applies to me', 'url': 'https://www.reddit.com/gallery/lez8xi', 'created': 1612742635.0}",2021-02-08 00:03:55
8,[deleted],1612742595,Robinhood’s ad is a good time for a bathroom break,https://i.redd.it/jq3vib58a5g61.jpg,1612742595.0,"{'author': '[deleted]', 'created_utc': 1612742595, 'title': 'Robinhood’s ad is a good time for a bathroom break', 'url': 'https://i.redd.it/jq3vib58a5g61.jpg', 'created': 1612742595.0}",2021-02-08 00:03:15
9,sungbylee,1612742572,I sold all of my snapchat stocks to buy GME last week. It feels bad bro,https://i.redd.it/xa2hlg8w95g61.png,1612742572.0,"{'author': 'sungbylee', 'created_utc': 1612742572, 'title': 'I sold all of my snapchat stocks to buy GME last week. It feels bad bro', 'url': 'https://i.redd.it/xa2hlg8w95g61.png', 'created': 1612742572.0}",2021-02-08 00:02:52
10,newecw,1612742559,Can I endure another week?!,https://i.redd.it/pwkz33c4a5g61.jpg,1612742559.0,"{'author': 'newecw', 'created_utc': 1612742559, 'title': 'Can I endure another week?!', 'url': 'https://i.redd.it/pwkz33c4a5g61.jpg', 'created': 1612742559.0}",2021-02-08 00:02:39
11,GoGoJoJoMoMoooo,1612742548,Lets get back to WSB basics...balls to the wall on CARR. 🚀🚀🚀’s over $45 or my wife will leave me for another autist.,https://i.redd.it/qnxajg53a5g61.jpg,1612742548.0,"{'author': 'GoGoJoJoMoMoooo', 'created_utc': 1612742548, 'title': 'Lets get back to WSB basics...balls to the wall on CARR. 🚀🚀🚀’s over $45 or my wife will leave me for another autist.', 'url': 'https://i.redd.it/qnxajg53a5g61.jpg', 'created': 1612742548.0}",2021-02-08 00:02:28
12,altobagel,1612742548,Spotted this in: Tórshavn - Faroe Islands,https://i.redd.it/y8ogji50a5g61.jpg,1612742548.0,"{'author': 'altobagel', 'created_utc': 1612742548, 'title': 'Spotted this in: Tórshavn - Faroe Islands', 'url': 'https://i.redd.it/y8ogji50a5g61.jpg', 'created': 1612742548.0}",2021-02-08 00:02:28
13,LobsterAfter,1612742545,"Reddit DELETED my ENTIRE ACCOUNT after I posted this describing the tactics of the paid WS troll army. So, like them, I bought a fake account and will repost it. F U Trolls - two can play this game!",https://www.reddit.com/r/wallstreetbets/comments/lez7ze/reddit_deleted_my_entire_account_after_i_posted/,1612742545.0,"{'author': 'LobsterAfter', 'created_utc': 1612742545, 'title': 'Reddit DELETED my ENTIRE ACCOUNT after I posted this describing the tactics of the paid WS troll army. So, like them, I bought a fake account and will repost it. F U Trolls - two can play this game!', 'url': 'https://www.reddit.com/r/wallstreetbets/comments/lez7ze/reddit_deleted_my_entire_account_after_i_posted/', 'created': 1612742545.0}",2021-02-08 00:02:25
14,kjbaran,1612742515,A sign of things to come?🚀,https://i.redd.it/egxqf9bz95g61.jpg,1612742515.0,"{'author': 'kjbaran', 'created_utc': 1612742515, 'title': 'A sign of things to come?🚀', 'url': 'https://i.redd.it/egxqf9bz95g61.jpg', 'created': 1612742515.0}",2021-02-08 00:01:55
15,[deleted],1612742500,Robinhood’s ad is a good time for a bathroom break,https://i.redd.it/1yrv4i2y95g61.jpg,1612742500.0,"{'author': '[deleted]', 'created_utc': 1612742500, 'title': 'Robinhood’s ad is a good time for a bathroom break', 'url': 'https://i.redd.it/1yrv4i2y95g61.jpg', 'created': 1612742500.0}",2021-02-08 00:01:40
16,AmericanMadeKid,1612742497,"I have been played like a fiddle by, Robinhood, Citadel, Melvin and Jim Cramer!! Every move I make get fucked up!! Fuck these market makers.",https://i.redd.it/v6n7jekx95g61.jpg,1612742497.0,"{'author': 'AmericanMadeKid', 'created_utc': 1612742497, 'title': 'I have been played like a fiddle by, Robinhood, Citadel, Melvin and Jim Cramer!! Every move I make get fucked up!! Fuck these market makers.', 'url': 'https://i.redd.it/v6n7jekx95g61.jpg', 'created': 1612742497.0}",2021-02-08 00:01:37
17,Ok-Hunt-5961,1612742482,Very complex theory I need u guys to know of. (Please. Please read),https://www.reddit.com/r/wallstreetbets/comments/lez7at/very_complex_theory_i_need_u_guys_to_know_of/,1612742482.0,"{'author': 'Ok-Hunt-5961', 'created_utc': 1612742482, 'title': 'Very complex theory I need u guys to know of. (Please. Please read)', 'url': 'https://www.reddit.com/r/wallstreetbets/comments/lez7at/very_complex_theory_i_need_u_guys_to_know_of/', 'created': 1612742482.0}",2021-02-08 00:01:22
18,nico517,1612742414,Dogecoin,https://www.reddit.com/r/wallstreetbets/comments/lez6c1/dogecoin/,1612742414.0,"{'author': 'nico517', 'created_utc': 1612742414, 'title': 'Dogecoin', 'url': 'https://www.reddit.com/r/wallstreetbets/comments/lez6c1/dogecoin/', 'created': 1612742414.0}",2021-02-08 00:00:14
19,Slow_firebird,1612742399,New the the investing world. I don’t think I’m doing too bad since I’ve made over $10 so far,https://i.redd.it/odlu6h7n95g61.jpg,1612742399.0,"{'author': 'Slow_firebird', 'created_utc': 1612742399, 'title': 'New the the investing world. I don’t think I’m doing too bad since I’ve made over $10 so far', 'url': 'https://i.redd.it/odlu6h7n95g61.jpg', 'created': 1612742399.0}",2021-02-07 23:59:59
20,mflight1980,1612742385,Here is my referral code for the BEE network. Get 1 free BEE when you join: bb1980. Download from https://bee.com/download.html,https://bee.com/download.html,1612742385.0,"{'author': 'mflight1980', 'created_utc': 1612742385, 'title': 'Here is my referral code for the BEE network. Get 1 free BEE when you join: bb1980. Download from https://bee.com/download.html', 'url': 'https://bee.com/download.html', 'created': 1612742385.0}",2021-02-07 23:59:45
21,Secure_Try6176,1612742363,"Feb 07, 2021 | Today's Top 25 WSB Tickers",https://www.reddit.com/r/wallstreetbets/comments/lez5sl/feb_07_2021_todays_top_25_wsb_tickers/,1612742363.0,"{'author': 'Secure_Try6176', 'created_utc': 1612742363, 'title': ""Feb 07, 2021 | Today's Top 25 WSB Tickers"", 'url': 'https://www.reddit.com/r/wallstreetbets/comments/lez5sl/feb_07_2021_todays_top_25_wsb_tickers/', 'created': 1612742363.0}",2021-02-07 23:59:23
22,StockCrusher,1612742346,"OTLK - Worth at Least a Small Position, Larger Position Gets You More 💵💵💵💵💰💰💰💰💰",https://www.reddit.com/r/wallstreetbets/comments/lez5lu/otlk_worth_at_least_a_small_position_larger/,1612742346.0,"{'author': 'StockCrusher', 'created_utc': 1612742346, 'title': 'OTLK - Worth at Least a Small Position, Larger Position Gets You More 💵💵💵💵💰💰💰💰💰', 'url': 'https://www.reddit.com/r/wallstreetbets/comments/lez5lu/otlk_worth_at_least_a_small_position_larger/', 'created': 1612742346.0}",2021-02-07 23:59:06
23,Joeymhmjr,1612742341,Will dogecoin reach 0.10 what you guys think,https://www.reddit.com/r/wallstreetbets/comments/lez5km/will_dogecoin_reach_010_what_you_guys_think/,1612742341.0,"{'author': 'Joeymhmjr', 'created_utc': 1612742341, 'title': 'Will dogecoin reach 0.10 what you guys think', 'url': 'https://www.reddit.com/r/wallstreetbets/comments/lez5km/will_dogecoin_reach_010_what_you_guys_think/', 'created': 1612742341.0}",2021-02-07 23:59:01
24,ShayIran,1612742322,This is how everyone should hold their Stonks💎🤲🏻💎🤲🏻💎 #BeThisGuy,https://i.redd.it/l40y70xe95g61.jpg,1612742322.0,"{'author': 'ShayIran', 'created_utc': 1612742322, 'title': 'This is how everyone should hold their Stonks💎🤲🏻💎🤲🏻💎 #BeThisGuy', 'url': 'https://i.redd.it/l40y70xe95g61.jpg', 'created': 1612742322.0}",2021-02-07 23:58:42
25,dedk1,1612742296,They can stop us to buy GME but not dogecoin,https://i.redd.it/kg8djq5c95g61.jpg,1612742296.0,"{'author': 'dedk1', 'created_utc': 1612742296, 'title': 'They can stop us to buy GME but not dogecoin', 'url': 'https://i.redd.it/kg8djq5c95g61.jpg', 'created': 1612742296.0}",2021-02-07 23:58:16
26,TendiesCrusher,1612742280,"Thank you Dr.Burry, a legend who's been on the right side of history TWICE",https://i.redd.it/trv6mnfa95g61.jpg,1612742280.0,"{'author': 'TendiesCrusher', 'created_utc': 1612742280, 'title': ""Thank you Dr.Burry, a legend who's been on the right side of history TWICE"", 'url': 'https://i.redd.it/trv6mnfa95g61.jpg', 'created': 1612742280.0}",2021-02-07 23:58:00
27,gorzholio,1612742278,Buy DIS,https://www.reddit.com/r/wallstreetbets/comments/lez4xg/buy_dis/,1612742278.0,"{'author': 'gorzholio', 'created_utc': 1612742278, 'title': 'Buy DIS', 'url': 'https://www.reddit.com/r/wallstreetbets/comments/lez4xg/buy_dis/', 'created': 1612742278.0}",2021-02-07 23:57:58
28,1400_Game_Tokens,1612742267,Explain 'shorts' to your older relatives,https://www.reddit.com/r/wallstreetbets/comments/lez4tp/explain_shorts_to_your_older_relatives/,1612742267.0,"{'author': '1400_Game_Tokens', 'created_utc': 1612742267, 'title': ""Explain 'shorts' to your older relatives"", 'url': 'https://www.reddit.com/r/wallstreetbets/comments/lez4tp/explain_shorts_to_your_older_relatives/', 'created': 1612742267.0}",2021-02-07 23:57:47
29,NewAgePhilosophr,1612742259,Dogecoin... worth buying?,https://www.reddit.com/r/wallstreetbets/comments/lez4qu/dogecoin_worth_buying/,1612742259.0,"{'author': 'NewAgePhilosophr', 'created_utc': 1612742259, 'title': 'Dogecoin... worth buying?', 'url': 'https://www.reddit.com/r/wallstreetbets/comments/lez4qu/dogecoin_worth_buying/', 'created': 1612742259.0}",2021-02-07 23:57:39
30,[deleted],1612742200,Not your parents PLAYBOY: How Playboy is reinventing themselves and why you should Invest $MCAC,https://www.reddit.com/r/wallstreetbets/comments/lez41z/not_your_parents_playboy_how_playboy_is/,1612742200.0,"{'author': '[deleted]', 'created_utc': 1612742200, 'title': 'Not your parents PLAYBOY: How Playboy is reinventing themselves and why you should Invest $MCAC', 'url': 'https://www.reddit.com/r/wallstreetbets/comments/lez41z/not_your_parents_playboy_how_playboy_is/', 'created': 1612742200.0}",2021-02-07 23:56:40
31,BigXBenz,1612742185,Who else saw the $GME Super Bowl ad?!,https://i.redd.it/2tlq7m7095g61.jpg,1612742185.0,"{'author': 'BigXBenz', 'created_utc': 1612742185, 'title': 'Who else saw the $GME Super Bowl ad?!', 'url': 'https://i.redd.it/2tlq7m7095g61.jpg', 'created': 1612742185.0}",2021-02-07 23:56:25
32,JimBond000,1612742175,What’s the move this week if Chief win how will market respond vice versa if the Bucs win?,https://www.reddit.com/r/wallstreetbets/comments/lez3o9/whats_the_move_this_week_if_chief_win_how_will/,1612742175.0,"{'author': 'JimBond000', 'created_utc': 1612742175, 'title': 'What’s the move this week if Chief win how will market respond vice versa if the Bucs win?', 'url': 'https://www.reddit.com/r/wallstreetbets/comments/lez3o9/whats_the_move_this_week_if_chief_win_how_will/', 'created': 1612742175.0}",2021-02-07 23:56:15
33,wallstreetrogue,1612742135,Short and Interest,https://www.reddit.com/r/wallstreetbets/comments/lez33m/short_and_interest/,1612742135.0,"{'author': 'wallstreetrogue', 'created_utc': 1612742135, 'title': 'Short and Interest', 'url': 'https://www.reddit.com/r/wallstreetbets/comments/lez33m/short_and_interest/', 'created': 1612742135.0}",2021-02-07 23:55:35
34,Zeus124z,1612742126,I messed up,https://www.reddit.com/r/wallstreetbets/comments/lez2yr/i_messed_up/,1612742126.0,"{'author': 'Zeus124z', 'created_utc': 1612742126, 'title': 'I messed up', 'url': 'https://www.reddit.com/r/wallstreetbets/comments/lez2yr/i_messed_up/', 'created': 1612742126.0}",2021-02-07 23:55:26
35,StockMaster-,1612742118,"NOTICE HOW GME TRADED BETWEEN 22 and 50 Day moving averages, A reversal is due to happen this week back to 150",https://i.redd.it/oypdju4t85g61.jpg,1612742118.0,"{'author': 'StockMaster-', 'created_utc': 1612742118, 'title': 'NOTICE HOW GME TRADED BETWEEN 22 and 50 Day moving averages, A reversal is due to happen this week back to 150', 'url': 'https://i.redd.it/oypdju4t85g61.jpg', 'created': 1612742118.0}",2021-02-07 23:55:18
36,Kiki_Moonchild,1612742112,New York Hedge Fund Founder (Daniel Kamensky) Pleads Guilty To Bankruptcy Fraud In Connection With Neiman Marcus Bankruptcy,https://www.reddit.com/r/wallstreetbets/comments/lez2s3/new_york_hedge_fund_founder_daniel_kamensky/,1612742112.0,"{'author': 'Kiki_Moonchild', 'created_utc': 1612742112, 'title': 'New York Hedge Fund Founder (Daniel Kamensky) Pleads Guilty To Bankruptcy Fraud In Connection With Neiman Marcus Bankruptcy', 'url': 'https://www.reddit.com/r/wallstreetbets/comments/lez2s3/new_york_hedge_fund_founder_daniel_kamensky/', 'created': 1612742112.0}",2021-02-07 23:55:12
37,Desperate_Ad6372,1612742093,So I have 105$ to invest this week whose got those tips that can put me on the moon,https://i.redd.it/yv3qazdq85g61.jpg,1612742093.0,"{'author': 'Desperate_Ad6372', 'created_utc': 1612742093, 'title': 'So I have 105$ to invest this week whose got those tips that can put me on the moon', 'url': 'https://i.redd.it/yv3qazdq85g61.jpg', 'created': 1612742093.0}",2021-02-07 23:54:53
38,Forearmnut,1612742092,What If Tesla accepts Dogecoins as payments few years from now?,https://www.reddit.com/r/wallstreetbets/comments/lez2li/what_if_tesla_accepts_dogecoins_as_payments_few/,1612742092.0,"{'author': 'Forearmnut', 'created_utc': 1612742092, 'title': 'What If Tesla accepts Dogecoins as payments few years from now?', 'url': 'https://www.reddit.com/r/wallstreetbets/comments/lez2li/what_if_tesla_accepts_dogecoins_as_payments_few/', 'created': 1612742092.0}",2021-02-07 23:54:52
39,LankeyLad,1612742085,Underestimating the Hedge funds - Part 1,https://v.redd.it/zt4l5i8k85g61,1612742085.0,"{'author': 'LankeyLad', 'created_utc': 1612742085, 'title': 'Underestimating the Hedge funds - Part 1', 'url': 'https://v.redd.it/zt4l5i8k85g61', 'created': 1612742085.0}",2021-02-07 23:54:45
40,Tired-nursingstudent,1612742063,Going to the moon,https://images.app.goo.gl/5psf7vZVBeospm38A,1612742063.0,"{'author': 'Tired-nursingstudent', 'created_utc': 1612742063, 'title': 'Going to the moon', 'url': 'https://images.app.goo.gl/5psf7vZVBeospm38A', 'created': 1612742063.0}",2021-02-07 23:54:23
41,WeFoundTreasure,1612742059,Doge to the moon,https://www.reddit.com/r/wallstreetbets/comments/lez2a6/doge_to_the_moon/,1612742059.0,"{'author': 'WeFoundTreasure', 'created_utc': 1612742059, 'title': 'Doge to the moon', 'url': 'https://www.reddit.com/r/wallstreetbets/comments/lez2a6/doge_to_the_moon/', 'created': 1612742059.0}",2021-02-07 23:54:19
42,stop_fucking_talking,1612742049,Waiting on the $GME squeeze like...,https://i.redd.it/uoo81rhl85g61.jpg,1612742049.0,"{'author': 'stop_fucking_talking', 'created_utc': 1612742049, 'title': 'Waiting on the $GME squeeze like...', 'url': 'https://i.redd.it/uoo81rhl85g61.jpg', 'created': 1612742049.0}",2021-02-07 23:54:09
43,DannyVFilms,1612742029,Got in late but we riding $DOGE straight to Mars?,https://i.redd.it/z9spw1nj85g61.jpg,1612742029.0,"{'author': 'DannyVFilms', 'created_utc': 1612742029, 'title': 'Got in late but we riding $DOGE straight to Mars?', 'url': 'https://i.redd.it/z9spw1nj85g61.jpg', 'created': 1612742029.0}",2021-02-07 23:53:49
44,ExtraBullishish,1612742026,Help Companies regain strength,https://www.reddit.com/r/wallstreetbets/comments/lez1y6/help_companies_regain_strength/,1612742026.0,"{'author': 'ExtraBullishish', 'created_utc': 1612742026, 'title': 'Help Companies regain strength', 'url': 'https://www.reddit.com/r/wallstreetbets/comments/lez1y6/help_companies_regain_strength/', 'created': 1612742026.0}",2021-02-07 23:53:46
45,BestUCanIsGoodEnough,1612741994,THIS IS IT!! HOW IT ALL STARTED!,https://www.reddit.com/r/wallstreetbets/comments/lez1ml/this_is_it_how_it_all_started/,1612741994.0,"{'author': 'BestUCanIsGoodEnough', 'created_utc': 1612741994, 'title': 'THIS IS IT!! HOW IT ALL STARTED!', 'url': 'https://www.reddit.com/r/wallstreetbets/comments/lez1ml/this_is_it_how_it_all_started/', 'created': 1612741994.0}",2021-02-07 23:53:14
46,GlassThought2476,1612741983,Doge coin you twats!!,https://www.reddit.com/r/wallstreetbets/comments/lez1ia/doge_coin_you_twats/,1612741983.0,"{'author': 'GlassThought2476', 'created_utc': 1612741983, 'title': 'Doge coin you twats!!', 'url': 'https://www.reddit.com/r/wallstreetbets/comments/lez1ia/doge_coin_you_twats/', 'created': 1612741983.0}",2021-02-07 23:53:03
47,itmedannyp,1612741973,A summary of the past week,https://v.redd.it/zfcnuutw75g61,1612741973.0,"{'author': 'itmedannyp', 'created_utc': 1612741973, 'title': 'A summary of the past week', 'url': 'https://v.redd.it/zfcnuutw75g61', 'created': 1612741973.0}",2021-02-07 23:52:53
48,TheSauce32,1612741970,People making bank on $Dogecoin a meme crypto that was never suppose to be a serious thing while people here are holding a dead stock on principle.,https://www.reddit.com/r/wallstreetbets/comments/lez1e8/people_making_bank_on_dogecoin_a_meme_crypto_that/,1612741970.0,"{'author': 'TheSauce32', 'created_utc': 1612741970, 'title': 'People making bank on $Dogecoin a meme crypto that was never suppose to be a serious thing while people here are holding a dead stock on principle.', 'url': 'https://www.reddit.com/r/wallstreetbets/comments/lez1e8/people_making_bank_on_dogecoin_a_meme_crypto_that/', 'created': 1612741970.0}",2021-02-07 23:52:50
49,PokaHerHontas,1612741968,Gorilla glue!,https://www.reddit.com/r/wallstreetbets/comments/lez1df/gorilla_glue/,1612741968.0,"{'author': 'PokaHerHontas', 'created_utc': 1612741968, 'title': 'Gorilla glue!', 'url': 'https://www.reddit.com/r/wallstreetbets/comments/lez1df/gorilla_glue/', 'created': 1612741968.0}",2021-02-07 23:52:48
50,aleblanki,1612741961,Cryptos or Stock?,https://www.reddit.com/r/wallstreetbets/comments/lez1ad/cryptos_or_stock/,1612741961.0,"{'author': 'aleblanki', 'created_utc': 1612741961, 'title': 'Cryptos or Stock?', 'url': 'https://www.reddit.com/r/wallstreetbets/comments/lez1ad/cryptos_or_stock/', 'created': 1612741961.0}",2021-02-07 23:52:41
51,ldigruccio,1612741900,"When it’s all you have, it hurts worse. But you know what 💎🙌🏻 fuck wall street.",https://i.redd.it/hhfuqkt585g61.jpg,1612741900.0,"{'author': 'ldigruccio', 'created_utc': 1612741900, 'title': 'When it’s all you have, it hurts worse. But you know what 💎🙌🏻 fuck wall street.', 'url': 'https://i.redd.it/hhfuqkt585g61.jpg', 'created': 1612741900.0}",2021-02-07 23:51:40
52,Resident-Function-94,1612741900,What is the next big thing?,https://www.reddit.com/r/wallstreetbets/comments/lez0fu/what_is_the_next_big_thing/,1612741900.0,"{'author': 'Resident-Function-94', 'created_utc': 1612741900, 'title': 'What is the next big thing?', 'url': 'https://www.reddit.com/r/wallstreetbets/comments/lez0fu/what_is_the_next_big_thing/', 'created': 1612741900.0}",2021-02-07 23:51:40
53,ExtraBullishish,1612741899,New targets,https://www.reddit.com/r/wallstreetbets/comments/lez0eu/new_targets/,1612741899.0,"{'author': 'ExtraBullishish', 'created_utc': 1612741899, 'title': 'New targets', 'url': 'https://www.reddit.com/r/wallstreetbets/comments/lez0eu/new_targets/', 'created': 1612741899.0}",2021-02-07 23:51:39
54,Pera990,1612741894,GmE,https://www.reddit.com/r/wallstreetbets/comments/lez0ca/gme/,1612741894.0,"{'author': 'Pera990', 'created_utc': 1612741894, 'title': 'GmE', 'url': 'https://www.reddit.com/r/wallstreetbets/comments/lez0ca/gme/', 'created': 1612741894.0}",2021-02-07 23:51:34
55,ChillinDylan19983,1612741874,Doge to dime!!!!,https://www.reddit.com/r/wallstreetbets/comments/lez00v/doge_to_dime/,1612741874.0,"{'author': 'ChillinDylan19983', 'created_utc': 1612741874, 'title': 'Doge to dime!!!!', 'url': 'https://www.reddit.com/r/wallstreetbets/comments/lez00v/doge_to_dime/', 'created': 1612741874.0}",2021-02-07 23:51:14
56,[deleted],1612741851,Here we go again.,https://i.redd.it/c1rg3nf085g61.png,1612741851.0,"{'author': '[deleted]', 'created_utc': 1612741851, 'title': 'Here we go again.', 'url': 'https://i.redd.it/c1rg3nf085g61.png', 'created': 1612741851.0}",2021-02-07 23:50:51
57,Pera990,1612741833,Hello Guys... I don-t have a clue how to invest.. SO I BOUGHT GME,https://www.reddit.com/r/wallstreetbets/comments/leyzg8/hello_guys_i_dont_have_a_clue_how_to_invest_so_i/,1612741833.0,"{'author': 'Pera990', 'created_utc': 1612741833, 'title': 'Hello Guys... I don-t have a clue how to invest.. SO I BOUGHT GME', 'url': 'https://www.reddit.com/r/wallstreetbets/comments/leyzg8/hello_guys_i_dont_have_a_clue_how_to_invest_so_i/', 'created': 1612741833.0}",2021-02-07 23:50:33
58,Ryan-Viper4171,1612741812,YES!,https://www.reddit.com/gallery/leyz4r,1612741812.0,"{'author': 'Ryan-Viper4171', 'created_utc': 1612741812, 'title': 'YES!', 'url': 'https://www.reddit.com/gallery/leyz4r', 'created': 1612741812.0}",2021-02-07 23:50:12
59,PopeyeSeattle,1612741791,NOK FCF based price - what are we missing?,https://www.reddit.com/r/wallstreetbets/comments/leyywl/nok_fcf_based_price_what_are_we_missing/,1612741791.0,"{'author': 'PopeyeSeattle', 'created_utc': 1612741791, 'title': 'NOK FCF based price - what are we missing?', 'url': 'https://www.reddit.com/r/wallstreetbets/comments/leyywl/nok_fcf_based_price_what_are_we_missing/', 'created': 1612741791.0}",2021-02-07 23:49:51
60,Love-the-Little-guy,1612741707,Pfizer,https://www.reddit.com/r/wallstreetbets/comments/leyxz4/pfizer/,1612741707.0,"{'author': 'Love-the-Little-guy', 'created_utc': 1612741707, 'title': 'Pfizer', 'url': 'https://www.reddit.com/r/wallstreetbets/comments/leyxz4/pfizer/', 'created': 1612741707.0}",2021-02-07 23:48:27
61,DannyLOLilley,1612741704,HODL Doge!,https://www.reddit.com/r/wallstreetbets/comments/leyxxw/hodl_doge/,1612741704.0,"{'author': 'DannyLOLilley', 'created_utc': 1612741704, 'title': 'HODL Doge!', 'url': 'https://www.reddit.com/r/wallstreetbets/comments/leyxxw/hodl_doge/', 'created': 1612741704.0}",2021-02-07 23:48:24
62,Intrepid_Tailor9438,1612741701,GME OPEN,https://www.reddit.com/r/wallstreetbets/comments/leyxwm/gme_open/,1612741701.0,"{'author': 'Intrepid_Tailor9438', 'created_utc': 1612741701, 'title': 'GME OPEN', 'url': 'https://www.reddit.com/r/wallstreetbets/comments/leyxwm/gme_open/', 'created': 1612741701.0}",2021-02-07 23:48:21
63,tarasca6,1612741681,HCMC GONNA WIN THE LAWSUIT!!!,https://www.reddit.com/r/wallstreetbets/comments/leyxon/hcmc_gonna_win_the_lawsuit/,1612741681.0,"{'author': 'tarasca6', 'created_utc': 1612741681, 'title': 'HCMC GONNA WIN THE LAWSUIT!!!', 'url': 'https://www.reddit.com/r/wallstreetbets/comments/leyxon/hcmc_gonna_win_the_lawsuit/', 'created': 1612741681.0}",2021-02-07 23:48:01
64,itzglobal,1612741675,$BBW,https://www.reddit.com/r/wallstreetbets/comments/leyxme/bbw/,1612741675.0,"{'author': 'itzglobal', 'created_utc': 1612741675, 'title': '$BBW', 'url': 'https://www.reddit.com/r/wallstreetbets/comments/leyxme/bbw/', 'created': 1612741675.0}",2021-02-07 23:47:55
65,daly1899,1612741666,I need help,https://www.reddit.com/r/wallstreetbets/comments/leyxj1/i_need_help/,1612741666.0,"{'author': 'daly1899', 'created_utc': 1612741666, 'title': 'I need help', 'url': 'https://www.reddit.com/r/wallstreetbets/comments/leyxj1/i_need_help/', 'created': 1612741666.0}",2021-02-07 23:47:46
