,author,created_utc,title,url,created,d_,created_utc_dt
0,Remarkable_Bill_4965,1611849844,someone help please?,https://www.reddit.com/r/wallstreetbets/comments/l70on6/someone_help_please/,1611849844.0,"{'author': 'Remarkable_Bill_4965', 'created_utc': 1611849844, 'title': 'someone help please?', 'url': 'https://www.reddit.com/r/wallstreetbets/comments/l70on6/someone_help_please/', 'created': 1611849844.0}",2021-01-28 16:04:04
1,FUCK50C1ETY,1611849844,The irony... WSB is the real Robin Hood! PS HOLDDDDDD,https://i.redd.it/nabkpb9mj3e61.jpg,1611849844.0,"{'author': 'FUCK50C1ETY', 'created_utc': 1611849844, 'title': 'The irony... WSB is the real Robin Hood! PS HOLDDDDDD', 'url': 'https://i.redd.it/nabkpb9mj3e61.jpg', 'created': 1611849844.0}",2021-01-28 16:04:04
2,Goose_Lord_7693,1611849844,"ROBINHOOD ISNT ALLOWING YOU TO SEARCH FOR GME, AMC, OR BB",https://www.reddit.com/r/wallstreetbets/comments/l70omw/robinhood_isnt_allowing_you_to_search_for_gme_amc/,1611849844.0,"{'author': 'Goose_Lord_7693', 'created_utc': 1611849844, 'title': 'ROBINHOOD ISNT ALLOWING YOU TO SEARCH FOR GME, AMC, OR BB', 'url': 'https://www.reddit.com/r/wallstreetbets/comments/l70omw/robinhood_isnt_allowing_you_to_search_for_gme_amc/', 'created': 1611849844.0}",2021-01-28 16:04:04
3,legowaffle05,1611849843,NOK,https://www.reddit.com/r/wallstreetbets/comments/l70omp/nok/,1611849843.0,"{'author': 'legowaffle05', 'created_utc': 1611849843, 'title': 'NOK', 'url': 'https://www.reddit.com/r/wallstreetbets/comments/l70omp/nok/', 'created': 1611849843.0}",2021-01-28 16:04:03
4,TheGlittering_Toe,1611849843,Don’t let Robinhood fuck you! Buy on Cashapp 💰🚀🚀,https://www.reddit.com/r/wallstreetbets/comments/l70oml/dont_let_robinhood_fuck_you_buy_on_cashapp/,1611849843.0,"{'author': 'TheGlittering_Toe', 'created_utc': 1611849843, 'title': 'Don’t let Robinhood fuck you! Buy on Cashapp 💰🚀🚀', 'url': 'https://www.reddit.com/r/wallstreetbets/comments/l70oml/dont_let_robinhood_fuck_you_buy_on_cashapp/', 'created': 1611849843.0}",2021-01-28 16:04:03
5,Nightrise19,1611849843,Free Market My Ass,https://www.reddit.com/r/wallstreetbets/comments/l70omg/free_market_my_ass/,1611849843.0,"{'author': 'Nightrise19', 'created_utc': 1611849843, 'title': 'Free Market My Ass', 'url': 'https://www.reddit.com/r/wallstreetbets/comments/l70omg/free_market_my_ass/', 'created': 1611849843.0}",2021-01-28 16:04:03
6,JLtheInvestor,1611849843,Actually buy and hold!!!,https://www.reddit.com/r/wallstreetbets/comments/l70omd/actually_buy_and_hold/,1611849843.0,"{'author': 'JLtheInvestor', 'created_utc': 1611849843, 'title': 'Actually buy and hold!!!', 'url': 'https://www.reddit.com/r/wallstreetbets/comments/l70omd/actually_buy_and_hold/', 'created': 1611849843.0}",2021-01-28 16:04:03
7,Scottieb17,1611849842,"Never forget. #neverforget This is the graph of VW before the mother of all short squeezes. This dip is normal. Regroup, stay calm, find a new brokerage, and buy $gme.",https://i.redd.it/eacj1m4mj3e61.jpg,1611849842.0,"{'author': 'Scottieb17', 'created_utc': 1611849842, 'title': 'Never forget. #neverforget This is the graph of VW before the mother of all short squeezes. This dip is normal. Regroup, stay calm, find a new brokerage, and buy $gme.', 'url': 'https://i.redd.it/eacj1m4mj3e61.jpg', 'created': 1611849842.0}",2021-01-28 16:04:02
8,ringedfalls,1611849842,"WE NEED TO DO SOMETHING ABOUT ROBINHOOD. like announce that people on this sub will no longer be using their app, if wsb has a official feed on twitter or whatever, tweet that and the media will push it out if we can get their attention",https://www.reddit.com/r/wallstreetbets/comments/l70olr/we_need_to_do_something_about_robinhood_like/,1611849842.0,"{'author': 'ringedfalls', 'created_utc': 1611849842, 'title': 'WE NEED TO DO SOMETHING ABOUT ROBINHOOD. like announce that people on this sub will no longer be using their app, if wsb has a official feed on twitter or whatever, tweet that and the media will push it out if we can get their attention', 'url': 'https://www.reddit.com/r/wallstreetbets/comments/l70olr/we_need_to_do_something_about_robinhood_like/', 'created': 1611849842.0}",2021-01-28 16:04:02
9,whatzefaks,1611849841,MOTHER OF GOD. IT'S THE ULTIMATE 🤑,https://twitter.com/DocumentingBTC/status/1354820426849898513?s=19,1611849841.0,"{'author': 'whatzefaks', 'created_utc': 1611849841, 'title': ""MOTHER OF GOD. IT'S THE ULTIMATE 🤑"", 'url': 'https://twitter.com/DocumentingBTC/status/1354820426849898513?s=19', 'created': 1611849841.0}",2021-01-28 16:04:01
10,mome75v,1611849841,Bb or nok,https://www.reddit.com/r/wallstreetbets/comments/l70ole/bb_or_nok/,1611849841.0,"{'author': 'mome75v', 'created_utc': 1611849841, 'title': 'Bb or nok', 'url': 'https://www.reddit.com/r/wallstreetbets/comments/l70ole/bb_or_nok/', 'created': 1611849841.0}",2021-01-28 16:04:01
11,Big-Week5312,1611849841,Stop Using Robinhood,https://www.reddit.com/r/wallstreetbets/comments/l70olc/stop_using_robinhood/,1611849841.0,"{'author': 'Big-Week5312', 'created_utc': 1611849841, 'title': 'Stop Using Robinhood', 'url': 'https://www.reddit.com/r/wallstreetbets/comments/l70olc/stop_using_robinhood/', 'created': 1611849841.0}",2021-01-28 16:04:01
12,djchristyle,1611849841,The rich get richer while the poor stay poor. Blatant market manipulation!,https://i.redd.it/bcsgzwzlj3e61.jpg,1611849841.0,"{'author': 'djchristyle', 'created_utc': 1611849841, 'title': 'The rich get richer while the poor stay poor. Blatant market manipulation!', 'url': 'https://i.redd.it/bcsgzwzlj3e61.jpg', 'created': 1611849841.0}",2021-01-28 16:04:01
13,Xanucks533,1611849841,Buy with the dip SNDL let’s cause a shortage with this ! Full send,https://www.reddit.com/r/wallstreetbets/comments/l70ol6/buy_with_the_dip_sndl_lets_cause_a_shortage_with/,1611849841.0,"{'author': 'Xanucks533', 'created_utc': 1611849841, 'title': 'Buy with the dip SNDL let’s cause a shortage with this ! Full send', 'url': 'https://www.reddit.com/r/wallstreetbets/comments/l70ol6/buy_with_the_dip_sndl_lets_cause_a_shortage_with/', 'created': 1611849841.0}",2021-01-28 16:04:01
14,Gillo17,1611849840,GME IS ON SALE! BUY THE DIP,https://www.reddit.com/r/wallstreetbets/comments/l70ol1/gme_is_on_sale_buy_the_dip/,1611849840.0,"{'author': 'Gillo17', 'created_utc': 1611849840, 'title': 'GME IS ON SALE! BUY THE DIP', 'url': 'https://www.reddit.com/r/wallstreetbets/comments/l70ol1/gme_is_on_sale_buy_the_dip/', 'created': 1611849840.0}",2021-01-28 16:04:00
15,KingOfTheP4s,1611849840,Some Redditors Have Silver ETFs In Their Sights,https://pub.webull.com/us/news-html/8463821da5014f0fb5c41eca18903f50.html?theme=2&amp;_v=1&amp;color=1&amp;hl=en&amp;sp=1&amp;_v=1&amp;theme=2&amp;color=1&amp;hl=en,1611849840.0,"{'author': 'KingOfTheP4s', 'created_utc': 1611849840, 'title': 'Some Redditors Have Silver ETFs In Their Sights', 'url': 'https://pub.webull.com/us/news-html/8463821da5014f0fb5c41eca18903f50.html?theme=2&amp;_v=1&amp;color=1&amp;hl=en&amp;sp=1&amp;_v=1&amp;theme=2&amp;color=1&amp;hl=en', 'created': 1611849840.0}",2021-01-28 16:04:00
16,nickgatsby24,1611849840,"Keep buying GME, 🧻🤲, please come and play with my tiny Asian salami. That’s the only thing you can hold onto. Won’t sell even if it’s $1.00 per share. Have fun.",https://www.reddit.com/r/wallstreetbets/comments/l70okt/keep_buying_gme_please_come_and_play_with_my_tiny/,1611849840.0,"{'author': 'nickgatsby24', 'created_utc': 1611849840, 'title': 'Keep buying GME, 🧻🤲, please come and play with my tiny Asian salami. That’s the only thing you can hold onto. Won’t sell even if it’s $1.00 per share. Have fun.', 'url': 'https://www.reddit.com/r/wallstreetbets/comments/l70okt/keep_buying_gme_please_come_and_play_with_my_tiny/', 'created': 1611849840.0}",2021-01-28 16:04:00
17,Greblanor,1611849840,If you have time and an open mind,https://www.reddit.com/r/wallstreetbets/comments/l70okr/if_you_have_time_and_an_open_mind/,1611849840.0,"{'author': 'Greblanor', 'created_utc': 1611849840, 'title': 'If you have time and an open mind', 'url': 'https://www.reddit.com/r/wallstreetbets/comments/l70okr/if_you_have_time_and_an_open_mind/', 'created': 1611849840.0}",2021-01-28 16:04:00
18,Aggravating_Fix1578,1611849840,RH THEORY!,https://www.reddit.com/r/wallstreetbets/comments/l70okq/rh_theory/,1611849840.0,"{'author': 'Aggravating_Fix1578', 'created_utc': 1611849840, 'title': 'RH THEORY!', 'url': 'https://www.reddit.com/r/wallstreetbets/comments/l70okq/rh_theory/', 'created': 1611849840.0}",2021-01-28 16:04:00
19,notScaredNotALoser,1611849840,Fight against Robinhood. They need to pay for our losses today due to market manipulation. Let's gang up!,https://www.reddit.com/r/wallstreetbets/comments/l70okl/fight_against_robinhood_they_need_to_pay_for_our/,1611849840.0,"{'author': 'notScaredNotALoser', 'created_utc': 1611849840, 'title': ""Fight against Robinhood. They need to pay for our losses today due to market manipulation. Let's gang up!"", 'url': 'https://www.reddit.com/r/wallstreetbets/comments/l70okl/fight_against_robinhood_they_need_to_pay_for_our/', 'created': 1611849840.0}",2021-01-28 16:04:00
20,SuckYourMum21,1611849839,Sooo are we still buying dogecoin or....?,https://www.reddit.com/r/wallstreetbets/comments/l70okc/sooo_are_we_still_buying_dogecoin_or/,1611849839.0,"{'author': 'SuckYourMum21', 'created_utc': 1611849839, 'title': 'Sooo are we still buying dogecoin or....?', 'url': 'https://www.reddit.com/r/wallstreetbets/comments/l70okc/sooo_are_we_still_buying_dogecoin_or/', 'created': 1611849839.0}",2021-01-28 16:03:59
21,Mustard_TigerNJ,1611849839,To the moooonnnn!,https://i.redd.it/3bhclytlj3e61.jpg,1611849839.0,"{'author': 'Mustard_TigerNJ', 'created_utc': 1611849839, 'title': 'To the moooonnnn!', 'url': 'https://i.redd.it/3bhclytlj3e61.jpg', 'created': 1611849839.0}",2021-01-28 16:03:59
22,judderbutter92,1611849839,Everyone rate the Robinhood app on the App Store,https://www.reddit.com/r/wallstreetbets/comments/l70ok5/everyone_rate_the_robinhood_app_on_the_app_store/,1611849839.0,"{'author': 'judderbutter92', 'created_utc': 1611849839, 'title': 'Everyone rate the Robinhood app on the App Store', 'url': 'https://www.reddit.com/r/wallstreetbets/comments/l70ok5/everyone_rate_the_robinhood_app_on_the_app_store/', 'created': 1611849839.0}",2021-01-28 16:03:59
23,nerVzzz,1611849839,HOLD THE LINE LIKE YOUR LIFE DEPENDED ON IT!,https://www.reddit.com/r/wallstreetbets/comments/l70ok1/hold_the_line_like_your_life_depended_on_it/,1611849839.0,"{'author': 'nerVzzz', 'created_utc': 1611849839, 'title': 'HOLD THE LINE LIKE YOUR LIFE DEPENDED ON IT!', 'url': 'https://www.reddit.com/r/wallstreetbets/comments/l70ok1/hold_the_line_like_your_life_depended_on_it/', 'created': 1611849839.0}",2021-01-28 16:03:59
24,JABNewWorld1776,1611849839,LOL! These hedge guys really want to block me off! I was gonna buy more to put more of a squeeze on 'em,https://i.redd.it/3mowz2slj3e61.jpg,1611849839.0,"{'author': 'JABNewWorld1776', 'created_utc': 1611849839, 'title': ""LOL! These hedge guys really want to block me off! I was gonna buy more to put more of a squeeze on 'em"", 'url': 'https://i.redd.it/3mowz2slj3e61.jpg', 'created': 1611849839.0}",2021-01-28 16:03:59
25,Glum-Volume-9696,1611849838,Will never use Robinhood again!!,https://i.redd.it/nu5bi0bkj3e61.jpg,1611849838.0,"{'author': 'Glum-Volume-9696', 'created_utc': 1611849838, 'title': 'Will never use Robinhood again!!', 'url': 'https://i.redd.it/nu5bi0bkj3e61.jpg', 'created': 1611849838.0}",2021-01-28 16:03:58
26,BearyBerryy,1611849838,Joined late,https://www.reddit.com/r/wallstreetbets/comments/l70oju/joined_late/,1611849838.0,"{'author': 'BearyBerryy', 'created_utc': 1611849838, 'title': 'Joined late', 'url': 'https://www.reddit.com/r/wallstreetbets/comments/l70oju/joined_late/', 'created': 1611849838.0}",2021-01-28 16:03:58
27,sgossard9,1611849838,Noob needs help in joining the cause,https://www.reddit.com/r/wallstreetbets/comments/l70ojp/noob_needs_help_in_joining_the_cause/,1611849838.0,"{'author': 'sgossard9', 'created_utc': 1611849838, 'title': 'Noob needs help in joining the cause', 'url': 'https://www.reddit.com/r/wallstreetbets/comments/l70ojp/noob_needs_help_in_joining_the_cause/', 'created': 1611849838.0}",2021-01-28 16:03:58
28,rustyscissorhands,1611849837,Every movement needs a catalyst,https://www.reddit.com/r/wallstreetbets/comments/l70oj8/every_movement_needs_a_catalyst/,1611849837.0,"{'author': 'rustyscissorhands', 'created_utc': 1611849837, 'title': 'Every movement needs a catalyst', 'url': 'https://www.reddit.com/r/wallstreetbets/comments/l70oj8/every_movement_needs_a_catalyst/', 'created': 1611849837.0}",2021-01-28 16:03:57
29,theblondelebron99,1611849837,When do we start the class action against Robinhood?,https://www.reddit.com/r/wallstreetbets/comments/l70oiz/when_do_we_start_the_class_action_against/,1611849837.0,"{'author': 'theblondelebron99', 'created_utc': 1611849837, 'title': 'When do we start the class action against Robinhood?', 'url': 'https://www.reddit.com/r/wallstreetbets/comments/l70oiz/when_do_we_start_the_class_action_against/', 'created': 1611849837.0}",2021-01-28 16:03:57
30,Stock-Hornet-1286,1611849836,AMC went to Oversold. Like if you plan to get in and hold. Not worth it unless everyone is in.,https://www.reddit.com/r/wallstreetbets/comments/l70oir/amc_went_to_oversold_like_if_you_plan_to_get_in/,1611849836.0,"{'author': 'Stock-Hornet-1286', 'created_utc': 1611849836, 'title': 'AMC went to Oversold. Like if you plan to get in and hold. Not worth it unless everyone is in.', 'url': 'https://www.reddit.com/r/wallstreetbets/comments/l70oir/amc_went_to_oversold_like_if_you_plan_to_get_in/', 'created': 1611849836.0}",2021-01-28 16:03:56
31,ThisisTMF,1611849836,Call your brokerage and tell them they cannot lend your shares out to short sellers,https://www.reddit.com/r/wallstreetbets/comments/l70oih/call_your_brokerage_and_tell_them_they_cannot/,1611849836.0,"{'author': 'ThisisTMF', 'created_utc': 1611849836, 'title': 'Call your brokerage and tell them they cannot lend your shares out to short sellers', 'url': 'https://www.reddit.com/r/wallstreetbets/comments/l70oih/call_your_brokerage_and_tell_them_they_cannot/', 'created': 1611849836.0}",2021-01-28 16:03:56
32,tenshinchan,1611849836,Fuck Robinhood!,https://www.reddit.com/r/wallstreetbets/comments/l70oia/fuck_robinhood/,1611849836.0,"{'author': 'tenshinchan', 'created_utc': 1611849836, 'title': 'Fuck Robinhood!', 'url': 'https://www.reddit.com/r/wallstreetbets/comments/l70oia/fuck_robinhood/', 'created': 1611849836.0}",2021-01-28 16:03:56
33,Senor-Theodore,1611849836,DO NOT SELL!! HOLD THE LINE!! DON'T LET THEM SQUEEZE YOU OUT!!,https://www.reddit.com/r/wallstreetbets/comments/l70oi8/do_not_sell_hold_the_line_dont_let_them_squeeze/,1611849836.0,"{'author': 'Senor-Theodore', 'created_utc': 1611849836, 'title': ""DO NOT SELL!! HOLD THE LINE!! DON'T LET THEM SQUEEZE YOU OUT!!"", 'url': 'https://www.reddit.com/r/wallstreetbets/comments/l70oi8/do_not_sell_hold_the_line_dont_let_them_squeeze/', 'created': 1611849836.0}",2021-01-28 16:03:56
34,2-7gordo,1611849835,BBW BBW BBW BBW TO THE MOON,https://www.reddit.com/r/wallstreetbets/comments/l70oi2/bbw_bbw_bbw_bbw_to_the_moon/,1611849835.0,"{'author': '2-7gordo', 'created_utc': 1611849835, 'title': 'BBW BBW BBW BBW TO THE MOON', 'url': 'https://www.reddit.com/r/wallstreetbets/comments/l70oi2/bbw_bbw_bbw_bbw_to_the_moon/', 'created': 1611849835.0}",2021-01-28 16:03:55
35,sharkslingersoulja,1611849835,"STOP USING ROBINHOOD. NAKD, AMC, ETC ARE AVAILABLE FOR DIRECT SALE THROUGH FIDELITY ONLINE, ETC",https://www.reddit.com/r/wallstreetbets/comments/l70oi1/stop_using_robinhood_nakd_amc_etc_are_available/,1611849835.0,"{'author': 'sharkslingersoulja', 'created_utc': 1611849835, 'title': 'STOP USING ROBINHOOD. NAKD, AMC, ETC ARE AVAILABLE FOR DIRECT SALE THROUGH FIDELITY ONLINE, ETC', 'url': 'https://www.reddit.com/r/wallstreetbets/comments/l70oi1/stop_using_robinhood_nakd_amc_etc_are_available/', 'created': 1611849835.0}",2021-01-28 16:03:55
36,Emersondesigns,1611849835,Go buy Apple TSM and NIO and force them to pull them from sites,https://www.reddit.com/r/wallstreetbets/comments/l70oht/go_buy_apple_tsm_and_nio_and_force_them_to_pull/,1611849835.0,"{'author': 'Emersondesigns', 'created_utc': 1611849835, 'title': 'Go buy Apple TSM and NIO and force them to pull them from sites', 'url': 'https://www.reddit.com/r/wallstreetbets/comments/l70oht/go_buy_apple_tsm_and_nio_and_force_them_to_pull/', 'created': 1611849835.0}",2021-01-28 16:03:55
37,Alexwflove123,1611849835,"$AMC to the end, my brothers and sisters. Godspeed and hold",https://v.redd.it/qjnq2k8ej3e61,1611849835.0,"{'author': 'Alexwflove123', 'created_utc': 1611849835, 'title': '$AMC to the end, my brothers and sisters. Godspeed and hold', 'url': 'https://v.redd.it/qjnq2k8ej3e61', 'created': 1611849835.0}",2021-01-28 16:03:55
38,ncadenaa,1611849834,I AM SCARED,https://www.reddit.com/r/wallstreetbets/comments/l70oje/i_am_scared/,1611849834.0,"{'author': 'ncadenaa', 'created_utc': 1611849834, 'title': 'I AM SCARED', 'url': 'https://www.reddit.com/r/wallstreetbets/comments/l70oje/i_am_scared/', 'created': 1611849834.0}",2021-01-28 16:03:54
39,ncadenaa,1611849834,I AM SCARED,https://www.reddit.com/r/wallstreetbets/comments/l70ohq/i_am_scared/,1611849834.0,"{'author': 'ncadenaa', 'created_utc': 1611849834, 'title': 'I AM SCARED', 'url': 'https://www.reddit.com/r/wallstreetbets/comments/l70ohq/i_am_scared/', 'created': 1611849834.0}",2021-01-28 16:03:54
40,KinaGroove,1611849834,[there is no need to be upset](https://youtu.be/ygr5AHufBN4) 🌙ape🦍together🚀stong💎,https://www.reddit.com/r/wallstreetbets/comments/l70ohh/there_is_no_need_to_be/,1611849834.0,"{'author': 'KinaGroove', 'created_utc': 1611849834, 'title': '[there is no need to be upset](https://youtu.be/ygr5AHufBN4) 🌙ape🦍together🚀stong💎', 'url': 'https://www.reddit.com/r/wallstreetbets/comments/l70ohh/there_is_no_need_to_be/', 'created': 1611849834.0}",2021-01-28 16:03:54
41,cboland4,1611849834,"Help Fund a Class Action Lawsuit against Robinhood, organized by Nicholas Violano",https://www.gofundme.com/f/help-fund-a-class-action-lawsuit-against-robinhood?utm_campaign=p_cp+share-sheet&amp;utm_medium=copy_link_all&amp;utm_source=customer,1611849834.0,"{'author': 'cboland4', 'created_utc': 1611849834, 'title': 'Help Fund a Class Action Lawsuit against Robinhood, organized by Nicholas Violano', 'url': 'https://www.gofundme.com/f/help-fund-a-class-action-lawsuit-against-robinhood?utm_campaign=p_cp+share-sheet&amp;utm_medium=copy_link_all&amp;utm_source=customer', 'created': 1611849834.0}",2021-01-28 16:03:54
42,TeaBagTheBear,1611849833,"While we figure out how to get around this, what are some stocks we can squeeze for the time being?",https://www.reddit.com/r/wallstreetbets/comments/l70oh9/while_we_figure_out_how_to_get_around_this_what/,1611849833.0,"{'author': 'TeaBagTheBear', 'created_utc': 1611849833, 'title': 'While we figure out how to get around this, what are some stocks we can squeeze for the time being?', 'url': 'https://www.reddit.com/r/wallstreetbets/comments/l70oh9/while_we_figure_out_how_to_get_around_this_what/', 'created': 1611849833.0}",2021-01-28 16:03:53
43,yesiamakpopfan,1611849833,RIDICULOUS,https://markets.businessinsider.com/news/stocks/nasdaq-monitors-social-media-halts-unusual-trading-friedman-market-manipulation-2021-1-1030011156?fbclid=IwAR1EZk57Dg2ilYHA3oqjGEF5kf4hNyaz6ryKFMQWGDOmWZO4duwqOgiZYXU,1611849833.0,"{'author': 'yesiamakpopfan', 'created_utc': 1611849833, 'title': 'RIDICULOUS', 'url': 'https://markets.businessinsider.com/news/stocks/nasdaq-monitors-social-media-halts-unusual-trading-friedman-market-manipulation-2021-1-1030011156?fbclid=IwAR1EZk57Dg2ilYHA3oqjGEF5kf4hNyaz6ryKFMQWGDOmWZO4duwqOgiZYXU', 'created': 1611849833.0}",2021-01-28 16:03:53
44,Ok-Acanthocephala989,1611849833,BUY NOK,https://www.reddit.com/r/wallstreetbets/comments/l70ogw/buy_nok/,1611849833.0,"{'author': 'Ok-Acanthocephala989', 'created_utc': 1611849833, 'title': 'BUY NOK', 'url': 'https://www.reddit.com/r/wallstreetbets/comments/l70ogw/buy_nok/', 'created': 1611849833.0}",2021-01-28 16:03:53
45,IEatPoopyButts,1611849832,Cant buy on trading 212 anymore.,https://www.reddit.com/r/wallstreetbets/comments/l70ogo/cant_buy_on_trading_212_anymore/,1611849832.0,"{'author': 'IEatPoopyButts', 'created_utc': 1611849832, 'title': 'Cant buy on trading 212 anymore.', 'url': 'https://www.reddit.com/r/wallstreetbets/comments/l70ogo/cant_buy_on_trading_212_anymore/', 'created': 1611849832.0}",2021-01-28 16:03:52
46,Am_zek,1611849832,HOW TO BUY GME AND AMC RIGHT NOW,https://www.reddit.com/r/wallstreetbets/comments/l70ogj/how_to_buy_gme_and_amc_right_now/,1611849832.0,"{'author': 'Am_zek', 'created_utc': 1611849832, 'title': 'HOW TO BUY GME AND AMC RIGHT NOW', 'url': 'https://www.reddit.com/r/wallstreetbets/comments/l70ogj/how_to_buy_gme_and_amc_right_now/', 'created': 1611849832.0}",2021-01-28 16:03:52
47,ahani222,1611849832,DONATING TENDIES TO HELP KIDS WITH CANCER. JOIN ME WITH THE LINK BELOW. MAKE SURE NO FAMILIES GO BANKRUPT LIKE MELVIN BECAUSE THEIR CHILD WAS DIAGNOSED WITH CANCER. ANYTHING IS GREATLY APPRECIATED,https://donate.thon.org/index.cfm?fuseaction=donordrive.participant&amp;participantID=36145,1611849832.0,"{'author': 'ahani222', 'created_utc': 1611849832, 'title': 'DONATING TENDIES TO HELP KIDS WITH CANCER. JOIN ME WITH THE LINK BELOW. MAKE SURE NO FAMILIES GO BANKRUPT LIKE MELVIN BECAUSE THEIR CHILD WAS DIAGNOSED WITH CANCER. ANYTHING IS GREATLY APPRECIATED', 'url': 'https://donate.thon.org/index.cfm?fuseaction=donordrive.participant&amp;participantID=36145', 'created': 1611849832.0}",2021-01-28 16:03:52
48,Slippery_Weiner,1611849832,I cannot make a new account for any of the following investment apps,https://www.reddit.com/r/wallstreetbets/comments/l70ogb/i_cannot_make_a_new_account_for_any_of_the/,1611849832.0,"{'author': 'Slippery_Weiner', 'created_utc': 1611849832, 'title': 'I cannot make a new account for any of the following investment apps', 'url': 'https://www.reddit.com/r/wallstreetbets/comments/l70ogb/i_cannot_make_a_new_account_for_any_of_the/', 'created': 1611849832.0}",2021-01-28 16:03:52
49,SlaterX9,1611849832,Ja Rule is in the game,https://i.redd.it/b6hv60xkj3e61.jpg,1611849832.0,"{'author': 'SlaterX9', 'created_utc': 1611849832, 'title': 'Ja Rule is in the game', 'url': 'https://i.redd.it/b6hv60xkj3e61.jpg', 'created': 1611849832.0}",2021-01-28 16:03:52
50,ChampionshipFew7661,1611849831,This Is their tactic to lock it and then sell off to get everybody to panic hold tha LINE,https://www.reddit.com/r/wallstreetbets/comments/l70og2/this_is_their_tactic_to_lock_it_and_then_sell_off/,1611849831.0,"{'author': 'ChampionshipFew7661', 'created_utc': 1611849831, 'title': 'This Is their tactic to lock it and then sell off to get everybody to panic hold tha LINE', 'url': 'https://www.reddit.com/r/wallstreetbets/comments/l70og2/this_is_their_tactic_to_lock_it_and_then_sell_off/', 'created': 1611849831.0}",2021-01-28 16:03:51
51,nutrap,1611849831,Lost all hope in Robinhood,https://www.reddit.com/r/wallstreetbets/comments/l70ofi/lost_all_hope_in_robinhood/,1611849831.0,"{'author': 'nutrap', 'created_utc': 1611849831, 'title': 'Lost all hope in Robinhood', 'url': 'https://www.reddit.com/r/wallstreetbets/comments/l70ofi/lost_all_hope_in_robinhood/', 'created': 1611849831.0}",2021-01-28 16:03:51
52,Better_Reference8236,1611849830,"Keep $AMC, buy $DVN",https://www.reddit.com/r/wallstreetbets/comments/l70oez/keep_amc_buy_dvn/,1611849830.0,"{'author': 'Better_Reference8236', 'created_utc': 1611849830, 'title': 'Keep $AMC, buy $DVN', 'url': 'https://www.reddit.com/r/wallstreetbets/comments/l70oez/keep_amc_buy_dvn/', 'created': 1611849830.0}",2021-01-28 16:03:50
53,Tisrok55,1611849830,TD Ameritrade--WeBull--and especially Robinhood want us to fail --------------------------------------------------------,https://www.reddit.com/r/wallstreetbets/comments/l70oeu/td_ameritradewebulland_especially_robinhood_want/,1611849830.0,"{'author': 'Tisrok55', 'created_utc': 1611849830, 'title': 'TD Ameritrade--WeBull--and especially Robinhood want us to fail --------------------------------------------------------', 'url': 'https://www.reddit.com/r/wallstreetbets/comments/l70oeu/td_ameritradewebulland_especially_robinhood_want/', 'created': 1611849830.0}",2021-01-28 16:03:50
54,twta96,1611849829,ROBINHOOD WONT LET YOU WITHDRAW,https://i.redd.it/i1bu7pckj3e61.jpg,1611849829.0,"{'author': 'twta96', 'created_utc': 1611849829, 'title': 'ROBINHOOD WONT LET YOU WITHDRAW', 'url': 'https://i.redd.it/i1bu7pckj3e61.jpg', 'created': 1611849829.0}",2021-01-28 16:03:49
55,Vetoxhazard,1611849829,What brokerage now,https://www.reddit.com/r/wallstreetbets/comments/l70oef/what_brokerage_now/,1611849829.0,"{'author': 'Vetoxhazard', 'created_utc': 1611849829, 'title': 'What brokerage now', 'url': 'https://www.reddit.com/r/wallstreetbets/comments/l70oef/what_brokerage_now/', 'created': 1611849829.0}",2021-01-28 16:03:49
56,mooky_kusch,1611849829,By halting stocks and forcing the price down these cuckolds get to sell off at artificial prices,https://www.reddit.com/r/wallstreetbets/comments/l70oee/by_halting_stocks_and_forcing_the_price_down/,1611849829.0,"{'author': 'mooky_kusch', 'created_utc': 1611849829, 'title': 'By halting stocks and forcing the price down these cuckolds get to sell off at artificial prices', 'url': 'https://www.reddit.com/r/wallstreetbets/comments/l70oee/by_halting_stocks_and_forcing_the_price_down/', 'created': 1611849829.0}",2021-01-28 16:03:49
