,author,created_utc,title,url,created,d_,created_utc_dt
0,IamnotKP,1609934704,Nice,https://i.redd.it/3wl1r1dxcp961.jpg,1609934704.0,"{'author': 'IamnotKP', 'created_utc': 1609934704, 'title': 'Nice', 'url': 'https://i.redd.it/3wl1r1dxcp961.jpg', 'created': 1609934704.0}",2021-01-06 12:05:04
1,hshamza,1609934476,Calls on Canoo Meme Power,https://i.redd.it/x9fhcow8cp961.jpg,1609934476.0,"{'author': 'hshamza', 'created_utc': 1609934476, 'title': 'Calls on Canoo Meme Power', 'url': 'https://i.redd.it/x9fhcow8cp961.jpg', 'created': 1609934476.0}",2021-01-06 12:01:16
2,FickleFinger6529,1609934369,Too early morning there is a hoping and want for change let's make http://links.email.paypal-prepaid.com/ctt?ms=MjM5MjQ3NzMS1&amp;kn=2&amp;r=Njg2Mjg5MDIwNTEzS0&amp;b=0&amp;j=MTg4MTA0ODc5NAS2&amp;mt=2&amp;rj=MTg4MTA0ODc5NAS2&amp;rt=0. Open an account and get 2 free stocks! Deposit and get another 2 free stocks! https://act.w,https://www.prodege.com/audience/,1609934369.0,"{'author': 'FickleFinger6529', 'created_utc': 1609934369, 'title': ""Too early morning there is a hoping and want for change let's make http://links.email.paypal-prepaid.com/ctt?ms=MjM5MjQ3NzMS1&amp;kn=2&amp;r=Njg2Mjg5MDIwNTEzS0&amp;b=0&amp;j=MTg4MTA0ODc5NAS2&amp;mt=2&amp;rj=MTg4MTA0ODc5NAS2&amp;rt=0. Open an account and get 2 free stocks! Deposit and get another 2 free stocks! https://act.w"", 'url': 'https://www.prodege.com/audience/', 'created': 1609934369.0}",2021-01-06 11:59:29
3,markusrasbech,1609934210,The next pharma pennystock to lift off!!,https://www.reddit.com/r/wallstreetbets/comments/krmhyd/the_next_pharma_pennystock_to_lift_off/,1609934210.0,"{'author': 'markusrasbech', 'created_utc': 1609934210, 'title': 'The next pharma pennystock to lift off!!', 'url': 'https://www.reddit.com/r/wallstreetbets/comments/krmhyd/the_next_pharma_pennystock_to_lift_off/', 'created': 1609934210.0}",2021-01-06 11:56:50
4,Top_Capital_9502,1609934100,Buy Wirecard 🚀🚀🚀,https://www.reddit.com/r/wallstreetbets/comments/krmh1s/buy_wirecard/,1609934100.0,"{'author': 'Top_Capital_9502', 'created_utc': 1609934100, 'title': 'Buy Wirecard 🚀🚀🚀', 'url': 'https://www.reddit.com/r/wallstreetbets/comments/krmh1s/buy_wirecard/', 'created': 1609934100.0}",2021-01-06 11:55:00
5,Thicc_Pug,1609934010,When r/all user meets wsb,https://v.redd.it/rd8qb0ftap961,1609934010.0,"{'author': 'Thicc_Pug', 'created_utc': 1609934010, 'title': 'When r/all user meets wsb', 'url': 'https://v.redd.it/rd8qb0ftap961', 'created': 1609934010.0}",2021-01-06 11:53:30
6,CrowdGoesWildWoooo,1609933619,As a PLTR bagholder this hits hard 🚀🚀,https://i.redd.it/tozsqj0p9p961.jpg,1609933619.0,"{'author': 'CrowdGoesWildWoooo', 'created_utc': 1609933619, 'title': 'As a PLTR bagholder this hits hard 🚀🚀', 'url': 'https://i.redd.it/tozsqj0p9p961.jpg', 'created': 1609933619.0}",2021-01-06 11:46:59
7,similiarintrests,1609933447,PLTR plese fly 🚀🚀,https://v.redd.it/t53mhys39p961,1609933447.0,"{'author': 'similiarintrests', 'created_utc': 1609933447, 'title': 'PLTR plese fly 🚀🚀', 'url': 'https://v.redd.it/t53mhys39p961', 'created': 1609933447.0}",2021-01-06 11:44:07
8,NotThatLebowski1,1609933406,One of us.,https://i.imgur.com/3N7YfFD.png,1609933406.0,"{'author': 'NotThatLebowski1', 'created_utc': 1609933406, 'title': 'One of us.', 'url': 'https://i.imgur.com/3N7YfFD.png', 'created': 1609933406.0}",2021-01-06 11:43:26
9,adatausb,1609933321,"$500,000 bet on a sleeper Marijuana winner. About to explode because Democrats won the senate.",https://i.imgur.com/RcdwFlI.png,1609933321.0,"{'author': 'adatausb', 'created_utc': 1609933321, 'title': '$500,000 bet on a sleeper Marijuana winner. About to explode because Democrats won the senate.', 'url': 'https://i.imgur.com/RcdwFlI.png', 'created': 1609933321.0}",2021-01-06 11:42:01
10,frydenlundmann,1609932646,If Buffett can achieve 50% you can achieve at least 100%,https://youtu.be/8nq2NH-BfUk,1609932646.0,"{'author': 'frydenlundmann', 'created_utc': 1609932646, 'title': 'If Buffett can achieve 50% you can achieve at least 100%', 'url': 'https://youtu.be/8nq2NH-BfUk', 'created': 1609932646.0}",2021-01-06 11:30:46
11,Technical-Republic25,1609932498,What are your expactations for the snow lockup expiration tomorrow?,https://thefly.com/landingPageNews.php?id=3219034&amp;headline=SNOW-Snowflake-gives-notice-of-early-lockup-release-date-of-January--,1609932498.0,"{'author': 'Technical-Republic25', 'created_utc': 1609932498, 'title': 'What are your expactations for the snow lockup expiration tomorrow?', 'url': 'https://thefly.com/landingPageNews.php?id=3219034&amp;headline=SNOW-Snowflake-gives-notice-of-early-lockup-release-date-of-January--', 'created': 1609932498.0}",2021-01-06 11:28:18
12,Fantastic_Search2300,1609932432,What are you retards spending your $2000 stimulus on,https://www.reddit.com/r/wallstreetbets/comments/krm233/what_are_you_retards_spending_your_2000_stimulus/,1609932432.0,"{'author': 'Fantastic_Search2300', 'created_utc': 1609932432, 'title': 'What are you retards spending your $2000 stimulus on', 'url': 'https://www.reddit.com/r/wallstreetbets/comments/krm233/what_are_you_retards_spending_your_2000_stimulus/', 'created': 1609932432.0}",2021-01-06 11:27:12
13,Ashtonished,1609931456,$SNDL going to moon after dems won senate. Stock just hit double meme material 🚀🚀🚀,https://i.redd.it/159e87l93p961.jpg,1609931456.0,"{'author': 'Ashtonished', 'created_utc': 1609931456, 'title': '$SNDL going to moon after dems won senate. Stock just hit double meme material 🚀🚀🚀', 'url': 'https://i.redd.it/159e87l93p961.jpg', 'created': 1609931456.0}",2021-01-06 11:10:56
14,_scuffed_,1609931189,New to stocks and I wanna go all out,https://www.reddit.com/r/wallstreetbets/comments/krlsil/new_to_stocks_and_i_wanna_go_all_out/,1609931189.0,"{'author': '_scuffed_', 'created_utc': 1609931189, 'title': 'New to stocks and I wanna go all out', 'url': 'https://www.reddit.com/r/wallstreetbets/comments/krlsil/new_to_stocks_and_i_wanna_go_all_out/', 'created': 1609931189.0}",2021-01-06 11:06:29
15,Seplkkl2345,1609931005,"So i am relatively new to analysing and trading, but i have read the following about Nio and their new business line.",https://www.reddit.com/r/wallstreetbets/comments/krlr0u/so_i_am_relatively_new_to_analysing_and_trading/,1609931005.0,"{'author': 'Seplkkl2345', 'created_utc': 1609931005, 'title': 'So i am relatively new to analysing and trading, but i have read the following about Nio and their new business line.', 'url': 'https://www.reddit.com/r/wallstreetbets/comments/krlr0u/so_i_am_relatively_new_to_analysing_and_trading/', 'created': 1609931005.0}",2021-01-06 11:03:25
16,HardtackOrange,1609930994,$GME Shorts Lost $1B in 2020,https://www.reddit.com/r/wallstreetbets/comments/krlqx4/gme_shorts_lost_1b_in_2020/,1609930994.0,"{'author': 'HardtackOrange', 'created_utc': 1609930994, 'title': '$GME Shorts Lost $1B in 2020', 'url': 'https://www.reddit.com/r/wallstreetbets/comments/krlqx4/gme_shorts_lost_1b_in_2020/', 'created': 1609930994.0}",2021-01-06 11:03:14
17,AutoModerator,1609930813,"Daily Discussion Thread for January 06, 2021",https://www.reddit.com/r/wallstreetbets/comments/krlpdb/daily_discussion_thread_for_january_06_2021/,1609930813.0,"{'author': 'AutoModerator', 'created_utc': 1609930813, 'title': 'Daily Discussion Thread for January 06, 2021', 'url': 'https://www.reddit.com/r/wallstreetbets/comments/krlpdb/daily_discussion_thread_for_january_06_2021/', 'created': 1609930813.0}",2021-01-06 11:00:13
18,_Definitely_Not_You_,1609930310,SEC? yeah that’s the guy,https://v.redd.it/nzchzmrszo961,1609930310.0,"{'author': '_Definitely_Not_You_', 'created_utc': 1609930310, 'title': 'SEC? yeah that’s the guy', 'url': 'https://v.redd.it/nzchzmrszo961', 'created': 1609930310.0}",2021-01-06 10:51:50
19,aravindraghvi,1609930280,About 3.5 months of investing. Not a big principle amount but this was my first time ever so wanted to play slow and safe. The portfolio is about 60% crypto and 40% stocks. Should I pull the plug and take out the profits? How do you guys decide when to pull out (profits)?,https://i.redd.it/0daur3nrzo961.jpg,1609930280.0,"{'author': 'aravindraghvi', 'created_utc': 1609930280, 'title': 'About 3.5 months of investing. Not a big principle amount but this was my first time ever so wanted to play slow and safe. The portfolio is about 60% crypto and 40% stocks. Should I pull the plug and take out the profits? How do you guys decide when to pull out (profits)?', 'url': 'https://i.redd.it/0daur3nrzo961.jpg', 'created': 1609930280.0}",2021-01-06 10:51:20
20,Rythco,1609930275,"As an apprentice with 2k to my name, this felt good to wake up to. And something different from GME/PLTR/TSLA!!",https://www.reddit.com/gallery/krllai,1609930275.0,"{'author': 'Rythco', 'created_utc': 1609930275, 'title': 'As an apprentice with 2k to my name, this felt good to wake up to. And something different from GME/PLTR/TSLA!!', 'url': 'https://www.reddit.com/gallery/krllai', 'created': 1609930275.0}",2021-01-06 10:51:15
21,MentaSuave,1609930220,Jack Ma arrested? Chinese media says Alibaba founder 'embracing supervision' A.K.A: laying low in the sun at a winter fun camp,https://www.businesstoday.in/current/world/jack-ma-arrested-chinese-media-says-alibaba-founder-embracing-supervision/story/426979.html,1609930220.0,"{'author': 'MentaSuave', 'created_utc': 1609930220, 'title': ""Jack Ma arrested? Chinese media says Alibaba founder 'embracing supervision' A.K.A: laying low in the sun at a winter fun camp"", 'url': 'https://www.businesstoday.in/current/world/jack-ma-arrested-chinese-media-says-alibaba-founder-embracing-supervision/story/426979.html', 'created': 1609930220.0}",2021-01-06 10:50:20
22,hoysnable,1609929865,Investing 1k$ in whichever ticker gets most upvoted in comments. Shill me your worst 5 year hold,https://www.reddit.com/r/wallstreetbets/comments/krlihm/investing_1k_in_whichever_ticker_gets_most/,1609929865.0,"{'author': 'hoysnable', 'created_utc': 1609929865, 'title': 'Investing 1k$ in whichever ticker gets most upvoted in comments. Shill me your worst 5 year hold', 'url': 'https://www.reddit.com/r/wallstreetbets/comments/krlihm/investing_1k_in_whichever_ticker_gets_most/', 'created': 1609929865.0}",2021-01-06 10:44:25
23,Thicc_Pug,1609929694,When r/all user meets wsb,https://v.redd.it/ntol5idxxo961,1609929694.0,"{'author': 'Thicc_Pug', 'created_utc': 1609929694, 'title': 'When r/all user meets wsb', 'url': 'https://v.redd.it/ntol5idxxo961', 'created': 1609929694.0}",2021-01-06 10:41:34
24,Fudge_Chicken,1609929521,Legal weed incoming; buy now,https://i.redd.it/r3s174hixo961.jpg,1609929521.0,"{'author': 'Fudge_Chicken', 'created_utc': 1609929521, 'title': 'Legal weed incoming; buy now', 'url': 'https://i.redd.it/r3s174hixo961.jpg', 'created': 1609929521.0}",2021-01-06 10:38:41
25,Connect-Put-7073,1609928949,"Hi! Newby here, what should invest with 1k ?",https://www.reddit.com/r/wallstreetbets/comments/krlbqq/hi_newby_here_what_should_invest_with_1k/,1609928949.0,"{'author': 'Connect-Put-7073', 'created_utc': 1609928949, 'title': 'Hi! Newby here, what should invest with 1k ?', 'url': 'https://www.reddit.com/r/wallstreetbets/comments/krlbqq/hi_newby_here_what_should_invest_with_1k/', 'created': 1609928949.0}",2021-01-06 10:29:09
26,bragghy,1609928585,"Breaking news: According to Credit Suisse, gay stocks outperform the market",https://www.reddit.com/r/wallstreetbets/comments/krl93c/breaking_news_according_to_credit_suisse_gay/,1609928585.0,"{'author': 'bragghy', 'created_utc': 1609928585, 'title': 'Breaking news: According to Credit Suisse, gay stocks outperform the market', 'url': 'https://www.reddit.com/r/wallstreetbets/comments/krl93c/breaking_news_according_to_credit_suisse_gay/', 'created': 1609928585.0}",2021-01-06 10:23:05
27,Thelasttrashcan,1609928325,Cant cuck the zuck,https://www.reddit.com/r/wallstreetbets/comments/krl765/cant_cuck_the_zuck/,1609928325.0,"{'author': 'Thelasttrashcan', 'created_utc': 1609928325, 'title': 'Cant cuck the zuck', 'url': 'https://www.reddit.com/r/wallstreetbets/comments/krl765/cant_cuck_the_zuck/', 'created': 1609928325.0}",2021-01-06 10:18:45
28,tortoisepump,1609928042,Papa Musk watching the Q4 delivery numbers roll in,https://i.redd.it/0mfb0vs3to961.gif,1609928042.0,"{'author': 'tortoisepump', 'created_utc': 1609928042, 'title': 'Papa Musk watching the Q4 delivery numbers roll in', 'url': 'https://i.redd.it/0mfb0vs3to961.gif', 'created': 1609928042.0}",2021-01-06 10:14:02
29,BenjaminStacks420,1609927744,The Next Big Thing...,https://i.redd.it/ovkt0t78so961.jpg,1609927744.0,"{'author': 'BenjaminStacks420', 'created_utc': 1609927744, 'title': 'The Next Big Thing...', 'url': 'https://i.redd.it/ovkt0t78so961.jpg', 'created': 1609927744.0}",2021-01-06 10:09:04
30,tortoisepump,1609927509,Our Lord and Saviour watching the Q4 delivery numbers roll in,https://imgur.com/s43nBom,1609927509.0,"{'author': 'tortoisepump', 'created_utc': 1609927509, 'title': 'Our Lord and Saviour watching the Q4 delivery numbers roll in', 'url': 'https://imgur.com/s43nBom', 'created': 1609927509.0}",2021-01-06 10:05:09
31,sluemane33,1609926836,"Is TLRY repeating election day price action, or will there be sustained bullish pressure?",https://www.reddit.com/r/wallstreetbets/comments/krkvxs/is_tlry_repeating_election_day_price_action_or/,1609926836.0,"{'author': 'sluemane33', 'created_utc': 1609926836, 'title': 'Is TLRY repeating election day price action, or will there be sustained bullish pressure?', 'url': 'https://www.reddit.com/r/wallstreetbets/comments/krkvxs/is_tlry_repeating_election_day_price_action_or/', 'created': 1609926836.0}",2021-01-06 09:53:56
32,AuthorAdamOConnell,1609926776,Where can I get the best weed?,https://www.reddit.com/r/wallstreetbets/comments/krkvgx/where_can_i_get_the_best_weed/,1609926776.0,"{'author': 'AuthorAdamOConnell', 'created_utc': 1609926776, 'title': 'Where can I get the best weed?', 'url': 'https://www.reddit.com/r/wallstreetbets/comments/krkvgx/where_can_i_get_the_best_weed/', 'created': 1609926776.0}",2021-01-06 09:52:56
33,Anonymous-Green,1609926766,Editas Medicine – SkyHigh Capital,https://skyhighcapitalinvestments.com/editas/,1609926766.0,"{'author': 'Anonymous-Green', 'created_utc': 1609926766, 'title': 'Editas Medicine – SkyHigh Capital', 'url': 'https://skyhighcapitalinvestments.com/editas/', 'created': 1609926766.0}",2021-01-06 09:52:46
34,moksha-mahey,1609926513,"Watch CCP stock DADA, fuckinh skyrocket🚀🚀🚀 to tendies Jupiter from this threat to short seller firm Citron. DADA to 130 or giant squid is dropped. From yours truly Incel messiah. ONE WORD DADA!!!!!!",https://i.redd.it/nwlyw4kkoo961.jpg,1609926513.0,"{'author': 'moksha-mahey', 'created_utc': 1609926513, 'title': 'Watch CCP stock DADA, fuckinh skyrocket🚀🚀🚀 to tendies Jupiter from this threat to short seller firm Citron. DADA to 130 or giant squid is dropped. From yours truly Incel messiah. ONE WORD DADA!!!!!!', 'url': 'https://i.redd.it/nwlyw4kkoo961.jpg', 'created': 1609926513.0}",2021-01-06 09:48:33
35,sluemane33,1609926350,Is it too late to buy TLRY calls at the open?,https://www.reddit.com/r/wallstreetbets/comments/krksli/is_it_too_late_to_buy_tlry_calls_at_the_open/,1609926350.0,"{'author': 'sluemane33', 'created_utc': 1609926350, 'title': 'Is it too late to buy TLRY calls at the open?', 'url': 'https://www.reddit.com/r/wallstreetbets/comments/krksli/is_it_too_late_to_buy_tlry_calls_at_the_open/', 'created': 1609926350.0}",2021-01-06 09:45:50
36,Zealousideal-Pack908,1609926339,Stock’s to buy with future performance of 10x-100x ? Shoot me some Potential Candidates 💰🔥,https://www.reddit.com/r/wallstreetbets/comments/krksil/stocks_to_buy_with_future_performance_of_10x100x/,1609926339.0,"{'author': 'Zealousideal-Pack908', 'created_utc': 1609926339, 'title': 'Stock’s to buy with future performance of 10x-100x ? Shoot me some Potential Candidates 💰🔥', 'url': 'https://www.reddit.com/r/wallstreetbets/comments/krksil/stocks_to_buy_with_future_performance_of_10x100x/', 'created': 1609926339.0}",2021-01-06 09:45:39
37,bohoo123er,1609926158,When new autists ask if they should buy the dip. PLTR ? Always !!,https://v.redd.it/qwvspicano961,1609926158.0,"{'author': 'bohoo123er', 'created_utc': 1609926158, 'title': 'When new autists ask if they should buy the dip. PLTR ? Always !!', 'url': 'https://v.redd.it/qwvspicano961', 'created': 1609926158.0}",2021-01-06 09:42:38
38,badouchee,1609926113,Poppa Elon has also made me mula💰,https://i.redd.it/22x7ndmdno961.jpg,1609926113.0,"{'author': 'badouchee', 'created_utc': 1609926113, 'title': 'Poppa Elon has also made me mula💰', 'url': 'https://i.redd.it/22x7ndmdno961.jpg', 'created': 1609926113.0}",2021-01-06 09:41:53
39,Savage8760,1609926092,Money Printer just got a refill 🚀🚀🚀,https://i.redd.it/l7op3thbno961.jpg,1609926092.0,"{'author': 'Savage8760', 'created_utc': 1609926092, 'title': 'Money Printer just got a refill 🚀🚀🚀', 'url': 'https://i.redd.it/l7op3thbno961.jpg', 'created': 1609926092.0}",2021-01-06 09:41:32
40,Crabby_Crab,1609926009,All in on $PLTR now or after the Lockout?,https://www.reddit.com/r/wallstreetbets/comments/krkq4n/all_in_on_pltr_now_or_after_the_lockout/,1609926009.0,"{'author': 'Crabby_Crab', 'created_utc': 1609926009, 'title': 'All in on $PLTR now or after the Lockout?', 'url': 'https://www.reddit.com/r/wallstreetbets/comments/krkq4n/all_in_on_pltr_now_or_after_the_lockout/', 'created': 1609926009.0}",2021-01-06 09:40:09
41,xhdt,1609925718,Elon Musk and Jeff Who before Jeff betrayed him by trying to patent rocket landing. Things went south after that.,https://i.redd.it/rzfufc97mo961.jpg,1609925718.0,"{'author': 'xhdt', 'created_utc': 1609925718, 'title': 'Elon Musk and Jeff Who before Jeff betrayed him by trying to patent rocket landing. Things went south after that.', 'url': 'https://i.redd.it/rzfufc97mo961.jpg', 'created': 1609925718.0}",2021-01-06 09:35:18
42,wisclom91,1609925495,Legendary war of the GME Squeeze &amp; hero jbro12345,https://v.redd.it/6udq2o70lo961,1609925495.0,"{'author': 'wisclom91', 'created_utc': 1609925495, 'title': 'Legendary war of the GME Squeeze &amp; hero jbro12345', 'url': 'https://v.redd.it/6udq2o70lo961', 'created': 1609925495.0}",2021-01-06 09:31:35
43,GoncaloRCastro,1609925376,🥸,https://i.redd.it/8ekrgtp6lo961.jpg,1609925376.0,"{'author': 'GoncaloRCastro', 'created_utc': 1609925376, 'title': '\U0001f978', 'url': 'https://i.redd.it/8ekrgtp6lo961.jpg', 'created': 1609925376.0}",2021-01-06 09:29:36
44,i_only_sell_options,1609925190,SKLZ - I see this mooning to the sky 🚀🚀🚀,https://www.reddit.com/r/wallstreetbets/comments/krkk67/sklz_i_see_this_mooning_to_the_sky/,1609925190.0,"{'author': 'i_only_sell_options', 'created_utc': 1609925190, 'title': 'SKLZ - I see this mooning to the sky 🚀🚀🚀', 'url': 'https://www.reddit.com/r/wallstreetbets/comments/krkk67/sklz_i_see_this_mooning_to_the_sky/', 'created': 1609925190.0}",2021-01-06 09:26:30
45,Yoyo_blah,1609924794,"""Don’t worry about stocks if Democrats win the Senate""",https://finance.yahoo.com/news/dont-worry-about-stocks-if-democrats-win-the-senate-162327534.html,1609924794.0,"{'author': 'Yoyo_blah', 'created_utc': 1609924794, 'title': '""Don’t worry about stocks if Democrats win the Senate""', 'url': 'https://finance.yahoo.com/news/dont-worry-about-stocks-if-democrats-win-the-senate-162327534.html', 'created': 1609924794.0}",2021-01-06 09:19:54
46,civver23410,1609924746,For options (bitcoin options actually but maybe can get some advice here) are there any ways to get loans to cash in on your option on the expiration date (and then immediately sell and pay back the loan)?,https://www.reddit.com/r/wallstreetbets/comments/krkgtx/for_options_bitcoin_options_actually_but_maybe/,1609924746.0,"{'author': 'civver23410', 'created_utc': 1609924746, 'title': 'For options (bitcoin options actually but maybe can get some advice here) are there any ways to get loans to cash in on your option on the expiration date (and then immediately sell and pay back the loan)?', 'url': 'https://www.reddit.com/r/wallstreetbets/comments/krkgtx/for_options_bitcoin_options_actually_but_maybe/', 'created': 1609924746.0}",2021-01-06 09:19:06
47,Savage8760,1609924345,high on life 🚀🚀,https://i.redd.it/2lrdypf4io961.jpg,1609924345.0,"{'author': 'Savage8760', 'created_utc': 1609924345, 'title': 'high on life 🚀🚀', 'url': 'https://i.redd.it/2lrdypf4io961.jpg', 'created': 1609924345.0}",2021-01-06 09:12:25
48,Lower_Creme2433,1609923739,Which is best: Cloud CRM or on-premises CRM?,https://www.reddit.com/r/wallstreetbets/comments/krk8wv/which_is_best_cloud_crm_or_onpremises_crm/,1609923739.0,"{'author': 'Lower_Creme2433', 'created_utc': 1609923739, 'title': 'Which is best: Cloud CRM or on-premises CRM?', 'url': 'https://www.reddit.com/r/wallstreetbets/comments/krk8wv/which_is_best_cloud_crm_or_onpremises_crm/', 'created': 1609923739.0}",2021-01-06 09:02:19
49,noidea1812,1609923600,Ehang the next Tesla?,https://www.reddit.com/r/wallstreetbets/comments/krk725/ehang_the_next_tesla/,1609923600.0,"{'author': 'noidea1812', 'created_utc': 1609923600, 'title': 'Ehang the next Tesla?', 'url': 'https://www.reddit.com/r/wallstreetbets/comments/krk725/ehang_the_next_tesla/', 'created': 1609923600.0}",2021-01-06 09:00:00
50,locomotivated1,1609923125,I HAVE RETURNED FROM THE GULAGS,https://i.redd.it/qtkg1wvheo961.jpg,1609923125.0,"{'author': 'locomotivated1', 'created_utc': 1609923125, 'title': 'I HAVE RETURNED FROM THE GULAGS', 'url': 'https://i.redd.it/qtkg1wvheo961.jpg', 'created': 1609923125.0}",2021-01-06 08:52:05
51,civver23410,1609923087,For options (bitcoin options actually but maybe can get some advice here) are there any ways to get loans to cash in on your option on the expiration date (and then immediately sell and pay back the loan)?,https://www.reddit.com/r/wallstreetbets/comments/krk3gi/for_options_bitcoin_options_actually_but_maybe/,1609923087.0,"{'author': 'civver23410', 'created_utc': 1609923087, 'title': 'For options (bitcoin options actually but maybe can get some advice here) are there any ways to get loans to cash in on your option on the expiration date (and then immediately sell and pay back the loan)?', 'url': 'https://www.reddit.com/r/wallstreetbets/comments/krk3gi/for_options_bitcoin_options_actually_but_maybe/', 'created': 1609923087.0}",2021-01-06 08:51:27
52,SummertimeInParis,1609922320,Sweet Dreams GME,https://i.redd.it/0dn8nkm3co961.jpg,1609922320.0,"{'author': 'SummertimeInParis', 'created_utc': 1609922320, 'title': 'Sweet Dreams GME', 'url': 'https://i.redd.it/0dn8nkm3co961.jpg', 'created': 1609922320.0}",2021-01-06 08:38:40
53,SummertimeInParis,1609922273,Print By Me; the Stand By Me adaptation,https://i.redd.it/bxd7fnoybo961.jpg,1609922273.0,"{'author': 'SummertimeInParis', 'created_utc': 1609922273, 'title': 'Print By Me; the Stand By Me adaptation', 'url': 'https://i.redd.it/bxd7fnoybo961.jpg', 'created': 1609922273.0}",2021-01-06 08:37:53
54,Duartem99,1609921982,Thoughts on $NGA???,https://www.reddit.com/r/wallstreetbets/comments/krjvft/thoughts_on_nga/,1609921982.0,"{'author': 'Duartem99', 'created_utc': 1609921982, 'title': 'Thoughts on $NGA???', 'url': 'https://www.reddit.com/r/wallstreetbets/comments/krjvft/thoughts_on_nga/', 'created': 1609921982.0}",2021-01-06 08:33:02
55,15-cent,1609921704,Buy riot related stocks. It’s gonna be a bloody good day!,https://i.redd.it/0vbrr6q9ao961.jpg,1609921704.0,"{'author': '15-cent', 'created_utc': 1609921704, 'title': 'Buy riot related stocks. It’s gonna be a bloody good day!', 'url': 'https://i.redd.it/0vbrr6q9ao961.jpg', 'created': 1609921704.0}",2021-01-06 08:28:24
56,unverifiedtraders,1609921404,The maddest I've ever seen a trader be,https://v.redd.it/6c38p4l59o961,1609921404.0,"{'author': 'unverifiedtraders', 'created_utc': 1609921404, 'title': ""The maddest I've ever seen a trader be"", 'url': 'https://v.redd.it/6c38p4l59o961', 'created': 1609921404.0}",2021-01-06 08:23:24
57,Exciting_Wrongdoer_9,1609921313,Aurelius to the moon,https://www.reddit.com/r/wallstreetbets/comments/krjptj/aurelius_to_the_moon/,1609921313.0,"{'author': 'Exciting_Wrongdoer_9', 'created_utc': 1609921313, 'title': 'Aurelius to the moon', 'url': 'https://www.reddit.com/r/wallstreetbets/comments/krjptj/aurelius_to_the_moon/', 'created': 1609921313.0}",2021-01-06 08:21:53
58,yoyoyoyoyoyoyoyoyook,1609921065,"Y’all did not want to listen to me yesterday, but I Called it - RDS to the moon 🚀🚀🚀",https://www.reddit.com/r/wallstreetbets/comments/krjnwc/yall_did_not_want_to_listen_to_me_yesterday_but_i/,1609921065.0,"{'author': 'yoyoyoyoyoyoyoyoyook', 'created_utc': 1609921065, 'title': 'Y’all did not want to listen to me yesterday, but I Called it - RDS to the moon 🚀🚀🚀', 'url': 'https://www.reddit.com/r/wallstreetbets/comments/krjnwc/yall_did_not_want_to_listen_to_me_yesterday_but_i/', 'created': 1609921065.0}",2021-01-06 08:17:45
59,StreamsnipeFaerlina,1609920965,APHA earnings January 14th. Get in now boys and this can be you,https://streamable.com/wzxmvv?fbclid=IwAR2-a3rRmvaCVg8ZUiAXeJXVIyg9fncfDWtcJrXOY5FOFlzEenokKC0_tiU,1609920965.0,"{'author': 'StreamsnipeFaerlina', 'created_utc': 1609920965, 'title': 'APHA earnings January 14th. Get in now boys and this can be you', 'url': 'https://streamable.com/wzxmvv?fbclid=IwAR2-a3rRmvaCVg8ZUiAXeJXVIyg9fncfDWtcJrXOY5FOFlzEenokKC0_tiU', 'created': 1609920965.0}",2021-01-06 08:16:05
