,author,created_utc,title,url,created,d_,created_utc_dt
67,ogre77414,1607539877,Almost $30k loss TSLA 12/11 660C,https://i.imgur.com/yDhFdK6.jpg,1607539877.0,"{'author': 'ogre77414', 'created_utc': 1607539877, 'title': 'Almost $30k loss TSLA 12/11 660C', 'url': 'https://i.imgur.com/yDhFdK6.jpg', 'created': 1607539877.0}",2020-12-09 18:51:17
68,z3ds_,1607539855,Am I doing this right? 👋🏼💎,https://i.redd.it/vvv0jr4tj7461.jpg,1607539855.0,"{'author': 'z3ds_', 'created_utc': 1607539855, 'title': 'Am I doing this right? 👋🏼💎', 'url': 'https://i.redd.it/vvv0jr4tj7461.jpg', 'created': 1607539855.0}",2020-12-09 18:50:55
69,a2options,1607539854,Adobe Vertical Credit Play,https://www.reddit.com/r/wallstreetbets/comments/k9xwwe/adobe_vertical_credit_play/,1607539854.0,"{'author': 'a2options', 'created_utc': 1607539854, 'title': 'Adobe Vertical Credit Play', 'url': 'https://www.reddit.com/r/wallstreetbets/comments/k9xwwe/adobe_vertical_credit_play/', 'created': 1607539854.0}",2020-12-09 18:50:54
70,SuperPanda_Punch,1607539847,What in tarnation is going on,https://i.redd.it/dkebvx8sj7461.jpg,1607539847.0,"{'author': 'SuperPanda_Punch', 'created_utc': 1607539847, 'title': 'What in tarnation is going on', 'url': 'https://i.redd.it/dkebvx8sj7461.jpg', 'created': 1607539847.0}",2020-12-09 18:50:47
71,Dangerous_Maybe_5230,1607539781,"What are your thoughts on AMC at this price point? On shortablestocks.com, there are zero shares available to short. And I expect the stimulus news to be announced before Christmas, along with various people beginning to have their vaccinations (SF, Houston, etc) next week",https://www.reddit.com/r/wallstreetbets/comments/k9xw0p/what_are_your_thoughts_on_amc_at_this_price_point/,1607539781.0,"{'author': 'Dangerous_Maybe_5230', 'created_utc': 1607539781, 'title': 'What are your thoughts on AMC at this price point? On shortablestocks.com, there are zero shares available to short. And I expect the stimulus news to be announced before Christmas, along with various people beginning to have their vaccinations (SF, Houston, etc) next week', 'url': 'https://www.reddit.com/r/wallstreetbets/comments/k9xw0p/what_are_your_thoughts_on_amc_at_this_price_point/', 'created': 1607539781.0}",2020-12-09 18:49:41
72,graham02,1607539762,"PLTR is not at the moon yet, what happened?",https://www.reddit.com/r/wallstreetbets/comments/k9xvt5/pltr_is_not_at_the_moon_yet_what_happened/,1607539762.0,"{'author': 'graham02', 'created_utc': 1607539762, 'title': 'PLTR is not at the moon yet, what happened?', 'url': 'https://www.reddit.com/r/wallstreetbets/comments/k9xvt5/pltr_is_not_at_the_moon_yet_what_happened/', 'created': 1607539762.0}",2020-12-09 18:49:22
73,red-fish-yellow-fish,1607539750,Tesla Semi prototype once again demonstrates its acceleration - Moon faster,https://uk.motor1.com/news/458502/tesla-semi-prototype-demonstrated-acceleration/,1607539750.0,"{'author': 'red-fish-yellow-fish', 'created_utc': 1607539750, 'title': 'Tesla Semi prototype once again demonstrates its acceleration - Moon faster', 'url': 'https://uk.motor1.com/news/458502/tesla-semi-prototype-demonstrated-acceleration/', 'created': 1607539750.0}",2020-12-09 18:49:10
74,No_Administration260,1607539727,Making these gains out here and none of you retards can tell me otherwise,https://i.redd.it/ro3d97ffj7461.jpg,1607539727.0,"{'author': 'No_Administration260', 'created_utc': 1607539727, 'title': 'Making these gains out here and none of you retards can tell me otherwise', 'url': 'https://i.redd.it/ro3d97ffj7461.jpg', 'created': 1607539727.0}",2020-12-09 18:48:47
75,mwdsonny,1607539707,Am I doing this right?,https://i.redd.it/y18ng7fdj7461.jpg,1607539707.0,"{'author': 'mwdsonny', 'created_utc': 1607539707, 'title': 'Am I doing this right?', 'url': 'https://i.redd.it/y18ng7fdj7461.jpg', 'created': 1607539707.0}",2020-12-09 18:48:27
76,No_Administration260,1607539660,"Making these gains out here, and none of you retard faggots can tell me otherwise",https://i.redd.it/vyfenjb8j7461.jpg,1607539660.0,"{'author': 'No_Administration260', 'created_utc': 1607539660, 'title': 'Making these gains out here, and none of you retard faggots can tell me otherwise', 'url': 'https://i.redd.it/vyfenjb8j7461.jpg', 'created': 1607539660.0}",2020-12-09 18:47:40
77,JUST___SEND___IT,1607539632,BUY THE DIP PLTR TO THE MOON 🚀🚀🚀🚀🚀🚀🚀🚀,https://i.redd.it/hc73jv20j7461.png,1607539632.0,"{'author': 'JUST___SEND___IT', 'created_utc': 1607539632, 'title': 'BUY THE DIP PLTR TO THE MOON 🚀🚀🚀🚀🚀🚀🚀🚀', 'url': 'https://i.redd.it/hc73jv20j7461.png', 'created': 1607539632.0}",2020-12-09 18:47:12
78,CaveTan,1607539574,[Actual DD] VERI is in a VERI good spot to buy 🚀🚀🚀🚀 VERI will be VERI deep in the moon,https://www.reddit.com/r/wallstreetbets/comments/k9xtgh/actual_dd_veri_is_in_a_veri_good_spot_to_buy_veri/,1607539574.0,"{'author': 'CaveTan', 'created_utc': 1607539574, 'title': '[Actual DD] VERI is in a VERI good spot to buy 🚀🚀🚀🚀 VERI will be VERI deep in the moon', 'url': 'https://www.reddit.com/r/wallstreetbets/comments/k9xtgh/actual_dd_veri_is_in_a_veri_good_spot_to_buy_veri/', 'created': 1607539574.0}",2020-12-09 18:46:14
79,DanuckInUSA,1607539563,DoorDash is another crazy overpriced IPO at $185...does this mean big moves on the horizon for Waitr?,https://www.reddit.com/r/wallstreetbets/comments/k9xtby/doordash_is_another_crazy_overpriced_ipo_at/,1607539563.0,"{'author': 'DanuckInUSA', 'created_utc': 1607539563, 'title': 'DoorDash is another crazy overpriced IPO at $185...does this mean big moves on the horizon for Waitr?', 'url': 'https://www.reddit.com/r/wallstreetbets/comments/k9xtby/doordash_is_another_crazy_overpriced_ipo_at/', 'created': 1607539563.0}",2020-12-09 18:46:03
80,liltroy17,1607539547,"they all sold TSLA to buy DASH, and they'll do it again tmrw",https://www.reddit.com/r/wallstreetbets/comments/k9xt5f/they_all_sold_tsla_to_buy_dash_and_theyll_do_it/,1607539547.0,"{'author': 'liltroy17', 'created_utc': 1607539547, 'title': ""they all sold TSLA to buy DASH, and they'll do it again tmrw"", 'url': 'https://www.reddit.com/r/wallstreetbets/comments/k9xt5f/they_all_sold_tsla_to_buy_dash_and_theyll_do_it/', 'created': 1607539547.0}",2020-12-09 18:45:47
81,usuckucocksucker,1607539543,In Which Stock Should i YOLO ?,https://www.reddit.com/r/wallstreetbets/comments/k9xt3f/in_which_stock_should_i_yolo/,1607539543.0,"{'author': 'usuckucocksucker', 'created_utc': 1607539543, 'title': 'In Which Stock Should i YOLO ?', 'url': 'https://www.reddit.com/r/wallstreetbets/comments/k9xt3f/in_which_stock_should_i_yolo/', 'created': 1607539543.0}",2020-12-09 18:45:43
82,DaCatWitDaGat,1607539519,BUY BUY BUY momentus,https://www.reddit.com/r/wallstreetbets/comments/k9xssl/buy_buy_buy_momentus/,1607539519.0,"{'author': 'DaCatWitDaGat', 'created_utc': 1607539519, 'title': 'BUY BUY BUY momentus', 'url': 'https://www.reddit.com/r/wallstreetbets/comments/k9xssl/buy_buy_buy_momentus/', 'created': 1607539519.0}",2020-12-09 18:45:19
83,Qkid98,1607539508,Okay I know it’s not much but at least I can buy a pizza now #Uvxy,https://www.reddit.com/gallery/k9xsng,1607539508.0,"{'author': 'Qkid98', 'created_utc': 1607539508, 'title': 'Okay I know it’s not much but at least I can buy a pizza now #Uvxy', 'url': 'https://www.reddit.com/gallery/k9xsng', 'created': 1607539508.0}",2020-12-09 18:45:08
84,feedmesteak,1607539484,GLSI - anyone in?,https://www.reddit.com/r/wallstreetbets/comments/k9xscr/glsi_anyone_in/,1607539484.0,"{'author': 'feedmesteak', 'created_utc': 1607539484, 'title': 'GLSI - anyone in?', 'url': 'https://www.reddit.com/r/wallstreetbets/comments/k9xscr/glsi_anyone_in/', 'created': 1607539484.0}",2020-12-09 18:44:44
85,andres_pez,1607539476,One minute after I buy a call this happens,https://www.reddit.com/gallery/k9xs8o,1607539476.0,"{'author': 'andres_pez', 'created_utc': 1607539476, 'title': 'One minute after I buy a call this happens', 'url': 'https://www.reddit.com/gallery/k9xs8o', 'created': 1607539476.0}",2020-12-09 18:44:36
86,codex_cz,1607539371,Temporary short attack,https://www.reddit.com/r/wallstreetbets/comments/k9xqum/temporary_short_attack/,1607539371.0,"{'author': 'codex_cz', 'created_utc': 1607539371, 'title': 'Temporary short attack', 'url': 'https://www.reddit.com/r/wallstreetbets/comments/k9xqum/temporary_short_attack/', 'created': 1607539371.0}",2020-12-09 18:42:51
87,TheDataDickHead,1607539338,GHIV is a steal under $11 and is about to pop!,https://www.mpamag.com/news/next-year-we-will-be-well-north-of-200-billion--uwm-ceo-241468.aspx,1607539338.0,"{'author': 'TheDataDickHead', 'created_utc': 1607539338, 'title': 'GHIV is a steal under $11 and is about to pop!', 'url': 'https://www.mpamag.com/news/next-year-we-will-be-well-north-of-200-billion--uwm-ceo-241468.aspx', 'created': 1607539338.0}",2020-12-09 18:42:18
88,_BreatheManually_,1607539323,Would it be possible for WSB to manipulate this penny stock so that it finishes drawing The Batman?,https://i.redd.it/2r80z9f6i7461.jpg,1607539323.0,"{'author': '_BreatheManually_', 'created_utc': 1607539323, 'title': 'Would it be possible for WSB to manipulate this penny stock so that it finishes drawing The Batman?', 'url': 'https://i.redd.it/2r80z9f6i7461.jpg', 'created': 1607539323.0}",2020-12-09 18:42:03
89,CantRemem6erPassword,1607539322,Feel good tendies - $PLTR,https://www.reddit.com/r/wallstreetbets/comments/k9xq9h/feel_good_tendies_pltr/,1607539322.0,"{'author': 'CantRemem6erPassword', 'created_utc': 1607539322, 'title': 'Feel good tendies - $PLTR', 'url': 'https://www.reddit.com/r/wallstreetbets/comments/k9xq9h/feel_good_tendies_pltr/', 'created': 1607539322.0}",2020-12-09 18:42:02
90,PrejudicedPat,1607539309,Hey what is GME's outlook for next week and the this month?,https://www.reddit.com/r/wallstreetbets/comments/k9xq41/hey_what_is_gmes_outlook_for_next_week_and_the/,1607539309.0,"{'author': 'PrejudicedPat', 'created_utc': 1607539309, 'title': ""Hey what is GME's outlook for next week and the this month?"", 'url': 'https://www.reddit.com/r/wallstreetbets/comments/k9xq41/hey_what_is_gmes_outlook_for_next_week_and_the/', 'created': 1607539309.0}",2020-12-09 18:41:49
91,SVXYstinks,1607539284,Make sure you...,https://i.redd.it/3zuyklxwh7461.jpg,1607539284.0,"{'author': 'SVXYstinks', 'created_utc': 1607539284, 'title': 'Make sure you...', 'url': 'https://i.redd.it/3zuyklxwh7461.jpg', 'created': 1607539284.0}",2020-12-09 18:41:24
92,Vote4clouds2020,1607539269,Retard checking in here. Up 10 and a half cents for the week guys after being up over 1200! Still profit baby!!!!,https://i.redd.it/vqkjcfd2i7461.jpg,1607539269.0,"{'author': 'Vote4clouds2020', 'created_utc': 1607539269, 'title': 'Retard checking in here. Up 10 and a half cents for the week guys after being up over 1200! Still profit baby!!!!', 'url': 'https://i.redd.it/vqkjcfd2i7461.jpg', 'created': 1607539269.0}",2020-12-09 18:41:09
93,Street_wall,1607539231,"$ZM useless air castle, back to 100$",https://www.reddit.com/r/wallstreetbets/comments/k9xp39/zm_useless_air_castle_back_to_100/,1607539231.0,"{'author': 'Street_wall', 'created_utc': 1607539231, 'title': '$ZM useless air castle, back to 100$', 'url': 'https://www.reddit.com/r/wallstreetbets/comments/k9xp39/zm_useless_air_castle_back_to_100/', 'created': 1607539231.0}",2020-12-09 18:40:31
94,iNewbSkrewb,1607539210,Is it possible to have an ETF $WSB holding another ETF $RTRD which is also holding $WSB to create perpetual growth?,https://www.reddit.com/r/wallstreetbets/comments/k9xou3/is_it_possible_to_have_an_etf_wsb_holding_another/,1607539210.0,"{'author': 'iNewbSkrewb', 'created_utc': 1607539210, 'title': 'Is it possible to have an ETF $WSB holding another ETF $RTRD which is also holding $WSB to create perpetual growth?', 'url': 'https://www.reddit.com/r/wallstreetbets/comments/k9xou3/is_it_possible_to_have_an_etf_wsb_holding_another/', 'created': 1607539210.0}",2020-12-09 18:40:10
95,lunnix1,1607539207,I hate IPOs,https://www.reddit.com/r/wallstreetbets/comments/k9xosu/i_hate_ipos/,1607539207.0,"{'author': 'lunnix1', 'created_utc': 1607539207, 'title': 'I hate IPOs', 'url': 'https://www.reddit.com/r/wallstreetbets/comments/k9xosu/i_hate_ipos/', 'created': 1607539207.0}",2020-12-09 18:40:07
96,Qkid98,1607539175,Call me autist shure but you can’t stop these small gains from happening,https://www.reddit.com/gallery/k9xog7,1607539175.0,"{'author': 'Qkid98', 'created_utc': 1607539175, 'title': 'Call me autist shure but you can’t stop these small gains from happening', 'url': 'https://www.reddit.com/gallery/k9xog7', 'created': 1607539175.0}",2020-12-09 18:39:35
97,CoHemperor,1607539150,FDA Finally Gives Tentative Approval To Lipocine's Oral Testosterone Replacement Therapy,https://www.nasdaq.com/articles/fda-finally-gives-tentative-approval-to-lipocines-oral-testosterone-replacement-therapy,1607539150.0,"{'author': 'CoHemperor', 'created_utc': 1607539150, 'title': ""FDA Finally Gives Tentative Approval To Lipocine's Oral Testosterone Replacement Therapy"", 'url': 'https://www.nasdaq.com/articles/fda-finally-gives-tentative-approval-to-lipocines-oral-testosterone-replacement-therapy', 'created': 1607539150.0}",2020-12-09 18:39:10
98,Lettsgobaby,1607539129,Absolutely killing the game,https://i.redd.it/x1n6azgnh7461.jpg,1607539129.0,"{'author': 'Lettsgobaby', 'created_utc': 1607539129, 'title': 'Absolutely killing the game', 'url': 'https://i.redd.it/x1n6azgnh7461.jpg', 'created': 1607539129.0}",2020-12-09 18:38:49
99,BigFrankTank17,1607539083,"Microsoft dipped a little today, buy options to end of the month?",https://www.reddit.com/r/wallstreetbets/comments/k9xndl/microsoft_dipped_a_little_today_buy_options_to/,1607539083.0,"{'author': 'BigFrankTank17', 'created_utc': 1607539083, 'title': 'Microsoft dipped a little today, buy options to end of the month?', 'url': 'https://www.reddit.com/r/wallstreetbets/comments/k9xndl/microsoft_dipped_a_little_today_buy_options_to/', 'created': 1607539083.0}",2020-12-09 18:38:03
