,author,created_utc,title,url,created,d_,created_utc_dt
62,rwcgamer,1611977804,WSBs theme song,http://www.youtu.be/PHbnoZHcDxw,1611977804.0,"{'author': 'rwcgamer', 'created_utc': 1611977804, 'title': 'WSBs theme song', 'url': 'http://www.youtu.be/PHbnoZHcDxw', 'created': 1611977804.0}",2021-01-30 03:36:44
63,Street-Crow-1986,1611977803,Stop Selling $GME,https://www.reddit.com/r/wallstreetbets/comments/l8ctm2/stop_selling_gme/,1611977803.0,"{'author': 'Street-Crow-1986', 'created_utc': 1611977803, 'title': 'Stop Selling $GME', 'url': 'https://www.reddit.com/r/wallstreetbets/comments/l8ctm2/stop_selling_gme/', 'created': 1611977803.0}",2021-01-30 03:36:43
64,Melvinfucker69,1611977802,💎🤲WE LIKE THE STOCK💎🤲,https://www.reddit.com/r/wallstreetbets/comments/l8ctls/we_like_the_stock/,1611977802.0,"{'author': 'Melvinfucker69', 'created_utc': 1611977802, 'title': '💎🤲WE LIKE THE STOCK💎🤲', 'url': 'https://www.reddit.com/r/wallstreetbets/comments/l8ctls/we_like_the_stock/', 'created': 1611977802.0}",2021-01-30 03:36:42
65,Shtinky,1611977801,WSB @ Hedge Funds,https://i.redd.it/tjjkt7s24ee61.jpg,1611977801.0,"{'author': 'Shtinky', 'created_utc': 1611977801, 'title': 'WSB @ Hedge Funds', 'url': 'https://i.redd.it/tjjkt7s24ee61.jpg', 'created': 1611977801.0}",2021-01-30 03:36:41
66,pullosa,1611977800,Seen above the Robinhood hq,https://i.redd.it/ufzo2ta34ee61.jpg,1611977800.0,"{'author': 'pullosa', 'created_utc': 1611977800, 'title': 'Seen above the Robinhood hq', 'url': 'https://i.redd.it/ufzo2ta34ee61.jpg', 'created': 1611977800.0}",2021-01-30 03:36:40
67,eatee410,1611977798,BEWARE THE BOTS! I HAVE STARTED TO RECEIVE WEIRD MESSAGES AND COMMENTS FROM SUS ACCOUNTS,https://i.redd.it/lkw07cd34ee61.jpg,1611977798.0,"{'author': 'eatee410', 'created_utc': 1611977798, 'title': 'BEWARE THE BOTS! I HAVE STARTED TO RECEIVE WEIRD MESSAGES AND COMMENTS FROM SUS ACCOUNTS', 'url': 'https://i.redd.it/lkw07cd34ee61.jpg', 'created': 1611977798.0}",2021-01-30 03:36:38
68,Paynful_Force,1611977798,Vending machine at work is telling me what to do. I have no idea what WSB is,https://i.redd.it/46jrrfb04ee61.jpg,1611977798.0,"{'author': 'Paynful_Force', 'created_utc': 1611977798, 'title': 'Vending machine at work is telling me what to do. I have no idea what WSB is', 'url': 'https://i.redd.it/46jrrfb04ee61.jpg', 'created': 1611977798.0}",2021-01-30 03:36:38
69,jthompson1992,1611977796,Hello fellow retards!!!!,https://www.reddit.com/r/wallstreetbets/comments/l8ctic/hello_fellow_retards/,1611977796.0,"{'author': 'jthompson1992', 'created_utc': 1611977796, 'title': 'Hello fellow retards!!!!', 'url': 'https://www.reddit.com/r/wallstreetbets/comments/l8ctic/hello_fellow_retards/', 'created': 1611977796.0}",2021-01-30 03:36:36
70,EmillionAdventures,1611977795,Celeration to the Moon 🚀,https://i.redd.it/8rtcguw04ee61.jpg,1611977795.0,"{'author': 'EmillionAdventures', 'created_utc': 1611977795, 'title': 'Celeration to the Moon 🚀', 'url': 'https://i.redd.it/8rtcguw04ee61.jpg', 'created': 1611977795.0}",2021-01-30 03:36:35
71,Reasonable_Meal_3767,1611977794,Your GAINING support - Stay STRONG - Diamond Hands!!,https://www.reddit.com/r/wallstreetbets/comments/l8ctgu/your_gaining_support_stay_strong_diamond_hands/,1611977794.0,"{'author': 'Reasonable_Meal_3767', 'created_utc': 1611977794, 'title': 'Your GAINING support - Stay STRONG - Diamond Hands!!', 'url': 'https://www.reddit.com/r/wallstreetbets/comments/l8ctgu/your_gaining_support_stay_strong_diamond_hands/', 'created': 1611977794.0}",2021-01-30 03:36:34
72,skizzity,1611977794,$GME Even my dads in!! #fuc*thesuits,https://i.redd.it/0324p9704ee61.jpg,1611977794.0,"{'author': 'skizzity', 'created_utc': 1611977794, 'title': '$GME Even my dads in!! #fuc*thesuits', 'url': 'https://i.redd.it/0324p9704ee61.jpg', 'created': 1611977794.0}",2021-01-30 03:36:34
73,UTLAG77,1611977792,I am new to retail investing and love you guys.. I am trying to find a place to buy Doge. please help,https://www.reddit.com/r/wallstreetbets/comments/l8ctfu/i_am_new_to_retail_investing_and_love_you_guys_i/,1611977792.0,"{'author': 'UTLAG77', 'created_utc': 1611977792, 'title': 'I am new to retail investing and love you guys.. I am trying to find a place to buy Doge. please help', 'url': 'https://www.reddit.com/r/wallstreetbets/comments/l8ctfu/i_am_new_to_retail_investing_and_love_you_guys_i/', 'created': 1611977792.0}",2021-01-30 03:36:32
74,Xtrasauc3,1611977792,Texas launches probe into online brokers halt of GameStop trading,https://www.reddit.com/r/wallstreetbets/comments/l8ctfp/texas_launches_probe_into_online_brokers_halt_of/,1611977792.0,"{'author': 'Xtrasauc3', 'created_utc': 1611977792, 'title': 'Texas launches probe into online brokers halt of GameStop trading', 'url': 'https://www.reddit.com/r/wallstreetbets/comments/l8ctfp/texas_launches_probe_into_online_brokers_halt_of/', 'created': 1611977792.0}",2021-01-30 03:36:32
75,DaoHanwb,1611977789,DFV should give out the final word for us to ALL sell,https://www.reddit.com/r/wallstreetbets/comments/l8cteb/dfv_should_give_out_the_final_word_for_us_to_all/,1611977789.0,"{'author': 'DaoHanwb', 'created_utc': 1611977789, 'title': 'DFV should give out the final word for us to ALL sell', 'url': 'https://www.reddit.com/r/wallstreetbets/comments/l8cteb/dfv_should_give_out_the_final_word_for_us_to_all/', 'created': 1611977789.0}",2021-01-30 03:36:29
76,MS91,1611977788,The Line Has Been Held,https://captiongenerator.com/2122237/The-Panic-Sell-Didnt-Happen,1611977788.0,"{'author': 'MS91', 'created_utc': 1611977788, 'title': 'The Line Has Been Held', 'url': 'https://captiongenerator.com/2122237/The-Panic-Sell-Didnt-Happen', 'created': 1611977788.0}",2021-01-30 03:36:28
77,InterwebAficionado,1611977783,"ALL IN....as soon as you guide my drunken, shaky hand.",https://www.reddit.com/r/wallstreetbets/comments/l8ctcn/all_inas_soon_as_you_guide_my_drunken_shaky_hand/,1611977783.0,"{'author': 'InterwebAficionado', 'created_utc': 1611977783, 'title': 'ALL IN....as soon as you guide my drunken, shaky hand.', 'url': 'https://www.reddit.com/r/wallstreetbets/comments/l8ctcn/all_inas_soon_as_you_guide_my_drunken_shaky_hand/', 'created': 1611977783.0}",2021-01-30 03:36:23
78,Pizzaismyfriendd,1611977783,"Stuck being verified on Robinhood for days since before they been doing the bs, which app/site should I sign up with instead?",https://www.reddit.com/r/wallstreetbets/comments/l8ctch/stuck_being_verified_on_robinhood_for_days_since/,1611977783.0,"{'author': 'Pizzaismyfriendd', 'created_utc': 1611977783, 'title': 'Stuck being verified on Robinhood for days since before they been doing the bs, which app/site should I sign up with instead?', 'url': 'https://www.reddit.com/r/wallstreetbets/comments/l8ctch/stuck_being_verified_on_robinhood_for_days_since/', 'created': 1611977783.0}",2021-01-30 03:36:23
79,ShankThatSnitch,1611977783,Hold Indefinitely. Get paid Interest. Bleed them dry.,https://www.reddit.com/r/wallstreetbets/comments/l8ctce/hold_indefinitely_get_paid_interest_bleed_them_dry/,1611977783.0,"{'author': 'ShankThatSnitch', 'created_utc': 1611977783, 'title': 'Hold Indefinitely. Get paid Interest. Bleed them dry.', 'url': 'https://www.reddit.com/r/wallstreetbets/comments/l8ctce/hold_indefinitely_get_paid_interest_bleed_them_dry/', 'created': 1611977783.0}",2021-01-30 03:36:23
80,traderglobal12,1611977782,Sold my nasdaq stonks worth 500k.going gme all in..the cause have a calling...hedge funds game on..monday...,https://www.reddit.com/r/wallstreetbets/comments/l8ctcc/sold_my_nasdaq_stonks_worth_500kgoing_gme_all/,1611977782.0,"{'author': 'traderglobal12', 'created_utc': 1611977782, 'title': 'Sold my nasdaq stonks worth 500k.going gme all in..the cause have a calling...hedge funds game on..monday...', 'url': 'https://www.reddit.com/r/wallstreetbets/comments/l8ctcc/sold_my_nasdaq_stonks_worth_500kgoing_gme_all/', 'created': 1611977782.0}",2021-01-30 03:36:22
81,PanzerBlitz36,1611977778,Looking to get started into action,https://www.reddit.com/r/wallstreetbets/comments/l8ctat/looking_to_get_started_into_action/,1611977778.0,"{'author': 'PanzerBlitz36', 'created_utc': 1611977778, 'title': 'Looking to get started into action', 'url': 'https://www.reddit.com/r/wallstreetbets/comments/l8ctat/looking_to_get_started_into_action/', 'created': 1611977778.0}",2021-01-30 03:36:18
82,acej0k3r_,1611977778,$NNDM is the next $GME with one of the highest shorted float ever. I did my due diligence and I want to share the massive play I'm looking at.,https://www.reddit.com/r/wallstreetbets/comments/l8ctao/nndm_is_the_next_gme_with_one_of_the_highest/,1611977778.0,"{'author': 'acej0k3r_', 'created_utc': 1611977778, 'title': ""$NNDM is the next $GME with one of the highest shorted float ever. I did my due diligence and I want to share the massive play I'm looking at."", 'url': 'https://www.reddit.com/r/wallstreetbets/comments/l8ctao/nndm_is_the_next_gme_with_one_of_the_highest/', 'created': 1611977778.0}",2021-01-30 03:36:18
83,Elderam199,1611977778,The life is being squeezed out of Cineplex too!! #CGX,https://www.reddit.com/r/wallstreetbets/comments/l8ctal/the_life_is_being_squeezed_out_of_cineplex_too_cgx/,1611977778.0,"{'author': 'Elderam199', 'created_utc': 1611977778, 'title': 'The life is being squeezed out of Cineplex too!! #CGX', 'url': 'https://www.reddit.com/r/wallstreetbets/comments/l8ctal/the_life_is_being_squeezed_out_of_cineplex_too_cgx/', 'created': 1611977778.0}",2021-01-30 03:36:18
84,Lordfardqua,1611977776,#DOGE COIN,https://www.reddit.com/r/wallstreetbets/comments/l8ctac/doge_coin/,1611977776.0,"{'author': 'Lordfardqua', 'created_utc': 1611977776, 'title': '#DOGE COIN', 'url': 'https://www.reddit.com/r/wallstreetbets/comments/l8ctac/doge_coin/', 'created': 1611977776.0}",2021-01-30 03:36:16
85,PureCristal,1611977776,"Rest over the weekend, and hold the force during next week. US Europe is backing you. Together we VINCERE!! We have them by the balls. To the moon and beyond 🚀🚀🚀🚀",https://v.redd.it/f52oej8z3ee61,1611977776.0,"{'author': 'PureCristal', 'created_utc': 1611977776, 'title': 'Rest over the weekend, and hold the force during next week. US Europe is backing you. Together we VINCERE!! We have them by the balls. To the moon and beyond 🚀🚀🚀🚀', 'url': 'https://v.redd.it/f52oej8z3ee61', 'created': 1611977776.0}",2021-01-30 03:36:16
86,CallsOnly,1611977775,MAN CALLS WIFE AND BUYS 50K OF GME,https://www.reddit.com/r/wallstreetbets/comments/l8ct9p/man_calls_wife_and_buys_50k_of_gme/,1611977775.0,"{'author': 'CallsOnly', 'created_utc': 1611977775, 'title': 'MAN CALLS WIFE AND BUYS 50K OF GME', 'url': 'https://www.reddit.com/r/wallstreetbets/comments/l8ct9p/man_calls_wife_and_buys_50k_of_gme/', 'created': 1611977775.0}",2021-01-30 03:36:15
87,jonty_dip,1611977774,Jim Cramer tells investors to take home run and sell GameStop: 'You've won',https://www.youtube.com/watch?v=jRHlprpFVPc&amp;ab_channel=CNBCTelevision,1611977774.0,"{'author': 'jonty_dip', 'created_utc': 1611977774, 'title': ""Jim Cramer tells investors to take home run and sell GameStop: 'You've won'"", 'url': 'https://www.youtube.com/watch?v=jRHlprpFVPc&amp;ab_channel=CNBCTelevision', 'created': 1611977774.0}",2021-01-30 03:36:14
88,Prestidgeous-125,1611977774,Late to the party but looking for the life of it,https://www.reddit.com/r/wallstreetbets/comments/l8ct9i/late_to_the_party_but_looking_for_the_life_of_it/,1611977774.0,"{'author': 'Prestidgeous-125', 'created_utc': 1611977774, 'title': 'Late to the party but looking for the life of it', 'url': 'https://www.reddit.com/r/wallstreetbets/comments/l8ct9i/late_to_the_party_but_looking_for_the_life_of_it/', 'created': 1611977774.0}",2021-01-30 03:36:14
89,2X_Unknown_X2,1611977771,Robinhood smd stop delaying new account applications,https://www.reddit.com/r/wallstreetbets/comments/l8ct8d/robinhood_smd_stop_delaying_new_account/,1611977771.0,"{'author': '2X_Unknown_X2', 'created_utc': 1611977771, 'title': 'Robinhood smd stop delaying new account applications', 'url': 'https://www.reddit.com/r/wallstreetbets/comments/l8ct8d/robinhood_smd_stop_delaying_new_account/', 'created': 1611977771.0}",2021-01-30 03:36:11
90,CorruptionTest,1611977771,Just #Doge it! Part 2 (Sequel) Where my #Doges at? We still on the 🚀 to the 🌙?,https://www.reddit.com/r/wallstreetbets/comments/l8ct8b/just_doge_it_part_2_sequel_where_my_doges_at_we/,1611977771.0,"{'author': 'CorruptionTest', 'created_utc': 1611977771, 'title': 'Just #Doge it! Part 2 (Sequel) Where my #Doges at? We still on the 🚀 to the 🌙?', 'url': 'https://www.reddit.com/r/wallstreetbets/comments/l8ct8b/just_doge_it_part_2_sequel_where_my_doges_at_we/', 'created': 1611977771.0}",2021-01-30 03:36:11
91,iLostMyWeenie,1611977769,"Are there shorts on all these stocks as well? I see everyone talking about driving the price up, yet they haven't moved as much as GameStop.",https://www.reddit.com/r/wallstreetbets/comments/l8ct7e/are_there_shorts_on_all_these_stocks_as_well_i/,1611977769.0,"{'author': 'iLostMyWeenie', 'created_utc': 1611977769, 'title': ""Are there shorts on all these stocks as well? I see everyone talking about driving the price up, yet they haven't moved as much as GameStop."", 'url': 'https://www.reddit.com/r/wallstreetbets/comments/l8ct7e/are_there_shorts_on_all_these_stocks_as_well_i/', 'created': 1611977769.0}",2021-01-30 03:36:09
92,Mad_Hatter_Quinn,1611977768,Too late to go 🚀🌑?,https://www.reddit.com/r/wallstreetbets/comments/l8ct6z/too_late_to_go/,1611977768.0,"{'author': 'Mad_Hatter_Quinn', 'created_utc': 1611977768, 'title': 'Too late to go 🚀🌑?', 'url': 'https://www.reddit.com/r/wallstreetbets/comments/l8ct6z/too_late_to_go/', 'created': 1611977768.0}",2021-01-30 03:36:08
93,pirate8oss,1611977768,WSB is the institution now!! - not the banks 😅,https://www.reddit.com/r/wallstreetbets/comments/l8ct6u/wsb_is_the_institution_now_not_the_banks/,1611977768.0,"{'author': 'pirate8oss', 'created_utc': 1611977768, 'title': 'WSB is the institution now!! - not the banks 😅', 'url': 'https://www.reddit.com/r/wallstreetbets/comments/l8ct6u/wsb_is_the_institution_now_not_the_banks/', 'created': 1611977768.0}",2021-01-30 03:36:08
94,CubicUnicycle50,1611977765,The Battle of The Century,https://i.redd.it/7cst6htz3ee61.jpg,1611977765.0,"{'author': 'CubicUnicycle50', 'created_utc': 1611977765, 'title': 'The Battle of The Century', 'url': 'https://i.redd.it/7cst6htz3ee61.jpg', 'created': 1611977765.0}",2021-01-30 03:36:05
95,sm2016,1611977762,DFV could sell me a sandpaper dildo,https://i.redd.it/e1r9qxjq3ee61.gif,1611977762.0,"{'author': 'sm2016', 'created_utc': 1611977762, 'title': 'DFV could sell me a sandpaper dildo', 'url': 'https://i.redd.it/e1r9qxjq3ee61.gif', 'created': 1611977762.0}",2021-01-30 03:36:02
96,NightPsychological26,1611977761,what the fuck happened to HOLD doodgecoin. Now i’m down bad i need help boys.,https://www.reddit.com/r/wallstreetbets/comments/l8ct47/what_the_fuck_happened_to_hold_doodgecoin_now_im/,1611977761.0,"{'author': 'NightPsychological26', 'created_utc': 1611977761, 'title': 'what the fuck happened to HOLD doodgecoin. Now i’m down bad i need help boys.', 'url': 'https://www.reddit.com/r/wallstreetbets/comments/l8ct47/what_the_fuck_happened_to_hold_doodgecoin_now_im/', 'created': 1611977761.0}",2021-01-30 03:36:01
97,darkr0b,1611977761,Will there be future targets?,https://www.reddit.com/r/wallstreetbets/comments/l8ct3z/will_there_be_future_targets/,1611977761.0,"{'author': 'darkr0b', 'created_utc': 1611977761, 'title': 'Will there be future targets?', 'url': 'https://www.reddit.com/r/wallstreetbets/comments/l8ct3z/will_there_be_future_targets/', 'created': 1611977761.0}",2021-01-30 03:36:01
98,DANKBOI-420-69,1611977759,I need understanding,https://www.reddit.com/r/wallstreetbets/comments/l8ct2v/i_need_understanding/,1611977759.0,"{'author': 'DANKBOI-420-69', 'created_utc': 1611977759, 'title': 'I need understanding', 'url': 'https://www.reddit.com/r/wallstreetbets/comments/l8ct2v/i_need_understanding/', 'created': 1611977759.0}",2021-01-30 03:35:59
99,yungdxgger,1611977759,Silver Lake cashes out on AMC for $713 million after Reddit-fueled rally (The Problem: the rich only get richer - glad we did some damage this week),https://www.wsj.com/articles/silver-lake-converts-amc-debt-to-equity-as-cinema-chains-stock-price-soars-11611842367,1611977759.0,"{'author': 'yungdxgger', 'created_utc': 1611977759, 'title': 'Silver Lake cashes out on AMC for $713 million after Reddit-fueled rally (The Problem: the rich only get richer - glad we did some damage this week)', 'url': 'https://www.wsj.com/articles/silver-lake-converts-amc-debt-to-equity-as-cinema-chains-stock-price-soars-11611842367', 'created': 1611977759.0}",2021-01-30 03:35:59
