,author,created_utc,title,url,created,d_,created_utc_dt
0,adi_2787,1611856374,Louis Rossman's newest video on trade stop and market manipulation,https://www.reddit.com/r/wallstreetbets/comments/l73sov/louis_rossmans_newest_video_on_trade_stop_and/,1611856374.0,"{'author': 'adi_2787', 'created_utc': 1611856374, 'title': ""Louis Rossman's newest video on trade stop and market manipulation"", 'url': 'https://www.reddit.com/r/wallstreetbets/comments/l73sov/louis_rossmans_newest_video_on_trade_stop_and/', 'created': 1611856374.0}",2021-01-28 17:52:54
1,septillionare,1611856373,CNBC trying their hardest to deter all GME investors,https://i.redd.it/7fhhuq7134e61.jpg,1611856373.0,"{'author': 'septillionare', 'created_utc': 1611856373, 'title': 'CNBC trying their hardest to deter all GME investors', 'url': 'https://i.redd.it/7fhhuq7134e61.jpg', 'created': 1611856373.0}",2021-01-28 17:52:53
2,wallstreetbullhead,1611856372,SHORT THE SHIT OUT OF ROBINHOOD WHEN IT IPO IN 2021 WHO IS WITH ME,https://www.reddit.com/r/wallstreetbets/comments/l73soa/short_the_shit_out_of_robinhood_when_it_ipo_in/,1611856372.0,"{'author': 'wallstreetbullhead', 'created_utc': 1611856372, 'title': 'SHORT THE SHIT OUT OF ROBINHOOD WHEN IT IPO IN 2021 WHO IS WITH ME', 'url': 'https://www.reddit.com/r/wallstreetbets/comments/l73soa/short_the_shit_out_of_robinhood_when_it_ipo_in/', 'created': 1611856372.0}",2021-01-28 17:52:52
3,Cuntosaurusrexx,1611856372,AMC! GME! BB! HODOR! HODOR!,https://www.reddit.com/r/wallstreetbets/comments/l73so1/amc_gme_bb_hodor_hodor/,1611856372.0,"{'author': 'Cuntosaurusrexx', 'created_utc': 1611856372, 'title': 'AMC! GME! BB! HODOR! HODOR!', 'url': 'https://www.reddit.com/r/wallstreetbets/comments/l73so1/amc_gme_bb_hodor_hodor/', 'created': 1611856372.0}",2021-01-28 17:52:52
4,Beneficial-Pipe1194,1611856372,I need help,https://www.reddit.com/r/wallstreetbets/comments/l73sno/i_need_help/,1611856372.0,"{'author': 'Beneficial-Pipe1194', 'created_utc': 1611856372, 'title': 'I need help', 'url': 'https://www.reddit.com/r/wallstreetbets/comments/l73sno/i_need_help/', 'created': 1611856372.0}",2021-01-28 17:52:52
5,Pupaway,1611856372,Where’s Ja?!,https://i.redd.it/ph1q5u2134e61.jpg,1611856372.0,"{'author': 'Pupaway', 'created_utc': 1611856372, 'title': 'Where’s Ja?!', 'url': 'https://i.redd.it/ph1q5u2134e61.jpg', 'created': 1611856372.0}",2021-01-28 17:52:52
6,[deleted],1611856371,"TD Ameritrade wont even let you monitor any stock right now, just says “Streaming quotes are currently unavailable”",https://i.redd.it/kpb4xzz034e61.jpg,1611856371.0,"{'author': '[deleted]', 'created_utc': 1611856371, 'title': 'TD Ameritrade wont even let you monitor any stock right now, just says “Streaming quotes are currently unavailable”', 'url': 'https://i.redd.it/kpb4xzz034e61.jpg', 'created': 1611856371.0}",2021-01-28 17:52:51
7,Match_MC,1611856371,"Isn't it convenient that every half hour there is an influx of tens of thousands of sell orders? Definitely not hedge funds running a short ladder scheme. -This is not financial advice, I'm just a retard",https://i.redd.it/tnj2gmdr24e61.png,1611856371.0,"{'author': 'Match_MC', 'created_utc': 1611856371, 'title': ""Isn't it convenient that every half hour there is an influx of tens of thousands of sell orders? Definitely not hedge funds running a short ladder scheme. -This is not financial advice, I'm just a retard"", 'url': 'https://i.redd.it/tnj2gmdr24e61.png', 'created': 1611856371.0}",2021-01-28 17:52:51
8,its-Loki,1611856371,This manipulation is crazy... don’t let Robinhood get away with this ☠️☠️☠️,http://www.twitter.com/ljmoynihan/status/1354836830169006081,1611856371.0,"{'author': 'its-Loki', 'created_utc': 1611856371, 'title': 'This manipulation is crazy... don’t let Robinhood get away with this ☠️☠️☠️', 'url': 'http://www.twitter.com/ljmoynihan/status/1354836830169006081', 'created': 1611856371.0}",2021-01-28 17:52:51
9,oV1SEo,1611856371,The reinforcements are coming! I’m doing my part! 💎 🙌 🦍 💪,https://gfycat.com/remorsefulalarmedamericancrocodile,1611856371.0,"{'author': 'oV1SEo', 'created_utc': 1611856371, 'title': 'The reinforcements are coming! I’m doing my part! 💎 🙌 🦍 💪', 'url': 'https://gfycat.com/remorsefulalarmedamericancrocodile', 'created': 1611856371.0}",2021-01-28 17:52:51
10,[deleted],1611856370,This shit is uniting the country,https://i.redd.it/12tg9rw034e61.jpg,1611856370.0,"{'author': '[deleted]', 'created_utc': 1611856370, 'title': 'This shit is uniting the country', 'url': 'https://i.redd.it/12tg9rw034e61.jpg', 'created': 1611856370.0}",2021-01-28 17:52:50
11,WideSmiles,1611856370,I sold the 30 second bottom (120) of the entire slope after holding for the whole week. I might be the biggest retard alive. Couldn't buy back in because IB rigged EU.,https://i.redd.it/hwkibhc124e61.png,1611856370.0,"{'author': 'WideSmiles', 'created_utc': 1611856370, 'title': ""I sold the 30 second bottom (120) of the entire slope after holding for the whole week. I might be the biggest retard alive. Couldn't buy back in because IB rigged EU."", 'url': 'https://i.redd.it/hwkibhc124e61.png', 'created': 1611856370.0}",2021-01-28 17:52:50
12,dwai1298,1611856369,$SLV - Not checking this again until next week,https://i.redd.it/0xrmlou034e61.jpg,1611856369.0,"{'author': 'dwai1298', 'created_utc': 1611856369, 'title': '$SLV - Not checking this again until next week', 'url': 'https://i.redd.it/0xrmlou034e61.jpg', 'created': 1611856369.0}",2021-01-28 17:52:49
13,Professional-Cress43,1611856369,DOGECOIN BABYYYY,https://www.reddit.com/r/wallstreetbets/comments/l73slq/dogecoin_babyyyy/,1611856369.0,"{'author': 'Professional-Cress43', 'created_utc': 1611856369, 'title': 'DOGECOIN BABYYYY', 'url': 'https://www.reddit.com/r/wallstreetbets/comments/l73slq/dogecoin_babyyyy/', 'created': 1611856369.0}",2021-01-28 17:52:49
14,335Bimmer,1611856369,Tired of watching from the sidelines! I'm in! 20 @ 235!,https://www.reddit.com/r/wallstreetbets/comments/l73slp/tired_of_watching_from_the_sidelines_im_in_20_235/,1611856369.0,"{'author': '335Bimmer', 'created_utc': 1611856369, 'title': ""Tired of watching from the sidelines! I'm in! 20 @ 235!"", 'url': 'https://www.reddit.com/r/wallstreetbets/comments/l73slp/tired_of_watching_from_the_sidelines_im_in_20_235/', 'created': 1611856369.0}",2021-01-28 17:52:49
15,kriven_risvan,1611856369,Cannot buy GME from Italy. Disgusting.,https://www.reddit.com/r/wallstreetbets/comments/l73slc/cannot_buy_gme_from_italy_disgusting/,1611856369.0,"{'author': 'kriven_risvan', 'created_utc': 1611856369, 'title': 'Cannot buy GME from Italy. Disgusting.', 'url': 'https://www.reddit.com/r/wallstreetbets/comments/l73slc/cannot_buy_gme_from_italy_disgusting/', 'created': 1611856369.0}",2021-01-28 17:52:49
16,ltpliskin,1611856368,OC meme - RIP Robinhood,https://i.redd.it/u35clety24e61.png,1611856368.0,"{'author': 'ltpliskin', 'created_utc': 1611856368, 'title': 'OC meme - RIP Robinhood', 'url': 'https://i.redd.it/u35clety24e61.png', 'created': 1611856368.0}",2021-01-28 17:52:48
17,gayfagot2049,1611856368,TD Ameritrade is still letting you buy! BUY BUY BUY HOLD HOLD HOLD,https://www.reddit.com/r/wallstreetbets/comments/l73skp/td_ameritrade_is_still_letting_you_buy_buy_buy/,1611856368.0,"{'author': 'gayfagot2049', 'created_utc': 1611856368, 'title': 'TD Ameritrade is still letting you buy! BUY BUY BUY HOLD HOLD HOLD', 'url': 'https://www.reddit.com/r/wallstreetbets/comments/l73skp/td_ameritrade_is_still_letting_you_buy_buy_buy/', 'created': 1611856368.0}",2021-01-28 17:52:48
18,ExternalBlood2960,1611856368,To the moon!,https://www.reddit.com/r/wallstreetbets/comments/l73sko/to_the_moon/,1611856368.0,"{'author': 'ExternalBlood2960', 'created_utc': 1611856368, 'title': 'To the moon!', 'url': 'https://www.reddit.com/r/wallstreetbets/comments/l73sko/to_the_moon/', 'created': 1611856368.0}",2021-01-28 17:52:48
19,pareeatl,1611856367,They are closing out people’s positions just because they feel like it smh,https://i.redd.it/aty35rm034e61.jpg,1611856367.0,"{'author': 'pareeatl', 'created_utc': 1611856367, 'title': 'They are closing out people’s positions just because they feel like it smh', 'url': 'https://i.redd.it/aty35rm034e61.jpg', 'created': 1611856367.0}",2021-01-28 17:52:47
20,BurgleB,1611856367,DOGECOIN,https://www.reddit.com/r/wallstreetbets/comments/l73skj/dogecoin/,1611856367.0,"{'author': 'BurgleB', 'created_utc': 1611856367, 'title': 'DOGECOIN', 'url': 'https://www.reddit.com/r/wallstreetbets/comments/l73skj/dogecoin/', 'created': 1611856367.0}",2021-01-28 17:52:47
21,thehomelessmexican,1611856367,"If you haven’t bought into $NOK yet, I have three words for you: BUY THE DIP",https://www.reddit.com/r/wallstreetbets/comments/l73skg/if_you_havent_bought_into_nok_yet_i_have_three/,1611856367.0,"{'author': 'thehomelessmexican', 'created_utc': 1611856367, 'title': 'If you haven’t bought into $NOK yet, I have three words for you: BUY THE DIP', 'url': 'https://www.reddit.com/r/wallstreetbets/comments/l73skg/if_you_havent_bought_into_nok_yet_i_have_three/', 'created': 1611856367.0}",2021-01-28 17:52:47
22,rspix000,1611856367,Robinhood App Hit With Class Action Suit After Trying to Shut Down GameStop Uprising,https://news.yahoo.com/robinhood-app-hit-lawsuit-trying-172304118.html,1611856367.0,"{'author': 'rspix000', 'created_utc': 1611856367, 'title': 'Robinhood App Hit With Class Action Suit After Trying to Shut Down GameStop Uprising', 'url': 'https://news.yahoo.com/robinhood-app-hit-lawsuit-trying-172304118.html', 'created': 1611856367.0}",2021-01-28 17:52:47
23,Jax5585,1611856367,Blackberry is dropping fast to below $10/share. If you don’t have a brokerage outside of Robinhood just wait until this illegal market manipulation stops on Robinhood and POUNCE,https://www.reddit.com/r/wallstreetbets/comments/l73sk2/blackberry_is_dropping_fast_to_below_10share_if/,1611856367.0,"{'author': 'Jax5585', 'created_utc': 1611856367, 'title': 'Blackberry is dropping fast to below $10/share. If you don’t have a brokerage outside of Robinhood just wait until this illegal market manipulation stops on Robinhood and POUNCE', 'url': 'https://www.reddit.com/r/wallstreetbets/comments/l73sk2/blackberry_is_dropping_fast_to_below_10share_if/', 'created': 1611856367.0}",2021-01-28 17:52:47
24,GeneralAboShakra,1611856365,WSB Hedge Fund !,https://www.reddit.com/r/wallstreetbets/comments/l73sjh/wsb_hedge_fund/,1611856365.0,"{'author': 'GeneralAboShakra', 'created_utc': 1611856365, 'title': 'WSB Hedge Fund !', 'url': 'https://www.reddit.com/r/wallstreetbets/comments/l73sjh/wsb_hedge_fund/', 'created': 1611856365.0}",2021-01-28 17:52:45
25,[deleted],1611856365,RH must have really fucked up if Ted Cruz and AOC are agreeing on something. Congratulations are in order!!!!,https://i.redd.it/1rbo17yz24e61.jpg,1611856365.0,"{'author': '[deleted]', 'created_utc': 1611856365, 'title': 'RH must have really fucked up if Ted Cruz and AOC are agreeing on something. Congratulations are in order!!!!', 'url': 'https://i.redd.it/1rbo17yz24e61.jpg', 'created': 1611856365.0}",2021-01-28 17:52:45
26,TRYLX,1611856365,UPVOTE AND HOLD,https://i.redd.it/td2myda034e61.jpg,1611856365.0,"{'author': 'TRYLX', 'created_utc': 1611856365, 'title': 'UPVOTE AND HOLD', 'url': 'https://i.redd.it/td2myda034e61.jpg', 'created': 1611856365.0}",2021-01-28 17:52:45
27,stonkslyfe420,1611856364,WSB Needs an Open Source Platform,https://www.reddit.com/r/wallstreetbets/comments/l73sj1/wsb_needs_an_open_source_platform/,1611856364.0,"{'author': 'stonkslyfe420', 'created_utc': 1611856364, 'title': 'WSB Needs an Open Source Platform', 'url': 'https://www.reddit.com/r/wallstreetbets/comments/l73sj1/wsb_needs_an_open_source_platform/', 'created': 1611856364.0}",2021-01-28 17:52:44
28,carlamaria76,1611856364,GME,https://www.reddit.com/r/wallstreetbets/comments/l73siz/gme/,1611856364.0,"{'author': 'carlamaria76', 'created_utc': 1611856364, 'title': 'GME', 'url': 'https://www.reddit.com/r/wallstreetbets/comments/l73siz/gme/', 'created': 1611856364.0}",2021-01-28 17:52:44
29,Sycthros,1611856364,I was able to download Fidelity and drop all my money ($150) into GME to buy a share 🚀🚀🚀🚀🚀🚀🚀💎💎💎,https://www.reddit.com/r/wallstreetbets/comments/l73siy/i_was_able_to_download_fidelity_and_drop_all_my/,1611856364.0,"{'author': 'Sycthros', 'created_utc': 1611856364, 'title': 'I was able to download Fidelity and drop all my money ($150) into GME to buy a share 🚀🚀🚀🚀🚀🚀🚀💎💎💎', 'url': 'https://www.reddit.com/r/wallstreetbets/comments/l73siy/i_was_able_to_download_fidelity_and_drop_all_my/', 'created': 1611856364.0}",2021-01-28 17:52:44
30,chabuddy95,1611856364,Locked out of etoro and 212 - where next?,https://www.reddit.com/r/wallstreetbets/comments/l73sip/locked_out_of_etoro_and_212_where_next/,1611856364.0,"{'author': 'chabuddy95', 'created_utc': 1611856364, 'title': 'Locked out of etoro and 212 - where next?', 'url': 'https://www.reddit.com/r/wallstreetbets/comments/l73sip/locked_out_of_etoro_and_212_where_next/', 'created': 1611856364.0}",2021-01-28 17:52:44
31,AssistanceNovel791,1611856363,Buy AMD,https://www.reddit.com/r/wallstreetbets/comments/l73sik/buy_amd/,1611856363.0,"{'author': 'AssistanceNovel791', 'created_utc': 1611856363, 'title': 'Buy AMD', 'url': 'https://www.reddit.com/r/wallstreetbets/comments/l73sik/buy_amd/', 'created': 1611856363.0}",2021-01-28 17:52:43
32,nxtde,1611856363,LISTEN! What is really important!? SAVE LIVES for MILLIONS -&gt; we can do it,https://www.reddit.com/r/wallstreetbets/comments/l73sii/listen_what_is_really_important_save_lives_for/,1611856363.0,"{'author': 'nxtde', 'created_utc': 1611856363, 'title': 'LISTEN! What is really important!? SAVE LIVES for MILLIONS -&gt; we can do it', 'url': 'https://www.reddit.com/r/wallstreetbets/comments/l73sii/listen_what_is_really_important_save_lives_for/', 'created': 1611856363.0}",2021-01-28 17:52:43
33,[deleted],1611856363,CLASS ACTION FILED AGAINST ROBINHOOD. ITS HAPPENING!! HOLD STRONG!!,https://i.redd.it/cpqvot4034e61.jpg,1611856363.0,"{'author': '[deleted]', 'created_utc': 1611856363, 'title': 'CLASS ACTION FILED AGAINST ROBINHOOD. ITS HAPPENING!! HOLD STRONG!!', 'url': 'https://i.redd.it/cpqvot4034e61.jpg', 'created': 1611856363.0}",2021-01-28 17:52:43
34,HunterSaboo,1611856362,"I hate how it canceled already pending buys, do I have a case with the sec? because I DID NOT cancel this, robinhood did.",https://i.redd.it/4ptasqwy24e61.jpg,1611856362.0,"{'author': 'HunterSaboo', 'created_utc': 1611856362, 'title': 'I hate how it canceled already pending buys, do I have a case with the sec? because I DID NOT cancel this, robinhood did.', 'url': 'https://i.redd.it/4ptasqwy24e61.jpg', 'created': 1611856362.0}",2021-01-28 17:52:42
35,saladsarentfood,1611856362,E*TRADE is allowing gme purchases,https://www.reddit.com/r/wallstreetbets/comments/l73si0/etrade_is_allowing_gme_purchases/,1611856362.0,"{'author': 'saladsarentfood', 'created_utc': 1611856362, 'title': 'E*TRADE is allowing gme purchases', 'url': 'https://www.reddit.com/r/wallstreetbets/comments/l73si0/etrade_is_allowing_gme_purchases/', 'created': 1611856362.0}",2021-01-28 17:52:42
36,jonjon2183,1611856361,Let’s go!,https://i.redd.it/hnjr9tyz24e61.jpg,1611856361.0,"{'author': 'jonjon2183', 'created_utc': 1611856361, 'title': 'Let’s go!', 'url': 'https://i.redd.it/hnjr9tyz24e61.jpg', 'created': 1611856361.0}",2021-01-28 17:52:41
37,jake4411,1611856361,FCEL to the 🌙 🚀 🚀 🚀,https://www.reddit.com/r/wallstreetbets/comments/l73shh/fcel_to_the/,1611856361.0,"{'author': 'jake4411', 'created_utc': 1611856361, 'title': 'FCEL to the 🌙 🚀 🚀 🚀', 'url': 'https://www.reddit.com/r/wallstreetbets/comments/l73shh/fcel_to_the/', 'created': 1611856361.0}",2021-01-28 17:52:41
38,SaxySh,1611856361,Took my tesla profits and put them in to AMC 👌 Cant but GameStop on Cash app so I'm doing the best I can,https://i.redd.it/v9garqvz24e61.png,1611856361.0,"{'author': 'SaxySh', 'created_utc': 1611856361, 'title': ""Took my tesla profits and put them in to AMC 👌 Cant but GameStop on Cash app so I'm doing the best I can"", 'url': 'https://i.redd.it/v9garqvz24e61.png', 'created': 1611856361.0}",2021-01-28 17:52:41
39,Yashimash,1611856361,BB go!,https://www.reddit.com/r/wallstreetbets/comments/l73she/bb_go/,1611856361.0,"{'author': 'Yashimash', 'created_utc': 1611856361, 'title': 'BB go!', 'url': 'https://www.reddit.com/r/wallstreetbets/comments/l73she/bb_go/', 'created': 1611856361.0}",2021-01-28 17:52:41
40,morphicdream,1611856360,Robinhood is doing us dirty and the double standards here are appalling. I made a meme to express our collective rage.,https://i.redd.it/2k4a533q24e61.jpg,1611856360.0,"{'author': 'morphicdream', 'created_utc': 1611856360, 'title': 'Robinhood is doing us dirty and the double standards here are appalling. I made a meme to express our collective rage.', 'url': 'https://i.redd.it/2k4a533q24e61.jpg', 'created': 1611856360.0}",2021-01-28 17:52:40
41,likeitorloveit_309,1611856360,The ticker is t even coming up!,https://i.redd.it/fx4ockrz24e61.jpg,1611856360.0,"{'author': 'likeitorloveit_309', 'created_utc': 1611856360, 'title': 'The ticker is t even coming up!', 'url': 'https://i.redd.it/fx4ockrz24e61.jpg', 'created': 1611856360.0}",2021-01-28 17:52:40
42,RoofTall,1611856359,Class action agains market manipulation,https://www.reddit.com/r/wallstreetbets/comments/l73sgl/class_action_agains_market_manipulation/,1611856359.0,"{'author': 'RoofTall', 'created_utc': 1611856359, 'title': 'Class action agains market manipulation', 'url': 'https://www.reddit.com/r/wallstreetbets/comments/l73sgl/class_action_agains_market_manipulation/', 'created': 1611856359.0}",2021-01-28 17:52:39
43,Longjumping_Degree28,1611856359,"So the illusion that we have a free market is gone, it’s time for revolution... and I’m a Biden supporter",https://www.reddit.com/r/wallstreetbets/comments/l73sgk/so_the_illusion_that_we_have_a_free_market_is/,1611856359.0,"{'author': 'Longjumping_Degree28', 'created_utc': 1611856359, 'title': 'So the illusion that we have a free market is gone, it’s time for revolution... and I’m a Biden supporter', 'url': 'https://www.reddit.com/r/wallstreetbets/comments/l73sgk/so_the_illusion_that_we_have_a_free_market_is/', 'created': 1611856359.0}",2021-01-28 17:52:39
44,abstractnorth,1611856358,"With mainstream traders blocking GME, where do we new apes go?",https://www.reddit.com/r/wallstreetbets/comments/l73sg1/with_mainstream_traders_blocking_gme_where_do_we/,1611856358.0,"{'author': 'abstractnorth', 'created_utc': 1611856358, 'title': 'With mainstream traders blocking GME, where do we new apes go?', 'url': 'https://www.reddit.com/r/wallstreetbets/comments/l73sg1/with_mainstream_traders_blocking_gme_where_do_we/', 'created': 1611856358.0}",2021-01-28 17:52:38
45,Ivytheplantt,1611856358,SEND BB TO THE MOON 🚀🚀🚀🚀,https://www.reddit.com/r/wallstreetbets/comments/l73sfv/send_bb_to_the_moon/,1611856358.0,"{'author': 'Ivytheplantt', 'created_utc': 1611856358, 'title': 'SEND BB TO THE MOON 🚀🚀🚀🚀', 'url': 'https://www.reddit.com/r/wallstreetbets/comments/l73sfv/send_bb_to_the_moon/', 'created': 1611856358.0}",2021-01-28 17:52:38
46,Daddybubbs69,1611856358,Ngl a certain meme coin is kinda rising,https://www.reddit.com/r/wallstreetbets/comments/l73sfr/ngl_a_certain_meme_coin_is_kinda_rising/,1611856358.0,"{'author': 'Daddybubbs69', 'created_utc': 1611856358, 'title': 'Ngl a certain meme coin is kinda rising', 'url': 'https://www.reddit.com/r/wallstreetbets/comments/l73sfr/ngl_a_certain_meme_coin_is_kinda_rising/', 'created': 1611856358.0}",2021-01-28 17:52:38
47,LiviateUser,1611856358,How long will RH block us to purchase?,https://www.reddit.com/r/wallstreetbets/comments/l73sfq/how_long_will_rh_block_us_to_purchase/,1611856358.0,"{'author': 'LiviateUser', 'created_utc': 1611856358, 'title': 'How long will RH block us to purchase?', 'url': 'https://www.reddit.com/r/wallstreetbets/comments/l73sfq/how_long_will_rh_block_us_to_purchase/', 'created': 1611856358.0}",2021-01-28 17:52:38
48,PillowHand187,1611856358,Took the risk ?,https://www.reddit.com/r/wallstreetbets/comments/l73sfp/took_the_risk/,1611856358.0,"{'author': 'PillowHand187', 'created_utc': 1611856358, 'title': 'Took the risk ?', 'url': 'https://www.reddit.com/r/wallstreetbets/comments/l73sfp/took_the_risk/', 'created': 1611856358.0}",2021-01-28 17:52:38
49,One_Entrepreneur2106,1611856357,Time for revenge..😠,https://www.reddit.com/r/wallstreetbets/comments/l73sf0/time_for_revenge/,1611856357.0,"{'author': 'One_Entrepreneur2106', 'created_utc': 1611856357, 'title': 'Time for revenge..😠', 'url': 'https://www.reddit.com/r/wallstreetbets/comments/l73sf0/time_for_revenge/', 'created': 1611856357.0}",2021-01-28 17:52:37
50,CreativePolymath,1611856357,AMC &amp; NOK Stock on Ca$h App,https://www.reddit.com/r/wallstreetbets/comments/l73sex/amc_nok_stock_on_cah_app/,1611856357.0,"{'author': 'CreativePolymath', 'created_utc': 1611856357, 'title': 'AMC &amp; NOK Stock on Ca$h App', 'url': 'https://www.reddit.com/r/wallstreetbets/comments/l73sex/amc_nok_stock_on_cah_app/', 'created': 1611856357.0}",2021-01-28 17:52:37
51,OneSmallStepMedia,1611856356,HOOOOLLD,https://i.redd.it/9ru9tuez24e61.jpg,1611856356.0,"{'author': 'OneSmallStepMedia', 'created_utc': 1611856356, 'title': 'HOOOOLLD', 'url': 'https://i.redd.it/9ru9tuez24e61.jpg', 'created': 1611856356.0}",2021-01-28 17:52:36
52,downwithrbinhood,1611856356,Switch to $DOGE,https://www.reddit.com/r/wallstreetbets/comments/l73sen/switch_to_doge/,1611856356.0,"{'author': 'downwithrbinhood', 'created_utc': 1611856356, 'title': 'Switch to $DOGE', 'url': 'https://www.reddit.com/r/wallstreetbets/comments/l73sen/switch_to_doge/', 'created': 1611856356.0}",2021-01-28 17:52:36
53,[deleted],1611856355,Market Manipulation,https://i.redd.it/zny66faz24e61.jpg,1611856355.0,"{'author': '[deleted]', 'created_utc': 1611856355, 'title': 'Market Manipulation', 'url': 'https://i.redd.it/zny66faz24e61.jpg', 'created': 1611856355.0}",2021-01-28 17:52:35
54,luketato,1611856355,"y’all need to allow me to reply in here, just cus i have shit karma doesn’t mean i’m not important",http://whycan,1611856355.0,"{'author': 'luketato', 'created_utc': 1611856355, 'title': 'y’all need to allow me to reply in here, just cus i have shit karma doesn’t mean i’m not important', 'url': 'http://whycan', 'created': 1611856355.0}",2021-01-28 17:52:35
55,FlippinTurt,1611856354,Looks like robinhood's in alotta trouble now,https://i.redd.it/sac0lf3z24e61.jpg,1611856354.0,"{'author': 'FlippinTurt', 'created_utc': 1611856354, 'title': ""Looks like robinhood's in alotta trouble now"", 'url': 'https://i.redd.it/sac0lf3z24e61.jpg', 'created': 1611856354.0}",2021-01-28 17:52:34
56,rholt13,1611856354,A friendly message to the wonderful people at Robinhood,https://i.redd.it/q5edbf9z24e61.jpg,1611856354.0,"{'author': 'rholt13', 'created_utc': 1611856354, 'title': 'A friendly message to the wonderful people at Robinhood', 'url': 'https://i.redd.it/q5edbf9z24e61.jpg', 'created': 1611856354.0}",2021-01-28 17:52:34
57,Mostly_ghosted,1611856354,Managed to grab amc and Nokia. But gmc isn't there anymore.,https://i.redd.it/awlcwt5z24e61.jpg,1611856354.0,"{'author': 'Mostly_ghosted', 'created_utc': 1611856354, 'title': ""Managed to grab amc and Nokia. But gmc isn't there anymore."", 'url': 'https://i.redd.it/awlcwt5z24e61.jpg', 'created': 1611856354.0}",2021-01-28 17:52:34
58,Dtbc123,1611856353,Buy Express,https://www.reddit.com/r/wallstreetbets/comments/l73sdk/buy_express/,1611856353.0,"{'author': 'Dtbc123', 'created_utc': 1611856353, 'title': 'Buy Express', 'url': 'https://www.reddit.com/r/wallstreetbets/comments/l73sdk/buy_express/', 'created': 1611856353.0}",2021-01-28 17:52:33
59,JGzz,1611856353,We will just do it again,https://www.reddit.com/r/wallstreetbets/comments/l73sdh/we_will_just_do_it_again/,1611856353.0,"{'author': 'JGzz', 'created_utc': 1611856353, 'title': 'We will just do it again', 'url': 'https://www.reddit.com/r/wallstreetbets/comments/l73sdh/we_will_just_do_it_again/', 'created': 1611856353.0}",2021-01-28 17:52:33
60,iamagro,1611856353,Can't understand why people are selling GME... Shouldn't there be squeeze tomorrow?,https://www.reddit.com/r/wallstreetbets/comments/l73sdb/cant_understand_why_people_are_selling_gme/,1611856353.0,"{'author': 'iamagro', 'created_utc': 1611856353, 'title': ""Can't understand why people are selling GME... Shouldn't there be squeeze tomorrow?"", 'url': 'https://www.reddit.com/r/wallstreetbets/comments/l73sdb/cant_understand_why_people_are_selling_gme/', 'created': 1611856353.0}",2021-01-28 17:52:33
61,coveed9teeing,1611856353,"AMC, NOK, GME - That's what I have to say",https://www.reddit.com/r/wallstreetbets/comments/l73sda/amc_nok_gme_thats_what_i_have_to_say/,1611856353.0,"{'author': 'coveed9teeing', 'created_utc': 1611856353, 'title': ""AMC, NOK, GME - That's what I have to say"", 'url': 'https://www.reddit.com/r/wallstreetbets/comments/l73sda/amc_nok_gme_thats_what_i_have_to_say/', 'created': 1611856353.0}",2021-01-28 17:52:33
62,ghostfacekilla2017,1611856353,"Screw robinhood, doing my part",https://i.redd.it/xltmuh0z24e61.jpg,1611856353.0,"{'author': 'ghostfacekilla2017', 'created_utc': 1611856353, 'title': 'Screw robinhood, doing my part', 'url': 'https://i.redd.it/xltmuh0z24e61.jpg', 'created': 1611856353.0}",2021-01-28 17:52:33
