,author,created_utc,title,url,created,d_,created_utc_dt
63,Yoshbyte,1598912606,Post from yesterday and a fee screenshots I took. F in the chat lads.,https://www.reddit.com/gallery/ik8153,1598912606.0,"{'author': 'Yoshbyte', 'created_utc': 1598912606, 'title': 'Post from yesterday and a fee screenshots I took. F in the chat lads.', 'url': 'https://www.reddit.com/gallery/ik8153', 'created': 1598912606.0}",2020-08-31 22:23:26
64,tonywonder_,1598912517,$25k gain TSLA long,https://www.reddit.com/r/wallstreetbets/comments/ik804y/25k_gain_tsla_long/,1598912517.0,"{'author': 'tonywonder_', 'created_utc': 1598912517, 'title': '$25k gain TSLA long', 'url': 'https://www.reddit.com/r/wallstreetbets/comments/ik804y/25k_gain_tsla_long/', 'created': 1598912517.0}",2020-08-31 22:21:57
65,dealbuddy20,1598912426,Can't win in life.....except with stonks,https://www.reddit.com/r/wallstreetbets/comments/ik7z6t/cant_win_in_lifeexcept_with_stonks/,1598912426.0,"{'author': 'dealbuddy20', 'created_utc': 1598912426, 'title': ""Can't win in life.....except with stonks"", 'url': 'https://www.reddit.com/r/wallstreetbets/comments/ik7z6t/cant_win_in_lifeexcept_with_stonks/', 'created': 1598912426.0}",2020-08-31 22:20:26
66,ItsJustAltstatt,1598912412,“Captivating Title for DGX”,https://www.reddit.com/r/wallstreetbets/comments/ik7z0r/captivating_title_for_dgx/,1598912412.0,"{'author': 'ItsJustAltstatt', 'created_utc': 1598912412, 'title': '“Captivating Title for DGX”', 'url': 'https://www.reddit.com/r/wallstreetbets/comments/ik7z0r/captivating_title_for_dgx/', 'created': 1598912412.0}",2020-08-31 22:20:12
67,Championone,1598912384,my friend yolo’d apple shares and lost alot lol,https://i.redd.it/cedxcuqwxek51.jpg,1598912384.0,"{'author': 'Championone', 'created_utc': 1598912384, 'title': 'my friend yolo’d apple shares and lost alot lol', 'url': 'https://i.redd.it/cedxcuqwxek51.jpg', 'created': 1598912384.0}",2020-08-31 22:19:44
68,pofish,1598912381,Are y’all tired of TSLA gain porn yet? Just bought a Subaru w/ mine (sorry Papa),https://imgur.com/gallery/QJFvB4a,1598912381.0,"{'author': 'pofish', 'created_utc': 1598912381, 'title': 'Are y’all tired of TSLA gain porn yet? Just bought a Subaru w/ mine (sorry Papa)', 'url': 'https://imgur.com/gallery/QJFvB4a', 'created': 1598912381.0}",2020-08-31 22:19:41
69,MyPetEskimo,1598912322,getting ready to start trading tomorrow,https://i.redd.it/5jdoge4mxek51.png,1598912322.0,"{'author': 'MyPetEskimo', 'created_utc': 1598912322, 'title': 'getting ready to start trading tomorrow', 'url': 'https://i.redd.it/5jdoge4mxek51.png', 'created': 1598912322.0}",2020-08-31 22:18:42
70,expsenive_trashbag,1598912268,NVDA 9/4 Call,https://www.reddit.com/r/wallstreetbets/comments/ik7xjl/nvda_94_call/,1598912268.0,"{'author': 'expsenive_trashbag', 'created_utc': 1598912268, 'title': 'NVDA 9/4 Call', 'url': 'https://www.reddit.com/r/wallstreetbets/comments/ik7xjl/nvda_94_call/', 'created': 1598912268.0}",2020-08-31 22:17:48
71,blaknwiteboi,1598912228,I know ill get banned for this,https://www.reddit.com/r/wallstreetbets/comments/ik7x5f/i_know_ill_get_banned_for_this/,1598912228.0,"{'author': 'blaknwiteboi', 'created_utc': 1598912228, 'title': 'I know ill get banned for this', 'url': 'https://www.reddit.com/r/wallstreetbets/comments/ik7x5f/i_know_ill_get_banned_for_this/', 'created': 1598912228.0}",2020-08-31 22:17:08
72,gangindisbitch,1598912196,"It worked, let's do it again! (Credit to @WallStSupp on Twitter)",https://i.redd.it/6pic9qcbxek51.png,1598912196.0,"{'author': 'gangindisbitch', 'created_utc': 1598912196, 'title': ""It worked, let's do it again! (Credit to @WallStSupp on Twitter)"", 'url': 'https://i.redd.it/6pic9qcbxek51.png', 'created': 1598912196.0}",2020-08-31 22:16:36
73,blindasabat,1598912103,TSLA 9/11 $540c from $9 to $17 win. bonus all time loss porn,https://www.reddit.com/gallery/ik7vt2,1598912103.0,"{'author': 'blindasabat', 'created_utc': 1598912103, 'title': 'TSLA 9/11 $540c from $9 to $17 win. bonus all time loss porn', 'url': 'https://www.reddit.com/gallery/ik7vt2', 'created': 1598912103.0}",2020-08-31 22:15:03
74,lwilson747,1598912042,Certified Banking and Credit Analyst (CBCA)™ Certification &amp; Training - 10% Discount [Corporate Finance Institute],https://www.reddit.com/r/wallstreetbets/comments/ik7v7o/certified_banking_and_credit_analyst_cbca/,1598912042.0,"{'author': 'lwilson747', 'created_utc': 1598912042, 'title': 'Certified Banking and Credit Analyst (CBCA)™ Certification &amp; Training - 10% Discount [Corporate Finance Institute]', 'url': 'https://www.reddit.com/r/wallstreetbets/comments/ik7v7o/certified_banking_and_credit_analyst_cbca/', 'created': 1598912042.0}",2020-08-31 22:14:02
75,communistgod,1598912005,"Decided to hold my WMT and MSFT calls, wondering if it was a mistake",https://www.reddit.com/r/wallstreetbets/comments/ik7utu/decided_to_hold_my_wmt_and_msft_calls_wondering/,1598912005.0,"{'author': 'communistgod', 'created_utc': 1598912005, 'title': 'Decided to hold my WMT and MSFT calls, wondering if it was a mistake', 'url': 'https://www.reddit.com/r/wallstreetbets/comments/ik7utu/decided_to_hold_my_wmt_and_msft_calls_wondering/', 'created': 1598912005.0}",2020-08-31 22:13:25
76,Always_Excited,1598911910,When you buy ten bagger then let it go for 60%.,https://imgur.com/a/Kmax7Nf,1598911910.0,"{'author': 'Always_Excited', 'created_utc': 1598911910, 'title': 'When you buy ten bagger then let it go for 60%.', 'url': 'https://imgur.com/a/Kmax7Nf', 'created': 1598911910.0}",2020-08-31 22:11:50
77,blindasabat,1598911838,"Buy at $9 sell at $17, best day in a while. TSLA 9/11 $540c for the win. All time loss porn to balance everything out",https://www.reddit.com/gallery/ik7t1l,1598911838.0,"{'author': 'blindasabat', 'created_utc': 1598911838, 'title': 'Buy at $9 sell at $17, best day in a while. TSLA 9/11 $540c for the win. All time loss porn to balance everything out', 'url': 'https://www.reddit.com/gallery/ik7t1l', 'created': 1598911838.0}",2020-08-31 22:10:38
78,AlmightyBroly,1598911599,"At what point did you start, with what budget and what is the result right now?",https://www.reddit.com/r/wallstreetbets/comments/ik7qca/at_what_point_did_you_start_with_what_budget_and/,1598911599.0,"{'author': 'AlmightyBroly', 'created_utc': 1598911599, 'title': 'At what point did you start, with what budget and what is the result right now?', 'url': 'https://www.reddit.com/r/wallstreetbets/comments/ik7qca/at_what_point_did_you_start_with_what_budget_and/', 'created': 1598911599.0}",2020-08-31 22:06:39
79,heelhookd,1598911596,What TSLA calls should we buy tomorrow?,https://www.reddit.com/r/wallstreetbets/comments/ik7qax/what_tsla_calls_should_we_buy_tomorrow/,1598911596.0,"{'author': 'heelhookd', 'created_utc': 1598911596, 'title': 'What TSLA calls should we buy tomorrow?', 'url': 'https://www.reddit.com/r/wallstreetbets/comments/ik7qax/what_tsla_calls_should_we_buy_tomorrow/', 'created': 1598911596.0}",2020-08-31 22:06:36
80,BcStryker,1598911434,Oops... I am sad now.,https://i.redd.it/bo6ge333vek51.jpg,1598911434.0,"{'author': 'BcStryker', 'created_utc': 1598911434, 'title': 'Oops... I am sad now.', 'url': 'https://i.redd.it/bo6ge333vek51.jpg', 'created': 1598911434.0}",2020-08-31 22:03:54
81,ZJEEP,1598911431,Am I retarded for NOT putting my life savings down right now on $TSLA?,https://www.reddit.com/r/wallstreetbets/comments/ik7ojp/am_i_retarded_for_not_putting_my_life_savings/,1598911431.0,"{'author': 'ZJEEP', 'created_utc': 1598911431, 'title': 'Am I retarded for NOT putting my life savings down right now on $TSLA?', 'url': 'https://www.reddit.com/r/wallstreetbets/comments/ik7ojp/am_i_retarded_for_not_putting_my_life_savings/', 'created': 1598911431.0}",2020-08-31 22:03:51
82,bannedSnoo,1598911425,Papa Musk net worth is more than FORD+GM+CHRYSLER market cap.,https://www.reddit.com/r/wallstreetbets/comments/ik7ogt/papa_musk_net_worth_is_more_than_fordgmchrysler/,1598911425.0,"{'author': 'bannedSnoo', 'created_utc': 1598911425, 'title': 'Papa Musk net worth is more than FORD+GM+CHRYSLER market cap.', 'url': 'https://www.reddit.com/r/wallstreetbets/comments/ik7ogt/papa_musk_net_worth_is_more_than_fordgmchrysler/', 'created': 1598911425.0}",2020-08-31 22:03:45
83,marloflo,1598911418,Robinhood is definitely for autists cus this return on a call debit spread makes ZERO sense,https://i.redd.it/nr2vlgc1vek51.jpg,1598911418.0,"{'author': 'marloflo', 'created_utc': 1598911418, 'title': 'Robinhood is definitely for autists cus this return on a call debit spread makes ZERO sense', 'url': 'https://i.redd.it/nr2vlgc1vek51.jpg', 'created': 1598911418.0}",2020-08-31 22:03:38
84,MickNercs,1598911360,Perfect time to revisit this meme,https://i.redd.it/iywx3t4vuek51.jpg,1598911360.0,"{'author': 'MickNercs', 'created_utc': 1598911360, 'title': 'Perfect time to revisit this meme', 'url': 'https://i.redd.it/iywx3t4vuek51.jpg', 'created': 1598911360.0}",2020-08-31 22:02:40
85,marloflo,1598911343,Robinhood is definitely for autists cus this return on a call debit spread makes ZERO sense,https://i.redd.it/c159g5dtuek51.jpg,1598911343.0,"{'author': 'marloflo', 'created_utc': 1598911343, 'title': 'Robinhood is definitely for autists cus this return on a call debit spread makes ZERO sense', 'url': 'https://i.redd.it/c159g5dtuek51.jpg', 'created': 1598911343.0}",2020-08-31 22:02:23
86,marloflo,1598911241,Robinhood is definitely for autists cus this makes return on a call debit spread makes ZERO sense,https://i.redd.it/k9oopefiuek51.jpg,1598911241.0,"{'author': 'marloflo', 'created_utc': 1598911241, 'title': 'Robinhood is definitely for autists cus this makes return on a call debit spread makes ZERO sense', 'url': 'https://i.redd.it/k9oopefiuek51.jpg', 'created': 1598911241.0}",2020-08-31 22:00:41
87,Trodnik,1598911111,Baby gain porn,https://i.imgur.com/b8vVN8z.jpg,1598911111.0,"{'author': 'Trodnik', 'created_utc': 1598911111, 'title': 'Baby gain porn', 'url': 'https://i.imgur.com/b8vVN8z.jpg', 'created': 1598911111.0}",2020-08-31 21:58:31
88,DavePi81,1598910993,I thought the tesla split was going to be on Tuesday.,https://www.reddit.com/r/wallstreetbets/comments/ik7jsc/i_thought_the_tesla_split_was_going_to_be_on/,1598910993.0,"{'author': 'DavePi81', 'created_utc': 1598910993, 'title': 'I thought the tesla split was going to be on Tuesday.', 'url': 'https://www.reddit.com/r/wallstreetbets/comments/ik7jsc/i_thought_the_tesla_split_was_going_to_be_on/', 'created': 1598910993.0}",2020-08-31 21:56:33
89,CanWeDanceHere,1598910901,Am 13 years old and caught on to the TSLA train early on the march dip.,https://www.reddit.com/r/wallstreetbets/comments/ik7it0/am_13_years_old_and_caught_on_to_the_tsla_train/,1598910901.0,"{'author': 'CanWeDanceHere', 'created_utc': 1598910901, 'title': 'Am 13 years old and caught on to the TSLA train early on the march dip.', 'url': 'https://www.reddit.com/r/wallstreetbets/comments/ik7it0/am_13_years_old_and_caught_on_to_the_tsla_train/', 'created': 1598910901.0}",2020-08-31 21:55:01
90,Guilty-Marzipan,1598910836,Any of you cocksuckers holding MSFT and WMT calls?,https://www.reddit.com/r/wallstreetbets/comments/ik7i3o/any_of_you_cocksuckers_holding_msft_and_wmt_calls/,1598910836.0,"{'author': 'Guilty-Marzipan', 'created_utc': 1598910836, 'title': 'Any of you cocksuckers holding MSFT and WMT calls?', 'url': 'https://www.reddit.com/r/wallstreetbets/comments/ik7i3o/any_of_you_cocksuckers_holding_msft_and_wmt_calls/', 'created': 1598910836.0}",2020-08-31 21:53:56
91,illcrx,1598910762,Tesla technical analysis of 750 target,https://youtu.be/qgiamOmVwX4,1598910762.0,"{'author': 'illcrx', 'created_utc': 1598910762, 'title': 'Tesla technical analysis of 750 target', 'url': 'https://youtu.be/qgiamOmVwX4', 'created': 1598910762.0}",2020-08-31 21:52:42
92,legosandman,1598910742,Zoom zoom zoom 🚀🚀🚀🚀,https://i.redd.it/35yqij11tek51.jpg,1598910742.0,"{'author': 'legosandman', 'created_utc': 1598910742, 'title': 'Zoom zoom zoom 🚀🚀🚀🚀', 'url': 'https://i.redd.it/35yqij11tek51.jpg', 'created': 1598910742.0}",2020-08-31 21:52:22
93,GH051,1598910726,Why 🌈🐻 will win on tesla,https://www.reddit.com/r/wallstreetbets/comments/ik7gs3/why_will_win_on_tesla/,1598910726.0,"{'author': 'GH051', 'created_utc': 1598910726, 'title': 'Why 🌈🐻 will win on tesla', 'url': 'https://www.reddit.com/r/wallstreetbets/comments/ik7gs3/why_will_win_on_tesla/', 'created': 1598910726.0}",2020-08-31 21:52:06
94,illcrx,1598910686,Tesla will continue,https://www.reddit.com/r/wallstreetbets/comments/ik7gbs/tesla_will_continue/,1598910686.0,"{'author': 'illcrx', 'created_utc': 1598910686, 'title': 'Tesla will continue', 'url': 'https://www.reddit.com/r/wallstreetbets/comments/ik7gbs/tesla_will_continue/', 'created': 1598910686.0}",2020-08-31 21:51:26
95,Guilty-Marzipan,1598910564,Any of you fucking idiots holding MSFT and WMT calls?,https://www.reddit.com/r/wallstreetbets/comments/ik7f1p/any_of_you_fucking_idiots_holding_msft_and_wmt/,1598910564.0,"{'author': 'Guilty-Marzipan', 'created_utc': 1598910564, 'title': 'Any of you fucking idiots holding MSFT and WMT calls?', 'url': 'https://www.reddit.com/r/wallstreetbets/comments/ik7f1p/any_of_you_fucking_idiots_holding_msft_and_wmt/', 'created': 1598910564.0}",2020-08-31 21:49:24
96,HiImJustMike,1598910552,"I've decided for my upcoming 30th birthday I'm going to try to do myself a favor and stop squandering money and start investing. Put my first $300 in today, wish me luck.",https://i.redd.it/qpbiblogsek51.png,1598910552.0,"{'author': 'HiImJustMike', 'created_utc': 1598910552, 'title': ""I've decided for my upcoming 30th birthday I'm going to try to do myself a favor and stop squandering money and start investing. Put my first $300 in today, wish me luck."", 'url': 'https://i.redd.it/qpbiblogsek51.png', 'created': 1598910552.0}",2020-08-31 21:49:12
97,PM-ME-UR-NUDES_GIRL,1598910544,Almost forgot why I dont go to r/stocks anymore,https://www.reddit.com/r/wallstreetbets/comments/ik7eu2/almost_forgot_why_i_dont_go_to_rstocks_anymore/,1598910544.0,"{'author': 'PM-ME-UR-NUDES_GIRL', 'created_utc': 1598910544, 'title': 'Almost forgot why I dont go to r/stocks anymore', 'url': 'https://www.reddit.com/r/wallstreetbets/comments/ik7eu2/almost_forgot_why_i_dont_go_to_rstocks_anymore/', 'created': 1598910544.0}",2020-08-31 21:49:04
98,Pubgsus420,1598910327,LoL aT ApPle CaLL hOLdeRs,https://i.redd.it/x989njmsrek51.jpg,1598910327.0,"{'author': 'Pubgsus420', 'created_utc': 1598910327, 'title': 'LoL aT ApPle CaLL hOLdeRs', 'url': 'https://i.redd.it/x989njmsrek51.jpg', 'created': 1598910327.0}",2020-08-31 21:45:27
99,noentic,1598910275,Market and Options Summary for August 31st -,https://www.reddit.com/r/wallstreetbets/comments/ik7bz6/market_and_options_summary_for_august_31st/,1598910275.0,"{'author': 'noentic', 'created_utc': 1598910275, 'title': 'Market and Options Summary for August 31st -', 'url': 'https://www.reddit.com/r/wallstreetbets/comments/ik7bz6/market_and_options_summary_for_august_31st/', 'created': 1598910275.0}",2020-08-31 21:44:35
